,Title,Location,City,State,Zip,Country,Qualifications,Skills,Responsibilities,Education,Requirement,FullDescriptions
0,Data Analyst,"Palo Alto, CA",Palo Alto,CA,None Found,None Found,None Found,None Found,None Found,None Found,None Found,"GSN Games, the leading developer in mobile and social games, is seeking a Data Analyst with a passion for problem-solving and real world application to join our casual games studio based in Palo Alto and San Francisco.

About the GSN Casual Games Studio:
Our studio consists of a talented group of game artists, designers, engineers, product people and marketers who craft industry-leading mobile games providing very high quality experiences. This studio is the home of Solitaire Tripeaks by GSN, the #1 revenue solitaire game on mobile that has quickly grown into one of the top grossing games on both iOS and Android.

What You’ll Do:
As a Data Analyst in our Analytics group, your goal will be to help the team understand the most important behaviors of our players. You’ll use problem-solving skills, sound logic, and data tools like SQL, in order to identify and evaluate trends, determine real value of team initiatives, and clearly communicate results and outcomes. You’ll work with the entire team and provide analytics grounding to business decisions we make every day. You’ll learn our tables, do ad hoc analysis as requested, help our team figure out what they really should be asking, create dashboards where needed, and generally use our data to be the real backbone of our data-driven culture. Most importantly, you’ll use situational awareness to make sure you understand our game, our funnels, our current KPIs and our player behaviors to make sure that your analyses make sense and help the team learn.

You Will:

Work with marketing, product, engineering, game design, DBAs and other teams to deliver actionable insights into our games in order to improve our user acquisition, engagement and monetization, including creating and updating ad hoc queries and Tableau/Excel/Google Sheet dashboards
Design and implement new analytics events and queries for new game features, game events and player offers, to make sure the team gets the information they need to evaluate and improve the game
Design, implement, organize and analyze advanced statistical testing for specific problem-solving needs (e.g. A/B testing).
Identify problems, anomalies, trends, issues, and opportunities, by looking at the data and coming to your own conclusions
Answer business-related questions through exploratory data analyses and ad-hoc reporting.
Participate in data retention management processes, including defining and updating retention policies and creating/updating tables to optimize data analysis workflow and cost

About You:

BS in Analytics, Business Intelligence, Finance, Statistics or Computer Science, or other analytical discipline
2+ years of experience as a data or financial analyst applying statistical analysis to B2C consumer behaviors (mobile apps, advertising, market activities)
Outstanding problem-solving skills, including the ability to:
analyze situations and determine the best metrics for a situation
conceptualize player behaviors based on data
identify meaningful proxies of player behaviors where data doesn’t exist
Strong work ethic, intellectual curiosity, and drive to complete projects
Experience using SQL, including complex queries from multiple data sources
Experience creating, operating and analyzing multiple simultaneous A/B tests
Strong communication and presentation skills, including extensive use of chart and table tools
Ability to understand and act on changing priorities, and execute multiple competing projects based on business case and expected impact
Familiarity with data and BI presentation tools (Tableau, Excel, pivot tables)

Bonus Points!

2+ years experience (video gaming, e-commerce, consumer entertainment, etc.)
Experience with Python, JavaScript, Java or other programming language
A passion for playing world class mobile, social and casual games a huge plus
Experience in making world-class social/casual/casino games a huge plus

If you’re serious about joining our Puzzle Studio and you enjoy solving problems, we’ll look first at people who can answer these 4 questions:
https://www.surveymonkey.com/r/8WVDYGR"
1,eBook Data Analyst (6 months contract),"Santa Clara, CA 95054",Santa Clara,CA,95054,None Found,None Found,None Found,"
Work in a team environment
Maintain monthly eBook sales reports
Distribute monthly eBook sales reports externally and internally
Investigate eBook sales trends in relation to pricing and print relationship
Track and maintain inventory of eBook publisher contracts
Support ingestion of content metadata
Perform ad hoc analyses and projects as required",None Found,"
Must be excellent at Microsoft Excel or similar
Strong knowledge of SQL scripting or equivalent
Attention to detail a must
Excellent analytical and problem solving skills
Ability to prioritize and deliver within a fast-paced, dynamic environment with minimal supervision
High School or equivalent degree required
Available to work in this contract role for 6 months, 40 hours/week","eBook Sales/Content Analyst (Contractor)
6 months contract
Required Materials Team | Santa Clara, CA

The Problem:


This role will help maintain dozens of accurate monthly eBook sales reports assuring partners are receiving proper compensation while assuring proper Chegg margins. The ideal candidate will also add analysis around pricing and sales trends for both Chegg and publisher partners.

The Organization:


Chegg is the student-first connected learning platform, empowering students to take control of their education to save time, save money, get smarter and achieve better outcomes. As Chegg’s largest business unit, the Required Materials business annually rents 6 million print and digital textbooks to over 2 million students, saving students $550 million each year. The eBook group is a core function in the Required Materials business using analytical insights to help Chegg reduce costs, expand revenue and improve customer service.

The Role:

As an eBook Sales/Content Analyst, (contractor) you will assist in the operation of several support programs within the eBooks group including but not limited to sales reporting, content metadata ingestion, and contract analysis. This is a contract position lasting 3+ months.

Responsibilities:
Work in a team environment
Maintain monthly eBook sales reports
Distribute monthly eBook sales reports externally and internally
Investigate eBook sales trends in relation to pricing and print relationship
Track and maintain inventory of eBook publisher contracts
Support ingestion of content metadata
Perform ad hoc analyses and projects as required
Requirements:
Must be excellent at Microsoft Excel or similar
Strong knowledge of SQL scripting or equivalent
Attention to detail a must
Excellent analytical and problem solving skills
Ability to prioritize and deliver within a fast-paced, dynamic environment with minimal supervision
High School or equivalent degree required
Available to work in this contract role for 6 months, 40 hours/week
What is Chegg?
An ‘always on’ digital learning platform.
Chegg puts students first…Everything we build in this company is student-focused, making us the leading student-first connected learning platform. Chegg strives to improve the overall return on investment in education by helping students learn more in less time and at a lower cost. This is achieved by providing students a multitude of educational tools from affordable textbook rentals to Chegg Study which supplements their learning through 24/7 tutor access, step-by-step help with questions, and more. Chegg is a publicly-held company based in Santa Clara, California and trades on the NYSE under the symbol CHGG.
Why do we exist?
Students are working harder than ever before to stabilize their future. Our recent research study called State of the Student shows that nearly 3 out of 4 students are working to support themselves through college and 1 in 3 students feel pressure to spend more than they can afford. We founded our business on provided affordable textbook rental options to address these issues. Since then, we’ve expanded our offerings to supplement many facets of higher educational learning through Chegg Study, Chegg Math, and Chegg Internships and more to support students beyond their college experience. These offerings lower financial concerns for students by modernizing their learning experience. We exist so students everywhere have a smarter, faster, more affordable way to student.
Video Shorts - Life at Chegg: https://jobs.chegg.com/Video-Shorts-Chegg-Services
Certified Great Place to Work!: http://reviews.greatplacetowork.com/chegg
Chegg Corporate Career Page: https://jobs.chegg.com/
Chegg India: http://www.cheggindia.com/
Chegg Israel: http://insider.geektime.co.il/organizations/chegg
Chegg is an equal opportunity employer"
2,Senior Data Analyst,"Palo Alto, CA 94301",Palo Alto,CA,94301,None Found,None Found,None Found,None Found,None Found,None Found,"Based in Palo Alto, California, Cardinal Analytx Solutions is a predictive analytics company that leverages machine learning and clinical expertise to identify future cost and rising risk. We were founded with the vision of helping patients obtain better care, sooner. Most of healthcare today is very reactive – with care being delivered when someone is already ill. We believe that healthcare should be about keeping individuals and their families well – to prevent them from ever becoming sick. Through machine learning and the extensive experience of our founders, team, and advisers in healthcare, we are committed to helping healthcare organizations see around the corner so that they can take a proactive approach to helping patients.
On the Product team, our mission is to discover, improve and deliver products that meet customer pain points and revolutionize the healthcare industry. You will work closely with product managers, data scientists, engineers and customer teams to understand how our data can be used to tell a compelling story to customers and find opportunities to productize analytics. In addition to strong analytical skills, this person has solid business acumen, communication skills and ability to drive at customer pain points.
As a Data Analyst on the Product Team, You Will:
Develop deep understanding our products, machine learning methodology and outputs, and our customers analytic pain points and needs.
Translate your insights into stories, visuals and analytics that help drive product understanding and adoption.
Collaborate and influence across cross functional stakeholders including sales, marketing, engineering, data science and clinical
Be an integral part of the product team, contributing to and innovating on analytics and business intelligence
Assess business value and feasibility of productizing analytics
Document and translate analytical methodology into engineering requirements for scale / productization
Present complex analytical concepts to internal and external stakeholders and executives.
You Will Love this Job If:
You are curious. You thrive in the unknown, the chaotic and the ambiguous. You are tenacious and courageous, moving people and projects forward.
You can see the bigger picture while also getting into the details.
You are passionate about making an impact in healthcare and want to work in a fast-paced environment.
You excel not only at running analyses, but finding creative ways to visualize and tell a story with data that solves customer pain points
You enjoy working with internal and external customers, discovering how to solve pain points and business needs with data and analytics
You enjoy working with people and presenting your work
You enjoy the details and appreciate the foundation of rigorous code, methodology, documentation, and QA
You Should Get in Touch if You:
Have at least 4+ years of industry experience
Have extensive experience in advanced SQL
Nice to have: Experience with at least one scripting language (e.g., R, Python)
Have experience with multi-million record data sets and across many databases
Have experience working with healthcare data
Have experience working with both business leaders and technical experts
Have a Bachelors Degree-required.

**This is an onsite position located in the SF Bay Area of California!**
*No recruiter submissions without prior agreement/ consent*
TQe95kSjDo"
3,Principal Data Analyst,"Sunnyvale, CA 94087",Sunnyvale,CA,94087,None Found,"Master’s degree in Business Administration, Computer Science, Engineering, or related field with supervisory experienceExcellent written and verbal communication skills for varied audiences on analytical subject matterExtensive experience in analytical modeling, root cause analysis and generating data insightsAdvanced knowledge of SQL, Python/R and Statistics",None Found,None Found,None Found,None Found,"Position Description
By bringing together online, mobile, and physical with our 11,000+ stores and clubs around the world, Walmart Supply Chain Technology team is creating products that enable a seamless experience for customers and members to shop in the way that’s most convenient for them—anytime and anywhere. When you combine our unmatched assets in retail with our commitment to building best-in-class supply chain capabilities, we’re positioned to serve customers in ways no one else can. At Walmart Labs, our Walmart.com, SamsClub.com and technology teams, collaborate to drive billions of better customer experiences for the world’s largest global retailer. What’s the next big thing? See for yourself at Walmart Labs. As idea explorers for @WalmarLabs, our engineers, scientists, consumer internet professionals and visionaries design, prototype and build extraordinary products. With over 3,000 associates in Silicon Valley, Sao Paulo, San Diego, Portland and Bangalore, we’re bringing together some of the best professionals around the world. If you’re inspired by the opportunity to solve hard problems at scale and make a difference for our customers and members, join us.
Position Description
Ideal candidate will lead the formulation of analytics vision and strategy for eCommerce supply chain products; helping Product Managers understand customer behavior and measure the efficiency of supply chain products/tools. This role will be the analytics leader responsible for post purchase customer experience starting from when the customer decides to purchase to the time their packages are delivered to them. The candidate will be responsible to cultivate an environment that is rooted in data based decision making while adhering to company standards of integrity and ethics.
Minimum Qualifications
Master’s degree in Business Administration, Computer Science, Engineering, or related field with supervisory experienceExcellent written and verbal communication skills for varied audiences on analytical subject matterExtensive experience in analytical modeling, root cause analysis and generating data insightsAdvanced knowledge of SQL, Python/R and Statistics
Additional Preferred Qualifications
Advanced Knowledge of SQL, HIVE, TableauExperience with SAS, R, and/or Python for data manipulationA/B testing experience is a plusSupply chain experience is a plusSupervisory experience is a plusYou have excellent analysis and critical reasoning skills with a strong focus on executionYou are a proactive problem solver who operates effectively and independently, even in areas of uncertainty and ambiguityYou are a team player, with the courage to drive change through disruption while maintaining a respect for the teamYou possess strong collaboration skills and approach problems with positive intent while driving towards resolutionYou have the ability to simplify strategy into simple actionsYou empower and inspire your colleagues and team mates to take action and embrace the mindset that, ""Everything can be made better”You are curious, and are not afraid to dig deep and look in places that others ignore
Company Summary
The Walmart eCommerce team is rapidly innovating to evolve and define the future state of shopping. As the world’s largest retailer, we are on a mission to help people save money and live better. With the help of some of the brightest minds in technology, merchandising, marketing, supply chain, talent and more, we are reimagining the intersection of digital and physical shopping to help achieve that mission.
Position Summary
By bringing together online, mobile, and physical with our 11,000+ stores and clubs around the world, Walmart Supply Chain Technology team is creating products that enable a seamless experience for customers and members to shop in the way that’s most convenient for them—anytime and anywhere. When you combine our unmatched assets in retail with our commitment to building best-in-class supply chain capabilities, we’re positioned to serve customers in ways no one else can. At Walmart Labs, our Walmart.com, SamsClub.com and technology teams, collaborate to drive billions of better customer experiences for the world’s largest global retailer. What’s the next big thing? See for yourself at Walmart Labs. As idea explorers for @WalmarLabs, our engineers, scientists, consumer internet professionals and visionaries design, prototype and build extraordinary products. With over 3,000 associates in Silicon Valley, Sao Paulo, San Diego, Portland and Bangalore, we’re bringing together some of the best professionals around the world. If you’re inspired by the opportunity to solve hard problems at scale and make a difference for our customers and members, join us.
Position Description
Ideal candidate will lead the formulation of analytics vision and strategy for eCommerce supply chain products; helping Product Managers understand customer behavior and measure the efficiency of supply chain products/tools. This role will be the analytics leader responsible for post purchase customer experience starting from when the customer decides to purchase to the time their packages are delivered to them. The candidate will be responsible to cultivate an environment that is rooted in data based decision making while adhering to company standards of integrity and ethics."
4,"Marketing Data Scientist, Apple Media Products Data Science","Santa Clara Valley, CA 95014",Santa Clara Valley,CA,95014,None Found,None Found,None Found,None Found,None Found,None Found,"Summary
Posted: May 14, 2019
Role Number: 200060545
At Apple, new ideas have a way of becoming phenomenal products, services, and customer experiences very quickly. If you are an ambitious, high-energy individual who is not afraid of challenges, we’re looking for you.
Apple is seeking an expert Data Scientist to join a team passionate about Data Science & Analytics for Apple Media Products (AMP), covering the App Store, Apple Music, Apple TV and other services.
This role will involve working with Internet-scale data across numerous product and customer touch points, undertaking in-depth quantitative analysis and building models to drive strategy.
The team’s culture centers around rapid iteration with open feedback and debate along the way, plus strong collaboration with product, content, business, and marketing partners.
We encourage independent decision-making and taking calculated risks. AMP Analytics collaborates with partners across product, design, engineering, and business teams: our mission is to drive innovation at Apple through deep quantitive research of the App Store, Music, Apple Books and Apple Podcasts amongst other services.
Key Qualifications
3+ years of experience in a Data Scientist or Data Analyst role, preferably for a digital video or digital subscription business.
You have a strong proficiency with SQL-based languages. Experience with large scale analytics technologies such as Hadoop and Spark preferred.
Familiarity with Python or R and data visualization tools such as Tableau for full-stack data analysis, insight synthesis and presentation.
You have experience using relevant statistical packages to build predictive/ML models and knowledge of A/B test experimentation design.
Curious business mindset with an ability to condense complex concepts and analysis into clear and concise takeaways that drive action.
Excellent communication, social and presentation skills with meticulous attention to detail.
Strong time management skills with the ability to handle work to tight deadlines and the pressure of executive requests.
Description
Dive deep into large-scale data to uncover trends and identify key insights that will propel the Apple TV business and marketing strategy.
Craft how best to monitor, measure and understand business performance.
Collaborate with business, marketing, finance and executive teams to generate regular presentations for C-level.
Partner with other Apple organizations on data gathering, data governance, evangelizing key performance indicators and democratizing data.
Your creative solving skills will be utilized daily.
Education & Experience
Minimum of a Bachelors degree in Computer Science, Statistics, Mathematics, Engineering, Economics or related field. Ideally, Masters or PhD in related field."
