,Title,Location,City,State,Zip,Country,Qualifications,Skills,Responsibilities,Education,Requirement,FullDescriptions
138,Data Analyst,"Redwood City, CA",Redwood City,CA,None Found,None Found," Bachelor’s degree in Mathematics,Computer Science, Economics, or Statistics 5+ years proven working experiencemining data as a data analyst or business data analyst Technical expertise regarding datamodels, database design development, data mining, and segmentation techniques Strong analytical skills with theability to collect, organize, analyze, and disseminate significant amounts ofinformation with attention to detail and accuracy Strong knowledge of and experiencewith reporting packages (Tableau, etc), databases (SQL, etc) and ETL frameworks"," Bachelor’s degree in Mathematics,Computer Science, Economics, or Statistics 5+ years proven working experiencemining data as a data analyst or business data analyst Technical expertise regarding datamodels, database design development, data mining, and segmentation techniques Strong analytical skills with theability to collect, organize, analyze, and disseminate significant amounts ofinformation with attention to detail and accuracy Strong knowledge of and experiencewith reporting packages (Tableau, etc), databases (SQL, etc) and ETL frameworks"," Conducting full life cycle activitiesto include requirements, planning, design, and implementation. Work closely with stakeholders tounderstand their analytical needs, including identifying critical metrics andKPIs, and deliver actionable insights to relevant decision-makers Proactively analyze data to answerkey questions from stakeholders or out of self-initiated curiosity with an eyefor what drives business performance Interpret data, analyze resultsusing statistical techniques and provide ongoing reports Create and maintain rich interactivevisualizations through data interpretation and analysis integrating variousreporting components from multiple data sources Identify, analyze, and interprettrends or patterns in complex data sets Define and implement dataacquisition and integration logic, selecting appropriate combination of methodsand tools to ensure scalability and performance of the solution Develop and maintain databases byacquiring data from primary and secondary sources, and build scripts that willmake our data evaluation process more flexible or scalable across data sets Work with management to prioritize businessand information needs Locate and define new processimprovement opportunities",None Found,None Found,"Who Are We?

WiderCircle aims to address an epidemic affecting older Americans: Loneliness andisolation. Loneliness affects nearly half of older Americans; a numberthat is set to grow by 40% to 35 Million when all Baby Boomers have retired. Itcauses depression and is worse to health than smoking 12 cigarettes a day. Nothaving friends makes life less worth living and, as a result, lonely folks takeless better care and lose a decade of life. Wider Circle’s solution is theConnect for Life Program, in which, we form and manages neighborhood groups ofolder neighbors that meet regularly with support from our trained facilitatorsto improve health, make new friends and find renewed purpose.

Opportunity:

WiderCircle is searching for an experienced data analyst to join our team. The idealcandidate should be highly skilled in all aspects of data analytics, includingmining, generation, and visualization. Additionally, you should be committed totransforming data into information, information into insight, and insightinto business decisions.

Objectives of this Role: Identify trends and opportunitiesfor growth through analysis of complex data sets Develop, implement, and maintainleading-edge analytic systems, taking complicated problems and building simpleframeworks Evaluate organizational methods andprovide source-to-target mappings and information-model specification documentsfor data sets Create best-practice reports basedon data mining, analysis, and visualization Work directly with management andusers to gather requirements, provide status updates, and build relationships

Dailyand Monthly Responsibilities:
 Conducting full life cycle activitiesto include requirements, planning, design, and implementation. Work closely with stakeholders tounderstand their analytical needs, including identifying critical metrics andKPIs, and deliver actionable insights to relevant decision-makers Proactively analyze data to answerkey questions from stakeholders or out of self-initiated curiosity with an eyefor what drives business performance Interpret data, analyze resultsusing statistical techniques and provide ongoing reports Create and maintain rich interactivevisualizations through data interpretation and analysis integrating variousreporting components from multiple data sources Identify, analyze, and interprettrends or patterns in complex data sets Define and implement dataacquisition and integration logic, selecting appropriate combination of methodsand tools to ensure scalability and performance of the solution Develop and maintain databases byacquiring data from primary and secondary sources, and build scripts that willmake our data evaluation process more flexible or scalable across data sets Work with management to prioritize businessand information needs Locate and define new processimprovement opportunities

Skills and Qualifications: Bachelor’s degree in Mathematics,Computer Science, Economics, or Statistics 5+ years proven working experiencemining data as a data analyst or business data analyst Technical expertise regarding datamodels, database design development, data mining, and segmentation techniques Strong analytical skills with theability to collect, organize, analyze, and disseminate significant amounts ofinformation with attention to detail and accuracy Strong knowledge of and experiencewith reporting packages (Tableau, etc), databases (SQL, etc) and ETL frameworks

PreferredQualifications: Prior experience with data andanalytics in a healthcare environment, including health insurance and claimsdata as well as quality metrics Proven success in a collaborative,team-oriented environment"
139,RESEARCH ANALYST II,"San Jose, CA 95113",San Jose,CA,95113,None Found,None Found,None Found,None Found,None Found,None Found,"RESEARCH ANALYST II

San Jose/Evergreen Community College District

Close/First Review Date: 08/20/2019

Campus Location: District Office

Position Description:
POSITION SUMMARY
The Research Analyst II reports to the Division Dean of Business & Technology at the Community College Center for Economic Mobility (CCCEM) of San Jose - Evergreen CCD. This primary focus of this position is to provide a lead role in supporting the research & compliance for California Adult Education Plan (CAEP) and Workforce Innovation and Opportunity Act (WIOA) of South Bay Consortium for Adult Education (SBCAE) and SJECCD.
The work schedule is 12 months per year; Monday - Friday; 8:00 a.m. to 5:00 p.m.
This position is represented by CSEA (California School Employees Association), Chapter 363.
POSITION PURPOSE
Under the direction of the Dean of Business & Technology, the Research Analyst II serves as a lead analyst in developing and maintaining institutional research programs. The position provides support for research data management and quality assurance programs; supports the development and maintenance of strategic district and college planning processes; uses and analyzes data and conducts research to support decision-making, budgeting, assessments and evaluations, and enrollment management and to support the District and SBCAE in maximizing educational effectiveness and program performance.
DUTIES AND RESPONSIBILITIES
1. Serve as a lead research analyst in district-wide research projects. \
2. Develop institutional research studies using a wide variety of research analysis methodologies and technologies.
3. Collect, compile and assemble statistical data, including the District, regional, state and national.
4. Design, prepare and disseminate a variety of statistical reports and survey data and present to a wide variety of audiences both internal and external to the District.
5. Establish and maintain databases related to student success including retention, persistence, course completion, placement and others.
6. Develop, use, and maintain query tools and templates for accessing data in data warehouse and other databases; assess needs for access and query templates.
7. Work as a team member in composing, preparing, editing and proofing other office research documents, reports, memos, and correspondence prior to campus-wide and District-wide distribution.
8. Provide training and support for faculty and staff on query tools, templates, and topics of special research interest, including research/evaluation/survey designs, statistical methods, testing and assessment concepts.
9. Support colleges in the preparation of grant applications and reporting such as Title III to funding organizations.
10. Assist with other college studies including studies of transfer rates, transfer readiness, institutional effectiveness and student satisfaction.
11. Stay current on findings and trends in institutional research and planning, especially as related to data management, data warehousing, decision support systems, and institutional research web site use and support.
12. Participate in local, regional, and state activities to promote institutional research and planning and for professional development.
13. Represent the district office on college planning councils and instit
KNOWLEDGE, SKILLS AND ABILITIES

Knowledge of:
1. Research design, methods, sampling, statistics, and analytical strategies and techniques typically used in institutional research.
2. Current management information systems software including database, spreadsheet and graphic display.
3. Advanced formula and macro usage in spreadsheets and databases.
4. Database query tool use, data reduction and display techniques.
5. California community college data element structures.
6. Principles and techniques of information display and presentation in an environment with diverse audience.
7. Modern office practices, procedures and equipment including computer operation.
8. Oral and written communication skills.
Skills and Ability to:
1. Lead in the development and maintenance of complex database systems and a decision-support system for institutional research purposes.
2. Design and conduct institutional research projects and studies including research design, methods, statistical analysis, qualitative research methods, and analytical techniques.
3. Set up database for projects with a view to the data's relationship to the total project goals and outputs.
4. Read, analyze and interpret statistical reports, professional journals, technical procedures or governmental regulations.
5. Write reports, business correspondence and procedures manuals.
6. Gather, validate and interpret data from a wide variety of sources including literature and Internet searches.
7. Perform appropriate statistical analyses and interpret results and findings.
8. Communicate effectively both orally and in writing.
9. Establish and maintain cooperative and effective working relationships with others.
10. Work independently with little supervision; prioritize work and meet schedules.

Required Qualifications:
EDUCATION AND EXPERIENCE

1. Bachelor’s degree in statistics, mathematics or related field.

2. Two years of directly related research work experience.

3. Work experience as a lead with evidence of increasing responsibility over the work of others.

Desired Qualifications:
1. Bilingual abilities, desirable.

District’s Diversity Requirements
Demonstrated sensitivity, knowledge and understanding of the diverse academic, socioeconomic, gender identity, sexual orientation, cultural, disability, and ethnic background of groups historically underrepresented, and groups who may have experienceddiscrimination.
Success integrating diversity as appropriate into the major duties outlined in the job description and in the duties listed in the District’s hiring policy; or demonstrated equivalent transferable skills to do so.

Salary Range:
$73,315 - $89,413 Annual Salary (Range 115: Classified Salary Schedule Fiscal Year 2017-2018). Starting placement is generally at Step 1.

Benefits:
Excellent fringe benefit package includes a pension, medical, dental, vision, EAP (employee assistance plan) and life insurance for employee and eligible dependents, and income protection. Voluntary plans include supplemental life insurance, Flexible Spending Accounts, 403b and 457 Deferred Compensation Accounts. Classified employees also receive vacation, 12 sick leave days and 18 paid holidays.

To be considered for this position please visit our web site and apply on line at the following link: https://sjeccd.peopleadmin.com/

About San Jose/Evergreen Community College District
The District is represented by dedicated and talented employees who are passionate about providing our student population with the best educational experience possible. The District recognizes that cultural diversity in the academic environment promotes academic excellence; fosters cultural, racial and human understanding; provides positive roles models for all students, and creates an inclusive and supportive educational and work environment for its employees, students, and the community it serves.

As of fall 2017, with enrollment of approximately 18,500 per semester, and an extremely diverse student population (Hispanic/Latino 44%, Black/African-American 4%, Asian/Pacific Islander 32%, American Indian/Native American 0.5%, White/Caucasian 11%) attaining educational goals reflecting 45% - AA Degree and Transfer to a 4-Year College/ University, the District’s emphasis on student success makes it a recognized educational leader in the State.

The District encourages a diverse pool of applicants to serve as colleagues to an existing diverse group of managers, supervisors and confidential staff consisting of 29 % Hispanic/Latino, 13% Asian/Pacific Islander, 7% Black/African American, 23% White/Caucasian, and as well as encouraging applications from all qualified, outstanding applicants.

Copyright ©2017 Jobelephant.com Inc. All rights reserved.

Posted by the FREE value-added recruitment advertising agency

jeid-9531501b72d55d4f925ae0ca8e105703"
140,Business Systems Analyst,"Fremont, CA",Fremont,CA,None Found,None Found,None Found,None Found,None Found,None Found,None Found,"Facebook's mission is to give people the power to build community and bring the world closer together. Through our family of apps and services, we're building a different kind of company that connects billions of people around the world, gives them ways to share what matters most to them, and helps bring people closer together. Whether we're creating new products or helping a small business expand its reach, people at Facebook are builders at heart. Our global teams are constantly iterating, solving problems, and working together to empower people around the world to build community and connect in meaningful ways. Together, we can help people build stronger communities — we're just getting started.
Facebook is seeking a passionate Business Systems Analyst who will use data to assist decision-making and implement solutions in support of our Enterprise Engineering Operations services. This position is responsible for partnering with internal stakeholders/teams to design scalable solutions that provide business critical insights and metrics that will impact our internal customers every day. Successful candidates for this team will have a bias toward action and enjoy finding patterns amid chaos, and aren't afraid of being wrong. The perfect candidate will be an experienced business analyst or data analyst with solid contributions in a data-driven environment, is focused on results, a self-starter, and have demonstrated success in contributing to the growth and success of a business. A diverse and flexible skillset is required for supporting a wide set of IT services and business needs using large and varied datasets.
RESPONSIBILITIES
Work with internal stakeholders and cross-functional product development and data teams, to support delivery of internal digital products
Analyze and interpret high impact business needs and translate them into project requirements
Develop deep understanding of the products/tools used by the team, and analyze for continuous improvements
Work with Business Systems Analysts and Data Analysts in other regions to achieve same
Simplify and document requirement workflows for the product development/support teams
Use data to define metrics for the initiatives, measure current state and track attainment of key indicators driving improvement iteratively
Assist with product adoption, internal product marketing, review and feedback gathering
MINIMUM QUALIFICATIONS
BS/MS in Business/Data Analytics, Computer Science, Digital Innovation, Engineering, or equivalent experience
3+ years experience in systems analysis, product consulting or implementing digital products for internal business functions
3+ years experience in building/developing digital products
Demonstrated experience using data to solve business problems
Knowledge of the technical architecture of scalable solutions
Communication and presentation experience
PREFERRED QUALIFICATIONS
Ability to deal with ambiguity, is self-driven and results focused
Creative, data driven, process & detail oriented
Familiar with data tools is an advantage
Facebook is committed to providing reasonable accommodations for qualified individuals with disabilities and disabled veterans in our job application procedures. If you need assistance or an accommodation due to a disability, you may contact us at accommodations-ext@fb.com."
