,Title,Location,City,State,Zip,Country,Qualifications,Skills,Responsibilities,Education,Requirement,FullDescriptions
95,Spatial Planning Data Analyst,"San Jose, CA",San Jose,CA,None Found,None Found,"
Demonstrated technical skills in AutoCAD, Revit, Serraview, iOffice, PowerPoint, and Excel
Ability to effectively interpret and apply policy and procedure
Superb oral, written, and graphic communication skills
Client service oriented and able to effectively communicate to staff through executive levels of the organization
Ability to solve problems both individually and in a team setting
Highly organized and efficient with the ability to multi-task and manage competing priorities
Gives highest priority to accuracy
",None Found,"
Support Strategic Occupancy Planners, Occupancy Planners, Site Facility Managers, Project Managers and business stakeholder relationships with analytics
Maintain accurate planning data including demand and supply forecasting Site and BU intelligence
Work with MAC Coordinators and provide Strategic Planners data analytics to create long-term strategies and enterprise plans.
Analyze data, discover trends and provide insights to Strategic and Occupancy Planners and MAC Coordinators data analytics to inform long-term strategies and enterprise plans
Perform quality control procedures on data and information before distributing out reports
Issues periodic reporting including headcount projections, supply and capacity information and the status of major initiatives (a real estate action plan) for the portfolio; monthly space allocation data, group block plans
Understand business unit intelligence by site
Understand portfolio and occupancy strategy by site
Provide an outstanding employee experience
",None Found,None Found,"We are actively searching for a Spatial Planning Data Analyst to support our Global Solutions clients. This position is in San Jose, CA and may require travel to our clients' worksites or our NELSON office locations up to 10% of the time.

The Spatial Planning Data Analyst will be responsible for providing expertise and services to Strategic Occupancy Planners, Occupancy Planners, Site Facility Managers, Project Managers and business stakeholders. If you’re a highly organized, detailed, and analytical problem-solver with the ability to interpret data, this might be the opportunity for you! Experience and education in architecture, construction management, design or a related field is a must. The ideal candidate is an adaptable team-player capable of juggling multiple tasks simultaneously while consistently meeting deadlines. Serraview and/or iOFFICE workplace software experience preferred.

Key Responsibilities:

Support Strategic Occupancy Planners, Occupancy Planners, Site Facility Managers, Project Managers and business stakeholder relationships with analytics
Maintain accurate planning data including demand and supply forecasting Site and BU intelligence
Work with MAC Coordinators and provide Strategic Planners data analytics to create long-term strategies and enterprise plans.
Analyze data, discover trends and provide insights to Strategic and Occupancy Planners and MAC Coordinators data analytics to inform long-term strategies and enterprise plans
Perform quality control procedures on data and information before distributing out reports
Issues periodic reporting including headcount projections, supply and capacity information and the status of major initiatives (a real estate action plan) for the portfolio; monthly space allocation data, group block plans
Understand business unit intelligence by site
Understand portfolio and occupancy strategy by site
Provide an outstanding employee experience
Qualifications:

Demonstrated technical skills in AutoCAD, Revit, Serraview, iOffice, PowerPoint, and Excel
Ability to effectively interpret and apply policy and procedure
Superb oral, written, and graphic communication skills
Client service oriented and able to effectively communicate to staff through executive levels of the organization
Ability to solve problems both individually and in a team setting
Highly organized and efficient with the ability to multi-task and manage competing priorities
Gives highest priority to accuracy
We offer competitive wages based on skills and experience, excellent benefits package including; Paid Time Off, medical, dental, 401K, pre-tax Flexible Spending Accounts, and more. NELSON is an Equal Opportunity Employer."
96,Research Data Analyst,"San Jose, CA",San Jose,CA,None Found,None Found,None Found,None Found,None Found,None Found,None Found,"JOB SUMMARY

Responsible for conducting research and data analysis for a variety of organizational projects and initiatives.

Key Responsibilities
Assists in collection, aggregation and input of data (comps, Tenants in Markets, properties, availabilities, new constructions etc.) into CBRE property database.
Performs periodic data audits and change reports to ensure that quantity and quality of our data is top notch.
Picks up basic data visualization and programming skills to assist the Senior Analyst and DI manager on special projects.
Other duties as assigned.
No formal supervisory responsibilities in this position. May provide informal assistance such as technical guidance, and/or training to coworkers. May coordinate and assign tasks to co-workers within a work unit and/or project.


QUALIFICATIONS

To perform this job successfully, an individual must be able to perform each essential duty satisfactorily. The requirements listed below are representative of the knowledge, skill, and/or ability required. Reasonable accommodations may be made to enable individuals with disabilities to perform the essential functions.

Bachelor's degree from four-year college or university; or Associate degree and a minimum of two years related experience and/or training; or equivalent combination of education and experience.

0-4 years of experience in commercial real estate or other market research role.
Excellent written and verbal communication skills.

Strong organizational and analytical skills.

Ability to provide efficient, timely, reliable and courteous service to customers.

Ability to effectively present information.
Requires knowledge of financial terms and principles.

Ability to calculate intermediate figures such as percentages, discounts, and/or commissions.

Conducts basic financial analysis.
Ability to comprehend, analyze, and interpret documents.

Ability to solve problems involving several options in situations.

Requires intermediate analytical and quantitative skills.
Ability to handle and manipulate large amounts of data.
Intermediate experience with Microsoft Office and Tableau.
Possess a positive work attitude and ability to work in a team environment.
Decisions made with understanding of procedures and company policies to achieve set results and deadlines. Responsible for setting own project deadlines. Errors in judgment may cause short-term impact to co-workers and supervisor."
97,Clinical Data Analyst I (FIN1901.19),"Palo Alto, CA 94304",Palo Alto,CA,94304,None Found,None Found,"
Must be proficient in SAS, especially routines for the manipulation of large data sets;
Proficiency in natural language processing strongly preferred;
Ability to use SQL to construct analytic datasets strongly preferred;
Successful completion of advanced-level coursework in statistics, math or related field;
Ability to work well both independently and in a collaborative team;
Ability to communicate data requirements, as well as limitations to team members;
Proficiency with MS Word;
Capability to produce reference documents and to outline work processes in writing.",None Found,"
Required: 2 years or more of related experience, including SAS, especially routines for the manipulation of large data sets;
Desired: Experience working with clinical datasets; Prior work with unstructured data and natural language processing.","
Required: 2 years or more of related experience, including SAS, especially routines for the manipulation of large data sets;
Desired: Experience working with clinical datasets; Prior work with unstructured data and natural language processing.","The Palo Alto Veterans for Research PAVIR is seeking a Clinical Data Analyst to support a research program in the Finlay Lab by using SQL and SAS to construct analytic data sets from VA administrative data. The Finlay Lab, which is part of the Center for Innovation to Implementation, VA Palo Alto Health Care System and Stanford University, is focused on identifying disparities in treatment access, use and quality, as well as developing interventions to reduce disparities in care.
The Data Analyst will work with other experienced statisticians to perform statistical analysis and create summaries and reports. This position will also need to be familiar with unstructured data and natural language processing.
The Data Analyst will have the opportunity to learn or enhance skills in management and analysis of a large electronic health records database and advanced statistical techniques. There is also the opportunity to be part of scientific publications.
This position will support a clinical research study investigating mental health and substance use disorder treatment utilization and engagement among justice-involved veterans served at the VA. This position will primarily contribute to a clinical study examining treatment use among justice-involved veterans with substance use disorders.
This is a regular, full time 40 hours/week, Exempt salary-paid position. Benefits:
Medical Insurance
Vision Insurance
Dental Insurance
Vacation
Sick Pay
13 paid Holidays
Life Insurance - paid by PAVIR
Long-term Disability Insurance - paid by PAVIR
Short-term Disability Insurance - paid by PAVIR
Flexible Spending Account
401k Retirement Plan with Company Match and Profit Share
Wellness Program
Employee Assistance Program
Commuter Benefit
PAVIR is a nonprofit foundation affiliated with the Veterans Affairs Palo Alto Health Care System VAPAHCS. As a condition of employment, all PAVIR employees are required to have an approved appointment with VAPAHCS and complete a background check before they can commence work.
Duties:
Write and run programs in SQL and SAS for clinical datasets;
Identify and resolve database and analysis issues/problems;
Conduct statistical analyses in SAS or R;
Natural language processing with unstructured data;
Create and maintain documentation for study set-up, directories, quality assurance monitoring and programs;
Create written presentation of data information;
Perform other tasks as assigned.
Requirements:
Education: Master's degree in statistics, mathematics, or another quantitative field is required.
Experience:
Required: 2 years or more of related experience, including SAS, especially routines for the manipulation of large data sets;
Desired: Experience working with clinical datasets; Prior work with unstructured data and natural language processing.
Knowledge / Skills / Abilities:
Must be proficient in SAS, especially routines for the manipulation of large data sets;
Proficiency in natural language processing strongly preferred;
Ability to use SQL to construct analytic datasets strongly preferred;
Successful completion of advanced-level coursework in statistics, math or related field;
Ability to work well both independently and in a collaborative team;
Ability to communicate data requirements, as well as limitations to team members;
Proficiency with MS Word;
Capability to produce reference documents and to outline work processes in writing.
Environmental Conditions / Physical Demands:
Physical: Sitting in front of a computer for long periods of time, repetitive movement, etc.
Environmental: Exposure to office equipment and office environment.
PAVIR engages in nonprofit medical research and works with sponsors and the Veterans Affairs Palo Alto Health Care System VAPAHCS in administering funds for conducting research to find new and improved ways to combat human disease and help people with disabilities. Please refer to our website for additional information: www.pavir.org
PAVIR is pleased to be an Equal Opportunity Employer. Minorities, Women, Veterans, and Individuals with a Disability are encouraged to apply. We welcome and encourage diversity in the workplace regardless of race, color, religion, age, gender, sexual orientation, national origin, disability status, protected veteran status, or any other characteristic protected by law. If you need special assistance or an accommodation to apply for a posted position, please contact jobs@pavir.org - Human Resources department."
98,"Business Analyst, Play Pass, Google Play","Mountain View, CA",Mountain View,CA,None Found,None Found,None Found,None Found,"
Manage the ramp-up and growth of a new business opportunity for Google Play, working closely with cross-functional teams including Business Development, Engineering, Product Management, Merchandising, and Marketing.
Analyze data and trends to drive new insights, create strategies for the program and product, and make recommendations that drive the business forward.
Collaborate with other teams in Play to manage all aspects of developer onboarding, implementation, verification, and launch.
Define and monitor business metrics across multiple markets, lead operational reviews and strategy planning sessions and make catalog and product recommendations.
",None Found,None Found,"Minimum qualifications:

Bachelor's degree in a technical/business field or equivalent practical experience.
3 years of experience with business analysis and strategy related to games and/or content business models.
Experience with SQL.
Experience with mobile key performance indicators (KPIs) and the apps ecosystem, business models, distribution channels, competitive landscape, and developer success metrics.

Preferred qualifications:

Experience using mobile data and metrics to anticipate user needs and create actionable strategies and recommendations to grow the business.
Strategic thinker with a track record of developing and executing business strategy, leading to business growth.
Ability to multitask and operate with cross-functional teams in a fast paced, ambiguous and rapidly changing environment.
Effective attention to detail and ability to set priorities, drive decisions, create structured processes and respond proactively to potential issues.
About the job
The Business Strategy & Operations organization provides business critical insights using analytics, ensures cross functional alignment of goals and execution, and helps teams drive strategic partnerships and new initiatives forward. We stay focused on aligning the highest-level company priorities with effective day-to-day operations, and help evolve early stage ideas into future-growth initiatives.
Google Play is growing at a rapid pace, with apps and games that are innovative, useful, entertaining, and locally relevant. As as Business Analyst, you'll be part of the Google Play Apps and Games business development team, helping strategic partners gain business success through business development initiatives and projects. You will be at the center of a cross-functional team of people across multiple sites, including Business Development, Product Management, Engineering, UX, Merchandising, Marketing, Operations, and Support.
Google Play offers music, movies, books, apps and games for devices, powered by the cloud. It syncs across devices and on the web. As part of the Android and Mobile team, Googlers working on Google Play do everything from engineering our backend systems, to shaping product strategy, to forming great content partnerships. They make it possible for people to do things like buy an ebook or song on their Android phone, then have it instantly available on their laptop. The Google Play team enhances the Android ecosystem by giving developers and partners a premium store where they can reach millions of users.
Responsibilities
Manage the ramp-up and growth of a new business opportunity for Google Play, working closely with cross-functional teams including Business Development, Engineering, Product Management, Merchandising, and Marketing.
Analyze data and trends to drive new insights, create strategies for the program and product, and make recommendations that drive the business forward.
Collaborate with other teams in Play to manage all aspects of developer onboarding, implementation, verification, and launch.
Define and monitor business metrics across multiple markets, lead operational reviews and strategy planning sessions and make catalog and product recommendations.
At Google, we don’t just accept difference—we celebrate it, we support it, and we thrive on it for the benefit of our employees, our products and our community. Google is proud to be an equal opportunity workplace and is an affirmative action employer. We are committed to equal employment opportunity regardless of race, color, ancestry, religion, sex, national origin, sexual orientation, age, citizenship, marital status, disability, gender identity or Veteran status. We also consider qualified applicants regardless of criminal histories, consistent with legal requirements. See also Google's EEO Policy and EEO is the Law. If you have a disability or special need that requires accommodation, please let us know by completing this form."
99,Marketing Data Analyst,"Sunnyvale, CA 94086",Sunnyvale,CA,94086,None Found,None Found,None Found,"
Analyze the customer journeys and data from Google Analytics, SFDC, Marketo and other systems and data sources. Explore data to uncover patterns, meaningful relationships, anomalies, and trends.
Query and manipulate large data sets to create customer profiles and associated marketing strategies. Make recommendations based on findings.
Responsible for tracking, reporting and analyzing online user behavior, campaign performance, pipeline attribution, and conversion rates throughout the customer journey; including recommendations for conversion improvements and/or testing.
Create reporting for real-time, weekly, and monthly business performance against goals to enable data-driven decisions.
Generate actionable data to focus marketing spend, leverage digital footprints to provide reliable leads to the sales team, and uncover buying patterns to optimize buyer persona to help shape our marketing strategies.
Collaboration with our marketing team to ensure the website analytics platform is set up to measure performance, driving actionable insights and recommendations to improve website and marketing performance.
Partner with IT, Sales Operations, and Marketing teams to help identify and mend data gaps, source issues, and data inaccuracies.
Troubleshoot issues and provide corrective action plans.
Effectively communicate and collaborate with internal teams on data and analysis, and train users on reporting tools.",None Found,None Found,"About CrowdStrike
At CrowdStrike we’re on a mission - to stop breaches. Our groundbreaking technology, services delivery, and intelligence gathering together with our innovations in machine learning and behavioral-based detection, allow our customers to not only defend themselves, but do so in a future-proof manner. We’ve earned numerous honors and top rankings for our technology, organization and people – clearly confirming our industry leadership and our special culture driving it. We also offer flexible work arrangements to help our people manage their personal and professional lives in a way that works for them. So if you’re ready to work on unrivaled technology where your desire to be part of a collaborative team is met with a laser-focused mission to stop breaches and protect people globally, let’s talk.
About the Role
The CrowdStrike Marketing Operations team is seeking a talented and highly motivated Marketing Operations Analyst with a passion for analytics, an intellectual curiosity, and that thrives on translating data into business-driving insights. The ideal candidate will have a strong analytical and project management background with experience in analyzing the customer journey from initial contact through final sale. This role will provide regular analysis and insights back to the business, including recommended strategies for optimizing marketing content, channels, campaigns and conversions to maximize results with lead generation, pipeline growth and sales bookings goals.
Additional Responsibilities
Analyze the customer journeys and data from Google Analytics, SFDC, Marketo and other systems and data sources. Explore data to uncover patterns, meaningful relationships, anomalies, and trends.
Query and manipulate large data sets to create customer profiles and associated marketing strategies. Make recommendations based on findings.
Responsible for tracking, reporting and analyzing online user behavior, campaign performance, pipeline attribution, and conversion rates throughout the customer journey; including recommendations for conversion improvements and/or testing.
Create reporting for real-time, weekly, and monthly business performance against goals to enable data-driven decisions.
Generate actionable data to focus marketing spend, leverage digital footprints to provide reliable leads to the sales team, and uncover buying patterns to optimize buyer persona to help shape our marketing strategies.
Collaboration with our marketing team to ensure the website analytics platform is set up to measure performance, driving actionable insights and recommendations to improve website and marketing performance.
Partner with IT, Sales Operations, and Marketing teams to help identify and mend data gaps, source issues, and data inaccuracies.
Troubleshoot issues and provide corrective action plans.
Effectively communicate and collaborate with internal teams on data and analysis, and train users on reporting tools.
What You’ll Need
Bachelor's Degree in a business, economics, finance or technical discipline.
Solid track record of achieving and exceeding goals in fast-paced environments.
4+ years in marketing / digital data analysis, including customer journey/funnel metrics.
Strong knowledge base in all facets of marketing analytics (data capture, measurement, reporting and translation into business and/or behavioral insights) is a plus.
Demonstrated analytical ability with digital measurement, particularly with complex and abstract business problems. Strong quantitative analysis skills with an aptitude for mining large data sets.
Natural ability to effectively communicate results/implications both verbally and in writing to technical and non-technical audiences.
Experience thinking strategically, structurally solving and driving execution.
Highly-proactive, self-starter capable of effectively managing and prioritizing multiple projects.
Passion for cross-functional collaboration and comfort in the spotlight of high-visibility initiatives.
Bonus Points
Expertise in Salesforce and Microsoft Excel. Experience with DOMO and Google Analytics is a benefit.
High-tech, start-up, rapid growth and/or publicly traded company experience.
You must love our business. CrowdStrike is a leader in cybersecurity. We don’t have a mission statement. We are on a mission to protect our customers from breaches. You must be genuinely committed to our mission and eager to learn the details of our business
Benefits of Working at CrowdStrike:
Market leader in compensation and equity awards
Competitive vacation policy
Comprehensive health benefits + 401k plan
Paid paternity and maternity leave, including adoption
Flexible work environment
Wellness programs
Stocked fridges, coffee, soda, and lots of treats
We are committed to building an inclusive culture of belonging that not only embraces the diversity of our people but also reflects the diversity of the communities in which we work and the customers we serve. We know that the happiest and highest performing teams include people with diverse perspectives and ways of solving problems so we strive to attract and retain talent from all backgrounds and create workplaces where everyone feels empowered to bring their full, authentic selves to work.
CrowdStrike is an Equal Opportunity employer. All qualified applicants will receive consideration for employment without regard to race, color, religion, sex including sexual orientation and gender identity, national origin, disability, protected veteran status, or any other characteristic protected by applicable federal, state, or local law.

#LI-CL1
#LI-LM1"
