,Title,Location,City,State,Zip,Country,Qualifications,Skills,Responsibilities,Education,Requirement,FullDescriptions
43,"Internship Data Scientist, Product Analytics","Palo Alto, CA 94301",Palo Alto,CA,94301,None Found,None Found,None Found,None Found,None Found,None Found,"Who we are
At Criteo, we are building the advertising platform of choice for the open Internet, an ecosystem that favors neutrality, transparency and inclusiveness. With more than 1.4 billion active shoppers and $600 billion in annual commerce sales, we deliver performance at scale. Founded in a Paris start-up incubator, Criteo now carries out our entrepreneurial spirit across 30+ global offices. Do you want to have an impact on more than half of the world’s internet users? Join us and be part of something big.

We are innovative, passionate and result-driven. We are an interdisciplinary team, leveraging the strengths of engineers and scientists.
The Data Science - Product Analytics team uses cutting edge technology, advanced statistics and machine learning to understand the most complex business problems at Criteo. We are committed to designing and building technical solutions to drive Criteo’s development and keep up with a fast-evolving product landscape.
We serve as trusted partners to leadership and work closely with PMs, R&D, Finance or Business teams.

Inside Data Science - Product Analytics:
Find new ways to optimize the bidding strategy
Optimize our capability to recognize users across all their devices and their interactions in the open-internet
Define, drive and analyze results of A/B tests to assess whether online performance is in line with offline simulations
Provide data-driven insights to ensure Criteo remains one step ahead of competitive threats
Identify and size development opportunities for new products
What will you do?
Mine large data sets and turn them into understandable and actionable insights
Build scalable analytic solutions using state of the art tools based on large and granular datasets
Design and execute a stream of analysis and tests to measure the impact of your solutions
Master our internal analytic datasets and reporting tools
Who are you?
Last year of Master’s degree or higher in a quantitative field (Mathematics, Computer Science, Physics, Engineering, Economics,etc.)
Internship of a minimum of 6 months
Outstanding analytical skills and creative thinking
Fluency in the core toolkit of Data Science:
R/Python; SQL/Hive
Manipulating large-scale data sets
Building data pipelines
Descriptive and predictive modelling
Implementing visualizations, dashboards, and reports
Excellent interpersonal and communication skills, pro-active and independent
Fun to work with!
At Criteo, we dare to be different. We believe that diversity fuels innovation and creates an energy that can be seen and felt all over Criteo. We champion different perspectives and are committed to creating a workplace where all Criteos are heard, feel a sense of belonging, and are treated with respect and dignity.

At Criteo, we dare to be different. We believe that diversity fuels innovation and creates an energy that can be seen and felt all over Criteo. We champion different perspectives and are committed to creating a workplace where all Criteos are heard and feel a sense of belonging.

Criteo collects your personal data for the purposes of managing Criteo's recruitment related activities. Consequently, Criteo may use your personal data in relation to the evaluation and selection of applicants. Your information will be accessible to the different Criteo entities across the world. By clicking the ""Apply"" button you expressly give your consent."
44,Business Analyst (Intern) - United States,"San Jose, CA",San Jose,CA,None Found,None Found,None Found,None Found,None Found,None Found,None Found,"WHAT YOU’LL DO
As a Business Analyst Intern for Cisco you will develop creative solutions for real business challenges. You will collaborate on multi-functional projects to identify areas for improvement. You will analyze internal processes, data, and problems and identify benefits from enabling new capabilities. Ultimately you will improve how Cisco operates and how we work together.

WHO YOU'LL WORK WITH
At Cisco you will find a diverse group of people tackling business issues. We work with multi-functional teams to facilitate new business models and process improvements. Cisco employs the best so you will be surrounded by others as ambitious and dedicated as yourself.

WHO YOU AREYou are pursuing a bachelor’s or master's degree in Business, Management, Finance, Math, Accounting, Information Systems or related fieldYou have a minimum of a 3.0 GPA or equivalentYou have excellent analytical, problem-solving and decision-making skillsYou have a high level of customer focus and service excellence as you seek practical and creative solutionsYou have strong collaboration skills with internal/external customers and multi-functional teamsYou have superb communication skills, “can do” attitude and a great teammate in global environmentYou have effective time-management skills and the ability to prioritize work assignments

WHY CISCO

#WeAreCisco, where each person is unique, but we bring our talents to work as a team and make a difference. Here’s how we do it.

We embrace digital, and help our customers implement change in their digital businesses. Some may think we’re “old” (30 years strong!) and only about hardware, but we’re also a software company. And a security company. A blockchain company. An AI/Machine Learning company. We even invented an intuitive network that adapts, predicts, learns and protects. No other company can do what we do – you can’t put us in a box.

But “Digital Transformation” is an empty buzz phrase without a culture that allows for innovation, creativity, and yes, even failure (if you learn from it.)

Day to day, we focus on the give and take. We give our best, we give our egos a break and we give of ourselves (because giving back is built into our DNA.) We take accountability, we take bold steps, and we take difference to heart. Because without diversity of thought and a commitment to equality for all, there is no moving forward.

So, you have colorful hair? Don’t care. Tattoos? Show off your ink. Like polka dots? That’s cool. Pop culture geek? Many of us are. Passion for technology and world changing? Be you, with us!"
45,Senior Data Analyst,"Palo Alto, CA",Palo Alto,CA,None Found,None Found,None Found,None Found,None Found,None Found,None Found,"About Earnin:
Our financial system is fundamentally unfair for people who live paycheck to paycheck. People shouldn't have to wait weeks to get the pay they've already earned. This wait forces them to spend more than $100 billion a year on short-term credit products, late fees and overdraft fees.

Earnin helps people overcome this unfairness by giving them real-time access to their money as soon as they have worked -- without fees or interest.

Our team is bound together by a desire to level the financial playing field. Our investors, Andreessen Horowitz, Ribbit Capital, Felicis Ventures, Matrix Partners and March Capital believe we will change the world.

You can help make a difference. Join us.

About the Team:
Business decisions at Earnin rely heavily on good analysis. Autonomous, cross-functional product and operational teams (we call them ""pods"") drive these decisions on a day to day basis. You'll help a group of pods make product decisions by providing them with insights from our data. For success in this role, you'll need to be comfortable diving deep into the data, stepping up and owning your analysis, and communicating your insights in an accessible way. As a Senior Data Analyst, you'll also help guide the rest of the Analysts at Earnin on best practices.

This position will give you ample opportunity to use and enhance your analytics skills and be hands-on with a complex product in an interesting market. We're in the process of building out our analytics capabilities, so you'll also have a chance to shape the methods and tools that we use. Our business has interesting characteristics for analysis, e.g. lack of a fixed price or term, heavy dependency on external events and providers, and a very data-rich environment. It also has a large and direct impact on the financial lives of its users.

This role has the potential for massive impact on Earnin's growth trajectory. If you have a passion for helping people and a background in data, we want to hear from you!

What Set Us Apart:

A mission to improve the financial lives of folks who need help
Exceptional product-market fit with NPS scores in the 80s
$185 million raised from top tier fintech investors
Great growth, unit economics and user acquisition costs

As a Senior Data Analyst you will:

Provide colleagues with guidance in making product, marketing and operations decisions from an analytical perspective.
Conduct ad hoc analysis to better understand our users, how to serve their needs and run our business more efficiently.
Create and maintain reporting for business partners.
Leverage our data to deliver insights that can help improve key KPIs
Help shape the product roadmap by evangelizing insights gained from the data

Some skills we consider critical to being a Senior Data Analyst:


Expertise with data manipulation. An ideal candidate is comfortable joining/merging data sets with complex relationships and identifying and troubleshooting data issues. SQL, R, Python with pandas experience preferred, but extensive experience using SAS, Excel, etc is also possible.
Can identify and effectively prioritize opportunities to make our business better with analysis.
Experience with delivering information that solves product, marketing or operations questions.
Communicate data methodology and implications clearly
Ability to apply statistics and probability concepts to split testing or LTV estimation
Works well in a time and resource constrained environment. The perfect balance between prioritization and getting things done.

In addition, we expect you to have or quickly develop:

Significant experience with R, python, git, schema creation
Data visualization with any of the following tools: Looker, Tableau, R/Python packages, matplotlib, Seaborn, etc.
Experience with 3rd party analytics services like Google Analytics, Amplitude, Braze
BS or Master's Degree, and relevant experience
Have 4+ years of relevant experience, preferably within a high-growth environment.

Earnin does not unlawfully discriminate on the basis of race, color, religion, sex (including pregnancy, childbirth, breastfeeding or related medical conditions), gender identity, gender expression, national origin, ancestry, citizenship, age, physical or mental disability, legally protected medical condition, family care status, military or veteran status, marital status, registered domestic partner status, sexual orientation, genetic information, or any other basis protected by local, state, or federal laws. Earnin is an E-Verify participant."
46,Intern - Sr. Software Engineer (Masters Degree) - Multiple Locations,"Foster City, CA",Foster City,CA,None Found,None Found,"
Must have a High School diploma or equivalent
Pursuing a Masters Degree in Computer Science, SW Engineering, Computer Engineering, Information Systems, or a related field, graduating December 2020 or later
Minimum GPA of 3.0 out of 4.0 (or equivalent scale)",None Found,None Found,None Found,None Found,"Job Description

As a Software Engineer, you could work in the following roles:
Front End Development
Backend End Development
Full Stack Development
API Developer
Mobile Development
Data Analyst
QA
Specific assignments will depend on upon your skills sets, interest, location and team needs.
Sr. Software Engineer Interns will be placed in one of the Technology Organization teams. Here is a list and brief descriptions:
Network Processing: At its core, Visa is a payments network that connects consumers and merchants with financial institutions. The team is building the long-term architecture on architecture on open platforms and commodity hardware, as well as opening our technology platforms to enable industry collaboration and innovation through co- development.

Issuer Processing: Debit Processing Services (DPS), our Issuer Processing platform for North America, processes over half of all Visa Debit transactions and is the largest single prepaid processing platform for Visa prepaid transactions in the U.S. The team also partners with third-party companies outside of the U.S. to deliver value-added services through Visa-owned assets.

Merchant + Acquirer Processing: Merchant and Acquirer Processing (MAP) is focused on executing the Visa Merchant Strategy, building deeper merchant and acquirer relationships and increasing Total Merchant Value by developing solutions that address complex and emerging merchant and acquirer needs.

Digital and Developer Platform: Develop, deliver, and manage end-to-end technology products, services, capabilities, and solutions while collaborating with a global community of client, merchant, and partner developers to promote the growth of digital commerce and mobilization of payments in emerging and developed markets

Data Product Development: Develops and manages end-to-end technology solutions that create value from our enterprise data through internal and client-focused information-based services, business intelligence and insights, and data-driven product innovation.

Data Platform: We deliver secure, high-quality and easy-to-use Visa core data assets as a service, together with reliable and scalable data platform as a service, that enable Visa internal partners to rapidly and efficiently innovate data-driven business products and services to lead the digital payment industry

Cybersecurity: Cybersecurity provides enterprise-wide, risk-based security and continuity programs, and continually evolves security and continuity capabilities to meet changing internal and external threat landscapes.

Corporate IT: Build, operate and maintain the IT systems and infrastructure necessary to enable a highly connected and collaborative workforce that helps power Visa’s business.

Technology Planning and Business Operations: Provides a structured approach to synchronize, align and unite technology delivery capabilities with business management strategies for improved Technology + Operations organizational performance, execution and risk control.

Operations + Infrastructure: For Visa to deliver on the vision of the best way to pay and be paid for everyone, everywhere, O&I must provide best-in-class infrastructure services that are secure, scalable, continuously available, and run on software-defined infrastructures.

Qualifications

Basic Qualifications
Must have a High School diploma or equivalent
Pursuing a Masters Degree in Computer Science, SW Engineering, Computer Engineering, Information Systems, or a related field, graduating December 2020 or later
Minimum GPA of 3.0 out of 4.0 (or equivalent scale)
Preferred Qualifications
Proficiency in at least one programming language or technology including, but not limited:
Java/J2EE, C/C++, C#, .NET, python, PHP, Ruby on Rails, XML, Javascript, HTML, CSS, Objective-C, OOD, GoLang, Docker
Familiar with: JSON, REST APIs, MongoDB, AngularJS, ExpressJS, NodeJS, React
Big Data technologies: Hadoop, Spark, R, NoSQL
The ability to tackle challenges and address problems head-on
Strong ability to collaborate
Highly driven, inventive and results oriented
Additional Information

Work Hours This position requires the incumbent to be available during core business hours.
Travel Requirements This position requires the incumbent to travel for work 0% of the time.
Mental/Physical Requirements This position will be performed in an office setting. The position will require the incumbent to sit and stand at a desk, communicate in person and by telephone, frequently operate standard office equipment, such as telephones and computers, and reach with hands and arms.
EEO Statement Visa is an EEO Employer. Qualified applicants will receive consideration for employment without regard to race, color, religion, sex, national origin, sexual orientation, gender identity, disability or protected veteran status. Visa will also consider for employment qualified applicants with criminal histories in a manner consistent with EEOC guidelines and applicable local law."
47,Business Intelligence Analyst,"Redwood City, CA 94063",Redwood City,CA,94063,None Found,None Found,None Found,"
Use an analytical, data-driven approach to drive a deep understanding of our fast changing business.
Build data pipelines and reports that enable analysts and other stakeholders across the organization.
Building data models to deliver insightful analytics while ensuring the highest standard in data integrity.
",None Found,None Found,"Minimum qualifications:

Bachelor’s degree in Engineering, Computer Science, Statistics, Economics, Mathematics, Finance or related quantitative field, or equivalent practical experience.
5 years of experience in consulting, business intelligence, analytics or an equivalent analyst position.
Experience with SQL.

Preferred qualifications:

Ability to creatively solve problems in a fast paced, rapidly changing environment
Ability to navigate ambiguity, drive solutions forward and bring stakeholders along.
Strong problem solving, analytical skills and capability of managing multiple projects and reporting simultaneously across different stakeholders.
Strong structured thinking and the ability to easily break down complex ambiguous problems and propose impactful data modeling designs.
About the job
The Business Strategy & Operations organization provides business critical insights using analytics, ensures cross functional alignment of goals and execution, and helps teams drive strategic partnerships and new initiatives forward. We stay focused on aligning the highest-level company priorities with effective day-to-day operations, and help evolve early stage ideas into future-growth initiatives.

The Google Customer Solutions (GCS) Insights team powers Google’s GCS Revenue organization. We deliver actionable business intelligence and insights at scale, through cross-functional analytical investigations that shape how we serve Google's small and mid-market clients. As a Business Intelligence Analyst within the Sales Analytics and Solutions (SaS) Insights team, you will partner with our Sales stakeholders on their insights and business intelligence needs. You will use an analytical, data-driven approach to drive a deep understanding of our fast changing business, provide insights that will translate directly to accelerated business growth, and improve the ability of the overall GCS organization to operate at scale while simultaneously delighting its customers. Additionally, you will partner with Sales teams to identify the insights and intelligence they require to understand, manage, and grow their business and develop solutions to deliver their requirements at scale. In this ole, you will also provide analytical thought leadership to our leaders, delivering insights that enable them to make sound decisions about where to invest Product, Sales, and Marketing efforts, covering new advertiser acquisitions, existing account growth, and partner strategies for our small and mid-market client base.

When our millions of advertisers and publishers are happy, so are we! Our Google Customer Solutions (GCS) team of entrepreneurial, enthusiastic and client-focused members are the ""human face"" of Google, helping entrepreneurs both individually and broadly build their online presence and grow their businesses. We are dedicated to growing the unique needs of advertising companies. Our teams of strategists, analysts, advisers and support specialists collaborate closely to spot and analyze customer needs and trends. In collaboration, we create and implement business plans broadly for all types of businesses.
Responsibilities
Use an analytical, data-driven approach to drive a deep understanding of our fast changing business.
Build data pipelines and reports that enable analysts and other stakeholders across the organization.
Building data models to deliver insightful analytics while ensuring the highest standard in data integrity.
At Google, we don’t just accept difference—we celebrate it, we support it, and we thrive on it for the benefit of our employees, our products and our community. Google is proud to be an equal opportunity workplace and is an affirmative action employer. We are committed to equal employment opportunity regardless of race, color, ancestry, religion, sex, national origin, sexual orientation, age, citizenship, marital status, disability, gender identity or Veteran status. We also consider qualified applicants regardless of criminal histories, consistent with legal requirements. See also Google's EEO Policy and EEO is the Law. If you have a disability or special need that requires accommodation, please let us know by completing this form."
48,Data Analyst II,"Cupertino, CA",Cupertino,CA,None Found,None Found,None Found,None Found,None Found,None Found,None Found,"Product Operations CapEx Systems

The CapEx Operations Data Analyst (CapEx Data Analyst) plays an integral role to ensuring successful business operations management to enable successful product launches.

The CapEx Data Analyst is pivotal to the fast-paced development and launch of products. A successful Data Analyst is self-driven, organized and detail oriented, understands disparate data sources and formats, communicates with ease across engineering, operations and IT teams, thrives in an ambiguous environment and is adept at facilitating alignment and resolving conflicts.

This individual defines, creates and maintains tools and systems to compile data from disparate sources and systems into cohesive visualizations to enable equipment procurement and delivery, asset reuse and repurposing, and equipment inventory management across multiple factory sites. Overall mission is a successful product launch with all lines brought up on schedule and within budget, and completion of early operations builds on target.

Key Responsibilities:Generate meaningful, sustainable, easy to use data models and data visualizationsCreate maps of CapEx and related data streamsEngineer robust data integration and automation solutions to support CapEx managed and related activitiesFact find and document new system requirements
Understand current available data sources and tools; assess alignment to requirementsDrive and develop systems that meet requirements

Role Requirements:BA/BS degree and 3+ years of industry experienceBachelor’s Degree preferably in Business, Science or EngineeringExperience creating data models and managing, organizing and maintaining large quantities of dataAdvanced MS ExcelProficiency with Tableau, SQL, Data structures, API, and databasesDetail orientedExcellent communication (written and verbal)Excellent multi tasking and priority management abilitiesTop notch critical thinking skillsetAbility to react to resets and changes in a time sensitive environmentAbility to travel internationally up to 20%

Machine Learning, predictive modeling knowledge, FileMaker Pro App development experience not required but preferred"
49,Portuguese Speaking Data Analyst S593,"Cupertino, CA",Cupertino,CA,None Found,None Found,None Found,None Found,None Found,None Found,None Found,"The successful candidate will turn data into information and insights that will help support business decisions. Work closely with the Data Analytics team and cross functionally in marketing to produce monthly & quarterly data driven marketing reports.
Skills: Strong data and analytic skills, knowledge of excel, numbers and data modeling. Knowledge of or experience working on subscription businesses a plus. Reporting and presentation skills a must. Looking for a person who has a passion for data and numbers. The successful candidate will turn data into information and insights that will help support business decisions. Work closely with the Data Analytics team and cross functionally in marketing to produce monthly & quarterly data driven marketing reports.
Interpret data, analyze results using statistical techniques and provide ongoing reports.Develop and implement databases, data collection systems, data analytics and other strategies that optimize statistical efficiency and quality.Acquire data from primary or secondary data sources and maintain databases/data systems.Identify, analyze, and interpret trends or patterns in complex data sets.Filter and “clean” data by reviewing computer reports, printouts, and performance indicators to locate and correct code problems.Work with management to prioritize business and information needs.Locate and define new process improvement opportunities. Your candidate must be fluent in Portuguese – they will need to read, write and speak in the Portuguese language.
This role will work closely with the human evaluation team and cross functionally in marketing to produce monthly & quarterly data driven marketing reports.
Skills: MacOS iOS
Education: Bachelor’s Degree or equivalent work experience preferred.
For more information contact Jeanne jsharpe@anzuglobal.com
If this isn’t what you’re looking for maybe you could refer a colleague? We offer a referral bonus if your colleague is hired."
