,Job_Title,Company1_Info,Company2_Info,Company3_Info,Location,Full_Description
86,Data Scientist,,IBM,IBM,United States,"Introduction
IBM's Data Science and AI Technology is a core part of our company's strategy. IBM Data Science and AI is trailblazing new technology platform and services, business models, and data scientist/developer outreach activities with the creation of the IBM Garage.The IBM Garage is an “Innovation and Transformation” consultancy located in the heart of the start-up community. Our design first organization applies IBM DesignThinking and Lean User Experience (UX) techniques to help our clients, large and small, deliver amazing experiences to their customers by helping them identify and build innovative applications using IBM Data Science and AI. Our fast paced, collaborative,and co-located teams make the IBM Garage the most exciting place to be.Our clients who choose IBM Data Science and AI are looking for insights in their data and applying those insights to business problems. The notion of the IBM Garage was born out of the changes on how we work with our customers. We are bringing clients into the IBM Garage; where we are using our Garage Method to lead to a Minimal Viable Product (MVP) definition for the approach we use to define the hypotheses to validate the business requirements

Your Role and Responsibilities
As part of an entrepreneurial team, you will be the Subject Matter Expert on Data and AI Statistical models and how they apply tobusiness problems. Led by a solution architect, you will advise on and help implement models in Machine Learning, Optimization,Neural Networks, and Artificial Intelligence such as Natural Language, Transfer Learning, Deep Learning and other quantitativeapproaches.You will also leverage deep skills and best practices to provide expertise and leadership to help design IBM DataScience and AI solutions that will help our clients drive technology benefits and business outcomes across industries.Youwill workwith cutting edge technologies such as Watson, as well as Open Source approaches such as Python and Jupyter notebooks aswell as with a passionate team of people who are driving the innovation and digital transformation to crossindustry enterpriseclients with the adoption of IBM Data Science and AI. An ideal candidate will be familiar with Design Thinking, Statistics, buildingSupervised and Unsupervised machine learning models, and data cleansing techniques using various utilities and programmingtechniques.Key Responsibilities:Run and statistically evaluate statistical models such asMachine Learning, Optimization, Neural Networks and ArtificialIntelligencePartner with Scrum Masters, Product Owners, Solution architects and peer data scientist and development data engineersto create solutions to meet business and technical opportunitiesUnderstand and communicate technical advantages and tradeoffs between Data ModelsExplore and develop new technical skills and industry practices while absorbing professional knowledge quickly and usingdemonstrated interpersonal skills to be an effective ambassador for IBM Data Scienceand AIUse exceptional communication skills and with input from product management, development, and architecture thoughtleaders, work to deliver high quality endtoend Solutions at Scale in response to the identified business requirementsfrom our clients; ensure the results are statistically validAs part of an entrepreneurial team, you will be the Subject Matter Expert on Data and AI Statistical models and how they apply tobusiness problems. Led by a solution architect, you will advise on and help implement models in Machine Learning, Optimization,Neural Networks, and Artificial Intelligence such as Natural Language, Transfer Learning, Deep Learning and other quantitativeapproaches.You will also leverage deep skills and best practices to provide expertise and leadership to help design IBM DataScience and AI solutions that will help our clients drive technology benefits and business outcomes across industries.Youwill workwith cutting edge technologies such as Watson, as well as Open Source approaches such as Python and Jupyter notebooks aswell as with a passionate team of people who are driving the innovation and digital transformation to crossindustry enterpriseclients with the adoption of IBM Data Science and AI. An ideal candidate will be familiar with Design Thinking, Statistics, buildingSupervised and Unsupervised machine learning models, and data cleansing techniques using various utilities and programmingtechniques.Key Responsibilities:Run and statistically evaluate statistical models such asMachine Learning, Optimization, Neural Networks and ArtificialIntelligencePartner with Scrum Masters, Product Owners, Solution architects and peer data scientist and development data engineersto create solutions to meet business and technical opportunitiesUnderstand and communicate technical advantages and tradeoffs between Data ModelsExplore and develop new technical skills and industry practices while absorbing professional knowledge quickly and usingdemonstrated interpersonal skills to be an effective ambassador for IBM Data Scienceand AIUse exceptional communication skills and with input from product management, development, and architecture thoughtleaders, work to deliver high quality endtoend Solutions at Scale in response to the identified business requirementsfrom our clients; ensure the results are statistically validAs part of an entrepreneurial team, you will be the Subject Matter Expert on Data and AI Statistical models and how they apply to business problems. Led by a solution architect, you will advise on and help implement models in Machine Learning, Optimization, Neural Networks, and Artificial Intelligence such as Natural Language, Transfer Learning, Deep Learning and other quantitative approaches. You will also leverage deep skills and best practices to provide expertise and leadership to help design IBM Data Science and AI solutions that will help our clients drive technology benefits and business outcomes across industries. You will work with cutting edge technologies such as Watson, as well as Open Source approaches such as Python and Jupyter notebooks as well as with a passionate team of people who are driving the innovation and digital transformation to cross-industry enterprise clients with the adoption of IBM Data Science and AI. An ideal candidate will be familiar with Design Thinking, Statistics, building Supervised and Unsupervised machine learning models, and data cleansing techniques using various utilities and programming techniques.

Key Responsibilities:
Run and statistically evaluate statistical models such as Machine Learning, Optimization, Neural Networks and Artificial Intelligence
Partner with Scrum Masters, Product Owners, Solution architects and peer data scientist and development data engineers to create solutions to meet business and technical opportunities
Understand and communicate technical advantages and trade offs between Data Models
Explore and develop new technical skills and industry practices while absorbing professional knowledge quickly and using demonstrated interpersonal skills to be an effective ambassador for IBM Data Science and AI
Use exceptional communication skills and with input from product management, development, and architecture thought leaders, work to deliver high quality end-to-end Solutions at Scale in response to the identified business requirements from our clients; ensure the results are statistically valid

Required Professional and Technical Expertise
Bachelor’s degree in Computer Science or another field relevant to Data Science
1+ years of experience working with Machine Learning, Optimization, Neural Networks and/or Artificial Intelligence
1+ years of experience with a Data Science programming language such as Python or R
Deep understanding of Statistics
Fluent in English
Ability to Travel 75% and conduct Client Facing/Technical Solutions


Preferred Professional and Technical Expertise
Experience with Jupyter Notebooks
Deep understanding of Statistical Machine Learning Models with Python or R
Supporting Relevant business domain knowledge such as Finance or Health Care

About Business Unit
Digitization is accelerating the ongoing evolution of business, and Data Science and AIs - public, private, and hybrid - enable companies to extend their existing infrastructure and integrate across systems. IBM Data Science and AI provides the security, control, and visibility that our clients have come to expect. We are working to provide the right tools and environment to combine all of our client’s data, no matter where it resides, to respond to changing market dynamics.

Your Life @ IBM
What matters to you when you’re looking for your next career challenge? Maybe you want to get involved in work that really changes the world? What about somewhere with incredible and diverse career and development opportunities – where you can truly discover your passion? Are you looking for a culture of openness, collaboration and trust – where everyone has a voice? What about all of these? If so, then IBM could be your next career challenge. Join us, not to do something better, but to attempt things you never thought possible. Impact. Inclusion. Infinite Experiences. Do your best work ever.

About IBM
IBM’s greatest invention is the IBMer. We believe that progress is made through progressive thinking, progressive leadership, progressive policy and progressive action. IBMers believe that the application of intelligence, reason and science can improve business, society and the human condition. Restlessly reinventing since 1911, we are the largest technology and consulting employer in the world, with more than 380,000 IBMers serving clients in 170 countries.

Location Statement
For additional information about location requirements, please discuss with the recruiter following submission of your application.

Being You @ IBM
IBM is committed to creating a diverse environment and is proud to be an equal opportunity employer. All qualified applicants will receive consideration for employment without regard to race, color, religion, gender, gender identity or expression, sexual orientation, national origin, genetics, disability, age, or veteran status. IBM is also committed to compliance with all fair employment practices regarding citizenship and immigration status."
87,Data Scientist,,Employment Placement Agency,Employment Placement Agency,"Irving, TX","Key Responsibilities:
Research, prototype and develop innovative algorithms and solutions for real-time object detection, instance segregation and object tracking.
Work with the team to integrate computer vision into industrial-level software solutions
Stay up to date with tech, prototype with and learn new technologies, proactive in technology communities
Learn from peers in data science and engineering community
Deliver on time with a high bar on quality of research, innovation and engineering

Basic Qualifications:
Master’s degree in AI/Computer Vision areas
4+ years of hands-on experience with OpenCV, SOD or an equivalent computer vision library
3+ years of experience in software engineering
3+ years of industrial experience with at least one of the following languages: Python, C++, Java
Familiar with at least one machine learning framework: TensorFlow, Keras, Caffe, etc.
Strong knowledge of advanced mathematics, image/video processing, computer vision, and AI/machine learning theories

Preferred Qualifications:
Ph. D. preferred
2+ years of experience working in Agile team environment
Experience with CUDA/TensorRT and modern data compression
Experience in deep learning
Published research on computer vision, image processing or machine learning"
88,"Product Analyst, Data Scientist",,GoPro,GoPro,"San Diego, CA","About GoPro

GoPro makes it easy for people to celebrate and share experiences. We believe life is more meaningful when shared. We build cameras, software, and accessories that help the world share itself in immersive and exciting ways.

GoPro is a global movement whose business is driven by shared experiences. We celebrate diversity. We practice inclusion. We foster belonging. We demand equality. And we share the experiences of individuals and communities who also hold these values as core to who they are. From Bucharest to Munich, Silicon Valley to Shenzhen, we are dedicated to building a company that reflects and honors the diverse global communities where we live, work, and play.

GoPro is seeking a motivated candidate to take on the responsibilities of a Product Analyst, supporting our Product Teams. You will be a part of the Analytics & Data Science Team, working cross-functionally with our product hardware, software, and subscription services teams. Key responsibilities include but are not limited to working collaboratively with product teams, supporting their ad hoc, automated reporting and analytics deep-dive needs.

Responsibilities


Support camera, mobile, and subscription services teams with automated reporting and analytics
Discover and communicate relevant insights to key stakeholders for smarter decision making
Explore opportunities for combining internal and external data sources to discover insights
Support requirements gathering and data engineering efforts related to building analytics data sets

Required Qualifications


BA/BS degree or equivalent practical experience
3 years of experience working with Python and/or R
Experience articulating product questions and leveraging SQL to extract and analyze data
Ability to translate analysis results into business recommendations, and excellent written and verbal communication skills

Preferred Qualifications


Master's degree in a quantitative field such as; Statistics, Computer Science, Engineering, Mathematics, Data Sciences
Experience in scripting with SQL, extracting large sets of data, and design of ETL flows
Interest and aptitude in data, metrics, analysis and trends and applied knowledge of measurement, statistics and program evaluation

GoPro Highlights


Fully-stocked kitchen with snacks galore
Live it. Eat it. Love it. – Two dedicated hours during your week to explore your passions and capture it with your GoPro.
Get your very own GoPro (Mounts and accessories included)
Discounted employee stock purchase plan (ESPP)
401(K) matching
Discretionary Time Off
12 weeks paid Parental Leave for new parents
Medical, dental, and vision insurance – premiums are 100% paid for employees, 80% paid for dependents
Life insurance and disability benefits
Employee commuter shuttles

GoPro is an Equal Opportunity Employer."
89,Data Scientist,,Storyfit,save job,United States,"Employment Type
Full Time
Job Location
Austin, Texas
Description
Would you like to have a part in discovering next year’s hit book, movie or TV show? StoryFit is looking for an exceptional data scientist with NLP experience to work closely with our product team to develop and implement algorithms that impact the decision-making process for entertainment professionals.

This is a unique opportunity to join a dynamic group of creative and professional individuals destined to change the face of the entertainment industry. We are a lean startup team combining the disciplines of data science and media expertise in the tech-savvy community of Austin, Texas.

You will be responsible for building, measuring and optimizing the quality of StoryFit’s algorithms. We are focused on high-impact projects utilizing big data analytics and machine learning to improve discovery, evaluation, and predictive outcomes.

If you enjoy peering into the future and shaping its outcome, then you’re just who we’re looking for. (Preference is given to Austin-based candidates.)

Responsibilities
Provide insight into leading analytic practices, design and lead iterative learning and development cycles, and ultimately produce new and creative analytic solutions that will become part of our core deliverables
Work with cross-functional team members to identify and prioritize actionable, high-impact insights across a variety of core business areas
Qualifications
Experience in language-based algorithms and core platform technologies required for NLP
Intermediate experience in the use of statistical analysis environments
Familiarity with SQL, PostgreSQL, Python
Deep understanding of statistical and predictive modeling concepts, machine-learning approaches, clustering and classification techniques, and recommendation and optimization algorithms
Keen desire to solve business problems, and live to find patterns and insights within structured and unstructured data
Desire a fast paced, test-driven, collaborative and iterative engineering environment
Excel at making complex concepts simple and easy to understand by those around you
Driven to show the world the power of applied analytics
Bachelor’s Degree in operations research, applied statistics, data mining, machine learning, physics or a related quantitative discipline. Master’s Degree preferred.
2+ years of experience delivering world-class data science outcomes"
90,Junior Data Scientist,,Munchkin Inc,Munchkin Inc,"Los Angeles, CA","The Junior Data Scientist works within the Demand Planning function to develop predictive analytics and statistical forecasting models utilizing forecasting related systems to improve forecast accuracy and bias reduction. As a Junior Data Scientist, you will have direct responsibility of creating statistical models that drive forecasts on a Customer/SKU level. The candidate must have at least intermediate technical abilities in Python, R, SQL, as well as a collaborative mindset to work with Sales, Marketing, Finance and Operations to obtain qualitative inputs for the statistical model.
You'll do:
Create, update, and enhance statistical models via Python and R
Construct time series and machine learning models to forecast business metrics like gross revenue, item sales etc.
Partner with analysts and business leads to build dashboards and reports to regularly communicate results and monitor key metrics in PowerBI .
Analyze and monitor all data points as related to sales and forecasts for Munchkin; including weekly POS, shipments, orders, current market trends, seasonal trends, new item performance and product version changes.
Assist in the development of new data-driven business processes and systems that will drive forecast accuracy, adding value to all downstream commercial and supply chain processes
Liaise with Inventory Planning, Sales, and Marketing.
Utilize key Retailer Vendor Managed Systems for data analysis and reporting
Devise, generate, and maintain standard and exception reports as required for data validation, forecasting analysis, and meetings
Deliver training and provide Demand Planning systems support as required for the Sales, Marketing, and Supply Chain teams
Other duties may be assigned

Position Requirements

Bring it!
An outgoing and enthusiastic personality
Detail oriented, organized and strong on follow through
Ability to work in a team-oriented and very fast paced environment with little supervision
Desire to advance and gain increased responsibility
A problem solver who is comfortable taking initiative
BA/BS in a related quantitative field (Data Science, Computer Science, Statistics, Business Analytics, etc); M/S preferred
Intermediate level experience with data querying languages (SQL), scripting languages (Python)
Experience in Microsoft Office, Excel and the aptitude to learn various Retailer Vendor Managed Systems (Amazon Vendor Central, Content Analytics, IRI) and forecasting software (Galt)
Proficient level of supply chain understanding and CPFR activities such as forecasting, inventory control, etc. preferred"
91,Data Scientist,8 reviews,Simon-Kucher & Partners,Simon-Kucher & Partners,"Boston, MA","To support our project teams, we are looking for
Data Scientist-USA
for our office in Boston, United States
About Simon-Kucher & Partners
For over 30 years, Simon-Kucher & Partners has helped development stage to Global Fortune 500 companies in addressing their strategic and marketing challenges. We are regarded as the world’s leading pricing advisor and thought leader. We focus on TopLine Power® by helping clients grow their top-line through strategy, pricing, marketing and sales.

Globalization is a core element of our goals and strategy. Today we are an international and multilingual team of over 1,300 full-time employees from diverse academic and professional backgrounds in over 38 offices across the US, Europe, Asia Pacific, and South America.
The Role:
The Simon-Kucher Data Science team is a group of data scientists who develop best-in-class approaches and models to solve complex business problems using Machine Learning and Advanced Analytics.
As a Data Scientist at Simon-Kucher & Partners, you will be an integral part of the project teams working to drive top-line growth for our clients. You will be responsible for the core components of the model development process, from data wrangling / pre-processing to Machine Learning model development, testing, and implementation. Throughout this process, you will also gather and communicate meaningful data insights to your project team.
In addition, you will keep an eye on the fast-changing market of advanced analytics and help further develop Simon-Kucher’s data science offerings. Your continued involvement and efforts will enable Simon-Kucher & Partners to become a thought-leader on the applications of Machine Learning and AI to pricing, sales and marketing strategies.
Key Responsibilities:
Data wrangling, cleaning, and pre-processing
Conducting exploratory data analysis and communicating insights through clear descriptions and visualizations
Developing, testing, and implementing Machine Learning models
Conducting research on recent developments in machine learning and AI, with a focus on topics related to pricing, sales, and marketing
Being a topic expert on Machine Learning and AI for your project team, enabling strong project planning and team performance

Basic Qualifications:
Degree in a quantitative field, such as computer science, engineering, statistics, operations research, data science, or equivalent experience
Experience with Machine Learning and statistical modelling techniques
Strong programming skills in R and/or Python
Experience applying advanced analytics and Machine Learning to solve business problems
Experience with data visualization software / libraries (Tableau, PowerBI, Matplotlib)
Comfort working both on a team and autonomously
Strong written and verbal communication skills, ability to simply and concisely explain complex analytical topics
Entrepreneurial spirit—we are a fast-growing team with vast opportunities for growth
Preferred Qualifications:
Implementation experience with Machine Learning models and applications
Knowledge of cloud-based Machine Learning engines (AWS, Azure, Google, etc.)
Experience with large scale data processing tools (Spark, Hadoop, etc.)
Ability to query and program databases (SQL, No SQL)
Experience with distributed ML frameworks (TensorFlow, PyTorch, etc.)
Familiarity with collaborative software tools (Git, Jira, etc.)
Experience with user interface libraries / applications (Shiny, Django, etc.)
Domain expertise in pricing, demand forecasting, or time-series data
To Apply:
Submit your Resume/CV and Cover Letter via the Simon-Kucher job portal. Please ensure your Cover Letter includes:
Why you are interested in a job at Simon-Kucher.
Specific reasons why your application differentiates you from other candidates."
