,Job_Title,Company1_Info,Company2_Info,Company3_Info,Location,Full_Description
45,Full Time Opportunities for Students or Recent Graduates: Data & Applied Sciences,,Microsoft,Microsoft,"Redmond, WA","Data Scientists at Microsoft help to improve the quality of experiences on our devices and services. We are looking for highly motivated and passionate Data Scientists to apply rigorous scientific methodology and algorithms to data in order to improve Microsoft’s devices, operating systems, and services. As a Data Scientist, you will provide unique insight into business and customer scenarios that cut across organizational boundaries and lead the growth of a data-driven culture within Microsoft.

Do you want to work on a meaningful and impactful project and make a difference?
Are you willing to learn from others and open to new ideas?
Do you want to support others to succeed and operate in a highly-collaborative and global environment?
If this sounds like you, Microsoft would like to invite you to come join us as you are, where you can find more than just a job.
Read on to learn more about opportunities and apply online!
Responsibilities
As a Data Scientist, you will formulate approaches to solve problems using well-defined algorithms and data sources. You will incorporate an understanding of product functionality and customer perspective to provide context for those problems. You will use data exploration techniques to discover new questions or opportunities within your problem area and propose applicability and limitations of the data. Successful Data Scientists will interpret the results of their analysis, validate their approach, and learn to monitor, analyze, and iterate to continuously improve.

You will engage with peer stakeholders to produce clear, compelling, actionable insights that influence product and service improvements that will impact millions of customers. As a Data Scientist, you will also engage in the peer review process and act on feedback while learning innovative methods, algorithms, and tools to increase the impact and applicability of your results.
Qualifications
Currently has or is in the process of obtaining their BA/BS or Masters in Computer Science, Mathematics, Economics, Statistics, Applied Sciences like Biostatistics, Physics, Chemistry, Computational Neurology
Some Engineering experience and or project course work using large data systems on SQL, Hadoop, etc.
Proficiency using one or more programming or scripting language to work with data such as: Python, Perl, or C#.
Some experience and or project course work performing data analysis and applying statistics working with tools such as: Excel, R, MATLAB, AMPL, or SAS.
Some experience and or project course work with product and service telemetry systems.
Some A/B Testing or experimentation (this can be from conducting real life science experiments, hypothesis testing in stats etc.) Not required but ideal.
Some experience or course work applying basic ML to a type of data and or used algorithms to conduct experiments on data. Machine Learning strongly encouraged.
Passion to learn from your peers, manager, and other stakeholders in the Data Science domain.
Ability to interact with peers and stakeholders to drive product and business impact.
Strong interpersonal and communications skills.

Microsoft is an equal opportunity employer. All qualified applicants will receive consideration for employment without regard to age, ancestry, color, family or medical care leave, gender identity or expression, genetic information, marital status, medical condition, national origin, physical or mental disability, political affiliation, protected veteran status, race, religion, sex (including pregnancy), sexual orientation, or any other characteristic protected by applicable laws, regulations and ordinances. We also consider qualified applicants regardless of criminal histories, consistent with legal requirements. If you need assistance and/or a reasonable accommodation due to a disability during the application or the recruiting process, please send a request via the Accommodation request form.

Benefits/perks listed below may vary depending on the nature of your employment with Microsoft and the country where you work."
46,Data Scientist,412 reviews,University of California San Francisco,University of California San Francisco,"San Francisco, CA","The Data Scientist will work with the Principal Investigator (PI) in designing, testing, and validating algorithms and models for data analysis, providing data visualization of analyzed results, for various ongoing life sciences projects. The successful applicant will use professional bioinformatics, computer science, and data science concepts as well as computational research and development principles, and assist in additional analyses as needed to achieve research objectives. Develops and optimizes a variety of computational, data science, and CI research tools and components. Performs research on current and future HPC, data, and CI technologies, hardware and software projects. Works on algorithm development, optimization, programming, performance analysis and / or benchmarking assignments of moderate scope where the tasks involve knowledge of data science and bioinformatics.

MEDICINE / CARDIOLOGY / ARNAOUT LABORATORY
The Arnaout laboratory studies deep and machine learning for biomedical imaging and related clinical data, with the goals of decreasing diagnostic error and developing and scaling novel phenotypes to drive precision medicine research.

UCSF is a top-10 medical center and a leader in cross-campus efforts to mine, harmonize, and analyze multi-modal clinical data for the University of California’s 15 million patients.

The Arnaout laboratory is part of both the Bakar Computational Health Sciences Institute, where the abovementioned efforts are based, and the nationally ranked Department of Medicine (DOM). Projects focus on deep learning for medical imaging, and through collaborative work with intra- and inter-institutional partners, touch the electronic health record, genetics, and other sources of data.

ABOUT UCSF

The University of California, San Francisco (UCSF) is a leading university dedicated to promoting health worldwide through advanced biomedical research, graduate-level education in the life sciences and health professions, and excellence in patient care. It is the only campus in the 10-campus UC system dedicated exclusively to the health sciences."
47,Data Scientist,Spin Electric Scooters,Spin Electric Scooters,Spin Electric Scooters,"San Francisco, CA","About Spin

Spin operates electric scooters in cities and campuses nationwide, bringing sustainable last-mile mobility solutions to diverse communities. Recognized for its consistent cooperation and collaboration with cities, Spin partners closely with transportation planners, elected officials, community groups, and university administrators to bring stationless mobility options to streets in a responsible and carefully orchestrated manner.

Based in San Francisco, Spin is a diverse team of engineers, designers, urban planners, policymakers, lawyers and operators with experience from Y Combinator, Lyft, Uber, local and federal government, and the transportation advocacy world. Spin was known for launching the first stationless mobility program in Seattle, and has since expanded to become the exclusive electric scooter partner in mid-sized cities like Coral Gables, Florida and Lexington, Kentucky, and one of a few permitted scooter operators in large cities like Denver, Detroit, and Washington, D.C. The team embeds in cities and neighborhoods to understand their specific transportation needs, and hires locally from the community.

Spin is expanding quickly and looking for top-tier talent to help us bring affordable and accessible transportation options to cities and define what future safe streets will look like.

About the Role

We are looking for a highly experienced data scientist to solve numerous optimization problems that will impact rider experience, operation efficiency, and help elevate business growth on a massive scale. You will be responsible for developing analytical insights, machine learning models and actionable data-infoemd solutions. You will also be experimenting with data to predict future performance. As Spin is a data informed organization, you will present findings to senior management to strengthen business decisions.

The Team

Our team consists people that are passionate about creating finely polished and intuitive experiences and, at the same time, obsess over performance and reliability of what we build. We challenge the status quo and strive towards finding the best way to solve problems.

We work in very small groups to keep processes and overhead low, so we have a lot of trust and accountability to perform the work required to build the best product.
Responsibilities
Apply statistical techniques to develop analyses and models toward insights improving growth, experience, and operations
Design, build, train and test Machine Learning models
Write production-level code to convert your ML models into working pipelines
Create visualizations and communicate findings and collaborate cross-organizationally, to drive business understanding; identify behaviors, trends, and opportunities; and facilitate launch decisions
Collaborate with product, data, engineering, business and operations teams to frame analytical problems and design ML solutions
Qualifications
Degree in a quantitative field like statistics, economics, engineering, or applied math preferred
Minimum of 3-5 years of relevant experience in data science role
Knowledge of ML libraries and ability to build ML workflows
Strong oral and written communication skills, and ability to collaborate with cross-functional partners to build the business
Experienced in Python
Benefits & Perks
Opportunity to join a fast-growing startup and help shape and establish the company’s industry leadershipCompetitive health benefitsDaily catered lunch in our SF officeUnlimited PTO for salaried rolesCommuter stipend plus pre-tax benefitsMonthly cell phone bill stipendWellness perk for salaried roles

Spin is an equal opportunity employer and will not discriminate against any employee or applicant for employment in an unlawful matter. We celebrate diversity and are committed to creating an inclusive environment for all individuals. Spin treats all employees and job applicants on the basis of merit, qualifications, and competence without regard to any qualified individuals' sex, race, color, religion, national origin, ancestry, gender (including pregnancy, breastfeeding, or related medical condition), sexual orientation, gender identity, gender expression, age, physical or mental disability, medical condition, genetic characteristic or information, marital status, military and veteran status, or any other characteristic protected by state or federal law. Spin also considers qualified applicants with criminal histories, consistent with applicable local, state, and federal law.

Spin is committed to providing reasonable accommodations for qualified individuals with disabilities in its job application procedures. If you need assistance or an accommodation due to a disability, you may contact us at job_accommodations@spin.pm."
48,30817 - Data Scientist - GS-13,,U.S. Federal Government,U.S. Federal Government,"Montgomery County, MD","Duties
Summary
Position Information


This is an opportunity for:
An internal or external candidate to fill a GS-13 cadre position.
A Federal Government employee to serve on a two-year reimbursable detail assignment in the ODNI. The detail assignment may be extended an additional year if all parties agree.

Responsibilities
Component Mission


The Office of Intelligence Community (IC) Equal Employment Opportunity and Diversity (EEOD) reports directly to the Director of National Intelligence and is responsible for the overall strategic management of the IC's efforts to build a diverse workforce. IC EEOD develops policies and programs, and provides guidance and consultation that impact the representation of women, minorities, and persons with disabilities. In addition to its community management responsibilities, the IC EEOD provides EEO and diversity services for the Office of the Director of National Intelligence organization.


Major Duties and Responsibilities (MDRs)
Lead IC EEOD compilation of pertinent workforce data from all 17 IC elements (including ODNI) in the preparation of the following mandated reports: (1) Annual Demographic Report on Hiring and Retention of Minorities, Women, and Persons with Disabilities in the U.S. Intelligence Community; 2) Annual IC 462 Report on Complaints Activity; (3) Annual and quarterly Notification and Federal Employee Antidiscrimination and Retaliation Act (No FEAR);
Track submissions and ensure verification, timeliness, and completion of data collected and establish benchmarks using similar data collected from other federal agencies.
Organize IC workforce data in an effective manner to increase data driven decision making and access, using cutting edge analytic models, to provide the most rigorous and consolidated insight into all IC EEOD analytic product lines and decision making processes.
Prioritize research and other projects; establish project goals.
Engage with customers to understand and participate changing needs and requirements; determine substantive questions. Offer recommendations for resolution based on quantitative analysis.
Collaborate with IC collectors and analysts to acquire process and refine gaps on complex intelligence problems; devise creative all source data collection strategies to fill intelligence gaps; task specific collections resource.
Create and coordinate design solutions for transitioning (and maintaining) to a cloud based architecture(s) and associated accesses, along with local data management accesses and management.
Develop and/or retain current data repositories and data infrastructure and create new ones. Develop and maintain a data infrastructure that combines disparate data from various sources into a coherent structure to maximize utilization of the data and environment.
Independently develops the identification of new sources of intelligence and advance quantitative query. Devise quantitative analysis, ensuring all products incorporate multiple lines of inquiry and are fully coordinated with all stakeholders.
Devise accurate, timely, and sophisticated data analysis in support of the most complex key IC EEOD, ODNI, U.S. national security objectives and to shape Intelligence Community EEO and Diversity analysis priorities. Conceive complex statistical and mathematical modeling, and data mining analysis independently or in partnership with other Data Scientist or Analyst colleagues.
Manipulate, analyze, assess, and prepare tables and visualizations required for IC EEOD Congressional Budget Justification Book (CBJB) submissions, briefings, and other ad hoc data queries
Conceive, prepare and communication an extensive range of strategic, high complex graphics, computational models/tools, or written/oral assessments on significant or contentious issues for the most senior internal and external customers (e.g. policymakers, IC components, Agency executives).
Travel Required
Occasional travel - You may be expected to travel for this position.
Supervisory status
No
Promotion Potential
13
Job family (Series)
0132 Intelligence
Requirements

Requirements
Conditions of Employment
Desired Requirements
Thorough knowledge of individual, organizational, and technical or transnational issues of national security concern.
Thorough knowledge of business operations and associated processes.
Thorough knowledge of appropriate analytic methods and methodological tools in one or more of the following areas: Applied Mathematics (e.g. probability and statistics, formal modeling, computational social sciences); Computer Programming (e.g. programming languages, math/statistics packages, computer science, machine learning, scientific computing); and Visualization (e.g. GIS/geospatial analysis, telemetry analysis).
Thorough knowledge of research designs. Demonstrated ability to develop comprehensive computer software applications, as needed.
Ability to leverage multiple data management tools to organize relevant information and make decisions.
Ability to apply intellectual curiosity; creativity and innovation to go beyond current tools to deliver the best solution to complex problems.
Ability to effectively communicate complex, multi-disciplinary ideas and insights.
Ability to translate complex, technical findings into an easily understood narrative (i.e. tell story with data).
Analytical and critical thinking skills, including superior ability to think strategically.
Ability to multitask and change focus quickly as demands change.
Ability to evaluate data drawing pertinent inferences from data trend analysis, and interpretation of such inferences in keeping with the requirements of officials responsible for planning or for making policy decisions.
Qualifications
Mandatory and Educational Requirements
Bachelor's degree in quantitative or technical field of study (e.g. statistics, mathematics, computer science, physical science, economics, Geographic Information Systems). (Master's degree in computer science, information systems, or other technology-related field is preferred).
Five (5) years of relevant analytic experience, including demonstrated expert ability to use statistical software programs (e.g., SPSS, STATA, Tableau, text analytics, Microsoft Excel pivot tables).
Education
N/A
Additional information
*** OPEN UNTIL FILLED: This announcement will be open until the position is filled. Cut off points are scheduled in two-week increments. After each cut-off point, all compliant applications received during the previous two weeks will be reviewed for consideration.***


Who May Apply

Current GS employees at the same grade or one grade lower than the advertised position grade may apply.

Former members of the Peace Corps may be considered for ODNI employment only if five full years have elapsed since separation from the Peace Corps.
For a cadre assignment:
Current ODNI permanent cadre.
Current ODNI Staff Reserve Employees. (A staff reserve employee who currently occupies this position may not apply.)
Current Federal Government employees. (Current GS employees at the same grade or one grade lower than the advertised position grade may apply.)
Candidates outside the Federal Government.
For a detailee assignment:
Current Federal Government employees. (Current GS employees at the same grade or one grade lower than the advertised position grade may apply.)
Salary Determination
The ODNI uses a rank-in-person system in which rank is attached to the individual. A selected ODNI candidate or other Federal Government candidate will be assigned to the position at the employee's current GS grade and salary.
For a selected non-Federal Government candidate, salary will be established within the salary range listed above, based on education and experience.
A current Federal Government employee, selected for a detail, will be assigned to the position at his or her current grade and salary.
The ODNI is an equal opportunity employer and abides by applicable employment laws and regulations.


REASONABLE ACCOMMODATIONS FOR PERSONS WITH DISABILITIES: The ODNI provides reasonable accommodations to otherwise qualified applicants with disabilities. IF YOU NEED A REASONABLE ACCOMMODATION for any part of the application and hiring process, please notify the Intelligence Community Equal Employment Opportunity and Diversity Office Representative by classified email at DNI_Reasonable_Accommodation_WMA@cia.ic.gov and DNI_Diversity_WMA@cia.ic.gov, by unclassified email at DNI_DRA@dni.gov, by telephone at 703-275-3799 or by FAX at 703-275-1217 . Your request for reasonable accommodation will be addressed on a case-by-case basis. PLEASE DO NOT SUBMIT YOUR APPLICATION TO THE EEOD EMAIL ADDRESS. THIS EMAIL IS FOR REASONABLE ACCOMMODATION REQUESTS ONLY. PLEASE SUBMIT YOUR APPLICATION VIA THE EMAIL ADDRESS PROVIDED IN THE 'HOW TO APPLY' SECTION BELOW .

How You Will Be Evaluated
You will be evaluated for this job based on how well you meet the qualifications above.
Applicants are encouraged to carefully review the vacancy announcement, particularly the MDRs, and construct their resume to highlight their most significant experience and qualifications relevant to this job opportunity.

Background checks and security clearance
Security clearance
Sensitive Compartmented Information
Drug test required
Yes
Required Documents

Required Documents
APPLICATION PACKAGES MUST CONTAIN ALL ITEMS LISTED IN THE 'HOW TO APPLY' INSTRUCTIONS BELOW. AN INCOMPLETE APPLICATION PACKAGE WILL BE INELIGIBLE FOR CONSIDERATION.


Your application MUST be received by midnight on the closing date of this announcement. Applications received after the closing date will NOT be eligible for consideration.


To verify receipt of your application package ONLY, you may call 301-243-1318.

Benefits

Benefits
A career with the U.S. Government provides employees with a comprehensive benefits package. As a federal employee, you and your family will have access to a range of benefits that are designed to make your federal career very rewarding. Learn more about federal benefits .
Eligibility for benefits depends on the type of position you hold and whether your position is full-time, part-time, or intermittent. Contact the hiring agency for more information on the specific benefits offered."
49,"Associate Data Scientist, Online","48,451 reviews",The Home Depot,The Home Depot,"Atlanta, GA 30301","Position Purpose:
At HomeDepot.com, our award-winning e-Commerce team is blazing a trail of retail shopping innovation by leveraging cutting-edge technology with our 2,200+ store locations and a relentless focus on customer service. We have been named one of the world's most innovative companies and we are on a mission to provide the best interconnected shopping experience to our consumers. To do so, we need more dreamers, innovators and big thinkers passionate about re-imagining the future of retail. Interested in making history with us? If so, apply today to experience what it’s like to be a part of our HomeDepot.com team. Who knows? Your next big idea may just change the future of retail!

The candidate will be generating ideas for exploratory analysis to shape future projects and provide recommendations for actions, leading the development of models and techniques to deliver personalized experiences for our customers, leveraging data to perform intensive analysis across all areas of our business to drive product development. This role will ensure that the analysis results drives next iteration of changes to product functionality on desktop, mobile web and mobile app platforms. He or She will be working with cross-functional teams and present findings to senior management to drive business decisions.
Major Tasks, Responsibilities and Key Accountabilities:
50% - Establish scalable, efficient processes for large scale data analyses, model development and model implementation
30% - Design and develop algorithms and models to use against large datasets to create business insights
20%-Present analysis and resulting recommendations to senior management; Leverage data to present a compelling business case to optimize investments and operations
NATURE AND SCOPE
This position reports to Sr Manager, Data Science Online
This position has no Direct Reports
Environment:
Located in a comfortable indoor area. Any unpleasant conditions would be infrequent and not objectionable.
Travel:
Typically requires overnight travel less than 10% of the time.
Minimum Qualifications:


Must be eighteen years of age or older.
Must be legally permitted to work in the United States.
Education Required:
The knowledge, skills and abilities typically acquired through the completion of a bachelor's degree program or equivalent degree in a field of study related to the job.
Years of Relevant Work Experience: 2 years
Physical Requirements:
Most of the time is spent sitting in a comfortable position and there is frequent opportunity to move about. On rare occasions there may be a need to move or lift light articles.
Additional Qualifications:
B.S. in Computer Science, Math, Engineering, Finance, or related quantitative field.
Preferred Qualifications:2 years of experience in data mining and statistical analysisPrevious work experience in ecommerceExperience with large-scale data analysis and a demonstrated ability to identify key insights from data to solve business problems
Knowledge, Skills, Abilities and Competencies:Ability to build scalable systems that analyze huge data sets and make actionable recommendationsStrong communication and data presentation skillsAbility to quickly adapt to new technologies, tools and techniquesFlexible and responsive; able to perform in a fast paced, dynamic work environment and meet aggressive deadlinesAbility to work with technical and non-technical team members"
