,Title,Location,City,State,Zip,Country,Qualifications,Skills,Responsibilities,Education,Requirement,FullDescriptions
110,Bioinformatics Data Scientist,"San Francisco, CA 94107",San Francisco,CA,94107,None Found,None Found,None Found,None Found,None Found,None Found,"Invitae is dedicated to bringing comprehensive genetic information into mainstream medicine to improve healthcare for billions of people. Our team is driven to make a difference for the patients we serve. We are leading the transformation of the genetics industry, by making genetic testing affordable and accessible for everyone to guide health decisions across all stages of life.

Invitae needs data scientists with diverse backgrounds to help us achieve our mission. We are a cross-functional team of scientific domain experts and dedicated, curious engineers. We build systems that take massive amounts of genomic data, combine it with the world's scientific literature, add to it years of rigorously curated results, and package it all neatly for our scientists to consume. It's a lot of information. As the data gets bigger, our systems need to get better and faster. That's where you come in.

We are looking for a highly motivated and experienced data scientist to join the Dry Lab Operations group. In this role you will be responsible for analyzing lab process metrics, preparing reports for clinical validation, and modeling process changes. You will independently and proactively identify process issues and recommend solutions given critical timelines. This work is interdisciplinary and involves collaboration with production lab scientists, R&D scientists, the clinical quality assurance team, laboratory directors, and the bioinformatics pipeline engineering team. You will have ample opportunity to significantly contribute to the development of our evolving technologies. Expect to impact business decisions through data-driven presentations and recommendations.

What you'll do:

Enable smarter business processes and implement analytics for meaningful insights
Identify and execute exploratory analysis to solve various problems
Identify relevant data to mine for business needs
Perform data and error analysis to improve lab stability and methods
Clean and validate data for uniformity and accuracy

What you bring:

Strong experience using statistical computer language (R, Python, SQL, etc) to manipulate NGS data and draw insights
Strong problem solving skills with emphasis on lab processes and assay development
Excellent data science communication skills
2+ years demonstrated professional experience in statistics and modeling
2+ years demonstrated professional experience in data visualization (matplotlib, Tableau)
Excellent knowledge of Python and its applications to data science
Knowledge of querying databases: SQL, datalog, etc. Database management experience a plus.
Eagerness in taking ownership of day-to-day production operations
A drive to learn and master new technologies and techniques
Preferred: Experience with LIMS and working in a Lab environment

At Invitae, you'll work alongside some of the world's experts in genetics and healthcare at the forefront of genetic medicine. Our teams thrive in our dynamic organization, which has been designed to empower them to make the biggest impact they can for our patients. We give our employees the ability to explore interests and capabilities broadly within the organization. We prize freedom with accountability and offer significant flexibility. We also provide excellent benefits and competitive compensation in a fast-growing organization.

At Invitae, we're changing healthcare to change lives. Join us.

At Invitae, we value diversity and provide equal employment opportunities (EEO) to all employees and applicants without regard to race, color, religion, national origin, gender, sexual orientation, age, marital status, veteran status, or disability status. We will consider for employment qualified applicants with criminal histories in a manner consistent with the requirements of the San Francisco Fair Chance Ordinance."
111,Data Scientist,"San Mateo, CA",San Mateo,CA,None Found,None Found,None Found,None Found,None Found,None Found,None Found,"Upstart is the first lending platform to leverage artificial intelligence (AI) and machine learning (ML) to automate the borrowing process and price credit. In addition to our direct-to-consumer lending platform, Upstart provides technology to banks, credit unions and other partners via a ""Software-as-a-Service"" offering called Powered by Upstart.

Data scientists build the statistical and machine learning models that power our platform. By collaborating with our engineering team, data scientists use conventional and non-conventional variables at scale to continuously improve our underwriting, fraud, pricing and marketing models. After exciting success over the past few years, we are looking to double down on our competitive advantage by expanding our data science team.

Our mission is to enable effortless credit based on true risk. Going beyond FICO, our model provides higher approval rates and lower interest rates for every traditionally underserved demographic. Since our founding, we have originated more than $4 billion in loans and are on track for another year of record-setting growth in 2019.

Our Team

Our data science team consists of full-stack generalists as well as specialists in statistical modeling or machine learning. Because our challenges are so new, data scientists at Upstart need strong creative problem-solving skills and the technical background to implement solutions. Our research environment affords team members the opportunity to utilize a variety of statistical and machine learning methods with the freedom and encouragement to pursue alternative approaches to solving problems.

Our current Data Scientists summarize some of their favorite aspects of our team as:


Having a direct impact on the company's success
Collaborative, intelligent and open team
Mentorship, growth and friendship
Leaders committed to challenging and growing team members
Feeling safe asking for help when it's necessary; feeling trusted to get the job done when it's not

Hiring Profile


Strong academic credentials with a M.S. in Computer Science, Statistics, Data Science or a related field of study with a preference for Ph.D.
Comfort with programming (ideally in Python and R)
Rigorous quantitative background
Predictive modeling experience is preferred
Enthusiasm for and alignment with Upstart's mission and values
Strong sense of intellectual curiosity balanced with humility
Numerically-savvy with ability to operate at a speedy pace

Whether developing new products or identifying novel approaches to core models, we are continuously seeking the next big ideas to move our business forward. If you are energized by the impact you can make at Upstart, we would love to hear from you.

Upstart is an equal opportunity employer and all qualified individuals will receive consideration for employment without regard to race, color, religion, sex, national origin, age, disability status, veteran status, marital status, citizenship status, sexual orientation, gender identity or any other characteristic protected by law."
112,Principal Data Scientist,"San Bruno, CA 94066",San Bruno,CA,94066,None Found,Bachelor of Science and 6 years' data science experience OR Master of Science and 4 years' data science experience OR PhD.,None Found,None Found,None Found,None Found,"Position Description
Online Grocery is the next frontier of grocery retailing innovation and Walmart is at the front of it. We know time is just as valuable as money is to our customers and online grocery is helping them to live the life they love.


As part of the Online Grocery Customer Experience Insights team, you will help our customers save time by delivering a more personalized experience on our site. You will be part of a world-class team solving problems on a massive scale and will only be limited by your imagination.

This role will directly contribute to how we merchandise our products on Walmart Grocery and lead to new innovations that make the site experience faster and easier for our customers.
Minimum Qualifications
Bachelor of Science and 6 years' data science experience OR Master of Science and 4 years' data science experience OR PhD.
Additional Preferred Qualifications
Work experience in leading projects implementing machine learning models with huge datasets and providing scalable solutions to business, similar experience in data mining techniques and related fieldsDeep knowledge in quantitative analysis and Statistical techniques, demonstrated by leading implementation of scalable business solutions using such techniques and processing huge datasetsExcellent problem solving and analytical skills, demonstrated by leading projects where such skills are appliedProficient with at least one modern compiled programming language (Java, C++ etc) and one scripting language (Python, Ruby, PHP, Javascript etc.)Extensive Experience with big data technology (Hadoop, Hive, Spark, Hbase, etc.) and data processing pipelineExtensive Experience in leading complex projects from start to end and/or proven distinguished academic backgroundsExtensive experience in grocery retailingExperience in customer clustering/segmentation techniquesStrong skills in database systems (mySQL) and complex SQL queries is a plusAbility to translate results into business actions
Company Summary
The Walmart eCommerce team is rapidly innovating to evolve and define the future state of shopping. As the world’s largest retailer, we are on a mission to help people save money and live better. With the help of some of the brightest minds in technology, merchandising, marketing, supply chain, talent and more, we are reimagining the intersection of digital and physical shopping to help achieve that mission.
Position Summary
Online Grocery is the next frontier of grocery retailing innovation and Walmart is at the front of it. We know time is just as valuable as money is to our customers and online grocery is helping them to live the life they love.


As part of the Online Grocery Customer Experience Insights team, you will help our customers save time by delivering a more personalized experience on our site. You will be part of a world-class team solving problems on a massive scale and will only be limited by your imagination.

This role will directly contribute to how we merchandise our products on Walmart Grocery and lead to new innovations that make the site experience faster and easier for our customers."
113,Data Scientist (Analytics),"San Francisco, CA",San Francisco,CA,None Found,None Found,None Found,None Found,None Found,None Found,None Found,"We’re seeking an exceptional Data Scientist to join us to work on our core products such as our seller and buyer experiences, internal tools, and pricing algorithms. You will drive data-informed decisions for the business and guide our product direction with your insights.

Day to day you will understand business impact, product decisions, use a combination of statistical modeling and business intuition to uncover insights from our data, and build processes to generate robust metrics for teams to track to.
As a Data Scientist you will:
Partner with product, engineering, operations and finance teams to find opportunities, make smart trade-offs, and understand customer impact of new features
Use data to inform, influence, support, and execute our product decisions
Craft statistical models to gain insights from data and communicate results to partners
Build pipelines to automate generation of metrics to guide the business
Become a domain expert in real-estate
We’re looking for teammates who bring:
3+ years of relevant work experience
Comfort and experience building complex SQL queries
Deep understanding of statistics(e.g. hypothesis testing and regressions)
Familiarity with ETL design and analytics workloads, preferably experience in building maintainable pipelines
Highly self-motivated with the desire to solve open-ended problems
Resourcefulness, pragmatism, and ability to drive business impact
Strong verbal, written, and interpersonal communication skills
Bonus points:
You have experience in experimental design and interpretation
You love delighting customers with honest transparent products and experiences


More About Us
Want to learn more about us and how we are revolutionizing the home buying and selling process? Learn more about us on our website, check out our profile on The Muse to learn more about our culture from our team members, or read our blog posts to hear about the work we are doing.

We Offer the Following Benefits and Perks:Full medical, dental, and vision with optional 70% coverage for dependentsFlexible vacation policyEducational budget to invest in your career development and growthFitness/Commuter Benefit stipendGenerous parental leavePaid time off to volunteer
Please note that these benefits and perks are available only to Full Time team members and do not apply to contract roles.

Opendoor values Openness
Our team celebrates our diverse backgrounds. We believe that being open about who we are and what we do allows us to be better. Individuals seeking employment at Opendoor are considered without regards to race, color, religion, national origin, age, sex, marital status, ancestry, physical or mental disability, veteran status, sexual orientation, gender identity or other protected status under all applicable laws, regulations, and ordinances."
114,FY20 Intern Conversion: Data Scientist,"San Bruno, CA 94066",San Bruno,CA,94066,None Found,None Found,None Found,None Found,None Found,None Found,"Position Description

A Data Scientist is responsible for analyzing large data sets to develop custom models and algorithms to drive business solutions. Data Scientists work on project teams in order to provide analytical support to projects (for example, email targeting, business optimization, consumer recommendations) for Walmart eCommerce. Data Scientists are responsible for building large data sets from multiple sources in order to build algorithms for predicting future data characteristics. Those algorithms will be tested, validated, and applied to large data sets. Data Scientists are responsible for training the algorithms so they can be applied to future data sets and provide the appropriate search results. Data Scientists are responsible for researching new trends in the industry and utilizing up-to-date technology (for example, HBase, MapReduce, LAPack, Gurobi) and analytical skills to support their assigned project.
Build complex data sets from multiple data sources, both internally and externally.
Build learning systems to analyze and filter continuous data flows and offline data analysis.
Combine data features to determine search models.
Conduct advanced statistical analysis to determine trends and significant data relationships.
Demonstrates up-to-date expertise and applies this to the development, execution, and improvement of action plans
Develop custom data models to drive innovative business solutions.
Develop models of current state in order to determine needed improvements.
Models compliance with company policies and procedures and supports company mission, values, and standards of ethics and integrity
Provides and supports the implementation of business solutions
Research new techniques and best practices within the industry.
Scale new algorithms to large data sets.
Train algorithms to apply models to new data sets.
Utilize system tools including (MySQL, Hadoop, Weka, R, Matlab,ILog).
Validate models and algorithmic techniques.
Work with cross-functional partners across the business

Minimum Qualifications
Models compliance with company policies and procedures and supports company mission, values, and standards of ethics and integrity
Provides and supports the implementation of business solutions
Research new techniques and best practices within the industry.
Scale new algorithms to large data sets.
Train algorithms to apply models to new data sets.
Utilize system tools including (MySQL, Hadoop, Weka, R, Matlab,ILog).
Validate models and algorithmic techniques.
Work with cross-functional partners across the business
Additional Preferred Qualifications
Please add text
Company Summary
The Walmart eCommerce team is rapidly innovating to evolve and define the future state of shopping. As the world’s largest retailer, we are on a mission to help people save money and live better. With the help of some of the brightest minds in technology, merchandising, marketing, supply chain, talent and more, we are reimagining the intersection of digital and physical shopping to help achieve that mission.
Position Summary
A Data Scientist is responsible for analyzing large data sets to develop custom models and algorithms to drive business solutions. Data Scientists work on project teams in order to provide analytical support to projects (for example, email targeting, business optimization, consumer recommendations) for Walmart eCommerce. Data Scientists are responsible for building large data sets from multiple sources in order to build algorithms for predicting future data characteristics. Those algorithms will be tested, validated, and applied to large data sets. Data Scientists are responsible for training the algorithms so they can be applied to future data sets and provide the appropriate search results. Data Scientists are responsible for researching new trends in the industry and utilizing up-to-date technology (for example, HBase, MapReduce, LAPack, Gurobi) and analytical skills to support their assigned project.
Build complex data sets from multiple data sources, both internally and externally.
Build learning systems to analyze and filter continuous data flows and offline data analysis.
Combine data features to determine search models.
Conduct advanced statistical analysis to determine trends and significant data relationships.
Demonstrates up-to-date expertise and applies this to the development, execution, and improvement of action plans
Develop custom data models to drive innovative business solutions.
Develop models of current state in order to determine needed improvements.
Models compliance with company policies and procedures and supports company mission, values, and standards of ethics and integrity
Provides and supports the implementation of business solutions
Research new techniques and best practices within the industry.
Scale new algorithms to large data sets.
Train algorithms to apply models to new data sets.
Utilize system tools including (MySQL, Hadoop, Weka, R, Matlab,ILog).
Validate models and algorithmic techniques.
Work with cross-functional partners across the business"
115,Data Scientist - Customer Analytics,"San Bruno, CA 94066",San Bruno,CA,94066,None Found,"Proven work experience as a data scientist or analyst.Master’s degree in Statistics, Mathematics, Computer Science or related quantitative field or similar Bachelor’s degree with 3 years of analytics experience.2 to 3 years of experience working with and manipulating large data sets.2 to 3 years of experience with applied statistical skills, such as distribution, regression, etc.2 to 3 years of experience with SQL. Experience with Hadoop, Hive, or Spark a plus.2 to 3 years of experience with BI tools such as Tableau, Metabase, Periscope, or Looker.2 to 3 years of experience documenting, visualizing and presenting insights to stakeholders.2 to 3 years of experience working with statistical programming tools such as Python or R.Excellent critical thinking skills with an emphasis on problem solving and decision making.Excellent project and stakeholder management skills.Excellent organizational and time management skills.Excellent written and verbal communication.",None Found,None Found,None Found,None Found,"Position Description
Our Customer Science organization is looking for a Data Scientist to come join our fast-growing Customer Analytics team. The ideal candidate will deliver action focused customer insights and analytics capabilities to business partners across the Walmart organization. This is an excellent opportunity for a successful candidate to discover and solution against real customer problems and help build innovative customer experiences. You will collaborate with leading data scientists, data engineers and business leaders. You will analyze some of the largest data sets and leverage an array of industry-leading data science tools and technologies.

The Customer Analytics team analyzes customer behavior to identify trends, patterns and insights to help business partners identify opportunities, solve problems and make business decisions. We participate in a wide array of customer projects, some of which are cohort analysis, LTV, segmentation, clustering, and competitive analysis. The team sits within the Customer Organization and supports all business functions, e.g. Leadership, Finance, Retail, Marketing, Product, and Customer Service. We are laser focused and in search of opportunities to build long-lasting relationships with Walmart’s customers.

We are looking for a motivated, team-oriented individual to come join a great company, work with great people, learn some new things, solve interesting problems, and help Walmart on its journey to build great customer experiences.

Job Responsibilities:
Deliver insights & recommendations in support of business challenges and decision making.Deliver compelling presentation, data visualization and customer analysis.Deliver dashboards and reports in support customer analytics initiatives.Utilize analytical, statistical and programming techniques to analyze complex data sets to better understand customer behavior, build analytics capabilities, and identify customer experience opportunities.Develop methods and advanced statistical models to understand and predict customer behavior and drivers of growth.Manage multiple projects and business stakeholders at a time.Manage offshore analytics resources to enable efficient delivery of project work.
Minimum Qualifications
Proven work experience as a data scientist or analyst.Master’s degree in Statistics, Mathematics, Computer Science or related quantitative field or similar Bachelor’s degree with 3 years of analytics experience.2 to 3 years of experience working with and manipulating large data sets.2 to 3 years of experience with applied statistical skills, such as distribution, regression, etc.2 to 3 years of experience with SQL. Experience with Hadoop, Hive, or Spark a plus.2 to 3 years of experience with BI tools such as Tableau, Metabase, Periscope, or Looker.2 to 3 years of experience documenting, visualizing and presenting insights to stakeholders.2 to 3 years of experience working with statistical programming tools such as Python or R.Excellent critical thinking skills with an emphasis on problem solving and decision making.Excellent project and stakeholder management skills.Excellent organizational and time management skills.Excellent written and verbal communication.
Additional Preferred Qualifications

Company Summary
The Walmart eCommerce team is rapidly innovating to evolve and define the future state of shopping. As the world’s largest retailer, we are on a mission to help people save money and live better. With the help of some of the brightest minds in technology, merchandising, marketing, supply chain, talent and more, we are reimagining the intersection of digital and physical shopping to help achieve that mission.
Position Summary
Our Customer Science organization is looking for a Data Scientist to come join our fast-growing Customer Analytics team. The ideal candidate will deliver action focused customer insights and analytics capabilities to business partners across the Walmart organization. This is an excellent opportunity for a successful candidate to discover and solution against real customer problems and help build innovative customer experiences. You will collaborate with leading data scientists, data engineers and business leaders. You will analyze some of the largest data sets and leverage an array of industry-leading data science tools and technologies.

The Customer Analytics team analyzes customer behavior to identify trends, patterns and insights to help business partners identify opportunities, solve problems and make business decisions. We participate in a wide array of customer projects, some of which are cohort analysis, LTV, segmentation, clustering, and competitive analysis. The team sits within the Customer Organization and supports all business functions, e.g. Leadership, Finance, Retail, Marketing, Product, and Customer Service. We are laser focused and in search of opportunities to build long-lasting relationships with Walmart’s customers.

We are looking for a motivated, team-oriented individual to come join a great company, work with great people, learn some new things, solve interesting problems, and help Walmart on its journey to build great customer experiences.

Job Responsibilities:
Deliver insights & recommendations in support of business challenges and decision making.Deliver compelling presentation, data visualization and customer analysis.Deliver dashboards and reports in support customer analytics initiatives.Utilize analytical, statistical and programming techniques to analyze complex data sets to better understand customer behavior, build analytics capabilities, and identify customer experience opportunities.Develop methods and advanced statistical models to understand and predict customer behavior and drivers of growth.Manage multiple projects and business stakeholders at a time.Manage offshore analytics resources to enable efficient delivery of project work."
