,Title,Location,City,State,Zip,Country,Qualifications,Skills,Responsibilities,Education,Requirement,FullDescriptions
54,Data Science Intern,"San Francisco, CA 94105",San Francisco,CA,94105,None Found,None Found,None Found,"
Supporting data science projects in data acquisition, cleaning, processing.
Researching predictive algorithms using large amounts of structured and unstructured data.
Designing experiments to determine efficacy of solutions.
Providing on-going performance monitoring of decision systems and statistical models
First cohort runs from 5/18/2020 - 8/7/2020 for semesters students
Second cohort runs from 6/15/2020 - 9/4/2020 for quarters students",None Found,None Found,"Summary
Team. Culture. Community. That’s Life at Esurance!

The Esurance Internship Program is a 12 week summer program offering students an opportunity to explore our culture, gain business expertise, and provide innovative solutions to enhance our organization. We’re looking for a Data Science Intern to join our dynamic team of individuals who are committed to making insurance surprisingly painless! We’re a socially conscious company that’s focused on creating a diverse work environment.
Responsibilities
What our Data Science & Analytics Group is all about:
Esurance has created a centralized data science & analytics (DSA) group that is responsible for helping business units make objective decisions using data. The group supports the company’s overall business operations by delivering critical analytical insights and in-depth consultative analyses to senior management teams and our business partners.

What we’ve accomplished:
We have exploited our rich data repositories, industry-competitive data science tools, expertise and business SME knowledge to collaboratively build several machine learning models and applications which are used by our customers and associates on a daily basis across the range of operations of the company. Applications include accurate insurance pricing, customer lifetime value prediction, severe injury detection in Claims and prediction of customer churn.

What we’re working on:
We are building and deploying state-of-art machine learning and AI models to help our Claims, Product Pricing, Marketing, Sales and Service teams realize business value through automation, improved process efficiencies and optimal decision-making. Our recent efforts leverage deep learning expertise in NLP to take advantage of unstructured text data available in Claims reports, customer survey responses, emails and virtual chat sessions to uncover actionable insights.

What you’ll do:
As an intern of DSA, you will collaborate with some of our senior data scientists on various projects, a valuable opportunity to gain hands-on industrial experience for someone with career focus as a future data scientist. The data science intern will work closely with some senior team members with the following responsibilities:
Supporting data science projects in data acquisition, cleaning, processing.
Researching predictive algorithms using large amounts of structured and unstructured data.
Designing experiments to determine efficacy of solutions.
Providing on-going performance monitoring of decision systems and statistical models
First cohort runs from 5/18/2020 - 8/7/2020 for semesters students
Second cohort runs from 6/15/2020 - 9/4/2020 for quarters students
What we’re looking for:
Candidates in a Masters or PhD program are strongly preferred.
Minimum GPA: 3.4
Demonstrate a strong interest in data science as a future career.
Excellent knowledge of a language for statistical and scientific computing (R, Python, etc.).
Extensive experience in data management and data scrubbing.
Strong aptitude towards math and programming.
Ability to communicate complex information in a way that is clear and easily understood.
Prior exposure to machine learning techniques such as dimension reduction, regression, clustering, and classification to solve real-world problems.
Benefits
Why you’ll love interning with us:
Compensation is nice! 12-week PAID summer internship. 40 hours per week
You’ll be matched to a meaningful project that will build on your skills and background
Tackling complex, real-world problems, you’ll have the opportunity to own your projects from start to finish, all while working as part of a team!
Attend new hire orientation with your cohort on your first day
Professional Opportunities: Exposure to Esurance Executives, Work alongside skilled industry veterans and Participate in a Professional Development Course
Development Opportunities: Personal manager and mentor, Hands-on coaching and development, Exciting learning opportunities
Personal Opportunities: Weekly social events and lunches, A Volunteer Day (Community Service), Great location in San Francisco’s Financial District, Walking distance to popular attractions
Presenting your work: You will have two opportunities to present in front of the leadership team and your colleagues. Presentations will allow you to share what you have learned throughout your experience.
Learn more about us:

Esurance combines the spunk of a startup with the backing of Allstate (the largest publicly held personal lines insurer in the U.S.) to create a unique, energized, and exciting place to work.

To learn more about Life at Esurance, please review our Glassdoor page and see why our employees love to work for us!"
55,Senior Data Scientist,"Berkeley, CA",Berkeley,CA,None Found,None Found,None Found,None Found,None Found,None Found,None Found,"Senior Data Scientist
Senior Data Scientists on our team partner with product managers, SMEs and our clients to form a cross-functional team driving optimization of precious healthcare resources.

We are looking for strong, enthusiastic data scientists to join the team focusing on value creating products. With access to more than 55 million consumer healthcare datasets, our Data Scientists rely heavily on insights gained from data to guide feature development and metrics to detect optimization opportunities and improvements in healthcare delivery. The clarity and insights that our team provides enables our clients to quickly extract value from our collective efforts.


Job responsibilities include:
Inform product strategy, influence the product roadmap, and guide product decisions by:
Accessing and analyzing rich healthcare data to generate insights and make proactive recommendations.
Formulating success metrics for optimizing healthcare resources and patient experience, creating visualization to monitor them.
Designing and analyzing experiments to test new ideas for optimizing improving our clients precious resources.
Developing models and data-driven solutions that add material insight to our clients understanding of their business and their business environment

Cogitativo's data is amazingly rich and provides a fantastic opportunity for Data Scientists to explore and create, ultimately developing ways to improve our healthcare system.
You'll have the opportunity to work with some of the best data people anywhere in an environment that truly values data-driven decisions.

Required qualifications include:

Minimum five years' experience as a Data Scientist
PhD or Masters in a quantitative discipline: Computer Science, Statistics, Applied Mathematics, Operations Research, Engineering
Working knowledge of health care systems and healthcare terminology
Expert in analyzing large complex, multi-dimensional data sets with a variety of tools
Ability to thrive and demonstrate constant applied learning in highly complex, interdisciplinary, and dynamic work environment
Strong programming experience in R, or Python

If you're up to making an impact on humanity and this position sounds like an attractive match for you; contact us!"
56,Data Operations Associate (Alternative Hours),"Oakland, CA 94612",Oakland,CA,94612,None Found,"
You have strong Ediscovery technical fluency and are familiar with data ingestion in Ediscovery platforms. You are also familiar with other technical platforms including all MS Office applications, zip/compression tools, data manipulation tools, and have an interest in learning new technologies
You're ready to work either East Coast business hours, starting at 6 am and ending in the early afternoon or evening hours, starting at 12:00 pm PST and ending at 9:00 pm
You have excellent multi-tasking abilities and attention to detail, handling multiple responsibilities at the same time
You're a quick, eager, and proactive learner
You’re a natural problem-solver and enjoy digging into questions that require broad knowledge and precision
You work well in a team and are able to follow and help improve complex processes
Authorization to work in the US; please note that Everlaw is not sponsoring visas for any positions at this time.",None Found,"
Owning the process of uploading client data into our platform and being responsible for data quality and timeliness
Using the Everlaw platform and other tools to troubleshoot issues with documents and other file types, while working with our developers to find solutions when necessary
Managing large data upload projects or migration tasks that require coordinating with multiple team members and other teams
Communicating with clients and other teams about the status of their projects
",None Found,None Found,"We're looking for a Data Operations Associate (Alternative Hours) to join our Customer Success team!

Data and data processing are part of the foundation of Everlaw’s business and critical for the litigation and investigations hosted on our platform. In this role, you will be responsible for data ingestion, quality control, and consulting with clients on complex data migrations. Our ideal candidate is someone with Ediscovery data experience who is highly-organized, with exceptional attention to detail and strong technical fluency.

Additionally, you should be ready, willing, and eager to work either East Coast business hours starting at 6 am PST and leaving in the early afternoon or an evening shift, starting at 12:00 pm PST and leaving at 9:00 pm PST. This position is a particularly good fit for someone interested in joining a fast-growing startup and helping it scale, while working non-traditional hours.

If this sounds like a good fit, we’d love to hear from you! This is a full-time on-site position located in Oakland, California.

Please note that this is not a Data Scientist role.
Responsibilities
Owning the process of uploading client data into our platform and being responsible for data quality and timeliness
Using the Everlaw platform and other tools to troubleshoot issues with documents and other file types, while working with our developers to find solutions when necessary
Managing large data upload projects or migration tasks that require coordinating with multiple team members and other teams
Communicating with clients and other teams about the status of their projects
Qualifications
You have strong Ediscovery technical fluency and are familiar with data ingestion in Ediscovery platforms. You are also familiar with other technical platforms including all MS Office applications, zip/compression tools, data manipulation tools, and have an interest in learning new technologies
You're ready to work either East Coast business hours, starting at 6 am and ending in the early afternoon or evening hours, starting at 12:00 pm PST and ending at 9:00 pm
You have excellent multi-tasking abilities and attention to detail, handling multiple responsibilities at the same time
You're a quick, eager, and proactive learner
You’re a natural problem-solver and enjoy digging into questions that require broad knowledge and precision
You work well in a team and are able to follow and help improve complex processes
Authorization to work in the US; please note that Everlaw is not sponsoring visas for any positions at this time.
Pluses
You have significant experience with litigation technology tools and the associated data formats (e.g. load files)
You have experience with law
You have experience with project management
Benefits
Competitive salary
Substantial equity
401k with company matching
Health, dental, and vision
Flexible Spending Accounts for health and dependent care expenses
Paid parental leave and sick leave
Seventeen paid vacation days plus ten bankable federal holidays
Generous annual allocation for Learning & Development opportunities
Company-sponsored life and disability insurance
Reimbursement of bar membership
Perks
Work in Downtown Oakland, just steps from the BART line and dozens of restaurants
Select your preference of hardware (Mac or PC) and customize your desk setup
Bond over team lunches and out-of-the-box events
Voted one of ""San Francisco Bay Area's Best and Brightest Companies"" and one of ""Inc Magazine's Best Workplaces""


About Everlaw

We help law firms, government agencies, and corporations sift through millions of documents of evidence in big lawsuits and investigations to find the proverbial smoking gun (or needle in the haystack - pick your metaphor). It's a multi-billion dollar space typically dominated by service-oriented vendors, and we're coming at it with cutting-edge technology and elegant design. It's working, and we've been growing very rapidly: we host hundreds of terabytes of data and work with all 50 state Attorneys General and hundreds of law firms on some of the most high-profile cases litigated today.

If you’re looking for an open, democratic company culture that values passion, integrity, and a desire to learn, we want to hear from you.

Everlaw is an equal opportunity employer. We pride ourselves on having a diverse workforce and we do not discriminate against any employee or applicant because of race, creed, color, religion, gender, sexual orientation, gender identity/expression, national origin, disability, age, genetic information, veteran status, marital status, pregnancy or related condition, or any other basis protected by law. We respect the gender, gender identity and gender expression of our applicants and employees, and we honor requests for preferred pronouns. It is our policy to comply with all applicable national, state and local laws pertaining to nondiscrimination and equal opportunity."
57,Data Scientist (Predictive Services),"San Francisco, CA",San Francisco,CA,None Found,None Found,None Found,None Found,None Found,None Found,None Found,"We’re seeking an exceptional Data Scientist to join us in building data products at the core of the company. We build valuation models, predictive modeling infrastructure, and lead growth experiments. Day to day, it’s a mix of machine learning, crowdsourcing, exploratory data analysis, feature extraction, and software engineering.
As a Data Scientist you will:
Improve our industry-leading home valuation model using millions of real-estate transactions and complementary datasets
Rapidly prototype features and predictive models
Build ML pipelines in production
Identify, research, and analyze new data sources to improve model accuracy
Become a domain expert in real-estate
Coordinate with product, engineering, and operations to understand impact and trade-offs of modeling improvements
We’re looking for teammates who bring:
Commitment to rigorous analysis and production-quality code
Passion for building solid data infrastructure
A love of tackling complexity in real-world datasets such as geo data and transaction data
Experience in one of Python, R, Java, Scala, Julia; if R or Julia, candidate must be able to make algorithms scale
Familiarity with basic classes of ML algorithms, concepts in feature extraction and selection
Ability and desire to communicate your analysis with clarity and precision
Resourcefulness and pragmatism
Bonus points:
Competition experience in data mining or machine learning
You love delighting customers with honest, transparent products and experiences
Experience with GIS data
More About Us
Want to learn more about us and how we are revolutionizing the home buying and selling process? Learn more about us on our website, check out our profile on The Muse to learn more about our culture from our team members, or read our blog posts to hear about the work we are doing.

We Offer the Following Benefits and Perks:Full medical, dental, and vision with optional 70% coverage for dependentsFlexible vacation policyEducational budget to invest in your career development and growthFitness/Commuter Benefit stipendGenerous parental leavePaid time off to volunteer
Please note that these benefits and perks are available only to Full Time team members and do not apply to contract roles.

Opendoor values Openness
Our team celebrates our diverse backgrounds. We believe that being open about who we are and what we do allows us to be better. Individuals seeking employment at Opendoor are considered without regards to race, color, religion, national origin, age, sex, marital status, ancestry, physical or mental disability, veteran status, sexual orientation, gender identity or other protected status under all applicable laws, regulations, and ordinances."
58,"Sr. Data Scientist, Zillow Closing Services","San Francisco, CA 94102",San Francisco,CA,94102,None Found,None Found,None Found,None Found,None Found,None Found,"About the team
Zillow Group is transforming the way homes are bought and sold. The Zillow Closing Services team is focused on streamlining all of the steps involved in a real estate transaction.We are looking for a Senior Data Scientist to join our Decision Science team, focusing on insights to inform product strategy and improve operational efficiency. You will be based in San Francisco and work closely with teams in other offices and functions including strategy, product management, design, artificial intelligence and data engineering.
About the role
Inform the product development road map by driving objective, data-based decision making in goal setting and initiatives prioritization, design and success evaluation.
Define key product metrics and leading indicators, develop tools and dashboards to make these metrics reliable and useful.
Build key data sets to empower operational and exploratory analysis.
Partner with product and engineering to implement, document, validate and monitor logging.
Bring more rigor to statistics/experimentation so that we make optimal decisions with the data we have in assessing the impact of product initiatives.
Perform exploratory analysis and modeling to support new features.
Who you are
You will not shy away from complexity or uncertainty. You will develop a deep understanding of our mission, business models, and personas. We want you to use that intuition you've developed (both in business and real life) to find opportunities for growth and cultivate insights from our massive data sets.
An undergraduate or Master's degree in a quantitative field (e.g. science, engineering, economics, finance, statistics, or similar) or demonstrable experience within data science and analytics
5+ years of work experience involving quantitative data analysis and complex problem solving (preferably focused on operations or enterprise software).
Highly proficient with SQL, using Python and/or R for data preparation/analysis/modeling, creating data visualizations with Tableau/Mode
Experience with big data environments (e.g. Presto/Hive/Redshift)
Able to apply past experience with A/B testing, experimentation frameworks and best practices to guide org in building this capability
Able to effectively communicate and deliver findings and recommendations to non-technical stakeholders in a clear and compelling fashion
Get to know us
Zillow Group houses the largest portfolio of real estate brands on mobile and the web. We are on a mission to rewire the real estate transaction and are building transformational tools and services that make it easier for everyone to find and get into a home they love. We are working to create an on-demand real estate transaction experience for every stage of the home lifecycle - for buyers, sellers, renters and borrowers - and we're well on our way. No matter what job you're in, you will play a critical role in making this vision a reality for millions of people.
At Zillow Group, we're powered by our inclusive work culture, where everyone has the support and resources to do the best work of their careers. Our efforts to streamline the real estate transaction is supported by our passion to empower people and enrich lives around everything home, a deep-rooted culture of innovation, a fundamental commitment to Equity and Belonging, and world-class benefits. But, don't just take our word for it. Read our reviews on Glassdoor and recent recognition from multiple organizations, including: Fortune 100 Best Companies to Work For (#69), Fortune Best Workplaces for Diversity (#38), Fortune Best Workplaces for Parents (#31), Fortune Best Workplaces for Women (#20), Fatherly's Best Workplaces for New Dads (#37), JUST Capital 100 Company (#69), Bloomberg Gender Equality Index constituent.
Zillow Group is an equal opportunity employer committed to fostering an inclusive, innovative environment with the best employees. Therefore, we provide employment opportunities without regard to age, race, color, ancestry, national origin, religion, disability, sex, gender identity or expression, sexual orientation, or any other protected status in accordance with applicable law. If there are preparations we can make to help ensure you have a comfortable and positive interview experience, please let us know."
