,Title,Location,City,State,Zip,Country,Qualifications,Skills,Responsibilities,Education,Requirement,FullDescriptions
161,Senior Data Scientist,"San Francisco, CA",San Francisco,CA,None Found,None Found,"
5+ years of experience in data science and/or engineering OR relevant graduate degree with 2+ years of experience
Proven track record of delivering wins with quantitative models
Solid programming skills, particularly around data pipelines and production ML services
Driven by a curiosity to explore user interaction data, using this to inform or feed into products - using the standard data science stack
Willingness to collaborate and communicate with others to drive projects to completion, working outside any narrowly defined roles
A passion for improving education and learning",None Found,None Found,None Found,None Found,"Quizlet’s mission is to help students (and their teachers) practice and master whatever they are learning. Every month more than 50 million active learners from 130 countries practice and master more than 300 million study sets on every conceivable topic and subject. We are developing new learning experiences by modeling how students learn and drawing upon knowledge acquisition, retention, and pedagogy in cognitive science. We are always seeking to help students master any subject by optimizing study efficiency and engagement.
The Role
Leverage machine learning / quantitative modeling to build smarter products, being involved from conception to production
Build, maintain, and improve data products and pipelines consumable by product development teams, with full ownership for these services
Maintain a balance between scientifically rigorous solutions and shipping things quickly to get results
Publish results in various formats e.g. blog posts, conference posters and papers
Example Projects
Build and implement our first models for revenue optimization
Recommendations of content to study
Improve our subject taxonomy classification of our 300M+ study sets
Requires Qualifications
5+ years of experience in data science and/or engineering OR relevant graduate degree with 2+ years of experience
Proven track record of delivering wins with quantitative models
Solid programming skills, particularly around data pipelines and production ML services
Driven by a curiosity to explore user interaction data, using this to inform or feed into products - using the standard data science stack
Willingness to collaborate and communicate with others to drive projects to completion, working outside any narrowly defined roles
A passion for improving education and learning
Preferred Qualifications
Experience with Google Cloud Platform, Airflow
Experience with NLP models
We hope you are excited about everything you read so far. We highly encourage you to apply for this position, even if you feel you do not meet all the requirements. Quizlet is always looking for amazing folks that believe in our mission and can contribute to our team in various ways - not merely candidates that fit a certain mold.

Quizlet's Team Culture

We are here to make education better and more accessible. We strive to improve the lives of students and teachers at every stage and in every setting. We have a bias for action, take initiative, and hustle to deliver results. We make informed decisions whenever possible but are unafraid to take calculated risks on great ideas to promote learning. We embrace challenges and see effort as the path to mastery. We’re constantly seeking opportunities to learn and we embrace curiosity. Quality matters at Quizlet, and we hold the bar high on everything we do. We sweat the details and take personal accountability and pride in anything that carries the Quizlet name. We speak up, jump in and work with each other to fix problems, and never say ""that's not my job."" We treat each other with honesty and respect, encourage vigorous debate, and seek critical feedback. We value diversity, humility, transparency, and collaboration as the best paths to our success — as individuals, as a team, and as a company.

Quizlet’s success as an online learning community depends on a strong commitment to diversity, equity and inclusion. We are actively working to build a team that is representative of the diverse communities we serve, and an open, inclusive work environment where all employees can thrive. As an equal opportunity employer and a tech company committed to societal change, we welcome applicants from all backgrounds. Women, people of color, members of the LGBTQ+ community, individuals with disabilities, and veterans are strongly encouraged to apply. Come join us!"
162,Senior Data Scientist,"San Francisco, CA 94103",San Francisco,CA,94103,None Found,None Found,None Found,"
Mine and analyze data from all available data sources to support product development efforts
Track product usage, build churn models and present actionable insights to leadership teams
Design, monitor and analyze controlled experiments (A/B, multivariate)
Build predictive models to optimize the customer’s journey throughout Quantcast's product suite
Collaborate with Product Managers and relevant functions to help evolve Quantcast’s product offerings
Ensure excellence in process and workflow within the department as well as across other functions, such as Ad Ops, Client Strategy, Engineering, Modeling and Product Development
Present findings in client-facing settings or to other external partners as needed",None Found,"
Bachelor’s degree in a quantitative field (computer science, mathematics, statistics, bioinformatics, etc.) or equivalent experience - Master’s degree is a plus
Advanced knowledge of causal inference preferred
Five plus years of experience in a digital or technology company with a focus on data science
Proficiency with Postgres SQL (or any form of SQL) is required
Expert at mentoring other team members in the use of data science tools such as R, Python, Julia,SQL, MapReduce, Hadoop, Hive and Big Data technologies
Significant experience extracting, transforming and working with large sets of data
Experience working with large amounts of structured and unstructured data
Strong analytical, strategic and creative problem solver
Ability to remain calm under pressure and strict deadlines
Provide feedback for enhancements to current Product Suite
Experience with designing,analyzing and troubleshooting controlled experiments (causal A/B tests, multivariate tests)
Strong project management and communication skills to support internal operational teams
Excellent communication skills; ability to convey complex analysis results clearly and concisely with conviction to all levels of partners
Interest in D3, R shiny and other front end visualization platforms highly desirable
Ability to manage AWS EC2 instances for custom research playground is a huge plus","Quantcast is a premier leader in artificial intelligence (AI) and addressable advertising. We are focused on real-time, targeted advertising services that are revolutionizing the display advertising industry. Essentially, we are using AI and big data to take the evil out of advertising on the web!

We are looking for an exceptional Senior Data Scientist to join our diverse set of researchers, analysts and machine learning engineers. These are true product management roles that guide development of our products, shape the future of advertising and help marketers and agencies to connect with their audiences.
Responsibilities
Mine and analyze data from all available data sources to support product development efforts
Track product usage, build churn models and present actionable insights to leadership teams
Design, monitor and analyze controlled experiments (A/B, multivariate)
Build predictive models to optimize the customer’s journey throughout Quantcast's product suite
Collaborate with Product Managers and relevant functions to help evolve Quantcast’s product offerings
Ensure excellence in process and workflow within the department as well as across other functions, such as Ad Ops, Client Strategy, Engineering, Modeling and Product Development
Present findings in client-facing settings or to other external partners as needed
Requirements
Bachelor’s degree in a quantitative field (computer science, mathematics, statistics, bioinformatics, etc.) or equivalent experience - Master’s degree is a plus
Advanced knowledge of causal inference preferred
Five plus years of experience in a digital or technology company with a focus on data science
Proficiency with Postgres SQL (or any form of SQL) is required
Expert at mentoring other team members in the use of data science tools such as R, Python, Julia,SQL, MapReduce, Hadoop, Hive and Big Data technologies
Significant experience extracting, transforming and working with large sets of data
Experience working with large amounts of structured and unstructured data
Strong analytical, strategic and creative problem solver
Ability to remain calm under pressure and strict deadlines
Provide feedback for enhancements to current Product Suite
Experience with designing,analyzing and troubleshooting controlled experiments (causal A/B tests, multivariate tests)
Strong project management and communication skills to support internal operational teams
Excellent communication skills; ability to convey complex analysis results clearly and concisely with conviction to all levels of partners
Interest in D3, R shiny and other front end visualization platforms highly desirable
Ability to manage AWS EC2 instances for custom research playground is a huge plus
Quantcast owns and operates the world’s largest audience insights and measurement platform on the open internet. Fueled by live data drawn from more than 100 million web and mobile destinations, Quantcast applies machine learning technology to help marketers, publishers, and agencies grow their brands by better understanding and predicting consumer interactions in real-time.

Founded in 2006, Quantcast is headquartered in San Francisco and has employees in over 20 offices across 10 countries. We are committed to building an inclusive and diverse environment where everyone can be their authentic self."
163,"Data Scientist, Recommendation and Ranking (SF)","San Francisco, CA",San Francisco,CA,None Found,None Found,None Found,None Found,None Found,None Found,None Found,"Etsy is looking for a Data Scientist focusing on Recommendation and Ranking to join our Data Science - Machine Learning team in San Francisco.

Etsy is looking for a Data Scientist to join our Data Science team in San Francisco, California. We are committed to advancing E-commerce related fields by building technologies that help Etsy buyers and sellers discover and celebrate handmade goods from all over the world. We are seeking individuals passionate in areas such as search ranking, recommender systems, information retrieval, and computational advertising.

Our data scientists have the opportunity to make core algorithmic advances and apply their ideas in the dynamic world of E-commerce in strengthening Etsy’s global marketplace. Data scientists can publish their innovations at top tier conferences such as KDD, NIPS, ICML, ICLR, CVPR, ICCV, WWW, WSDM, SIGIR and etc. This position would be based in San Francisco, California.
About the Role
We are working on:
Search Ranking
Recommender System
Computational Advertising Ranking
Information Retrieval
Learning to RankDeep
Learning to MatchQuery
UnderstandingIntent Understanding
About You
You share our values (below) and are looking for a company that has a solid mission.
You have strong analytical and quantitative skills. You are familiar with techniques in Recommender Systems, Information Retrieval, Computational Advertising, Search Ranking, Learning To Rank, Deep Learning to Match or related fields.
You have a Ph.D. degree or Master degree in Computer Science, Machine Learning, or related fields.
You have strong technical and programming skills. You are familiar with relevant technologies and languages (e.g. Python, Java, Scala, C++ and etc.). You have experience in or desire to learn Hadoop/Spark related Big Data technologies.
You have demonstrated the capability to review and write technical papers.
You can contribute to research that can be applied to Etsy products.
You have the ability to quickly prototype ideas and solve complex problems by adapting creative approaches.
You are a strong collaborator and communicator and you make the engineers around you grow and learn.


What’s Next

Interested in working with us? Send us a cover letter and your CV or resume explaining why you’d be great for the job. We value your unique talents and point of view, so feel free to tell us what you are all about. And if you write, draw, craft, or contribute to something you’re proud of, we’d love to hear about it.
At Etsy, we believe that a diverse, equitable and inclusive workplace makes us a more relevant, more competitive, and more resilient company. We welcome people from all backgrounds, ethnicities, cultures, and experiences. Etsy is an equal opportunity employer. We do not discriminate on the basis of race, color, ancestry, religion, national origin, sexual orientation, age, citizenship, marital or family status, disability, gender identity or expression, veteran status, or any other legally protected status."
164,Data Scientist - Trading Technologies,"San Francisco, CA",San Francisco,CA,None Found,None Found,"
PhD or Master’s degree in Statistics, Physics, Mathematics, Econometrics, or related field
Extensive knowledge of machine learning techniques and ability to apply them at professional level.
Experience with distributed analytical technologies (Spark, Hive, Hadoop)
Excellent skills in SQL, statistical packages in Python/R. Willingness to learn new languages if required.
Data visualization skills to communicate data driven insights
Exceptional communication and interpersonal skills
Entrepreneurial attitude towards problem solving and driving innovation and change in a geographically distributed team environment",None Found,"
Partner with various stakeholders in providing actionable data driven insights to improve the products.
Develop anomaly detection, and data modelling tools to monitor key performance indicators to improve the efficiency of the products.
Build self-serve tools (dashboards, analytics tools) for leadership and product management to monitor and improve product efficiency
Design experiments for product team to test hypothesis and help with idea generation and refinement
Lead enterprise level analytics framework to aid product analytics. Be a voice for data across organization.
Experience with story-telling in presenting data insights.
Build key datasets and data pipelines using Python/ETL frameworks",None Found,None Found,"About Kraken

Our mission is to accelerate the adoption of cryptocurrency so that you and the rest of the world can achieve financial freedom and inclusion. Founded in 2011 and with over 4 million clients, Kraken is one of the world's largest, most successful bitcoin exchanges and we're growing faster than ever. Our range of successful products are playing an important role in the mainstream adoption of crypto assets. We attract people who constantly push themselves to think differently and chart exciting new paths in a rapidly growing industry. Kraken is a diverse group of dreamers and doers who see value in being radically transparent. Let's change the way the world thinks about money! Join the revolution!

About the Role

This is a fully remote role, we will consider applicants based in North America, South America.

Kraken is looking for a data scientist who is a self-starter and an excellent team player. You will be part of a team who is building cutting-edge trading products in cryptocurrency industry.

You will be responsible for transforming data into insights at Kraken. You will collaborate with product management, engineering and data team to build advanced analytics leveraging data to discover opportunities, insights and help improve performance of trading products and business.

Our technology team is having a blast while delivering the most sophisticated crypto-trading platform out there. Help us continue to define and lead the industry.
Responsibilities:
Partner with various stakeholders in providing actionable data driven insights to improve the products.
Develop anomaly detection, and data modelling tools to monitor key performance indicators to improve the efficiency of the products.
Build self-serve tools (dashboards, analytics tools) for leadership and product management to monitor and improve product efficiency
Design experiments for product team to test hypothesis and help with idea generation and refinement
Lead enterprise level analytics framework to aid product analytics. Be a voice for data across organization.
Experience with story-telling in presenting data insights.
Build key datasets and data pipelines using Python/ETL frameworks
Qualifications:
PhD or Master’s degree in Statistics, Physics, Mathematics, Econometrics, or related field
Extensive knowledge of machine learning techniques and ability to apply them at professional level.
Experience with distributed analytical technologies (Spark, Hive, Hadoop)
Excellent skills in SQL, statistical packages in Python/R. Willingness to learn new languages if required.
Data visualization skills to communicate data driven insights
Exceptional communication and interpersonal skills
Entrepreneurial attitude towards problem solving and driving innovation and change in a geographically distributed team environment
Preferred Qualifications:
Experience in fintech related technologies is a plus
Knowledge of tools such as Tableau, Looker, etc.
Knowledge of Jupyter Notebooks (or similar) for story-telling using data.
We’re powered by people from around the world with their own unique backgrounds and experiences. We value all Krakenites and their talents, contributions, and perspectives.

Check out all our open roles at https://jobs.lever.co/kraken. We’re excited to see what you’re made of.

Learn more about us:

Watch ""Working at Kraken""
Follow us on Twitter
Catch up on our blog"
165,Data Scientist,"San Francisco, CA 94105",San Francisco,CA,94105,None Found,None Found,None Found,None Found,None Found,None Found,"Job Category
Products and Technology
Job Details
The Data Science Solutions team in Salesforce’s Customer Success and Growth (CSG) organization structures customer data and creates data science products that drive customer success. The team works with executives, success managers, sales and renewal managers, and product managers across CSG to discover and analyze opportunities for growth and optimization and to provide actionable insights.
As a Data Scientist, you will work with and analyze large amounts of product usage and business data. You will play a key role empowering business groups – helping them formulate strategies and improve business processes by measuring and optimizing their impact – ultimately improving how Salesforce engages with and delivers value to its customers.
In detail, you will:
Work with large amounts of structured and unstructured data.
Work with internal stakeholders to explore and understand business data.
Formulate and test hypotheses to evaluate business strategies and measure impact.
Apply complex analytical techniques.
Design and implement ML applications.
Author reports and presentations to communicate your process and results.
Preferred Experience and Skills:
Bachelor or Masters degree in Physics, Mathematics, Statistics, Computer Science or related field with project experience in data analysis, statistical modeling and hypothesis testing.
Working knowledge of one or more SQL languages: Oracle, MySQL, PostgreSQL, Redshift, etc.
Working knowledge of one or more statistical analysis packages: R, SPSS, SAS, Numpy/Scipy, etc.
Development experience in at least one programming language: Python, Java, C++, etc.
Knowledge of Machine Learning concepts: e.g., cross-validation, regularization, boosting, bootstrapping, etc.
Strong written and verbal communication skills.
Experience with large data sets and distributed computing (Hive/Hadoop) is a plus.
Experience with one or more Business Intelligence and visualization tools (Business Objects, Tableau, ChartIO, JMP, etc.) is a plus.
Salesforce experience/certification is a huge plus but not required.
Posting Statement
Salesforce.com and Salesforce.org are Equal Employment Opportunity and Affirmative Action Employers. Qualified applicants will receive consideration for employment without regard to race, color, religion, sex, sexual orientation, gender perception or identity, national origin, age, marital status, protected veteran status, or disability status. Headhunters and recruitment agencies may not submit resumes/CVs through this Web site or directly to managers. Salesforce.com and Salesforce.org do not accept unsolicited headhunter and agency resumes. Salesforce.com and Salesforce.org will not pay fees to any third-party agency or company that does not have a signed agreement with Salesforce.com or Salesforce.org.
Pursuant to the San Francisco Fair Chance Ordinance and the Los Angeles Fair Chance Initiative for Hiring, Salesforce will consider for employment qualified applicants with arrest and conviction records."
166,"Project Manager, Center for Data-Driven Insights and Innovation","Oakland, CA 94607",Oakland,CA,94607,None Found,None Found,None Found,None Found,None Found,None Found,"Project Manager, Center for Data-Driven Insights and Innovation

University of California Office of the President

Requisition Number: 20190181

Appointment Type: Staff - Career

Personnel Program: MSP

Work Hours: 8:00 AM - 5:00 PM, Monday - Friday

Percentage of Time: 100

Organizational Area: Health Sciences and Services

Location: Oakland, CA

Posting Salary: Salary commensurate with experience.

Position Summary:
Serves as key strategist with the Chief Data Scientist and the Executive Director/Chief Health Data Officer within the Center for Data-Driven Insights and Innovation (CDI2) in initiating and developing new strategic direction, long- and short-range plans and innovative initiatives. Has high level authority to broadly represent the Chief Data Scientist's and Executive Director's interests across the organization. Responds to issues with little or no precedence. Will help drive and develop system-wide initiatives, typically with organization-wide impact. Will convene and manage various stakeholders within UCOP and across the health system engaged in various projects or initiatives. Uses advanced concepts and organizational objectives to resolve highly complex issues. Regularly works on highly complex issues or problems which require analysis of unique issues / problems without precedent and / or structure. Exercises a high level of judgment in selecting methods, techniques and evaluation criteria for obtaining results.

LI-SG1

Special Conditions of Employment:
Overtime

Other Special Conditions of Employment:
Successful completion of a background check is required for appointment to this critical position.

Job Close Date:

Duties
In collaboration and communication with the Chief Data Scientist and the Executive Director of CDI2, strategizing and/or negotiating directly to achieve consensus among high level stakeholders (such as faculty, senior medical center / professional school leadership, other stakeholders in the Office of the President, public agencies, and the community) to develop solutions to complex problems. Providing briefings on key issues to a variety of stakeholders. Representing the Chief Data Scientist/Executive Director on high-level task forces and long- and short-range strategic planning groups.

Job Requirements
Bachelor's degree required.

Advanced skills in short- and long-range planning, program and project management, facilitation and collaboration.

Sound strategic thinking and consulting skills in guiding the organization toward workable strategies and solutions.

Proven ability to focus on priorities, strategies, and vision.

Advanced ability to coach, facilitate and influence people at all levels.

Advanced ability to build and maintain relationships with a broad range of staff and members of the community.

Knowledge of common organization-specific and other computer application programs.
Required

Law degree or graduate degree in a health care field preferred.

Financial analysis and reporting techniques.

Experience working in an Academic Medical Center.

Experience working in quality and/or population health management.

Health regulatory experience and expertise.

Experience working with business and /or regulatory issues regarding health data strongly preferred.
Preferred

How to Apply
For complete job description and application instructions, visit: https://apptrkr.com/1636341

About us
The University of California, one of the largest and most acclaimed institutions of higher learning in the world, is dedicated to excellence in teaching, research and public service. The University of California Office of the President is the corporate headquarters to the ten campuses, five medical centers and three Department of Energy National Labs and enrolls premier students from California, the nation and the world.

The University of California is an Equal Opportunity/Affirmative Action Employer. All qualified applicants will receive consideration for employment without regard to race, color, religion, sex, national origin, disability, age or protected veteran status.

Copyright ©2017 Jobelephant.com Inc. All rights reserved.

Posted by the FREE value-added recruitment advertising agency

jeid-aefb8820f1d4c146a116f6c6b870ed5d"
