,Title,Location,City,State,Zip,Country,Qualifications,Skills,Responsibilities,Education,Requirement,FullDescriptions
103,Sr. Data Analyst,"Farmers Branch, TX",Farmers Branch,TX,None Found,None Found,None Found,None Found,None Found,None Found,None Found,"Home Point Financial Corporation (HPFC) is a rising star in the financial services industry. At Home Point, we created a culture that encourages community, caring and open communication. We want our associates to speak up, become innovators and make impactful changes – no matter what position they hold within the company. What makes our team special? Our “We Care” approach in all that we do. At HPFC we collaborate, question the norm, reinvent and help each other succeed. If you thrive in a fast-paced environment and are looking for an opportunity to develop your career, then we have a great opportunity for you!

The Sr. Data Analyst will be responsible for data related support, data investigation, research, and data management to support development solutions for defined projects, working closely with the business and development teams. The Sr. Data Analyst will use current technologies to provide analysis to assist in developing advanced modern, scalable, SQL based solutions serving our business in the mortgage finance industry. This includes the data analysis, occasional development, and recommendations for design of client and partner integrated SQL technical solutions for both proprietary and purchased software.


Provide data analysis to assist in producing well-designed and developed solutions for on time deployment based on list of requirements
Collaborate with team members on complex projects
Ensure adherence to corporate development and mortgage industry requirements
Perform extensive data validation/quality assurance analysis within large datasets
Troubleshoot and investigate data anomalies and issues along with working directly with the developers to follow through and resolve issues
Work with business analysts to clarify requirements
Translate business import and export needs into a maintainable integrations platform
Perform all other duties as requested or assigned

SKILLS & QUALIFICATIONS:

5+ years of mortgage banking experience
Strong knowledge and experience working in the Mortgage Industry – Emphasis on Originations space
Deep SQL and Relational Database experience
SQL Server, Snowflake or Oracle experience preferred
Encompass LOS experience
Black Knight MSP experience preferred
Monarch experience preferred
Tableau experience helpful
Experience translating complex business rules into system and data specifications
Experience building source to target mappings for ETL development
Experience reverse engineering complex stored procedures to create data mapping documentation
Exposure/expertise in agile scrum development methodology
Exposure to cloud computing (Azure preferred)
Strong verbal and written communication skills

Home Point Financial Corporation (HPFC) is an equal opportunity at will employer and does not discriminate against any employee or applicant for employment because of age, race, religion, color, disability, sex, sexual orientation or national origin."
104,Data Analyst - Belleview,"Dallas, TX 75215",Dallas,TX,75215,None Found,None Found,None Found,None Found,None Found,None Found,"Job Description:
POSITION PURPOSE

Responsible for extracting, interpreting and turning data into information which can offer ways to improve a business, thus affecting business decisions. Once data has been gathered and interpreted, the Data Analyst will report back what has been found in a comprehensive study to business executives and other colleagues.

ESSENTIAL FUNCTIONS AND BASIC DUTIES

1. Assumes responsibility for effective performance of assigned programming functions

Advanced data extracting using different programming languages including but not limited to MS SQL, Crystal Report

Design and build queries, reports using SQL, Crystal Report and create dashboards using various data visualization tools including, but not limited to, Power Bi, iDashboard, Advanced MS Excel.

Identify, define, and produce accurate and meaningful metrics in an effort to deliver high quality, actionable, efficient, and interactive reporting to drive business decisions.

Produce analytic reports, which extract meaningful insights for leadership to better understand and improve business performance.

With general supervision, work in a collaborative and constructive manner with internal stakeholders and various business units to complete tasks with time sensitive deadlines.

Develop and maintain productive working relationship with IT and other stakeholders. Takes raw Datasets and transfer them into Executive presentations Knowledge.

Skilled in data analytics/data presentation, deep understanding of database technology and design concepts. Collecting and interpreting data; and analyzing results. Reporting the results back to the relevant members of the business.

Identifying patterns and trends in data sets. Defining new data collection and analysis processes.

Working alongside teams within the business or the management team to establish business needs

Managing and designing the reporting environment, including data sources, security, and metadata.

Providing technical expertise on data storage structures, data mining, and data cleansing.

2. Assumes and demonstrates the skills and responsibility outlined below:

Strong programming skills with SQL and other querying languages.

Ability to understand Credit Union Financial business; apply knowledge and critical thinking skills in day-to-day problems and solutions

Strong analytical skills and ability to draw conclusions based on data

Must be able use appropriate analysis, judgment, logic, and communication methods when solving problems and making decisions

Detail oriented, with a structured approach to planning and organization

Capable of working both independently and as a contributing team member, to meet team and department goals

Excellent verbal and written communication skills

Possesses the skill to display the utmost level of professionalism, tact, and discretion

Ability to analyze large Datasets, data models and reporting packages.

Ability to write comprehensive reports

3. Assumes responsibility for establishing and maintaining professional working relationships with members, suppliers, and outside contacts.

Tracks and resolves problems promptly and effectively.

Obtains and conveys information as needed.

Promotes goodwill and a positive image of the Credit Union.

4. Assumes responsibility for related duties as required or assigned.

Ensures that work area is clean, secure, and well maintained.

Completes other duties as assigned.

Performs miscellaneous projects as assigned.

Updates technical skills as required.

Preserves confidentiality of Credit Union records.

PERFORMANCE MEASUREMENTS

1. Information users can effectively utilize established systems.

2. Good business relations exist with users. Users’ concerns are promptly attended to and any problem effectively resolved.

3. Credit Union information needs are met. Suggestions for improvements are made.

4. Programming goals and projects are completed on schedule. Programming functions are completed in accordance with established policies and procedures.

5. Data integrity and quality programs are maintained. Programs are efficient.

Job Requirements:
Education/Certification: Bachelor’s degree or an equivalent.

Required Knowledge:
Knowledge of software applications and relational database systems.

Understanding of related programming languages and development platforms.

Understanding of Credit Union operations and information needs.

Work experience as a data analyst or in related field.

Ability to work with stakeholders to assess potential risks.

Ability to analyze existing tools and databases and provide software solution recommendations.

Ability to translate business requirements into non-technical, lay terms.

High-level experience in methodologies and processes for managing large scale databases.

Demonstrated experience in handling large data sets and relational databases.

Understanding of addressing and metadata standards.

High-level written and verbal communication skills.

Experience Required: Two to five years of similar or related experience.

Skills/Abilities:
Attentive to detail.

Strong problem-solving skills.

Ability to operate computer, printer, and other business equipment.

Knowledge of report writing software and computer database engines.

Willingness to assist others."
105,Product Web Analyst,"Dallas, TX 75204",Dallas,TX,75204,None Found,"Ability to setup, manage and maintain analytics software like Heap, Adobe Analytics, Mixpanel, Flurry, Google Analytics, or similar software.Ability to analyze software usage data to identify trends, gaps and user behavior.Ability to query SQL databases with an understanding of relational databases and table structures.Beginner knowledge of JavaScript & CSS are required; intermediate knowledge desiredExperience with quantitative research methods and displaying results using pivot tables, graphs, charts, etc.Ability to learn and use product management software, such as Rally, JIRA, or other applications.Ability to communicate effectively with product team and stakeholders about data trends and interpretations.Expertise in the use of Microsoft applications; specifically SQL, Excel, PowerPoint, and Visio.Knowledge of Agile SCRUM and Lean methodologies preferred.Strong organization skills and attention to detail with the ability to plan, prioritize and meet deadlines.Ability to resolve complex issues.Ability to work independently and in a collaborative team environment.Excellent written, verbal, and interpersonal skills.","Ability to setup, manage and maintain analytics software like Heap, Adobe Analytics, Mixpanel, Flurry, Google Analytics, or similar software.Ability to analyze software usage data to identify trends, gaps and user behavior.Ability to query SQL databases with an understanding of relational databases and table structures.Beginner knowledge of JavaScript & CSS are required; intermediate knowledge desiredExperience with quantitative research methods and displaying results using pivot tables, graphs, charts, etc.Ability to learn and use product management software, such as Rally, JIRA, or other applications.Ability to communicate effectively with product team and stakeholders about data trends and interpretations.Expertise in the use of Microsoft applications; specifically SQL, Excel, PowerPoint, and Visio.Knowledge of Agile SCRUM and Lean methodologies preferred.Strong organization skills and attention to detail with the ability to plan, prioritize and meet deadlines.Ability to resolve complex issues.Ability to work independently and in a collaborative team environment.Excellent written, verbal, and interpersonal skills.","Recommends and establishes appropriate KPIs, and monitors and analyzes key metrics in order to execute recurring analyses and reporting.Owns BAL’s Web Analytics software, Heap, and ensures accurate implementation, including design, setup, and maintenance, ensuring that all data is tracked, appropriately organized and kept up-to-date, in accordance with new features and evolving existing features.Works as part of the Product Management team to ask the right questions, measure the right things and interpret metrics to tell a meaningful story about product usage and trends.Is self-motivated and proactively investigates and uses data from Heap, reporting and directly querying the database to understand user behavior and evaluate potential opportunities for creating a better user experience within the product.Empower the Product Team, Steering Committee, Support team and business stakeholders with data by providing data to keep us informed; help us prioritize and maintain urgency of new features and/or defect fixes.Manage medium to large size projects or processes with limited oversight and/or direction.Independently analyzes and interprets Android and iOS mobile app usage to suggest enhancements that will increase usage.Understands how user interactions translate to data that provides insights on behavior and defines and creates reports and dashboards with meaningful data interpretations, data segments, filters and flows that communicate product and/or feature performance.Proactively suggests how the data gleaned contributes to product feature designs and expected impact of new features.Provides objective evaluations of feature impact post implementation, as part of the Build>Measure>Learn cycle.Executes on the discovery phase of the SDLC through identifying possible feature/functionality needs and completing research from both a business need and a value/ROI perspective.Conducts conversations with the business and users to validate data interpretations and predictions.Maintains and updates documentation on Data/Web Analytics product design and implementation.","BA/BS in statistics, mathematics, business, or a related field. Master’s degree in a related field is preferred.",Able to maintain a sedentary position for up to 90% of the work day.Able to walk and climb stairs or use elevator to coordinate with other departments.Occasional travel required.,"Overview
The Product Data Analyst will work in a dynamic, fast-paced environment as part of the Product team, to understand, define and create industry-changing products. We are looking for someone who is equal parts web analyst and data analyst; who is a proactive, results driven individual, excited to work with internal business teams to drive new product development, and can contribute to critical high value projects that will define and maintain our products.

*This position is open to remote applicants*
Responsibilities
PRIMARY RESPONSIBILITIES (Under the supervision of the Product Manager):
Recommends and establishes appropriate KPIs, and monitors and analyzes key metrics in order to execute recurring analyses and reporting.Owns BAL’s Web Analytics software, Heap, and ensures accurate implementation, including design, setup, and maintenance, ensuring that all data is tracked, appropriately organized and kept up-to-date, in accordance with new features and evolving existing features.Works as part of the Product Management team to ask the right questions, measure the right things and interpret metrics to tell a meaningful story about product usage and trends.Is self-motivated and proactively investigates and uses data from Heap, reporting and directly querying the database to understand user behavior and evaluate potential opportunities for creating a better user experience within the product.Empower the Product Team, Steering Committee, Support team and business stakeholders with data by providing data to keep us informed; help us prioritize and maintain urgency of new features and/or defect fixes.Manage medium to large size projects or processes with limited oversight and/or direction.Independently analyzes and interprets Android and iOS mobile app usage to suggest enhancements that will increase usage.Understands how user interactions translate to data that provides insights on behavior and defines and creates reports and dashboards with meaningful data interpretations, data segments, filters and flows that communicate product and/or feature performance.Proactively suggests how the data gleaned contributes to product feature designs and expected impact of new features.Provides objective evaluations of feature impact post implementation, as part of the Build>Measure>Learn cycle.Executes on the discovery phase of the SDLC through identifying possible feature/functionality needs and completing research from both a business need and a value/ROI perspective.Conducts conversations with the business and users to validate data interpretations and predictions.Maintains and updates documentation on Data/Web Analytics product design and implementation.

SECONDARY RESPONSIBILITIES (Under the supervision of the Product Manager):Contributes to road mapping activities through needs assessment, feature ROI analysis, prioritization, and user behavior data.Employs lean methodology to help define business problems, form hypotheses, test and validate solutions, and continue with the build > measure > learn cycle.Helps design tests for beta/pilot/early adopter programs to ensure successful adoption of a new product or feature.Reports bugs found in product(s) through the appropriate channel.Has the ability to demo the product(s) and explain product functionality.Efficiently manages multiple projects with competing deadlines.Other duties as assigned.
Qualifications
Skills and Abilities:
Ability to setup, manage and maintain analytics software like Heap, Adobe Analytics, Mixpanel, Flurry, Google Analytics, or similar software.Ability to analyze software usage data to identify trends, gaps and user behavior.Ability to query SQL databases with an understanding of relational databases and table structures.Beginner knowledge of JavaScript & CSS are required; intermediate knowledge desiredExperience with quantitative research methods and displaying results using pivot tables, graphs, charts, etc.Ability to learn and use product management software, such as Rally, JIRA, or other applications.Ability to communicate effectively with product team and stakeholders about data trends and interpretations.Expertise in the use of Microsoft applications; specifically SQL, Excel, PowerPoint, and Visio.Knowledge of Agile SCRUM and Lean methodologies preferred.Strong organization skills and attention to detail with the ability to plan, prioritize and meet deadlines.Ability to resolve complex issues.Ability to work independently and in a collaborative team environment.Excellent written, verbal, and interpersonal skills.

Physical Requirements:
Able to maintain a sedentary position for up to 90% of the work day.Able to walk and climb stairs or use elevator to coordinate with other departments.Occasional travel required.

Experience:
5+ years in product management, data/web analytics, statistics, data science or market research.Experience managing and using Heap, Adobe Analytics / Omniture / SiteCatalyst, Mixpanel, Flurry, Google Analytics, or similar software.

Minimum Education Level:
BA/BS in statistics, mathematics, business, or a related field. Master’s degree in a related field is preferred."
106,Business Analyst,"Grapevine, TX 76051",Grapevine,TX,76051,None Found,None Found,None Found,None Found,None Found,None Found,"We will rely on this individual to solicit and organize requirements, and document processes and systems key to the business. To be successful, this individual must have the ability to apply prior training and experience through all life-cycle phases such as analysis, design, development, testing, implementation, and documenting of systems and processes from a continuous quality improvement perspective. This position may also identify and analyze opportunities for efficiencies and quality improvements utilizing standard process control tools.

ESSENTIAL FUNCTIONS:
Collaborate with line management to evaluate existing systems and/or end-user needs to design, recommend, and assist in the implementation of complex system changes.
Collaborate with internal and external stakeholders to elicit, analyze, communicate, and validate requirements for changes to business processes, policies, and information systems.
Assist in the analysis of business problems and opportunities in the context of the requirements and recommend solutions that enable the organization to achieve its goals.
Initiate the analysis of, and ensure adequate evaluation of system and stakeholder impacts.
Develop project plans and monitors project scheduling and completion, and coordinate Information System efforts and customer needs to ensure expeditious response and resolution of system problems/issues.
Serve as the system and process expert for customer base and other Information System departments.
Translate high-level business requirements into functional specifications for the organization and manage changes to such specifications (with senior business analyst oversight through peer reviews).
Develop an informed knowledge of the business unit being supported, as well as an understanding of the organization’s systems and capabilities in order to participate in project activities and research requests on an ongoing basis.
Research, review, and analyze the effectiveness and efficiency of existing requirement gathering processes and develop strategies for enhancing or further leveraging these processes.
Contribute in fundamental and quantitative analysis related to market structure, customer analysis, price discovery, and product performance.
Participate in the research and development of new system application releases, and coordinate the identification of interfaces for externally developed packages.
Act as a liaison between business leaders, technology, and project team.
Familiar with a broad range of healthcare-related business and/or IT concepts, practices, and procedures.
Develop and utilize standard templates to accurately and concisely write requirements specifications.
Translate conceptual user requirements into functional requirements in a clear manner that is comprehensible to the developers/project team.
Manage and track the status of requirements throughout the project lifecycle; enforce and redefine as necessary.
Communicate changes, enhancements, and modifications of business requirements- verbally or written documentation – to project manager, sponsors, and other stakeholders so that the issues and solutions are understood.
Communicate and interact effectively and professionally with co-workers, management, customers, etc.
Comply with HIPAA, Diversity Principles, Corporate Integrity, Compliance Program policies and other applicable corporate and departmental policies.
Maintain complete confidentiality of company business.
Maintain communication with management regarding development within areas of assigned responsibilities and perform special projects as required or requested.

QUALIFICATIONS:
Bachelor’s degree from four-year College or university; or 3+ years related experience and/or training; or equivalent combination of education and experience.
Project Management Professional (PMP) Certification preferred.
Experience in the healthcare industry or student insurance is a plus.
Proficient in Microsoft Word, Excel, PowerPoint, Project, and Outlook. Experience in Microsoft Access and Visio preferred.
Effectively prioritize and execute tasks in a high-pressure environment.
Ability to set and achieve challenging goals, demonstrate persistence and overcome obstacles, measure self against standard of excellence, recognize and act on opportunities, take calculated risks to accomplish goals.
Exhibit good listening and comprehension, express ideas and thoughts in written/verbal form and keep others adequately informed.
Dependable and committed individual.
Develop alternative solutions to resolve issues in the early stages.
Ability to balance team and individual responsibilities, and exhibits objectivity and openness to others’ views.

About Academic HealthPlans


Academic HealthPlans has a single goal: To continually provide extraordinary service, innovative products, and valuable resources in the field of student health insurance to colleges & universities, students, and parents. We were founded in 1998 by Terry Lyons, who continues to provide his expertise to our clients as President & CEO. Terry Lyons has over 25 years of experience in student health and is well trusted by clients in his ability to utilize his industry insights to provide schools and universities with the best benefits available for their students. AHP has over 50 employees, many of whom have long industry tenures and have been with AHP since our beginnings. We currently partner with over 100 colleges and universities of all sizes across the United States and are continuing to grow each year."
