,Title,Location,City,State,Zip,Country,Qualifications,Skills,Responsibilities,Education,Requirement,FullDescriptions
37,Financial Analyst,"Dallas, TX",Dallas,TX,None Found,None Found,"Bachelor’s degree in Accounting, Finance, Economics or related field
Advanced Excel, Powerpoint, Hyperion and Essbase skills
Experience using SQL to extract and analyze data
Comfortable when challenged with difficult, unstructured problems that must be solved quickly
2-4 years of relevant experience, preferably in the retail industry
Strong financial modeling capabilities utilizing data from numerous sources
Strong planning / organizational skills and attention to detail
Strong written and verbal communication skills
An inquisitive nature and can-do attitude
Previous experience working within a retail environment is preferred",None Found,"Forecast, analyze and provide summary of organizations trends in sales, margin, inventory, expense and other operational business metrics
Developing a deep understanding of business unit objectives, key operating metrics while providing analysis and reporting to support business leaders
Build credibility and partnership by providing accurate timely and accurate financial intelligence, communicating in a responsive and solution-oriented manner, and working with an entrepreneurial attitude
Build financial models for prospective business opportunities
Utilize multiple systems and software applications to execute tasks
Identify potential business issues and opportunities through data analysis",None Found,None Found,"Summary:
The Financial Analyst of Inventory, Margin and Retail Analytics will support the organization through the analysis of the merchandise and operational data, the development of standardized reporting for key merchandise KPIs, and preparation of ad hoc expense analysis for special initiatives. The individual will be required to gather and validate information necessary to provide analytical, fact-based assessments which will aid in the decision making needed to drive business results. This position provides an outstanding opportunity to understand and influence the business, learn the company systems, enhance the individuals' analytical and communication skills, and interact with various management teams.

Responsibilities:
Forecast, analyze and provide summary of organizations trends in sales, margin, inventory, expense and other operational business metrics
Developing a deep understanding of business unit objectives, key operating metrics while providing analysis and reporting to support business leaders
Build credibility and partnership by providing accurate timely and accurate financial intelligence, communicating in a responsive and solution-oriented manner, and working with an entrepreneurial attitude
Build financial models for prospective business opportunities
Utilize multiple systems and software applications to execute tasks
Identify potential business issues and opportunities through data analysis

Qualifications

Bachelor’s degree in Accounting, Finance, Economics or related field
Advanced Excel, Powerpoint, Hyperion and Essbase skills
Experience using SQL to extract and analyze data
Comfortable when challenged with difficult, unstructured problems that must be solved quickly
2-4 years of relevant experience, preferably in the retail industry
Strong financial modeling capabilities utilizing data from numerous sources
Strong planning / organizational skills and attention to detail
Strong written and verbal communication skills
An inquisitive nature and can-do attitude
Previous experience working within a retail environment is preferred

Primary Location: United States of America-Texas-DALLAS-Dallas-Renaissance Tower
Work Locations: Renaissance Tower Neiman Marcus 1201 Elm Street Dallas 75270
Job: Finance/Accounting
Organization: Corporate
Schedule: Full-time
Shift: Day
Employee Status: Regular
Job Type: Standard
Job Level: Individual Contributor
Travel: No
Job Posting: Sep 19, 2019, 6:31:29 PM"
38,Senior Data Modeler,"Richardson, TX",Richardson,TX,None Found,None Found,"10+ years of expert experience in data modeling (3NF, Dimensional) required
10+ years expert SQL (writing and tuning) experience required
5+ years of experience with Microsoft BI stack (SSIS SSRS and SSAS) strongly preferred
Bachelor’s degree in Computer Science or MIS related area required or equivalent experience required
Experience with modeling to target the cloud (e.g. Azure) strongly preferred
Experience with Kimball data warehouse design principles strongly preferred
Strong IDERA (formerly Embarcadero) ER/Studio Data Architect or ERwin experience required, but other data modeling tools very applicable
Experience with metadata management concepts and tools strongly preferred
Experience with master data management concepts strongly preferred
Experience with TFS / Azure DevOps (fka VSTS) or Jenkins utilizing Continuous Integration and Continuous Delivery (CI / CD) with the Azure platform or SQL Server products strongly preferred
Experience with source controlling data models strong preferred
Knowledge of different software development methodologies required (e.g. Agile, Waterfall)
Banking and/or financial services experience required
Detailed-oriented with a proven history as a self-starter who can work independently with minimal supervision
Strong oral presentation and written communication skills
Ability to present ideas in user-friendly language
Outstanding organizational and effective time management skills
Ability to obtain, analyze and synthesize information from multiple sources
Excellent problem-solving, analytical and critical thinking skills",None Found,"This position functions as an experienced data modeler and data analyst supporting the bank’s data strategy.
Partner with Business Analysts, Subject Matter Experts from TCB’s Business Units, and counterparts in IT to identify data requirements and develop data models that meet the collective needs of the business
Responsible for creating and maintaining data modeling artifacts including conceptual, logical, and physical data models, data dictionaries, and source to target mappings
Profile source data to identify challenges early in the SDLC
Ensure data models adhere to published development and architectural standards
Define, publish, and foster data modeling standards
Design enterprise data warehouse data models that are consistent, intuitive, and easy to use
Manage Visual Studio database projects including source control change sets, branching and merging
Responsible for physical model implementation and tuning
Responsible for version controlling data models
Work closely with other developers to ensure ETL solutions conform to source to target mappings and data transformation rules through periodic code reviews
Multi-task across several ongoing projects and daily duties of varying priorities as required
Provide input into each phase of the system development lifecycle as required
Ability to make good judgments, decisions, negotiate and problem solve",None Found,None Found,"Overview
At Texas Capital Bank, we are driven by a single-minded and unwavering mission: to serve business and the individuals who run them. We use a consultative approach and innovative technologies to develop new ideas that give the bank and our clients a competitive advantage. We partner with our customers to push the boundaries of what’s possible—together.

Headquartered in Dallas, Texas Capital Bank has offices in Austin, Fort Worth, Houston, Richardson, Plano and San Antonio, and we serve clients in a variety of industries from coast-to-coast.
We are on the Forbes Best Banks in America list, and were named a top place to work by The Dallas Morning News, Houston Chronicle and San Antonio Express-News. For further information, please visit us at www.texascapitalbank.com.
The Senior Data Modeler must possess a strong understanding of large-scale data warehouses in the Microsoft SQL Server and Azure space. The ideal team member will partner with internal stake holders from IT and the business to create data models that meet the objectives of the business and the bank’s data strategy. The Senior Data Modeler must possess a collaborative attitude, strong oral/written presentation skills, excellent problem-solving skills, and solid analytical/critical thinking skills.
Responsibilities
This position functions as an experienced data modeler and data analyst supporting the bank’s data strategy.
Partner with Business Analysts, Subject Matter Experts from TCB’s Business Units, and counterparts in IT to identify data requirements and develop data models that meet the collective needs of the business
Responsible for creating and maintaining data modeling artifacts including conceptual, logical, and physical data models, data dictionaries, and source to target mappings
Profile source data to identify challenges early in the SDLC
Ensure data models adhere to published development and architectural standards
Define, publish, and foster data modeling standards
Design enterprise data warehouse data models that are consistent, intuitive, and easy to use
Manage Visual Studio database projects including source control change sets, branching and merging
Responsible for physical model implementation and tuning
Responsible for version controlling data models
Work closely with other developers to ensure ETL solutions conform to source to target mappings and data transformation rules through periodic code reviews
Multi-task across several ongoing projects and daily duties of varying priorities as required
Provide input into each phase of the system development lifecycle as required
Ability to make good judgments, decisions, negotiate and problem solve
Qualifications
10+ years of expert experience in data modeling (3NF, Dimensional) required
10+ years expert SQL (writing and tuning) experience required
5+ years of experience with Microsoft BI stack (SSIS SSRS and SSAS) strongly preferred
Bachelor’s degree in Computer Science or MIS related area required or equivalent experience required
Experience with modeling to target the cloud (e.g. Azure) strongly preferred
Experience with Kimball data warehouse design principles strongly preferred
Strong IDERA (formerly Embarcadero) ER/Studio Data Architect or ERwin experience required, but other data modeling tools very applicable
Experience with metadata management concepts and tools strongly preferred
Experience with master data management concepts strongly preferred
Experience with TFS / Azure DevOps (fka VSTS) or Jenkins utilizing Continuous Integration and Continuous Delivery (CI / CD) with the Azure platform or SQL Server products strongly preferred
Experience with source controlling data models strong preferred
Knowledge of different software development methodologies required (e.g. Agile, Waterfall)
Banking and/or financial services experience required
Detailed-oriented with a proven history as a self-starter who can work independently with minimal supervision
Strong oral presentation and written communication skills
Ability to present ideas in user-friendly language
Outstanding organizational and effective time management skills
Ability to obtain, analyze and synthesize information from multiple sources
Excellent problem-solving, analytical and critical thinking skills"
39,Data Analyst,"Plano, TX",Plano,TX,None Found,None Found,None Found,None Found,None Found,None Found,None Found,"ARE YOU READY TO WORK AT ALTISOURCE?


Are you looking for an opportunity to advance your career in data analysis?
Do you enjoy solving complex business problems using financial and sales data?
Are you excited to join a growing team and take on exciting challenges?

If so, Altisource would love to hear from you! Altisource is seeking a Data Analyst to use data to build and execute a client retention and lead generation strategy. This includes building a database to run overall data modeling to measure and address client lead generation. The Junior Data Analyst will use large complex sets of data that will need to be mined and manipulated in order to make important business decisions.

WHAT YOU GET TO DO


Use a variety of technologies ( SQL Server, Oracle, Visual Studio, Microstrategy, Salesforce) and business data to help support client base
Help maintain database to track and report on key client & corporate metrics to drive retention, improve efficiency, and enhance value to all stakeholders
Use data to run a variety of analytics models that can help drive decision-making for both tactical and strategic purposes including assessments of existing products, new products, client consultation, and process improvement
Participate in the design and implementation of lean reporting processes and initiatives within databases and CRM's

WHAT ABOUT YOU? You have...


Knowledge in creating SQL queries is highly beneficial. Exposure to Tableau, major databases (Oracle & SQL Server), and CRM's (Salesforce)
Strong reporting skills in MS Excel (pivot tables, macros, etc.) and MS Access
A highly analytical ability, yet skilled at distilling complex ideas and data into meaningful and actionable business insights
An ability to manage large, complex sets of data that need to be mined and manipulated in order to make important business decisions

WORKING AT ALTISOURCE ADVANTAGES:
Prosperity


Competitive base salaries!
401k plans with company match – we want to empower you to further your career, and prepare for retirement!

Good Health


Comprehensive Medical, Dental, and Vision insurance plans
Tax-free Flexible Spending Account
Life insurance, short-term, and long-term disability

And Happiness


Paid holidays, plus 19 days of accrued PTO for a total of 28 paid days off per year!
Free snacks, drinks and coffee!
Plenty of employee engagement activities including sporting events, happy hours, and other fun team-building activities
Opportunities to join our community service initiatives, including Habitat for Humanity
Employee Discounts on movie tickets, Verizon cell service, Microsoft products, and more!

OUR CORE VALUES

For our employees, customers, and shareholders, we commit to…


Act With Integrity – exhibit unwavering integrity, compliance and ethical conduct at all times
Energize People – enable exceptional people to energize their teams and drive results
Empower Innovation – reward the relentless creation of innovative and compliant solutions to achieve our mission and generate value for our customers
Exceed Customer Expectations – execute world-class solutions to deliver value and delight our customers
Win as a Team – embrace the passion, energy and power of our global teams to win as ""One-Altisource""
Enrich Communities – create positive impacts for the communities where we live and serve

Are you up to the challenge? Apply today!

Reach out to our Talent Acquisition Team directly at working@altisource.com if we can be of any assistance!

At Altisource we value diversity, and are proud to be an equal opportunity workplace. We do not discriminate against any employee or applicant for employment on the basis of race, religion, color, sex, national origin, gender identity and/or expression, sexual orientation, age, marital status, veteran status, or disability status."
40,Big Data Engineer,"Plano, TX",Plano,TX,None Found,None Found,None Found,"
Hands-on experience with the Hadoop eco-system - HDFS, MapReduce, HBase, Hive, Impala, Spark, Kafka
Experience in implementing Hadoop Data Lakes - Data storage, partitioning, splitting, file types (Parquet, Avro, ORC) for specific use cases etc.
Experience with Query languages – SQL, Hive, Impala, Drill etc.
Experience with NoSQL databases – MapR-DB, HBase, MongoDB, Cassandra etc.
Experience in agile(scrum) development methodology
Exposure to Data ingestion frameworks such as Kafka, Sqoop, Storm, Nifi, Spring Cloud, etc.
Experience with building stream-processing systems using solutions such as Kafka, MapR-Streams, Spark-Streaming etc.
Experience with development/automation skills. Must be very comfortable with reading and writing Scala, Python or Java code
Experience with one of the Hadoop open source distributions - MapR and Cloudera
Bachelor or master’s Degree in engineering in Computer Science or Information Technology","
Partner with data analyst, product owners and data scientists, to better understand requirements, solution designs, finding bottlenecks, resolutions, etc.
Support/Enhance data pipelines and ETL using heterogeneous sources
Transform data using data mapping and data processing capabilities like Spark, Spark SQL, HiveQL etc.
Expands and grows data platform capabilities to solve new data problems and challenges
Ability to dynamically adapt to conventional big-data frameworks and tools with the use-cases required by the project",None Found,"10+ years Enterprise Development
5+ years of experience with the Hadoop and Big Data technologies
2+ Years Design with Big Data Strategies.","Req ID: 58054

At NTT DATA Services, we know that with the right people on board, anything is possible. The quality, integrity, and commitment of our employees are key factors in our company’s growth, market presence and our ability to help our clients stay a step ahead of the competition. By hiring the best people and helping them grow both professionally and personally, we ensure a bright future for NTT DATA Services and for the people who work here.

NTT DATA Services currently seeks a Big Data Engineer to join our team in Plano, Texas (US-TX), United States (US).

Responsibilities
Partner with data analyst, product owners and data scientists, to better understand requirements, solution designs, finding bottlenecks, resolutions, etc.
Support/Enhance data pipelines and ETL using heterogeneous sources
Transform data using data mapping and data processing capabilities like Spark, Spark SQL, HiveQL etc.
Expands and grows data platform capabilities to solve new data problems and challenges
Ability to dynamically adapt to conventional big-data frameworks and tools with the use-cases required by the project

Basic Skill Requirements
10+ years Enterprise Development
5+ years of experience with the Hadoop and Big Data technologies
2+ Years Design with Big Data Strategies.
Other Skills
Hands-on experience with the Hadoop eco-system - HDFS, MapReduce, HBase, Hive, Impala, Spark, Kafka
Experience in implementing Hadoop Data Lakes - Data storage, partitioning, splitting, file types (Parquet, Avro, ORC) for specific use cases etc.
Experience with Query languages – SQL, Hive, Impala, Drill etc.
Experience with NoSQL databases – MapR-DB, HBase, MongoDB, Cassandra etc.
Experience in agile(scrum) development methodology
Exposure to Data ingestion frameworks such as Kafka, Sqoop, Storm, Nifi, Spring Cloud, etc.
Experience with building stream-processing systems using solutions such as Kafka, MapR-Streams, Spark-Streaming etc.
Experience with development/automation skills. Must be very comfortable with reading and writing Scala, Python or Java code
Experience with one of the Hadoop open source distributions - MapR and Cloudera
Bachelor or master’s Degree in engineering in Computer Science or Information Technology

This position is only available to those interested in direct staff employment opportunities with NTT DATA, Inc. or its subsidiaries. Please note, 1099 or corp-2-corp contractors or the equivalent will NOT be considered. We offer a full comprehensive benefits package that starts from your first day of employment.
About NTT DATA Services

NTT DATA Services partners with clients to navigate and simplify the modern complexities of business and technology, delivering the insights, solutions and outcomes that matter most. We deliver tangible business results by combining deep industry expertise with applied innovations in digital, cloud and automation across a comprehensive portfolio of consulting, applications, infrastructure and business process services.

NTT DATA Services, headquartered in Plano, Texas, is a division of NTT DATA Corporation, a top 10 global business and IT services provider with 118,000+ professionals in more than 50 countries, and NTT Group, a partner to 88 percent of the Fortune 100. Visit nttdataservices.com to learn more.

NTT DATA, Inc. (the “Company”) is an equal opportunity employer and makes employment decisions on the basis of merit and business needs. The Company will consider all qualified applicants for employment without regard to race, color, religious creed, citizenship, national origin, ancestry, age, sex, sexual orientation, gender identity, genetic information, physical or mental disability, veteran or marital status, or any other class protected by law. To comply with applicable laws ensuring equal employment opportunities to qualified individuals with a disability, the Company will make reasonable accommodations for the known physical or mental limitations of an otherwise qualified individual with a disability who is an applicant or an employee unless undue hardship to the Company would result.

INDAPPS"
41,Director of Nursing Research,"Dallas, TX 75201",Dallas,TX,75201,None Found,None Found,None Found,None Found,None Found,None Found,"The Director of Nursing Research coordinates, manages and provides subject matter expertise in the development, design and implementation of nursing research projects across Baylor Scott & White Health (BSWH). The Director manages multiple research projects and teams and makes the challenge of research a reality for staff nurses. The Director provides leadership in provision of training and consultation to support individual or teams in research projects that promote and advance the use of research-based practice. In addition, the Director provides leadership in the translation of research findings into nursing practice and the profession to promote evidence based practice across the BSWH System. Data Analyst and Nurse Scientists will either direct or matrix report to this position. This position will advance Nursing and Interprofessional research across the System to align to BSWH Mission/Vision/Values and promote optimal staff and clinical outcomes. This position scope of responsibility is BSWH System and will require travel. Other essential functions of the role include the following:
Collaborates with chief nursing officers and other nurse leaders, including staff nurses, to identify nursing research studies that align with the strategic direction of the organization.
Develops educational programs supporting translation of the research process into practical steps for nursing staff, supporting professional growth and skill development.
Leads the development and design of research studies; serves as an expert in research design, methodologies and processes in collaboration with nurse scientists across the system.
Responsibility for maintaining system registry and annual reporting of all Nursing Research & Publications
Provides knowledge and expertise in the area of statistical and qualitative data analysis.
Develops or assists in the development of curriculum relative to research; conducts training and/or oversees delivery of training.
Partners with the BSWH Foundations to develop proposals to fund nursing research initiatives.
Builds partnerships with local nursing schools to promote collaboration on research projects among faculty and BSWH nurses.
Leadership in collaborating with CNOs and Magnet Coordinators in meeting research requirements for Magnet designation to ensure all organizations are meeting Magnet Standards for Nursing Research.


The ideal candidate will have knowledge and expertise in the area of nursing research studies, annual reporting, funding and grant proposals, collaborating with various constituents and members of leadership and driving results. The ideal candidate will have excellent communication, leadership, and analytical skills.
Benefits Our competitive benefits package includes*:
Immediate eligibility for health and welfare benefits
401(k) savings plan with dollar-for-dollar match up to 5%
Tuition Reimbursement
PTO accrual beginning Day 1


Note: Benefits may vary based upon position type and/or level.
#LI-EX2
5 8 years of related experience required
Registered Nurse (RN) license required
MD or PHD degree required"
