,Title,Location,City,State,Zip,Country,Qualifications,Skills,Responsibilities,Education,Requirement,FullDescriptions
69,IT Consultant [CRM Software Engineer Data analyst SAS SQL],"Dallas, TX",Dallas,TX,None Found,None Found,None Found,None Found,None Found,None Found,None Found,"Duties:
Minimum 2 years' experience in consulting industry while working with clients and managing projects Demonstrated strengths as a strong, independent, analytical thinker capable of effectively communicating findings through spreadsheets, statistical programs and written reports as well as oral presentation
SAS Programming, SQL Queries, Data Analysis, Statistical Analysis, Project Management, Stored Procedures, Data Cleaning, SATA, Excel, Litigation consulting .SAS/SQL certifications Ability to work in a team and keep project leaders updated on the status of multiple cases, working in a fast pace environment
Data cleaning and analysis including database construction of employee records and transactional files Extract and convert data from sources such as CSV, PDF documents, text files, etc. Develop and calculate exposure models including lost wages, employment penalties, interest, etc.
Education:
Bachelor's degree in Economics, Statistics, Business Administration or other quantitative social sciences field.
Requirements:
Applicants need to have 7 years of experience in the job offered."
70,IT Business Lead Analyst,"Irving, TX 75039",Irving,TX,75039,None Found,"
6-10 years of experience
Proficiency in MS Office (Word, Excel, Visio, PowerPoint) with extensive experience using Excel for data analysis
Experience with all phases of Software Development Life Cycle
Comprehensive knowledge of the principles of business analysis",None Found,"
Provide input during development and implementation phases, including formulation and definition of systems scope, objectives and necessary system enhancements for complex, high-impact projects
Identify and communicate risks and impacts and propose risk mitigation options, considering business implications of the application of technology to the current business environment
Consult with business clients to determine system functional specifications and partner with multiple management teams and other units to meet organizational objectives
Evaluate new IT developments and evolving business requirements and recommend appropriate systems alternatives and/or enhancements to current systems by analyzing business processes, systems and industry standards
Provide in-depth and sophisticated analyses with interpretive thinking to define problems, develop innovative solutions and influence strategic functional decisions
Supervise day-to-day staff management issues, including resource management, work allocation, mentoring/coaching and other duties and functions as assigned
Appropriately assess risk when business decisions are made, demonstrating particular consideration for the firm's reputation and safeguarding Citigroup, its clients and assets, by driving compliance with applicable laws, rules and regulations, adhering to Policy, applying sound ethical judgment regarding personal behavior, conduct and business practices, and escalating, managing and reporting control issues with transparency.","
Bachelor's degree/University degree or equivalent experience
Master's degree preferred",None Found,"The IT Business Lead Analyst is a senior-level position responsible for liaising between business users and technologists to exchange information in a concise, logical and understandable way in coordination with the Technology team. The overall objective of this role is to contribute to continuous iterative exploration and investigation of business performance and other measures to gain insight and drive business planning.

Responsibilities:
Provide input during development and implementation phases, including formulation and definition of systems scope, objectives and necessary system enhancements for complex, high-impact projects
Identify and communicate risks and impacts and propose risk mitigation options, considering business implications of the application of technology to the current business environment
Consult with business clients to determine system functional specifications and partner with multiple management teams and other units to meet organizational objectives
Evaluate new IT developments and evolving business requirements and recommend appropriate systems alternatives and/or enhancements to current systems by analyzing business processes, systems and industry standards
Provide in-depth and sophisticated analyses with interpretive thinking to define problems, develop innovative solutions and influence strategic functional decisions
Supervise day-to-day staff management issues, including resource management, work allocation, mentoring/coaching and other duties and functions as assigned
Appropriately assess risk when business decisions are made, demonstrating particular consideration for the firm's reputation and safeguarding Citigroup, its clients and assets, by driving compliance with applicable laws, rules and regulations, adhering to Policy, applying sound ethical judgment regarding personal behavior, conduct and business practices, and escalating, managing and reporting control issues with transparency.
Qualifications:
6-10 years of experience
Proficiency in MS Office (Word, Excel, Visio, PowerPoint) with extensive experience using Excel for data analysis
Experience with all phases of Software Development Life Cycle
Comprehensive knowledge of the principles of business analysis
Education:
Bachelor's degree/University degree or equivalent experience
Master's degree preferred
Citi Retail Services Technology is looking for Business Data Analysts with broad experience and an interest to develop and Implement data management strategy. In this role, you will collaborate with Data Governance team and other analytical users for developing the data strategy and solutions. As a Business Data Analyst, you will be part of a distributed team and work independently as well as in tight collaboration with the Data Stewards, analytical users and other shared service technology teams. We'll need you to be a great communicator and influencer, and, especially, a collaborator. You will regularly collaborate with cross-functional teams to deliver technology guidance, requiring a clear understanding of the desired outcomes and a solid grasp of the overall technology roadmap.
Primary Job Responsibilities:
Serve as a Technical Subject Matter Expert (SME) with knowledge of reporting and analytics data along with business rules, ETL processes as it flows through the different systems.
Facilitates Resolution of Data quality issues by working with the Data Governance and technical teams.
Perform the root cause analysis for the Data Quality issues and Implement the solutions to remediate the issues.
Ensure Data Quality standards/ process are met and supported.
Attain subject matter expertise included documenting metadata as it relates to business definitions and needs.
Actively drive simplification of Technology environment by eliminating specific/duplicative platforms leveraging the Global platforms where appropriate.
Enforce a consistent strategy, roadmap, and standard platforms documentation.
Works with Product Managers to document translate business strategy into technology roadmaps and coordinating them with internal IT team and vendors.
Work with partners to develop business cases to justify initiatives, and develop tracking mechanism to track finance request and tracking throughout the lifecycle of the program MIS
Strong Data analytical and Problem solving skills
Knowledge of data, reporting and analytic functions preferably within a financial services
5 - 8 yrs Experience with SAS, Cognos, SQL, Teradata, Hadoop and Big Data technologies
Experience with Abinitio, Teradata is a plus
Knowledge of Microsoft Office products
Strong Communication and presentation skills
Strong background and proven track record in managing software projects
Superior execution skills and ability to drive results
Methodologies:
Scrum/Agile experience
Continuous Integration and Delivery
-
Grade :All Job Level - All Job FunctionsAll Job Level - All Job Functions - US
-
Time Type :Full time
-
Citi is an equal opportunity and affirmative action employer.
Minority/Female/Veteran/Individuals with Disabilities/Sexual Orientation/Gender Identity.
Citigroup Inc. and its subsidiaries (""Citi”) invite all qualified interested applicants to apply for career opportunities. If you are a person with a disability and need a reasonable accommodation to use our search tools and/or apply for a career opportunity CLICK HERE.
To view the ""EEO is the Law"" poster CLICK HERE. To view the EEO is the Law Supplement CLICK HERE.
To view the EEO Policy Statement CLICK HERE.
To view the Pay Transparency Posting CLICK HERE."
71,Data Analyst - Loan Boarding,"Dallas, TX 75252",Dallas,TX,75252,None Found,"
Two+ years of recent experience as a data analyst, report developer, or another related title in a financial or banking environment
Experience creating and maintaining dashboards for KPI metrics and other performance measurables, preferred
Strong proficiency with the Microsoft Office Suite package including an expert knowledge of Excel
Two to three years of recent experience with Visual Basic or similar programming languages
Bachelor's Degree in Computer Science, Mathematics, or Business Administration
",None Found,"
Interpret client requirements into actionable specifications
Mine, analyze, and interpret data from multiple sources
Create import and export maps from external data sources
Develop data validation rules to ensure quality data
Create Visual Basic scripts to manage external data
Perform tests for validity, reasonableness, and accuracy through standard methods and application of specific subject-area knowledge
Troubleshoot data inconsistencies
Perform regular maintenance and testing on production reports and dashboards
Provide ad-hoc reporting and analysis services as required to meet business needs
",None Found,None Found,"Position Summary:
The Data Analyst – Loan Boarding will be responsible for day-to-day production, maintenance, and development of the loan onboarding process and data solutions at RoundPoint. This role will focus on understanding business processes and data, interpreting client requirements and specifications, and developing meaningful analyses and reports to drive business decisions. Qualified candidates will have a proven background performing data mining, analysis, and reporting.

Working Relationships:
The Data Analyst – Loan Boarding role reports to the Loan Boarding Manager in the Loan Administration department. This role works closely with members of the Loan Boarding and Loan Administration teams and other internal stakeholders to fulfill client and investor inquiries.

Primary Responsibilities:

Interpret client requirements into actionable specifications
Mine, analyze, and interpret data from multiple sources
Create import and export maps from external data sources
Develop data validation rules to ensure quality data
Create Visual Basic scripts to manage external data
Perform tests for validity, reasonableness, and accuracy through standard methods and application of specific subject-area knowledge
Troubleshoot data inconsistencies
Perform regular maintenance and testing on production reports and dashboards
Provide ad-hoc reporting and analysis services as required to meet business needs

Qualifications:
The right candidate will be flexible, action and results oriented, self-starting, have strong analytical skills, and be comfortable with a Microsoft Excel-driven environment. He or she must have a proven track record in analyzing and compiling data from multiple sources as well as creating reports for an executive management audience.

Required


Two+ years of recent experience as a data analyst, report developer, or another related title in a financial or banking environment
Experience creating and maintaining dashboards for KPI metrics and other performance measurables, preferred
Strong proficiency with the Microsoft Office Suite package including an expert knowledge of Excel
Two to three years of recent experience with Visual Basic or similar programming languages
Bachelor's Degree in Computer Science, Mathematics, or Business Administration

Desired


Demonstrated ability to effectively communicate with both internal and external customers, peers, and management
Ability to adapt to new, changing technologies used in day-to-day production tasks.

RoundPoint's Employee Value Proposition:
A team where quality is required, hard work is rewarded, and wins happen.

Our mission is to serve our homeowners and all of their homeownership needs. We do this by embracing challenges, executing with excellence, and fostering a positive work culture that encourages personal and professional growth. We are on the fast track to becoming the premier marketplace for all things home, and the National Mortgage News and Best Companies Group just named us one of 2019's Best Mortgage Companies to Work For! Without a doubt, RoundPointers are what make this company a great place to work! That's why we hire individuals who share our core values: Energy, Ethics, Execution, Everyone, and Earn it!

As a RoundPointer, we will empower you to innovate, provide meaningful solutions, set goals and crush them, play hard, and give back to the community! Our secret sauce is our mantra, All In. All Win. Together, we can achieve great things!

Physical Demands and Work Environment:
The physical demands described here are representative of those that must be met by an employee to successfully perform the essential functions of this position. Reasonable accommodations may be made to enable individuals with disabilities to perform the essential functions. While performing the duties of this job:


The employee is regularly required to talk or hear.
The employee is required to sit for extended periods of time and is occasionally required to stand and walk.
The employee must regularly use hands to finger, handle, or feel objects and is regularly required to reach with hands and arms; the employee may occasionally climb or balance, and stoop, kneel, crouch, or crawl.
The employee must frequently lift and/or move up to 10 pounds and occasionally lift and/or move up to 25 pounds.
Specific vision abilities required by this job include close vision, distance vision, color vision, and ability to adjust focus.
The noise level in the work environment is usually quiet to moderate, and no extreme conditions are present.

"
72,Data Analyst (Power Trading),"Dallas, TX",Dallas,TX,None Found,None Found,None Found,None Found,None Found,None Found,None Found,"About the team:
Capco is a fully independent, global management and technology consultancy providing services to the Financial Services and Energy industries. For nearly 20 years we have combined innovative thinking with deep industry knowledge to deliver business consulting, digital transformation and technology services to our clients. Our collaborative and efficient approach helps clients reduce costs and manage risk and regulatory change while increasing revenues. We are thinkers, innovators, and disruptors. We are small enough to care but large enough to matter.

About the Job:
This position involves analysis, design, and consulting support, as well as developing an understanding of our clients’ strategic direction, issues, and project goals. The successful candidate must have Power Marketing Operations experience with trading, settlements, and financial instruments used in various markets (ERCOT, ISO-NE, MISO, PJM, NYISO, CAISO) and familiarity with bids, offers, and awards processes in various Power Markets.

What You’ll Get to Do:
P&L Reporting
Conduct data analysis in Power Trading market
Gas trading data analysis
Conduct Physical and Financial Gas and Power trades
Data analysis of ISO operations and settlements

What You’ll Bring with You:
2+ years of Data Analysis experience
1+ year of experience working at a professional services consulting company
1+ year of experience working in Power Trading environment
Bachelor’s degree required with a major in MIS, Computer Science, Finance, Economics, Business or Financial Engineering preferred. (An advanced degree is desirable)
Data Analyst skills, including experience interviewing client executives to gather and document business requirements and process mapping
Strong presentation skills

Why Capco?
You will join a company that supports and encourages an entrepreneurial outlook and independent thinking. Capco is not about organizational charts and layers – we operate with little hierarchy because we want all employees to feel that Capco is their firm.

We offer highly competitive benefits, including medical, dental and vision insurance, a 401(k) plan, tuition reimbursement, and a work culture focused on innovation and creation of lasting value for our clients and employees.

Ready to get started?
If this sounds like you, we would love to hear from you. This is an opportunity to make a difference and contribute to a highly successful company with a significant growth trajectory."
73,Infrastructure Performance (high availability) Data Analyst - USC/GCH Only- C,"Coppell, TX 75019",Coppell,TX,75019,None Found,None Found,None Found,None Found,None Found,None Found,"Sr. Analyst (High Availability Management), Dallas, TX, Contract to Hire, High availability service operations, Gather Data, Execute & Produce service availability reports, Strong Data Analysis, Sharepoint, OpsCenter/ Service Now/ Salesforce/ SQL+

======================

Description:


Gather service availability data from a wide variety of sources such as OpsCenter, Service Now, Salesforce, Incident management escalations, and Subject Matter Experts Analyze client impact of service disruptionsExecute the service availability methodology to produce monthly reports for management audiences and/or other stakeholdersProduce custom reports as required by management and/or other stakeholdersWork on improvements to the service availability management process and toolsAs directed by the manager, enhance the methodology and tools as requirements and data sources changeContribute on improving cross functional requirements, communication and collaboration to reduce the number of production outagesManage archives of availability data and reports Liaise with partner teams to:-Determine and/or update new service level statements- just policies for compliance to regulatory requirements

===============

Why work with me when you see the same position advertised with others?
I am a senior staffing professional not a junior recruiter who doesn' t know what they are doing yet. I can answer your questions immediately. I know your skill set.
Resume won' t get lost in the "" black hole""
Feedback and follow through
Resume review, create relevancy
Better information on the company culture
Inside information on the hiring manager, team, the ideal profile, etc.
The best Interview preparation you will ever experience!


Please check out my profile on Linkedin and Email/ Message me @

kathleen.griffiths@sg.com

or

www.linkedin.com/in/kathleengriffiths/

Sr. Analyst (High Availability Management), Dallas, TX, Contract to Hire, High availability service operations, Gather Data, Execute & Produce service availability reports, Strong Data Analysis, Sharepoint, OpsCenter/ Service Now/ Salesforce/ SQL+"
