,Title,Location,City,State,Zip,Country,Qualifications,Skills,Responsibilities,Education,Requirement,FullDescriptions
87,Data Scientist Product Manager,"Austin, TX 78731",Austin,TX,78731,None Found,None Found,None Found,"
Build best in class AI products to create value for our customers and business.
Experience shipping successful products, including defining vision, strategy, outcome-driven product roadmaps and creating and managing backlogs
Analyze customer behavior and business performance to design and develop impactful analytics solutions/products.
Drive analytics program & product management while working with cross-functional teams.
Work with software engineering, data engineers, data scientist, architects and business to design actionable strategic products.
Lead cross-functional engagements to define problem statements, collect data, build analytical models and make recommendations.
Lead end-to-end AI product development from understanding the user requirements to successfully delivering products in production environment.",None Found,"
6+ years of relevant Product Management experience with at least 2+ years’ experience with AI/ML
Typically requires 12+ years of related experience in a professional role with a Bachelor’s degree; or 8+ years with a Master’s degree; or 5+ years with a PhD; or equivalent experience
Experience in most big data and statistical analytic tools: Python, Hadoop (Hive), SQL and machine learning algorithms/concepts.
Experience with lean startup or agile/Pivotal methodologies for developing products.
Hands-on analytics capabilities, expertise in analytical problem-solving techniques and frameworks and the ability to deal with large volumes of data.
Strong communication skills, including the ability to convey analytic insights effectively to both IT and business audiences
Strong teamwork, business acumen, and customer advocacy skills","Data Scientist Product Manager
Austin, TX
Dell provides the technology that transforms the way we all work and live. But we are more than a technology company — we are a people company. We inspire, challenge and respect every one of our over 100,000 employees. We also provide them with unparalleled growth and development opportunities. We can’t wait for you to discover this for yourself as a Data Scientist Product Manager.
Product Development Management is a fast-paced environment where innovative thinking is prized. Our team focuses on the delivery of products or computer-based systems for external customers. We lead and deliver the entire lifecycle from product definition and planning through to production and release. We also oversee modifications, upgrades and maintenance of the product or product line. And to make the whole process run smoothly and seamlessly, we’re experts in analytics project management, from initiation through to delivery, and liaise with other departments on technical matters. We are looking for a candidate who has a strong background in product management, data science and analytical problem-solving.
Responsibilities:
Build best in class AI products to create value for our customers and business.
Experience shipping successful products, including defining vision, strategy, outcome-driven product roadmaps and creating and managing backlogs
Analyze customer behavior and business performance to design and develop impactful analytics solutions/products.
Drive analytics program & product management while working with cross-functional teams.
Work with software engineering, data engineers, data scientist, architects and business to design actionable strategic products.
Lead cross-functional engagements to define problem statements, collect data, build analytical models and make recommendations.
Lead end-to-end AI product development from understanding the user requirements to successfully delivering products in production environment.
Requirements:
6+ years of relevant Product Management experience with at least 2+ years’ experience with AI/ML
Typically requires 12+ years of related experience in a professional role with a Bachelor’s degree; or 8+ years with a Master’s degree; or 5+ years with a PhD; or equivalent experience
Experience in most big data and statistical analytic tools: Python, Hadoop (Hive), SQL and machine learning algorithms/concepts.
Experience with lean startup or agile/Pivotal methodologies for developing products.
Hands-on analytics capabilities, expertise in analytical problem-solving techniques and frameworks and the ability to deal with large volumes of data.
Strong communication skills, including the ability to convey analytic insights effectively to both IT and business audiences
Strong teamwork, business acumen, and customer advocacy skills
Preferences:
Experience working within global teams
Experience with large, high-volume web sites
Benefits
We offer highly competitive salaries, bonus programs, world-class benefits, and unparalleled growth and development opportunities — all to create a compelling and rewarding work environment.
Dell is committed to the principle of equal employment opportunity for all employees and to providing employees with a work environment free of discrimination and harassment. All employment decisions at Dell are based on business needs, job requirements and individual qualifications, without regard to race, color, religion or belief, national, social or ethnic origin, sex (including pregnancy), age, physical, mental or sensory disability, HIV Status, sexual orientation, gender identity and/or expression, marital, civil union or domestic partnership status, past or present military service, family medical history or genetic information, family or parental status, or any other status protected by the laws or regulations in the locations where we operate. Dell will not tolerate discrimination or harassment based on any of these characteristics. Dell encourages applicants of all ages. Learn more about Diversity and Inclusion at Dell here."
88,"Managing Director, Data Science","Austin, TX",Austin,TX,None Found,None Found,None Found,None Found,None Found,None Found,None Found,"Your Opportunity
Charles Schwab’s purpose is to champion every client’s goals with passion and integrity. Through advocacy and innovation, Schwab has worked to make investing more affordable, more accessible and more understandable for all. For more than three decades, The Charles Schwab Corporation has been an advocate for individual investors and the independent advisors who serve them.

We provide securities brokerage, banking, and related financial services to individuals and institutional clients. Schwab operates through two segments: Investor Services and Institutional Services. The Investor Services segment provides retail brokerage and banking services to individual investors. It offers research, analytic tools, performance reports, market analysis, and educational material to its clients. The Institutional Services segment provides custodial, trading, and support services to registered independent Investment Advisors (RIA's). This segment also provides retirement plan services, specialty brokerage services and mutual fund clearing services and supports the availability of Schwab proprietary mutual funds and collective trust funds on third-party platforms. Institutional also serves employer sponsored plans: equity compensation plans, defined contribution plans, defined benefit plans, nonqualified deferred compensation plans and other employee benefit plans.

The Analytics & Business Insight (ABI) organization supports multiple business units across Schwab through quantitative-based decision support. Our mission is to help Schwab better understand the needs and behaviors of our prospects and clients through statistical analysis, predictive modeling, market research, and business intelligence.
Our analytical teams within ABI provide the organization with advanced quantitative analyses and insights that help guide development of new product/service offerings, better target prospects and clients through informed marketing efforts, increase acquisition of desired prospects, understand the ROI of advertising and marketing promotions, measure and assess the impact of business strategies, and identify strategies to grow client engagement, retention, and loyalty. Our analytical services are in heavy demand as our team is a critical component in Schwab’s commitment to being a leading data-driven organization.
What you’re good at
The Managing Director, Data Science will leverage statistical algorithms to provide decision makers across Schwab with insights and solutions to important business projects. This position will use a wide range of modeling techniques including but not limited to machine learning, deep learning, Bayesian modeling, time series and econometric modeling, design of experiments, marketing mix modeling, and other approaches. In addition, the position will also work on exploring most recent innovations in modeling techniques and applying those to structured and unstructured data across various business use cases.
There will be a diverse set of business applications and project areas that this position will be responsible for. This includes areas such as:
Recommendation systems across different product, content and user levels
NLP/NLU/NLG based Conversational assistants and other relevant use cases
Anomaly detection for cybersecurity and other relevant use cases
Predictive modeling for acquisition, retention and asset consolidation
Business impact analyses to help the firm determine the ROI on strategic investments
Customer lifetime value modeling
Provide data science vision and leadership on using modeling and algorithms to uncover new insights that drive decisions to impact the business
Support multiple business units and use cases on a wide range of advanced modeling projects
Consult with business partners to understand and define their needs in terms of clear data science project deliverables
Fully scope modeling projects including defining clear business value, determining modeling approach in discussion with data scientists, identifying right resources needed, development of execution plan and realizing business impact
Work independently or collaboratively throughout the complete project lifecycle across a range of cross-functional teams including product managers, data engineers, architects, and other business plus engineering teams
Clearly communicate methodologies and results to increase our business partners’ understanding and confidence in Advanced modeling capabilities and recommendations
Work with UI/UX/market researchers, various business partners, engineering teams and other analytical teams to align and integrate modeling efforts in various end user applications
Provide education and consultation to various cross-functional teams and decision makers to understand impact of AI to frame and solve complex business problems.
What you have
MS/PhD in Machine Learning, Computer Science or other quantitative disciplines highly preferred
10 years or more work experience in an advanced modeling role (working with external clients and/or internal business partners)
Strong Python/R and SQL programming and data mining experience.
Solid understanding of machine learning algorithms and their appropriate use for wide variety of use cases across marketing, product, sales, service and risk
Experience with Hadoop ecosystem including experience in data mining using Hive, Sqoop, Drill, plus other query languages
Ability to work with large transactional databases across multiple platforms (Teradata, Oracle, HDFS, SAS)
Proven ability to execute complex modeling projects end to end for a large Fortune 500 company
Outstanding oral and written communication and interpersonal skills; skill & interest in communicating with senior levels of management.
Must be able to clearly understand and articulate the linkage between business objectives/ decisions and analytical approaches & findings.
Must possess strong interview/consulting skills to probe deep into questions, the broad analytic skill set to ensure they are solved appropriately and the narrative skills to recommend action steps.
Must possess a love for problem solving and genuinely enjoy helping our business partners succeed.
Financial services experience preferred."
89,Data Scientist,"Austin, TX",Austin,TX,None Found,None Found, Full-time,None Found," Aggregate and analyze data sets from multiple data sources Work closely with operations engineers and development engineers to implement database solutions Collaborate with team to establish and manage best practices for data aggregation and management Develop data structures and pipelines to organize, collect and standardize data to help generate insights and address reporting needs Gain familiarity with NetSuite solutions and customer needs Use CSI toolset to summarize, understand, and escalate customer-impacting issues Audit past events to determine true customer impact Help identify areas for improvement in process, procedure & monitoring among all Operations teams Establish rapport with all Operations teams and managers Manage projects addressing long term, permanent resolutions for major issues",None Found,None Found,"Data Scientist-190019NU


No Visa Sponsorship is available for this position.

Preferred Qualifications

Employment Type Full-time
Job Functions Data analytics, statistical analysis, database management
 Title Data Analyst / Data Scientist

The Continual Service Improvement (CSI) team is a global team created to promote a culture of cross-functional collaboration and continuous improvement throughout NetSuite operations. We serve as the first point of contact for all issues that have impacted our customer-facing production environment. The team’s foremost responsibility is to keep those issues from recurring using the resources available to identify, resolve, or escalate issues to the appropriate person or team.

As a CSI team member, you will work directly with regional Event Managers and the Global Service Improvement organization to record and update all information on issues that are being managed under the Continual Service Improvement (CSI) Process. CSI is an ITIL-based process that uses methods from quality management in order to learn from past successes and failures. Our program aims to continually improve the effectiveness and efficiency of SaaS service delivery, in line with the concept of continual improvement adopted in ISO 20000.

CSI is global with members in Austin, TX; Brno, Czech Republic; and Sydney, Australia. Despite the distance, the team is a close-knit and collaborative group. Each member brings a unique skillset to create a robust and knowledgeable team.

Responsibilities: Aggregate and analyze data sets from multiple data sources Work closely with operations engineers and development engineers to implement database solutions Collaborate with team to establish and manage best practices for data aggregation and management Develop data structures and pipelines to organize, collect and standardize data to help generate insights and address reporting needs Gain familiarity with NetSuite solutions and customer needs Use CSI toolset to summarize, understand, and escalate customer-impacting issues Audit past events to determine true customer impact Help identify areas for improvement in process, procedure & monitoring among all Operations teams Establish rapport with all Operations teams and managers Manage projects addressing long term, permanent resolutions for major issues

Qualifications: BS, MS or advanced professional certificate in data science, data analytics, statistics, mathematics, economics, computer science or related field 1 - 2 years experience with quantitative data analysis Fluency in Python (or R) Knowledge of advanced statistics, machine learning, predictive modeling and data aggregation Knowledge of database architecture – SQL, NoSQL (knowledge of Oracle databases a plus) Solid command of Excel Experience with Unix or Linux Excellent written and verbal communication, conflict resolution, and meeting management Excellent troubleshooting skills Motivated to work quickly and accurately under pressure in time-critical situations Strategic thinker, big-picture oriented

Preferred Qualifications Advanced knowledge of 2 or more: Advanced mathematics, Big data, API Interactions, Tableau, Git/GitHub, JavaScript, HTML Experience with ELK/Kibana Data Center and Networking experience Database knowledge in Cassandra and/or Redis Confluence, JIRA, Visio, PowerPoint, Smart Sheet Technical Project Team/Management experience (PMP a plus)

Detailed Description and Job Requirements

Designs, develops and programs methods, processes, and systems to consolidate and analyze unstructured, diverse “big data” sources to generate actionable insights and solutions for client services and product enhancement.

Interacts with product and service teams to identify questions and issues for data analysis and experiments. Develops and codes software programs, algorithms and automated processes to cleanse, integrate and evaluate large datasets from multiple disparate sources. Identifies meaningful insights from large data and metadata sources; interprets and communicates insights and findings from analysis and experiments to product, service, and business managers.

Job duties are varied and complex utilizing independent judgment. May have project lead role. 5 years relevant work experience. BS/BA preferred.

Oracle is an Affirmative Action-Equal Employment Opportunity Employer. All qualified applicants will receive consideration for employment without regard to race, color, religion, sex, national origin, sexual orientation, gender identity, disability, protected veterans status, age, or any other characteristic protected by law."
90,Data Scientist,"Austin, TX",Austin,TX,None Found,None Found,None Found,None Found,None Found,None Found,None Found,"About Us

At Cloudflare, we have our eyes set on an ambitious goal: to help build a better Internet. Today the company runs one of the world's largest networks that powers trillions of requests per month. Cloudflare protects and accelerates any Internet application online without adding hardware, installing software, or changing a line of code. Internet properties powered by Cloudflare have all web traffic routed through its intelligent global network, which gets smarter with every request. As a result, they see significant improvement in performance and a decrease in spam and other attacks. Cloudflare was recognized by the World Economic Forum as a Technology Pioneer and named to Entrepreneur Magazine's Top Company Cultures list.

We realize people do not fit into neat boxes. We are looking for curious and empathetic individuals who are committed to developing themselves and learning new skills, and we are ready to help you do that. We cannot complete our mission without building a diverse and inclusive team. We hire the best people based on an evaluation of their potential and support them throughout their time at Cloudflare. Come join us!

About the department

Cloudflare is looking to build and grow our Business Intelligence team responsible for building large-scale enterprise data lake and EDW from different sources and enabling various product and business teams such as Marketing, Customer Support, Sales, Finance with key business dashboards/reporting, insights and recommendation models.

About the role

As part of this initiative, we are looking for a strong data scientist to come join Cloudflare and help us drive predictive analytic insights and best practices at scale from the ground up. This is a high visibility role and success in this role comes from marrying a strong data & modeling background with acute product and business acumen to deliver highly strategic and compelling insights that accelerate our business growth and influence our product decisions within Cloudflare. This person will also play a crucial role in hiring and growing the data science team in Austin in a rapid manner.

What we look for: Predictive Modeling techniques, Machine Learning, Model creation and deployment, Storytelling and Visualization, Strong Business & Product acumen, Cross-functional Collaboration, Creative Problem solving, Agile

What you'll do
--------------


Partner and align with business leaders, stakeholders, product managers and internal teams to understand the business and product challenges and goals and address them using predictive analytics in a globally distributed environment.
Understand data landscape i.e tooling, tech stack, source systems etc. and work closely with the data engineering team to improve the data collection and quality.
Understand business/product strategy and high-level roadmap and align analysis efforts to enable them with data insights and help achieve their strategic goals.
Strong audience focused presentation and storytelling skills focused on key takeaways in a crisp and concise manner.
Define, implement, and train statistical, machine learning, and deep learning models.
Use software engineering best practices to publish model scores/insights/learnings at scale within the company.
Ability to define and spot macro and micro levels trends with statistical significance on a regular basis and understand key drivers driving those trends.
Active role in hiring, growing, and mentoring the data scientist team in Austin.

Examples of desirable skills, knowledge and experience


M.S or Ph.D in Computer Science, Statistics, Mathematics, or other quantitative field.
Strong experience in scientific computing using Python, R, or Scala.
Experience with Spark, SQL, Tableau, Google Analytics, Hive and BigQuery (or any other Big data/Cloud equivalent) etc.
Experience working with and processing structured, unstructured, and semi-structured data.
Work closely with data engineering team to ensure robust data pipelines and model deployment.
Proven track record of applying data insights and machine learning in order to address business needs and drive revenue.
5+ years of data scientist experience with proven industry experience in a large scale environment (PBs scale, globally distributed teams).
2+ years experience with a fast-growing SaaS business based company is preferred.
Strong communication and presentation skills catered to different audience within the company.
Capable of working closely with business, engineering, and product teams to ensure data initiatives are aligned with business needs.
Experience in hiring data scientists and establishing team best practices is preferred.

What Makes Cloudflare Special?

We're not just a highly ambitious, large-scale technology company. We're a highly ambitious, large-scale technology company with a soul. Fundamental to our mission to help build a better Internet is protecting the free and open Internet.

Project Galileo ( https://blog.cloudflare.com/protecting-free-expression-online/ ): We equip politically and artistically important organizations and journalists with powerful tools to defend themselves against attacks that would otherwise censor their work, technology already used by Cloudflare's enterprise customers--at no cost.

Project Athenian ( https://www.cloudflare.com/athenian/ ): We created Athenian Project to ensure that state and local governments have the highest level of protection and reliability for free, so that their constituents have access to election information and voter registration.

Path Forward Partnership ( https://blog.cloudflare.com/tag/path-forward/ ): Since 2016, we have partnered with Path Forward, a nonprofit organization, to create 16-week positions for mid-career professionals who want to get back to the workplace after taking time off to care for a child, parent, or loved one.

1.1.1.1 ( https://1.1.1.1/ ): We released1.1.1.1 ( https://1.1.1.1/ ) to help fix the foundation of the Internet by building a faster, more secure and privacy-centric public DNS resolver. This is available publicly for everyone to use - it is the first consumer-focused service Cloudflare has ever released. Here's the deal - we don't store client IP addresses never, ever. We will continue to abide by ourprivacy policy ( https://developers.cloudflare.com/1.1.1.1/commitment-to-privacy/privacy-policy/privacy-policy/ ) and ensure that no user data is sold to advertisers or used to target consumers.

Sound like something you'd like to be a part of? We'd love to hear from you!

Cloudflare is proud to be an equal opportunity employer. We are committed to providing equal employment opportunity for all people and place great value in both diversity and inclusiveness. All qualified applicants will be considered for employment without regard to their, or any other person's, perceived or actual race, color, religion, sex, gender, gender identity, gender expression, sexual orientation, national origin, ancestry, citizenship, age, physical or mental disability, medical condition, family care status, or any other basis protected by law. We are an AA/Veterans/Disabled Employer.

Cloudflare provides reasonable accommodations to qualified individuals with disabilities. Please tell us if you require a reasonable accommodation to apply for a job. Examples of reasonable accommodations include, but are not limited to, changing the application process, providing documents in an alternate format, using a sign language interpreter, or using specialized equipment. If you require a reasonable accommodation to apply for a job, please contact us via e-mail at hr@cloudflare.com or via mail at 101 Townsend St. San Francisco, CA 94115."
