,Title,Location,City,State,Zip,Country,Qualifications,Skills,Responsibilities,Education,Requirement,FullDescriptions
54,Global Technology Analyst Program - 2020,"New York, NY",New York,NY,None Found,None Found,"
Candidates are required to be pursuing a BA/BS degree from an accredited college or university with a graduation timeframe between December 2019 and June 2020
Undergraduate degree in Computer Science, Computer Engineering, Information Systems or similar degree of relevance",None Found,None Found,None Found,None Found,"Job Description & Program Overview
Global Technology & Operations (GT&O) provides end-to-end technology and fulfillment to individual consumers, small businesses, middle-market businesses and large corporations. Globally, GT&O manages the critical systems and multiple platforms needed to maintain the enterprise’s market-leading positions in key segments, including deposits, payment products, consumer lending, wealth management, small business and middle-market lending, treasury services, investment banking, and sales and trading.
The Global Technology Analyst Program is a one-year global development program designed to develop high potential graduates and facilitate your transition from academia to a professional career so you can hit the ground running from day one. It not only provides program management support, but also structured learning and development training, and networking opportunities. The learning curriculum focuses on business, technical and soft skills. As part of new hire experience, participants will attend an orientation training event to provide a strong foundation upon which to build their knowledge and career.
The job profiles for the Global Technology Analyst Program include:*
Business Analyst: As a business analyst, your key tasks and responsibilities may include but are not limited to:
Gather, analyze, and document business and system requirements
Act as the liaison between business partners and software development teams
Translate business requirements into technical requirements and ensure that systems or applications support and conform to business needs and specifications
Coordinate the process of analyzing functional specifications, use cases, process flows and user interface requirements
Collaborate with software testers to develop valid test plans and test scripts
Data Science: As a Data Scientist, your key tasks and responsibilities may include but are not limited to:
Gather and translate internal and external client requirements into technical design specifications suitable for the application of machine learning
Provide technical excellence to apply state-of-the-art machine learning / artificial intelligence utilizing technologies such as Spark, R, Hadoop, Scala, SQL to real world infrastructure business problems. Define strategies and parameters for predictive models and data mining projects, ensuring data integrity and usability
Partner with business, product and technology teams across the organization to evolve machine learning and data science capabilities within the bank
Developer: As a Developer, your key tasks and responsibilities may include but are not limited to:
Provide technical excellence to design, develop and maintain state-of-the-art technology applications utilizing technologies such as Java/EJB’s, C++, .NET, Python and Web services
Gather and translate internal and external client requirements into technical design specifications, business process reengineering
Mainframe Analyst: As a Mainframe Analyst, your key tasks and responsibilities may include but are not limited to:
Knowledge in basic IBM Mainframe systems (e.g. transaction and database managers, message queue managers, and operating system and communication services)
Technical skills to include basic knowledge of one or more mainframe technologies (e.g. CICS, DB2, IMS, WMQ, z/OS); as well as Job Control Language (JCL)
Network Analyst: As a Network Analyst, your key tasks and responsibilities may include but are not limited to:
Provide technical support to include network monitoring, response, continuity, reporting and post incident follow-up. Technical skillsets include: Networking (TCP IP, Routing protocols, CCNA, Ethernet), Data, Voice and/or Security Infrastructure.
Responsible for the requirements gathering, design, engineering, and implementation lifecycle of standard service requests tied to the delivery of infrastructure services specific to the respective infrastructure technology platform
Cybersecurity Analyst: As a Cybersecurity Analyst, your key tasks and responsibilities may include but are not limited to:
Provide analytical, strategic and technical skills to design, develop, implement and use state-of-the-art technology cybersecurity solutions aimed at reducing risk.
Responsible for delivering innovative capabilities in team environment, as well as leveraging skills, background and interests for a specific group within Global Information Security.
Majority of opportunities available are developer roles.
Qualifications
Required skills:
Candidates are required to be pursuing a BA/BS degree from an accredited college or university with a graduation timeframe between December 2019 and June 2020
Undergraduate degree in Computer Science, Computer Engineering, Information Systems or similar degree of relevance
Desired skills:
3.2 minimum GPA preferred
Strong work ethic and ability to work in a fast-paced environment
Detail orientated and teamwork orientation
Demonstrated problem solving abilities
Leadership skills
Commitment to building a complete technical and business skill set"
55,Senior Data Scientist,"New York, NY",New York,NY,None Found,None Found,None Found,None Found,None Found,None Found,None Found,"At Feather, our mission is to transform people's relationship with material goods to create a healthier and happier planet. You'll join a fast-paced, innovative team whose passion lies in delighting customers and helping people live light.

Feather is seeking a Data hire to work closely with our leadership team and investors to help drive the strategic direction of the company.

You're a great fit if you're happy to get your hands dirty but also understand strategy and have the desire to build a team as we scale.

What you'll be doing:

Use analytical thinking, mathematics, and data manipulation to build models that can be used across various functions within Feather's operations, engineering, and finance teams to make better and faster decisions
Build scalable practices to create a solid foundation for Feather's backend data structure
Clearly define analytical business problems and create innovative solutions for them by facilitating the application of cutting edge techniques
Create a foundation for a data team and build the team over time by developing KPIs for the function and job descriptions for additional data hires.
Transform large sets of raw data into easily consumable reports and models to be read by technical and non-technical users
Create dashboards and reports to empower teams (within Looker or excel).

What you need to be successful:

3+ years experience in a data-focused role
Experience in SQL or other programming languages (like Javascript, Python, SAS)
Strong written and verbal communication to easily articulate findings to teams with varying degrees of experience with data analysis
Ability to work as an individual contributor to tackle basic data needs, and context switch to use higher level thinking in team meetings and strategy planning.
Experience applying Machine Learning techniques and using platforms such as TensorFlow, Azure, R, Pandas, SparkR, etc.
Experience with Looker and the LOOKML, as well as creating models.
Experience and background in Finance is a big plus.
Some experience with AWS - Redshift services.
Some Data Engineering experience or knowledge of ETL process preferred.

Who you are:

Based in NYC (or willing to move)
Excited about joining a small team and growing with Feather
Passionate about Feather's mission
Eligible to work in the United States

What you'll get when joining Feather:

Competitive compensation
Generous health, vision, dental, and ancillary benefits
Flexible vacation and paid time off
A 50% discount on your own Feather subscription
The latest MacBook and a high-resolution external monitor
A stylish desk and an ergonomic chair (it's what we do, after all!)

"
56,Senior Data Scientist – Premium Analytics,"New York, NY 10011",New York,NY,10011,None Found,None Found,None Found,None Found,None Found,None Found,"We are looking for an experienced Data Science expert to build, grow and lead a team of Data Scientists specialized within propensity score modeling and audience segmentation within Spotify Premium. This is a highly impactful role where you and your team will use data to help paint the best possible picture of what our customers want. Your findings will impact how our Premium product is experienced, packaged and sold around the world.

What you’ll do
Plan, build and be responsible for the statistical modelling needed to deepen our understanding of customer segments
Use machine learning and industry-leading tools and methods to deepen our customer preference understanding
Over time you will build a team of Data Scientists within Spotify Premium
Closely collaborate and partner with senior leaders across multiple teams and disciplines
Who you are
You have a Degree in Science, Statistics, Economics, Mathematics, or other relevant quantitative subject
You have 5 years or more experience of Data Science. Leadership and management experience is a plus.
You have experience with machine learning, customer segmentation, clustering models and propensity scoring
You have experience using survey data combined with large scale data sets to train statistical models
You have a proven understanding of statistics coupled with strong business acumen
You are an excellent communicator with the ability to clearly and concisely explain complex and technical topics to business stakeholders
You have strong project management skills with the ability to lead and prioritize work in order to deliver on high impact projects in a timely manner
You thrive in a fast-paced, dynamic and high energy environment and are comfortable with ambiguity
You prioritize simplicity over complexity
You are comfortable writing code on a daily basis (such as Python/R, Java, Scala) and have strong SQL skills"
57,"Data Scientist, Sr. Principal","New York, NY",New York,NY,None Found,None Found,"
An AI practitioner with hands on experience in designing and deploying machine learning solutions
Excellent understanding of machine learning techniques and algorithms, such as k-NN, Naive Bayes, SVM, Decision Forecasts, etc.
Experience with common data science toolkits, such as R, NumPy, MatLab, etc.
Experience with data visualization tools
Proficiency in using query languages and databases
Applied statistics skills, such as distributions, statistical testing, regression, etc.
Entrepreneurial and results oriented
Excellent analytical and problem solving skills
Able to deal well with uncertainty and unstructured problems to be solved
Able to work across businesses and functions at all levels
Able to lead ad-hoc and structured teams for achieving goals within established time parameters
Excellent interpersonal skills necessary to accomplish goals through others, including employees, peers, and other function/business areas of the company
10-12 years of related experience preferred
Experience in the securities, financial services, or asset management industry a plus
Graduate degree from top universities a plus
",None Found,None Found,None Found,None Found,"Who we are
For over 230 years, Bank of New York Mellon (BNY Mellon) has been at the center of the global financial markets, providing the world’s leading institutions the tools, capabilities, and services to be distinctive investors. BNY Mellon has approximately $15 billion in revenues and market capitalization of approximately $50 billion.

BNY Mellon is a leader in the world of investment services and investment management, and our businesses support the full range of stakeholders of the financial system including:
Managing the custody of over $31 trillion financial assets of the world’s leading institutional investors, hedge funds, sovereign wealth funds, and corporates
Investing over $1.8 trillion as one of the largest global asset managers across a wide range of asset classes
Providing collateral, liquidity, and funding for the world’s largest banks through our markets franchise
Serving family offices and high net worth individuals in our top 10 wealth manager ($250 billion assets)
Providing a full suite of solutions to advisors, broker-dealers, family offices, hedge and '40 Act fund managers, registered investment advisor firms and wealth managers (over $1.8 trillion in client assets)
Advising large global corporations on a range of trust and other solutions
Providing integrated managed data services to asset managers (over $4.7 trillion)
In addition, BNY Mellon is a strategic partner to a variety of financial technology companies and a convener of influential industry and market structure forums.
What we are doing
Chairman & CEO Charlie Scharf recently announced the launch of a newly formed global digital team, led by Roman Regelman, a former BCG partner who drove a number of large scale digital transformations for global financial services clients. The Digital team drives BNY Mellon’s core digitization strategy and is responsible for mapping our digital future, investing in digital client and internal capabilities, including data management, analytics, artificial intelligence, machine learning and robotics.
The Digital team focuses on maximizing investments in our digital capabilities to drive significant improvements in business performance and the client and employee experience. The team is accelerating the bank’s innovation strategy, developing more cross-functional integration and mining best practices to integrate across businesses, regions, front line relationship managers, innovation centers. We are currently looking to fill positions at our global headquarters in Tribeca, New York.
Role responsibilities
As a member of the Advanced Digital Solutions team, the primary focus and responsibilities will be to deliver tangible value and advance the digital agenda across the enterprise by accelerating effective use of AI. Main responsibilities will include:
Serving as AI solutions expert to address critical business needs in partnership with business teams, digital team members and technology. This includes designing and delivering proofs of concept as required.
Providing guidance on AI capabilities – available internally or in the market place – to determine best path forward factoring in feasibility, maturity of solutions, cost, time to market etc.
Driving the use of shared library / repository and model management of AI solutions across the enterprise
Driving / promoting best practices on effective use of AI solutions
Supporting lines of business and functions in developing AI capabilities to drive scale
Qualifications
Bachelor’s Degree in business or a related discipline, or equivalent work experience required. Advanced degree in Math, Science / Engineering or a related discipline is preferred.
Preferred Qualifications:
An AI practitioner with hands on experience in designing and deploying machine learning solutions
Excellent understanding of machine learning techniques and algorithms, such as k-NN, Naive Bayes, SVM, Decision Forecasts, etc.
Experience with common data science toolkits, such as R, NumPy, MatLab, etc.
Experience with data visualization tools
Proficiency in using query languages and databases
Applied statistics skills, such as distributions, statistical testing, regression, etc.
Entrepreneurial and results oriented
Excellent analytical and problem solving skills
Able to deal well with uncertainty and unstructured problems to be solved
Able to work across businesses and functions at all levels
Able to lead ad-hoc and structured teams for achieving goals within established time parameters
Excellent interpersonal skills necessary to accomplish goals through others, including employees, peers, and other function/business areas of the company
10-12 years of related experience preferred
Experience in the securities, financial services, or asset management industry a plus
Graduate degree from top universities a plus

BNY Mellon is an Equal Employment Opportunity/Affirmative Action Employer.
Minorities/Females/Individuals With Disabilities/Protected Veterans.

Primary Location: United States-New York-New York
Internal Jobcode: 70194
Job: Digital
Organization: Digital Global-HR17565
Requisition Number: 1906801"
58,"Data Scientist, Product Analytics","New York, NY 10017",New York,NY,10017,None Found,None Found,None Found,None Found,None Found,None Found,"Facebook's mission is to give people the power to build community and bring the world closer together. Through our family of apps and services, we're building a different kind of company that connects billions of people around the world, gives them ways to share what matters most to them, and helps bring people closer together. Whether we're creating new products or helping a small business expand its reach, people at Facebook are builders at heart. Our global teams are constantly iterating, solving problems, and working together to empower people around the world to build community and connect in meaningful ways. Together, we can help people build stronger communities — we're just getting started.
We’re looking for Data Scientists to work on our core and business products (ex. Instagram, Messaging, Growth, Engagement, Ads) to help shape the future of what we build at Facebook. You will enjoy working with one of the richest data sets in the world, cutting edge technology, and the ability to see your insights turned into real products on a regular basis. The perfect candidate will have a background in a quantitative or technical field, will have experience working with large data sets, and will have some experience in data-driven decision making. You are focused on results, a self-starter, and have demonstrated success in using analytics to drive the understanding, growth, and success of a product.
RESPONSIBILITIES
Apply your expertise in quantitative analysis, data mining, and the presentation of data to see beyond the numbers and understand how our users interact with both our consumer and business products
Partner with Product and Engineering teams to solve problems and identify trends and opportunities
Inform, influence, support, and execute our product decisions and product launches
The Data Scientist Analytics role has work across the following four areas:
Product Operations
Forecasting and setting product team goals
Designing and evaluating experiments
Monitoring key product metrics, understanding root causes of changes in metrics
Building and analyzing dashboards and reports
Building key data sets to empower operational and exploratory analysis
Evaluating and defining metrics
Exploratory Analysis
Proposing what to build in the next roadmap
Understanding ecosystems, user behaviors, and long-term trends
Identifying new levers to help move key metrics
Building models of user behaviors for analysis or to power production systems
Product Leadership
Influencing product teams through presentation of data-based recommendations
Communicating state of business, experiment results, etc. to product teams
Spreading best practices to analytics and product teams
Data Infrastructure
Working in Hadoop and Hive primarily, sometimes MySQL, Oracle, and Vertica
Automating analyses and authoring pipelines via SQL and Python based ETL framework
MINIMUM QUALIFICATIONS
4+ years of experience doing quantitative analysis within a large-scale company or fast-paced environment
BA/BS in Computer Science, Math, Physics, Engineering, Statistics or other technical field. Advanced degrees
Experience in SQL or other programming languages
Development experience in any scripting language (PHP, Python, Perl, etc.)
Experience communicating the results of analyses with product and leadership teams to influence the strategy of the product
Knowledge of statistics (e.g. hypothesis testing, regressions)
Experience manipulating data sets through statistical software (ex. R, SAS) or other methods
PREFERRED QUALIFICATIONS
Experience with distributed computing (Hive/Hadoop)
Experience working within the tech sector preferred
Facebook is committed to providing reasonable accommodations for qualified individuals with disabilities and disabled veterans in our job application procedures. If you need assistance or an accommodation due to a disability, you may contact us at accommodations-ext@fb.com."
59,Data Scientist,"New York, NY 10176",New York,NY,10176,None Found,None Found,None Found,None Found,None Found,None Found,"By selecting “Apply” above, you indicate you have read and acknowledge the Dow Jones Applicant Privacy Notice and Dow Jones Cookie Policy , including data transfers as described in the Policy.
Job Description:
We are looking for a data scientist to join the Data Science & Analytics team for The Wall Street Journal’s Membership group. In this role, you will lead our efforts in machine learning and product analytics, working on the development and refinement of critical models for our business—including the propensity model behind WSJ’s dynamic paywall. Additionally, you will serve as an evangelist for analytics within our organization and develop metrics for measuring engagement within our products.
The role will require a strong understanding of data wrangling, log-level usage data, and production models. You will need strong organization skills, and will oversee the execution of large scale data projects. An interest in best-in-class design and engineering, as well as visualization and storytelling, will also be critical to your success in this role.
Requirements:
You have at minimum bachelor’s degree in information systems, computer science, mathematics, data analytics, data science, or a related quantitative discipline. Applicants with strong technical experience and a professional background in media are also encouraged to apply.
At least 2-5 years of experience working in a data-related role is preferred.
You have strong coding skills in R and/or Python and understand version control software (git/GitHub).
You have a mastery of analytics tools (SQL, Tableau, Adobe/Google Analytics).
You are well versed in the fundamentals of statistics and have a working understanding of machine learning algorithms and their applications.
You have an entrepreneurial attitude toward work and sweat the details.
You have an interest in continued learning and stay well versed in new technologies that can be applied to your work.
Dow Jones , Making Careers Newsworthy
All qualified applicants will receive consideration for employment without regard to race, color, religion, sex, national origin, protected veteran status, or disability status. EEO/AA/M/F/Disabled/Vets .
Dow Jones is committed to providing reasonable accommodation for qualified individuals with disabilities, in our job application and/or interview process. If you need assistance or accommodation in completing your application, due to a disability, please reach out to us at TalentResourceTeam@dowjones.com . Please put “Reasonable Accommodation"" in the subject line.
Business Area: WSJ MEMBERSHIP GROUP
Job Category: Sales Ops/Planning/Support Group
About Us
Dow Jones is a global provider of news and business information, delivering content to consumers and organizations around the world across multiple formats, including print, digital, mobile and live events. Dow Jones has produced unrivaled quality content for more than 125 years and today has one of the world’s largest news gathering operations globally. It produces leading publications and products including the flagship Wall Street Journal, America’s largest newspaper by paid circulation; Factiva, Barron’s, MarketWatch, Financial News, DJX, Dow Jones Risk & Compliance, Dow Jones Newswires, and Dow Jones VentureSource.Dow Jones is a division of News Corp (NASDAQ: NWS, NWSA; ASX: NWS, NWSLV).
If you are a current employee at Dow Jones, do not apply here. Please go to the Career section on your Workday homepage and view ""Find Jobs - Dow Jones."" Thank you.
Req ID: 18133"
