,Title,Location,City,State,Zip,Country,Qualifications,Skills,Responsibilities,Education,Requirement,FullDescriptions
0,Data Scientist,"Manhattan, NY",Manhattan,NY,None Found,None Found,None Found,None Found,None Found,None Found,None Found,"The Mayor’s Office of the Chief Technology Officer (MOCTO) facilitates citywide coordination and collaboration on technology issues, serves as a catalyst for and advises agencies on innovation, and interacts with the wider New York City technology ecosystem. MOCTO proactively engages with technologists to help influence the delivery of new technologies that can positively impact the public realm. MOCTO helps prepare the City for technology transformation and the outcomes that will impact the future of our City, from urban planning, to government services, to policy and decision-making.

The Data Scientist will report to the Deputy Chief Technology Officer for Digital in the Mayor’s Office of the Chief Technology Officer (MOCTO).

Responsibilities will include:
Work closely with Product Managers and Web Developers to gain insights from data in order to deliver higher quality, lower cost services online;Work under the direction of a Product Manager when working on a specific team, product, or project;Manipulate and analyze data to identify patterns and predict outcomes;Create data visualizations to communicate insights;Establish data-related project deliverables, including: scope, timeline, reporting cadence, impact, quality measures, and technical documentation;Perform special technology or data science-related projects, as assigned;Build predictive analytics models.
The position’s responsibilities include commitment to and compliance with the City’s EEO policy.


Minimum Qual Requirements

1. A baccalaureate degree from an accredited college including or supplemented by 24 credits in the field of voice and/or data telecommunications or in a pertinent scientific, technical, electronic or related area, and four years of satisfactory fulltime experience in the performance of analytical, planning, operational, technical, or administrative duties in a voice and/or data telecommunications or closely related electronics planning, management, and/or service organization, one year of which must have been in a highly specialized capacity and 18 months must have been in an executive, managerial, or administrative capacity or in the supervision of staff performing work in the voice and/or data telecommunications field; or

2. An associate degree from an accredited college including or supplemented by 12 credits in the field of voice and/or data telecommunications or in a pertinent, scientific, technical, electronic or related area and five years of experience as described in ""1"" above; or

3. Education and/or experience equivalent to ""1"" above. However, all candidates must have at least a four-year high school diploma or its educational equivalent and one year of the specialized experience as described in ""1"" above and must possess the 18 months of executive, managerial, administrative or supervisory experience as described in ""1"" above.


Preferred Skills

The preferred candidate should possess the following:
3+ years of relevant work and/or academic experience, including experience in high-pressure, entrepreneurial environments;A combination of statistics and computer science fluency;Deep familiarity with Python and R;A reviewable portfolio of data visualizations;Data imaging and processing experience;Comfort working with both structured and unstructured data;Experience in building and manipulating predictive analytics models;Knowledge of commonly used databases, such as SQL, MySQL, and Mongo DB;A growth mindset.


To Apply

Special Note: Taking and passing civil service exams are necessary to maintain employment with the City of New York. Please check the Department of Citywide Administrative Services (DCAS) website (http://www.nyc.gov/html/dcas/html/work/exam_monthly.shtml) for important exam filing information. Please ensure that you are either a permanent employee in the civil service title listed on this posting, or, that you file for the examination when there is an open filing period. For more information regarding the civil service process, please visit the DCAS website at: http://www.nyc.gov/html/dcas/html/work/work.shtml

Interested applicants with other civil service titles who meet the preferred requirements should also submit a resume for consideration
For City employees, please go to Employee Self Service (ESS), click on Recruiting Activities > Careers, and search for Job ID #405566
For all other applicants, please go to www.nyc.gov/jobs/search and search for Job ID #405566

SUBMISSION OF A RESUME IS NOT A GUARANTEE THAT YOU WILL RECEIVE AN INTERVIEW
APPOINTMENTS ARE SUBJECT TO OVERSIGHT APPROVAL
The Department of Information Technology & Telecommunications and the City of New York are equal opportunity employers.
DoITT participates in E-Verify


Hours/Shift

Day - Due to the necessary support duties of this position in a 24/7 operation, candidate may be required to work various shifts such as weekends and/or nights/evenings.


Work Location

New York, NY


Residency Requirement

New York City residency is generally required within 90 days of appointment. However, City Employees in certain titles who have worked for the City for 2 continuous years may also be eligible to reside in Nassau, Suffolk, Putnam, Westchester, Rockland, or Orange County. To determine if the residency requirement applies to you, please discuss with the agency representative at the time of interview."
1,"Senior Data Scientist, Growth Insights","New York, NY 10011",New York,NY,10011,None Found,None Found,None Found,None Found,None Found,None Found,"We are looking for a Senior Data Scientist to join the band and help drive a data-first culture with focus on growth. As a Senior Data Scientist, our mission is to turn our 200 petabytes of data into insights and gain a deep understanding of music and listeners to impact the strategy and direction of Spotify. You will study user behavior, strategic initiatives, markets, content, and new features and bring data and insights into every decision we make. Above all, your work will impact how we think about user growth and how we can make Spotify available and accessible for more people in the world.

What you’ll do:
Perform analyses on large sets of data to extract actionable insights that will help drive Spotify’s strategy across the user funnel
Work on larger user understanding projects to understand and recommend our next direction to drive user growth
Work on end-to-end projects to ensure your findings are executed and tested in a desired way
Work closely with cross-functional teams of analysts, researchers, product owners, marketers, designers, and others across the company who are passionate about Spotify’s user growth
Work from our offices in New York
Who you are:
You have a deep understanding of numbers and a strong business sense for growth drivers
You have at least 5 years of experience in a similar data scientist role and a degree in science, computer science, statistics, economics, mathematics, or similar quantitative discipline
You have the technical competence to perform more advanced analytics, including causal inference modelling
Coding skills (such as Python)
Analytics tools experience (such as Pandas, R or SQL)
Experience performing analysis with large datasets
You have experience collaborating closely with research to design novel analytical approaches in response to loosely defined problems
You have experience driving real world product or feature decisions based on your analysis
You are a communicative person that values building strong relationships with colleagues and stakeholders and have the ability to explain complex topics in simple terms
You’re capable of mentoring more junior data scientist to set them up for success"
2,Global Data Scientist,"New York, NY 10001",New York,NY,10001,None Found,"Undergraduate (or above) degree in economics, statistics, computer science, engineering, or related fields
Two years of relevant work experience, such as performing advanced statistical analysis, developing software applications, and/or designing evaluations
Demonstrated statistical programming and data management skills (Stata preferred, Python or R can substitute)
Demonstrated expertise in methods for causal inference in social science
",None Found,"Developing software applications and data management systems (25%). The Global Data Scientist will design and develop software applications and data management systems that help to improve the quality of IPA’s data, including user-written Stata commands and Python-based applications.
Supporting staff technical capacity (25%). The Global Data Scientist will prepare and lead training sessions and remote courses on topics such as statistical inference, survey programming, and data quality control processes. The Global Data Scientist will also provide technical guidance and troubleshooting/support for technical staff in IPA’s 21 country offices. Depending on the applicant’s managerial experience, the Global Data Scientist may also directly oversee other coders and trainers.
Expanding the scope of IPA’s technical services (15%). The Global Data Scientist will research, adapt, and design innovative methods to broaden IPA’s portfolio of evaluation and technical services. Depending on the applicant’s technical experience, the Global Data Scientist may for example lead the selection of new software applications for global use, or the development of new data management protocols.
Partnering with project teams to increase the technical rigor of project deliverables (15%). The Global Data Scientist will help draft and refine technical documents, which may include evaluation designs, pre-analysis plans, sample size calculations, and other documents.
Documenting knowledge and best practices (10%). The Global Data Scientist will write detailed code and process documentation for technical teams, clear knowledge articles for consumption by global research staff, and occasional public-facing blog posts.
Supporting other research-related activities as necessary (10%). The Global Data Scientist may be asked to troubleshoot technical products, support regional technical teams, assist with strategic projects and initiatives, or perform any related duties assigned by the Associate Director.
",None Found,None Found,"The Global Data Scientist is an expert in statistics, data science, and quantitative research who supports a large portfolio of research projects across diverse geographies, sectors, and methods. This position will work as a technical lead on IPA’s Global Research and Data Support (GRDS) Team*. The Global Data Scientist’s role will include, but not be limited to, the following activities:
Responsibilities
Developing software applications and data management systems (25%). The Global Data Scientist will design and develop software applications and data management systems that help to improve the quality of IPA’s data, including user-written Stata commands and Python-based applications.
Supporting staff technical capacity (25%). The Global Data Scientist will prepare and lead training sessions and remote courses on topics such as statistical inference, survey programming, and data quality control processes. The Global Data Scientist will also provide technical guidance and troubleshooting/support for technical staff in IPA’s 21 country offices. Depending on the applicant’s managerial experience, the Global Data Scientist may also directly oversee other coders and trainers.
Expanding the scope of IPA’s technical services (15%). The Global Data Scientist will research, adapt, and design innovative methods to broaden IPA’s portfolio of evaluation and technical services. Depending on the applicant’s technical experience, the Global Data Scientist may for example lead the selection of new software applications for global use, or the development of new data management protocols.
Partnering with project teams to increase the technical rigor of project deliverables (15%). The Global Data Scientist will help draft and refine technical documents, which may include evaluation designs, pre-analysis plans, sample size calculations, and other documents.
Documenting knowledge and best practices (10%). The Global Data Scientist will write detailed code and process documentation for technical teams, clear knowledge articles for consumption by global research staff, and occasional public-facing blog posts.
Supporting other research-related activities as necessary (10%). The Global Data Scientist may be asked to troubleshoot technical products, support regional technical teams, assist with strategic projects and initiatives, or perform any related duties assigned by the Associate Director.
Qualifications
Minimum qualifications
Undergraduate (or above) degree in economics, statistics, computer science, engineering, or related fields
Two years of relevant work experience, such as performing advanced statistical analysis, developing software applications, and/or designing evaluations
Demonstrated statistical programming and data management skills (Stata preferred, Python or R can substitute)
Demonstrated expertise in methods for causal inference in social science
Preferred qualifications
Experience with data collection platforms and technologies (e.g. ODK/SurveyCTO, Survey Solutions)
Experience supervising field or technical teams
Experience conducting field research in developing countries
Experience training staff or developing training content
Experience with software or machine learning engineering
Travel requirements
Note that this position requires willingness to travel internationally up to 35% of the time. You can see a list of IPA’s worldwide offices at https://www.poverty-action.org/research."
3,Data Analyst / Data Scientist,"New York, NY",New York,NY,None Found,None Found,None Found,None Found,None Found,None Found,None Found,"We have a client that is looking for a data scientist to add to its team. This position is for a Fortune 50 company that is based in Philadelphia. This is not a remote position.

Expertise in SQL Development.Call Center or Customer care data experience a plus.Must be able to write SQL queries and must have experience with data extraction
and ETL.
Experience with Teradata and SQL Server DatabasesR Studio and Python scripting is a plus.Communication and presentation skills are a must as you will have to present to key stakeholders.Tableau analysis and dashboard development is required.

A minimum of three years professional-level SQL programming experience in a
Windows and Linux environment.
A Computer Science or Mathematics degree.Outstanding problem-solving skills.Ability to develop and deliver power point presentations.Knowledge of shell scripts and other languages including Java, Python or Perl is a
plus."
4,Data Scientist,"New York, NY",New York,NY,None Found,None Found,None Found,None Found,None Found,None Found,None Found,"We marry design and engineering language in ways that produce impactful and memorable experience journeys. We partner all the way to continuously improve our clients’ digital maturity. Our Studio network brings the optimal combination of skill, scale, and cost for each stage of the product development lifecycle. And to do this we need great transformational people that want to impact the projects and organizations that they work with.
We are looking for an exceptional Data Scientist to work with our cross-functional team, and join our world-class community of talented experts. Core to this need are expertise in:

Mid to Senior Level Data Scientist with 5+ years of experience in Data Science
Experience in Banking domain is a plus
Excellent communication skills
Person should be able to lead the entire data science project from
Coding and executing the project (from model building to model testing to model deployment)
Presenting regular updates to clients (including updates from exploration)
Excellent in R or Python
Understanding of Big Data and cloud platforms like (Cloudera Hadoop or Microsoft Azure) is a plus

Ideally you will also have:

Undergraduate Degree in Computer Science, Physics or Mathematics (Graduate Degree always is a plus)
5-10 years experience in Data Science role
An Agile mindset with experience working in Agile environment
A spirit of collaboration and transparent communication
A natural curiosity for new scripting languages , frameworks and technologies
High personal code/development standards (peer testing, unit testing, documentation, etc)
We are a thriving Community of top technology talent that is globally connected. We Engage, Make, Run and Evolve the technology that makes many brands that you know and love. So let’s take this journey together. No matter where you are on your digital career roadmap, we can help you grow and have fun doing it.
Pack and move relocation available. Softvision LLC is an Equal Opportunity Employer. No 3rd Party Agency Candidates.
Benefits
Great globally diverse culture
Flexible work-life balance
Ongoing career development
Relocation opportunities
Competitive Salary"
5,Data Scientist,"New York, NY 10011",New York,NY,10011,None Found,None Found,None Found,None Found,None Found,"
At least 5 years of relevant professional experience and/or a Masters or PhD in computer science, mathematics, statistics, linguistics, physics, computational finance, or similar quantitative field.
Strong knowledge of machine learning, computer science, mathematics, and statistics.
Strong programming skills in Python, R, and/or Scala.
Experience with NumPy, SciPy, Pandas, Scikit-Learn, TensorFlow, and Keras. PyTorch is also acceptable.
Experience with building distributed machine learning systems using Apache Spark and a working knowledge of MLlib.
Experience with several of the following concepts: decision trees, random forests, and gradient boosting; linear regression; logistic regression; linear and non-linear dimensionality reduction using PCA, kernel methods, and dictionary learning; clustering with K-means, hierarchical clustering, and DBSCAN; autoencoders; generative models; and sequential data modeling.
","7Park Data, a Vista Equity portfolio company, is the world’s leading alternative data intelligence firm. We have access to some of the most coveted alternative datasets – such as clickstream, geolocation, mobile app usage, credit and debit card, email receipt, and shipping cargo data – and are constantly acquiring more.

You will be joining other extremely passionate data scientists, product managers, and engineers that share a common interest in tackling some of the most difficult data science and machine learning problems today. With the data products and machine learning systems you design, 7Park will arm influential decisionmakers at financial and corporate giants with critical information they need to make smart, data-driven decisions. And, along the way, you will help advance the current work in artificial intelligence and predictive modeling.

The data science team has two major goals: to create and build data products that provide intelligence on real-time economic activity to our financial and corporate clients and to research and develop machine learning systems to extract information from large volumes of structured and unstructured text.

We are looking for a talented and creative Data Scientist to join our data science team. As a Data Scientist, you will be responsible for the following:

Conduct research on some of the world’s most interesting alternative datasets
Plan, develop, and apply cutting-edge machine learning systems and statistical modeling to extract insight from vast amounts of data at scale
Write production-ready code to analyze, structure, and make accurate and timely predictions
Design systems to monitor the results of models in productions, discover and address anomalies, and ensure the robustness and reliability of these models
Lead projects from start to finish, collaborating with 7Park’s senior management, product managers, engineers, external data partners, and clients
An ideal candidate will be passionate about building machine learning systems on real world data and have several years of industry experience and/or a Masters or PhD in computer science, mathematics, statistics, linguistics, physics, computational finance, or a similar quantitative field.

It is also very important that you enjoying working in a lean, tight-knit, and highly entrepreneurial startup that marries the creative, experimental problem-solving found in academia with the hacker ethos of shipping products quickly and often.

 Compensation package: includes highly competitive salary, bonus and 401(k) plan.

Requirements

At least 5 years of relevant professional experience and/or a Masters or PhD in computer science, mathematics, statistics, linguistics, physics, computational finance, or similar quantitative field.
Strong knowledge of machine learning, computer science, mathematics, and statistics.
Strong programming skills in Python, R, and/or Scala.
Experience with NumPy, SciPy, Pandas, Scikit-Learn, TensorFlow, and Keras. PyTorch is also acceptable.
Experience with building distributed machine learning systems using Apache Spark and a working knowledge of MLlib.
Experience with several of the following concepts: decision trees, random forests, and gradient boosting; linear regression; logistic regression; linear and non-linear dimensionality reduction using PCA, kernel methods, and dictionary learning; clustering with K-means, hierarchical clustering, and DBSCAN; autoencoders; generative models; and sequential data modeling.
Bonus

Publications in communities such as NIPS, ICML, or related.
GitHub projects demonstrating your creative drive.
Kaggle wins demonstrating your competitive drive.
Experience running or working at data-centric startups.
Experience with knowledge graphs.
Working knowledge of GraphX and Spark Streaming."
