,Title,Location,City,State,Zip,Country,Qualifications,Skills,Responsibilities,Education,Requirement,FullDescriptions
115,Data Science Internship - Summer 2020,"New York, NY",New York,NY,None Found,None Found,None Found,None Found,None Found,None Found,None Found,"Etsy is looking for Data Science Interns to join our Data Science team in Brooklyn, New York. We are committed to advancing the fields around E-commerce by building technologies to help understand our customers and the world. We are seeking individuals passionate in areas such as Machine Learning, Data Mining, Recommender Systems, Information Retrieval, Natural Language Processing, Computational Advertising, Deep Learning and Computer Vision.

Our interns have a chance to create core algorithmic advances and apply their ideas in the dynamic world of E-commerce. Interns could publish their innovations at top tier conferences such as KDD, NIPS, ICML, ICLR, CVPR, ICCV, WWW, WSDM, SIGIR and etc.

This position is to be based in Brooklyn, New York.
About the Role
Recommendation and Personalization
Natural Language Processing and Query Understanding
Image Processing and Understanding
Text Understanding
Ranking for Search and Ads
Fraud and Abuse Detection
Large-scale Machine Learning
About You
Curiosity and modesty. We are dedicated to learning and constantly improving. We hope you also value things like blamelesspostmortems and have a natural aim to determine how everything works.
Keeping it real. Etsy’s mission and values are a part of everything we do. We care about how our work affects real people in the community and enjoy opportunities to meet them. We are motivated by this mission every single day.
Please note: Resumes without a cover letter will not be considered.
What’s Next

Interested in working with us? Send us a cover letter and your CV or resume explaining why you’d be great for the job. We value your unique talents and point of view, so feel free to tell us what you are all about. And if you write, draw, craft, or contribute to something you’re proud of, we’d love to hear about it.
At Etsy, we believe that a diverse, equitable and inclusive workplace makes us a more relevant, more competitive, and more resilient company. We welcome people from all backgrounds, ethnicities, cultures, and experiences. Etsy is an equal opportunity employer. We do not discriminate on the basis of race, color, ancestry, religion, national origin, sexual orientation, age, citizenship, marital or family status, disability, gender identity or expression, veteran status, or any other legally protected status."
116,Data Scientist,"New York, NY",New York,NY,None Found,None Found,"4 year Relevant Degree ( ideally Statistics, Mathematics, Computer Science, Physics)
Excellent written and interpersonal communication skills
Understanding of probability theory and statistical inference – required
Proficiency in Python – required
Knowledge of SQL or willingness and ability to learn SQL – required
",None Found,None Found,None Found,None Found,"We are currently seeking a Data Scientist for our New York City team. We seek someone with strong quantitative abilities and the capacity to express those ideas in code. The successful candidate will be team oriented and feel comfortable with the dynamic pace of a startup, participating in all phases of product development from research to implementation. The ability to clearly communicate with technical and nontechnical stakeholders is crucial. This position reports to the Head of Data Science.
Professional Qualifications
4 year Relevant Degree ( ideally Statistics, Mathematics, Computer Science, Physics)
Excellent written and interpersonal communication skills
Understanding of probability theory and statistical inference – required
Proficiency in Python – required
Knowledge of SQL or willingness and ability to learn SQL – required
Researching and evaluating mathematical models
Implementing and testing of models in Python
Performing data analysis on large data sets
Communicating results of work with teammates and company stakeholders
send resume to: jobs@teqqi.net"
117,Venture Capital Analyst - Data Scientist,"New York, NY 10017",New York,NY,10017,None Found,None Found,None Found,None Found,None Found,None Found,"Job Location:
Corporate New York City
ABOUT SIMON VENTURES

Simon Ventures is the venture capital affiliate of Simon Property Group (Simon), an S&P 100 company as well as the largest publicly traded real estate investment trust in the S&P 500. Simon Ventures specializes in investing in next generation commerce as well as the retail technologies that power or optimize for those consumer experiences with CB Insights most recently recognizing Simon Ventures as one of the 10 most active investors in retail technology.

Simon Ventures can serve as a unique investment partner to founders by leveraging Simon's operational platform and access to market distribution channels to impact the slope and velocity of their growth while supporting their continued creative and shareholder control. This service proposition resonates with founders who are looking for a partner that can strategically amplify their abilities to create value and capitalize on unfair market advantage.


PRIMARY PURPOSE

The analyst role will be based in New York City. As an analyst you will have an opportunity to learn the venture capital business, including the fundamentals of asset allocation and the process of selecting high quality investments using both quantitative and qualitative analysis to support due diligence efforts, and gain insight into many fascinating startups that are innovating at the intersection of retail and technology. You will also contribute to building an investment platform that is focused on leveraging the best in assets across real estate, technology, brands and social influence to offer a service proposition to founders that is uniquely differentiated for venture capital.

The primary role of the analyst is to support the Managing Director, including due diligence and active portfolio management (including assisting and supporting portfolio companies with operational initiatives). Core duties include the following:

Supporting deal origination efforts, including performing market research relating to investment trends, global market environments and analysis of bench-marking and comparative statistics
Supporting the Managing Director in a variety of analytic and investment management activities, including running due diligence for potential investments and assisting in the preparation of IC memos and presentations
Working with and supporting portfolio companies, including with the activation of any operational initiatives, research projects, competitor analysis, valuation work and board meeting support
Conducting valuation updates and monitoring performance across the existing portfolio
Helping with the coordination and production of regular reporting for IC review, including quarterly updates and other reports

THE IDEAL CANDIDATE

Education & Experience:

Bachelor’s degree and one to three years of investment banking, finance, investment management, start up or retail operating experience
Demonstrated ability to execute detailed financial analysis
Proficiency in MS Excel, Word and PowerPoint
Strong writing skills
Knowledge Skills and Abilities:

Interest in next generation commerce and retail technology
Critical thinker, intellectually curious, detail-oriented and unafraid to ask questions
Driven to work hard within a high performance environment with ability to work across a number of investments and projects simultaneously, sometimes on tight deadlines
Strong technical/quantitative skills
Strong fit within a team oriented, no ego, intellectually curious culture
Strong interpersonal skills
#ZR"
118,Data Scientist,"New York, NY 10004",New York,NY,10004,None Found,None Found,"
Strong statistical analysis background with a deep understanding of a variety of ML algorithms and statistical modeling techniques
Ability to code a proof of concept (in a programming language of their choice)Willingness to stay abreast of and evaluate recent advances in NLP and sequence modeling in general
Experience with relevant software tools, such as Python, Gensim, scikit-learn, statsmodels, and/or others. You'll be free to use whatever tools you feel are appropriate
Comfortable extracting data using SQL, Apache Spark or other distributed compute engine
Accustomed to working with GIT and shared codebases
Extensive data cleaning and textual data manipulation experience
Strong communication skills. Experience presenting experimental to people who are not Data Scientists
Ability to collaborate with the team and translate existing research into practical solutions and products
Ability to build and maintain relationships with various collaborators across the company, and take ownership of data science projects
Preferred Skills and Experience:
Experience with complex, high dimension, sparse time series data
Experience with healthcare data and/or insurance data a plus",None Found,None Found,None Found,"Prognos is a NYC-based healthcare startup whose mission is to improve health by driving the best actions learned from the world's data. In order to achieve this goal we have curated the world's largest clinical lab dataset-covering almost 200M patients in the US-and are currently deploying cutting-edge technology for predicting disease at the earliest possible time.
The Mission of the Data Science team at Prognos is to develop, deploy and maintain AI/ML pipelines within all of Prognos' products, addressing business-relevant problems in close collaboration with Engineering, Clinical and Product teams.
We are looking for a hands on (IC) Data Scientist to join the team, and help us move this mission-critical task forward. This position will focus on building a platform for flexibility and efficiently building predictive models of disease incidence and progression.
Candidates must have a degree in Statistics/Biostatistics, Computer Science, or a related quantitative field; Masters or higher is preferred. At least 1 year of hands on machine learning (ML) experience required.
Required Skills and Experience
Strong statistical analysis background with a deep understanding of a variety of ML algorithms and statistical modeling techniques
Ability to code a proof of concept (in a programming language of their choice)Willingness to stay abreast of and evaluate recent advances in NLP and sequence modeling in general
Experience with relevant software tools, such as Python, Gensim, scikit-learn, statsmodels, and/or others. You'll be free to use whatever tools you feel are appropriate
Comfortable extracting data using SQL, Apache Spark or other distributed compute engine
Accustomed to working with GIT and shared codebases
Extensive data cleaning and textual data manipulation experience
Strong communication skills. Experience presenting experimental to people who are not Data Scientists
Ability to collaborate with the team and translate existing research into practical solutions and products
Ability to build and maintain relationships with various collaborators across the company, and take ownership of data science projects
Preferred Skills and Experience:
Experience with complex, high dimension, sparse time series data
Experience with healthcare data and/or insurance data a plus
Prognos Values & Culture
Be Collaborative: Always do what is best for the client. Check your ego at the door. We deliver premium value at a premium price. Practice blameless problem solving. Create win/win solutions.
Be Courageous: Do the right thing, always. Look at the facts and don't assume.
Be Curious: Think big and start small. Be relentless about improvement. Be predictive. Be curious and always ask why
Be Enthusiastic: Celebrate success. Be enthusiastic and positive. Let's have fun. Have purpose and believe in the greater good.
Be Driven: Act with a sense of urgency. Take ownership and honor commitments. Either find a way or make one. Deliver results.
Be a Superstar: Make quality personal. Deliver remarkable client service. Be better than your previous self. Go above and beyond.
Our culture guide: http://bit.ly/2ISMzjl
About Prognos
Prognos is a healthcare AI company focused on predicting disease to drive decisions earlier in healthcare in collaboration with payers, Life Sciences and diagnostics companies. The Prognos Registry is the largest source of clinical diagnostics information in 40+ disease areas, with over 25B medical records for 200M patients. Prognos has 1000 extensive proprietary and learning clinical algorithms to enable earlier patient identification for enhanced treatment decision-making, risk management and quality improvement. The company is supported by a $42M investment from Safeguard Scientifics, Inc. (NYSE: SFE), Merck Global Health Innovation Fund (GHIF), Cigna (CI), GIS Strategic Ventures, Hikma Ventures, Hermed Capital, and Maywic Select Investments. For more information, visit www.prognos.ai.
Our Mission
To improve health by driving the best actions learned from the world's data
Our Vision
To prevail over disease and empower people everywhere to live life to the fullest
Selected Perks
Free FreshDirect food, snacks, drinks, etc. delivered to the NYC office weekly
Flexible work arrangements and unlimited PTO
Monthly Happy Hours with Leadership
Some of our benefits include: Health Insurance, Life Insurance, Short Term and Long Term Disability, Dental, Vision, 401k, HSA, FSA, Dependent care flexible spending, commuter benefits, free access to One Medical Group, Gym discounts, flexible work hours and locations, access to the WeWork network, a Health Advocate, Employee Stock Option Plan, and more
WAqpqZIrNF"
119,DATA SCIENTIST,"New York, NY",New York,NY,None Found,None Found,None Found,None Found,None Found,None Found,None Found,"The Data Scientist leads the team in developing sophisticated predictive models, mining large data sets for insights, building scalable data products, and growing the overall Data Science capability at Foot Locker. This individual serves as the senior member on project teams, often creating solutions from scratch, or, applying known and proven techniques effectively. This role is well versed in multiple analytical techniques, and can seamlessly transition between projects, data types, and problems.

Our global house-of-brands inspires and empowers youth culture. Relentlessly committed to fuel a shared passion for self-expression, we create unrivaled experiences at the heart of the sport and sneaker communities through the power of our people. If you want to be a part of something bigger than you can imagine, you’ve come to the right place. To learn more about the incredible impact we’re making on both our local and global communities, Click Here! Opens a New Window.
RESPONSIBILITIES
Accesses data from a variety of sources, including RDMS, NoSQL, or API.
Performs data aggregations, joins, manipulations, and cleaning to ensure data integrity throughout the entire analytical process.
Applies supervised and unsupervised modeling techniques to data to generate predictions and uncover patterns.
Develops hypothesis statements and applies statistical testing to determine causality and generalize observations.
Solves problems by applying a variety of predictive modeling/machine learning/deep learning techniques.
Maintains a comprehensive understanding of the current analytical landscape, including emergent technologies and methods.
Works closely with the Data Engineering and Product teams to ensure the successful completion of projects.
Decomposes problem statements into specific deliverables and requirements.
Supports the Product Owners in developing sprint goals and roadmaps.
Continuously scans the Data Science landscape for recent developments and opportunities to ingrate new methodologies into the existing project portfolio.
Creates presentations and delivers results to colleagues, stakeholders and executive leadership.
Leads peer review sessions and collaborative exercises to build the team's overall analytical capability.
Thoroughly understands Foot Locker’s retail business model and can seamlessly connect data, context, and analytical solutions.
Mentors junior team members and provides constructive critique on specific projects.

QUALIFICATIONS
Advanced SQL skills and is comfortable operating with relational data models and structure.
Advanced skills with NoSQL databases and can interact with large amounts of data stored in a Hadoop environment.
Is capable of accessing data via a variety of API/RESTful services.
Advanced programming skills in either R, Python, or similar analytical language.
Intermediate knowledge of Linux and Bash. Can interact with the OS at the command line and create shell scripts to automate workflows.
Experience with state of the art techniques such as AI and Deep Learning.
Advanced knowledge of Apache Spark.
Intermediate knowledge of cloud environments such as AWS and Azure.
Intermediate understanding of software development and collaboration, including experience with tools such as Git.
Exceptional written and verbal communication skills, comfortable presenting in front of large audiences.
A basic understanding of Agile methodologies and continuous delivery.
Excellent data visualization skills, is able to determine the appropriate visualization for a variety of data types and create compelling stories with data.
An advanced understanding of supervised and unsupervised learning techniques including; variable selection, feature engineering, model generation, model diagnostics, and deployment.
Excellent statistical skills that are grounded in a thorough understanding of testing and frequentist/Bayesian methodologies.
A proven track record of leading successful projects and driving measurable, viable results using Data Science techniques.
EDUCATION and/or EXPERIENCE
Bachelors Degree, Masters Degree or PhD. in a Data Science, Applied Mathematics, Computer Science or otherwise research-based field; 3-5 years of related experience and/or training; or equivalent combination of education and experience."
