,Title,Location,City,State,Zip,Country,Qualifications,Skills,Responsibilities,Education,Requirement,FullDescriptions
31,"Senior Data Scientist - Big Data, AI","Austin, TX 78731",Austin,TX,78731,None Found,None Found,None Found,None Found,None Found,"You are passionate about asking and answering questions in large datasets. You have a strong desire to solve business problems, and live to find patterns and insights within structured and unstructured data. You propose analytics strategies and solutions that challenge and expand the thinking of everyone around you.
 You are expert in analyzing large, complex, multi-dimensional datasets with a variety of tools. You are accomplished in the use of statistical analysis environments and have experience with BI visualization tools such as Tableau. You’re comfortable with relational databases and are familiar with SQL, Python, and R.
You desire a fast paced, collaborative and iterative environment. You love learning, data, scale and agility. You excel at making complex concepts simple and easy to understand by those around you. You’re driven to show the world the power of applied analytics.
You are curious and enjoy diving deep into the data find an answer to a yet unknown question and have a natural desire to go beneath the surface of a problem. You are a thinker who can ask the right business questions.
Experience in applied business intelligence with a record of success in designing and building large, complex, and horizontally integrated data sets
Ability to analyze large data sets and formulate recommendations based on the analysis output
Thinks strategically about uses of data and how to use data to enable business transformation and to drive competitive advantages
Demonstrates intellectual horsepower in solving complex often ambiguous business problems using data based decision making
Visualizes and effectively communicates data findings and insights creatively in a variety of formats
Undergraduate Computer Science, Data Sciences or Engineering degree and 10-15 years relevant experience or Graduate degree and 8-10 years relevant experience Expertise in driving business results through analytics","Senior Data Scientist
Location: Austin, Tx (local candidates only- no relocation)
Come work with the industry leader in IT products and solutions to help transform the way we do business. You will work with big data and apply analytics, machine learning (ML), artificial intelligence (AI) , and advanced statistical models to identify valuable insights that lead to cutting edge business transformations. You will champion the data based business transformation initiatives resulting in informed and faster decision making and enhanced productivity. This role offers a high level of visibility within the senior most levels of Dell's cross functional organizations and the ability to influence real change.
This role focuses on utilizing analytics and data science to enable Dell's business transformation programs through data based decisions and actions.

Essential Requirements
 You are passionate about asking and answering questions in large datasets. You have a strong desire to solve business problems, and live to find patterns and insights within structured and unstructured data. You propose analytics strategies and solutions that challenge and expand the thinking of everyone around you.
 You are expert in analyzing large, complex, multi-dimensional datasets with a variety of tools. You are accomplished in the use of statistical analysis environments and have experience with BI visualization tools such as Tableau. You’re comfortable with relational databases and are familiar with SQL, Python, and R.
You desire a fast paced, collaborative and iterative environment. You love learning, data, scale and agility. You excel at making complex concepts simple and easy to understand by those around you. You’re driven to show the world the power of applied analytics.
You are curious and enjoy diving deep into the data find an answer to a yet unknown question and have a natural desire to go beneath the surface of a problem. You are a thinker who can ask the right business questions.
Experience in applied business intelligence with a record of success in designing and building large, complex, and horizontally integrated data sets
Ability to analyze large data sets and formulate recommendations based on the analysis output
Thinks strategically about uses of data and how to use data to enable business transformation and to drive competitive advantages
Demonstrates intellectual horsepower in solving complex often ambiguous business problems using data based decision making
Visualizes and effectively communicates data findings and insights creatively in a variety of formats
Undergraduate Computer Science, Data Sciences or Engineering degree and 10-15 years relevant experience or Graduate degree and 8-10 years relevant experience Expertise in driving business results through analytics

Desirable Requirements
 Advanced knowledge of Excel, MS SQL , Tableau (preferred) & Python (preferred)
Business strategy skills to build the algorithms necessary to ask the right questions and find the right answers

Benefits
We offer highly competitive salaries, bonus programs, world-class benefits, and unparalleled growth and development opportunities — all to create a compelling and rewarding work environment.

If you’re ready to develop cutting-edge software for a changing world, this is your opportunity to develop with Dell.

Dell is committed to the principle of equal employment opportunity for all employees and to providing employees with a work environment free of discrimination and harassment. All employment decisions at Dell are based on business needs, job requirements and individual qualifications, without regard to race, color, religion or belief, national, social or ethnic origin, sex (including pregnancy), age, physical, mental or sensory disability, HIV Status, sexual orientation, gender identity and/or expression, marital, civil union or domestic partnership status, past or present military service, family medical history or genetic information, family or parental status, or any other status protected by the laws or regulations in the locations where we operate. Dell will not tolerate discrimination or harassment based on any of these characteristics. Learn more about Diversity and Inclusion at Dell here.
DCAM1
LIPriority"
32,Data Scientist (Austin),"Austin, TX 78701",Austin,TX,78701,None Found,None Found,"
Academic or industry exposure to B2B or B2C pricing and revenue optimization
Experience in deploying large scale enterprise software that employs operations research, statistics, or data science methods and algorithms
Industry experience in distribution, manufacturing, transportation, hospitality, or financial services is desirable
Prior experience working within a professional services organization","
Leverage an array of software tools to analyze large client datasets
Integrate large scale commercial software into a client’s existing pricing process
Travel to client offices to present scientific concepts and model results to senior executives
Based out of the Zilliant office in downtown Austin
",None Found,"
Advanced Degree in an applied mathematics subject such as Data Science, Operations Research, Industrial Engineering, Statistics or a related discipline
Experience in building data driven models which have driven measurable business performance
Experience using SQL and/or Spark to analyze and process large datasets
Experience implementing data science routines in R and/or Python
","Description:
The primary role of a Data Scientist is to effectively configure the scientific models which support Zilliant’s Price Optimization and Sales Growth solutions. The Data Scientist must be comfortable with independent interactions with clients, guiding clients towards Zilliant’s configuration best practices, and effectively communicating the value of Zilliant’s products.

Responsibilities Include:

Leverage an array of software tools to analyze large client datasets
Integrate large scale commercial software into a client’s existing pricing process
Travel to client offices to present scientific concepts and model results to senior executives
Based out of the Zilliant office in downtown Austin
Key Requirements:

Advanced Degree in an applied mathematics subject such as Data Science, Operations Research, Industrial Engineering, Statistics or a related discipline
Experience in building data driven models which have driven measurable business performance
Experience using SQL and/or Spark to analyze and process large datasets
Experience implementing data science routines in R and/or Python
Desirable Skills and Experience:

Academic or industry exposure to B2B or B2C pricing and revenue optimization
Experience in deploying large scale enterprise software that employs operations research, statistics, or data science methods and algorithms
Industry experience in distribution, manufacturing, transportation, hospitality, or financial services is desirable
Prior experience working within a professional services organization"
33,Data Science Internship,"Austin, TX 78759",Austin,TX,78759,None Found,"
Current status as a Sophomore-Senior
Minimum of 3.0 GPA
Must be a US Citizen, as required by US Government Contracts
Requires 0-2 years of experience and must be pursuing a Bachelors or Master’s degree in Engineering, Physics, Math or Computer Science or related degree.",None Found,"
Current status as a Sophomore-Senior
Minimum of 3.0 GPA
Must be a US Citizen, as required by US Government Contracts
Requires 0-2 years of experience and must be pursuing a Bachelors or Master’s degree in Engineering, Physics, Math or Computer Science or related degree.",None Found,None Found,"Job Description
Data Science Internship
Internship Opportunity: Are you a problem solver, ready for a challenge this summer? CACI is seeking 2020 Summer Interns for Data Science Internships! CACI is a recognized industry leader providing Mission-Ready Geolocation and Intelligence, Surveillance, and Reconnaissance (ISR) Systems and Services to Government and Industry. Through our Intern program’s on the job training and mentorship, you will gain experience with cutting edge technology alongside engineers, mathematicians, and computer scientists.
About the Team: The National Tactical Systems Group, consists of people with backgrounds in Mathematics, Physics, Electrical and Aerospace Engineering, and Computer Science. We develop and test signal processing algorithms and evaluate the performance of Radio Frequency (RF) geolocation systems and processes. These systems include sensor hardware sub-systems, data handling and management components, and advanced signal processing algorithms.
Description: This position is for individuals interested in a broad area of data analysis, including statistical analysis, signal processing, big data analytics, and data visualization methods. The ideal candidate should have strong academic credentials and experience in working in a team environment, having both academic and interpersonal skills to help optimize teamwork. The single most important attribute is an inquisitive nature and a strong desire to learn real world applications to compliment your academic experience. The internship will be ~11-12 weeks in the summer of 2020.
Responsibilities:
Data Scientists typically perform ongoing analysis of system performance including rapid evaluation and resolution of problems and controlled testing designed to assess sub-system and whole-system performance. Design and develop analytical tools to analyze, profile, and optimize system software. The position is heavily oriented towards the simulation, collection and processing of real data. Specific intern job duties will be based on skills and experience.
Required Qualifications:
Current status as a Sophomore-Senior
Minimum of 3.0 GPA
Must be a US Citizen, as required by US Government Contracts
Requires 0-2 years of experience and must be pursuing a Bachelors or Master’s degree in Engineering, Physics, Math or Computer Science or related degree.
Desired experience in one or more of the following:
Matlab
C++
JAVA
Laboratory instrumentation (at a level that is appropriate for your academic level)
Ticom Geomatics (TGI) is a subsidiary of CACI International, Inc. in Austin, Texas with ~200 employees.” We’ve recently been named as one of the Top Places to Work in Austin. We are an industry leader in interoperable, mission-ready Time and Frequency Difference of Arrival (T/FDOA) Precision Geolocation systems and produce diverse portfolio of Intelligence, Surveillance and Reconnaissance (ISR) products spanning small lightweight sensors, rack-mounted deployments, cloud-based solutions which are deployed across the world. View TGI teams and programs: http://www.ticom-geo.com/. View more about CACI at www.caci.com.
 inrn2
Job Location
US-Austin-TX-AUSTIN


CACI employs a diverse range of talent to create an environment that fuels innovation and fosters continuous improvement and success. At CACI, you will have the opportunity to make an immediate impact by providing information solutions and services in support of national security missions and government transformation for Intelligence, Defense, and Federal Civilian customers. CACI is proud to provide dynamic careers for employees worldwide. CACI is an Equal Opportunity Employer - Females/Minorities/Protected Veterans/Individuals with Disabilities."
34,"Software Engineer, Machine Learning","Austin, TX",Austin,TX,None Found,None Found,None Found,None Found,"Collaborate with peers on requirements, designs, code reviews, and testing
Produce designs and rough estimates, and implement features based on product requirements
Deliver efficient, maintainable, robust Java/Scala based microservices
Produce unit and end-to-end tests to improve code quality and maximize code coverage for new and existing features
Productize and operationalize machine learning algorithms
Actively engage in technology discovery that can be applied to the product
",None Found,"7-10 years of professional software development experience
2+ years of data engineering or related experience
Strong Java and/or Scala experience
Experience with Agile development practices and continuous delivery
Proficient understanding of distributed computing principles. microservice architectures and patterns
Experience with integration of data from multiple data sources
Experience writing unit and integration tests
Great communication skills
BS in Computer Science or a related experience
","At SailPoint, we do things differently. We understand that a fun-loving work environment can be highly motivating and productive. When smart people work on intriguing problems, and they enjoy coming to work each day, they accomplish great things together. With that philosophy, we’ve assembled the best identity team in the world that is passionate about the power of identity.
As the fastest-growing, independent identity and access management (IAM) provider, SailPoint helps hundreds of global organizations securely and effectively deliver and manage user access from any device to data and applications residing in the data center, on mobile devices, and in the cloud. The company’s innovative product portfolio offers customers an integrated set of core services including identity governance, provisioning, and access management delivered on-premises or from the cloud (IAM-as-a-service).
SailPoint is seeking a Sr/Staff Data Software Engineer to help build a new cloud-based identity analytics product incorporating real-time data pipelines, machine learning algorithms and multi-tenancy support. We are looking for well-rounded backend or full stack engineers who are passionate about building and delivering reliable, scalable microservices and infrastructure for SaaS products.
Responsibilities
Collaborate with peers on requirements, designs, code reviews, and testing
Produce designs and rough estimates, and implement features based on product requirements
Deliver efficient, maintainable, robust Java/Scala based microservices
Produce unit and end-to-end tests to improve code quality and maximize code coverage for new and existing features
Productize and operationalize machine learning algorithms
Actively engage in technology discovery that can be applied to the product
Requirements
7-10 years of professional software development experience
2+ years of data engineering or related experience
Strong Java and/or Scala experience
Experience with Agile development practices and continuous delivery
Proficient understanding of distributed computing principles. microservice architectures and patterns
Experience with integration of data from multiple data sources
Experience writing unit and integration tests
Great communication skills
BS in Computer Science or a related experience
Preferred
Experience with Cloud computing architectures (AWS, Google Cloud)
Experience with Kafka, Flink/Spark, Elasticsearch technologies or related
Experience integrating data pipelines for machine learning
Experience with container technologies (Docker, Kubernetes, etc.)
Experience with NoSQL databases, such as Redshift, Cassandra, DynamoDB
Experience instrumenting code for gathering production performance metrics
Compensation and benefits
Experience a Small-company Atmosphere with Big-company Benefits
Competitive pay, 401(k) and comprehensive medical, dental and vision plans
Recharge your batteries with a flexible vacation policy and paid holidays
Grow with us with both technical and career growth opportunities
Enjoy a healthy work-life balance with flexible hours, family-friendly company events and charitable work
All qualified applicants will receive consideration for employment without regard to race, color, religion, sex, sexual orientation, gender identity, national origin, disability, or veteran status.
k
All qualified applicants will receive consideration for employment without regard to race, color, religion, sex, sexual orientation, gender identity, national origin, disability, or veteran status."
35,Senior Data Scientist,"Austin, TX 78744",Austin,TX,78744,None Found,None Found,"
M.S. or Ph.D. in Statistics, Operations Research, Mathematics, Computer Science, or other quantitative field or a B.A./B.S. with 3+ years professional or research experience
Proficiency with SQL
Proficiency with Python
Matching and recommendation algorithms
End-to-end experience with data, including querying, aggregation, analysis, and visualization
Familiarity with Bayesian techniques
Passion for solving unstructured and non-standard mathematical problems
Willingness to collaborate and communicate with others to solve a problem","
Work with Data Scientists, Product Managers, and all other relevant stakeholders to frame a problem, both mathematically and within the business context
Construct and fit statistical, machine learning, or optimization models
Perform exploratory data analysis to gain a deeper understanding of the problem
Write production modeling code; collaborate with Software Engineers to implement algorithms in production
Analyze experimental and observational data; communicate findings; facilitate launch decisions
",None Found,None Found,"The home search starts online, but the real estate industry is often optimized for in-person, one-on-one service. That's a fantastic experience once you connect with the right professional, but finding the right fit isn't always a smooth process. Opcity built a nationwide real-time data and technology platform combining cutting edge deep learning, business analytics and human intuition with the latest web, mobile and digital telephony technologies to enable our team of professionals, and thousands of real estate agents and brokers, to make sure we connect every home buy with the right agent at the right time so more time is spent finding a home and less time finding the perfect agent.

We are looking for a self-starting data scientist to tackle some of the most interesting problems in the real estate space. As a Data Scientist here at Opcity you will help define and build the Opcity recommendation system from the ground up. You will have the freedom to test and explore the data where any decision will have an immediate visible impact.
An ideal candidate should be able to tackle a new problem space with minimal guidance. They should have the drive and ability to meet with relevant stakeholders, understand and model relevant data, and effectively communicate with an engineering team to put models into production. They should also be demonstrated lifelong learners and team players; willing to take advice and fill gaps in their knowledge when required.
Data Scientist Responsibilities
Work with Data Scientists, Product Managers, and all other relevant stakeholders to frame a problem, both mathematically and within the business context
Construct and fit statistical, machine learning, or optimization models
Perform exploratory data analysis to gain a deeper understanding of the problem
Write production modeling code; collaborate with Software Engineers to implement algorithms in production
Analyze experimental and observational data; communicate findings; facilitate launch decisions

Data Scientist Experience and Skills
M.S. or Ph.D. in Statistics, Operations Research, Mathematics, Computer Science, or other quantitative field or a B.A./B.S. with 3+ years professional or research experience
Proficiency with SQL
Proficiency with Python
Matching and recommendation algorithms
End-to-end experience with data, including querying, aggregation, analysis, and visualization
Familiarity with Bayesian techniques
Passion for solving unstructured and non-standard mathematical problems
Willingness to collaborate and communicate with others to solve a problem"
36,Data Scientist,"Austin, TX",Austin,TX,None Found,None Found,None Found,None Found,None Found,None Found,None Found,"BS and Masters degrees in computer science, engineering, or related technical/scientific field1+ years of professional experience in a business environment1+ years of relevant experience in building large scale machine learning or deep learning models and/or systems1+ year of experience specifically with deep learning (e.g., CNN, RNN, LSTM)Experience in using Python, R, or other programming language

Machine learning (ML) has been strategic to Amazon from the early years. We are pioneers in areas such as recommendation engines, product search, eCommerce fraud detection, and large-scale optimization of fulfillment center operations.

The Amazon ML Solutions Lab team helps AWS customers accelerate the use of machine learning to solve business and operational challenges and promote innovation in their organization. As an ML Solutions Lab data scientist, you are proficient in designing and developing advanced ML models to solve diverse challenges and opportunities. You will be working with terabytes of text, images, and other types of data to solve real-world problems. You'll design and run experiments, research new algorithms, and find new ways of optimizing risk, profitability, and customer experience.

We’re looking for talented data scientists capable of applying classical ML algorithms and cutting-edge deep learning (DL) and reinforcement learning approaches to areas such as drug discovery, customer segmentation, fraud prevention, capacity planning, predictive maintenance, pricing optimization, call center analytics, player pose estimation, event detection, and virtual assistant among others.

The primary responsibilities of this role are to:
Design, develop, and evaluate innovative ML/DL models to solve diverse challenges and opportunities across industriesInteract with customer directly to understand their business problems, and help them with defining and implementing scalable ML/DL solutions to solve themWork closely with account teams, research scientist teams, and product engineering teams to drive model implementations and new algorithms
This position requires travel of up to 25%, and can be located in Austin, Chicago, New York, Boston, Washington D.C., Atlanta, Palo Alto/Bay Area, or Seattle.

PhD degree in computer science, engineering, or related technical/scientific fieldHands on experience building models with deep learning frameworks like MXNet, Tensorflow, Keras, Caffe, PyTorch, or similarStrong communication and data presentation skillsStrong attention to detailComfortable working in a fast paced, highly collaborative, dynamic work environmentAbility to think creatively and solve problems
Amazon.com is an Equal Opportunity-Affirmative Action Employer – Minority / Female / Disability / Veteran / Gender Identity / Sexual Orientation."
