,Title,Location,City,State,Zip,Country,Qualifications,Skills,Responsibilities,Education,Requirement,FullDescriptions
0,Data Scientist,"Austin, TX",Austin,TX,None Found,None Found,None Found,None Found,None Found,None Found,None Found,"Job Description Summary
CCC Information Services, Inc. is seeking a Data Scientist to join their Machine Learning team.

The data science team functions like a startup within a secure, established company. The team was formally started in 2013 after one predictive analytics product successfully entered the marketplace. Our Data Scientists typically hold Ph.D. or Masters level degrees in Math, Statistics, Data Science, Computer Science and other related fields; who can predict variables of interest before those variables are known. The analysts take this prediction and turn it into business value. The team supports work across CCC and is currently working on one of the most strategic initiatives of the company, which is essentially building the AI capabilities for products. Job Duties

The Data Scientist will lead implementation and scaling of machine learning and AI algorithms.
He/she will work with other scientists and architects to deliver AI driven technology and solutions, with a heavy focus on creating ways to streamline and automate every process.
As part of the data science team he/she will be working on the state of art algorithms from diverse fields such as AI, deep learning, NLP, Telematics and computer vision.
He/she will be designing and performing experiments using a scientific approach to compare hypothesis, generate insights and ensure the solution meets the target metrics specified by business requirements.
The Data Scientist will be expected to apply strong analytical thinking and various statistical methods to evaluate and optimize the deep learning models.
He/she will be responsible for end-to-end data engineering activities like data acquisition and pre-processing, creating seamless automated data pipelines.
He/she will be responsible, as well for transformation of research model/code into a production ready solution and perform testing to ensure quality metrics.
An ideal candidate will additionally have strong communication and collaboration skills to augment his technical expertise and generate business value. Qualifications

Must have a Ph.D. or Master’s degree in Applied Math, Physics, Electronics Engineering, Computer Science, Computer Engineering, or related field.
Internship or work experience in applied statistics, machine learning, probability, and linear algebra.
Advanced mathematical modeling skills, algorithm design, creative problem solving, and performance optimization
Experience programming in Python, especially the data science stack: numpy, scikit-learn, pandas, matplotlib
Experience in at least one of the following frameworks is required: Keras, Tensorflow, PyTorch
Knowledge of SQL/NoSQL databases and back-end systems.
Comfortable with scripting and Linux systems
Exceptional problem solver and communicator
Effective documentation practices and experience writing reports
Ability to create end-to-end pipeline automating the entire data science life cycle working individually or with a team.
Experience delivering data science models or workflows in production, regular optimization of data science software.
Excellent communication and collaboration skill to maintain successful relationship with remote teams.

Preferred Qualifications
The ideal candidate will have 2+ years of practical experience in machine learning
Nice to have up to 2 years of experience in an analytical role as a data scientist.
Parallel computing and analytics skills
Familiarity with software design and scalable software architectures
Skilled with using scripting languages to manipulate large data-sets
Experience in programming C/C++."
1,Senior Data Scientist,"Austin, TX 78746",Austin,TX,78746,None Found,None Found,None Found,None Found,None Found,None Found,"Key Responsibilities:
Design and develop statistical models with Big Data, IoT, ERP, Supply Chain, etc. to drive major operational business decisions
Understand customer and business requirements and implement reliable technical solutions for non-technical end users.
Identify opportunities to improve data collection, reporting, and analysis based on business needs.
Regularly interface with client sponsors and team members to meet project deadlines and provide clear communication with the team.
Provide documentation and explanation of technical solutions in a professional manner
Ability to create and deliver presentations in the Data Science and Advanced Analytics space
Ability to take complex problems/concepts and simplify down for a variety of audiences
Travels to client sites.
Requirements:
Strong and proven background of analytical, mathematical and critical thinking
Passion for data analytics, modeling, programming, and machine learning.
Strong Python and/or R programming experience.
Exposure to data ETL, storage, and manipulation tools including SQL, XML/JSON, and APIs
4+ years of experience in Data Science or related field.
BS or MS in Computer Science, Computational Mathematics, Applied Mathematics, Engineering, Data Science, Statistics or equivalent
US Citizen or GC Holder
Delighters
Having examples of scaling production-facing applications or open-source contributions.
2+ years of consulting experience
Experience using Big Data and Cloud technologies
Familiarity with Spark and Data Lakes
Prior experience in the Oil and Gas industry

Sense Corp powers insight-driven organizations.
We accelerate the entire transformation life cycle, from strategy through implementation. We turn data into actionable insights and transform organizations for the digital era.
Our people, culture, and how we engage with our clients are differentiators. Brilliant, Creative, Human, and Fun exemplify who we are. We are regularly recognized as a Best Place to Work by Houston, Austin, Dallas, and St. Louis Business Journals. With operations in Austin, Atlanta, Columbus, Dallas, Houston, San Antonio, Minneapolis-St. Paul, and St. Louis we serve mid-market to Fortune 50 companies.
The Sense Corp Compass
We may be the only management consulting firm in the country where being brilliant isn’t enough to land you a job. Sense Corp people must be brilliant, creative, human, and fun all at once. In other words, we hire terrific, well-rounded people. It is one reason clients love working with us. And it is why we enjoy working with each other. We may not sound like typical consultants but that’s OK. We don’t think like them either."
2,Senior Mathematician,"Austin, TX",Austin,TX,None Found,None Found,None Found,None Found,None Found,None Found,"
Advanced degree in mathematics, statistics or related fields, or 3+years experience in social slot game designs.
Excellent working knowledge in combinatorics, statistics and probability theories.
High degree of creativity and innovation on game designs.
Proven ability to perform analysis on complicated concepts.
Comfortable to work and research independently as well as in a team.
Excellent understanding of successful elements of slot games.","Zynga is looking for a Senior Mathematician to join our Slots team. Reporting to the Director of Math, the Slots Mathematician will:
Collaborate with game designers to build excellent slot games to delight players.
Provide detailed mathematical models for slot games and other game features
Offer detailed analysis and explanation of mathematical models
Develop and explore innovative functionality of slot games
Validate, simulate and sign-off mathematical models to ensure they work as intended
Troubleshoot with engineers on technical implementation on mathematical models
Requirements:
Advanced degree in mathematics, statistics or related fields, or 3+years experience in social slot game designs.
Excellent working knowledge in combinatorics, statistics and probability theories.
High degree of creativity and innovation on game designs.
Proven ability to perform analysis on complicated concepts.
Comfortable to work and research independently as well as in a team.
Excellent understanding of successful elements of slot games.
What we offer you:
Zynga RSUs, 401k match and Bonus Plan
Full medical, dental, vision insurance benefits as well as life insurance
Lunch catered daily - stocked snack areas
Generous Paid Maternity/Paternity leave
Emergency child care support
Active Employee Resource Groups - Women at Zynga, ZPride, ZParents and more
Dog Friendly offices
Zynga happy hours and frequent employee events
Open vacation policy for most employees, generous vacation for other
Flexible working hours on many teams
Gym Benefits
Commuter benefits
Casual dress every single day
Culture of diversity and inclusion
Work with cool people and impact millions of daily players!
Zynga is an equal opportunity employer. We are proud of our broad community; we do not discriminate on the basis of race, sex, religion, color, national origin, gender, sexual orientation, age, marital status, veteran status, medical condition, disability, or any other class or characteristic protected by applicable law. We welcome job-seekers, players, employees, and partners from all backgrounds. Join us!
We will consider all qualified job-seekers with criminal histories in a manner consistent with applicable law.
Zynga is committed to providing reasonable accommodation to applicants with disabilities. If you need an accommodation during the interview process, please let us know."
3,Product Cost Data Scientist,"Austin, TX",Austin,TX,None Found,None Found,None Found,None Found,None Found,None Found,None Found,"About

At Cloudflare, we have our eyes set on an ambitious goal: to help build a better Internet. Today the company runs one of the world's largest networks that powers trillions of requests per month. Cloudflare protects and accelerates any Internet application online without adding hardware, installing software, or changing a line of code. Internet properties powered by Cloudflare have all web traffic routed through its intelligent global network, which gets smarter with every request. As a result, they see significant improvement in performance and a decrease in spam and other attacks. Cloudflare was recognized by the World Economic Forum as a Technology Pioneer and named to Entrepreneur Magazine's Top Company Cultures list.

We realize people do not fit into neat boxes. We are looking for curious and empathetic individuals who are committed to developing themselves and learning new skills, and we are ready to help you do that. We cannot complete our mission without building a diverse and inclusive team. We hire the best people based on an evaluation of their potential and support them throughout their time at Cloudflare. Come join us!

About the Department

Cloudflare is looking to build and grow our Business Intelligence team responsible for building large-scale enterprise data lake and EDW from different sources and enabling various product and business teams such as Marketing, Customer Support, Sales, Finance with key business dashboards/reporting, insights and recommendation models.

About the role

Cloudflare is looking for a data scientist with first class financial modeling skills who will help the company exceed its growth and profitability goals. You'll work with key stakeholders to develop and maintain accurate product costing models. You will apply data wrangling skills, discover and share data-driven insights, create visualizations, construct and interpret quantitative analyses, and build statistical and machine learning models, all in order to solve complex costing problems. This is a high profile, cross-functional role that will have an immediate impact on the business.

You are:

A strong team player and self-starter with a positive, service-oriented attitude.
An analytical thinker with superior problem solving skills. You have the initiative to develop a deep understanding of network and capacity dynamics.
Extremely detail-oriented and intellectually curious. You will keep the ""big picture"" in mind but can dive into detail to generate useful insights.
An expert in financial modeling who can design and maintain sophisticated cost models.
An excellent multi-tasker who can handle shifting priorities and understand the importance of planning in advance to meet deadlines.

What you'll do


Lead cost modeling initiatives with cross functional teams
Build partnerships with functional managers to understand drivers, trends, and opportunities
Create compelling presentations and reports to communicate insights and recommendations
Analyze and transform large datasets for feature engineering
Develop and maintain statistical and machine learning models using best programming practices
Coordinate with Engineering teams for model deployment, monitoring, and maintenance

Examples of desirable skills, knowledge and experience


M.S. or Ph.D. in Computer Science, applied mathematics, or a related engineering discipline
4+ years of industry experience in analyzing large datasets, modeling and machine learning algorithms
Experience in high level programming languages like Python (Numpy, Scipy, Pandas)
Experience with Spark, SQL, Tableau, Google Analytics, Hive and BigQuery (or any other Big data/Cloud equivalent), GCP, etc.
Excellent communication and presentation skills
Background working with Finance or Accounting a plus

What Makes Cloudflare Special?

We're not just a highly ambitious, large-scale technology company. We're a highly ambitious, large-scale technology company with a soul. Fundamental to our mission to help build a better Internet is protecting the free and open Internet.

Project Galileo ( https://blog.cloudflare.com/protecting-free-expression-online/ ): We equip politically and artistically important organizations and journalists with powerful tools to defend themselves against attacks that would otherwise censor their work, technology already used by Cloudflare's enterprise customers--at no cost.

Project Athenian ( https://www.cloudflare.com/athenian/ ): We created Athenian Project to ensure that state and local governments have the highest level of protection and reliability for free, so that their constituents have access to election information and voter registration.

Path Forward Partnership ( https://blog.cloudflare.com/tag/path-forward/ ): Since 2016, we have partnered with Path Forward, a nonprofit organization, to create 16-week positions for mid-career professionals who want to get back to the workplace after taking time off to care for a child, parent, or loved one.

1.1.1.1 ( https://1.1.1.1/ ): We released 1.1.1.1 ( https://1.1.1.1/ ) to help fix the foundation of the Internet by building a faster, more secure and privacy-centric public DNS resolver. This is available publicly for everyone to use - it is the first consumer-focused service Cloudflare has ever released. Here's the deal - we don't store client IP addresses never, ever. We will continue to abide by our privacy policy ( https://developers.cloudflare.com/1.1.1.1/commitment-to-privacy/privacy-policy/privacy-policy/ ) and ensure that no user data is sold to advertisers or used to target consumers.

Sound like something you'd like to be a part of? We'd love to hear from you!

Cloudflare is proud to be an equal opportunity employer. We are committed to providing equal employment opportunity for all people and place great value in both diversity and inclusiveness. All qualified applicants will be considered for employment without regard to their, or any other person's, perceived or actual race, color, religion, sex, gender, gender identity, gender expression, sexual orientation, national origin, ancestry, citizenship, age, physical or mental disability, medical condition, family care status, or any other basis protected by law. We are an AA/Veterans/Disabled Employer.

Cloudflare provides reasonable accommodations to qualified individuals with disabilities. Please tell us if you require a reasonable accommodation to apply for a job. Examples of reasonable accommodations include, but are not limited to, changing the application process, providing documents in an alternate format, using a sign language interpreter, or using specialized equipment. If you require a reasonable accommodation to apply for a job, please contact us via e-mail at hr@cloudflare.com or via mail at 101 Townsend St. San Francisco, CA 94115."
4,Principal Data Scientist,"Austin, TX",Austin,TX,None Found,None Found,None Found,None Found,None Found,None Found,None Found,"Job Summary : Works closely with the data science team to build information-rich data products using innovative techniques and technologies to solve transportation related challenges and problems. Understands and leverages data mining, machine learning, data modeling, and statistical modeling techniques. Applies strong problem solving and analytic skills to data integration projects and is able to isolate non-obvious relationships between disparate data sources. This position typically works under general supervision and direction. Incumbents of this position will regularly exercise discretionary and substantial decision-making authority.
Essential Job Duties and Responsibilities:
Lead data science team and stakeholders to address business challenges by harnessing structured, semi-structured, and unstructured data in a distributed processing environment
Designs, develops and programs methods, processes, and systems to consolidate and analyze unstructured, diverse data sources to generate actionable insights and solutions for client services and product enhancement.
Design, implement, and maintain statistical models representing transportation network behavior and other transportation related processes
Develops and codes software programs, algorithms and automated processes to cleanse, integrate and evaluate large datasets from multiple disparate sources.
Research, interpret, and identify use cases for applying data science techniques against public transportation data
Prepare and deliver presentations that effectively describe complex quantitative methods in clear and concise communications
Apply an understanding of global and/or local trends and events (e.g., economics, social issues) to assist with the formulation of hypotheses and interpretation of data
Keep up to date with technical as well as industry developments, analytics software/tools, trends, and recognized best practices
Work within project constraints – funding, resources, schedule, priority, goals
Minimum Job Requirements:

Four-year college degree, in statistics, economics, physics, mathematics, operations research, computer science, data engineering, or related field ; plus six years of related experience using data mining, data modeling, data integration, machine learning, statistical modeling, and other data science skills and techniques. Masters or Ph.D. preferred. Experience with Python or comparable scripting language. Experience working with Hadoop, Pig, Hive, and knowledge of SQL is essential. Experience with statistical and analytic programming design and technologies such as R and other simulation / data analysis tools. Knowledge of database management systems and other software tools used to manage an organization’s business activities. Requires fundamental knowledge and experience developing algorithms and analytics applications. Must have strong analytical and problem solving skills, attention to details, critical thinking ability, and creativity. Must be able to abstract from ambiguous and sometimes conflicting information to identify opportunities for improvement and the critical business drivers and factors that influence outcomes. Must have demonstrated ability to produce high quality analytics applications that can be deployed in a repeatable and scalable fashion. Requires strong knowledge of statistics, signal processing, machine learning, predictive analytics, and other related techniques. Must have excellent written and verbal communication skills used to effectively communicate and present complex information in terms appropriate to the audience. Incumbent will have well-developed research skills and knowledge of current data management principles, procedures, and other tools of the trade. Must be able to manage and prioritize multiple projects simultaneously while balancing according to scope, budget and schedule. Prior experience working in the transportation or logistics industries desired .
The description provided above is not intended to be an exhaustive list of all job duties, responsibilities and requirements. Duties , responsibilities and requirements may change over time and according to business need.
Worker Type:
Employee"
