,Title,Location,City,State,Zip,Country,Qualifications,Skills,Responsibilities,Education,Requirement,FullDescriptions
60,"Artificial Intelligence Architect, Manager - Applied Artificial Intelligence","Austin, TX",Austin,TX,None Found,None Found,"
6+ years of relevant work experience
2+ years of consulting experience on AI projects (preferred)
2+ years of experience leading and managing project teams
Experience architecting, designing, developing and deploying enterprise solutions, based on client or business vision, which include components across the Artificial Intelligence spectrum such as Advanced Analytics, Machine Learning and Data Science
Experience in Hadoop, Spark, Storm or related paradigms and associated languages such as Pig, Hive, Mahout, plus advanced skills in Java/C++, R, Python, etc.
Experienced programming knowledge in both SAS and SQL, Operating system experience with UNIX and relational database knowledge such as ORACLE/TERADATA. SAS/Base, SAS/Stat, SAS/Macro preferred
Demonstrated expertise in at least one of the follownig: machine learning, deep learning, time-series modeling, propensity and prediction, behavioral nudges, recommenders, anomaly detection, segmentation, AI arcitecture, AI interface design
Experience with quantitative modeling (design, development & implemantation) using 3+ types of algorithm (e.g., Decision Trees, Naive Bayes Classification, Ordinary Least Squares Regression, Logistic Regression, Support Vector Machines, Ensemble Methods, Clustering Algorithms, Principal Component Analysis, Singular Value Decomposition, Independent Component Analysis)
In-depth theoretical and practical knowledge in a few select areas from across the AI spectrum
Bachelor's Degree preferably in applied mathematics, statistics, computer science, data science, electrical engineering, physics, or closely related field
Formal training in one or many of the following: signal processing, optimization, machine learning, linear algebra
Ability to travel 80-100% of the time (Monday – Thursday/Friday)",None Found,None Found,None Found,None Found,"Work you’ll do
At Deloitte you will manage and deliver components of client engagements that identify, design, and implement technology and creative business solutions for large companies. Key responsibilities will include:

Architect, Position, Design, Develop and Deploy enterprise solutions which include components across the Artificial Intelligence spectrum such as Chatbots, Virtual Assistants, Machine Learning, and Cognitive Services
Manage teams in the identification of business requirements, functional design, process design (including scenario design, flow mapping), prototyping, testing, training, defining support procedures.
Formulate planning, budgeting, forecasting and reporting strategies.
Manage full life cycle implementations.
Develop statements of work and/or client proposals.
Identify business opportunities to increase usability and profitability of information architecture.
Experience with program leadership, governance and change enablement.
Develop and manage vendor relationships.
Lead workshops for client education.
Manage resources and budget on client projects.
Assist and drive the team by providing oversight.

The team

Analytics & Cognitive

In this age of disruption, organizations need to navigate the future with confidence, embracing decision making with clear, data-driven choices that deliver enterprise value in a dynamic business environment.


The Analytics & Cognitive team leverages the power of data, analytics, robotics, science and cognitive technologies to uncover hidden relationships from vast troves of data, generate insights, and inform decision-making. Together with the Strategy practice, our Strategy & Analytics portfolio helps clients transform their business by architecting enterprise programs and differentiated strategies to win in their chosen markets.


The Analytics & Cognitive team works with our clients to:

Implement large-scale data ecosystems including data management, governance and the integration of structured and unstructured data to generate insights leveraging cloud-based as well as client-owned platforms
Deploy automation and cognitive and science-based techniques to manage data, predict scenarios and prescribe actions
Drive operational efficiency by maintaining their data ecosystems, sourcing analytics expertise and providing As-a-Service offerings for continuous insights and improvements

Qualifications

6+ years of relevant work experience
2+ years of consulting experience on AI projects (preferred)
2+ years of experience leading and managing project teams
Experience architecting, designing, developing and deploying enterprise solutions, based on client or business vision, which include components across the Artificial Intelligence spectrum such as Advanced Analytics, Machine Learning and Data Science
Experience in Hadoop, Spark, Storm or related paradigms and associated languages such as Pig, Hive, Mahout, plus advanced skills in Java/C++, R, Python, etc.
Experienced programming knowledge in both SAS and SQL, Operating system experience with UNIX and relational database knowledge such as ORACLE/TERADATA. SAS/Base, SAS/Stat, SAS/Macro preferred
Demonstrated expertise in at least one of the follownig: machine learning, deep learning, time-series modeling, propensity and prediction, behavioral nudges, recommenders, anomaly detection, segmentation, AI arcitecture, AI interface design
Experience with quantitative modeling (design, development & implemantation) using 3+ types of algorithm (e.g., Decision Trees, Naive Bayes Classification, Ordinary Least Squares Regression, Logistic Regression, Support Vector Machines, Ensemble Methods, Clustering Algorithms, Principal Component Analysis, Singular Value Decomposition, Independent Component Analysis)
In-depth theoretical and practical knowledge in a few select areas from across the AI spectrum
Bachelor's Degree preferably in applied mathematics, statistics, computer science, data science, electrical engineering, physics, or closely related field
Formal training in one or many of the following: signal processing, optimization, machine learning, linear algebra
Ability to travel 80-100% of the time (Monday – Thursday/Friday)
Preferred:


Expertise in at least one functional application preferred (e.g., prediction models, behavioral analytics, etc.)
2+ years’ experience working with Microsoft Cognitive Services, IBM Watson, IPSoft, Pega, Salesforce Einstein, Google Cloud Platform/Tensor Flow, or Amazon Web Services/Sagemaker, MS LUIS Chat, MS Azure Cognitive/ML
Deployed 10+ AI use cases
Expertise in 2+ domains preferred (e.g., Customer & Marketing, Finance, M&A, Operations, Pricing, Risk, Supply Chain, Workforce, etc.). Example of expertise includes:

Supply Chain: Knowledge of operations, manufacturing, quality or operations strategy for pharmaceutical, biotechnology and medical device organizationsPayments: Experience with use cases such as fraud detection, cashierless stores, hyperpersonalized credit scores, enhanced customer service, etc.Customer: Experience with use cases such as reduce customer churn, accurately price products / services, increase up-sell / cross-sell, reduce service Center call times, etc.HR: Experience with use cases such as improve workforce / role matching, workforce optimization, increase learning effectiveness, align total rewards by employee type, etc.IT: Experience with use cases such as optimize infrastructure use, optimize system / application performance, reduce IT security breaches, etc.Risk: Experience with use cases such as improve safety/standards compliance, improve fraud detection, improve regulatory complianceOperations: Experience with use cases such as eliminate underperforming SKUs, optimize fleet size and logistics, optimize inventory management

Strong experience running pursuits (US Practitioners)
Ability to communicate complex quantitative analysis in a concise and actionable manner
Ability to work independently, manage small engagements or parts of large engagements.
Strong oral and written communication skills, including presentation skills (MS Visio, MS PowerPoint) (US Practitioners)
Strong problem solving and troubleshooting skills with the ability to exercise mature judgment
An advanced degree in the area of specialization is preferred
How you’ll grow

At Deloitte, our professional development plan focuses on helping people at every level of their career to identify and use their strengths to do their best work every day. From entry-level employees to senior leaders, we believe there’s always room to learn. We offer opportunities to help sharpen skills in addition to hands-on experience in the global, fast-changing business world. From on-the-job learning experiences to formal development programs at Deloitte University, our professionals have a variety of opportunities to continue to grow throughout their career. Explore Deloitte University, The Leadership Center.


Benefits

At Deloitte, we know that great people make a great organization. We value our people and offer employees a broad range of benefits. Learn more about what working at Deloitte can mean for you.


Deloitte’s culture

Our positive and supportive culture encourages our people to do their best work every day. We celebrate individuals by recognizing their uniqueness and offering them the flexibility to make daily choices that can help them to be healthy, centered, confident, and aware. We offer well-being programs and are continuously looking for new ways to maintain a culture where our people excel and lead healthy, happy lives. Learn more about Life at Deloitte.


Corporate citizenship

Deloitte is led by a purpose: to make an impact that matters. This purpose defines who we are and extends to relationships with our clients, our people and our communities. We believe that business has the power to inspire and transform. We focus on education, giving, skill-based volunteerism, and leadership to help drive positive social impact in our communities. Learn more about Deloitte’s impact on the world.


Recruiter tips

We want job seekers exploring opportunities at Deloitte to feel prepared and confident. To help you with your interview, we suggest that you do your research: know some background about the organization and the business area you’re applying to. Check out recruiting tips from Deloitte professionals.

#LI:PTY

#IND:PTY"
61,Machine Learning Engineer,"Austin, TX",Austin,TX,None Found,None Found,"
A degree in Computer Science, Engineering, AI, Machine Learning, BI, MIS, or an equivalent technology field
3+ years of production programming experience in Scala (emphasis in functional programming), Spark and Python
Proven experience in Spark (strong knowledge optimizing code for Spark jobs)
Able to program and understand data science and data engineering ideas in Python and translate into modular, functional components in Scala
Familiar with automated machine learning (AutoML) concepts would be an asset
Experience with Breeze would be an asset
Experience deploying containerized Docker/Kubernetes applications
Streaming and micro-batch application development experience would be an asset, including Kafka, Storm, NiFi, Spark Streaming, Confluent or equivalent
Production systems integration experience
Proficiency with Linux/Unix operating systems, utilities and tools
Big Data application architecture experience and in-depth understanding of the Big Data ecosystem, applications, services, and design patterns",None Found,"
Architect, build, test, deploy distributed, scalable, and resilient Spark/Scala/Kafka Data processing, and Machine Learning model pipelines for batch, micro-batch, and streaming workloads. Experience in Scala development is required for this role.
Collaborate with data engineers to develop automated orchestration of data pipelines to find signals in client data
Collaborate with data scientists to develop automated orchestration of model pipelines to solve Cerebri AI business use case objectives
Proven experience in test automation for data and model pipelines
Deploy fully containerized Docker/Kubernetes Data processing, and Machine Learning model pipelines into Azure, AWS, GCP cloud environments and on-premise systems as necessary
Document Detailed Designs (including source to target mappings) and Code for Data Quality frameworks that can measure and maintain Data Completeness, Data Integrity and Data Validity between interfacing systems
Ensure all solutions comply with the highest levels of security, privacy, and data governance requirements as outlined by Cerebri and Client legal and information security guidelines, law enforcement, and privacy legislation, including data anonymization, encryption, and security in transit and at rest, etc.
Train and mentor junior team members
Acts as a Subject Matter Expert and a Thought Leader, continuously following industry trends, the latest competitive developments, and delivering papers and presentations at major industry conferences and events.",None Found,None Found,"As a Machine Learning Engineer, you will play an integral role in the development of our flagship AI product offerings for enterprise. You will be part of a small, focused team working in fast paced environment.

Responsibilities
Architect, build, test, deploy distributed, scalable, and resilient Spark/Scala/Kafka Data processing, and Machine Learning model pipelines for batch, micro-batch, and streaming workloads. Experience in Scala development is required for this role.
Collaborate with data engineers to develop automated orchestration of data pipelines to find signals in client data
Collaborate with data scientists to develop automated orchestration of model pipelines to solve Cerebri AI business use case objectives
Proven experience in test automation for data and model pipelines
Deploy fully containerized Docker/Kubernetes Data processing, and Machine Learning model pipelines into Azure, AWS, GCP cloud environments and on-premise systems as necessary
Document Detailed Designs (including source to target mappings) and Code for Data Quality frameworks that can measure and maintain Data Completeness, Data Integrity and Data Validity between interfacing systems
Ensure all solutions comply with the highest levels of security, privacy, and data governance requirements as outlined by Cerebri and Client legal and information security guidelines, law enforcement, and privacy legislation, including data anonymization, encryption, and security in transit and at rest, etc.
Train and mentor junior team members
Acts as a Subject Matter Expert and a Thought Leader, continuously following industry trends, the latest competitive developments, and delivering papers and presentations at major industry conferences and events.
Qualifications
A degree in Computer Science, Engineering, AI, Machine Learning, BI, MIS, or an equivalent technology field
3+ years of production programming experience in Scala (emphasis in functional programming), Spark and Python
Proven experience in Spark (strong knowledge optimizing code for Spark jobs)
Able to program and understand data science and data engineering ideas in Python and translate into modular, functional components in Scala
Familiar with automated machine learning (AutoML) concepts would be an asset
Experience with Breeze would be an asset
Experience deploying containerized Docker/Kubernetes applications
Streaming and micro-batch application development experience would be an asset, including Kafka, Storm, NiFi, Spark Streaming, Confluent or equivalent
Production systems integration experience
Proficiency with Linux/Unix operating systems, utilities and tools
Big Data application architecture experience and in-depth understanding of the Big Data ecosystem, applications, services, and design patterns
Nice To Haves
Experience with the Atlassian suite (JIRA, Confluence, BitBucket).
Any other related experience with Big Data, artificial intelligence, natural language processing, machine learning and/or deep learning, predictive analytics

Problem Solver – You are proficient at using a combination of intuition and logic to come up with solutions
Detail Oriented – You are an expert at identifying nuances and aligning small details with larger objectives
Independent Worker – Your experience and capabilities allow you to require little instruction and guidance
Excellent team player – You are humble, ambitious and driven to make a difference"
62,Geospatial Software Developer and Data Scientist,"Austin, TX",Austin,TX,None Found,None Found,"Standard office conditions
Use of manual dexterity
Repetitive use of keyboard at a workstation
Some weekend, evening, or holiday work
Possible interstate/intrastate travel
",None Found,"Develop new software and algorithms for remote sensing data production, evaluation and applications.
Collaborate with sponsor technical team and manage project progress.
Other related functions as assigned.
",None Found,None Found,"Job Posting Title:
Geospatial Software Developer and Data Scientist
-
Hiring Department:
Applied Research Laboratories
-
Position Open To:
All Applicants
-
Weekly Scheduled Hours:
40
-
FLSA Status:
Exempt
-
Earliest Start Date:
Immediately
-
Position Duration:
Expected to Continue
-
Location:
PICKLE RESEARCH CAMPUS
-
Job Description:
Development and implementation of geospatial algorithms for a variety of remote sensing technologies and applications (airborne and space-based). Innovate machine learning and deep learning techniques for exciting programs for diverse sponsor needs. Enhance and improve existing machine learning algorithms using modern machine learning methods. Innovate solutions to accommodate clustering and cloud based capabilities. Contribute to the Geospatial Laser Applications and Measurements group research tasks and objectives.
-
Job Details:
Responsibilities
Develop new software and algorithms for remote sensing data production, evaluation and applications.
Collaborate with sponsor technical team and manage project progress.
Other related functions as assigned.
Required Qualifications
Bachelor's degree in engineering or computer science and three years of related experience. Applicant must have expertise in Python and Unix shell scripting. Proficient with algorithm design and development. Applicant must be comfortable using a Linux command line interface and have practical experience using Git/Gitlab/Github or other modern software version control system. Experience with one or more machine learning toolkits, like ScikitLearn, Keras, PyTorch, or Tensorflow. Experience with common machine learning algorithms and supervised training methods, like dimensionality reduction, clustering, ensemble learning, decision trees, SVMs, and CNNs. Ability to work with sensitive and confidential information, maintain a professional demeanor, work as a team member without daily supervision and effectively communicate with diverse groups of clients.
US Citizen: Applicant selected will be subject to a government security investigation and must meet eligibility requirements for access to classified information at the level appropriate to the project requirements of the position.
Preferred Qualifications
Hands-on experience with state-of-the-art machine learning techniques using U-Nets, GANs, Autoencoders, or Reinforcement Learning. Demonstrated experience with end-to-end machine learning pipelines with real-world data-sets, including data cleaning, feature engineering, cross-validation, three-sets, and hyper-parameter tuning. Experience with R or MATLAB. Demonstrated experience with algorithm development for remote sensing data product processing, analysis and applications. Understanding of best practices of software development such as code reviews, test-driven development, and continuous integration/continuous deployment. Cumulative GPA of 3.0.
General Notes
An agency designated by the federal government handles the investigation as to the requirement for eligibility for access to classified information. Factors considered during this investigation include but are not limited to allegiance to the United States, foreign influence, foreign preference, criminal conduct, security violations, drug involvement, the likelihood of continuation of such conduct, etc.
Salary Range
$82,000-$129,000+/negotiable depending on qualifications
Working Conditions
Standard office conditions
Use of manual dexterity
Repetitive use of keyboard at a workstation
Some weekend, evening, or holiday work
Possible interstate/intrastate travel
Required Materials
Resume/CV
3 work references with their contact information; at least one reference should be from a supervisor
Letter of interest
Unofficial college transcripts
Important for applicants who are NOT current university employees or contingent workers: You will be prompted to submit your resume the first time you apply, then you will be provided an option to upload a new Resume for subsequent applications. Any additional Required Materials (letter of interest, references, etc.) will be uploaded in the Application Questions section; you will be able to multi-select additional files. Before submitting your online job application, ensure that ALL Required Materials have been uploaded. Once your job application has been submitted, you cannot make changes.
Important for Current university employees and contingent workers: As a current university employee or contingent worker, you MUST apply within Workday by searching for Find UT Jobs. If you are a current University employee, log-in to Workday, navigate to your Worker Profile, click the Career link in the left hand navigation menu and then update the sections in your Professional Profile before you apply. This information will be pulled in to your application. The application is one page and you will be prompted to upload your resume. In addition, you must respond to the application questions presented to upload any additional Required Materials (letter of interest, references, etc.) that were noted above.
-
Employment Eligibility:
Regular staff who have been employed in their current position for the last six continuous months are eligible for openings being recruited for through University-Wide or Open Recruiting, to include both promotional opportunities and lateral transfers. Staff who are promotion/transfer eligible may apply for positions without supervisor approval.
-
Retirement Plan Eligibility:
The retirement plan for this position is Teacher Retirement System of Texas (TRS), subject to the position being at least 20 hours per week and at least 135 days in length.
-
Background Checks:
A criminal history background check will be required for finalist(s) under consideration for this position.
-
Equal Opportunity Employer:
The University of Texas at Austin, as an equal opportunity/affirmative action employer , complies with all applicable federal and state laws regarding nondiscrimination and affirmative action. The University is committed to a policy of equal opportunity for all persons and does not discriminate on the basis of race, color, national origin, age, marital status, sex, sexual orientation, gender identity, gender expression, disability, religion, or veteran status in employment, educational programs and activities, and admissions.
-
Pay Transparency:
The University of Texas at Austin will not discharge or in any other manner discriminate against employees or applicants because they have inquired about, discussed, or disclosed their own pay or the pay of another employee or applicant. However, employees who have access to the compensation information of other employees or applicants as a part of their essential job functions cannot disclose the pay of other employees or applicants to individuals who do not otherwise have access to compensation information, unless the disclosure is (a) in response to a formal complaint or charge, (b) in furtherance of an investigation, proceeding, hearing, or action, including an investigation conducted by the employer, or (c) consistent with the contractor’s legal duty to furnish information.
-
Employment Eligibility Verification:
If hired, you will be required to complete the federal Employment Eligibility Verification I-9 form. You will be required to present acceptable and original documents to prove your identity and authorization to work in the United States. Documents need to be presented no later than the third day of employment. Failure to do so will result in loss of employment at the university.
-
E-Verify:
The University of Texas at Austin use E-Verify to check the work authorization of all new hires effective May 2015. The university’s company ID number for purposes of E-Verify is 854197."
