,Title,Location,City,State,Zip,Country,Qualifications,Skills,Responsibilities,Education,Requirement,FullDescriptions
168,Data Scientist -Quality Operations-Corporate,"New York, NY",New York,NY,None Found,None Found,None Found,None Found,"Providing innovative visual answers to clearly and concisely meet end user needs while considering all complexities that are inherent in health care data.
Translating requirements for data-driven solutions with minimal guidance.
Leading analytics and/or statistics project from start to finish.
Documenting workflow.
Work with clinical /internal team leads to define measures for assessment and analysis in support of operations management and quality and process improvement.
Determine and apply the most appropriate statistical analysis techniques in an agile fashion.
Create meaningful, appropriate data visualizations across various clinical and business domains.
Use common collaboration tools (i.e. JIRA, git) along with scripting languages (R, SAS, SQL) to create accurate and reproducible analyses.",None Found,"Master's (preferred) in Statistics, Mathematics, Economics or Public Health.
Three (+) years of experience in statistical programming language (R, SAS).
Possesses advanced applied statistics skills including an understanding of probability and its application to the analysis of data including statistical process control, process monitoring, and diagnostics.
Experience in risk model development, hierarchical modeling and predictive analytics.
Excellent at communicating difficult statistical concepts (oral and written).
Self-motivated and organized in pushing projects to completion.
Able to learn quickly on the job, with minimal guidance.
Experience working in agile environment.
","Strength Through Diversity
Ground breaking science. Advancing medicine. Healing made personal.

Quality Operations- Corporate
Data Scientist- Req # 2508918

The mission of Quality Operations is to improve health system performance and outcomes by providing leadership and care teams with quantifiable data and insights needed for operations, clinical performance measurement, quality improvement, analytics and outcomes research. We provide solutions to integrate, cleanse, govern, translate and dispense information across Mount Sinai’s clinical institutes and clinical care service lines.

Our team is seeking a Data Scientist to design and implement innovative data visualization and statistical analyses to drive quality and process improvement efforts.

Roles & Responsibilities:
Providing innovative visual answers to clearly and concisely meet end user needs while considering all complexities that are inherent in health care data.
Translating requirements for data-driven solutions with minimal guidance.
Leading analytics and/or statistics project from start to finish.
Documenting workflow.
Work with clinical /internal team leads to define measures for assessment and analysis in support of operations management and quality and process improvement.
Determine and apply the most appropriate statistical analysis techniques in an agile fashion.
Create meaningful, appropriate data visualizations across various clinical and business domains.
Use common collaboration tools (i.e. JIRA, git) along with scripting languages (R, SAS, SQL) to create accurate and reproducible analyses.
Requirements:
Master's (preferred) in Statistics, Mathematics, Economics or Public Health.
Three (+) years of experience in statistical programming language (R, SAS).
Possesses advanced applied statistics skills including an understanding of probability and its application to the analysis of data including statistical process control, process monitoring, and diagnostics.
Experience in risk model development, hierarchical modeling and predictive analytics.
Excellent at communicating difficult statistical concepts (oral and written).
Self-motivated and organized in pushing projects to completion.
Able to learn quickly on the job, with minimal guidance.
Experience working in agile environment.
Preferred Experience:
Experience with performance improvement methodologies (Lean, Six Sigma) and data-driven improvement efforts.
Experience in designing measures, surveys and studies helpful.
General understanding of healthcare departmental/clinical operations, workflow, policies, and procedures helpful.
Strength Through Diversity
The Mount Sinai Health System believes that diversity is a driver for excellence. We share a common devotion to delivering exceptional patient care. Yet we’re as diverse as the city we call home- culturally, ethically, in outlook and lifestyle. When you join us, you become a part of Mount Sinai’s unrivaled record of achievement, education and advancement as we revolutionize medicine together.

We work hard to acquire and retain the best people, and to create a welcoming, nurturing work environment where you can develop professionally. We share the belief that all employees, regardless of job title or expertise, can make an impact on quality patient care.

Explore more about this opportunity and how you can help us write a new chapter in our story!

Who We Are
Over 38,000 employees strong, the mission of the Mount Sinai Health System is to provide compassionate patient care with seamless coordination and to advance medicine through unrivaled education, research, and outreach in the many diverse communities we serve.

Formed in September 2013, The Mount Sinai Health System combines the excellence of the Icahn School of Medicine at Mount Sinai with seven premier hospital campuses, including Mount Sinai Beth Israel, Mount Sinai Beth Israel Brooklyn, The Mount Sinai Hospital, Mount Sinai Queens, Mount Sinai West (formerly Mount Sinai Roosevelt), Mount Sinai St. Luke’s, and New York Eye and Ear Infirmary of Mount Sinai.

The Mount Sinai Health System is an equal opportunity employer. We promote recognition and respect for individual and cultural differences, and we work to make our employees feel valued and appreciated, whatever their race, gender, background, or sexual orientation.

EOE Minorities/Women/Disabled/Veterans"
169,Senior Data Scientist - Machine Learning,"New York, NY",New York,NY,None Found,None Found,None Found,None Found,"
Apply machine learning and optimization algorithms to maximize the efficiency of our business and minimize risks.
Build, validate, test and deploy predictive models using machine learning techniques to explain or predict behavior and solve a variety of business and engineering problems.
Identify, collect, and explore the right data used for predictive modeling and algorithm development.
",None Found,None Found,"The search science team @WalmartLabs in Hoboken, NJ is dedicated to the mission of helping millions of customers every day in finding the right products. We are at the forefront of attacking one of the most complex problems of e-commerce. Whenever a user types in a query or browses through product categories on the web site, phone or the iPad, our service goes to work. We mine billions of search queries and tens of millions of products to find the most relevant products for our customers. Team members take end-end responsibility in analyzing large amounts of data, creating complex models, improving their accuracy and deploying these models to serve customers. As part of this team, you'll solve some of the most fascinating and impactful problems in machine learning, information retrieval, NLP or computer vision problems. The algorithms you develop will champion customers need to express their intent and our goal to understand their preferences, implicitly or explicitly across devices and modalities (voice, text, image etc.).

You will develop and deploy machine learned models, to engage and converse with our customers and to understand their goals and expectations to enable them to make the right purchase decision. Your work will be visible to millions of customers and you will have a direct impact on the goals of the Fortune #1 enterprise. If you speak and think machine learning then we want to talk to you. Come join our team and be part of this exciting journey.

Responsibilities:

Apply machine learning and optimization algorithms to maximize the efficiency of our business and minimize risks.
Build, validate, test and deploy predictive models using machine learning techniques to explain or predict behavior and solve a variety of business and engineering problems.
Identify, collect, and explore the right data used for predictive modeling and algorithm development.

Requirements


2+ years of work and research experience in the machine learning field.
A deep understanding of machine learning and interest in applying it at scale.
Experience with data cleaning, preparation, and feature building and selection techniques.
Experience working with large data sets to solve problems.
Experience with Spark and/or Hadoop would be very helpful.
Experience with deep learning library like TensorFlow and/or PyTorch is highly desirable.
Experience with GPU Computing is highly advantageous.
Prior hands-on experience with Python, Java or Scala and the ability to write reusable and

efficient code to automate machine learning pipeline and data processes.


Effective communication, interpersonal and teamwork skills.
Ability to handle multiple concurrent projects while working independently and in teams.
Ability to work in a fast-paced and deadline driven environment.
Ph.D. or MS in Computer Science, Statistics, Computational Linguistics, Artificial Intelligence,

Operations Research, Mathematics or related fields.

About Jet

Jet is reshaping ecommerce as we know it. Based in Hoboken NJ (just 10 min from Manhattan), we are a shopping site on the relentless pursuit to build the greatest shopping experience in the world. At Jet, we believe in bold. That means taking risks, asking ""why not"", looking where no ones looked before and bringing it! Our engineers are utilizing world class technologies, to optimize the supply chain, remove unnecessary costs, sprinkle in some surprise and delight all while saving customers every penny possible and we're just getting started. At Jet, we have worked hard to build a culture that stresses the importance of learning and sharing knowledge. If you want to be part of the team that is changing the shopping norm and learning a lot along the way, we have a hunch you'd look good in purple.

See what we've been up to

""A New & Improved Saving Experience ( https://medium.com/jet-stories/a-new-improved-savings-experience-f01846576b2c#.llzaqggis )"" // by Jessica Anerella, Product Design at Jet.com"
170,Data Scientist Manager - Advanced Analytics (HIA),"New York, NY 10017",New York,NY,10017,None Found,"Statistical Analysis and Techniques;Customer, Product and Pricing Analysis;Business and Operations Analysis within marketing, operations, or risk analysis using quantitative techniques.","Statistical Analysis and Techniques;Customer, Product and Pricing Analysis;Business and Operations Analysis within marketing, operations, or risk analysis using quantitative techniques.","
Proactively assist in the management of a portfolio of clients, while reporting to Senior Managers and above
Be involved in the financial management of clients
Be actively involved in business development activities to help identify and research opportunities on new/existing clients
Contribute to the development of your own and team’s technical acumen
Develop strategies to solve complex technical challenges
Assist in the management and delivering of large projects
Train, coach, and supervise staff
Keep up to date with local and national business and economic issues
Continue to develop internal relationships and your PwC brand","Statistical Analysis and Techniques;Customer, Product and Pricing Analysis;Business and Operations Analysis within marketing, operations, or risk analysis using quantitative techniques.","Statistical Analysis and Techniques;Customer, Product and Pricing Analysis;Business and Operations Analysis within marketing, operations, or risk analysis using quantitative techniques.","A career in our Analytics Technology practice, within Data and Analytics Technology services, will provide you with the opportunity to help organisations uncover enterprise insights and drive business results using smarter data analytics. We focus on a collection of organisational technology capabilities, including business intelligence, data management, and data assurance that help our clients drive innovation, growth, and change within their organisations in order to keep up with the changing nature of customers and technology. You’ll make impactful decisions by mixing mind and machine to leverage data, understand and navigate risk, and help our clients gain a competitive edge. Our team helps clients navigate various analytics applications to get the most value out of their technology investment and foster confidence in their business intelligence. As part of our team, you’ll help our clients implement enterprise content and data management applications that improve operational effectiveness and provide impactful data analytics and insights.

Responsibilities
As a Manager, you’ll work as part of a team of problem solvers with extensive consulting and industry experience, helping our clients solve their complex business issues from strategy to execution. Specific responsibilities include but are not limited to:
Proactively assist in the management of a portfolio of clients, while reporting to Senior Managers and above
Be involved in the financial management of clients
Be actively involved in business development activities to help identify and research opportunities on new/existing clients
Contribute to the development of your own and team’s technical acumen
Develop strategies to solve complex technical challenges
Assist in the management and delivering of large projects
Train, coach, and supervise staff
Keep up to date with local and national business and economic issues
Continue to develop internal relationships and your PwC brand

Job Requirements and Preferences:

Basic Qualifications:

Minimum Degree Required:
Bachelor Degree

Required Fields of Study:
Computer and Information Science, Computer and Information Science & Accounting, Economics, Economics and Finance, Economics and Finance & Technology, Engineering, Operations Management/Research, Statistics

Additional Educational Requirements:
Other quantitative fields of study may be considered

Minimum Years of Experience:
6 year(s)

Preferred Qualifications:

Preferred Knowledge/Skills:
Demonstrates extensive knowledge of, and proven success with a role, executing various aspects of the business or information technology-related client engagements and/or projects within a professional services environment, including knowledge of an industry or functional domain and expertise in at least two of the following areas:
Statistical Analysis and Techniques;Customer, Product and Pricing Analysis;Business and Operations Analysis within marketing, operations, or risk analysis using quantitative techniques.
Demonstrates significant experience working with analytical models or techniques and the ability to apply such methods to an applicable challenge within the larger field of expertise. This background should include:
Visualization techniques and tools;Advanced analytics techniques (regression, simulation, etc.);Applicable sources of external, internal or new data sources to support analytic methods and visualization techniques;Healthcare, Insurance, Financial Services, Customer an industrial Products and Services, Manufacturing or Telecom Industries.
Demonstrates extensive skills and success in consulting-related projects within a professional services environment, including:
Analyzing large and complex data sets to solve business challenges and present insights to non-analytics minded individuals;Collaborating and contributing as a team member: understanding personal and team roles, contributing to a positive working environment by building solid relationships with team members, proactively seeking guidance, clarification and feedback;Identifying and addressing client needs, building relationships with clients, developing requests for information, demonstrating flexibility in prioritizing and completing tasks, communicating potential conflicts to a supervisor;Prioritizing and handling multiple tasks, researching and analyzing pertinent client, industry and technical matters, utilizing problem-solving skills, and communicating effectively in written and verbal formats to various management levels and external;Coaching and collaborating with associates who assist with this work, including providing coaching, feedback and guidance on work performance;Applying analytical techniques correlated to business value and selecting the appropriate analytical techniques for the problem at hand.
Demonstrates extensive abilities as a team leader that include the following: leading teams to generate a vision, establish direction and motivate members, create an atmosphere of trust, leverage diverse views, coach staff, and encourage improvement and innovation.
All qualified applicants will receive consideration for employment at PwC without regard to race; creed; color; religion; national origin; sex; age; disability; sexual orientation; gender identity or expression; genetic predisposition or carrier status; veteran, marital, or citizenship status; or any other status protected by law. PwC is proud to be an affirmative action and equal opportunity employer."
171,Data Scientist (EFT Analytics),"New York, NY",New York,NY,None Found,None Found,None Found,None Found,None Found,None Found,None Found,"EFT Analytics, Inc. is looking for a Data Scientist to join our team! The Data Scientist will have the opportunity to work with a dynamic team to optimize and expand our advanced analytics platform. The successful candidate will be able to enhance and expand machine learning capabilities in the platform.
Strong written and verbal communication skills are required.
A Day In The Life Typically Includes:
Research, design and develop machine learning algorithms as part of the product development team
Perform Root Cause Analysis leveraging data science on large industrial problems related to process control, process engineering, and discrete manufacturing environments
Collaborate with our process engineering teams as the expert in applied data science and machine learning techniques
Use industry technologies, tools, and data mining frameworks for data analytics including data visualization for analyzing, optimizing, developing hypotheses, and drawing conclusions
What You Will Need:

Basic Qualifications:
2+ years of industry experience analyzing data sets and applying machine learning to assist decision making and solve problems
Knowledge of supervised and unsupervised algorithms
Extensive knowledge of a scientific computing language (e.g. Python or R)
Experience writing code in a collaborative environment
Strong knowledge of statistics and experimental design
This role is not eligible for visa sponsorship
What Will Put You Ahead?

Preferred Qualifications:
Master’s degree or PhD in Mathematics, Computer Science, Computer Engineering, Physics, Data Science or Statistics from an accredited institution
Exposure to programming languages: C#, Java, Scala, Julia
Experience deploying models to production and ensuring the model remains relevant in production
2+ years proficiency across a combination of academic and practical experience with Bayesian Statistics, Neural Networks, Regression Techniques, and other Machine Learning Applications
The ability to communicate results clearly and a focus on driving impact
Additional Information:
Ability to travel for work up to 15% of the time, by plane, car, etc.
Want to learn more about EFT Analytics?
Twenty years ago, EFT Analytics set out to deliver real-time, data-driven insights. Today, Industry 4.0 is the advent of Internet of Things, smart manufacturing and industrial stewardship. Insights and results earn your data a seat in the boardroom. EFT is a subsidiary of Koch Industries, one of the largest private companies in the U.S. Koch has delivered results using its unique management philosophy across dozens of industries and hundreds of sites for decades. EFT strives daily to bring those time-tested fundamentals to how we operate and what we deliver.
Our people and culture are just like you, totally unique. We come from vastly diverse backgrounds. We’ve taken our own paths. When there wasn’t a path, we blazed trails. Trails that led us here. Where we find ourselves unified around one mission: to be the best data analytics company on the planet. And we won’t stop until we get there.
Salary and benefits commensurate with experience.
This role is not eligible for work visa sponsorship.
We are an equal opportunity employer. Minority/Female/Disabled/Veteran

This employer uses E-Verify. Please visit the following website for additional information: www.kochcareers.com/doc/Everify.pdf"
