,Title,Location,City,State,Zip,Country,Qualifications,Skills,Responsibilities,Education,Requirement,FullDescriptions
0,NSPG Database Developer/Analyst,"Peabody, MA 01960",Peabody,MA,01960,None Found,"3 to 5 years working experience as a report developer or database programmer in a relational database environment.2+ years experience with a reporting tool (SSRS, Tableau, etc).Proven skills in developing ETL (Extract, Transform, Load) processes using a relational database - preferably SQL Server.Experience in creating or using stored procedures and functions to transform data in a relational database.Ability to assists with various database-related tasks, depending on need.Experience developing dashboards using business intelligence software, preferably Tableau.Experience with data collection, analytics and reporting from multi-sourced databases.Highly organized and able to manage multiple priorities.Able to work accurately while meeting tight deadlines within an environment with changing priorities.Able to work independently with a minimum of supervision.Strong team player with the ability to work well in a dynamic team environment.Excellent analytical and problem solving skills.Proficiency with MS Office Suite, especially MS Excel and MS Access.Excellent organizational, written/verbal and presentation skills, and the ability to work well with individuals at all levels within the institution.Independent learner who can acquire the necessary software skills to get the job done, including learning new applications, reporting tools, and/or programming languages.Ability to work well with others in a demanding and changing environment, including those whose expertise is not analytic or technical.Ability to work in incremental steps toward long-term strategy/vision",None Found,Develops and supports SQL Server Integration Services (SSIS) packages and scheduled jobs.,"BS/BA in computer science or related field. Similar work experience, technical skills, or relevant certification may be considered in place of bachelor's degree.Must maintain awareness of changing technology.","BS/BA in computer science or related field. Similar work experience, technical skills, or relevant certification may be considered in place of bachelor's degree.Must maintain awareness of changing technology.","About Us

North Shore Physicians Group (NSPG), the largest multispecialty group north of Boston, has a singular focus: the patient. We are more than 320 physicians, nurses and health professionals working as one to provide exceptional care. And we are a national leader in improving care delivery, patient health and satisfaction.
Through our partnership with North Shore Medical Center and our affiliation with Massachusetts General Hospital and Partners HealthCare, we offer such advances as EMRs, shared medical appointments, online access and remote patient monitoring. Our success is built on team-based practices, collaborative environments and the importance of work-life balance. Bring your exceptional skills to our innovative practices and join us in driving medicine forward.

General Summary

The NSPG Analytics Team works to support NSPG and other Parthers HealthCare physician group leadership strategies and decisions. The team develops and delivers solutions to complex problems based on data analysis and in depth knowledge of many data sources.
Under the supervision of the Director of Analytics and Business Strategy, the Database Developer - Analyst will be responsible for programming tasks related to ETL and database development as well as development and support of analytical reports for end users. The Database Developer – Analyist will collaboarate with operations, finance, and training teams, as well as staff at various levels throughout NSPG, NSMC, and associated physicians groups within Partners Healthcare.

Role Specific Responsibilities

Service
Develops and supports SQL Server Integration Services (SSIS) packages and scheduled jobs.Creates and tests SQL Server scripts, functions, and stored procedures to support ETL processing and the needs of end-user analysts.Provides thoughtful feedback on data architecture design and data model decisions.Builds and tests reports using Tabeau, Microsoft Access, Excel, PowerPoint, Word, Crystal Reports, and SQL Server Reporting Services (SSRS).Assists in administration of user access and appropriate report distribution.Collaborates with leadership to define problems and clarify project objectives.Evaluates data and reports to determine if they meet end user requirements.Coordinates with external departments to obtain data and ensure data integrity.
Regularly reviews data, identifies trends, and communicates changes in trends to leadership.
Leads, conducts, and coordinates development/analytic projects as assigned.
Provides cross-coverage for other team members.Leads by example, actively demonstrating and contributing to NSPG Mission of the “perfect patient experience every time”.

Growth
Willing to work in a Lean management style environment and willing to learn Lean techniques.Identifies sources of useful data to describe clinical and operations work processes and outcomes.
Flexibility and willingness to adapt to changing business processes, technologies, and NSPG strategyWork closely with end users to define business needs, develop project goals, approach, scope and work plan to meet both system and operational objectivesLeverage technology to improve processes. Be forward thinking with regard to use of technology and its application to current processes. Utilize existing technologies to the fullest to ensure efficient operations.Participate in both Operational and Technical Projects.Analyzes entire data flows for automation opportunities. Understands the cost-benefit trade-off of possible automation projects and communicates this information to supervisors when appropriate.Provides administrative, analytic, and reporting support to senior medical and leadership committees as needed.Able to identify complex problems, their probable causes, their impact to operations, report them appropriately, offer possible solutions and decide on the optimal course of action. Able to independently and/or collaboratively bring problems to complete resolution.

People
Ability to cooperatively and effectively work with people from all organizational levels and build consensus through negotiation and diplomacy.
Advanced analytical and problem solving skills. Ability to take initiative, embrace challenges and develop creative solutions.Address system inquiries and provide support to end-users at all levels of the organization.Effectively communicate with cross functional teams including both technical and non-technical staff.Ability to facilitate and work within complex, multi-site environment.Demonstrates comfort and enjoyment working within a team.

Quality

Creates and maintains custom database solutions to automate analytic and reporting needs.Demonstrated expertise in manipulating and interpreting data.Gathers and compiles documentation on standard data sets.Creates documentation for projects to facilitate Lean Standard Work.Understands Epic and other application user interface design principles.Demonstrate ability to work independently, take initiative and perform with integrity and responsibility.Ability to work well under pressure and on concurrent projects.Ability to manage priorities independently.


Qualifications

Required

3 to 5 years working experience as a report developer or database programmer in a relational database environment.2+ years experience with a reporting tool (SSRS, Tableau, etc).Proven skills in developing ETL (Extract, Transform, Load) processes using a relational database - preferably SQL Server.Experience in creating or using stored procedures and functions to transform data in a relational database.Ability to assists with various database-related tasks, depending on need.Experience developing dashboards using business intelligence software, preferably Tableau.Experience with data collection, analytics and reporting from multi-sourced databases.Highly organized and able to manage multiple priorities.Able to work accurately while meeting tight deadlines within an environment with changing priorities.Able to work independently with a minimum of supervision.Strong team player with the ability to work well in a dynamic team environment.Excellent analytical and problem solving skills.Proficiency with MS Office Suite, especially MS Excel and MS Access.Excellent organizational, written/verbal and presentation skills, and the ability to work well with individuals at all levels within the institution.Independent learner who can acquire the necessary software skills to get the job done, including learning new applications, reporting tools, and/or programming languages.Ability to work well with others in a demanding and changing environment, including those whose expertise is not analytic or technical.Ability to work in incremental steps toward long-term strategy/vision

Preferred
Familiarity with Epic, MGPO IPort, PHS EDW.

Education/Degree Requirements
BS/BA in computer science or related field. Similar work experience, technical skills, or relevant certification may be considered in place of bachelor's degree.Must maintain awareness of changing technology.


EEO Statement

Partners HealthCare is an Equal Opportunity Employer & by embracing diverse skills, perspectives and ideas, we choose to lead. All qualified applicants will receive consideration for employment without regard to race, color, religious creed, national origin, sex, age, gender identity, disability, sexual orientation, military service, genetic information, and/or other status protected under law.

Primary Location: MA-Peabody-NSM 2 Corporation
Work Locations: NSM 2 Corporation 2 Corporation Way Peabody 01960
Job: Business and Systems Analyst
Organization: North Shore Physicians Group(NSPG)
Schedule: Full-time
Standard Hours: 40
Shift: Day Job
Employee Status: Regular
Recruiting Department: NSPG Administration
Job Posting: Sep 13, 2019"
1,Database Administrator,"Burlington, MA 01803",Burlington,MA,01803,None Found,None Found,"
3+ years of database server administration experience in Microsoft SQL Server 2014 or later and intermediate knowledge of at least one of the following: MySQL/MariaDB, PostgreSQL, Cassandra
Thorough understanding of relational database technology and concepts, T-SQL/PLSQL scripting, database normalization best practices
SQL Server Management Studio (SSMS) and PowerShell
Strong experience in monitoring, backup/restore, performance tuning, query optimization, Performance Monitor, SQL Profiler, and other monitoring and troubleshooting tools
Exposure to ""NoSQL"" data stores, data warehouse, and web service data exchange
Practical experience in monitoring and configuring database servers for high availability using solutions like MSSQL clustering, Always On, database mirroring, and replication technologies
Experience with SQL, stored procedures, data batch processing, and data as a service
Practical experience in managing internal and external database security
Critical thinking skills to resolve problems and present solutions
In-depth expertise in automation for data operations
Excellent communication and documentation skills
Ability to triage issues, react well to changes, work with teams, and self-manage time and effort across multiple projects
Experience with cloud-based data services (especially AWS) preferred
Previous experience in healthcare or other highly-regulated industry is desirable.
Experience with SSIS/SSRS/SSAS is helpful","
Manage and maintain Welltok data management systems to encompass design, installation, deployment, replication, backup, restoration, optimization, security, and data exchange. Systems include ETL, operational data stores (relational and non-relational), data warehouse, and reporting.
Manage administration and database performance by tuning file structures and managing indexes.
Partner with software architects and engineers on data access methods and decisions on optimal data structures for persistence.
Safeguard data integrity and maintain security controls in all existing databases and data exchange technology through process, training, quality control, and monitoring.
Write simple to complex SQL queries, troubleshoot queries, and tune queries for best performance.
Design and implement processes to automate transactional information functions to optimize operational efficiency throughout the organization.
Develop logical and physical architecture models.
Manage data operations for data at rest, data exchange, batch processing, and data reporting.
Support development and production activities.
Generate and maintain documentation of data store architectures, configurations, operations, and maintenance.",None Found,None Found,"Welltok is a data-driven, enterprise SaaS company that delivers the healthcare industry's leading consumer activation platform. Welltok's solutions empower leading health plans, employers, providers and public entities to connect consumers with personalized health improvement resources, making it easy and rewarding for consumers to complete actions that optimize their health and wellbeing.

Welltok was named one of five healthcare companies on the Forbes 2018 Cloud 100 list, ranked #1 on the 2019 Tech Tribune's Best Technology Startups in Colorado and #2 in Colorado on Deloitte's 2017 Technology Fast 500. At Welltok, we're proud of what we're accomplishing and are committed to building a company where smart, passionate people can thrive and succeed. Join us as we make healthcare more personal and rewarding!
Position Summary
Welltok is looking for an experienced Database Administrator who will be responsible for the day to day operation of Welltok's data stores. The Database Administrator performs system check, replication, backup, recovery, and load analysis. They will troubleshoot systems with other operations functions and application developers when required.
Responsibilities
Manage and maintain Welltok data management systems to encompass design, installation, deployment, replication, backup, restoration, optimization, security, and data exchange. Systems include ETL, operational data stores (relational and non-relational), data warehouse, and reporting.
Manage administration and database performance by tuning file structures and managing indexes.
Partner with software architects and engineers on data access methods and decisions on optimal data structures for persistence.
Safeguard data integrity and maintain security controls in all existing databases and data exchange technology through process, training, quality control, and monitoring.
Write simple to complex SQL queries, troubleshoot queries, and tune queries for best performance.
Design and implement processes to automate transactional information functions to optimize operational efficiency throughout the organization.
Develop logical and physical architecture models.
Manage data operations for data at rest, data exchange, batch processing, and data reporting.
Support development and production activities.
Generate and maintain documentation of data store architectures, configurations, operations, and maintenance.
Required Knowledge & Skills
3+ years of database server administration experience in Microsoft SQL Server 2014 or later and intermediate knowledge of at least one of the following: MySQL/MariaDB, PostgreSQL, Cassandra
Thorough understanding of relational database technology and concepts, T-SQL/PLSQL scripting, database normalization best practices
SQL Server Management Studio (SSMS) and PowerShell
Strong experience in monitoring, backup/restore, performance tuning, query optimization, Performance Monitor, SQL Profiler, and other monitoring and troubleshooting tools
Exposure to ""NoSQL"" data stores, data warehouse, and web service data exchange
Practical experience in monitoring and configuring database servers for high availability using solutions like MSSQL clustering, Always On, database mirroring, and replication technologies
Experience with SQL, stored procedures, data batch processing, and data as a service
Practical experience in managing internal and external database security
Critical thinking skills to resolve problems and present solutions
In-depth expertise in automation for data operations
Excellent communication and documentation skills
Ability to triage issues, react well to changes, work with teams, and self-manage time and effort across multiple projects
Experience with cloud-based data services (especially AWS) preferred
Previous experience in healthcare or other highly-regulated industry is desirable.
Experience with SSIS/SSRS/SSAS is helpful

Welltok celebrates respects and supports diversity in the workplace. Welltok is an equal opportunity employer. We are committed to considering all qualified candidates regardless of race, color, ancestry, religion, sex, national origin, sexual orientation, age, citizenship, marital status, disability, or veteran status.

x7ol6EWtmU"
2,SQL Database Administrator,"Boston, MA 02111",Boston,MA,02111,None Found,"Four or more years of experience as a Microsoft SQL Server database administrator with significant SQL Server 2012/2014/2016 production experience
Knowledge of high availability architecture including clustering, data replication to a multisite setup, transaction log shipping, database mirroring, replication, AlwaysOn
Solid experience with Performance Monitor, DMV’s, Profiler and other tools to find areas that need tweaking
Experience with logical and physical database design
Experience with SQL database development and working with developers in web based environment
Experience with SQL encryption technologies, powershell, third party monitoring tools, DRaaS providers & AWS preferred
Hands on knowledge with Microsoft SQL Server Business Intelligence offering of products -Analysis Services, Reporting Services and Integration Services
Intuitive and analytical approach to problem solving
Excellent communication skills (written and verbal)
A highly self-motivated individual with the ability to work effectively in a collaborative, team-first IT environment",None Found,"Provide technical and operational database administration for MS SQL Server in Dev, Test and Production environments
Apply database knowledge in the areas of physical database design, performance and tuning, backup and recovery procedures and general problem resolution
Support multiple servers and multiple databases of high complexity with multiple concurrent users, ensuring control, integrity and accessibility of the data
Work with DBA team to develop, implement, and monitor standards and procedures to ensure optimum performance, scalability and reliability
Create and maintain scripts and documentation for all aspects of administration including database design, implementation, data scrubbing, encryption, disaster recovery, and participate in disaster recovery process
Perform system optimization and improvement planning, including, but not limited to, SQL Server database performance monitoring and analysis, capacity planning, system sizing and ongoing maintenance and tuning to ensure maximum performance
Hands-on support of large databases, including, but not limited to, availability monitoring, security, general database maintenance, extract- transformation-load, backup/recovery, documentation, and configuration
Evaluate and interpret requirements to develop and implement appropriate technical solutions
Be part of on-call rotation, including nights and weekends as needed
Perform daily monitoring of servers to provide proactive issue resolution
Perform code reviews, identify potential issues to reduce technical debt and provide coding best practice recommendations
Experience with multi-node/multi-instance clusters preferred
Knowledge of hardware and its impact on SQL preferred
Proficient working knowledge of the SQL language
Remain up to date with latest SQL related technologies
",None Found,None Found,"Homesite Insurance was founded in 1997 and was one of the first companies to enable customers to purchase home insurance directly online, during a single visit. Since then, we've continued to innovate rapidly to meet the needs of our customers and their changing expectations.
One thing that's stayed the same since our founding: our commitment to our customers, partners and employees.
Join us on our journey as we continue to grow into a powerful contender in the field of insurance.
Responsibilities
Provide technical and operational database administration for MS SQL Server in Dev, Test and Production environments
Apply database knowledge in the areas of physical database design, performance and tuning, backup and recovery procedures and general problem resolution
Support multiple servers and multiple databases of high complexity with multiple concurrent users, ensuring control, integrity and accessibility of the data
Work with DBA team to develop, implement, and monitor standards and procedures to ensure optimum performance, scalability and reliability
Create and maintain scripts and documentation for all aspects of administration including database design, implementation, data scrubbing, encryption, disaster recovery, and participate in disaster recovery process
Perform system optimization and improvement planning, including, but not limited to, SQL Server database performance monitoring and analysis, capacity planning, system sizing and ongoing maintenance and tuning to ensure maximum performance
Hands-on support of large databases, including, but not limited to, availability monitoring, security, general database maintenance, extract- transformation-load, backup/recovery, documentation, and configuration
Evaluate and interpret requirements to develop and implement appropriate technical solutions
Be part of on-call rotation, including nights and weekends as needed
Perform daily monitoring of servers to provide proactive issue resolution
Perform code reviews, identify potential issues to reduce technical debt and provide coding best practice recommendations
Experience with multi-node/multi-instance clusters preferred
Knowledge of hardware and its impact on SQL preferred
Proficient working knowledge of the SQL language
Remain up to date with latest SQL related technologies

Qualifications:
Four or more years of experience as a Microsoft SQL Server database administrator with significant SQL Server 2012/2014/2016 production experience
Knowledge of high availability architecture including clustering, data replication to a multisite setup, transaction log shipping, database mirroring, replication, AlwaysOn
Solid experience with Performance Monitor, DMV’s, Profiler and other tools to find areas that need tweaking
Experience with logical and physical database design
Experience with SQL database development and working with developers in web based environment
Experience with SQL encryption technologies, powershell, third party monitoring tools, DRaaS providers & AWS preferred
Hands on knowledge with Microsoft SQL Server Business Intelligence offering of products -Analysis Services, Reporting Services and Integration Services
Intuitive and analytical approach to problem solving
Excellent communication skills (written and verbal)
A highly self-motivated individual with the ability to work effectively in a collaborative, team-first IT environment"
