,Title,Location,City,State,Zip,Country,Qualifications,Skills,Responsibilities,Education,Requirement,FullDescriptions
16,Sr. Grant Administrator,"Boston, MA 02114",Boston,MA,02114,None Found, Professional certification (CRA or similar) preferred,None Found,None Found,None Found,None Found,"The Wellman Center for Photomedicine http://www.massgeneral.org/wellman is the world’s largest academic research facility dedicated to investigating the effects of light on human biology and to the development of light-mediated, minimally invasive diagnostic and therapeutic technologies. A pioneer in light-based biomedical research, the Center has a proven track record of translation of applications to clinical use. The Center operates on a current research budget of $39 million and employs over 170 research staff in 13 laboratories.
The Sr. Grant Administrator will be responsible for all pre and post award management of a portfolio of grants and contracts at Wellman Center. Primary duties include compliance, budget development, oversight and maintenance, subcontract management, reports to sponsors and Center leadership, and daily administrative and operational requirements for a financial portfolio for several principal investigators.
PRINCIPAL DUTIES AND RESPONSIBILITIES:
The Sr. Grant Administrator will work directly with several research laboratories within the Center. Fiscal responsibility includes providing pre- & post-award support for the fiscal management of the research grant portfolio. Responsible for: monitoring spending on research grants to ensure compliance with sponsor regulations; preparing monthly financial reports to inform the finance/administrative director & principal investigators of spending activity; maintaining a database of all active and pending grants; performing complete funding analysis on each grant and assisting Research Management with the timely closeout of all expired projects.
Pre-Award
 Assist with the preparation of research proposals, awards and transactions related to grant/ contract management.
 Prepare budgets and budget justification; ensure proposal compliance with Hospital and grantor policies and procedures, as well as those of subcontracting institutions.
 Serve as liaison to subcontracting institutions.
 Maintain grant, contract and sponsored research agreements in WCP shared electronic files in compliance with institutional and research sponsor policies.
 Facilitate implementation of grant awards by obtaining fund numbers, activating salary assignments to grants, and other associated tasks.
 Maintain updated other support pages in shared electronic files for proposal and JIT requests.
Post-Award
 Maintain timely coordination and communication with involved parties regarding grants management issues. Serve as liaison between WCP, PIs and internal and external groups to manage programs and funds.
 Prepare new fund activation requests, monitor fund balances and close out expired funds in a timely fashion.
 Work with Partners Innovations Office on administrative set up and monitoring of industry sponsored research agreements and MTAs.
 Prepare budget forecasting; conduct ongoing monitoring of fund statements; resolve accounting problems and errors including personnel and non-personnel expenses.
 Advise researchers regarding the allowability of costs to be charged to sponsored programs. Review appropriateness of transactions and budget reallocations against funding source guidelines. Work with Research Finance to resolve complex accounting issues.
 Ensure financial integrity of the lab(s) with accurate and timely accounts reconciliation and approve travel vouchers, invoices, procurements, reimbursements to employees, credit card activities with proper justification.
 Meet regularly with Principal Investigators to review funding portfolio.
 Responsible for identification and prevention of projected overruns and for the resolution of projects in deficit situation. Initiate mechanisms of budget control and assist in implementation on short and long-term basis. Identify, propose and implement creative solutions to potential fiscal issues.
 Monitor award/ agreement milestones, payment schedules and payments. In coordination with Research Finance, oversee contract billing, receivables and receipt of funds.
 Prepare cost transfers, changes in salary allocations, No Cost Extension requests, Residual Balance Transfers and rebudgeting according to institutional and sponsor policies.
 Prepare progress reports, just in time requests, continuation for future award years and maintain electronic file of updated biosketches, other support pages for proposal submission.
 Responsible for the timely closeout of all expired projects through the coordination of fiscal resources. In conjunction with Research Finance, conduct final desk audit for sponsor compliance upon project termination.
 Verify Financial Status Reports and subcontract invoices for accuracy.
 Coordinate regularly scheduled “Time and Effort” reports for all sponsored activities in order to ensure compliance with government guidelines.
General
 Maintain current working knowledge of Federal and Private sponsor regulations as well as institutional guidelines pertaining to research management.
 Assist in education and training of staff and researchers regarding sponsored research applications and financial management of grants.
 Assume additional responsibilities as assigned supporting the lifecycle of awards, contracts and unrestricted sources.
 Use Partners research applications as needed for daily workflow (e.g. PeopleSoft, Insight).
 Participate in Research Administrators Discussion Group and its task forces and committees.
 Represents the department as “grant management expert” on Hospital committees or at external meetings/symposiums.
SUPERVISORY RESPONSIBILITY (if applicable):
May assist in supervising support staff if assigned

FISCAL RESPONSIBILITY (if applicable):
The Sr. Grant Administrator will be responsible for several laboratories with pre and post award financial oversight for portfolios of approximately $10 million in research funds.
SKILLS/ABILITIES/COMPETENCIES REQUIRED:
 Must possess the ability to thrive in a busy, high-volume, and deadline driven team environment that requires coordination of multiple activities and the judgment and flexibility to reprioritize tasks as needed.
 Extensive knowledge of program administration guidelines of Federal and non-Federal funding agencies supporting biomedical research.
 Familiarity/experience with all types of award mechanisms, including grants, contracts, subcontracts, cooperative agreements, including complex multi-project awards.
 Proficiency in Microsoft Office Suite.
 Excellent problem-solving skills.
 Excellent organizational and communication skills with a focus on customer service.
 Ability to manage high volume and complex transactions

WORKING CONDITIONS:

Office setting within Wellman Center

Qualifications

LICENSES, CERTIFICATIONS, and/or REGISTRATIONS (if applicable):
 Professional certification (CRA or similar) preferred

EDUCATION:
Bachelors degree required. Masters degree in a related field preferred

EXPERIENCE:
3-5 years of professional grant administration experience required

EEO Statement

Massachusetts General Hospital is an Equal Opportunity Employer. By embracing diverse skills, perspectives and ideas, we choose to lead. Applications from protected veterans and individuals with disabilities are strongly encouraged.
Primary Location: MA-Boston-MGH Main Campus
Work Locations: MGH Main Campus 55 Fruit Street Boston 02114
Job: Grant and Fiscal Support
Organization: Massachusetts General Hospital(MGH)
Schedule: Full-time
Standard Hours: 40
Shift: Day Job
Employee Status: Regular
Recruiting Department: MGH Wellman Center for Photomedicine
Job Posting: Sep 4, 2019"
17,Grants Subaward Administrator 2,"Cambridge, MA 02142",Cambridge,MA,02142,None Found,None Found,None Found,None Found,None Found,None Found,"Working at MIT offers opportunities, an environment, a culture – and benefits – that just aren’t found together anywhere else. If you’re curious, motivated, want to be part of a unique community, and help shape the future – then take a look at this opportunity.

GRANTS SUBAWARD ADMINISTRATOR, Office of Sponsored Programs (OSP), to perform subaward administration under federal financial assistance (i.e., grants or cooperative agreements) and other sponsored awards on a cost reimbursement, fixed price, time and materials, and labor hour basis involving research and education. Responsibilities will include initiating subawards; establishing a risk designation for new organizations and conducting annual organizational reviews; determining appropriateness of subawards; interpreting and understanding prime award terms and conditions and negotiating and drafting subaward agreements; learning and maintaining awareness of relevant MIT/local/state/federal regulations relative to funding sources; establishing common understanding with stakeholders on subaward terms and conditions; monitoring subaward performance and modifying agreements; entering documents Kuali Coeus database; closing out subawards; providing reports; collaborating on updating policies/procedures and improving efficiency; conducting cost reasonableness studies and developing small business plans; providing guidance to OSP colleagues, department representatives, and others; and performing other duties as necessary.

Job Requirements

REQUIRED: bachelor degree in a relevant field; at least three years’ relevant professional experience, e.g., paralegal, contract administration, etc.; excellent organizational, oral and written communication, reading comprehension, and analytical skills; attention to detail; proficiency with MS Office (Word, Excel, PowerPoint), including intermediate-level spreadsheet capabilities; knowledge and understanding of how to find applicable legal and regulatory frameworks; and knowledge of and experience with grants and contract administration. Must be able to solve problems, draft written agreements, review and understand basic financial documents and contract terms/conditions, manage multiple concurrent tasks/projects/deliverables in a fast-paced environment, and collaborate with a range of stakeholders. Research administration experience; knowledge of MIT systems such as Kuali Coues and SAP; and paralegal or other legal/business administration/accounting experience would be helpful. Job #17794-8"
18,Senior Database Engineer,"Boston, MA",Boston,MA,None Found,None Found,"
Bachelor’s degree in computer science or a related technical field is preferred
Experience designing and implementing cloud native relational and non-relational data management technologies (Aurora, PostgreSQL, MongoDB, Hadoop, SPARK, etc.)
Software development or scripting experience (python, PowerShell, C#, node.js, etc.)
Infrastructure as code experience, preferably HashiCorp Terraform
Experience working with High Performance Computing supporting Machine Learning
Experience with traditional RDBMS platforms such as MS SQL Server
Knowledge of Linux platforms, Windows Server 2012/2016, and containerization
",None Found,"
Work closely with Investment Research Development teams to ensure that database design and code is optimized, scalable, and meets standards regardless of platform
Evaluate new technologies and implement enhancements to existing platforms
Efficiently and effectively troubleshoot problems in all environments as they arise
Identify and correct performance bottlenecks
Review developer database code and work with developers to implement suggested enhancements
Occasional on-call responsibilities of mission critical systems
",None Found,None Found,"Acadian Asset Management LLC is a Boston-headquartered investment management firm with wholly owned affiliates located in Singapore, London, Tokyo and Sydney. As of June 30, 2019, the firm managed approximately US$98 billion on behalf of major pension funds, endowments, foundations, governments and other investors based in the U.S. and abroad.

Position Overview:
The Senior Database Engineer primarily responsible for the design, build out, performance and management of the data systems and technologies that drive Acadian’s investment research process. As a member of the Database Operations Team the Engineer will report to the manager of Database Operations but be embedded in the Investment Analytics & Data team to provide technical expertise and guidance to the Investment Research Development staff.

Our current data environment is primarily MS SQL Server run on premises. Candidates will play a critical role in evaluating, piloting and migrating to alternative data stores that may be more appropriate based on the latency, parallelization and isolation demands of a variety of critical use cases. Experience with cloud native database technologies is required, Amazon Web Services is preferred. Experience with relational database design is a plus.

A successful candidate is a motivated self-starter with an aptitude for learning new skills and environments quickly while multi-tasking on more than one deliverable.

Responsibilities:

Work closely with Investment Research Development teams to ensure that database design and code is optimized, scalable, and meets standards regardless of platform
Evaluate new technologies and implement enhancements to existing platforms
Efficiently and effectively troubleshoot problems in all environments as they arise
Identify and correct performance bottlenecks
Review developer database code and work with developers to implement suggested enhancements
Occasional on-call responsibilities of mission critical systems

Qualifications:

Bachelor’s degree in computer science or a related technical field is preferred
Experience designing and implementing cloud native relational and non-relational data management technologies (Aurora, PostgreSQL, MongoDB, Hadoop, SPARK, etc.)
Software development or scripting experience (python, PowerShell, C#, node.js, etc.)
Infrastructure as code experience, preferably HashiCorp Terraform
Experience working with High Performance Computing supporting Machine Learning
Experience with traditional RDBMS platforms such as MS SQL Server
Knowledge of Linux platforms, Windows Server 2012/2016, and containerization

To view all of Acadian’s open positions please visit the Careers section of our website at http://www.acadian-asset.com/Careers/Job-opportunities. We will contact only selected candidates.

It is the policy of Acadian Asset Management LLC to provide equal employment opportunity to all qualified persons without regard to race, creed, color, sex, age, national origin, marital status, veteran status, citizenship status, disability, or sexual orientation."
19,SQL Database Developer,"Boston, MA",Boston,MA,None Found,None Found,None Found,"Strong written and verbal communication skills
Technical team experience and be a hands-on database administrator
The ability to work as an individual or as part of a critical team are mandatory
Working knowledge of SQL server 2017 and 2019 database management and web server software
Demonstrated expertise in various web technologies, MS SQL Enterprise Manager, T-SQL, and MS SQL store procedures
Ability to analyze and learn rapidly changing web related technologies and apply them as part of integrated solutions to business requirements
Pragmatic problem solving skills
Able to solve complex, analytical problems with the project team
Minimum of 4-5 years of experience or equivalent using MS SQL server and T-SQL
Ability to problem-solve, prioritizes projects, work on multiple projects at the same time; adjust project schedules to meet critical/changeable deadlines
Expertise in supporting web applications backed by SQL Server 2017
A master's or bachelor’s degree in Computer Science, Computer Engineering or a related field or equivalent work experience",None Found,None Found,None Found,".
Do you dare to reinvent the future of education?
At Cengage, we are harnessing the power of tech to build a future where all learners have the tools and confidence to achieve their goals. As a Cengage employee, you will blaze a new trail to transform the way people learn. Collaborating with the best of the best, you will feel challenged and inspired to do breakthrough work. With the support of our united team, there is no limit to what you can imagine, create and set in motion.
Are we right for you?
We set the bar higher by bringing our unique talents and point of view to the table every day. We are curious and comfortable with change and are willing to take risks to transform education. Most importantly, with everything we do, we put learning first.
What You'll Do Here:
This position will be responsible for building and maintaining a significant number of MS SQL server database coupled with customer-facing enterprise applications
You will work independently and on small teams to build solutions in a fast-paced, demanding environment
You will work on the development, approval, and implementation of database projects
You will be involved in major development projects that are used to support SAM customers and sales forces
You will stay abreast of emerging database development technologies
You will develop software solutions using Industry and Client's Learning Best Standards & Practices
You will provide business unit resource/consultant support for emerging internet technologies – understanding their ability to support functional requirements identified by other business units
You will be the Database lead, when necessary, on complex development efforts
Skills You Will Need Here:
Strong written and verbal communication skills
Technical team experience and be a hands-on database administrator
The ability to work as an individual or as part of a critical team are mandatory
Working knowledge of SQL server 2017 and 2019 database management and web server software
Demonstrated expertise in various web technologies, MS SQL Enterprise Manager, T-SQL, and MS SQL store procedures
Ability to analyze and learn rapidly changing web related technologies and apply them as part of integrated solutions to business requirements
Pragmatic problem solving skills
Able to solve complex, analytical problems with the project team
Minimum of 4-5 years of experience or equivalent using MS SQL server and T-SQL
Ability to problem-solve, prioritizes projects, work on multiple projects at the same time; adjust project schedules to meet critical/changeable deadlines
Expertise in supporting web applications backed by SQL Server 2017
A master's or bachelor’s degree in Computer Science, Computer Engineering or a related field or equivalent work experience"
20,SQL Server DBA,"Andover, MA 01810",Andover,MA,01810,None Found,None Found,None Found, Advise the customer on best practices,None Found,None Found,"SQL Server Database Administrator - Onsite in Andover, MA

Essential Duties and Responsibilities include the following. Other duties may be assigned.
 Advise the customer on best practices
 Implement best practices on Microsoft SQL Server Databases and Servers
 Interface and communicate with customers
 Interface and communicate with other internal departments at Remote DBA Experts
 Participate in an on call rotation
 Install and configure SQL Server
 Document processes and procedures
 Implement/Support Log Shipping
 Implement/Support Mirroring
 Implement/Support Replication
 Implement/Support Clustering
 Participate in migrations for customers
 Participate in upgrades
 Keep time entry up to date within 24 hours
 Advise customers on hardware and licensing questions
 Ensure that customers are have appropriate maintenance in place including backups, index maintenance, consistency checks and statistics maintenance
 Support SSIS, SSRS, SSAS solutions for customers
 Performance tuning
 Continue to learn new skills involved in being a SQL Server DBA as the technology evolves
 Keep up to date with new releases of Microsoft SQL Server and advise customers of the aspects that pertain to them

Qualifications
To perform this job successfully, an individual must be able to perform each essential duty satisfactorily. The requirements listed below are representative of the knowledge, skill, and/or ability required. Reasonable accommodations may be made to enable individuals with disabilities to perform the essential functions.

Education and/or Experience
Bachelor's degree (B. A.) from four-year college or university; or one to two years related experience and/or training; or equivalent combination of education and experience.

Computer Skills
To perform this job successfully, an individual should have knowledge of SQL Server Database software, including SSMS, BIDS, Embarcadero, and Perfmon. The employee should know how to perform a server side trace, and how to use the various DMVs, the Cluster Manager, and other tools needed to troubleshoot issues when they arise."
21,Database Assistant,"Boston, MA 02114",Boston,MA,02114,None Found,"Associates Degree preferred
Minimum of 2 to 4 years of database experience
Medical Terminology
2-4 years healthcare experience
",None Found,None Found,None Found,None Found,"Under general supervision, provides data management support to the Program Manager for various database programs. Requires discretion and judgment to organize priorities, complete tasks and handle confidential patient information. Responsibilities include accurate case selection, data extraction and data entry from a variety of sources, as well as, assisting in report preparation, assisting in research activities, and supporting performance improvement. Reports directly to and receives supervision and overall administrative direction related to policies and procedures from the Program Manager for the Trauma, Emergency Surgery and Surgical Critical Care. Also works collaboratively with the Trauma Program administrative team (Trauma Program Nurse Director, Administrative Director and Trauma Attending Physicians).


PRINCIPAL DUTIES AND RESPONSIBILITIES: Indicate key areas of responsibility, major job duties, special projects and key objectives for this position. These items should be evaluated throughout the year and included in the written annual evaluation.


DATABASE RESPONSIBILITIES

Proper case selection using the policy for inclusion and exclusion criteria
Extracts data for all current data fields for the registries from various electronic or paper sources
Fills out data entry forms
Performs diagnostic/procedure/injury coding

Performs data entry on the cases selected and extracted
Enters performance improvement and complication data points
Assists with cleaning up data using validation reports and correcting errors when identified
Generates standard reports as requested
Assists with data projects including calculations or data mining with direction from the program manager and may include research projects, education and outreach, or performance improvement activities
Assists with the preparation of State, NTDB or National Burn Repository mandatory data submission
Assists with over flow from all departmental registries
Participates in the TQIP Program
Attends webinars on TQIP education
Takes quizzes regarding TQIP material
Understands and stays current with TQIP concepts, definitions and requirements
May have to attend TQIP conference
Performs TQIP data entry when needed
Participates in TQIP program at all levels as directed by program manager

II. ADMINISTRATIVE RESPONSIBILITIES

Assists with the Performance Improvement Program including producing and filing PI folders
Medical Records abstracting for PI or other departmental projects
Perform/participate in special projects at the request of the Program Manager, Nursing Director or Administrative Director.
Participates in the American College of Surgeons Trauma Center verification visit
Cross - covers for other staff members for breaks, lunches, vacations, etc. and during variations in workflow as needed.
Other projects assigned by trauma administration


Qualifications

Associates Degree preferred
Minimum of 2 to 4 years of database experience
Medical Terminology
2-4 years healthcare experience

EEO Statement

Massachusetts General Hospital is an Equal Opportunity Employer. By embracing diverse skills, perspectives and ideas, we choose to lead. Applications from protected veterans and individuals with disabilities are strongly encouraged.

Primary Location: MA-Boston-MGH Main Campus
Work Locations: MGH Main Campus 55 Fruit Street Boston 02114
Job: Administrative Support
Organization: Massachusetts General Hospital(MGH)
Schedule: Full-time
Standard Hours: 40
Shift: Day Job
Employee Status: Regular
Recruiting Department: MGH Trauma Surgery
Job Posting: Sep 11, 2019"
