,Title,Location,City,State,Zip,Country,Qualifications,Skills,Responsibilities,Education,Requirement,FullDescriptions
53,"Oracle Database Administrator - Exton, PA or Bedford, MA","Bedford, MA",Bedford,MA,None Found,None Found,"
Proficient in Microsoft Office Suite products.
General desktop with windows and linux server experience.
Be available after hours and weekends as necessary for customer maintenances.
Technical support or call center production support experience a plus","
Oracle RMAN and logical backup and recovery processes
Oracle DataGuard and ASM
Knowledge of running Oracle on Unix/Linux
Deploying or migrating oracle databases into AWS (ec2 or RDS) desired but not essential
Oracle 12c and 13c Enterprise Manager Cloud Control
Basic Knowledge of RDBMS systems. Oracle, Microsoft SQL Server and MySQL preferred.
Knowledge of ANSI SQL Language (SELECT, INSERT, UPDATE, DELETE, JOIN, WHERE, etc…).
HTML/CSS/PHP, Command-line and shell scripting experience a plus.
Strong analytical, communication both written and verbal and quality control skills.
Ability to manage multiple tasks with different deadlines.
Detail oriented, self-motivated and uses sound judgment.
A team player who works well with others.
Desire to learn and improve your skills.",None Found,"
Bachelor’s Degree in related area preferred
5+ years’ experience in database administration
3+ years’ experience in Oracle, MySQL, MSSQL or otherdatabase scripting language",None Found,"Looking to start an exciting new career as a Database Administrator? Do you have a basic understanding of relational databases and the SQL language? Guidewire is looking for a highly motivated individual to join our team as an Oracle Database Administrator. As a DBA at Guidewire, assignments, decision making and complexity are not limited to just carrying out established work processes and operations. You will be learning new and exciting AWS processes as we embrace our journey to the cloud. In addition, you will learn additional database platforms which will expand your skills in both database administration and performance tuning.

Duties:
Assist in daily administration activities including setup, configuration and monitoring of Oracle Rman and logical backups, Oracle DataGuard and Oracle ASM.
Tuning, trouble shooting and on-call production support for oracle environments deployed in multi-AZ AWS environments both on the EC2 and RDS platforms.
Monitor and work the JIRA ticket queue for request to make schema changes, security changes, execute scripts against the databases and refresh non-production databases.
Advise application development and support teams on process bottlenecks and provide database tuning to ensure optimal performance.
Assist the support staff to troubleshoot SQL and any other database errors.
Provide 24*7 on-call support (includes holidays) for the Oracle, Microsoft SQL Server and Aurora (MySQL) production and non-production databases.
Report monthly to management about abnormalities and critical issues; provide root cause analysis and recommendations; work with infrastructure team, application team and/or other teams for problem resolutions, following the escalation path if needed.

Desired Skills:
Oracle RMAN and logical backup and recovery processes
Oracle DataGuard and ASM
Knowledge of running Oracle on Unix/Linux
Deploying or migrating oracle databases into AWS (ec2 or RDS) desired but not essential
Oracle 12c and 13c Enterprise Manager Cloud Control
Basic Knowledge of RDBMS systems. Oracle, Microsoft SQL Server and MySQL preferred.
Knowledge of ANSI SQL Language (SELECT, INSERT, UPDATE, DELETE, JOIN, WHERE, etc…).
HTML/CSS/PHP, Command-line and shell scripting experience a plus.
Strong analytical, communication both written and verbal and quality control skills.
Ability to manage multiple tasks with different deadlines.
Detail oriented, self-motivated and uses sound judgment.
A team player who works well with others.
Desire to learn and improve your skills.

Minimum Qualifications:
Proficient in Microsoft Office Suite products.
General desktop with windows and linux server experience.
Be available after hours and weekends as necessary for customer maintenances.
Technical support or call center production support experience a plus

Education and Experience:
Bachelor’s Degree in related area preferred
5+ years’ experience in database administration
3+ years’ experience in Oracle, MySQL, MSSQL or otherdatabase scripting language

Why Guidewire?
Guidewire exists to deliver the industry platform that P&C insurers rely upon to adapt and succeed in a time of accelerating change—and to ensure that every customer succeeds in the journey. We provide the software, services, and partner ecosystem to enable our customers to run, differentiate, and grow their business.
Guidewire InsurancePlatform is the P&C industry platform that unifies software, services, and partner ecosystem to power our customers’ business. InsurancePlatform provides the standard upon which insurers can engage their customers, optimize their operations, drive smart decisions, and innovate quickly. We are privileged to serve more than 350 P&C insurers in 32 countries. We invest heavily in R&D to build a technology platform that combines three elements—core processing, data and analytics, and digital engagement—to enhance insurers’ ability to engage and empower their customers and employees."
54,Systems Administrator,"Bedford, MA 01730",Bedford,MA,01730,None Found,None Found,None Found,None Found,None Found,None Found,"Job Description: System Administrator
Location: Bedford, MA

As a System Administrator at EnterpriseDB you will join team of exceptional professionals in a dynamic open source software company. EnterpriseDB develops and supports an enterprise-class relational database, built on PostgreSQL, the world’s most advanced open source database. With outstanding financial backing, experienced world-class management and a fast growing global presence, EnterpriseDB has quickly become one of the “companies to watch” in the IT marketplace.
The chosen candidate will be part of our global IT team, playing a vital role in the delivery and management of global infrastructure services to the company.
The ideal candidate will have experience working in a highly-available environment that can support our development and release efforts. This position requires fluency in LINUX operating environments, experience with networking fundamentals and experience with virtualization concepts.
Required / Desired Skills
Experience supporting a distributed global IT infrastructure
Experience with OpenStack (strongly preferred) or other virtualization technologies
Experience with CentOS or Red Hat Enterprise Linux (RHEL)
Experience working with Cloud providers (such as Amazon EC2) and managed hosting providers
Experience with monitoring and alerting systems such as Nagios (and or Splunk).
Experienced in one or more scripting technologies (Python strongly preferred)
Solid understanding of TCP/IP networking, UNIX-related network services, VLAN configuration (Cisco), load balancing, horizontal scaling
Experience with Meraki wireless LAN’s and switching , is a plus.
Strong written and verbal communication skills
Strong technical, organizational and interpersonal skills
Ability to work as part of a team
Self-motivated with strong desire for personal growth
Ability to thrive under pressure, self-manage and prioritize activities

Position requires 3-5 years of relevant experience with a Bachelor’s degree in Computer Science (or equivalent)"
55,Data Analyst - 20 Hours,"Somerville, MA 02145",Somerville,MA,02145,None Found,"Bachelor’s Degree in Business, or Information Systems field required; Master’s Degree strongly preferred.","Ability to, set priorities, respond to changing situations, and manage time appropriately to meet deadlines.Self-motivated, organized, attentive to detailAbility to work in a dynamic team environment and with individuals at all levels within the institution.Customer-focused, with effective communication techniques including effective presentation skills and ability to communicate technical information to a non-technical audienceStrong computer and data management skillsLogical thinking with strong mathematical, statistical and fiscal analytic skillsExpertise in managing, interpreting, reporting and presenting dataHigh degree of professionalism, discretion, and confidentialityPossible local travel to Partners sites","Assisting with maintaining data access rightsGaining and maintaining a comprehensive, in depth knowledge of all applications used by the OHS and Workers’ Compensation DivisionDeveloping strategic plans and goals to ensure data needs are met and data can be provided in an efficient and timely manner to support leadership and program and regulatory needsAssessing workflow related to data capture, storage, and maintenance to improve upon efficiencyModifying existing OHS and Workers’ Compensation info systems applications as needed to meet changing needsDeveloping training tools for end users",None Found,None Found,"About Us

As a not-for-profit organization, Partners HealthCare is committed to supporting patient care, research, teaching, and service to the community by leading innovation across our system. Founded by Brigham and Women’s Hospital and Massachusetts General Hospital, Partners HealthCare supports a complete continuum of care including community and specialty hospitals, a managed care organization, a physician network, community health centers, home care and other health-related entities. Several of our hospitals are teaching affiliates of Harvard Medical School, and our system is a national leader in biomedical research.

We’re focused on a people-first culture for our system’s patients and our professional family. That’s why we provide our employees with more ways to achieve their potential. Partners HealthCare is committed to aligning our employees’ personal aspirations with projects that match their capabilities and creating a culture that empowers our managers to become trusted mentors. We support each member of our team to own their personal development—and we recognize success at every step.

Our employees use the Partners HealthCare values to govern decisions, actions and behaviors. These values guide how we get our work done: Patients, Affordability, Accountability & Service Commitment, Decisiveness, Innovation & Thoughtful Risk; and how we treat each other: Diversity & Inclusion, Integrity & Respect, Learning, Continuous Improvement & Personal Growth, Teamwork & Collaboration.

General Overview

The Partners Occupational Health Services (OHS) Data Manager serves a key role in supporting the mission of the OHS, including the Workers’ Compensation Division, by ensuring the data needs are met to support process improvement, initiatives and programs and to meet regulatory compliance in a timely and accurate manner. Key to this work is the ability to collaborate with key stakeholders in the OHS, Workers’ Compensation Division, at local affiliates, and with the OHS Database Administrators. The OHS Data Manager has responsibility for developing and modifying the data infrastructure of the OHS to facilitate data collection and analysis.
The OHS Data Manager collaborates with all members of the Occupational Health leadership team including the Chief of Occupational/Environmental Medicine, OHS Director, and the OHS Database Administrators.

Principal Duties and Responsibilities

The OHS Database Manager assists with the development, management, and implementation of data applications and related tools utilized by the OHS and Workers’ Compensation Division so as to ensure there is an adequate data infrastructure. This work includes the following responsibilities:
Assisting with maintaining data access rightsGaining and maintaining a comprehensive, in depth knowledge of all applications used by the OHS and Workers’ Compensation DivisionDeveloping strategic plans and goals to ensure data needs are met and data can be provided in an efficient and timely manner to support leadership and program and regulatory needsAssessing workflow related to data capture, storage, and maintenance to improve upon efficiencyModifying existing OHS and Workers’ Compensation info systems applications as needed to meet changing needsDeveloping training tools for end users
The OHS Database Manager is responsible for extracting data from the applications used for the purpose of supporting the OHS leadership team, OHS Site Directors and their staff assigned to compliance management, and the Workers’ Compensation Division Manager. Data extracted is generally intended for use for program implementation and assessment, compliance, and process improvement. This work includes the following responsibilities:
Identifying and understanding reporting needs to committees and key stakeholders as well as regulatory agencies for the purpose of identifying most efficient and accurate way to extract data and present the data to meet the needs. This work includes assisting with the development of the presentations or reports in regards to the data component.
Assisting with queries and data extracts from the OHS and WC Division applications
With an understanding of the mission and strategic value of the OHS and WC Division, synthesizes data from various sources and highlights key metrics to inform OHS leadership decision-making
Produces timely and accurate regular and ad hoc reports; integrates and automates management data, analytics and metrics in management reports
Use/s the Partners HealthCare values to govern decisions, actions and behaviors. These values guide how we get our work done: Patients, Affordability, Accountability & Service Commitment, Decisiveness, Innovation & Thoughtful Risk; and how we treat each other: Diversity & Inclusion, Integrity & Respect, Learning, Continuous Improvement & Personal Growth, Teamwork & Collaboration
Other duties as assigned

Qualifications
Bachelor’s Degree in Business, or Information Systems field required; Master’s Degree strongly preferred.
o 3-5 years’ experience and demonstrated competency in:
 Data management and reporting tools such as MS Access, and MS Excel
 Familiarity with SQL Server a plus
A combination of education and experience may be substituted for requirements

Skills, Abilities and Competencies

Ability to, set priorities, respond to changing situations, and manage time appropriately to meet deadlines.Self-motivated, organized, attentive to detailAbility to work in a dynamic team environment and with individuals at all levels within the institution.Customer-focused, with effective communication techniques including effective presentation skills and ability to communicate technical information to a non-technical audienceStrong computer and data management skillsLogical thinking with strong mathematical, statistical and fiscal analytic skillsExpertise in managing, interpreting, reporting and presenting dataHigh degree of professionalism, discretion, and confidentialityPossible local travel to Partners sites

EEO Statement

Partners HealthCare is an Equal Opportunity Employer & by embracing diverse skills, perspectives and ideas, we choose to lead. All qualified applicants will receive consideration for employment without regard to race, color, religious creed, national origin, sex, age, gender identity, disability, sexual orientation, military service, genetic information, and/or other status protected under law.

Primary Location: MA-Somerville-Assembly Row - PHS
Work Locations: Assembly Row - PHS 399 Revolution Drive Somerville 02145
Job: Finance/Accounting
Organization: Partners HealthCare(PHS)
Schedule: Part-time
Standard Hours: 20
Shift: Day Job
Employee Status: Regular
Recruiting Department: PHS Occupational Health
Job Posting: Sep 9, 2019"
56,Patient Family Relations Specialist,"Boston, MA 02115",Boston,MA,02115,None Found,None Found,None Found,"Shares responsibility for the coverage of Patient/Family Relations Office phones, pagers, and email during operational hours
Responds to patient, family, staff queries / feedback
Triages patient, family, and staff queries appropriately and efficiently
Responds to urgent patient/family needs as requested
Completes documentation related to patient/family/staff encounters to gather pertinent information
Enters case summary and related information into the PFR database",None Found,None Found,"Overview
Located in Boston and the surrounding communities, Dana-Farber Cancer Institute brings together world renowned clinicians, innovative researchers and dedicated professionals, allies in the common mission of conquering cancer, HIV/AIDS and related diseases. Combining extremely talented people with the best technologies in a genuinely positive environment, we provide compassionate and comprehensive care to patients of all ages; we conduct research that advances treatment; we educate tomorrow's physician/researchers; we reach out to underserved members of our community; and we work with amazing partners, including other Harvard Medical School-affiliated hospitals.

The Patient / Family Relations (P/FR) Specialist serves as an integral member of the Quality and Patient Safety Department (QPS), participating in various aspects of patient advocacy, which includes helping to personalize and humanize the hospital experience.

The P/FR Specialist will support the Patient / Family Relations program at the Institute, including the outpatient and inpatient locations, by serving as a liaison between patients (adult and pediatric), families, and staff by ensuring an effective complaint and grievance process. He/she will engage in intake and triage of patient complaints and requests. The P/FR Specialist will ensure a coordinated and timely response, in accordance with state and federal regulatory guidelines and Institute policy, to patients/families who have expressed a concern, complaint, grievance, compliment, question and / or a request regarding care, treatment or services at Dana-Farber Cancer Institute (DFCI).

In addition, the P/FR Specialist will help to ensure ongoing monitoring of DFCI’s compliance with federal laws prohibiting discrimination against patients, including applicable rules under the Patient Protection and Affordable Care Act (“ACA”) and Americans with Disabilities Act (“ADA”). In addition, the P/FR Specialist will be available to staff to assist with challenging patients / families or to provide guidance in the utilization of other Institute resources (e.g., the Division of Social Work, Psychosocial Oncology, or Patient & Family Programs & Services).
The P/FR Specialist will be available during regular business hours.
Responsibilities
Patient / Family / Staff communications
Shares responsibility for the coverage of Patient/Family Relations Office phones, pagers, and email during operational hours
Responds to patient, family, staff queries / feedback
Triages patient, family, and staff queries appropriately and efficiently
Responds to urgent patient/family needs as requested
Completes documentation related to patient/family/staff encounters to gather pertinent information
Enters case summary and related information into the PFR database
Complaint/Grievance Management
Assists in the coordination, facilitation, and accurate documentation of cases from intake to resolution
Works closely with P/FR Manager, along with Department / Unit leaders to write / review / edit / format response letters to patients / families
Collaborates with P/FR Manager, Risk Management staff and Medical Director of Patient Safety on case reviews
Interfaces closely with affiliates, Brigham and Women’s Hospital and Boston Children’s Hospital, to insure coordinated investigation and feedback
Patient/Family Relations Program
Assists in maintaining the Service Recovery Program inventory and log
Tracks Service Recoveries in the PFR database
Supports Patient Experience initiatives
Participates in Institute-wide committees
Participates in the orientation of new staff
Interacts with Institute staff and departments, such as but not limited to Social Work, Nursing, Psychosocial Oncology & Palliative Care, Volunteer Services, Medical, Surgical and Pediatric Oncology
Responds to requests for information related to or witnessing Advance Directives (e.g., health care proxy)
Assists in the coordination of PFR activities, education, and training programs
ADA/ACA Program
Facilitate compliance with the rules required under the ACA and ADA to prevent discriminatio
Ensure DFCI’s timely response to patient disability accommodation requests and discrimination grievances.
Serve as a resource for administrators and staff about the ACA and ADA.
When appropriate, along with DFCI’s Office of General Counsel, serve as a liaison to the Department of Health and Human Services Office of Civil Rights (“OCR”) for issues regarding discrimination generally.
Maintains Department and Institute service standards.

All other duties as assigned.
Qualifications
Bachelor’s degree required. 3-5 years healthcare experience demonstrating excellent customer service, writing and problem-solving skills. Ability to communicate with all levels of staff and appropriately manage challenging situations in real-time. Ability to demonstrate flexibility, participate in and provide customer service training and guidance to staff and clinicians

Dana-Farber Cancer Institute is an equal opportunity employer and affirms the right of every qualified applicant to receive consideration for employment without regard to race, color, religion, sex, gender identity or expression, national origin, sexual orientation, genetic information, disability, age, ancestry, military service, protected veteran status, or other groups as protected by law."
57,Senior Database Administrator,"Cambridge, MA",Cambridge,MA,None Found,None Found,None Found,None Found,None Found,None Found,None Found,"Cogo Labs
Cambridge, Massachusetts, United States
Data is the life blood of Cogo Labs and impacts nearly all decision making within the company. Cogo Lab’s data team is seeking an experienced MySQL DBA to aid in the improvement, maintenance, and scaling of Cogo's relational database systems. This is an opportunity to have a significant impact on a critical part of the business, innovate with the latest tools in the database space, and work on a small team of experienced engineers.

What you'll do:

Aid in the maintenance and improvement of Cogo's relational database infrastructure. This work will emphasize improving and iterating on our high availability strategies, enhancing our backup procedures, and exploring geographically diverse deployments.
Instill process and procedure that allow Cogo's database infrastructure to scale as more incubating companies are created.
Help incubating companies plan their schemas and table layouts, and debug or optimize problematic SQL.
Participate in an on-call rotation to ensure that any outages are limited in scope and duration.
Experience and skills required:

Four years experience administering MySQL (or MySQL drop-in equivalent).
Expertise on replication strategies (multi-master, semi-synchronous, asynchronous), failover and high availability, backup strategies, and upgrade procedures.
Comfortability with bare-metal environments. Expertise with Linux (CentOS) including tools like Linux software RAID (mdadm) and LVM.
Experience with cloud database deployments on services like AWS RDS or Google's Cloud SQL.
Python 2/3 scripting experience.
Strong experience profiling and optimizing SQL statements. Ability to tune databases for optimization under specific workloads.
Experience with Percona distribution of MySQL including XtraDB.
Nice-to-haves:

Experience with PostgreSQL administration.
Experience with big-data frameworks and tools like Apache Spark, Apache Hive, and Presto.
Experience with workflow orchestration tools like Apache Airflow.
Experience with container orchestration tools like Kubernetes.
About Cogo Labs:

We’re a long-running, successful startup incubator, with a strong startup culture and none of the startup anxiety! Our work is challenging and dynamic, but our environment is fun and supportive.
We employ data-driven, analytical methodologies to build profitable large-scale consumer internet startups.
We offer competitive salaries and benefits, along with substantive participation in the success of the companies we incubate.
We are a diverse group with passions and interesting hobbies outside of work: musicians, athletes, filmmakers, gamers, authors, beer brewers, and whatever you are!"
