,Title,Location,City,State,Zip,Country,Qualifications,Skills,Responsibilities,Education,Requirement,FullDescriptions
34,SharePoint Administrator,"Cambridge, MA",Cambridge,MA,None Found,None Found,None Found,"
Ability to quickly configure, reconfigure all types of SharePoint build scripts.
Windows Server 2008 R2 (Administrator)
Windows Server 2012/2012 R2/2016
SQL Server 2008/2012/2014/2017 Enterprise
SharePoint PowerShell Management Scripting
Experience with at least one 3rd party SharePoint Administrative Tool
IIS 7/7.5","
Maintain multiple SharePoint Farms; both single and multi-server configurations on premise, in the cloud and hybrid solutions.
Configure and maintain Development, Quality Assurance and Production platforms.
Configure, secure and maintain the following SharePoint Service Applications
Business Connectivity Services
Secure Store Service
Search Service
User Profile Service
SQL Server Reporting Services (nice to have)
Governance Software
Web Parts
Review, troubleshoot SharePoint issues, perform root cause analysis and recommend/implement corrective action. This includes the review of system level and application level logging.
Configure, maintain, troubleshoot and debug issues related to integrating Microsoft SQL Server Reporting Services.
Collaborate with System Administrators and Network Engineers to ensure SharePoint Connectivity across multiple organizational domains.
Collaborate with Database Administrators and Architect/Developers for maintenance of existing systems and development of new systems.
Provide guidance on Security Best Practices and their implementation.
Assist and collaborate with SP Architects, Developers, Stakeholders and Power Users to design, test and implement a sustainable SP Governance plan.
Insure adherence w/ in-house Development Standards and Topology.
Maintain Branding Standards and Best Practices.
Create, maintain and execute PowerShell scripts for SharePoint maintenance.
Create and maintain Operational, System, Procedure and Archival documents relating to SOP’s, Critical Issues, Builds and Configurations.
Support Nintex Forms and workflows.","Bachelor’s Degree preferred.
MCSE: SharePoint Certification a plus",None Found,"ActioNet has an immediate opportunity for a SharePoint Administrator located in Cambridge, MA. ActioNet is an IT service provider and solutions integrator headquartered in Vienna, VA that works with the Federal Government and Department of Defense.
Position Description
Responsibilities
Maintain multiple SharePoint Farms; both single and multi-server configurations on premise, in the cloud and hybrid solutions.
Configure and maintain Development, Quality Assurance and Production platforms.
Configure, secure and maintain the following SharePoint Service Applications
Business Connectivity Services
Secure Store Service
Search Service
User Profile Service
SQL Server Reporting Services (nice to have)
Governance Software
Web Parts
Review, troubleshoot SharePoint issues, perform root cause analysis and recommend/implement corrective action. This includes the review of system level and application level logging.
Configure, maintain, troubleshoot and debug issues related to integrating Microsoft SQL Server Reporting Services.
Collaborate with System Administrators and Network Engineers to ensure SharePoint Connectivity across multiple organizational domains.
Collaborate with Database Administrators and Architect/Developers for maintenance of existing systems and development of new systems.
Provide guidance on Security Best Practices and their implementation.
Assist and collaborate with SP Architects, Developers, Stakeholders and Power Users to design, test and implement a sustainable SP Governance plan.
Insure adherence w/ in-house Development Standards and Topology.
Maintain Branding Standards and Best Practices.
Create, maintain and execute PowerShell scripts for SharePoint maintenance.
Create and maintain Operational, System, Procedure and Archival documents relating to SOP’s, Critical Issues, Builds and Configurations.
Support Nintex Forms and workflows.
Skills Required
SharePoint 2010 & 2016 Standard and Enterprise
Ability to quickly configure, reconfigure all types of SharePoint build scripts.
Windows Server 2008 R2 (Administrator)
Windows Server 2012/2012 R2/2016
SQL Server 2008/2012/2014/2017 Enterprise
SharePoint PowerShell Management Scripting
Experience with at least one 3rd party SharePoint Administrative Tool
IIS 7/7.5
Skills Preferred
SharePoint Online O365
Prior SharePoint migration/upgrade experience
Microsoft Identity Manager (MIM)
A willingness to support legacy systems and the skills to transition content onto newer, Microsoft supportable platforms.
IIS 8/8.5
Visual Studio 2015 (Architect/Developer)
SPDocKit
Education / Certifications
Bachelor’s Degree preferred.
MCSE: SharePoint Certification a plus
Miscellaneous
Ability to obtain a Public Trust security clearance.
ActioNet is an equal opportunity employer and value diversity at our company. We do not discriminate on the basis of race, religion, color, national origin, gender, sexual orientation, age, marital status, veteran status, or disability status."
35,Database Engineer,"Wellesley, MA",Wellesley,MA,None Found,None Found,None Found,"At least eight years of database & software development experience
Advanced understanding of data modeling, index analysis & optimization in MongoDB
Advanced understanding of MongoDB replication, sharding, and performance tuning
Experience designing and improving aggregate pipelines
Experience optimizing WiredTiger settings
Experience programming with Node.js, JavaScript, Python or similar
Experience working in an Agile/Scrum development process
Working experience with source code version control (Git)
Proven ability to learn and adapt to change quickly and easily
Experience with healthcare information technology a plus but not required
B.S. or M.S. Computer Science or related field or equivalent experience a plus but not required",None Found,None Found,None Found,"Job Summary: As a Database Engineer specializing in MongoDB you will be a member of a small, driven and growing team focused on developing new features and platform capabilities for the growth of our RESTful API and web-based applications. You’ll work on new features supporting our SaaS offering, and will lead the design and development of new database capabilities to support the scale we need to achieve with current and prospective customers. You’ll be empowered and encouraged to bring forth new ideas that further empower the product and the team while showcasing your passion for emerging database technologies and best practices.
Our Tech Stack:
MongoDB
Node.js
Redis
Elasticsearch
AWS
Essential Functions:
Architect and implement solutions to solve database and application problems that involve database performance, scalability, and data security
Collaborate with product development team to ensure new features are architected and implemented such that MongoDB best practices are adopted and reinforced
Develop automation for deployment activities related to database changes, and collaborate with Dev Ops team on capacity planning, disk space management, redundancy/HA, and overall database operations
Oversee essential database administration – install, configure, upgrade, back up, and monitor MongoDB databases
Debug issues brought forth by the product team
Key Attributes for Success:
Passion for software development and problem-solving
Constantly seek to evolve and improve current processes
Highly motivated
Positive attitude
Excellent and effective communication skills, both written and verbal
Knowledge or Skills:
At least eight years of database & software development experience
Advanced understanding of data modeling, index analysis & optimization in MongoDB
Advanced understanding of MongoDB replication, sharding, and performance tuning
Experience designing and improving aggregate pipelines
Experience optimizing WiredTiger settings
Experience programming with Node.js, JavaScript, Python or similar
Experience working in an Agile/Scrum development process
Working experience with source code version control (Git)
Proven ability to learn and adapt to change quickly and easily
Experience with healthcare information technology a plus but not required
B.S. or M.S. Computer Science or related field or equivalent experience a plus but not required"
36,Systems Administrator,"Boston, MA",Boston,MA,None Found,None Found,"
Bachelor’s degree required.
A minimum of 1-3 years of progressively responsible Accounting or administering accounting and finance systems.
Strong knowledge of accounting concepts.
A working knowledge of SAP’s Crystal Reports XI, Oracle JD Edwards EnterpriseOne.preferred
Possess an understanding or willingness to learn relational database concepts, database architecture & data access tools.
Proven ability to provide telephone-based and in-person support for troubleshooting and resolving technical issues. Excellent verbal and written communications skills. Proven ability to interact with all levels of employees.
Demonstrated commitment to and proficiency in customer service culture. Exhibits and champions excellence in work habits and a willingness to embrace change.
Demonstrated ability to work proactively, independently, and as part of a team is essential.
Be detail-oriented and methodical in solving problems and managing multiple projects.
Possess an aptitude toward learning technical concepts. Be results-oriented and a quick learner in supporting new products and technologies.
Strong working knowledge of Microsoft Excel and the suite of Microsoft Office products.
Be able to travel and to work flexible schedules outside normal business hours when required.",None Found,None Found,None Found,"
Bachelor’s degree required.
A minimum of 1-3 years of progressively responsible Accounting or administering accounting and finance systems.
Strong knowledge of accounting concepts.
A working knowledge of SAP’s Crystal Reports XI, Oracle JD Edwards EnterpriseOne.preferred
Possess an understanding or willingness to learn relational database concepts, database architecture & data access tools.
Proven ability to provide telephone-based and in-person support for troubleshooting and resolving technical issues. Excellent verbal and written communications skills. Proven ability to interact with all levels of employees.
Demonstrated commitment to and proficiency in customer service culture. Exhibits and champions excellence in work habits and a willingness to embrace change.
Demonstrated ability to work proactively, independently, and as part of a team is essential.
Be detail-oriented and methodical in solving problems and managing multiple projects.
Possess an aptitude toward learning technical concepts. Be results-oriented and a quick learner in supporting new products and technologies.
Strong working knowledge of Microsoft Excel and the suite of Microsoft Office products.
Be able to travel and to work flexible schedules outside normal business hours when required.","Job Description
Systems Administrator

Primary Purpose of Position:
This position provides day-to-day administration of Oracle’s JD Edwards EnterpriseOne, Business Object’s Crystal Enterprise, Corporate Budgeting Tools and other related third party applications. Maintain security and systems controls. Perform analysis, application development and implementation support on new initiatives.

Essential Functions:

Maintenance and Support – JD Edwards EnterpriseOne & Related Third Party Applications
Respond to daily user inquiries. Troubleshoot and resolve problems. Escalate issues to outside vendors & contractors if necessary. Act as primary liaison with vendors and/or internal resources to ensure appropriate technical and product-level support.
In close collaboration with Accounting Department, responsible for on-boarding/off-boarding users, setting up Business Units and maintenance of the overall Chart of Accounts in JD Edwards software.
Support the Applications Group on numerous project initiatives at the company.
Support Users of BXP’s Contract Management and E-Signature Solutions
Support our Accounting Operations Department on Nexus Systems A/P Solutions platform.
Support and on-board/off-board Property Management Groups on Contract Logix Software
Security, Integrity Reports & System Controls
Maintain user and group profiles. Audit security profiles.
Review and assemble weekly integrity reports. Troubleshoot and resolve integrity issues.
Monitor incidents and/or changes related to security, system objects and integrity reports.

Application Development
Test new applications, configurations or enhancements. Coordinate beta testing.
Develop reports. Assist others in the use of reporting tools.
Follow guidelines and controls in promoting new packages and versions.
Integrate & support third party applications and tools.

Reporting Services
Manage and administer reporting services in Crystal Enterprise.
Implement controls and security strategies to safeguard corporate data. Develop operating procedures and routines for monitoring usage and ensuring the integrity of reports.
Coordinate and chair monthly reporting change mgt meetings

Implementation & Training
Perform training of new applications. Prepare supporting documentation and training materials.
Perform quality control to ensure new applications are properly transitioned into production.
Internal Operations
Conduct research on new technologies, products or solutions.
Maintain documentation in accordance with policies and control requirements.
Conduct both one-on-one instruction and group training sessions.

Non-Essential Functions:
Special projects as assigned.

Requirements and Qualifications:
Bachelor’s degree required.
A minimum of 1-3 years of progressively responsible Accounting or administering accounting and finance systems.
Strong knowledge of accounting concepts.
A working knowledge of SAP’s Crystal Reports XI, Oracle JD Edwards EnterpriseOne.preferred
Possess an understanding or willingness to learn relational database concepts, database architecture & data access tools.
Proven ability to provide telephone-based and in-person support for troubleshooting and resolving technical issues. Excellent verbal and written communications skills. Proven ability to interact with all levels of employees.
Demonstrated commitment to and proficiency in customer service culture. Exhibits and champions excellence in work habits and a willingness to embrace change.
Demonstrated ability to work proactively, independently, and as part of a team is essential.
Be detail-oriented and methodical in solving problems and managing multiple projects.
Possess an aptitude toward learning technical concepts. Be results-oriented and a quick learner in supporting new products and technologies.
Strong working knowledge of Microsoft Excel and the suite of Microsoft Office products.
Be able to travel and to work flexible schedules outside normal business hours when required.

Physical Requirements:
Involves work of a general office nature usually performed sitting such as operation of a computer.
Involves work of a general office nature usually performed standing such as operation of a fax and printer.
Involves movement between departments to facilitate work.

Internal and External Contacts:
This position regularly interacts in both verbal and written form with employees, vendors and contractors of Boston Properties.

Reporting Structure:
This position reports to the Applications Director who provides supervision and guidance, and coordinates, evaluates, and monitors work performance on a periodic basis."
37,DBA/Database Administrator,"Waltham, MA",Waltham,MA,None Found,None Found,"
BS in technology related field, or equivalent combination of education and experience required for a specific job level",None Found,"
Administer, maintain and enhance the existing databases, exports, and reports
Create, review, optimize TSQL Queries and perform analysis on them
Develop vendor and client exports that meet provided specifications
Perform quality checks on reports and exports to ensure exceptional quality
Monitor job and transfer queues to ensure they are functioning as expected
Provide business users the data required for metrics and analysis
Create and maintain documentation for all projects
Take ownership of projects and drive them to completion on schedule
Resolve any production issues assigned in a timely manner
All other responsibilities as assigned
Will occasionally be required to work outside of usual business hours to support releases without impeding access to services during usual business hours, or to support production systems as needed
Periodically serves as ""DBA on call"" ready to respond to an off hours production problem. Develop, enhance, review SSIS packages to meet business needs",None Found,None Found,"Overview
SUMMARY:
Alegeus is the market leader in consumer directed healthcare solutions, offering the industry’s most comprehensive platform for the administration of healthcare benefit accounts, the industry’s most widely-used benefit debit card, and powerful engagement solutions to help consumers maximize savings and optimize spending for their healthcare. Over 300 clients – including health insurance plans, third party administrators and financial institutions – leverage Alegeus’ deep expertise and proven technology to administer benefit accounts for more than 29 million members and process more than $8.9 billion in consumer healthcare payments annually. As the healthcare and benefit markets continue to evolve, Alegeus delivers solutions that enable clients to evolve their service offerings, operate their businesses more efficiently, and focus on their customers.

Alegeus is part of the Vista Equity Partners portfolio of companies, working in partnership with the market-leading technology investment firm to reinvent the consumer directed healthcare marketplace. Our talented associates benefit from this partnership through increased capital for strategic investments, access to exceptional toolkits, best practices and resources for success, and strong cultural and value alignment focused on talent development and growth.

POSITION SUMMARY:
The DBA / Database Developer will be responsible for administering Microsoft SQL Server databases, developing and optimizing applications and integrations using the Microsoft SQL Server platform. This will include imports, vendor exports, data warehousing tasks, reports, and other data related tasks. This position requires excellent communication, technical and project management skills.
Responsibilities
MAJOR RESPONSIBILITIES:
Administer, maintain and enhance the existing databases, exports, and reports
Create, review, optimize TSQL Queries and perform analysis on them
Develop vendor and client exports that meet provided specifications
Perform quality checks on reports and exports to ensure exceptional quality
Monitor job and transfer queues to ensure they are functioning as expected
Provide business users the data required for metrics and analysis
Create and maintain documentation for all projects
Take ownership of projects and drive them to completion on schedule
Resolve any production issues assigned in a timely manner
All other responsibilities as assigned
Will occasionally be required to work outside of usual business hours to support releases without impeding access to services during usual business hours, or to support production systems as needed
Periodically serves as ""DBA on call"" ready to respond to an off hours production problem. Develop, enhance, review SSIS packages to meet business needs
Qualifications
EDUCATION/EXPERIENCE
BS in technology related field, or equivalent combination of education and experience required for a specific job level
REQUIRED SKILLS/KNOWLEDGE
Excellent DBA skills
Expert with T-SQL code and analysis.
Expert with SQL Server 2016/2014/2012 server side administration and development
Expert with T-SQL Stored Procedures and Triggers
Excellent troubleshooting and TSQL optimization skills
Ability to analyze existing code, quickly understand its complexities, and take that code forward
Strong desire to develop and innovate new technology
Must be self-motivated, independent, detail oriented, responsible, strong on team collaboration, exhibit exceptional relationship management skills, and strive for excellence
Must work well in a structured change control and billing environment
Ability to manage an application through the entire development life cycle and to manage and account for time effectively
Ability to adapt quickly to an existing, complex environment, as well as new concepts and software
Passionate about building high-quality systems with software implementation best practices
Excellent written, verbal, and analytical skills
Comfort working with resources across disciplines in a production environment and at all client levels
Strong knowledge of version control systems, with a preference for TFS
Strong knowledge of testing strategies at the unit and application levels
6+ years as a DBA / database developer
OPTIONAL/ADDITIONAL SKILLS
Experience with Big Data is a plus
Experience with EDI standards a plus
Experience with EFT
The above cited duties and responsibilities describe the general nature and level of work performed by an incumbent assigned to the job. They are not intended to be an exhaustive list of all the duties and responsibilities that an incumbent may be expected or asked to perform.
Standards and processes a plus
.NET development experience is a plus
Familiarity with healthcare and related terminology including HIPAA procedures and standards a plus"
