,Title,Location,City,State,Zip,Country,Qualifications,Skills,Responsibilities,Education,Requirement,FullDescriptions
53,Software Developer,"Westminster, CO",Westminster,CO,None Found,None Found,None Found,None Found,None Found,None Found,None Found,"Title: Software Engineer
Location: Westminster, CO
Department: Trimble Cloud
Reports To: Engineering Manager

About Us:
The Trimble Cloud Platform team builds core platform services such as data storage, authentication, authorization, and data processing that are used by Trimble and Trimble partners in the Buildings, Construction, Transportation, Agriculture, and Geospatial industries. Our cloud services allow Trimble businesses to efficiently build applications and connect content throughout its lifecycle.

We are seeking a self-motivated and enthusiastic Software Engineer to join the Trimble Cloud platform team. You will be contributing to the evolution, architecture design, implementation and maintenance of the Data lake for Trimble. Trimble Data lake is mission-critical for Trimble’s cloud strategy and will serve hundreds of thousands of users. You will also work on utilizing this Trimble wide data to apply machine learning models and derive insights once integrated across applications.

As a member of the platform team, you will use a variety of technologies and have the opportunity to explore and use new and emerging technologies. We are looking for intelligent, organized, driven, and effective developers.

Required Skills and Experience


Bachelor Degree in Computer Science
Demonstrably strong Python skills
Object-oriented programming such as C# a plus
Experience with SQL, NoSQL database
Experience with WebServices, REST API development
A wide degree of creativity and latitude is expected
Provide on-call support as required

Desirable Skills and Experience


Expertise with Python web development (Flask)
Demonstrable proficiency with a wide variety of Amazon Web Services (AWS) such as S3, EC2,and IAM
Familiarity and experience with architectural design
Serverless technology experience a plus
Experience with scalability, security and performance engineering for web services a huge plus
Ability to work in a team environment, work with and motivate others

Company Info:
Trimble is transforming the way the world works by delivering products and services that connect the physical and digital worlds. Core technologies in positioning, modeling, connectivity and data analytics enable customers to improve productivity, quality, safety, and sustainability. From purpose-built products to enterprise lifecycle solutions, Trimble software, hardware, and services are transforming a broad range of industries such as agriculture, construction, geospatial and transportation, and logistics. For more information about Trimble (NASDAQ: TRMB), visit www.trimble.com

Trimble is proud to be an Equal Opportunity and Affirmative Action Employer and considers qualified applicants for employment without regard to race, gender, age, color, religion, national origin, marital status, disability, sexual orientation, status as a covered veteran in accordance with applicable federal, state and local laws, or any other protected factor. EOE/M/F/V/D

#engineering"
54,Software Engineer,"Lakewood, CO",Lakewood,CO,None Found,None Found,"Bachelor's degree in Computer Science, Engineering or technical degree
Minimum of 2 years' experience using .NET Framework and C#
Multi-threading
Experience with object-oriented development
A passion for writing great software
Exceptional troubleshooting abilities
","Bachelor's degree in Computer Science, Engineering or technical degree
Minimum of 2 years' experience using .NET Framework and C#
Multi-threading
Experience with object-oriented development
A passion for writing great software
Exceptional troubleshooting abilities
",None Found,None Found,None Found,"(Colorado)
We are hiring motivated and intelligent Software Engineers to help develop our next generation products.

This is a challenging, rewarding, and fun job for people that want to learn new technologies and play a major role at a small, very successful company.
Primary Duties:
Design and develop software to simulate and control tube bending machines
Interface with industrial devices including servo motors and robots
Assist with testing and deployment of new software releases
Support legacy code
Help technical support team resolve customer issues
Required Qualifications/Skills:
Bachelor's degree in Computer Science, Engineering or technical degree
Minimum of 2 years' experience using .NET Framework and C#
Multi-threading
Experience with object-oriented development
A passion for writing great software
Exceptional troubleshooting abilities
Helpful Qualifications/Skills:
Artificial Intelligence
3D simulation
User Interface design
Beckhoff TwinCAT software and EtherCAT based hardware
Real Time machine control
Mobile / iOS development
IoT experience

Entry level will be considered if you have the talent.

The successful applicants must be able to work in our Lakewood, Colorado office.

Qualified candidates should email their resume to: job1@currenttech.com"
55,Staff Software Engineer,"Littleton, CO 80125",Littleton,CO,80125,None Found,Previous C++ or Python experienceStrong problem solving and troubleshooting skillsExcellent team orientation,"Previous real-time and embedded software development experienceAgile processesFull development life cycle experienceAbility to perform software integration and test developmentAbility to work with multiple programming languages, operating systems, and development environments.Understanding of missile or satellite software systemsUnderstanding of Human Space Flight",None Found,None Found,None Found,"At the dawn of a new space age, Lockheed Martin is a pioneer, partner, innovator and builder. Our amazing men and women are on a mission to make a difference in the world and every single day we use our unique skills and experiences to craft, design and build solutions to some of the worlds’ hardest engineering problems. Do you want join a culture that inspires employees to think creatively, exceed their own expectations and build incredible products? We provide the resources, support and focus - if you have the passion and courage to dream big, then we want to build a better tomorrow with you.

Do you have a passion to get humans back to the moon and eventually to Mars? NASA has developed a vision for exploration that includes the development of a Human Lander System and a Gateway Habitat in the next 5 years. The nation received a White House mandate to place humans back on the surface of the Moon by 2024. Lockheed Martin Space is onboard to be part of this historic event and is looking to build a core team of highly-motivated engineers excited to be working in a fast-paced, dynamic environment. This is a rare opportunity for you to help NASA meet the challenges of the first step in achieving that “long-term presence at the Moon” and the stepping point for human missions to Mars.

To promote the sharing of ideas, Lockheed Martin fosters an inclusive work environment that supports big picture thinking. Our employees play an active role in strengthening the quality of life where we live and work by volunteering more than 850,000 hours annually. Here are some of the benefits you can enjoy:

Typically has 9-15 years of professional experience.

Medical
Dental
401k
Paid time off
Work/life balance
Career development

Join us at Lockheed Martin, where your mission is ours. Our customers pursue the hardest missions. Those that demand extraordinary amounts of courage, resilience and precision. They’re dangerous. Critical. Sometimes they even provide an opportunity to change the world and save lives. Those are the missions we care about.

Learn more about Lockheed Martin’s competitive and comprehensive benefits package.
Basic Qualifications:
Previous C++ or Python experienceStrong problem solving and troubleshooting skillsExcellent team orientation
Desired Skills:
Previous real-time and embedded software development experienceAgile processesFull development life cycle experienceAbility to perform software integration and test developmentAbility to work with multiple programming languages, operating systems, and development environments.Understanding of missile or satellite software systemsUnderstanding of Human Space Flight
BASIC QUALIFICATIONS:
job.Qualifications

Lockheed Martin is an Equal Opportunity/Affirmative Action Employer. All qualified applicants will receive consideration for employment without regard to race, color, religion, sex, pregnancy, sexual orientation, gender identity, national origin, age, protected veteran status, or disability status.
Join us at Lockheed Martin, where your mission is ours. Our customers tackle the hardest missions. Those that demand extraordinary amounts of courage, resilience and precision. They’re dangerous. Critical. Sometimes they even provide an opportunity to change the world and save lives. Those are the missions we care about.

As a leading technology innovation company, Lockheed Martin’s vast team works with partners around the world to bring proven performance to our customers’ toughest challenges. Lockheed Martin has employees based in many states throughout the U.S., and Internationally, with business locations in many nations and territories.
EXPERIENCE LEVEL:
Experienced Professional"
56,Software Engineer,"Denver, CO",Denver,CO,None Found,None Found,None Found,None Found,None Found,None Found,"2+ years of full-time engineering experience
Expertise in one or more object oriented programming language (e.g. Python, Go, Java, C++)
Experience with mobile apps development using iOS and/or Android, mobile SDKs
Strong analytical, verbal and written communication skills
BS/MS in Computer Science or a related major, or equivalent experience
Bonus: Fluency with one or more modern neural network frameworks such as Tensorflow, Keras, or Torch
","As a software engineer, you will join as a core member of a seasoned 6-person team. We’ve built numerous start-ups as founders, early team, and investors…from conception all the way to numerous exits and IPOs. We're also backed by top flight Silicon Valley VCs and angels. You’ll be part of a cross-functional team that’s responsible for the full software development life cycle, from conception to deployment.

At Exer, you’ll have the opportunity to use cutting edge AI and computer vision to impact millions of people’s lives for the better. How? By helping them move, play, and train better using our mobile apps and eventually in physical spaces as well. We have big ambitions to democratize fitness / wellness so that it can be a luxury that everyone in the world has access to on their phones. Our motion coaching platform is just the first step in a bigger plan.

Role:
Develop new products and features, improve existing products and features
Become a next level expert in mobile app development
Expand your development experience across the stack and to other platforms like TensorFlow
Contribute in the product process: thinking through UX, designing beautiful UI, and working with consumers to solve their problems
Help estimate, plan and execute on projects, features, and integrations
Technologies we use: Python, Swift, Kotlin, Java, Go, Tensorflow, Tensorflow Lite, Torch, Keras, CoreML, OpenCV, Metal
Requirements
Sound Like You?:
2+ years of full-time engineering experience
Expertise in one or more object oriented programming language (e.g. Python, Go, Java, C++)
Experience with mobile apps development using iOS and/or Android, mobile SDKs
Strong analytical, verbal and written communication skills
BS/MS in Computer Science or a related major, or equivalent experience
Bonus: Fluency with one or more modern neural network frameworks such as Tensorflow, Keras, or Torch
Benefits
Our Benefits:
Meals: Lunch and dinner on us at the office.
Gym and studio memberships: We’re an active group that likes to get up and move. Some of us are just starting out, some of us are pro level athletes, but regardless of ability we believe that movement is important to everyone’s well-being. We’ll pay for your gym or studio membership and also offer lots of other fun opportunities to test different things out. It’s research!
Open Vacation Policy: We celebrate all the usual holidays and support people taking time for themselves when they need it. We’re not super big into counting vacation days as long as people get their stuff done, so we did away with them and you can take the time you need when you need it.
Paid Parental Leave: Family and self-first is one of our core values, so we offer fully paid time off for 12 weeks.
Medical, Dental, and Vision Insurance: We offer comprehensive health care for employees, with 100% of premiums paid by Exer.
Exer is an equal opportunity employer: we value diversity. We do not discriminate on the basis of race, religion, color, national origin, gender, sexual orientation, age, marital status, veteran status, or disability status."
57,Embedded Software Engineer,"Denver, CO 80225",Denver,CO,80225,None Found,"
Bachelor’s Degree in Electrical Engineering or Computer Science and a minimum of three years of experience or an equivalent combination of skills, education, and experience
Experience in software engineering related to embedded systems and/or firmware development
Experience with object oriented programming
Experience working with embedded software that controls hardware (e.g. device drivers, microcontrollers MSP, ARM, PIC)
Experience with the software engineering process from requirements reviews, code inspection to component delivery and sign-off
Development experience on multiple hardware platforms utilizing either Linux or Unix-based operating systems
Experience with build and run systems, make files, and scripting languages also applied use of development tools (e.g. editors and compliers)",None Found,None Found,None Found,None Found,"Job Description
Do you have a passion for innovation? So do we! At LGS our people are our greatest asset – we make sure your voice is heard and give you the resources to invent solutions to some of the most difficult challenges facing our customers. Our entrepreneurial environment fosters your best ideas and allows you to build your career to fit your creativity. Sound interesting? We’re always looking for the best and brightest to join our ranks and share the fun.
In this position you will work under general direction, perform research, design and software development in various aspects of IP/telecommunication systems on multiple hardware platforms utilizing Window, Linux and/or Unix-based operating systems.
Minimum Qualifications:
Bachelor’s Degree in Electrical Engineering or Computer Science and a minimum of three years of experience or an equivalent combination of skills, education, and experience
Experience in software engineering related to embedded systems and/or firmware development
Experience with object oriented programming
Experience working with embedded software that controls hardware (e.g. device drivers, microcontrollers MSP, ARM, PIC)
Experience with the software engineering process from requirements reviews, code inspection to component delivery and sign-off
Development experience on multiple hardware platforms utilizing either Linux or Unix-based operating systems
Experience with build and run systems, make files, and scripting languages also applied use of development tools (e.g. editors and compliers)
Preferred Qualifications:
Experience with hardware development and the integration between hardware and firmware systemsFamiliarity with protocol stack development, including wireless cellular protocol stacks (e.g., GSM, CDMA, UMTS, LTE)Familiar with RF equipment and principlesGood oral and written communication skillsAbility to work under limited supervision and flexibility to adapt to changeGood teamwork skillsDemonstrated confidence debugging system-level issues with various lab equipment
A Secret clearance is required to begin employment. For this position, CACI has the ability to provide clearance sponsorship for qualified individuals.
What We Can Offer You:

We’ve been named a Best Place to Work by the Washington Post.
Our employees value the flexibility at CACI that allows them to balance quality work and their personal lives.
We offer competitive benefits and learning and development opportunities.
We are mission-oriented and ever vigilant in aligning our solutions with the nation’s highest priorities.
For over 55 years, the principles of CACI’s unique, character-based culture have been the driving force behind our success.
Job Location
US-Denver-CO-DENVER


CACI employs a diverse range of talent to create an environment that fuels innovation and fosters continuous improvement and success. At CACI, you will have the opportunity to make an immediate impact by providing information solutions and services in support of national security missions and government transformation for Intelligence, Defense, and Federal Civilian customers. CACI is proud to provide dynamic careers for employees worldwide. CACI is an Equal Opportunity Employer - Females/Minorities/Protected Veterans/Individuals with Disabilities."
58,"Professional, Software Engineer","Boulder, CO 80301",Boulder,CO,80301,None Found,"BS Degree or equivalent work experience in a software engineering discipline
Typically has 3-6 years experience in an applicable software development environment
Proficient/competent to work on most phases of development within assigned technical discipline
Driven to excel in areas of technical expertise.
Willing to assist team members in areas of: manual testing, test automation, build improvements.
Customer oriented: meets individual commitments, works with the team to achieve team commitments, responds to requests in a timely manner, willing to help.
Ability to focus on and solve problems, with a willingness to ask for help when needed.
",None Found,None Found,None Found,None Found,"Job Summary
Join the team that powers the global real estate economy - CoreLogic is an innovative, future focused company whose vision is to deliver unique property-level insights that power the global real estate economy.
We are a $1.95 billion in sales company with more than 6,000 employees globally serving the financial services and insurance industries. We are evolving at a rapid pace and the clients we serve are challenged from every direction, which means we are growing and innovating to help drive their success. Working together, and differentiated by our superior data, analytics and data-enabled solutions, we empower our clients to make smarter business decisions through data-driven insights. We take initiative, are fully accountable, build respect and trust, make transparency a must—and engage, include and collaborate at every turn.
We take pride in our work and believe in cultivating a work environment that supports and values our greatest asset: our talented employees.
Job Description:
Design, code, test and debug moderately complex software while developing new, and enhancing existing functionality in order to satisfy customer requirements, both internal and external. Works from specifications, or comfortable in an iterative and incremental development environment. May develop detailed specifications from which applications will be written, designed, coded, tested and debugged.
Actively contribute to, participate in, and aim to continuously improve all levels of testing efforts. Defines scope and develop testing methods, collaborating with QA team and other developers. Provides a broad perspective on quality initiatives, offering guidance to team members.
Support, maintain and document software functionality. Act as a resource for less experienced engineers. Makes recommendations on engineering processes and methods.
Provide second level operational support to diagnose and resolve incidents in production systems. Has direct interaction and consultative role with operations team. Able to resolve most issues, but will escalate complex issues to more senior team members as necessary.
Actively participate in general knowledge/technology transfer throughout the team/department. This includes documenting larger scope and moderately complex assignments for knowledge transfer and developing expertise in specific areas. Presents information and mentors other team members on area(s) of expertise. Provide technical assistance on assigned module/project.
Partner with product owners/business partners to define requirements and software design. Participate in discussions, influence outcomes, and make recommendations on feasibility and processes.
Job Qualifications:
BS Degree or equivalent work experience in a software engineering discipline
Typically has 3-6 years experience in an applicable software development environment
Proficient/competent to work on most phases of development within assigned technical discipline
Driven to excel in areas of technical expertise.
Willing to assist team members in areas of: manual testing, test automation, build improvements.
Customer oriented: meets individual commitments, works with the team to achieve team commitments, responds to requests in a timely manner, willing to help.
Ability to focus on and solve problems, with a willingness to ask for help when needed.
CoreLogic offers an empowered work environment that encourages creativity, initiative and professional growth and provides a competitive salary and benefits package. CoreLogic is an Equal Opportunity/Affirmative Action employer committed to attracting and retaining the best-qualified people available, without regard to race, color, religion, national origin, gender, sexual orientation, gender identity, age, disability or status as a veteran of the Armed Forces, or any other basis protected by federal, state or local law. CoreLogic maintains a Drug-Free Workplace. We are fully committed to employing a diverse workforce and creating an inclusive work environment that embraces everyone’s unique contributions, experiences and values. Please apply on our website for consideration."
59,Software Engineer I- Embedded,"Englewood, CO 80110",Englewood,CO,80110,None Found,None Found,"Bachelor's degree from a four-year college or university in a related field
At least 6 months of experience developing with C and or C++
","
Hands-on in the creation, design & testing of exciting new features
Accomplish tasks, define milestones, create schedules and estimated development resources for projects
Work within a development team using change control and source code management systems
Work in a dynamic development environment and be responsible for delivering reliable software components
",None Found,"Bachelor's degree from a four-year college or university in a related field
At least 6 months of experience developing with C and or C++
","Summary
DISH is a Fortune 250 company with more than $13 billion in annual revenue that continues to redefine the communications industry. Our legacy is innovation and a willingness to challenge the status quo, including reinventing ourselves. We disrupted the pay-TV industry in the mid-90s with the launch of the DISH satellite TV service, taking on some of the largest U.S. corporations in the process, and grew to be the fourth-largest pay-TV provider. We are doing it again with the first live, internet-delivered TV service – Sling TV – that bucks traditional pay-TV norms and gives consumers a truly new way to access and watch television.

Now we have our sights set on upending the wireless industry and unseating the entrenched incumbent carriers.

We are driven by curiosity, pride, adventure, and a desire to win – it's in our DNA. We're looking for people with boundless energy, intelligence, and an overwhelming need to achieve to join our team as we embark on the next chapter of our story.

Opportunity is here. We are DISH.

Job Duties and Responsibilities
Dish Technologies, in Englewood CO, has an opening for a Software Engineer. This is an exciting opportunity to join a growing team with an atmosphere similar to that of a start-up where ideas are encouraged and explored daily. This software engineer will get to be hands on in the design, development and maintenance of set top box applications for satellite and internet based whole home audio/video entertainment solutions, with a special focus on video-streaming.

Primary responsibilities fall into the following categories:

Hands-on in the creation, design & testing of exciting new features
Accomplish tasks, define milestones, create schedules and estimated development resources for projects
Work within a development team using change control and source code management systems
Work in a dynamic development environment and be responsible for delivering reliable software components
Skills - Experience and Requirements
A successful Software Engineer will have the following:

Bachelor's degree from a four-year college or university in a related field
At least 6 months of experience developing with C and or C++
Preferred Qualifications:

Agile software development knowledge is a plus.
Familiarity with software Configuration Management tools such as Git
Any video streaming experience is a huge plus"
