,Title,Location,City,State,Zip,Country,Qualifications,Skills,Responsibilities,Education,Requirement,FullDescriptions
175,Software Engineer (Ada),"Centennial, CO",Centennial,CO,None Found,None Found,"
BA or BS degree in a computer / system science, engineering or math discipline from an accredited college or university.","
BA or BS degree in a computer / system science, engineering or math discipline from an accredited college or university.","
Understand system characteristics that influence choice of software architecture, code development, requirements definition and analysis, interfaces, designs and test approaches.
Follow established processes and procedures for the full software engineering lifecycle, including analysis, design, code, unit test, and integration test.
Follow all applicable safety guidelines.
Conduct themselves in an ethical manner, following all applicable company policies and customer policies.
Perform all other assigned duties.","
BA or BS degree in a computer / system science, engineering or math discipline from an accredited college or university.","
Must be a U.S. Citizen and successfully complete a U.S. government background investigation.
Applicant selected may be subject to government security investigation and must meet eligibility requirements for access to classified information.
Work may involve sitting for extended periods.
May require lifting and carrying up to 25 lb.
Must have sufficient mobility to enter areas of test facilities where necessary.
Generally an office environment, but can involve inside or outside work depending on task.
Standard office equipment (PC, telephone, fax, etc.)
Regular attendance in accordance with established work schedule is critical.
Ability to work outside normal schedule and adjust schedule to meet peak periods and surge requirements when required.
Must be able to work in a team atmosphere.
Must put forward a professional behavior that enhances productivity and promotes teamwork and cooperation.
Grooming and dress must be appropriate for the position and must not impose a safety risk/hazard to the employee or others.
This position may require some commuting and traveling to other installations as needed.","Overview
Barrios Technology Ltd. is a woman-owned and operated small business headquartered in Houston, Texas. We provide a full spectrum of engineering, operations and related technology services in support of the aerospace community and have successfully supported NASA for 38 years. Barrios Technology is the prime contractor for the Mission and Program Integration (MAPI) contract and Research, Engineering, Mission Integration Services (REMIS) contracts along with subcontractor support to multiple prime contractors as listed below. Barrios employees have the opportunity to contribute to the US Space Program through work on the International Space Station (ISS), Orion, Space Launch System and Exploration programs. Our primary locations are at NASA’s Johnson Space Center (JSC) in Houston, TX and the Marshall Space Flight Center (MSFC) in Huntsville, AL. We also support commercial space programs and provide systems engineering services to the oil and gas industry. Our customers include:

Boeing on the Boeing Engineering and Technical Services (BETS) contract at JSC and MSFC
Jacobs Technology on the JSC Engineering and Technical Services (JETS) contract at JSC
COLSA Corporation on the Huntsville Operations Support Center (HOSC) contract at MSFC
Rothe Development, Inc. on the Joint Operations, Integrated Systems Technology (JOIST) Contract at JSC
Sierra Nevada Corporation (SNC) Commercial Resupply Services 2 (CRS2) contract in Colorado and Houston
Leidos Innovations on the Cargo Mission Contract (CMC)3 at JSC
Northrop Grumman Innovation Systems (formerly Orbital ATK) on the CRS1 contract in Houston, TX and Virginia
British Petroleum (BP) in Houston, TX
Stinger Ghaffarian Technologies, Inc.(SGT) / KBRwyle on the Mission Systems Operations (MSOC) contract at JSC
Stinger Ghaffarian Technologies, Inc. (SGT)/ KBRwyle on the Integrated Mission Operations Contract II (IMOC II) contract at JSC
KBRwyle on the Fully Integrated Lifecycle Mission Support Services (FILMSS) contract at Ames Research Center
Responsibilities
** We are actively searching for qualified candidates of all skill levels for multiple computer related openings. However we do not have assurance at this time if and when the position will be finalized and opened. Because we have strong reason to believe the position will be approved soon, we are proceeding with identifying qualified candidates and conducting interviews. If you have software development experience, programming/coding experience, and know common computer languages such as C++, you are encouraged to apply and learn more about these exciting positions working in the space industry in Centennial, CO!

The Software Engineer (Ada) will:

Understand system characteristics that influence choice of software architecture, code development, requirements definition and analysis, interfaces, designs and test approaches.
Follow established processes and procedures for the full software engineering lifecycle, including analysis, design, code, unit test, and integration test.
Follow all applicable safety guidelines.
Conduct themselves in an ethical manner, following all applicable company policies and customer policies.
Perform all other assigned duties.
Qualifications
Required Education/Experience/Skills:

This position is posted at multiple levels. Depending on the candidate’s experience, position requirements and business needs, we reserve the right to consider candidates at any level for which this position has been advertised.

BA or BS degree in a computer / system science, engineering or math discipline from an accredited college or university.
 -OR-
BA or BS degree in a computer / system science, engineering or math discipline from an accredited college or university and five (5) or more years of related experience. Progressive relevant training and /or certification may be substituted for a portion of the experience requirement.
Excellent communication skills both written and verbal using the English language.
Ability to work in a team environment and independently.
Ada programming/development experience.

Preferences:
C++ programming with demonstrated ability to program in C language to design, code and test transactional and real-time software.
Experience with any of the following operations systems and tools: Ada, Visual Studio, Git, Jira, Bitbucket, Eclipse IDE.
Familiarity with MIL-STD-1553.

Essential Requirements
Must be a U.S. Citizen and successfully complete a U.S. government background investigation.
Applicant selected may be subject to government security investigation and must meet eligibility requirements for access to classified information.
Work may involve sitting for extended periods.
May require lifting and carrying up to 25 lb.
Must have sufficient mobility to enter areas of test facilities where necessary.
Generally an office environment, but can involve inside or outside work depending on task.
Standard office equipment (PC, telephone, fax, etc.)
Regular attendance in accordance with established work schedule is critical.
Ability to work outside normal schedule and adjust schedule to meet peak periods and surge requirements when required.
Must be able to work in a team atmosphere.
Must put forward a professional behavior that enhances productivity and promotes teamwork and cooperation.
Grooming and dress must be appropriate for the position and must not impose a safety risk/hazard to the employee or others.
This position may require some commuting and traveling to other installations as needed.

Don’t miss out on this great opportunity; for immediate consideration, apply now!
Must be a U.S. Citizen and successfully complete a U.S. government background investigation.
Management has the prerogative to select at any level for which this position has been advertised.

Barrios Technology is an Equal Employment Employer. All qualified applicants will receive consideration for employment without regard to race, color, religion, disability, sex, sexual orientation, gender identity or expression, age, national origin, veteran status, genetic information, union status and/or beliefs, or any other characteristic protected by federal, state, or local law."
176,"Senior Principal CDN Software Engineer, VIPER","Denver, CO 80202",Denver,CO,80202,None Found,None Found,None Found,None Found,None Found,None Found,"Comcast’s Technology. Product Xperience. organization works at the intersection of media and technology. Our innovative teams are continually developing and delivering products that transform the customer experience. From creating apps like TVGo to new features such as the Talking Guide on the X1 platform, we work every day to make a positive impact through innovation in the pursuit of building amazing products that are enjoyable, easy to use and accessible across all platforms. The team also develops and supports our evolving network architecture, including next-generation consumer systems and technologies, infrastructure and engineering, network integration and management tools, and technical standards.


We are looking for engineers to join our Content Delivery team. Do you love to build massive, distributed, and amazing systems? Are you passionate about open source software, and building systems using it? Do you like to add immediate, tangible business value?

As an engineer in the CDN team, you will help build the infrastructure and develop software to support the systems that deliver IP content for a wide range of mobile and first-screen television devices. As part of the larger Comcast engineering teams, you will help shape the next generation of IP content delivery and transform the customer experience. Using the tenets of DevOps, you will have the opportunity to own the entire stack, from architecture to production.

Who does the CDN engineer work with?
Apache Traffic Control is the Open Source CDN control plane for which we lead the development, and this project represents our primary focus. Want to learn more? Visit https://trafficcontrol.apache.org/. There you will find the documentation, source code, and every open bug. We’re a small but growing team, delivering state-of-the-art software solutions at the leading edge of CDN technology.

What are some interesting problems you’ll be working on?
We deliver petabytes of traffic and tens of billions of transactions every day. Our software and infrastructure must reliably deliver an excellent customer experience, automatically and seamlessly converge around network and system events and provide the necessary telemetry and instrumentation for operational, planning and engineering use.

Where can you make an impact?
Thinking out of the box and considering the customer experience are key to our success. We never want to impact service unless it is in a positive manner. We need additional team members to follow their passion of engineering thought leadership, coding and contributing to the delivery code at the heart of many organizations!

Responsibilities:
Provide technical leadership in a fast-paced environment
Participate in and contribute to our architectural advancement
Interact with the Open Source community with focus on Apache Traffic Control
Create design and engineering documentation
Keep current with emerging technologies in the CDN and surrounding knowledge spaces
Help ensure the system can scale in any dimension quickly and safely
Develop and improve automated validation environments
Improve system reliability and stability
Drive to ensure all changes made are positive to customer experience
Collaborate with project stakeholders to identify product and technical requirements
Conduct analysis to determine integration needs
Diagnose performance issues and propose and implement code improvements
Work with Quality Assurance team to determine if applications fit specification and technical requirements
Other duties and responsibilities as assigned.

Here are some of the specific technologies we use with the CDN team:
Linux (CentoOS)
Git
HTTP(s) including HTTP caching
SQL
DNS
TCP/UDP
BGP
IPv6
Adaptive Bitrate Video Protocols
MPEG
database technologies
PostgreSQL
InfluxDB
ClickHouse

Preferred Skills:
Experienced technical leader 4+ years of technical leadership (Leadership not Management)
Good communicator; able to analyze and clearly articulate complex issues and technologies understandably and engagingly
Great design and problem-solving skills, with a strong bias for architecting at scale
Strong troubleshooting skills, adaptable, proactive and willing to take ownership
Able to work in a fast-paced environment
Strong familiarity with industry standards, specifications, standards bodies and working groups
Advanced networking knowledge (protocols, routing, switching, hardware, optics, etc)
Advanced knowledge of current, state-of-the-art hardware systems (storage, CPU, memory, network)
Advanced knowledge of software development, including the software development lifecycle
Working to advanced knowledge of database technologies such as RDBMS, time-series and column-oriented
Deep knowledge of GNU/Linux, including kernel tuning and customization

About the CDN Team:
CDN is a passionate and high paced team within Comcast’s Technology and Product Division and is based in Denver’s LoDo district. Our technology is open-source based, and our products deliver video and other content over IP infrastructure to an array of connected devices in and out of the home.

About Viper:
VIPER (Video IP Engineering & Research), is a division within Comcast’s Core Platform Technologies team and spun out from IP Video and online projects originated within Comcast Interactive Media is based in downtown Denver, CO. We are a cloud-based, IP video infrastructure that’s been built to deliver a broad mix of on-demand video, live TV streams and an assortment of other digital media to an array of connected devices in the home.

Job Specifications:
Bachelors Degree or Equivalent
Engineering, Computer Science
Generally requires 15+ years related experience


Comcast is an EOE/Veterans/Disabled/LGBT employer"
177,Software Engineer,"Denver, CO 80205",Denver,CO,80205,None Found,None Found,None Found,None Found,None Found,None Found,"We are looking for developers with 2-5 years experience who want an engaging, challenging and rewarding experience in software engineering. Your accomplishments should reflect an in-depth personal desire to captivate end users.

You are a fit if:

You are a polyglot. Some of our best developers believe this personal definition fits what we do at Levels Beyond.
You have the potential to work on both the server side and user interface side of our development team.
You appreciate the opportunity to take ambiguous requirements, break down the problem into understandable segments and get the job done for the client.
You like doing elegant work, resolving problems and sharing ideas with your team.
You always love new technology and are willing to try new things.
You are willing to challenge what we do and can accept the current path of our product and realities of our platform: a blend of confidence and humility.
You understand that delivering software is much more than just writing code.
Skills we value:

Building Java REST APIs
Angular JS
Building UX-Centric UIs with modern JavaScript frameworks such as Angular and React
Experience working with ElasticSearch
Using SQL via stored procedures and ORMs
Developing within a Linux/Unix environment
Unit and integration testing, including the application of TDD
Experience working on a team with Agile methodologies
Full stack or strong back/front end skills with the ambition to move towards full stack
Bonus skills:

Digital multimedia experience
Experience migrating to Angular 2+
Experience with any of the following: Webpack, Gulp, Protractor, Docker, Tomcat, NGiNX, ElasticSearch, PostgreSQL, Hibernate, Spring, Swagger
Experience managing the SDLC with Jira
Github repo with code examples
Cool perks:

Located in Denver, Colorado: a Top 10 Best Places to Work in the U.S. according to Outside Magazine
PTO: Minimum 3 weeks per year; we pay you to go away and refuel
Participation in two company hack events per year to express creativity
Comprehensive medical, dental and vision care benefits
Computer: Company supplied MacBook and fun tools
Great place to work with a supportive and collaborative environment
Levels Beyond is an Equal Employment Opportunity Employer"
178,Software Engineer,"Denver, CO",Denver,CO,None Found,None Found,"
Contributes independently to multiple functional and technical areas within a product.
Designs and scopes new features.
Creates artifacts/documents that are valuable to the team
Continued ownership of technical growth including:
Product and business knowledge
Problem solving skills
Technical knowledge
Process knowledge
Acts as a good citizen within the team technically and culturally.",None Found,"
Contributes independently to multiple functional and technical areas within a product.
Designs and scopes new features.
Creates artifacts/documents that are valuable to the team
Continued ownership of technical growth including:
Product and business knowledge
Problem solving skills
Technical knowledge
Process knowledge
Acts as a good citizen within the team technically and culturally.",None Found,None Found,"Empowering The People Who Power The World
Are you interested in a career opportunity with a growing software company? P2 Energy Solutions is dedicated to providing a positive culture where the ability to learn, collaborate, and make a difference is rewarded. We have a fast-paced, innovative culture where employees are empowered to provide a superior experience for internal and external customers.
Upstream oil and gas professionals who are focused on solving tough challenges rely on P2 software, data and analytics solutions to optimize their business performance. We are currently developing our solutions on mobile and in the cloud! More than 1,600 companies from around the world use P2 solutions every day to manage their land assets, measure and process financial information, optimize production, and manage their reserves. With more than 80 years of experience in data and 30 years in software, P2 has offices around the world, and employs approximately 600 people.
Responsibilities & Qualifications
The Software Engineer will be a lead technical memeber of the develpment team for a P2 Software suite. This individual will work closely with others in the Development group to integrate code, understand the software features and usage, adhere to development standards & practices, and test the results.

Essential Duties:
Contributes independently to multiple functional and technical areas within a product.
Designs and scopes new features.
Creates artifacts/documents that are valuable to the team
Continued ownership of technical growth including:
Product and business knowledge
Problem solving skills
Technical knowledge
Process knowledge
Acts as a good citizen within the team technically and culturally.
Qualifications Include:
Recommended 4+ years of relevant experience
BA/BS required, Technical Diploma in Computer Science, MIS, or IT or a related field preferred.
Good communication skills
Initiative and ability to contribute to team goals with limited supervision
“Can do” positive attitude coupled with a strong respect for others
Consistently able to make and meet commitments
Required Experience:
JavaScript including Angular
HTML 5 and CSS 3
C# and ASP.NET Core framework
RESTful Web Services
SQL Server
Test-driven and Agile development methodology
Required Tools:
Azure DevOps
Git
Visual Studio
Belief In The P2 Way
Always be learning.
When in doubt, talk it out.
Show up and follow up.
Create positive energy.
Think beyond…

Please note: Assessment testing may be required for this position.
We offer a casual work environment, comprehensive benefits plan, generous PTO, and a competitive compensation structure. We have a positive culture designed around the philosophy of mutual respect and the challenge of contributing to the continued success of our organization. P2 is dedicated to individual and corporate growth opportunities, and we would love to talk to you further!
P2 Energy Solutions and its affiliated companies is an Equal Employment Opportunity employer. We also participate in the E-Verify program, a service of DHS and SSA."
179,"Software Engineer - Machine Learning Data and Observability, Cortex","Boulder, CO",Boulder,CO,None Found,None Found,None Found,None Found,None Found,None Found,None Found,"Who we are

Our mission in Cortex is to empower teams at Twitter to effectively practice Machine Learning (ML) within Twitter by providing both a platform and modeling expertise. If you’re interested in the platform side of this and get excited about reusable, powerful tools which increase developer efficiency, read on!

Our software in the Cortex Platform org allows ML practitioners to share features, automate workflows, train models using advanced techniques, and serve models quickly and with confidence in their operation.

Our team specifically is called Machine Learning Data and Observability, and we seek to provide visibility, awareness, and understanding of the ML lifecycle. Our efforts affect every other product in Cortex in an effort to make our users able to understand their data, data pipelines, and models.

What you’ll do

If this sounds like a team you want to be a part of, fantastic! We are looking for experienced engineers who love writing code, understanding our customers, and collaborating with teammates to ship useful software. More specifically, you will:

Design and own projects and drive their delivery
Explore problems in partnership with our users to understand new technical domains
Craft pragmatic solutions using existing tools as well as writing our own
Help drive larger decisions within Cortex that connect with our core mission
Sample projects we’ve worked on

Ongoing collaboration with Twitter’s ML Ethics, Transparency, and Accountability team
Instrumenting data anomalies in production model systems
Migrating and improving the data pipelines behind core models
Who you are

You prefer to collaborate with users to uncover their most pressing problems and incrementally deliver pragmatic solutions. You love bringing transparency to systems and you've seen how logging, metrics, observability, and visualizations can help organizations run better. You've added these approaches and more to your toolkit. Additionally, you consider yourself an engineer first and foremost with an interest in the fields of ML and Data Science.

On our team we need people who

4+ years of professional experience
Enjoy mapping ambiguous business problems into technical plans and solutions.
Have professional experience with a production grade typed language. Java/Scala, Go, C# or C++ is ok, whereas Ruby/Python or JavaScript alone is not enough.
Have implemented efficient distributed data systems with both online and offline processing.
Enjoy working with our internal customers and having empathy for their problems.
Embrace a growth mindset and want to improve ourselves, the team, our process, and the products we work on.
Additionally it would be nice if you had

Scala experience, development experience with Python, Jupyter Notebooks, Spark.
Experience specifying re-usable, ergonomic libraries.
Basic understanding of ML modeling lifecycle workflows to help communicate with our customers.
A proven understanding of data processing and storage technologies. We work Hadoop and Scalding to analyze large datasets."
