,Title,Location,City,State,Zip,Country,Qualifications,Skills,Responsibilities,Education,Requirement,FullDescriptions
75,Software Engineer - .Net Robotics,"Houston, TX 77002",Houston,TX,77002,None Found,None Found,None Found,None Found,None Found,None Found,"As a member of our Software Engineering Group we look first and foremost for people who are passionate around solving business problems through innovation & engineering practices. You will be required to apply your depth of knowledge and expertise to all aspects of the software development lifecycle, as well as partner continuously with your many stakeholders on a daily basis to stay focused on common goals. We embrace a culture of experimentation and constantly strive for improvement and learning. You’ll work in a collaborative, trusting, thought-provoking environment—one that encourages diversity of thought and creative solutions that are in the best interests of our customers globally.


With CT, CT Robotics is a Center of Excellence (CoE) for Robotics Process Automation development enabling all Corporate Business Groups (Global Finance, Global Supplier Services, Human Resources, Firmwide Risk & Compliance, Reference Data, Treasury & CIO) and Cyber Security & Technology Controls (CTC) to deliver efficiency.
CT Robotics CoE seeks a strong technologist with 8+ years of overall technology industry experience with an emphasis on process automation.

Responsibilities include:
Develop Application Level Understanding for the applications that are assigned
Business engagement and interactions for process understanding and requirements review
Detailed process evaluation & documentation standards
Develop Solution/Automation Design
Automation development adhering to design pattern and control guidelines
Collaborate with Ops SME for creation of test plan scripts, define validation criteria
Adhere to Automation Good Practices - review and provide suggestions to update the same
Provide Implementation and Post production Support for automations live in Production
Peer review of scripting done by fellow automation developers
Partner with other technology teams, business users, control and cyber security teams to ensure appropriate controls & security
Display efficient work style with attention to detail, organization, and strong sense of urgency

This role requires a wide variety of strengths and capabilities, including:
BS/BA degree or equivalent experience
8+ years of overall technology industry experience with an emphasis on process automation
Full stack developer with strong experience in ASP.NET, HTML 5, JavaScript, CSS, XML, Bootstrap, Angular, Modular JS frameworks, Web Services: WEBAPI, REST Services, Python, WCF, C# WPF, SOLID Design principles, VB.NET, and PowerShell
Strong in Oracle, MSSQL database development including PL/SQL and DBMS packages
Experience in Cloud and Micro services is a huge plus
Preferred experience in one of the Robotic process automation solutions such as Automation Anywhere, Softomotive WinAutomation/ProcessRobot, BluePrism, Workfusion, or UI Path
Advanced knowledge of application, data and infrastructure architecture disciplines
Solid design, coding, testing and debugging skills
Working proficiency in developmental toolsets
Knowledge of industry wide technology strategies and best practices
Understanding of architecture and design across all systems
Ability to work in large, collaborative teams to achieve organizational goals, and passionate about building an innovative culture
Expertise in process evaluation
Strong logical and problem solving skills
Must be detailed oriented with strong organizational and communication skills.
In-depth knowledge about technology design and architect skills
 Strong in documentation, requirement gathering, and providing trainings
 Testing Concepts & Methodologies
 Requirement Analysis & Automated Test Case Creation.
 Self-directed, highly motivated, ability to work independently
Our Corporate Technology team relies on smart, driven people like you to develop applications and provide tech support for all our corporate functions across our network. Your efforts will touch lives all over the financial spectrum and across all our divisions: Global Finance, Corporate Treasury, Risk Management, Human Resources, Compliance, Legal, and within the Corporate Administrative Office. You’ll be part of a team specifically built to meet and exceed our evolving technology needs, as well as our technology controls agenda.
When you work at JPMorgan Chase & Co., you’re not just working at a global financial institution. You’re an integral part of one of the world’s biggest tech organizations. In our global technology centers, our team of 50,000 technologists design, build and deploy everything from enterprise technology initiatives to big data and mobile solutions, as well as innovations in electronic payments, cybersecurity, machine learning, and cloud development. Our $11B annual investment in technology enables us to hire people to create innovative solutions that are transforming the financial services industry.
At JPMorgan Chase & Co. we value the unique skills of every employee, and we’re building a technology organization that thrives on diversity. We encourage professional growth and career development, and offer competitive benefits and compensation. If you’re looking to build your career as part of a global technology team tackling big challenges that impact the lives of people and companies all around the world, we want to meet you."
76,Lead Software Engineer,"Houston, TX",Houston,TX,None Found,None Found,None Found,None Found,None Found,None Found,None Found,"Named as one of Fortunes’ 100 Fastest Growing Companies for 2019, EPAM is committed to providing our global team of 30,100+ EPAMers with inspiring careers from day one. EPAMers lead with passion and honesty and think creatively. Our people are the source of our success and we value collaboration, try to always understand our customers’ business, and strive for the highest standards of excellence. No matter where you are located, you’ll join a dedicated, diverse community that will help you discover your fullest potential.

Description

You are curious, persistent, logical and clever – a true techie at heart. You enjoy living by the code of your craft and developing elegant solutions for complex problems. If this sounds like you, this could be the perfect opportunity to join EPAM as a Lead Software Engineer. Scroll down to learn more about the position’s responsibilities and requirements.

#LI-DNI
What You’ll Do
The hands-on Lead Software Engineer will lead a team in designing, developing and building backend frameworks, tools, blueprints for all development teams across the corporate enterprise
What You Have
Technical Lead experience
Strong Java (server side) development experience
Spring Boot framework experience
RESTful microservices development experience (preferably using Spring Boot)
Agile experience
Google Cloud Platform (GCP) tools
Nice to have
Python
Azure familiarity
Docker
Kubernetes
What We Offer
Medical, Dental and Vision Insurance (Subsidized)
Health Savings Account
Flexible Spending Accounts (Healthcare, Dependent Care, Commuter)
Short-Term and Long-Term Disability (Company Provided)
Life and AD&D Insurance (Company Provided)
Employee Assistance Program
Unlimited access to LinkedIn learning solutions
Matched 401(k) Retirement Savings Plan
Paid Time Off
Legal Plan and Identity Theft Protection
Accident Insurance
Employee Discounts
Pet Insurance"
77,Imaging Software Developer,"Houston, TX 77098",Houston,TX,77098,None Found,None Found,"
Strong communication skills, verbal and written
Ability to handle multiple projects with possibly conflicting timelines
Ability to work with minimal supervision and as part of a team
",None Found,None Found,None Found,"Description
The Imaging Software Developer will enhance and support Digisonics Medical Imaging applications. The developer may work independently or in a team with QC and other developers as necessary. He/she will also work closely with management to refine specifications; however a wide degree of creativity is expected with the development and implementation of technical strategies.

Duties
The primary focus will be Imaging applications
Develop new functionality for assigned applications
Ongoing maintenance of assigned applications
Collaboration with other developers, teams, or departments
Create application change documentation
Assist in creation of testing procedures
Create technical diagrams and additional documentation as needed
Contribute technical insight to the Digisonics multi-generational product roadmap
Experience

C++ development – 5 years related experience
Imaging technologies – 5 years related experience
Preferred experience with: DICOM, DirectX, LEAD Tools, SQL Server
Bachelor’s degree or greater with industry certifications
Proven record with excellent referrals
Non-Technical Skills

Strong communication skills, verbal and written
Ability to handle multiple projects with possibly conflicting timelines
Ability to work with minimal supervision and as part of a team
Industry
Healthcare – Medical Software

Location
Houston, Texas

To apply for this position, please submit resume and cover letter to Bill O’Connor at boconnor@digison.net ."
78,UI Specialist-React Node.js,"Houston, TX 77002",Houston,TX,77002,None Found,None Found,None Found,None Found,None Found,None Found,"Our Corporate & Investment Bank relies on innovators like you to build and maintain the technology that helps us safely service the world’s important corporations, governments and institutions. You’ll develop solutions for a bank entrusted with holding $18 trillion of assets and $393 billion in deposits. CIB provides strategic advice, raises capital, manages risk, and extends liquidity in markets spanning over 100 countries around the world.

Located in the heart of Houston City Centre, our center is one of strategic, pure technology hubs globally for Global Investment Banking Technology. Our opportunities offer chance to work on extremely challenging projects, using latest cutting edge technologies.

Be part of a growing hub:

Role:

As an experienced Software Engineer, your mission is to help lead our team of innovators and technologists toward creating next-level solutions that improve the way our business is run. Your deep knowledge of design, analytics, development, coding, testing and application programming will help your team raise their game, meeting your standards, as well as satisfying both business and functional requirements. Your expertise in various technology domains will be counted on to set strategic direction and solve complex and mission critical problems, internally and externally. Your quest to embracing leading-edge technologies and methodologies inspires your team to follow suit. And best of all, you’ll be able to harness massive amounts of brainpower through our global network of technologists from around the world.

Located in Houston, you will work on prototyping new applications and models and either take them to production or partner with globally located software engineering teams to deliver the full product.

What you will be doing:

Be part of the strategic global Banking technology core team who are responsible for accelerating the delivery of high impact projects to the business. You will be working directly with DIB partners to understand the problems, and then formulate, socialize and deliver solutions.
Build a services/API architecture, leveraging private and/or public cloud.
Always be thinking about the user experience
Build tools that transform the client and user experience, productivity and business impact, with a particular focus on moving key capabilities out of excel and into fully supportable platforms that enable internal and client users to engage dynamically.

We need your expertise:

This role requires a wide variety of strengths and capabilities, including:

Advanced knowledge of Node.js and Javascript
Advanced knowledge of JS Web UI frameworks like React
Ability to work collaboratively in teams and develop meaningful relationships to achieve common goals
Mindset to work with highly sensitive data and appropriate controls framework
Strong knowledge of Javascript, services, microservices, REST
Experience with web UI and frameworks like React is beneficial
Knowledge of risk and PNL reporting is desirable.
Hands-on experience designing and building large scale web/desktop and mobile platforms which are systems of record. These applications & services should have been built leveraging some of the following technologies:
Programming Languages – Javascript, Node.js, React and/or other JS UI frameworks
Database Servers – Experience with Oracle or other RDMS
Service Oriented Architecture – experience with designing APIs, Messaging, Caching
Cloud – understanding of public and private cloud



Interested? This is what you will have:


A commercial mindset to deliver short, medium and long term strategies to achieve sustained efficiency; an innovation mindset; focus on simplification; and help the team adopt SDLC automation/DevOps to maximize ROI of technology investments.

When you work at JPMorgan Chase & Co., you’re not just working at a global financial institution. You’re an integral part of one of the world’s biggest tech companies. In 14 technology hubs worldwide, our team of 50,000+ technologists design, build and deploy everything from enterprise technology initiatives to big data and mobile solutions, as well as innovations in electronic payments, cybersecurity, machine learning, and cloud development. Our $10.8B+ annual investment in technology enables us to hire people to create innovative solutions that will not only transform the financial services industry, but also change the world."
79,Software Engineer,"Houston, TX",Houston,TX,None Found,None Found,None Found,None Found,None Found,None Found,None Found,"DISA Global Solutions is a fast-paced, growing company focused on providing safety and compliance solutions, which include drug and alcohol testing, background screening, occupational health screening, transportation compliance, and safety and substance abuse training. We are headquartered in Houston, Texas with over 800 employees. DISA has specialized in promoting workplace health and safety for over 25 years and has a strong market presence in the energy and transportation sector. We are IT innovators and developed one of the most advanced platforms to support our clients’ access to data. DISA is highly committed to quality and service excellence.

DISA employees are offered a competitive pay and benefits package and a fun and exciting place to work. We have a collaborative and team-oriented culture with numerous opportunities of career advancement. We offer monthly appreciation events and strive to provide a learning environment where each employee is encouraged to participate in continuing education and training.

Position Overview:
The Software Engineer designs and develops computer programs that automate specific business processes. Ideal candidates will use existing knowledge and experience in conjecture with problem solving skills to create solutions meeting both internal and external business needs.

A Day in the Life:

You will consult with business analysts to analyze and understand functions that are to be automated, client needs, objectives, desired features, and input and output requirements.
You will write and maintain functional and technical specifications.
You will convert designs and specifications into computer code.
You will compile code into programs and correct errors detected in the compilation process.
You will create test transactions and run tests to find errors and confirm that the program meets specifications.
You will analyze codes to find causes of errors and revise programs.
You will write and maintain documentation to describe program development, logic, coding, testing, changes and corrections.
You will provide technical assistance by responding to inquiries regarding errors, problems, or questions with programs.
You will perform maintenance of existing custom software.
You will monitor performance of programs after implementation.

Our Ideal Candidate:

Has significant experience working with C#, .NET, Javascript, SQL, HTML, XML, Ember Js or related scripting languages.
Has Relational Database Design experience.
Has Object-oriented programming experience.
Has Web Services experience
Has a Bachelor's degree in biotechnology, computer science, electrical engineering, computer engineering, or a related degree.

DISA is an equal opportunity at will employer and does not discriminate against any employee or applicant for employment because of age, race, religion, color, disability, sex, sexual orientation or national origin."
80,Software Engineer-Junior,"Houston, TX",Houston,TX,None Found,None Found,"Bachelors in Computer Science, Computer Engineering, or similar field and 0 years related experience.",None Found,None Found,"Bachelors in Computer Science, Computer Engineering, or similar field and 0 years related experience.",None Found,"Job Description
Description
This position provides OS Linux and Windows Systems Administration engineering support to the Mission Control Center (MCC) Operations and Training Systems within the NASA JSC Flight Operations Directorate on the Mission Systems Operations Contract (MSOC).

The candidate will be responsible for maintaining the operations, on-going and new IT Initiatives and upgrades, evaluation for new software, and support for all production, staging, development, and disaster recovery environments.

Responsibilities may include:
Managing the appropriate configuration baseline of operating systems, software applications, and security compliance
Working with monitoring tools and active directory
Assess and interpret requirements of systems and applications in relation to hardware, software and operational needs
Implement efficiencies through automations (leverage PowerShell, Power CLI, and batch jobs to automate manual and repetitive processes)
Investigate new technology and provide recommendations on system improvements and life cycle planning.
Qualifications
Required Education & Experience
Bachelors in Computer Science, Computer Engineering, or similar field and 0 years related experience.

Required Clearance
Must be able obtain & maintain a Public Trust Security Clearance.


Desired Qualifications

Some experience in Windows and/or Linux Operating System
Familiar in at least one high-level scripting language is a plus (e.g.VBScript, Jscript, PowerShell, Perl, BigFix ActionScript) a plus
Familiar with an automation & system management product is a plus (e.g. BigFix preferred, or SCCM, MOM, or similar tool) a plus
Familiar with heterogeneous platform management between Windows and Linux (SSH, Samba, Kerberos, LDAP) a plus
Familiar in system automation practices (Group Policy, Local GPO, and Registry)
Familiar with basic TCP/IP (addressing, subnetting, routing, firewall rules, DHCP, DNS)


Overview
SAIC is a premier technology integrator, solving our nation's most complex modernization and systems engineering challenges across the defense, space, federal civilian, and intelligence markets. Our robust portfolio of offerings includes high-end solutions in systems engineering and integration; enterprise IT, including cloud services; cyber; software; advanced analytics and simulation; and training. We are a team of 23,000 strong driven by mission, united purpose, and inspired by opportunity. Headquartered in Reston, Virginia, SAIC has annual revenues of approximately $6.5 billion. For more information, visit saic.com. For information on the benefits SAIC offers, see Working at SAIC. EOE AA M/F/Vet/Disability"
81,Senior Software Engineer,"Houston, TX",Houston,TX,None Found,None Found,None Found,None Found,None Found,None Found,None Found,"Two Sigma is a different kind of investment manager. Since 2001, we have used data science and technology to derive insights that forecast the future and discover value in markets worldwide. Our team of scientists, technologists and academics looks beyond traditional finance to understand the bigger picture and develop creative solutions to some of the world’s most difficult economic problems. Our work spans markets and industries, from insurance and securities to private investments and new ventures.
We are seeking Senior Software Engineers for roles across all of our engineering groups. As a senior software engineer at Two Sigma you can take on a wide range of responsibilities and challenges.
You will take on the following responsibilities:
Tackle the complex and interesting challenge of discovering value hidden in the world’s data through software engineering.
Build and maintain robust data pipelines that ingest over 30TB of data each day.
Create infrastructure that is used by all of our software engineers.
Build and maintain a suite of analysis tools that enable our quantitative researchers.
Work on world-class trading systems.
Build technologies that bolster our trading businesses and drive productivity enhancements, collaboration, and risk reduction across the company.
You should possess the following qualifications:
You have at least a bachelor’s degree in a technical or quantitative field.
You have an understanding of data structures and algorithms.
You have experience with Java (or other JVM languages), Python, C or C++.
You have extraordinary programming skills.
You have demonstrated experience in large-scale systems.
You will enjoy the following benefits:
Core Benefits: Fully paid medical and dental insurance premiums for employees and dependents, competitive 401k match, employer-paid life & disability insurance.
Perks: Onsite gyms with laundry service, wellness activities, casual dress, snacks, game rooms.
Learning: Tuition reimbursement, conference and training sponsorship.
Time Off: Generous vacation and unlimited sick days, competitive paid caregiver leaves.
We are proud to be an equal opportunity workplace. We do not discriminate based upon race, religion, color, national origin, sex, sexual orientation, gender identity/expression, age, status as a protected veteran, status as an individual with a disability, or any other applicable legally protected characteristics."
