,Title,Location,City,State,Zip,Country,Qualifications,Skills,Responsibilities,Education,Requirement,FullDescriptions
0,Software Engineer,"Boulder, CO 80301",Boulder,CO,80301,None Found,None Found,None Found,None Found,None Found,None Found,"SUMMARY
ANSYS Discovery is one of the most exciting software products in engineering today. Recently launched, it has been called “the most impressive software in decades” by the press and “a game changer” by customers. It promises to deliver true digital exploration for every engineer, profoundly changing product development, and striving to provide users with innovative and effective user assistance along the way. This is a great opportunity to join the global leader in engineering simulation and evangelizing the most exciting product in the portfolio.

In this position, the Software Engineer will extend existing API and customization frameworks. The position involves programming / development activities in conjunction with other members of the development team, and support of internal and external customers as they adopt our technology. The simulation market for design engineers is a fast-growing segment of the company business. ANSYS is committed to address it, by providing easy-to-use products that leverage on the power and breadth of the company’s flagship products.

RESPONSIBILITIES
Work as a member of the development team in creating and extending the infrastructure for customization of design engineers’ products
Contribute to the creation and review of documented APIs
Contribute to the creation of custom apps
Work with the development team in providing access to the core technology for integration in third party applications
Provide documented examples that demonstrate the mechanism of third-party integration
Support the ecosystem of Ansys customers in their effort to create and customize products targeted to design engineers

MINIMUM QUALIFICATIONS
Bachelor’s Degree in Computer Science or Engineering with strong emphasis on programming
Demonstrated proficiency in one or more programming language (C++, C#, Java)
Demonstrated proficiency in object-oriented programming concepts
Familiarity with development environment (Visual Studio, Eclipse, other)
Ability to work in a fast-paced, distributed environment

PREFERRED QUALIFICATIONS
Experience with UI development
Experience with scripting languages (Python, Scheme, etc.)
Engineering background (mechanical, chemical, electric) is a definite plus

CULTURE AND VALUES
Culture and values are incredibly important to ANSYS. They inform us of who we are, of how we act. Values aren't posters hanging on a wall or about trite or glib slogans. They aren't about rules and regulations. They can't just be handed down the organization. They are shared beliefs – guideposts that we all follow when we're facing a challenge or a decision. Our values tell us how we live our lives; how we approach our jobs. Our values are crucial for fostering a culture of winning for our company:
Customer focus
Results and Accountability
Innovation
Transparency and Integrity
Mastery
Inclusiveness
Sense of urgency
Collaboration and Teamwork

ANSYS is an Equal Opportunity Employer. All qualified applicants will receive consideration for employment without regard to race, color, religion, sex, sexual orientation, gender identity, national origin, disability, veteran status, and other protected characteristics.

ANSYS does not accept unsolicited referrals for vacancies, and any unsolicited referral will become the property of ANSYS. Upon hire, no fee will be owed to the agency, person, or entity."
1,Software Engineer Intern (Summer 2020),"Boulder, CO",Boulder,CO,None Found,None Found,None Found,None Found,"
You will design, develop, code and test software systems, or applications for software improvements and new products
You'll actively contribute through participation in agile development of project timelines, implementation design specifications, system flow diagrams, documentation, testing, and ongoing support of systems
Your voice will have an impact through your recommended modifications to processes and procedures, and directly contribute to standard methodologies, architecture, and implementation","
The opportunity to work with a set of extraordinarily talented and dedicated peers, all the way from engineering and QA to product management and customer support. Splunk flourishes with disruption and diversity.
A constant stream of new things for you to learn and an opportunity for growth and mentorship. We believe in growing engineers through ownership and leadership opportunities. We also believe mentors help both sides of the equation.
A stable, collaborative and supportive work environment","
Familiarity with object-oriented programming concepts, large-scale software architecture, networking and distributed systems, and - - UNIX/Linux environments
You have strong knowledge of programming in one of the following programming languages including but not limited to: Go, C++, Java, Python, Javascript)
Familiarity with REST API and microservices is a plus
Familiarity with CI/CD concepts is a plus
Familiarity with tools and technologies like Git, Jenkins, Gitlab, AWS, Docker, GCP is a plus
You enjoy working well with others in a fast-paced environment
You enjoy working within an agile environment
Strong communication skills, verbal and written
You bring enthusiasm for solving interesting problems","Join us as we pursue our disruptive new vision to make machine data accessible, usable and valuable to everyone. We are a company filled with people who are passionate about our product and seek to deliver the best experience for our customers. At Splunk, we’re committed to our work, customers, having fun and most importantly to each other’s success. Learn more about Splunk careers and how you can become a part of our journey!
Role:
Splunk is looking for highly motivated college students to join our team. As an intern, you will work on a real project (or a few) and have an opportunity to enjoy our dynamic, startup-like environment.
You will experience Splunking and what defines our culture while honing the skills which separate our development teams from others. Working to support internal and external customer needs, you will collaborate with multi-functional teams, receive mentorship, and gain insight into our values-driven process. Our goal is both to support your growth and development while empowering you for a successful start to your career.
Responsibilities:
As a Software Engineer Intern you will be responsible for …
Building innovative solutions that enables rapid development. You will get to work with a super smart bunch of folks who are doing state of the art development work (native mobile, front-end and back-end, DevOps) in areas of machine learning, data analytics, infrastructure and event correlations across silos to build best-in-class business analytics software. You will be interacting with product management and customers to understand detailed requirements. You will also work with other engineering teams across Splunk to design and build high-performance solutions.
You will design, develop, code and test software systems, or applications for software improvements and new products
You'll actively contribute through participation in agile development of project timelines, implementation design specifications, system flow diagrams, documentation, testing, and ongoing support of systems
Your voice will have an impact through your recommended modifications to processes and procedures, and directly contribute to standard methodologies, architecture, and implementation
Requirements:
Possess knowledge of software engineering processes, agile framework, tools (e.g.: programming proficiency in a language, preferably Go, C++, Java, Python, etc), methods, test development, algorithms and data structure.
Familiarity with object-oriented programming concepts, large-scale software architecture, networking and distributed systems, and - - UNIX/Linux environments
You have strong knowledge of programming in one of the following programming languages including but not limited to: Go, C++, Java, Python, Javascript)
Familiarity with REST API and microservices is a plus
Familiarity with CI/CD concepts is a plus
Familiarity with tools and technologies like Git, Jenkins, Gitlab, AWS, Docker, GCP is a plus
You enjoy working well with others in a fast-paced environment
You enjoy working within an agile environment
Strong communication skills, verbal and written
You bring enthusiasm for solving interesting problems
Education:
Actively pursuing a Bachelor’s, Master’s, or PhD in Computer Science, Software Engineering, Computer Engineering, Electrical Engineering, Mathematics or a related technical field, and a strong record of academic achievement.

What We Offer You:

The opportunity to work with a set of extraordinarily talented and dedicated peers, all the way from engineering and QA to product management and customer support. Splunk flourishes with disruption and diversity.
A constant stream of new things for you to learn and an opportunity for growth and mentorship. We believe in growing engineers through ownership and leadership opportunities. We also believe mentors help both sides of the equation.
A stable, collaborative and supportive work environment
We value diversity at our company. All qualified applicants will receive consideration for employment without regard to race, color, religion, sex, sexual orientation, gender identity, national origin, or any other applicable legally protected characteristics in the location in which the candidate is applying.
For job positions in San Francisco, CA, and other locations where required, we will consider for employment qualified applicants with arrest and conviction records."
2,Principal Software Engineer,"Denver, CO",Denver,CO,None Found,None Found,"
5+ years’ experience as a Software Developer
End-to-end development, deployment and maintenance of rich applications on LAMP stack or equivalent
Experience working with distributed/offshore teams
Ability to inherit a codebase and platform and progressively refactor as business needs change
Prior experience in a technical leadership position
College or University degree in Computer Science or a related discipline
",None Found,"
Guide team development efforts towards successful project delivery.
Provide technical leadership to teammates through coaching and mentorship.
Maintain high standards of software quality within the team by establishing good practices and habits.
Identify and encourage areas for growth and improvement within the team.
Collaborate with other software developers, business analysts and software architects to plan, design, develop, test, and maintain web- based business applications, Android and iOS applications.
Assist in the collection and documentation of user's requirements, development of user stories, estimates and work plans.
Prepare reports, manuals and other documentation on the status, operation and maintenance of software.
Design, develop, and unit test applications in accordance with established standards.
Participate in peer-reviews of solution designs and related code.
Package and support deployment of releases.
Develop, refine, and tune integrations between applications.
Analyze and resolve technical and application problems.
Assess opportunities for application and process improvement and prepare documentation of rationale to share with team members and other affected parties.
Adhere to high-quality development principles while delivering solutions on-time and on-budget.
Provide third-level support to business users.
Research and evaluate a variety of software products.
",None Found,"
Proficient with AWS, PHP, HTML, CSS3, and SQL Server
In depth knowledge and experience with core Android, IOS, Boostrap JavaScript, .Net, Codelgniter, Apache, and jQuery
Need some experience with devops to manage deployment and architecture
Experience with source control management systems and continuous integration/deployment environments
Experience with automated testing
Experience with agile development methodologies including Kanban and Scrum
Experience with multi-threading and concurrency
Experience with debugging, performance profiling and optimization
Comprehensive understanding of object-oriented and service-oriented application development techniques and theories
Internally motivated, able to work proficiently both independently and in a team environment Strong communication skills with both internal team members and external business stakeholders
Strong initiative to find ways to improve solutions, systems and processes
","Engage Mobilize is a team focused on driving digital transformation and bringing modern software design to the Energy, Construction and Mining Industries. Our product is a combination of modern web & native applications that manage, analyze, and report field ticket data for E&P Companies and Service Contractors alike. Our three-tiered platform leverages the capabilities of a smart device to generate real-time analytics for all steps of a transaction from point of order to accounting.

We work side-by-side with our customers providing them with the tools to drive better business decisions all the way from implementation to custom real-time reporting.

An Awesome Culture:
Our startup’s success will be driven by a team with diverse backgrounds that not only brings ideas to the table but, more importantly, executes on those ideas. Whether working remotely or at our HQ (proudly located in Denver, CO) our team works in partnership to get this new venture growing with a bootstrap mindset. Our culture will be shaped by talented new team members, full of energy and integrity, with a wide range of experiences both professional and personal. Delivering results through open communication will undoubtedly lead to Engage Mobilize’s continued success. A work/life balance will always define our culture.

Our Core Values:

Act with Integrity
Create Lasting Value
Work Hard
Strike a Balance
Celebrate Success as a Team
Family & Friends

What we looking for:
Engage Mobilize is looking for a friendly, driven and organized Principal Software Engineer with strong communication skills and a love for learning. This position will be part of an agile development team, building and working on enterprise grade software systems. The Software Development Team Lead will provide technical and team leadership through coaching and mentorship for an offshore team.

Responsibilities & Opportunities of the Role:

Guide team development efforts towards successful project delivery.
Provide technical leadership to teammates through coaching and mentorship.
Maintain high standards of software quality within the team by establishing good practices and habits.
Identify and encourage areas for growth and improvement within the team.
Collaborate with other software developers, business analysts and software architects to plan, design, develop, test, and maintain web- based business applications, Android and iOS applications.
Assist in the collection and documentation of user's requirements, development of user stories, estimates and work plans.
Prepare reports, manuals and other documentation on the status, operation and maintenance of software.
Design, develop, and unit test applications in accordance with established standards.
Participate in peer-reviews of solution designs and related code.
Package and support deployment of releases.
Develop, refine, and tune integrations between applications.
Analyze and resolve technical and application problems.
Assess opportunities for application and process improvement and prepare documentation of rationale to share with team members and other affected parties.
Adhere to high-quality development principles while delivering solutions on-time and on-budget.
Provide third-level support to business users.
Research and evaluate a variety of software products.

Minimum Qualifications to Apply:

5+ years’ experience as a Software Developer
End-to-end development, deployment and maintenance of rich applications on LAMP stack or equivalent
Experience working with distributed/offshore teams
Ability to inherit a codebase and platform and progressively refactor as business needs change
Prior experience in a technical leadership position
College or University degree in Computer Science or a related discipline

Core Competency Requirements:

Proficient with AWS, PHP, HTML, CSS3, and SQL Server
In depth knowledge and experience with core Android, IOS, Boostrap JavaScript, .Net, Codelgniter, Apache, and jQuery
Need some experience with devops to manage deployment and architecture
Experience with source control management systems and continuous integration/deployment environments
Experience with automated testing
Experience with agile development methodologies including Kanban and Scrum
Experience with multi-threading and concurrency
Experience with debugging, performance profiling and optimization
Comprehensive understanding of object-oriented and service-oriented application development techniques and theories
Internally motivated, able to work proficiently both independently and in a team environment Strong communication skills with both internal team members and external business stakeholders
Strong initiative to find ways to improve solutions, systems and processes

About Engage Mobilize

Engage Mobilize was founded in 2016 under its parent company Engage Management. Engage Management is a boutique energy consulting firm that specializes in driving operational efficiencies into drilling and completion projects worldwide. Efficiency is always benchmarked on the ability to save time and reduce costs. The leadership team and consultants that founded the company always took issue with the way the capital burn and expense allocation were accounted for at the field level. Hence, Engage Mobilize was drawn up on a napkin.

Field ticketing, in essence, is a required control measure but wastes uncountable resources and capital for both Operators and Service Contractors. As a team, we are not the first to identify this massive waste of time that slows and burdens our industry, but we are in fact the first to build a platform that both sides of the transaction can identify with. Our leadership’s experience with consulting on the corporate side coupled with their dirty work boots & faded FRs led to the development of a digital field ticketing solution that respects everyone’s workflows and simply makes sense. Our company understands the “real” workflow at the field level that is intrinsic to driving the total success in a basin for both the E&P’s and the Service Providers that support them."
3,Sr. Software Engineer,"Englewood, CO 80112",Englewood,CO,80112,None Found,None Found,None Found,None Found,None Found,"
Employees working in the Englewood offices may be asked to travel 1-2 times per year for training or to attend industry conferences.
","The primary role of the Senior Software Developer will be to design and build cutting edge user experiences for our consumer facing applications for web and connected TVs both client-side and cloud- based technologies. The Senior Software Developer will work closely with product owners, UX designers, front end and back end developers to help build the next generation consumer video streaming platform.


ESSENTIAL DUTIES AND RESPONSIBILITIES:


Build “best in class” content discovery and video streaming experiences for STARZ subscribers
Participate in code reviews with staff as necessary to ensure a high quality, performant product
Collaborate with the broader Digital Platforms team including the leadership team, quality assurance professionals, designers, business analysts and other software engineers in an open, creative environment
Be a subject matter expert for our client applications, backend services and business
Contribute to all aspects of the software creation process:
Software architecture and design
Object-oriented development
Unit testing/test-driven development
Integration testing
Deployment
Maintenance
o Post-deployment production support and troubleshooting


Required Skills


5-8+ years experience in an enterprise or consumer software development environment
Bachelor’s Degree in Computer Science or similar discipline is preferred
Expert level programming skills creating applications using frameworks such as Angular, React, Node.js
Experience developing consumer facing user interfaces and supporting UI controls/components.
Must possess excellent analytical and troubleshooting skills which will be used to diagnose, debug and solve issues
Strong knowledge of cloud environments (Amazon, Google, Azure)


Ability to write clean, readable, maintainable code
Possess excellent written and verbal communication skills
Experience instrumenting applications with digital marketing technologies


Travel & Proximity Requirements


An Ideal candidate is located in the Denver-Metro area and is capable of being based in Englewood, Colorado.

Employees working in the Englewood offices may be asked to travel 1-2 times per year for training or to attend industry conferences.


STARZ (www.starz.com), a Lionsgate company (NYSE: LGF.A, LGF.B), is a leading global media and entertainment company that provides premium subscription video programming on domestic U.S. pay television networks and produces and distributes content for worldwide audiences, including its investment in the STARZ PLAY Arabia OTT service.


STARZ is the ultimate destination for obsessable TV, movies and more. Characters who pull you in and stories that stay with you. From bold Original Series to the best movies, whatever you love, STARZ ignites your passions.


STARZ offers a competitive compensation package and an attractive benefits program to all eligible employees including a variety of healthcare plans, dental and vision insurance, 401k, life/disability insurance. Eligible employees will enjoy paid time off in the form of vacation and company holidays.


STARZ is an Equal Opportunity Employer. This means that all applicants will receive consideration for employment regardless of gender, age, race, national origin, disability, color, religion, sexual orientation, gender identity and/or expression, veteran status, or any other characteristic protected by federal, state or local law. In addition, STARZ will provide reasonable accommodations for qualified individuals with disabilities.
Required Experience"
