,Title,Location,City,State,Zip,Country,Qualifications,Skills,Responsibilities,Education,Requirement,FullDescriptions
111,Software Engineer (Java),"Denver, CO 80209",Denver,CO,80209,None Found,None Found,None Found,None Found,None Found,None Found,"Businessolver delivers market-changing benefits administration technology supported by an intrinsic and unwavering responsiveness to client needs. Our clients trust Businessolver to take care of them and their employees with a configurable and secure SaaS platform and a culture of service, all aimed at total and measurable success and our clients' complete delight.

We work with some of the most recognizable brands in the U.S. We look to our rock-star employees to help these clients maximize the investment in their benefits program, minimize their exposure to risk, engage their employees with our easy-to-use solution and full suite of communication tools, and empower their employees to use their benefits wisely.

At Businessolver you will have opportunities for individual development through our common language: Trust through transparency. Assume positive intent. Be real. Live a growth attitude. Embrace the reverse golden rule.

We are currently seeking Software Engineers with experience in all phases of the software development life cycle. This is a unique opportunity to contribute extensively to the success of a rapidly growing technology company. Businessolver developers create web based solutions within a complex integrated system seen by millions of users.

The Gig:

Innovative design and analysis of enhancements
Deliver code based on sprint commitments
Actively participate in discussions, coding, and testing.
Develop core web application changes using JAVA and XSL
Present application enhancements to team
Collaborate with Tech Leads to align on design strategy that will achieve business goals of the user story while ensuring technical integrity
Creative thinking and proposing solutions to grow our business by delighting our clients.

What you need to make the cut:

BS in Computer Science, CIS, Software Engineering or related degree.
4-8 years of experience in Large Scale Enterprise Development
Extensive knowledge of JAVA, SQL, XML, HTML, CSS, JavaScript/JQuery, Object-Oriented Programming and Relational Databases (Oracle).
Experience with LINUX, Eclipse IDE, GIT, JIRA, Agile Development Methodology and XSL is a plus.
Highly motivated, Innovative, self-directed thinker with an eagerness to stay up-to-date with current trends and a desire to impress.
React Native experience required.
Excellent written and verbal communication skills
Any experience with development in the following areas is helpful:
AWS and AWS Lambda's
User interface development
Mobile development with HTML5 or Swift
Bootstrap, JQuery
Financial Transactions (Debit, Credit, Spending Accounts (HSA/FSA), etc.)
Data import/export, SSO, or large-scale EDI

The Businessolver Way…

Our team has spent nearly two decades crafting a culture that challenges each employee to perform at the top of their game – and have fun doing it! If you desire to use your skills and experience in an environment where you can make a difference, we want to hear from you! Businessolver employees experience a vibrant work culture with extensive workplace perks including:


Competitive pay, great benefits, and vacation time. We are an equal opportunity employer with competitive benefits including medical, dental, life insurance, disability, 401(k) with company match, among others.
Smart Casual Dress. No need to suit up, but we also have on-site dry cleaning services for those that prefer to dress-up!
Weekly catered meals. Breakfast every other Mondays, lunch Wednesdays, and afternoon appetizers on Fridays encourage collaboration across our teams.
Fully-stocked kitchens. We know it takes fuel to perform, so we provide a kitchen stocked with healthy cereals, fruit, snacks, and beverages to keep you at the top of your game.
Fitnessolver. If you need a boost, visit our on-site fitness facility to clear your head.
Massages. With a ""work hard/play hard"" atmosphere we all need a little stress relief at times.
Charity and community involvement. Participate in a variety of ways to support those around us.
Learning & Development. Continue to learn about the industry through our online and instructor-led classes.
Recognition. Want some swag? Earn tons of it by helping out your co-workers through our employee recognition program.
Culture. Want a culture most dream of? Most companies talk about it, we live it. Come find out for yourself!

Interested? Great, we look forward to reading your application - make sure it includes:


A cover letter that highlights why you think you'd be great for the gig, focusing on how your past work experience has prepared you for this kind of position – or why you think you can rock the job even though you don't have past work experience that's perfectly aligned.
Your resume.

You will receive an auto-reply confirming that we've received your application, and you will hear from us again after we've reviewed your application and decided whether or not to move you forward in our recruiting process.

If you do decide to apply, please know that every complete application will be carefully reviewed. Seriously! We know it is a time commitment to prepare an application. We will respect that effort by thoughtfully reviewing every single complete application and we are truly grateful for your interest.
Thanks for your interest in Businessolver!

Check us out on Twitter ( https://twitter.com/businessolver ), Facebook ( https://www.facebook.com/bsolver ) and LinkedIn ( https://www.linkedin.com/company/232793?trk=tyah&trkInfo=tarId%3A1415406210925%2Ctas%3Abusinessolver%2Cidx%3A2-1-4 ) for a look at our vibrant culture."
112,Software Engineer,"Greenwood Village, CO 80111",Greenwood Village,CO,80111,None Found,None Found,None Found,None Found,None Found,None Found,"Company Overview
BryterCX is seeking a talented and driven Software Developer who enjoys working in a dynamic, high-paced and innovative team environment. The candidate must be comfortable working in Agile teams to design, prototype and build new products, and enhance existing products and tools. We prefer the candidate to have direct experience in test-driven product development, as well as demonstrated ability to process and analyze large datasets, especially in a big data environment.
Roles, Responsibilities and Skills:
Responsible for the implementation of Java applications for enterprise or enterprise style applications
Functional and real-world knowledge and experience in the implementation of core Java functionality as well as Java-based REST web services in an application development environment and production systems
Ability to design and develop application code within and supporting business requirements as outlined for a data platform using Java knowledge and skills
Participate in daily stand-up
Produce high-quality, maintainable software
Work independently and with other team members to develop code and acceptance criteria and design test cases
Collaborative negotiation of feature design and implementation
Speak to and demonstrate feature functionality
Obtain and incorporate user feedback
Analyze and resolve identified functional/usability software issues
Job Requirements:
2+years of experience as a Software Engineer in a Java environment; exposure to Javascript, Angular, TypeScript, Hadoop, and/or NoSQL databases is preferred.
Highly skilled with direct experience in Java-based design and development with REST-based web services
Big data experience preferred.
Processing large datasets via large parallel / distributed algorithms in clustered environments is highly desirable (MapReduce, Spark)
Experience with Hive, Impala, Map Reduce, Spark, HBase and related Java API's is also highly desirable
Experience with Cloud Services and Microservices also highly desirable
Experience with performance tuning at a Java API layer a strong plus
Experience with Python or Scala a strong plus
Company Overview:
BryterCX pioneered and remains the industry leader in providing the premier Journey Analytics (Fox) solution for optimizing self-service information systems. BryterCX unique software modeling solutions enable its customers to translate complex customer interactions across multiple self-service channels, including Interactive Voice Response, Web/Intranet, Email, Chat, Agent Desktop, Routing, and other enterprise applications. Through ongoing application of the ClickFox Customer Behavior Intelligence system, companies can dramatically reduce operational costs, improve customer satisfaction and revenue generation and enhance the overall interactive customer experience.
lxWTE6Lacp"
113,Software Developer 3,"Broomfield, CO",Broomfield,CO,None Found,None Found,Work as a member of an Agile Software Development Team to help implement new functionality based on business requirements.,Bachelor’s degree in Computer Science or related field,None Found,None Found,None Found,"Software Developer 3-19001B4A


Preferred Qualifications

Senior Software Engineer - Oracle Data Cloud (ODC)


Oracle Data Cloud: Powering connections to customers.


The Oracle Data Cloud enables companies to use data to inform and measure business decisions. We do it by providing Data as a Service, or DaaS, to help create connections to customers across channels and devices. The Oracle Data Cloud was created in 2014 through the acquisition of BlueKai and was expanded in 2015 through the acquisition of Datalogix. The BlueKai and Datalogix brands live on as products within the Oracle Data Cloud.


Join Oracle Data Cloud and be part of the team creating innovative and groundbreaking data-driven solutions for Marketing, Sales and Customer Intelligence.

Job Description

As a Senior Software Engineer, you’ll be using your object-oriented development expertise and database know-how on the data we ingest from hundreds of different companies, and the solutions you develop will revolutionize the way products and services are sold. We rely on all of our Software Engineers to develop innovative solutions for our digital and offline marketing products. Our solutions will require you to work effectively with your teammates, of course. But your real success with Oracle will be measured by how well you couple critical thinking with self-motivation, enthusiasm and determination. Our engineers are grouped into teams that each focus on a specific business line. Engineers that like to share and mentor thrive here, for Oracle offers ample opportunities to move between teams and work on varying business domains and technology challenges.

Specific responsibilities include:
Work as a member of an Agile Software Development Team to help implement new functionality based on business requirements.
Develop new programs and supporting existing programs in Linux and Windows environments.
Interact with the Oracle business and operations teams and facilitate working through technical implementation and customer service issues.
Solve big data challenges. We work at multi-petabyte scale as we ingest data from hundreds of companies.
Work on high-volume, low-latency Internet solutions. We have real-time api’s that receive 10 billion requests per day from our partners and clients.
Develop service-based, server-side solutions in Java/Scala/Go
Work with our analytics teams to develop predictive modeling and data mining algorithms on petabytes of data using distributed computing.
All development and production processing is done in the cloud. If you are not a cloud computing expert already, you will become one. We use Amazon AWS and the Oracle Cloud.
Implement real-time streaming data pipelines on large volumes of data using Kafka and Spark.
Develop in a variety of database technologies; Hadoop, Cassandra, Elastic Search, MySQL


Desired Skills and Experience:
Bachelor’s degree in Computer Science or related field
Development experience in Java/Scala
Other experience we look for includes: Spark, Kafka, Akka, Hadoop, Go, Apache Ignite, Mesos, Kubernetes, Docker
Familiarity with AWS (Amazon Web Services) is preferred
Must have the ability to work in a dynamic, fast-paced environment
Strong communication skills to interact with Agile team members


This is a world-class, career-building opportunity:
Work in an environment with colleagues who are as smart and driven as they are collaborative and fun
Seize the opportunity to have a direct impact on the development of constantly evolving, game-changing products and services
Strategize with well-known thought leaders making a real impact in this ever-evolving industry
Stay on top of your game with professional development opportunities


What Oracle Data Cloud is best known for:
Industry-leading products and service solutions
Unique positioning in the advertising & marketing ecosystem
Longstanding relationships with high-profile advertisers and the biggest players in the digital-media advertising world
A visionary organization with an unmatched drive for excellence
A fast-paced, exciting culture giving employees the opportunity to work and play hard


Detailed Description and Job Requirements

Design, develop, troubleshoot and debug software programs for databases, applications, tools, networks etc.

As a member of the software engineering division, you will assist in defining and developing software for tasks associated with the developing, debugging or designing of software applications or operating systems. Provide technical leadership to other software developers. Specify, design and implement modest changes to existing software architecture to meet changing needs.

Duties and tasks are varied and complex needing independent judgment. Fully competent in own area of expertise. May have project lead role and or supervise lower level personnel. BS or MS degree or equivalent experience relevant to functional area. 4 years of software engineering or related experience.

Oracle is an Equal Employment Opportunity Employer. All qualified applicants will receive consideration for employment without regard to race, color, religion, sex, national origin, sexual orientation, gender identity, disability and protected veterans status or any other characteristic protected by law.


Oracle is an Affirmative Action-Equal Employment Opportunity Employer. All qualified applicants will receive consideration for employment without regard to race, color, religion, sex, national origin, sexual orientation, gender identity, disability, protected veterans status, age, or any other characteristic protected by law."
114,"Software Engineer, Intern","Broomfield, CO",Broomfield,CO,None Found,None Found,"Work as a member of an Agile Software Development Team to help implement new functionality based on business requirements
Help develop new programs and support existing programs running in the cloud
Interact with the Oracle Data Cloud business and operations teams
Engage in performance testing in a high-volume Internet infrastructure
Develop solutions in Java, Scala, Python, and other languages
Learn a variety of Big Data technologies including Hadoop, Spark, Elasticsearch, Kafka, Cassandra
","Pursuing a Bachelor’s or Master's degree in Computer Science or related discipline
Experience coding in Java, Scala, or Python
Must have the ability to work in a dynamic, fast-paced environment
Strong communication skills
",None Found,None Found,None Found,"Software Engineer, Intern-190017NN


Preferred Qualifications

Software Engineer, Intern - Oracle Data Cloud (ODC)

Oracle Data Cloud enables companies to use data to inform and measure business decisions and do it on a massive scale, rivaled only by top software companies like Facebook and Google. We accomplish this by providing Data as a Service, or DaaS, to help create connections to customers across channels and devices.
Oracle Data Cloud was created in 2014 through the acquisition of BlueKai and was expanded through the subsequent acquisitions of Datalogix, AddThis, Crosswise, Moat and Grapeshot, though the individual brands live on as products within the Oracle Data Cloud.

Join Oracle Data Cloud and be part of the team creating innovative and groundbreaking data-driven solutions for Marketing, Sales and Customer Intelligence.
Job Description
This is a great opportunity to apply your computer science or software engineering education to the data we ingest from millions of data sources. The solutions you help develop will revolutionize the way products and services are sold.

At Oracle Data Cloud, we use a variety of technologies, but we don’t expect you to know them all; we only expect an eagerness to learn and work with any of them. Most of the work is done in languages like Java, Scala, and Python. That said, we’re open to talented computer science students with relevant experience in other languages, too. Machine Learning and AI are also part of the tool set used by Oracle Data Cloud.

We rely on all of our Software Engineering Interns to help develop innovative, production solutions for our digital and offline marketing products. Our solutions will require you to work effectively with your teammates, of course, but your real success with Oracle Data Cloud will be measured by how well you combine critical thinking with self-motivation, enthusiasm and determination. Additionally, you may be called upon to perform troubleshooting of issues with our systems since we follow the ""you build it, you run it"" operational model.

This Software Engineering Internship opportunity will allow you to develop relevant and valuable skills that will help you succeed in your career. However, we think once you join our team, you may not want to leave!

Specific responsibilities include:
Work as a member of an Agile Software Development Team to help implement new functionality based on business requirements
Help develop new programs and support existing programs running in the cloud
Interact with the Oracle Data Cloud business and operations teams
Engage in performance testing in a high-volume Internet infrastructure
Develop solutions in Java, Scala, Python, and other languages
Learn a variety of Big Data technologies including Hadoop, Spark, Elasticsearch, Kafka, Cassandra

Desired Skills and Experience:
Pursuing a Bachelor’s or Master's degree in Computer Science or related discipline
Experience coding in Java, Scala, or Python
Must have the ability to work in a dynamic, fast-paced environment
Strong communication skills

Other Helpful Skills or Experience
Front-end development with JavaScript and HTML
Cloud infrastructure and networking
Linux or Windows server administration
Exposure to Machine Learning/AI/neural networks
Knowledge of relational database systems such as MySQL or Oracle
Experience with advertising technology or high-volume, web-scale systems support

This is a world-class, career-building opportunity:
Work in an environment with colleagues who are as smart and driven as they are collaborative and fun
Deploy code to production
Have a direct impact on constantly evolving, game-changing products and services
Strategize with thoughtful leaders making a real impact in this ever-evolving industry
Stay on top of your game with professional development opportunities
What Oracle Data Cloud is best known for:
Industry-leading products and service solutions
Massive scale and reach
Unique positioning in the advertising & marketing ecosystem
Longstanding relationships with high-profile advertisers and the biggest players in the digital-media advertising world
A visionary organization with an unmatched drive for excellence
Having a startup culture with the benefits of a large corporation

Detailed Description and Job Requirements

Do you want to get a foot in the door and perhaps even get the chance to interview early for one of the best technology jobs in the world? If so, you may be an ideal candidate for our internship program.

Gain invaluable experience in what it is like to work at a leading global hardware and software systems innovator - Oracle. Your colleagues are industry experts and knowledgeable veterans. Your contributions will enhance real Oracle products and services. By the end of your internship you will be connected to a powerful network of professionals, managers, and executives.

Received undergraduate degree in computer science, computer engineering, electrical engineering, or related area of study. Strong academic achievement. Strong interest in technical area of study.

Oracle is an Affirmative Action-Equal Employment Opportunity Employer. All qualified applicants will receive consideration for employment without regard to race, color, religion, sex, national origin, sexual orientation, gender identity, disability, protected veterans status, age, or any other characteristic protected by law."
115,Software Engineer Developer Productivity - Engineering Effectiveness,"Boulder, CO",Boulder,CO,None Found,None Found,None Found,None Found,None Found,None Found,None Found,"Who We Are

Part of Twitter’s Engineering Effectiveness organization , our team ensures Twitter engineers have the tools necessary to produce healthy code. Whether that’s improving our code review tools, identifying flaky tests, enabling language upgrades, or building a new generation of semantic tooling our team is the next step in developer efficiency at Twitter.

What You’ll Do

Create tools to support the Scala, Java, Python, JavaScript, C/C++, Objective-C, and Swift development environments.
Contribute to a wide array of developer tooling such as compilers, build systems, static and dynamic code analysis systems, code review systems, and code search systems.
Integrate the IDE experience with the latest technologies such as the Language Server Protocol (LSP) and Build Server Protocol (BSP).
Improve the daily workflow of engineers.
Tackle critical large scale software engineering problems presented by working on a mono repo codebase.
Optimize compile times.
Enable and perform language and library upgrades.
Collaborate with multiple teams in a joint effort to tackle customer problems.
Who You Are

Willing to embrace and enrich Twitter’s culture of empathy, teamwork and passion. #GrowTogether
Have a strong desire for learning and growth.
Passionate about improving developer productivity
Strive for speed and quality
Desire to automate
Enjoy interacting with and helping customers
Model of software engineering best practices, including agile development, unit testing, code reviews, design documentation, debugging, and troubleshooting.
Previous experience with Scala, Java, Python, C++, and/or JavaScript.
Strong computer science fundamentals, algorithms, and data structures background
Bachelors or higher in Computer Science or a related discipline or equivalent experience."
