,Title,Location,City,State,Zip,Country,Qualifications,Skills,Responsibilities,Education,Requirement,FullDescriptions
43,Gateway Robotics Software Engineer,"Houston, TX 77058",Houston,TX,77058,None Found,"
BS degree in engineering from an accredited engineering school.","
BS degree in engineering from an accredited engineering school.","
Capture and manage software requirements.
Design robotic system architectures.
Design and prototype robotic system components such as actuators and grippers.
Participate as software Subject Matter Expert in project meetings.
Perform other duties as assigned.","
BS degree in engineering from an accredited engineering school.","
Must be a U.S. Citizen and successfully complete a U.S. government background investigation.
Applicant selected may be subject to government security investigation and must meet eligibility requirements for access to classified information.
Work may involve sitting for extended periods.
May require lifting and carrying up to 25 lb.
Must have sufficient mobility to enter areas of test facilities where necessary.
Generally an office environment, but can involve inside or outside work depending on task.
Standard office equipment (PC, telephone, fax, etc.)
Regular attendance in accordance with established work schedule is critical.
Ability to work outside normal schedule and adjust schedule to meet peak periods and surge requirements when required.
Must be able to work in a team atmosphere.
Must put forward a professional behavior that enhances productivity and promotes teamwork and cooperation.
Grooming and dress must be appropriate for the position and must not impose a safety risk/hazard to the employee or others.
This position may require some commuting and traveling to other installations as needed.","Overview
Our long-term client relationship with Jacobs has led to a need for a Gateway Robotics Software Engineer on the JSC Engineering, Technology, and Science (JETS) contract at Johnson Space Center (Houston, TX).
JETS provides products and technical services related to human operations in space through development and integration of a broad spectrum of engineering requirements. This includes human spacecraft flight and flight development products, human exploration mission planning for NASA, institution support services, and new technology development.

Barrios Technology Ltd. is a woman-owned and operated small business headquartered in Houston, Texas. We provide a full spectrum of engineering, operations and related technology services in support of the aerospace community and have successfully supported NASA for 38 years. Barrios Technology is the prime contractor for the Mission and Program Integration (MAPI) contract and Research, Engineering, Mission Integration Services (REMIS) contracts along with subcontractor support to multiple prime contractors as listed below. Barrios employees have the opportunity to contribute to the US Space Program through work on the International Space Station (ISS), Orion, Space Launch System and Exploration programs. Our primary locations are at NASA’s Johnson Space Center (JSC) in Houston, TX and the Marshall Space Flight Center (MSFC) in Huntsville, AL. We also support commercial space programs and provide systems engineering services to the oil and gas industry. Our customers include:

Boeing on the Boeing Engineering and Technical Services (BETS) contract at JSC and MSFC
Jacobs Technology on the JSC Engineering and Technical Services (JETS) contract at JSC
COLSA Corporation on the Huntsville Operations Support Center (HOSC) contract at MSFC
Rothe Development, Inc. on the Joint Operations, Integrated Systems Technology (JOIST) Contract at JSC
Sierra Nevada Corporation (SNC) Commercial Resupply Services 2 (CRS2) contract in Colorado and Houston
Leidos Innovations on the Cargo Mission Contract (CMC)3 at JSC
Northrop Grumman Innovation Systems (formerly Orbital ATK) on the CRS1 contract in Houston, TX and Virginia
British Petroleum (BP) in Houston, TX
Stinger Ghaffarian Technologies, Inc.(SGT) / KBRwyle on the Mission Systems Operations (MSOC) contract at JSC
Stinger Ghaffarian Technologies, Inc. (SGT)/ KBRwyle on the Integrated Mission Operations Contract II (IMOC II) contract at JSC
KBRwyle on the Fully Integrated Lifecycle Mission Support Services (FILMSS) contract at Ames Research Center
Responsibilities
The Gateway Robotics Software Engineer will:
Capture and manage software requirements.
Design robotic system architectures.
Design and prototype robotic system components such as actuators and grippers.
Participate as software Subject Matter Expert in project meetings.
Perform other duties as assigned.
Qualifications
Required Education/Experience/Skills:

This position is posted at multiple levels. Depending on the candidate’s experience, position requirements and business needs, we reserve the right to consider candidates at any level for which this position has been advertised.

BS degree in engineering from an accredited engineering school.
- OR –
BS degree in engineering from an accredited engineering school and five (5) years of related engineering experience, or a MS degree from an accredited engineering school and four (4) years of related engineering experience, or a Ph.D. from an accredited engineering school and zero (0) years of related experience.
 - OR –
BS degree in engineering from an accredited engineering school and ten (10) years of direct engineering experience, or a MS degree from an accredited engineering school and eight (8) years of direct engineering experience, or Ph.D. and four (4) years of direct engineering experience.
 - OR –
BS degree in engineering from an accredited engineering school and a minimum of fourteen (14) years of direct engineering experience, or a MS degree from an accredited engineering school and twelve (12) years of direct engineering experience, or PhD. degrees and nine (9) years direct engineering experience.
Understanding of robotic system kinematics and controls.
Strong C/C++ programming skills and experience.
Experience with coding in Python.
Experience with Linux development environments.
Experience with VxWorks.
Experience with Matlab/Simulink code generation.
Experience with user interface development.
Experience with code version control.

Preferences:
Experience with:
Linux drivers for COTS devices/electronics.
Motor Control for Robotic Systems.
CFS (Core Flight System).
Visual Studio.
QT
ROS (Robot Operating System).
Git version control system.
Essential Requirements
Must be a U.S. Citizen and successfully complete a U.S. government background investigation.
Applicant selected may be subject to government security investigation and must meet eligibility requirements for access to classified information.
Work may involve sitting for extended periods.
May require lifting and carrying up to 25 lb.
Must have sufficient mobility to enter areas of test facilities where necessary.
Generally an office environment, but can involve inside or outside work depending on task.
Standard office equipment (PC, telephone, fax, etc.)
Regular attendance in accordance with established work schedule is critical.
Ability to work outside normal schedule and adjust schedule to meet peak periods and surge requirements when required.
Must be able to work in a team atmosphere.
Must put forward a professional behavior that enhances productivity and promotes teamwork and cooperation.
Grooming and dress must be appropriate for the position and must not impose a safety risk/hazard to the employee or others.
This position may require some commuting and traveling to other installations as needed.

Don’t miss out on this great opportunity; for immediate consideration, apply now!
Must be a U.S. Citizen and successfully complete a U.S. government background investigation.
Management has the prerogative to select at any level for which this position has been advertised.

Barrios Technology is an Equal Employment Employer. All qualified applicants will receive consideration for employment without regard to race, color, religion, disability, sex, sexual orientation, gender identity or expression, age, national origin, veteran status, genetic information, union status and/or beliefs, or any other characteristic protected by federal, state, or local law."
44,Software Engineer,"Houston, TX",Houston,TX,None Found,None Found,None Found,"Possess effective interpersonal skills.
Ability to communicate effectively both orally and in writing.
Ability to analyze a problem and develop a solution.
Ability to establish goals and objectives and plan methods to achieve these goals.
Demonstrate stability of performance under pressure and/or opposition.
Ability to be scheduled for work on short notice and overtime – nights, days, Saturdays or holidays – and travel on short notice.
Possess above average investigative skills.
Possesses good technical skills in computer hardware, software and computer operations techniques and procedures.
Possess effective organizational skills.
Possess a basic understanding of the health care industry and the specific information systems technologies and concepts employed to satisfy the Enterprise Information Systems direction.
Ability to make decisions based on facts, intuition and experience and assume responsibility for those decisions.
","Bachelors Degree from an accredited college or university with a minimum of 24 semester hours in computer and/or analytical related studies (pref. degree in Computer Information Systems, Computer Science, Management Information Systems, etc.) and a minimum of 3 years of prior experience in application systems programming design and analysis with emphasis and experience in the skills listed in the base requirements on the attached sheet for the system specified.
Or a a minimum of 5 years of prior experience in application systems programming design and analysis with emphasis in the base requirements on the attached sheet for the system specified.
One (1) year minimum experience with the specified system. Related application programming experience in a similar development environment may be substituted.
",None Found,"Bachelors Degree from an accredited college or university with a minimum of 24 semester hours in computer and/or analytical related studies (pref. degree in Computer Information Systems, Computer Science, Management Information Systems, etc.) and a minimum of 3 years of prior experience in application systems programming design and analysis with emphasis and experience in the skills listed in the base requirements on the attached sheet for the system specified.
Or a a minimum of 5 years of prior experience in application systems programming design and analysis with emphasis in the base requirements on the attached sheet for the system specified.
One (1) year minimum experience with the specified system. Related application programming experience in a similar development environment may be substituted.
","Work Location(s)
Houston TX
Duration
6 Months

Summary
This position is accountable for the analysis, development, maintenance and testing of software applications and/or programs as it relates to the ABCBS Private Programs application systems. These activities include development and maintenance of programs, preparation of test data, program coding and documentation. The incumbent is expected to make recommendations of workable solutions to processing problems.
Job Description
This position reports to an Information Systems Supervisor within Information Systems. The Systems Analyst Programmer performs the majority of his/her assigned tasks in a project team environment with direct supervision from the project supervisor or senior member of the project team. Most job activities are performed in the realm of small systems, subsystems, or programs, and their general relationship to the project or system. The incumbent works closely with members of the Information Systems team, systems and user business analysts, data warehouse staff, other enterprise wide technical staff, as well as the internal and external users to ensure user/customer requests, problems, and questions are researched and resolved in a timely manner. An individual in this position is able to formulate logical statements of business problems and devise effective solutions to these problems through the use of proposed manual procedures, an existing automated system or a proposed automated system. Assignments include analysis, data gathering, program logic development, coding, testing, documentation and various other tasks as requested by the project supervisor. The Systems Analyst Programmer is expected to conduct detailed analysis of defined system specifications.
Communication
The incumbent must possess excellent communication skills, both oral and written to ensure that a productive and cooperative climate is maintained with all customers of the ABCBS Private Programs systems, the Blue Cross Association, various vendors and other Enterprise team members.
Skills and Competencies
Possess effective interpersonal skills.
Ability to communicate effectively both orally and in writing.
Ability to analyze a problem and develop a solution.
Ability to establish goals and objectives and plan methods to achieve these goals.
Demonstrate stability of performance under pressure and/or opposition.
Ability to be scheduled for work on short notice and overtime – nights, days, Saturdays or holidays – and travel on short notice.
Possess above average investigative skills.
Possesses good technical skills in computer hardware, software and computer operations techniques and procedures.
Possess effective organizational skills.
Possess a basic understanding of the health care industry and the specific information systems technologies and concepts employed to satisfy the Enterprise Information Systems direction.
Ability to make decisions based on facts, intuition and experience and assume responsibility for those decisions.
Minimum Job Requirements and Responsibilities
Application Systems Programming includes performance in the areas of analysis, design, coding, testing and implementation and documentation of system projects.
Level 1
Bachelors Degree from an accredited college or university with a minimum of 24 semester hours in computer and/or analytical related studies (pref. degree in Computer Information Systems, Computer Science, Management Information Systems, etc.) and a minimum of 3 years of prior experience in application systems programming design and analysis with emphasis and experience in the skills listed in the base requirements on the attached sheet for the system specified.
Or a a minimum of 5 years of prior experience in application systems programming design and analysis with emphasis in the base requirements on the attached sheet for the system specified.
One (1) year minimum experience with the specified system. Related application programming experience in a similar development environment may be substituted.
Level 2
Bachelors Degree from an accredited college or university with a minimum of 24 semester hours in computer and/or analytical related studies (pref. degree in Computer Information Systems, Computer Science, Management Information Systems, etc.) and a minimum of 3 years of prior experience in application systems programming design and analysis with emphasis and experience in the skills listed in the base requirements on the attached sheet for the system specified.
Or a a minimum of 5 years of prior experience in application systems programming design and analysis with emphasis in the base requirements on the attached sheet for the system specified.
Two (2) years minimum experience with the specified system. Related application programming experience in a similar development environment may be substituted.
Two (2) years minimum experience with the database design and database access methods for systems specified.
One (1) year minimum experience with skills identified in Systems Analyst Programmer Level 2 & 3 requirements on the attached sheet for the system specified.
Internal - Production Support Team detailed knowledge of one (1) ABCBS Private Program System supported by Production Support Team.
Level 3
Bachelors Degree from an accredited college or university with a minimum of 24 semester hours in computer and/or analytical related studies (pref. degree in Computer Information Systems, Computer Science, Management Information Systems, etc.) and a minimum of 4 years of prior experience in application systems programming design and analysis with emphasis and experience in skills listed in the base requirements on the attached sheet for the system specified.
Or a a minimum of 6 years of prior experience in application systems programming design and analysis with emphasis in the base requirements on the attached sheet for the system specified.
Three (3) years minimum experience with the specified system. Related application programming experience in a similar development environment may be substituted.
Three (3) years minimum experience with skills identified in Systems Analyst Programmer Level 2 & 3 requirements on the attached sheet for the system specified.
Three (3) years minimum experience with the database design and database access methods for systems specified. Related database access methods may be substituted.
Project Management Experience - must have participated in a minimum of three large scale projects with heavy user interfacing. Successful completion of the project (e.g. implementation, problem resolution and user satisfaction) must be shown.
Internal - Production Support Team detailed knowledge of two (2) ABCBS Private Program Systems supported by Production Support Team.
Principal Activities or Accountabilities
Ensure that the project supervisor is adequately informed concerning the status of all assigned tasks.
Ensure that all assigned tasks are completed accurately and by the assigned target dates and within cost estimates.
Become knowledgeable of company functions to the level necessary to accomplish assigned tasks.
Formulate solutions to business problems through the use of data processing concepts and techniques.
Enhance programming skills including coding, testing, debugging and documentation.
Consult with users to identify current operating procedures and to clarify program objectives.
Write documentation to describe program, development, logic, coding, and corrections.
Use standard application design principles to create appropriate logical and physical application designs to promote efficiency and code reuse so systems operate at highest level of efficiency.
Follow corporate standards in naming conventions, security, and interface design.
Thoroughly test and debug/fix code.
Ensure positive working relationships exist with all customers.
Become familiar with the ABCBS Private Programs applications and operational usage of the applications.
Ensure that a cooperative and productive climate is maintained with all internal and external contacts.
Contribute to and support enterprise-wide undertakings and commitments.
Contribute to and support the enterprise strategic and operational planning process to include total quality management philosophies.
Become knowledgeable of, and adhere to Corporate and ABCBS Information Systems standards and policies.
Base Requirements
Operating Systems
OS/390
Wind Vista
Windows 7
Data Access Method
DB2
SQL Server
Programming Languages
C,C#
.NET
ASP
VB.NET
ADO.NET
Visual
FoxPro
SQL
Scripting Languages Job Control
VBScript
Web Technologies
XML
HTML
JavaScript
Application Development Tools
Microsoft Applications
Reporting
Crystal Enterprise Reporting
Level 2 & 3 Requirements
DB2 Stored Procedures
Web Services
Security Requirements
This position is identified as level three (3). This position must ensure the security and confidentiality of records and information to prevent substantial harm, embarrassment, inconvenience, or unfairness to any individual on whom information is maintained. The integrity of information must be maintained as outlined in the company Administrative Manual.
Segregation of Duties
Segregation of duties will be used to ensure that errors or irregularities are prevented or detected on a timely basis by employees in the normal course of business. This position must adhere to the segregation of duties guidelines in the Administrative Manual."
45,"Engineer, Software","Houston, TX 77034",Houston,TX,77034,None Found,None Found,None Found,None Found,None Found,None Found,"JOB TITLE: Software Engineer LOCATION: Houston, TX
JOB SUMMARY: Our Software Engineers are the backbone of a dynamic product development organization. They continually enhance our product offerings and provide unique and innovative solutions for our clients. Software Engineers work closely with safety lifecycle management experts and Process Engineers to develop new features and products, support existing applications and code, perform testing and QA activities and provide research and prototypes for new technologies. Duties will include maintaining and supporting production web applications for the company and our clients. Developers are expected to conduct their work with minimal guidance and to have a proactive and resourceful approach when solving problems.
RESPONSIBILITIES:
Application support: bug fixes, updates to existing application code
New application and feature development based on specifications
Platform enhancements and support
3rd party software integration and interfacing
Report development
Code and feature testing, QA activities
Support and develop deployment, conversion and maintenance tools
Conduct research and prototyping activities
REQUIRED EXPERIENCE:
Bachelorâ€™s degree in computer science
Strong written and verbal communication skills
Ability to work in a team environment
Ability to handle multiple priorities, work accurately, work under pressure and respond quickly to tight deadlines
Positive attitude and self-starter mentality
Execution and results oriented
Functions effectively as a team player
TECHNICAL REQUIREMENTS AND QUALIFICATIONS:
REQUIRED QUALIFICATIONS: Potential Candidates should be able to show 1-5 yearsâ€™ experience in two or more of the following criteria:
PHP and Web Technology Development (CSS3, JavaScript, HTML5)
Demonstrable MVC Pattern Experience
Experience with MVC Frameworks (CodeIgniter, Zend, Symfony)
Experience with Web UI Frameworks (JQuery, AngularJS, DoJo)
Experience with Systems Administration (Windows, Linux)
Experience with Database Development and Optimization (MS SQL, Oracle, MySQL)
Experience with Cloud Infrastructure Environments (Amazon EC3, Azure, VMWare)
Experience with ERP Server Integration or Systems Integration Tools (SSIS, SAP BI, PeopleSoft)
DESIRED QUALIFICATIONS
Experience with the CodeIgniter MVC framework
Experience working with SQL Server and MySQL database systems
Minimum 3-5 yearsâ€™ work experience developing enterprise software solutions in .NET
Experience with SAP and their set of integration APIs
Experience in Database Optimization
Experience deploying and managing Windows Server based infrastructure
Experience integrating with process control systems (OPC-DA, OPC A&E, OPC-UA)"
