,Title,Location,City,State,Zip,Country,Qualifications,Skills,Responsibilities,Education,Requirement,FullDescriptions
118,LAMP Software Engineer,"Houston, TX",Houston,TX,None Found,None Found,None Found,None Found,None Found,None Found,None Found,"DISA Global Solutions is a fast-paced, growing company focused on providing safety and compliance solutions, which include drug and alcohol testing, background screening, occupational health screening, transportation compliance, and safety and substance abuse training. We are headquartered in Houston, Texas with over 800 employees. DISA has specialized in promoting workplace health and safety for over 25 years and has a strong market presence in the energy and transportation sector. We are IT innovators and developed one of the most advanced platforms to support our clients’ access to data. DISA is highly committed to quality and service excellence.

DISA employees are offered a competitive pay and benefits package and a fun and exciting place to work. We have a collaborative and team-oriented culture with numerous opportunities of career advancement. We offer monthly appreciation events and strive to provide a learning environment where each employee is encouraged to participate in continuing education and training.

Job Overview:

Designs and develops computer programs that automate specific business processes. Ideal candidates will use existing knowledge and experience in conjecture with problem solving skills to create solutions meeting both internal and external business needs.

A day in the life of:

You will consult with business analysts to analyze and understand functions that are to be automated, client needs, objectives, desired features, and input and output requirements
You will write and maintains functional and technical specification.
You will convert design and specifications into computer code.
You will compile code into programs and correct errors detected in the compilation process.
You will create and test transactions and run test to find errors and confirms that the program meets specifications.
You will analyzes codes to find causes of errors and revises programs.
You will write and maintain documentation to describe program development, logic, coding, testing, changes and corrections.
You will provide technical assistance by responding to inquiries regarding errors, problems, or questions with programs.
You will perform maintenance of existing custom software, including end-user support.
You will monitor performance of programs after implementation.

Our Ideal Candidate:

Has significant experience working with LAMP.
Has Python and Perl knowledge.
Has experience with MySQL, PHP.
Has experience with HTML, CSS, jQuery, JavaScript, AJAX, json.
Has experience using API's to perform actions on 3rd party services.
Has a Bachelor's degree in computer science, electrical engineering, computer engineering, or a related degree; or an associate's degree in computer science.
Has 5 years’ experience working in a software development capacity.
Has the preferred experience of using Git version control software.

DISA is an equal opportunity at will employer and does not discriminate against any employee or applicant for employment because of age, race, religion, color, disability, sex, sexual orientation or national origin."
119,Senior Back End Java Software Engineer,"Houston, TX 77002",Houston,TX,77002,None Found,None Found,None Found,None Found,None Found,None Found,"Our Corporate & Investment Bank relies on innovators like you to build and maintain the technology that helps us safely service the world’s important corporations, governments and institutions. You’ll develop solutions for a bank entrusted with holding $18 trillion of assets and $393 billion in deposits. CIB provides strategic advice, raises capital, manages risk, and extends liquidity in markets spanning over 100 countries around the world.
As an experienced member of our Software Engineering Group we look first and foremost for people who are passionate around solving business problems through innovation & engineering practices. You will be required to apply your depth of knowledge and expertise to all aspects of the software development lifecycle, as well as partner continuously with your many stakeholders on a daily basis to stay focused on common goals. We embrace a culture of experimentation and constantly strive for improvement and learning. You’ll work in a collaborative, trusting, thought-provoking environment—one that encourages diversity of thought and creative solutions that are in the best interests of our customers globally

This role requires a wide variety of strengths and capabilities, including:

BS/BA degree or equivalent experience
Expertise in application, data and infrastructure architecture disciplines
Advanced knowledge of architecture, design across all systems
Experience in building high-performance latency-sensitive back-end applications.
In-depth knowledge and experience of Java 8+, with excellent core understanding
Strong experience in building concurrent / multi-threaded software in Java
Strong experience in Object Orientated design.
Strong computer science foundations.
A clear understanding of messaging technologies, including HTTP and message buses.
Experience in running, maintaining, and troubleshooting software deployed to Linux
Experience in full software development lifecycle with agile methodologies.
Experience in test driven development using modern source control and continuous integration.
Strong interpersonal and communication skills
Strong organisational ability, time and project management skills to juggle many priorities
Knowledge of industry wide technology strategies and best practices
Keen understanding of financial control and budget management
Ability to work in large, collaborative teams to achieve organizational goals, and passionate about building an innovative culture

Ideally, you would also have:

Experience in forex (FX), options, emerging markets, commodities, or rates products
Experience developing web-based applications, preferably with large user bases
Experience with the following tools & technologies
Python
Spring
Tomcat
ActiveMQ / ZeroMQ / Tibco / MQ / similar
TCP / UDP
FIX

When you work at JPMorgan Chase & Co., you’re not just working at a global financial institution. You’re an integral part of one of the world’s biggest tech companies. In 14 technology hubs worldwide, our team of 40,000+ technologists design, build and deploy everything from enterprise technology initiatives to big data and mobile solutions, as well as innovations in electronic payments, cybersecurity, machine learning, and cloud development. Our $9.5B+ annual investment in technology enables us to hire people to create innovative solutions that will not only transform the financial services industry, but also change the world.

At JPMorgan Chase & Co. we value the unique skills of every employee, and we’re building a technology organization that thrives on diversity. We encourage professional growth and career development, and offer competitive benefits and compensation. If you’re looking to build your career as part of a global technology team tackling big challenges that impact the lives of people and companies all around the world, we want to meet you."
120,Software Test Automation Engineer,"Houston, TX",Houston,TX,None Found,None Found,None Found,None Found,None Found,None Found,None Found,"About TTC

The Testing Consultancy (TTC) is a global specialist software testing company with a focus on helping organizations transform the way they deliver quality software. We have broad capabilities across a wide range of testing areas that enable our clients to increase the speed and quality of software development while reducing risk and cost.

Perks of working for TTC


Competitive Base Salary
Medical, Dental, Vision Benefits
401K w/ company match
Paid Time Off
Paid Holidays
Work Life Balance
Relaxed Work Environment
Growth and Development Opportunities

Responsibilities


Assess and develop good understanding of customer's manual and automated testing needs
Maintain hands-on involvement in test execution, test automation and risk coverage analysis
Review functional and non-functional requirements and specifications
Produce Test Artifacts such as Test Strategy, Test Plan, Test Cases and Test Metrics reports
Build and support automated testing frameworks based on various technologies
Deliver good quality work internally and at the customer site while meeting project deadlines
Maintain excellent relationships with key customer stakeholders and manage their expectations

Role Requirements


Capable of executing and completing assigned projects within the time, scope, and budget negotiated with the client
Skilled at evaluating existing processes and procedures and making recommendations for improvement; designing prototypes and proof of concepts that best fit client needs
Hands-on experience with test automation tools and frameworks
Excellent communication and customer- facing skills
Strong decision- making and problem- solving skills from both a business and systems perspective
Highly self-motivated and directed
Capable of effectively prioritizing and executing tasks in a high-pressure environment
Able to facilitate open discussion and construct debate
Experience working in Agile and traditional development environments
Experience with working /deploying in a Linux environment
Performance test planning, scripting and execution
Experience with Cucumber / Gherkin testing framework
Configuration and provisioning tools like Jenkins for CI testing
Experience testing with continuous integration in a high-volume production environment
AWS experience (Cloud Formation, resource provisioning and management)

Technical Skills


Experience in automated testing with one or more automation tools; Tosca preferred
Hands-on technical expertise in programming, development tools and methodologies and system protocols
Understanding of database concepts and good knowledge of SQL
Familiarity with API testing (SOAP and/or REST) and UI testing
Experience in business requirements analysis and test case design using Test Case management tools: ALM, TFS, JIRA plug-ins, etc.
Ability to document defects and track them to resolution using defect management tools: JIRA, Quality Center, TFS, etc.
Experience with programming languages
Relational Databases (MySQL, Postgres)
RESTful web service design

Qualifications


Bachelor's degree in Computer science, Engineering or related fields preferred
Minimum of 3 years' experience in Software Development and/or Quality Assurance

Travel Requirements


25% Travel may be required

"
121,Lead Software Engineer - Spacecraft,"Houston, TX 77027",Houston,TX,77027,None Found,"BS degree in engineering from an accredited engineering school and ten (10) years of direct engineering experience, or a MS degree from an accredited engineering school and eight (8) years of direct engineering experience, or Ph.D. and four (4) years of direct engineering experience.
Experience with leading small teams of software developers and engineers.
Experience with planning and executing software development tasks.
Experience developing software across the full development life cycle.
Proficiency with C & C++ coding.
Proficiency with Linux.
Experience with Agile Development tools and processes.
Excellent communication, negotiation and coordination skills and strong customer service attitude.
Experience with at least one microcontroller architecture (e.g. ATmega, MSP430, ARM M0/3/4).
Experience in at least one of the following specialty areas:
Spacecraft Systems Engineering and Integration.
Battery Management Systems.
Power Distribution.
Interface design.
Data Integration and Flow Analysis.
Safety Critical Spacecraft or Avionics Systems.
Failure Mode Effects and Criticality Analysis.
Fault Detection, Isolation and Recovery (FDIR) for Distributed Avionics Architectures.
","BS degree in engineering from an accredited engineering school and ten (10) years of direct engineering experience, or a MS degree from an accredited engineering school and eight (8) years of direct engineering experience, or Ph.D. and four (4) years of direct engineering experience.
Experience with leading small teams of software developers and engineers.
Experience with planning and executing software development tasks.
Experience developing software across the full development life cycle.
Proficiency with C & C++ coding.
Proficiency with Linux.
Experience with Agile Development tools and processes.
Excellent communication, negotiation and coordination skills and strong customer service attitude.
Experience with at least one microcontroller architecture (e.g. ATmega, MSP430, ARM M0/3/4).
Experience in at least one of the following specialty areas:
Spacecraft Systems Engineering and Integration.
Battery Management Systems.
Power Distribution.
Interface design.
Data Integration and Flow Analysis.
Safety Critical Spacecraft or Avionics Systems.
Failure Mode Effects and Criticality Analysis.
Fault Detection, Isolation and Recovery (FDIR) for Distributed Avionics Architectures.
",None Found,"BS degree in engineering from an accredited engineering school and ten (10) years of direct engineering experience, or a MS degree from an accredited engineering school and eight (8) years of direct engineering experience, or Ph.D. and four (4) years of direct engineering experience.
Experience with leading small teams of software developers and engineers.
Experience with planning and executing software development tasks.
Experience developing software across the full development life cycle.
Proficiency with C & C++ coding.
Proficiency with Linux.
Experience with Agile Development tools and processes.
Excellent communication, negotiation and coordination skills and strong customer service attitude.
Experience with at least one microcontroller architecture (e.g. ATmega, MSP430, ARM M0/3/4).
Experience in at least one of the following specialty areas:
Spacecraft Systems Engineering and Integration.
Battery Management Systems.
Power Distribution.
Interface design.
Data Integration and Flow Analysis.
Safety Critical Spacecraft or Avionics Systems.
Failure Mode Effects and Criticality Analysis.
Fault Detection, Isolation and Recovery (FDIR) for Distributed Avionics Architectures.
",None Found,"Are you passionate about human space exploration or understanding the origins of the universe, and working with a dynamic and diverse team to make a difference? If you are, we need you!
We need your commitment, teamwork, and energy to help us achieve great things that inspire humans all over the globe. We need you to bring innovative ideas and diverse backgrounds to help us envision, shape, and deliver systems that will benefit the quality of life of people around the world. We are excited about what we do, and we need you on our team as we take on new challenges for NASA’s pursuits in deep space exploration. Jacobs is NASA’s largest engineering solutions provider working alongside NASA at centers across the United States.
We have the unique and significant role to partner with NASA at Johnson Space Center (JSC), to be part of every human spaceflight program – the International Space Station (ISS), NASA’s Orion spacecraft, which will carry astronauts into deep space, and Gateway, the orbiting platform providing the home for astronauts to work and travel back and forth to the moon’s surface, and serving as the platform for deep space exploration. From critical systems on the ISS to enable astronauts to live and work in space; to performing advanced development for systems leading to deep space exploration; to being part of the foundation for Gateway.
We also partner with NASA at JSC, the only NASA center in the United States to curate all astromaterial samples returned from exploration missions, to perform curation services, orbital debris analysis, and basic research to further humankind’s understanding of the origins of our solar system.
We need you to be a part of our team!
We are currently in need of a Lead Software Engineer - Spacecraft to join our team. Do you have the following skills?

As a Lead Software Engineer - Spacecraft you will:
Lead a team of software developers and engineers in developing new and modified flight software capabilities and improvements.
Develop software for both flight computer systems and embedded microcontroller devices.
Develop and document system architecture.
Perform Agile project planning, management and execution.
Plan and implement the software development process.
Lead and participate in code, design and test reviews.
Lead testing and verification efforts.
Work with subject matter experts to identify and document software requirements for new capabilities and incremental improvements.
Perform requirements traceability analyses.
Evaluate software development tools and implementation of the software development tool chain.
Ensure that coding standards are met.
Ensure appropriate version control and configuration management are implemented.
Troubleshoot problems or defects and recommend changes.
Perform other duties as required.
Qualifications
Required Education/Experience/Skills:
This position has been posted at multiple levels. Depending on the candidate's experience, requirements and business needs, we reserve the right to consider candidates at any level for which this position has been advertised.
BS degree in engineering from an accredited engineering school and ten (10) years of direct engineering experience, or a MS degree from an accredited engineering school and eight (8) years of direct engineering experience, or Ph.D. and four (4) years of direct engineering experience.
Experience with leading small teams of software developers and engineers.
Experience with planning and executing software development tasks.
Experience developing software across the full development life cycle.
Proficiency with C & C++ coding.
Proficiency with Linux.
Experience with Agile Development tools and processes.
Excellent communication, negotiation and coordination skills and strong customer service attitude.
Experience with at least one microcontroller architecture (e.g. ATmega, MSP430, ARM M0/3/4).
Experience in at least one of the following specialty areas:
Spacecraft Systems Engineering and Integration.
Battery Management Systems.
Power Distribution.
Interface design.
Data Integration and Flow Analysis.
Safety Critical Spacecraft or Avionics Systems.
Failure Mode Effects and Criticality Analysis.
Fault Detection, Isolation and Recovery (FDIR) for Distributed Avionics Architectures.
Preferences:
Experience with:
Scripting languages such as Python.
Hardware/Software Integration.
Software coding standards.
Software configuration management tools such as GitLab.
Issue tracking tools such as Jira.
Project and task scheduling tools such as Microsoft Project.
Software engineering for safety critical systems.
Spacecraft Avionics and Software Architecture.
NASA software and systems development requirements and standards.
Core Flight Software (CFS).
Software project management.
Why Work for Jacobs?
For more information on our partnership with NASA at Johnson Space Center, please click on the links below:
See What We Do
Jacobs Aerospace Solutions Overview

( Please view in Chrome or Microsoft Edge. )
In addition to exciting career opportunities, we also offer:
Excellent personal and professional career growth.
9/80 work schedule (every other Friday off).
Onsite cafeteria (breakfast & lunch).
Comprehensive Benefit Package (medical, dental & vision).
401(k).
Tuition Reimbursement.
Much, much more!
Must be a U.S. Citizen and successfully complete a U.S. government background investigation.

Management has the prerogative to select at any level for which this position has been advertised.

Come join our team and be a part of our future - we look forward to seeing you!
Please visit our career page at: www.wehavespaceforyou.com .
Essential Functions

Work Environment

Generally an office environment, but can involve inside or outside work depending on task.
Physical Requirements

Work may involve sitting or standing for extended periods (90% of time). May require lifting and carrying up to 25 lbs (5% of time).
Equipment and Machines

Standard office equipment (PC, telephone, printer, etc.).
Attendance

Regular attendance in accordance with established work schedule is critical. Ability to work outside normal schedule and adjust schedule to meet peak periods and surge requirements when required.
Other Essential Functions

Must be able to work in a team atmosphere. Must put forward a professional behavior that enhances productivity and promotes teamwork and cooperation. Grooming and dress must be appropriate for the position and must not impose a safety risk/hazard to the employee or others.
Jacobs is an Equal Opportunity/Affirmative Action Employer. All qualified applicants will receive consideration for employment without regard to race, color, religion, sex, sexual orientation, gender identity, national origin, disability, veteran status or other characteristics protected by law. Jacobs is a background screening, drug-free workplace."
122,LIMS Architect,"Sugar Land, TX",Sugar Land,TX,None Found,None Found,"Bachelor's Degree from an accredited college or university in Information Systems, Information Technology, Computer Science or Engineering with experience in software development, testing and support of business applications and technologies
Minimum 3 years of hands on development/configuration experience using Lab Information Management System, preferably in the Oil & Gas industry",None Found,"IT Ownership for the Laboratory Information Management system application (StarLIMS )
The software engineer/analyst will be responsible for projects, enhancements, support & maintenance of laboratory solutions using StarLIMS, SDMS and other technologies as required.
Work with key stakeholders to clarify requirements and prioritize enhancement backlog
Take an ownership role of the support queue to reduce resolution times
Participate in reviews and status updates with development lead
Resolve production support issues
Resolve platform and technical issues",None Found,"Bachelor's Degree from an accredited college or university in Information Systems, Information Technology, Computer Science or Engineering with experience in software development, testing and support of business applications and technologies
Minimum 3 years of hands on development/configuration experience using Lab Information Management System, preferably in the Oil & Gas industry","Essential Responsibilities:

IT Ownership for the Laboratory Information Management system application (StarLIMS )
The software engineer/analyst will be responsible for projects, enhancements, support & maintenance of laboratory solutions using StarLIMS, SDMS and other technologies as required.
Work with key stakeholders to clarify requirements and prioritize enhancement backlog
Take an ownership role of the support queue to reduce resolution times
Participate in reviews and status updates with development lead
Resolve production support issues
Resolve platform and technical issues

Qualifications/Requirements:
Bachelor's Degree from an accredited college or university in Information Systems, Information Technology, Computer Science or Engineering with experience in software development, testing and support of business applications and technologies
Minimum 3 years of hands on development/configuration experience using Lab Information Management System, preferably in the Oil & Gas industry

Desired Characteristics:

Knowledge and experience with all aspects of StarLIMS Laboratory management system, including: configuration, testing, implementation, deployment, and support and maintenance

Experienced in NET, C#, VB, JavaScript development
3rd party Software interface like SAP/MES is a Plus
Strong relational database skills, preferably with SQL Server
Development experience with Crystal Reports is a plus
Proven technical, analytical and problem resolution skills
Ability to work in a globally distributed team environment
Added Advantage: STARLIMS 11

Locations:

Sugarland, TX


This is your opportunity to learn more, do more, live the career you have imagined and be part of a truly diverse organization.


Baker Hughes, a GE company is an Equal Opportunity Employer. Employment decisions are made without regard to race, color, religion, national or ethnic origin, sex, sexual orientation, gender identity or expression, age, disability, protected veteran status or other characteristics protected by law. Learn more

Job: Digital Technology
Primary Location: North America-United States-Texas-SUGAR LAND"
123,DevOps Engineer,"Houston, TX",Houston,TX,None Found,None Found,None Found,None Found,None Found,None Found,None Found,"Requirements:
B.Sc. or M.Sc. in Computer Science or equivalent
Minimum 5+ years of total experience
Minimum 2+ years of experience on DevOps or equivalent.
Strong experience on Python or equivalent language.
Experience with DevOps on public cloud. The preference is Azure.
Experience with Ansible and/or Terraform
Experience with DevOps on Kubernetes
Experience with monitoring tools like ELK and Prometheus.
Working experience on Git and build tools
Excellent oral and written communication skills
Ability to be versatile and handle multiple tasks and re-prioritizations
Ability to maintain self-motivation and to work independently and in team environment

Nice to have:
Working experience with a Kubernetes package manager like Helm.
Working experience with data science tools
Understanding of application security standards and practices
Knowledge and experience in developing software using agile methodologies"
