,Title,Location,City,State,Zip,Country,Qualifications,Skills,Responsibilities,Education,Requirement,FullDescriptions
13,Senior Manager Central Monitoring,"Northbrook, IL 60062",Northbrook,IL,60062,None Found,"
BS/BA degree in a biological science, statistics, health-related or computer science field. Advanced degree preferred.
Generally, 7 plus years related experience in pharmaceutical, clinical research or health services industry with a minimum of 5 years' experience as clinical study manager, data manager or biostatistician, with progressive levels of responsibility.
Demonstrated data analytical and/or site monitoring skills in multiple development programs, inclusive of all activities from program inception to regulatory submission.
Experience in multiple Therapeutic Areas or disease state/indications desired.
Regulatory submission experience.
Proven excellent leadership and subject matter expertise for key process improvement initiatives.
Active contribution to inspections and major (vendor) audits.
Proven skills in outsourced vendor oversight.
Strong cross-functional understanding of processes of clinical study management, data management, clinical programming, and biostatistics with senior level expertise expected in at least one of those disciplines.
Strong computer skills, including database management software, data analysis &reporting tools, project management tools, etc.
Excellent verbal & written communication and critical thinking skills.
Proven ability to work with and influence individuals across multiple functions and disciplines.
",None Found,"
Develop the centralized monitoring plan, incorporating feedback and discussion with the study team to capture the study requirements for centralized and statistical monitoring.
Contribute to key activities of study start up: study risk assessment & identification and definition of critical data.
Lead the study team through the process of Key Risk Indicator (KRI) identification for study level centralized monitoring and definition of appropriate thresholds to effectively monitor study progress around the associated KRIs.
Key contact and lead for the setup of the statistical monitoring tool. Work with study team to make key decisions around data and settings that will support statistical monitoring.
Participate with study team in CRO evaluation and startup activities as required. As appropriate, Central Monitor should provide feedback on previous experiences with the potential vendors as it relates to centralized monitoring activities.
Provides the requirements for the set-up of any study-specific systems or tools supporting central monitoring data review.
",None Found,"
BS/BA degree in a biological science, statistics, health-related or computer science field. Advanced degree preferred.
Generally, 7 plus years related experience in pharmaceutical, clinical research or health services industry with a minimum of 5 years' experience as clinical study manager, data manager or biostatistician, with progressive levels of responsibility.
Demonstrated data analytical and/or site monitoring skills in multiple development programs, inclusive of all activities from program inception to regulatory submission.
Experience in multiple Therapeutic Areas or disease state/indications desired.
Regulatory submission experience.
Proven excellent leadership and subject matter expertise for key process improvement initiatives.
Active contribution to inspections and major (vendor) audits.
Proven skills in outsourced vendor oversight.
Strong cross-functional understanding of processes of clinical study management, data management, clinical programming, and biostatistics with senior level expertise expected in at least one of those disciplines.
Strong computer skills, including database management software, data analysis &reporting tools, project management tools, etc.
Excellent verbal & written communication and critical thinking skills.
Proven ability to work with and influence individuals across multiple functions and disciplines.
","Senior Manager Central Monitoring



Description
Developing innovative therapies is one of the most challenging, most essential and personally rewarding fields in science. This is the most exciting time to be a part of Astellas, a company with a uniquely collaborative and patient-focused culture.

There's something special about working at Astellas. It's reflected in our focus on the people we serve, the way we treat each other and the results we achieve together as a company.

Astellas is announcing a Senior Central Monitoring Manager position located in Northbrook, IL.

Purpose & Scope:

The Senior Central Monitoring (CM) Manager acts as a study level centralized monitoring contributor, supporting Astellas drug development projects of simple to moderate complexity. The incumbent requires limited supervision and day-to-day support from line management. The Senior Manager represents Data Science as a central monitoring subject matter expert and advocate for CM processes.

The Central Monitor will support the implementation and ongoing adaptation of procedures to ensure Astellas maintains a robust, comprehensive centralized monitoring program. This includes providing subject matter expertise to the development of processes and tools, and to oversee our external partnerships with vendors performing study level work.

Essential Job Responsibilities:

The Senior Central Monitoring Manager is responsible for developing and implementing the requirements of a centralized monitoring plan and performing all of the data driven components of centralized monitoring (including aggregate KRI review, statistical monitoring output review and site risk review) as key components of RBM. The aggregate KRI review by the Central Monitor supports CRO oversight and early trend and signal detection that will lead to better study integrity and data quality.

The Central Monitor provides strong subject expertise to key development project teams. Application of all end-to-end activities involved in centralized monitoring to support multiples drug development programs (3-5). Has a big picture understanding of how the data come together to support the submission strategy for the compound and has the ability to detect signals and/or trends in summarized data. Experienced in supporting multiple Therapeutic Areas.

The Central Monitor is responsible for collaborating with the cross-functional study team to establish the centralized monitoring strategy and requirements, conducting centralized monitoring during the study(s) and reconciling all centralized monitoring observations and documentation at the close of the study(s).

The following activities are the responsibilities of the Central Monitor:

Study Start:

Develop the centralized monitoring plan, incorporating feedback and discussion with the study team to capture the study requirements for centralized and statistical monitoring.
Contribute to key activities of study start up: study risk assessment & identification and definition of critical data.
Lead the study team through the process of Key Risk Indicator (KRI) identification for study level centralized monitoring and definition of appropriate thresholds to effectively monitor study progress around the associated KRIs.
Key contact and lead for the setup of the statistical monitoring tool. Work with study team to make key decisions around data and settings that will support statistical monitoring.
Participate with study team in CRO evaluation and startup activities as required. As appropriate, Central Monitor should provide feedback on previous experiences with the potential vendors as it relates to centralized monitoring activities.
Provides the requirements for the set-up of any study-specific systems or tools supporting central monitoring data review.
Study Conduct:

Review KRIs and statistical monitoring outputs in aggregate across sites, regions and countries. As needed, review study level operational and patient data to support the investigation and root cause analysis of observations.
Review and interpret multiple data sources to identify potential issues with study sites or data quality with the study team.
Conduct centralized monitoring per the study specific plan and quality procedures.
Support the team in assessment of centralized monitoring observations to identify potential issues and risks occurring during study conduct.
Track and investigate observations to determine best mitigation action and follow up.
Communicate centralized monitoring observations to study team and appropriate cross-functional partners.
Lead centralized monitoring observations review discussion.
For any fully outsourced work, ensure/oversee the execution of central monitoring including the documentation of centralized monitoring activities and inspection readiness.
Apply lessons learned to centralized monitoring, including update of the centralized monitoring plan and functional monitoring activities as required throughout the study conduct.
Participate in issue evaluation and risk review meetings.
Collaborate with study manager to investigate any identified issues with CRO monitoring partners, based on centralized monitoring findings.
Complete corrective and preventive actions related to identified issues as required
Study Close:

Throughout the study, and at study close, ensure all observations, investigations, actions and communication are documented and adequately stored in study team files.
Participate in lessons learned discussions with cross-functional study team.
RBM Process Improvement:

Contribute to activities that define, deliver, and optimize the centralized monitoring capabilities and processes
Participate in discussions regarding identification of new KRIs for inclusion in Astellas standard KRI library
Works with appropriate groups to obtain approval for new KRIs and addition to the KRI library
Provide recommendations on centralized monitoring best practice to internal and external stakeholders as required
Actively provide feedback on RBM and centralized monitoring process and areas for improvement.
Contribute to the development of centralized monitoring processes, work tools and training content.
May participate in vendor evaluation and provide feedback on performance as required.
Quantitative Dimensions:

The Data Science department provides statistical, biometrical, medical writing, centralized monitoring and data management/warehousing expertise for all R & D projects and marketed products, encompassing Phase I-IV studies.

Qualified centralized monitoring expertise for clinical studies is a regulatory requirement, and is carried out in accordance with international regulations (ICH, FDA, EMA) and internal Astellas SOPs and working practices.

The Senior Central Monitoring Manager supports approximately 3-5 compounds and is the study level CM Lead for all studies within those compounds.
The Senior Central Monitoring Manager provides oversight, consultation, advice and central monitoring process leadership to the multiple vendors supporting any study related outsourcing efforts.
Monitors KPIs and other key study metrics for assigned studies. Escalates any issues with study team, as necessary.
Organizational Context:

Reports to Director, Central Monitoring.
Peers - has between 2 - 4 peers at same level
Participates as an ad-hoc member to study level project teams
Independent worker, working under supervision of Line Manager.
No direct reports, but may oversee the activities of contract resources assigned to the individual studies within a drug program.
Closely collaborates with cross-functional study team members (e.g., GDOL, Study Manager, Data Manager, Statistician, Stats Programmer, Medical Monitor, etc.)
Interacts with GDOL, GSTATL, GMWrL and other core and extended drug development project team members as necessary.

Requirements
Qualifications:
Required

BS/BA degree in a biological science, statistics, health-related or computer science field. Advanced degree preferred.
Generally, 7 plus years related experience in pharmaceutical, clinical research or health services industry with a minimum of 5 years' experience as clinical study manager, data manager or biostatistician, with progressive levels of responsibility.
Demonstrated data analytical and/or site monitoring skills in multiple development programs, inclusive of all activities from program inception to regulatory submission.
Experience in multiple Therapeutic Areas or disease state/indications desired.
Regulatory submission experience.
Proven excellent leadership and subject matter expertise for key process improvement initiatives.
Active contribution to inspections and major (vendor) audits.
Proven skills in outsourced vendor oversight.
Strong cross-functional understanding of processes of clinical study management, data management, clinical programming, and biostatistics with senior level expertise expected in at least one of those disciplines.
Strong computer skills, including database management software, data analysis &reporting tools, project management tools, etc.
Excellent verbal & written communication and critical thinking skills.
Proven ability to work with and influence individuals across multiple functions and disciplines.


#LI-VB

Equal Opportunity Employer Minorities/Women/Protected Veterans/Disabled

Type Full-time

Location IL, Northbrook

Category Data Science"
14,"Consulting Statistician, Manager – US Research & Insights, Deloitte Services LP","Chicago, IL 60606",Chicago,IL,60606,None Found,"PhD in statistics or one of the quantitative social sciences
5+ years of experience doing hands-on, statistics-intensive work
Solid experience working in a consulting statistician capacity: ideating with clients, manifesting good communication skills, balancing multiple projects
Broad, solid knowledge of statistics with depth in one or more areas such as survey design/analysis, econometrics, or causal inference
Flair for Exploratory Data Analysis
Knowledge of core machine learning methods
Ability and eagerness to keep abreast of data-intensive developments in such fields as text analysis, social network analysis, Computational Social Science

To apply
Apply with a letter explaining why you are interested in this role and expanding upon your qualifications. Please include a full CV and two writing samples, ideally sole- or first-authored. One sample should be shorter (i.e., <1000 words) and one longer (i.e., >2000 words).",None Found,"Participates in discussions of research agendas of other R&I centers; help ideate project ideas
Help articulate the art of the possible; translate high-level research goals into the design of analytical projects
Help establish timelines; assist in the management of the data science group’s portfolio of projects
Peer review and help ensure the scientific quality and business relevance of the team’s work products
Review team members’ code as appropriate
Coach analysts in how to effectively communicate the results of their work in written and visual form
Help mentor junior data scientists; help them cultivate analytical and statistical skills
Serve as one of the group’s senior “sounding boards”, helping think through business, conceptual, and technical issues
Assist the team leader triage or refine project ideas based on feasibility, resource requirements, generalizability, relevance, etc
Suggest refinements of requests from other R&I leaders
Monitor project work for quality assurance and call attention to coding or methodological issues
Ensure that analytical results are being appropriately interpreted, communicated, and documented
Coach non-data science R&I members on the ‘art of the possible’ to address their ‘problem statement’ and derive insights
Help foster a culture of creativity & experimentation

Qualifications and Work Experience",None Found,None Found,"Consulting Statistician, Manager – US Research & Insights, Deloitte Services LP
The Manager, Consulting Statistician [SCS] of the Deloitte Research & Insights [R&I] Data Science group will help cultivate and manage a pipeline of data science and analytics projects. A primary focus of the projects will be to support the research goals of the rest of R&I, and other parts of the firm. The SCS will regularly ideate projects with other R&I industry and research leaders; help translate broad research goals into well-designed analytics projects; help oversee and ensure the scientific integrity of the team’s work; and help communicate findings to stakeholders. The SCS will also help cultivate talent and serve as a scientific mentor to other members of the data science team. The role is intended to add both significant statistical sophistication and consulting orientation to the data science group.

Role Responsibilities:

Participates in discussions of research agendas of other R&I centers; help ideate project ideas
Help articulate the art of the possible; translate high-level research goals into the design of analytical projects
Help establish timelines; assist in the management of the data science group’s portfolio of projects
Peer review and help ensure the scientific quality and business relevance of the team’s work products
Review team members’ code as appropriate
Coach analysts in how to effectively communicate the results of their work in written and visual form
Help mentor junior data scientists; help them cultivate analytical and statistical skills
Serve as one of the group’s senior “sounding boards”, helping think through business, conceptual, and technical issues
Assist the team leader triage or refine project ideas based on feasibility, resource requirements, generalizability, relevance, etc
Suggest refinements of requests from other R&I leaders
Monitor project work for quality assurance and call attention to coding or methodological issues
Ensure that analytical results are being appropriately interpreted, communicated, and documented
Coach non-data science R&I members on the ‘art of the possible’ to address their ‘problem statement’ and derive insights
Help foster a culture of creativity & experimentation

Qualifications and Work Experience
PhD in statistics or one of the quantitative social sciences
5+ years of experience doing hands-on, statistics-intensive work
Solid experience working in a consulting statistician capacity: ideating with clients, manifesting good communication skills, balancing multiple projects
Broad, solid knowledge of statistics with depth in one or more areas such as survey design/analysis, econometrics, or causal inference
Flair for Exploratory Data Analysis
Knowledge of core machine learning methods
Ability and eagerness to keep abreast of data-intensive developments in such fields as text analysis, social network analysis, Computational Social Science

To apply
Apply with a letter explaining why you are interested in this role and expanding upon your qualifications. Please include a full CV and two writing samples, ideally sole- or first-authored. One sample should be shorter (i.e., <1000 words) and one longer (i.e., >2000 words).
How you’ll grow
At Deloitte, our professional development plan focuses on helping people at every level of their career to identify and use their strengths to do their best work every day. From entry-level employees to senior leaders, we believe there’s always room to learn. We offer opportunities to help sharpen skills in addition to hands-on experience in the global, fast-changing business world. From on-the-job learning experiences to formal development programs, our professionals have a variety of opportunities to continue to grow throughout their career.

Benefits
At Deloitte, we know that great people make a great organization. We value our people and offer employees a broad range of benefits. Learn more about what working at Deloitte can mean for you.

Deloitte’s culture
Our positive and supportive culture encourages our people to do their best work every day. We celebrate individuals by recognizing their uniqueness and offering them the flexibility to make daily choices that can help them to be healthy, centered, confident, and aware. We offer well-being programs and are continuously looking for new ways to maintain a culture where our people excel and lead healthy, happy lives. Learn more about Life at Deloitte.

Corporate citizenship
Deloitte is led by a purpose: to make an impact that matters. This purpose defines who we are and extends to relationships with our clients, our people and our communities. We believe that business has the power to inspire and transform. We focus on education, giving, skill-based volunteerism, and leadership to help drive positive social impact in our communities. Learn more about Deloitte’s impact on the world.

Recruiter tips
We want job seekers exploring opportunities at Deloitte to feel prepared and confident. To help you with your interview, we suggest that you do your research: know some background about the organization and the business area you’re applying to. Check out recruiting tips from Deloitte professionals.

As used in this posting, “Deloitte” means Deloitte Services LP, a subsidiary of Deloitte LLP. Please see www.deloitte.com/us/about for a detailed description of the legal structure of Deloitte LLP and its subsidiaries.

All qualified applicants will receive consideration for employment without regard to race, color, religion, sex, sexual orientation, gender identity, national origin, age, disability or protected veteran status, or any other legally protected basis, in accordance with applicable law."
