,Title,Location,City,State,Zip,Country,Qualifications,Skills,Responsibilities,Education,Requirement,FullDescriptions
0,Senior Statistician,"Chicago, IL",Chicago,IL,None Found,None Found,None Found,None Found,None Found,None Found,None Found,"Job no: 495344 Work type: Regular Full-Time Location: Chicago – 55 East Monroe Street, IL Capability Area: Statistics & Methodology

JOB DESCRIPTION:
NORC at the University of Chicago is seeking Senior Statisticians to join our Statistics and Methodology department.


DEPARTMENT: STATISTICS & METHODOLOGY
The Statistics and Methodology department pioneers innovations in survey research, analytics, and data science. We work in collaboration with all NORC subject area departments, while also conducting our own industry research. In the survey research arena, members of our team help understand the cognitive processes underlying respondents’ reactions to surveys; design and implement rigorous, efficient methods for sampling from populations and weighting resultant survey data; and employ advanced techniques for analyzing and interpreting survey and secondary data. NORC statisticians utilize a broad range of analytic methods such as predictive modeling, survival analysis, item response theory, latent variable analysis, small area estimation, GIS/spatial analysis, psychometrics, and econometrics in deriving insights from data. NORC data scientists apply advanced techniques such as machine learning, natural language processing, data linkage, data visualization, network analysis, optimization, simulation, and parallel processing in working with large and multiple datasets.


RESPONSIBILITIES:
Write and implement computer programs to extract and manipulate data, make statistical calculations necessary for selecting samples, and perform other statistical analyses
Discuss and provide specifications for the construction of data files from which samples are drawn and from which variances, statistical weights, and standard errors are calculated
Perform quality control to ensure the accuracy of deliverables; contribute to and review the sampling and analytic sections of reports, final technical reports, and other deliverables
Work with the client on sampling and other statistical issues, provide technical information on the types of analyses, limitations of the data, as well as the strengths and weaknesses of various strategies
Calculate weights, non-response rates, and standard error estimates as part of documenting sample selection and implementation; carry out substantive analysis on projects with analytical deliverables
Manage, analyze, and interpret data to provide insights into important business issues
Perform statistical analyses, including developing and implementing predictive models

REQUIRED SKILLS:
Master’s or PhD degree in statistics, social sciences, or other quantitative program, or a Bachelor’s degree with equivalent experience in statistics, survey research, or related quantitative field
Ability to apply knowledge to quickly troubleshoot issues
Knowledge of the methods, principles, and processes of survey research and broad experience in the field
Strong skills in quantitative analysis. Statistical modelling experience including logistic regression with random effects, machine learning, and small area estimation
Expert skills in the use of computer software, especially packages for statistical analysis.
Strong verbal and written communication skills; ability to quickly understand, communicate and troubleshoot issues
Strong interpersonal and time management skills.
General familiarity with social science research and policy issues
Excellent quality control skills.

WHAT WE DO:
NORC at the University of Chicago is an objective, non-partisan research institution that delivers reliable data and rigorous analysis to guide critical programmatic, business, and policy decisions. Since 1941, our teams have conducted groundbreaking studies, created and applied innovative methods and tools, and advanced principles of scientific integrity and collaboration. Today, government, corporate, and nonprofit clients around the world partner with us to transform increasingly complex information into useful knowledge.


WHO WE ARE: For over 75 years, NORC has evolved in many ways, moving the needle with research methods, technical applications and groundbreaking research findings. But our tradition of excellence, passion for innovation, and commitment to collegiality have remained constant components of who we are as a brand, and who each of us is as a member of the NORC team. With world-class benefits, a business casual environment, and an emphasis on continuous learning, NORC is a place where people join for the stellar research and analysis work for which we’re known, and stay for the relationships they form with their colleagues who take pride in the impact their work is making on a global scale.

EEO STATEMENT:
NORC is an affirmative action, equal opportunity employer that values and actively seeks diversity in the workforce. NORC evaluates qualified applicants without regard to race, color, religion, sex, national origin, disability, veteran status, sexual orientation, gender identity, and other legally- protected characteristics.


Advertised: July 29, 2019 Central Daylight Time Applications close:"
1,"Supervisory Survey Statistician, GG-1530-13, Census-MP-KML","Chicago, IL",Chicago,IL,None Found,None Found,"
30% or more disabled
Persons with Disabilities
CTAP
ICTAP
",None Found,"Develop, monitor, report and analyze progress weekly and monthly on a variety of administrative and data collection programs.
Plan, develop, design, and implement new ways to report progress on the completion of administrative and data collection programs in the Regional Census Center.
Design, conduct, and analyze surveys. Supervise and manage a team involved in data collection.
Analyze, review, monitor, evaluate and interpret survey methods, designing, conducting, and analyzing surveys.
Supervise and administer the work of subordinates or team assigned to a survey or administrative program.
","
30% or more disabled
Persons with Disabilities
CTAP
ICTAP
","U.S. citizen.
Suitable for Federal employment.
Registered for Selective Service, if applicable. (www.sss.gov)
You may be required to complete a financial disclosure (OGE-450).
Time-in-grade requirements must be met by the announcement closing date.
Must be able to speak, read and write in English and Spanish.
","Duties
Summary
The primary mission is a variety of administrative programs and data collection activities, and short range planning and special projects.

This vacancy is for a Supervisory Survey Statistician position in the Chicago Regional Census Center located in Chicago, IL.

Responsibilities
Develop, monitor, report and analyze progress weekly and monthly on a variety of administrative and data collection programs.
Plan, develop, design, and implement new ways to report progress on the completion of administrative and data collection programs in the Regional Census Center.
Design, conduct, and analyze surveys. Supervise and manage a team involved in data collection.
Analyze, review, monitor, evaluate and interpret survey methods, designing, conducting, and analyzing surveys.
Supervise and administer the work of subordinates or team assigned to a survey or administrative program.
Travel Required
25% or less - Some travel may be required
Supervisory status
Yes
Promotion Potential
13
Job family (Series)
1530 Statistics
Similar jobs
Statisticians
Statisticians, Survey
Survey Statisticians
Requirements

Requirements
Conditions of Employment
U.S. citizen.
Suitable for Federal employment.
Registered for Selective Service, if applicable. (www.sss.gov)
You may be required to complete a financial disclosure (OGE-450).
Time-in-grade requirements must be met by the announcement closing date.
Must be able to speak, read and write in English and Spanish.
Applicants must meet all qualification requirements by the closing date of this announcement.

This vacancy is advertised under 2 different announcements. Please read the 'Who May Apply' section carefully to determine your eligibility. If you are not eligible under this announcement, please see CHICAGO RO-2020-0003, Supervisory Survey Statistician, GG-1530-13, CENSUS-DE-KML.

This is a Temporary Appointment, initial appointment is not to exceed (NTE) 09/26/2020. This appointment may be extended an additional year at management's discretion.

A supervisory probationary period may be required.

Relocation expenses may be paid.

The work schedule for this position is Mixed Tour. With a Mixed Tour work schedule, an employee may be changed between full-time, part-time and intermittent work schedules to accommodate fluctuating workloads and is subject to a signed agreement.
Qualifications
Minimum Education Requirements:

Degree: that included 15 semester hours in statistics (or in mathematics and statistics, provided at least 6 semester hours were in statistics), and 9 additional semester hours in one or more of the following: physical or biological sciences, medicine, education, or engineering; or in the social sciences including demography, history, economics, social welfare, geography, international relations, social or cultural anthropology, health sociology, political science, public administration, psychology, etc. Credit toward meeting statistical course requirements should be given for courses in which 50 percent of the course content appears to be statistical methods, e.g., courses that included studies in research methods in psychology or economics such as tests and measurements or business cycles, or courses in methods of processing mass statistical data such as tabulating methods or electronic data processing.

OR

Combination of education and experience - courses as shown in A above, plus appropriate experience. The experience should have included a full range of professional statistical work such as (a) sampling, (b) collecting, computing, and analyzing statistical data, and (c) applying statistical techniques such as measurement of central tendency, dispersion, skewness, sampling error, simple and multiple correlation, analysis of variance, and tests of significance.

In addition to meeting the basic entry requirements, you must possess the below specialized experience.

Specialized Experience:

For the GG-13, you must have one year of experience at a level of difficulty and responsibility equivalent to the GS-12 grade level in the Federal service.

Experience for this position includes conducting or overseeing operational evaluations or similar activities involving the collection, analysis, and presentation of data; experience communicating with subordinate staff to achieve goals in the prescribed time frames; experience as a first level supervisor to include interviewing applicants, making selections and proposing performance and conduct related actions; experience using administrative program and survey research data collection to monitor and analyze survey progress; experience preparing and presenting analysis or evaluations reports to interpret survey results and propose recommendations; and experience working on a single portion of a statistical survey such as data collection, data processing, data analysis or data presentation.

Education cannot be substituted for experience.

Experience refers to paid and unpaid experience, including volunteer work done through National Service programs (e.g., Peace Corps, AmeriCorps) and other organizations (e.g., professional; philanthropic; religious; spiritual; community, student, social). Volunteer work helps build critical competencies, knowledge, and skills and can provide valuable training and experience that translates directly to paid employment. You will receive credit for all qualifying experience, including volunteer experience.
Education
Additional information
The following links provide information on various hiring authorities that may enable you to apply through merit assignment procedures, or be eligible for a non-competitive appointment

30% or more disabled
Persons with Disabilities
CTAP
ICTAP
The Department of Commerce provides reasonable accommodations to applicants with disabilities. If you need a reasonable accommodation for any part of the application and hiring process, please notify the Human Resources Office. The decision on granting reasonable accommodation will be on a case-by-case basis. TTY users can contact the Human Resources Office via the Federal Relay Service, 1-800-877-8339.


How You Will Be Evaluated
You will be evaluated for this job based on how well you meet the qualifications above.
Your resume, optional cover letter and supporting documentation will be reviewed to determine if you meet the minimum qualifications for the position. If you meet the minimum qualifications stated in the job opportunity announcement, we will compare your resume, optional cover letter and supporting documentation to your responses on the scored occupational questionnaire (True/False, Yes/No, Multiple Choice questions). Your resume and/or optional cover letter must support your responses to the scored occupational questionnaire, or your score may be lowered. The best-qualified candidates will be identified for referral to the hiring manager and may be invited for an interview.

Due weight shall be given to performance appraisals and awards in accordance with 5 CFR § 335.103(b)(3), during the interview/selection process conducted by the hiring manager.

The scored occupational questionnaire will evaluate you on the following competencies; please do not provide a separate written response:

Ability to lead, communicate and motivate a team; complete a project under a tight deadline; provide administrative and technical guidance to a team to accomplish goals.
Ability to use survey methods such as survey research and data collection in order to develop, monitor reports and analyze surveys.
Skill in identification and assessment impacts associated with the interpretation of results generated, and the need for procedural or operations changes.
Knowledge of qualitative and/or quantitative measurement techniques.
Skill in research, development and implementation of programming specifications which includes monitoring program design, coding, and pilot testing program developed for commercial statistical software packages to work with existing programs or systems.
Ability to manage, assign work, set priorities, prepares schedules, evaluate performance and provide advice, instructions, and training for subordinate staff.
We recommend that you preview the online questions for this announcement before you start the application process.

To preview questions please click here.

Background checks and security clearance
Security clearance
Not Required
Drug test required
No
Required Documents

Required Documents
A complete application consists of the following:

Resume showing relevant experience; cover letter optional. Your resume should list your educational and work experience including the dates (mm/dd/yy) of each employment along with the number of hours worked per week. For work in the Federal service, please include the grade level for the position(s). Your resume may be used to validate your responses to the scored occupational questionnaire. Your resume should also indicate your citizenship and if you are registered with the Selective Service System if you are a male born after 12/31/59.
SF-50, ""Notification of Personnel Action,"" supporting your eligibility, with the exception of current Census Bureau employees.
Veterans Employment Opportunities Act (VEOA) documentation, if applicable. For more information, please go to https://www.fedshirevets.gov/hire/hrp/vetguide/index.aspx.
Career Transition Assistance Plan (CTAP) and Interagency Career Transition Assistance Plan (ICTAP) documentation, if applicable (see other information).
Documentation supporting eligibility for non-competitive appointment, (Schedule A disability, 30 percent disabled veteran, certain military spouses, etc).
Education Documentation: If this position requires proof of higher education, or you are substituting education for experience, you must submit an unofficial transcript or a list of courses that includes the following information: name of accredited institution, grades earned, completion dates, and quarter and semester hours earned. This also includes Census Bureau employees. Education completed in foreign colleges or universities may be used to meet the requirements. Please refer to http://www.opm.gov/qualifications/policy/ApplicationOfStds-04.asp for more information.
You are not required to submit official documents at this time; copies are sufficient.

Special Instructions for Foreign Education: Qualifying education from colleges and universities in foreign countries must be evaluated in terms of equivalency to that acquired in U.S. colleges and universities. Applicants educated in whole or in part in foreign countries must submit sufficient evidence, including transcripts, to an accredited private organization for an equivalency evaluation of course work and degree. A listing of these accredited organizations can be found on the Department of Education's website - http://www.ed.gov/international/usnei/us/workrecog.doc. You must provide a copy of the letter containing the results of the equivalency evaluation with a course by course listing along with your application. Failure to provide such documentation when requested will result in lost consideration.

CTAP and ICTAP candidates:

CTAP and ICTAP candidates will be eligible for selection priority if it is determined that they have exceeded the minimum qualifications for the position by attaining at least a rating of 85 out of 100. Information about CTAP and ICTAP eligibility is on the Office of Personnel Management's Career Transition Resources website at: http://www.opm.gov/ctap.

CTAP applicants MUST submit the following documents:

A copy of your RIF separation notice; notice of proposed removal for declining a directed geographic relocation outside of the local commuting area; a Certificate of Expected Separation (CES); or certification that you are in a surplus organization or occupation (this could be a position abolishment letter, a notice of eligibility for discontinued service retirement, or similar notice).
A copy of your SF-50 ""Notification of Personnel Action"" noting current position, grade/band level, and duty location;
A copy of your latest performance appraisal including your rating; and
Any documentation from your bureau/operating unit that shows your current promotion potential.
ICTAP applicants MUST submit the following documents:

A copy of your RIF separation notice; notice of proposed removal for declining a directed geographic relocation outside of the local commuting area; notice of disability annuity termination; certification from your former agency that it cannot place you after your recovery from a work-related compensable injury; or certification from the National Guard Bureau or Military Department that you are eligible for disability retirement.
A copy of your SF-50 ""Notification of Personnel Action"", documenting your RIF separation, noting your position, grade/band level, and duty location, and/or Agency certification of inability to place you through RPL, etc.;
A copy of your latest performance appraisal including your rating; and
Any documentation from your agency that shows your current promotion potential.
NOTE: You will not be considered if you fail to provide all required documents.
If you are relying on your education to meet qualification requirements:
Education must be accredited by an accrediting institution recognized by the U.S. Department of Education in order for it to be credited towards qualifications. Therefore, provide only the attendance and/or degrees from schools accredited by accrediting institutions recognized by the U.S. Department of Education.
Failure to provide all of the required information as stated in this vacancy announcement may result in an ineligible rating or may affect the overall rating.
Benefits

Benefits
A career with the U.S. Government provides employees with a comprehensive benefits package. As a federal employee, you and your family will have access to a range of benefits that are designed to make your federal career very rewarding. Learn more about federal benefits.
Eligibility for benefits depends on the type of position you hold and whether your position is full-time, part-time, or intermittent. Contact the hiring agency for more information on the specific benefits offered."
