,Title,Location,City,State,Zip,Country,Qualifications,Skills,Responsibilities,Education,Requirement,FullDescriptions
7,"Supervisory Survey Statistician, GG-1530-13,Census-DE-KML","Chicago, IL",Chicago,IL,None Found,None Found,"
Ability to lead, communicate and motivate a team; complete a project under a tight deadline; provide administrative and technical guidance to a team to accomplish goals.
Ability to use survey methods such as survey research and data collection in order to develop, monitor reports and analyze surveys.
Skill in identification and assessment impacts associated with the interpretation of results generated, and the need for procedural or operations changes.
Knowledge of qualitative and/or quantitative measurement techniques.
Skill in research, development and implementation of programming specifications which includes monitoring program design, coding, and pilot testing program developed for commercial statistical software packages to work with existing programs or systems.
Ability to manage, assign work, set priorities, prepares schedules, evaluate performance and provide advice, instructions, and training for subordinate staff.
",None Found,"Develop, monitor, report and analyze progress weekly and monthly on a variety of administrative and data collection programs.
Plan, develop, design, and implement new ways to report progress on the completion of administrative and data collection programs in the Regional Census Center.
Design, conduct, and analyze surveys. Supervise and manage a team involved in data collection.
Analyze, review, monitor, evaluate and interpret survey methods, designing, conducting, and analyzing surveys.
Supervise and administer the work of subordinates or team assigned to a survey or administrative program.
","
Ability to lead, communicate and motivate a team; complete a project under a tight deadline; provide administrative and technical guidance to a team to accomplish goals.
Ability to use survey methods such as survey research and data collection in order to develop, monitor reports and analyze surveys.
Skill in identification and assessment impacts associated with the interpretation of results generated, and the need for procedural or operations changes.
Knowledge of qualitative and/or quantitative measurement techniques.
Skill in research, development and implementation of programming specifications which includes monitoring program design, coding, and pilot testing program developed for commercial statistical software packages to work with existing programs or systems.
Ability to manage, assign work, set priorities, prepares schedules, evaluate performance and provide advice, instructions, and training for subordinate staff.
","U.S. citizen.
Suitable for Federal employment.
Registered for Selective Service if applicable. (www.sss.gov)
You may be required to complete a financial disclosure (OGE-450).
","Duties
Summary
The primary mission is a variety of administrative programs and data collection activities, and short range planning and special projects.

This vacancy is for a Supervisory Survey Statistician position in the Chicago Regional Census Center located in Chicago, IL.

Responsibilities
Develop, monitor, report and analyze progress weekly and monthly on a variety of administrative and data collection programs.
Plan, develop, design, and implement new ways to report progress on the completion of administrative and data collection programs in the Regional Census Center.
Design, conduct, and analyze surveys. Supervise and manage a team involved in data collection.
Analyze, review, monitor, evaluate and interpret survey methods, designing, conducting, and analyzing surveys.
Supervise and administer the work of subordinates or team assigned to a survey or administrative program.
Travel Required
25% or less - Some travel may be required
Supervisory status
Yes
Promotion Potential
13
Job family (Series)
1530 Statistics
Similar jobs
Statisticians
Statisticians, Survey
Survey Statisticians
Requirements

Requirements
Conditions of Employment
U.S. citizen.
Suitable for Federal employment.
Registered for Selective Service if applicable. (www.sss.gov)
You may be required to complete a financial disclosure (OGE-450).
Applicants must meet all qualification requirements by the closing date of this announcement.

This announcement will close at 11:59 p.m. Eastern Time on the date the first (50) applicants are received or on October 15, 2019, whichever comes first.

This vacancy is advertised under 2 different announcements. Please read the 'Who May Apply' section carefully to determine your eligibility. If you are not eligible under this announcement, please see CHICAGO RO-2020-0004, Supervisory Survey Statistician, GG-1530-13, CENSUS-MP-KML.

This is a Temporary Appointment; initial appointment is not to exceed (NTE) 9/26/2020. This appointment may be extended an additional year at management’s discretion.

A supervisory probationary period may be required.

Relocation expenses will not be paid.

The work schedule for this position is Mixed Tour. With a Mixed Tour work schedule, an employee may be changed between full-time, part-time and intermittent work schedules to accommodate fluctuating workloads and is subject to a signed agreement.
Qualifications
Minimum Education Requirement:

Degree: that included 15 semester hours in statistics (or in mathematics and statistics, provided at least 6 semester hours were in statistics), and 9 additional semester hours in one or more of the following: physical or biological sciences, medicine, education, or engineering; or in the social sciences including demography, history, economics, social welfare, geography, international relations, social or cultural anthropology, health sociology, political science, public administration, psychology, etc. Credit toward meeting statistical course requirements should be given for courses in which 50 percent of the course content appears to be statistical methods, e.g., courses that included studies in research methods in psychology or economics such as tests and measurements or business cycles, or courses in methods of processing mass statistical data such as tabulating methods or electronic data processing.

OR

Combination of education and experience - courses as shown in A above, plus appropriate experience. The experience should have included a full range of professional statistical work such as (a) sampling, (b) collecting, computing, and analyzing statistical data, and (c) applying statistical techniques such as measurement of central tendency, dispersion, skewness, sampling error, simple and multiple correlation, analysis of variance, and tests of significance.

In addition to meeting the basic entry requirements, you must possess the below specialized experience.

Specialized Experience:

For the GG-13, you must have one year of experience at a level of difficulty and responsibility equivalent to the GS-12 grade level in the Federal service.

Experience for this position includes conducting or overseeing operational evaluations or similar activities involving the collection, analysis, and presentation of data; experience communicating with subordinate staff to achieve goals in the prescribed time frames; experience as a first level supervisor to include interviewing applicants, making selections and proposing performance and conduct related actions; experience using administrative program and survey research data collection to monitor and analyze survey progress; experience preparing and presenting analysis or evaluations reports to interpret survey results and propose recommendations; and experience working on a single portion of a statistical survey such as data collection, data processing, data analysis or data presentation.

Education cannot be substituted for experience.

Experience refers to paid and unpaid experience, including volunteer work done through National Service programs (e.g., Peace Corps, AmeriCorps) and other organizations (e.g., professional; philanthropic; religious; spiritual; community, student, social). Volunteer work helps build critical competencies, knowledge, and skills and can provide valuable training and experience that translates directly to paid employment. You will receive credit for all qualifying experience, including volunteer experience.
Education
Additional information
The Department of Commerce provides reasonable accommodations to applicants with disabilities. If you need a reasonable accommodation for any part of the application and hiring process, please notify the Human Resources Office. The decision on granting reasonable accommodation will be on a case-by-case basis. TTY users can contact the Human Resources Office via the Federal Relay Service, 1-800-877-8339.


How You Will Be Evaluated
You will be evaluated for this job based on how well you meet the qualifications above.
Your resume, optional cover letter and supporting documentation will be reviewed to determine if you meet the minimum qualifications for the position. If you meet the minimum qualifications stated in the job opportunity announcement, we will compare your resume, optional cover letter and supporting documentation to your responses on the scored occupational questionnaire (True/False, Yes/No, Multiple Choice questions) and place you in one of three pre-defined categories. These categories are ""gold,"" ""silver,"" and ""bronze."" Your resume and/or optional cover letter must support your responses to the scored occupational questionnaire, or your score may be lowered. Candidates placed in the ""gold"" category will be identified for referral to the hiring manager and may be invited for an interview.

How you will be evaluated for preference eligibility: Within each category, those entitled to veterans' preference will be listed at the top of the pre-defined category for which they are placed.

The scored occupational questionnaire will evaluate you on the following competencies; please do not provide a separate written response:

Ability to lead, communicate and motivate a team; complete a project under a tight deadline; provide administrative and technical guidance to a team to accomplish goals.
Ability to use survey methods such as survey research and data collection in order to develop, monitor reports and analyze surveys.
Skill in identification and assessment impacts associated with the interpretation of results generated, and the need for procedural or operations changes.
Knowledge of qualitative and/or quantitative measurement techniques.
Skill in research, development and implementation of programming specifications which includes monitoring program design, coding, and pilot testing program developed for commercial statistical software packages to work with existing programs or systems.
Ability to manage, assign work, set priorities, prepares schedules, evaluate performance and provide advice, instructions, and training for subordinate staff.
For more information on category rating, please go to:
http://www.hr.commerce.gov/s/groups/public/@doc/@cfoasa/@ohrm/documents/content/prod01_009474.pdf

We recommend that you preview the online questions for this announcement before you start the application process.

To preview questions please click here.

Background checks and security clearance
Security clearance
Not Required
Drug test required
No
Required Documents

Required Documents
A complete application consists of the following:

Resume showing relevant experience; cover letter optional. Your resume should list your educational and work experience including the dates (mm/dd/yy) of each employment along with the number of hours worked per week. Your resume may be used to validate your responses to the scored occupational questionnaire. Your resume should also indicate your citizenship and if you are registered with the Selective Service System if you are a male born after 12/31/59.
Veterans' Preference Documentation: Please indicate on your resume the type of veterans' preference you are claiming and provide the appropriate supporting documentation (DD-214 stating disposition of discharge or character of service, VA letter, SF-15, etc.) to validate your claim. For more information regarding eligibility requirements, please go to: http://www.fedshirevets.gov/job/vetpref/index.aspx.
Career Transition Assistance Plan (CTAP) and Interagency Career Transition Assistance Plan (ICTAP) documentation, if applicable (see other information).
Education Documentation: If this position requires proof of higher education, or you are substituting education for experience, you must submit an unofficial transcript or a list of courses that includes the following information: name of accredited institution, grades earned, completion dates, and quarter and semester hours earned. This also applies to Census Bureau employees. Education completed in foreign colleges or universities may be used to meet the requirements. Please refer to http://www.opm.gov/qualifications/policy/ApplicationOfStds-04.asp for more information.
You are not required to submit official documents at this time; copies are sufficient.

Special Instructions for Foreign Education: Qualifying education from colleges and universities in foreign countries must be evaluated in terms of equivalency to that acquired in U.S. colleges and universities. Applicants educated in whole or in part in foreign countries must submit sufficient evidence, including transcripts, to an accredited private organization for an equivalency evaluation of course work and degree. A listing of these accredited organizations can be found on the Department of Education's website - http://www.ed.gov/international/usnei/us/workrecog.doc You must provide a copy of the letter containing the results of the equivalency evaluation with a course by course listing along with your application. Failure to provide such documentation when requested will result in lost consideration.

CTAP and ICTAP Eligibles

CTAP and ICTAP candidates will be eligible for selection priority if it is determined that they have exceeded the minimum qualifications for the position by attaining at least a rating of 85 out of 100. Information about CTAP and ICTAP eligibility is on the Office of Personnel Management's Career Transition Resources website at: http://www.opm.gov/ctap

CTAP applicants MUST submit the following documents:

A copy of your RIF separation notice, notice of proposed removal for declining a directed geographic relocation outside of the local commuting area; a Certificate of Expected Separation (CES); or certification that you are in a surplus organization or occupation (this could be a position abolishment letter, a notice of eligibility for discontinued service retirement, or similar notice);
A copy of your SF-50 ""Notification of Personnel Action"", noting current position, grade/band level, and duty location;
A copy of your latest performance appraisal including your rating; and
Any documentation from your bureau/operating unit that shows your current promotion potential.
ICTAP applicants MUST submit the following documents:

A copy of your RIF separation notice, notice of proposed removal for declining a directed geographic relocation outside of the local commuting area, notice of disability annuity termination, certification from your former agency that it cannot place you after your recovery from a work-related compensable injury; or certification from the National Guard Bureau or Military Department that you are eligible for disability retirement.
A copy of your SF-50 ""Notification of Personnel Action"", documenting your RIF separation, noting your position, grade/band level, and duty location, and/or Agency certification of inability to place you through RPL, etc.;
A copy of your latest performance appraisal including your rating; and
Any documentation from your agency that shows your current promotion potential.
NOTE: You will not be considered if you fail to provide all required documents.
If you are relying on your education to meet qualification requirements:
Education must be accredited by an accrediting institution recognized by the U.S. Department of Education in order for it to be credited towards qualifications. Therefore, provide only the attendance and/or degrees from schools accredited by accrediting institutions recognized by the U.S. Department of Education.
Failure to provide all of the required information as stated in this vacancy announcement may result in an ineligible rating or may affect the overall rating.
Benefits

Benefits
A career with the U.S. Government provides employees with a comprehensive benefits package. As a federal employee, you and your family will have access to a range of benefits that are designed to make your federal career very rewarding. Learn more about federal benefits.
Census Bureau offers a comprehensive benefits package. Explore the benefits offered to most Federal employees at https://www.usa.gov/benefits-for-federal-employees.
Eligibility for benefits depends on the type of position you hold and whether your position is full-time, part-time, or intermittent. Contact the hiring agency for more information on the specific benefits offered."
8,Research Statistical Analyst,"Chicago, IL",Chicago,IL,None Found,None Found,None Found,None Found,None Found,None Found,None Found,"Please make sure to read the job posting in its entirety as it reflects both the University roles and responsibilities, followed by the specific description.
Department
2012211 Medicine-Infectious Diseases
About the Unit
The Chicago Center for HIV Elimination (CCHE), is situated within the Biological Sciences Division at the University of Chicago Medicine. CCHE aims to eliminate all new HIV transmission events by 2041. The University of Chicago's position on the South Side makes it uniquely situated to test, treat, and prevent new HIV infections in a highly affected population. The South Side communities and majority Black suburbs connected to them to the South represents the largest contiguous Black population in the United States. By using our integrated HIV transmission elimination approaches, we are beginning to make new infections in these communities less frequent.
Job Family
Research
Responsible for all aspects of research projects and research facilities. Plans and conducts clinical and non-clinical research; facilitates and monitors daily activities of clinical trials or research projects. Directs engineering and technical support activities to develop and maintain tools and computational methods needed to gather and analyze data.
Career Track and Job Level
Statistician
Designs, implements, and publishes results from research projects and writes statistical design, methods, and analysis for research proposals. Develops objectives, designing sampling, randomization, and data collection procedures. Develops and implements new innovative procedures in the areas of data collection, quality control, presentation of results, and statistical analyses.
P2: Requires knowledge and experience in own discipline; still acquiring higher-level knowledge and skills. Builds knowledge of the organization, processes and customers. Solves a range of straightforward problems. Analyzes possible solutions using standard procedures. Receives a moderate level of guidance and direction.
Role Impact
Individual Contributor
Responsibilities
The job performs a range of activities to support the statistical design and implementation of research analysis. Uses knowledge of statistics to communicate analyses for research proposals and draft reports detailing their results. Follows objectives and procedures for sampling, randomization, data collection, analysis, and quality control.
1) Performs a range of activities to facilitate the design of research project and the publication of their results. Uses knowledge of statistics to help develop objectives and statistical procedures for the project., 2) Analyzes data and prepares data tables, charts, and graphs for reports. Writes grant proposals for faculty throughout the unit., 3) Helps develop and implements new innovative procedures in the areas of data collection, quality control, presentation of results, and statistical analysis., 4) Writes statistical computer programs and reviews computer output for consistency and quality., 5) Performs other related work as needed.
Unit-specific Responsibilities
1) The Research Statistical Analyst will be responsible for managing cutting-edge bio-behavioral health and network epidemiological datasets that often includes sensitive sex and drug use behavior.
2) The candidate will implement procedures for data cleaning, coding, documentation, and creation of analytic datasets in collaboration with data analysts and investigators at CCHE.
3) May assist with the development of abstracts, posters, and presentations for local and national conferences, manuscripts, and other research outputs.
4) P rovide data management for multiple CDC and NIH funded projects at CCHE, including but not limited to longitudinal cohort studies, network studies, and randomized controlled trials of HIV prevention interventions.
5) Create analytic datasets by merging, cleaning, and coding data from multiple sources, including behavioral surveys, electronic health records, and public health surveillance.
6) Create and implementing data management, storage and analysis policies and procedures.
7) Design and implementing data tracking and monitoring tools.
8) Create data codebooks and variable coding descriptions.
9) Evaluate data accuracy and integrity, and creating reports to identify inconsistencies.
10) Maintain and sharing datasets in accordance with IRB and HIPPAA regulations, including implementation of de-identification procedures.
11) Oversee the organization and structure of lab share files and data sets.
12) Respond to requests from investigators, analysts, and collaborators to facilitate the analysis of data sets/research projects.
13) Prepare descriptions of data collection and management procedures for manuscripts, abstracts, and other scientific publications.
14) Work closely with data analysts and other staff to ensure compatibility of data collection procedures for new and ongoing research protocols.
15) Provide critical input about data collection, storage, and management procedures for newly proposed research designs and suggest design improvements.
Unit-preferred Competencies
1) Strong data management skills.
2) Proficiency with one or more statistical analysis software packages, such as SAS, Stata, or R for data management (i.e., merging, cleaning, and coding raw data to create analytic datasets.
3) Proficiency with Microsoft applications, including but not limited to Outlook, Excel, Access, and Word.
4) Ability to provide written descriptions of data collection and management methods for grant applications and scientific manuscripts.
5) Experience maintaining and documenting source code for reproducibility of research.
6) Ability to adhere to protocols for maintaining confidentiality of protected health information, and work with sensitive information (HIV/STI testing data).
7) Meticulous attention to detail and excellent organizational skills.
8) Ability to work on multiple projects simultaneously, set priorities, and meet deadlines.
9) Strong interpersonal skills and the ability to work both independently and as part of a team.
10) Demonstrated written and verbal communication skills, including ability to communicate recommendations for data management procedures with investigators and other center staff.
11) Flexibility, creativity, and problem solving skills.
12) Ability to collaborate with colleagues from diverse academic and professional backgrounds.
13) Demonstrated effective leadership skills and ability to manage new data managers or students.
14) Experience in one or more of the following areas, including HIV/STI prevention research, epidemiologic study design, network analysis, public health surveillance, and/or clinical and social science research methods, or willingness to gain knowledge in these areas.
15) Experience managing data from longitudinal studies, network studies, or other complex study designs.
16) Experience with manipulation of large databases and consolidation and synthesis of data from multiple sources.
Education, Experience, and Certifications
Minimum requirements include a college or university degree in related field.
Minimum requirements include knowledge and skills developed through 2-5 years of work experience in a related job discipline.
Required Documents
1) Resume
2) Cover letter
NOTE: When applying, all required documents MUST be uploaded under the R esume/CV section of the application.
FLSA Status
Exempt
Pay Frequency
Monthly
Pay Grade
Depends on Qualifications
Scheduled Weekly Hours
40
Benefits Eligible
Yes
Drug Test Required
No
Health Screen Required
No
Motor Vehicle Record Inquiry Required
No
Posting Date
2019-08-08-07:00
Remove from Posting On or Before
2020-02-08-08:00"
