,Title,Location,City,State,Zip,Country,Qualifications,Skills,Responsibilities,Education,Requirement,FullDescriptions
11,Lead Machine Learning Analyst,"Chicago, IL",Chicago,IL,None Found,None Found,None Found,None Found,None Found,None Found,None Found,"Please make sure to read the job posting in its entirety as it reflects both the University roles and responsibilities, followed by the specific description.
Department
2013902 Public Health Sciences-Cep
About the Unit
The newly created Institute for Population and Precision Health (IPPH), located in the Biological Sciences Division, will integrate a wide spectrum of factors such as human health behaviors, environmental factors, social and economic factors, policies and genetic determinants of health, into studies focused on the treatment and prevention of disease, as well as the maintenance of wellness. Leveraging and integrating the University of Chicago’s considerable institutional strength in population science with research spanning diverse fields such as genetic medicine, cancer epidemiology, microbiome, and epigenomics, the Institute will have the common goal of improving human health outcomes. Another major goal of the Institute will be to develop a new multidisciplinary training program to equip researchers with emerging tools and methods to conduct precision health research within a population health framework. The administration and human resources for the IPPH is managed by the Department of Public Health Sciences. The Department of Public Health Sciences is the home in the Biological Sciences Division for the core quantitative research fields in public health: biostatistics, epidemiology and health services research. Our faculty both lead research projects in these fields and participate in interdisciplinary teams with faculty in other departments to address complex problems in health and healthcare, in our communities and around the globe. We provide training in these fields through two degree programs: a flexible doctoral program that may focus on any of our core areas and a MS degree for clinical professionals, designed to provide physicians and other doctoral-level providers with the methods to carry out rigorous research in clinical epidemiology and health services. Through our Biostatistics Laboratory we provide a collaborative service to investigators throughout the Biological Sciences Division to design studies, oversee data collection and analyze and interpret data. This at-will position is wholly or partially funded by extramural funds (e.g., grant, gift, endowment) which is renewed under provisions set by the grantor. Employment will be contingent upon the continued receipt of these extramural funds and satisfactory job performance. If the position is eliminated due to the discontinuation of extramural funding, a minimum of one pay period's written notice (2 weeks) will be given or pay in-lieu of notice.
Job Family
Research
Responsible for all aspects of research projects and research facilities. Plans and conducts clinical and non-clinical research; facilitates and monitors daily activities of clinical trials or research projects. Directs engineering and technical support activities to develop and maintain tools and computational methods needed to gather and analyze data.
Career Track and Job Level
Statistician
Designs, implements, and publishes results from research projects and writes statistical design, methods, and analysis for research proposals. Develops objectives, designing sampling, randomization, and data collection procedures. Develops and implements new innovative procedures in the areas of data collection, quality control, presentation of results, and statistical analyses.
P1: Performs routine assignments in the entry level to a professional job progression. Typically requires a college or university degree or the equivalent work experience that provides knowledge and exposure to fundamental theories, principles and concepts. Develops competence by performing structured work assignments. Uses existing procedures to solve routine or standard problems. Receives instruction, guidance and direction from others.
Role Impact
Individual Contributor
Responsibilities
The job performs a broad range of operational business activities to support the statistical design and implementation of research analysis. Uses knowledge of statistics to communicate analyses for research proposals and draft reports detailing their results. Follows objectives and procedures for sampling, randomization, data collection, analysis, and quality control.
1) Relies on administrative guidance and review, collaborates with researchers in designing, implementing, and monitoring research projects and assumes primary responsibility for the analysis and presentation of project data., 2) With researcher guidance assists in developing objectives, designing sampling, randomization, and data collection procedures to achieve study objectives., 3) Analyzes data and prepares tables for interim and final reports. Designs tables and statistical procedures for specific research studies., 4) Maintains collaboration with other research support personnel, including analysts and programmers in monitoring and assessing data quality., 5) Performs other related work as needed.
Additional Responsibilities
1) Acquire statistical knowledge and programming skills on emerging methods and tools if necessary for a given project.
2) Implement appropriate quality assurance procedures to enhance the validity and reliability of the study results.
3) Write reports and presentations of the statistical analyses results for scientific and public dissemination and communication (presentations, manuscripts, web-site, etc.).
4) Conduct literature reviews and summarize findings needed for scientific reports and manuscripts.
5) Serve as a resource person for data collection and management staff as well as laboratory staff regarding data issues, quality control and transformation.
6) Provide specific support to the Dean for Population and Precision Health in the areas of population and precision health research as well as information systems development and management, creation and management of data repositories, data sharingand process improvement initiatives at the Institute.
7) Create and maintain appropriate documentations of statistical methods and programming codes.
8) Perform a range of activities to facilitate the design of research project and the publication of their results. Uses knowledge of statistics to help develop objectives and statistical procedures for the project.
9) Write grant proposals for faculty throughout the unit.
10) Assist in developing and implementing new innovative procedures in the areas of data collection, quality control, presentation of results, and statistical analysis.
11) Write statistical computer programs and reviews computer output for consistency and quality.
12) Perform statistical analysis and associated programming and data management tasks for integrated datasets derived from epidemiology, genomic (including NGS and microbiome), clinical (including EHR), environmental (including environmental mixtures), administrative (including Medicare/Medicaid), image, and geospatial/sensor-based studies.
Unit-preferred Competencies
1) Strong interpersonal skills and ability to work as part of a multi-disciplinary team, while contributing to a high quality and respectful work environment.
2) Strong oral and written communication skills, with the ability to communicate effectively to colleagues and staff across multi-disciplinary areas.
3) Ability to manage multiple projects in a dynamic environment with changing priorities.
4) Proven ability to establish realistic goals and deliver work on schedule.
5) Ability to work independently and solve problems as they arise and communicate effectively with staff, colleagues, Co PIs, and PI.
6) Familiarity with theoretical aspects of relevant statistical methods as well as their appropriate application, interpretation, assumption and limitation.
7) Strong quantitative and writing skills are highly important.
8) Specialized advanced knowledge, education and/or training in statistical analyses methods, tools and associated software.
Education, Experience, and Certifications
Minimum requirements include a college or university degree in related field.
Minimum requirements include knowledge and skills developed through < 2 years of work experience in a related job discipline.
Preferred Qualifications
Education
1) Advanced degree in Biostatistics, Statistics/Machine Learning, Quantitative Epidemiology Methods, or related analytic fields.
Experience
1) Experience in using major statistical packages and languages including R statistical software, Python, Machine Learning and Artificial Intelligence algorithms, SAS/Stata and GIS software.
2) Knowledge of genomics, informatics infrastructure/security, web-/cloud-computing.
3) Strong writing and editing skills of manuscripts (and/or grant applications).
4) Experience with machine-learning and artificial intelligence analyses.
Required Documents
1) Resume

2) Cover Letter
Note: When applying, all required documents MUST be uploaded under the Resume/CV section of the application.
FLSA Status
Exempt
Pay Frequency
Monthly
Pay Grade
Depends on Qualifications
Scheduled Weekly Hours
40
Benefits Eligible
Yes
Drug Test Required
No
Health Screen Required
No
Motor Vehicle Record Inquiry Required
No
Posting Date
2019-04-12-07:00
Remove from Posting On or Before
2019-10-12-07:00"
12,Associate Biostatistics Director,"Northbrook, IL 60062",Northbrook,IL,60062,None Found,"
M.S. or Ph.D. in statistics or equivalent
Minimum of 8 years' experience in applying statistical methods in biomedical research, extensive pharmaceutical or CRO experience required
Experience in working on clinical project teams. Good understanding of entire drug development process - ability to see the ""big picture"".
Experience as the independent lead statistician in a regulatory submission preferred
Experience with cross functional process improvement or innovation initiatives
Advanced and broad knowledge of statistical methods, along with understanding of industry practices related to the statistical analysis of clinical data
Knowledge and skills in SAS required and knowledge of other statistical software preferred.
In-depth familiarity with processes and procedures in data management and SAS programming
Experience working in an international environment and demonstrated ability to manage and influence across different locations, time zones and cultures; builds global relationships.
Ability to work in a matrix environment.
Proven excellent organizational, project and time management skills.
Leadership skills and ability to delegate appropriately and provide direction to more junior Biostatisticians.
Very good oral, written, and presentation communication skills. Able to clearly communicate statistical issues and methods to both statisticians and non-statisticians.
Very good problem solving skills.
Accurate with a keen eye for detail. Dedication to quality and reliability in all work tasks
Ability to perform under pressure
",None Found,"Participates in project teams for clinical development programs and/or lifecycle management of marketed products
Provides strategic statistical input to the project teams and is a major contributor to the clinical development plan (CDP). Ensures CDP with statistical integrity and optimal study designs, and ensures that Data Science needs are reflected within the development plan and strategy across regions. Provides statistical advice to clinical teams including design of studies and analyses requiring advanced statistical methodologies. Recognizes and addresses issues which may impact the statistical integrity of the development program or for which statistical tools may add value.
Provides best in class data science support to Astellas drug development programs and leads the Data Science extended (project) team and deliverables teams. Ensures quality and consistency of key data science deliverables across studies. Ensures creation of, maintenance and adherence to indication specific standards with respect to key variables, definitions, statistical methods, data structures and presentation of results.
Ensures availability of integrated database(s) where needed, and planning and conduct of integrated analyses to support development decisions, submissions or marketing needs.
Represents the company on statistical matters at meetings with regulatory authorities, key opinion leaders and similar experts / bodies
Reviews key project and study documents to ensure optimal statistical presentation and compliance. These documents include, but are not limited to, clinical development plans (CDPs), protocols, analysis plans, study reports, submission documents and correspondence with health authorities.
Provides statistical, health economic and clinical outcomes expertise and data management/warehousing expertise to support marketed and late-phase products.
Provides consultancy to Medical Affairs projects in areas of expertise.
Plans, executes and reports on clinical and non-interventional studies and/or reviews documents generated by vendors.
",None Found,"
M.S. or Ph.D. in statistics or equivalent
Minimum of 8 years' experience in applying statistical methods in biomedical research, extensive pharmaceutical or CRO experience required
Experience in working on clinical project teams. Good understanding of entire drug development process - ability to see the ""big picture"".
Experience as the independent lead statistician in a regulatory submission preferred
Experience with cross functional process improvement or innovation initiatives
Advanced and broad knowledge of statistical methods, along with understanding of industry practices related to the statistical analysis of clinical data
Knowledge and skills in SAS required and knowledge of other statistical software preferred.
In-depth familiarity with processes and procedures in data management and SAS programming
Experience working in an international environment and demonstrated ability to manage and influence across different locations, time zones and cultures; builds global relationships.
Ability to work in a matrix environment.
Proven excellent organizational, project and time management skills.
Leadership skills and ability to delegate appropriately and provide direction to more junior Biostatisticians.
Very good oral, written, and presentation communication skills. Able to clearly communicate statistical issues and methods to both statisticians and non-statisticians.
Very good problem solving skills.
Accurate with a keen eye for detail. Dedication to quality and reliability in all work tasks
Ability to perform under pressure
","Associate Biostatistics Director



Description
Developing innovative therapies is one of the most challenging, most essential and personally rewarding fields in science. This is the most exciting time to be a part of Astellas, a company with a uniquely collaborative and patient-focused culture.

There's something special about working at Astellas. It's reflected in our focus on the people we serve, the way we treat each other and the results we achieve together as a company.

Astellas is announcing an Associate Biostatistics Director opportunity in Northbrook, IL.

Purpose & Scope:
The Associate Biostatistics Director acts as fully independent global statistical lead (GSTATL), representing Data Science in Core Teams. May be responsible for one or for multiple global or local drug projects within the same indication / therapeutic area. Leads large and/or complex projects, interacts with regulatory authorities and key opinion leaders, supervises other statisticians providing support to the projects and is accountable for the statistical soundness of ALL statistical input and deliverables for the assigned projects. Provides consultancy to other project teams and other GSTATLs in areas of expertise. Is expected to complete these tasks with very minimal supervision, appropriately and pro-actively seeking line management intervention where needed to ensure successful outcome, e.g. with respect to project resource requirements or key strategic functional issues.

Essential Job Responsibilities:
Participates in project teams for clinical development programs and/or lifecycle management of marketed products
Provides strategic statistical input to the project teams and is a major contributor to the clinical development plan (CDP). Ensures CDP with statistical integrity and optimal study designs, and ensures that Data Science needs are reflected within the development plan and strategy across regions. Provides statistical advice to clinical teams including design of studies and analyses requiring advanced statistical methodologies. Recognizes and addresses issues which may impact the statistical integrity of the development program or for which statistical tools may add value.
Provides best in class data science support to Astellas drug development programs and leads the Data Science extended (project) team and deliverables teams. Ensures quality and consistency of key data science deliverables across studies. Ensures creation of, maintenance and adherence to indication specific standards with respect to key variables, definitions, statistical methods, data structures and presentation of results.
Ensures availability of integrated database(s) where needed, and planning and conduct of integrated analyses to support development decisions, submissions or marketing needs.
Represents the company on statistical matters at meetings with regulatory authorities, key opinion leaders and similar experts / bodies
Reviews key project and study documents to ensure optimal statistical presentation and compliance. These documents include, but are not limited to, clinical development plans (CDPs), protocols, analysis plans, study reports, submission documents and correspondence with health authorities.
Provides statistical, health economic and clinical outcomes expertise and data management/warehousing expertise to support marketed and late-phase products.
Provides consultancy to Medical Affairs projects in areas of expertise.
Plans, executes and reports on clinical and non-interventional studies and/or reviews documents generated by vendors.
For studies within assigned projects

Provides all required statistical support and deliverables by supervising another statistician in that role, or as a member of study team him/herself.
Writes or reviews key study documents to ensure optimal statistical presentation and compliance. These documents include, but are not limited to, protocols, analysis plans, tables, listings, and figure (TLF) specifications, study reports.
Ensures efficient planning, execution and reporting of clinical studies and statistical review of critical documents such as CRFs, Data Validation Plans, SDTM/ADaM data specifications, TLFs Ensures statistical analyses performed in accordance with the protocol, statistical analysis plan, good statistical practice, and available regulatory guidelines.
Provides (executive) top line reports of study results
When statistical support or SAS programming for studies or other deliverables within assigned projects are contracted out to a CRO:
Contributes to vendor selection.
Performs vendor oversight for assigned programs: Ensures CRO is provided with details, timelines and Astellas specifications and requirements and kept up to date in case of changes. Monitors timelines, progress and specific issues, and takes action if necessary. Ensures review of the outputs created by the CRO.
Other tasks and roles may include:

Major contributor to cross-departmental/departmental/sectional improvement initiatives, for example: write SOPs; select, validate and implement statistical software; generate standard output or analysis methods.
Member or leader of external industry or professional organizations. Develops and maintain relations with leading academic institutions.
Perform vendor qualification / audits in collaboration with functional management
Investigates new statistical methodology and feeds back to department and project teams
Participates in due diligence activities, reviews data and advises company.
Quantitative Dimensions:
The Data Science department provides statistical, biometrical and data management/warehousing expertise for all R&D projects and marketed products, encompassing Phase I-IV studies. Qualified biostatistical expertise for clinical studies and drug submissions is a regulatory requirement, and carried out in accordance with international regulations (ICH, FDA, EMA) and internal Astellas SOPs and standards. The results must be reproducible and statistically sound, and are subject to internal and external inspections. Flawed statistical input to drug development projects may result in failure to achieve marketing authorization or regulatory approval delays resulting in substantial financial loss for the company.

An Associate Biostatistics Director is assigned to approximately 1-6 compounds simultaneously in 1-3 indications, and oversees between 4 and 12 studies simultaneously. Undertakes this work with minimal supervision.

Organizational Context:

There are 5 biostatistician levels (excluding functional management roles). This is the fourth level. Reports to Associate Director / Director Biostatistics. Is a member of project teams. Closely collaborates with project team members (e.g. project leader, development operations lead, medical lead, regulatory affairs, clinical pharmacology, project management). Leads the data science extended (project) team and deliverables teams. Is a member of study teams and/or supervises other statisticians as members of study teams for studies within assigned projects. Manages to achieve successful outcome through delegation of work, coaches assigned team members within own functions. Provides guidance to / mentors less experienced statisticians.

Requirements
Qualifications:
Required

M.S. or Ph.D. in statistics or equivalent
Minimum of 8 years' experience in applying statistical methods in biomedical research, extensive pharmaceutical or CRO experience required
Experience in working on clinical project teams. Good understanding of entire drug development process - ability to see the ""big picture"".
Experience as the independent lead statistician in a regulatory submission preferred
Experience with cross functional process improvement or innovation initiatives
Advanced and broad knowledge of statistical methods, along with understanding of industry practices related to the statistical analysis of clinical data
Knowledge and skills in SAS required and knowledge of other statistical software preferred.
In-depth familiarity with processes and procedures in data management and SAS programming
Experience working in an international environment and demonstrated ability to manage and influence across different locations, time zones and cultures; builds global relationships.
Ability to work in a matrix environment.
Proven excellent organizational, project and time management skills.
Leadership skills and ability to delegate appropriately and provide direction to more junior Biostatisticians.
Very good oral, written, and presentation communication skills. Able to clearly communicate statistical issues and methods to both statisticians and non-statisticians.
Very good problem solving skills.
Accurate with a keen eye for detail. Dedication to quality and reliability in all work tasks
Ability to perform under pressure
Preferred

Oncology experience
#LI-VB

Equal Opportunity Employer Minorities/Women/Protected Veterans/Disabled

Type Full-time

Location IL, Northbrook

Category Data Science"
