,Title,Location,City,State,Zip,Country,Qualifications,Skills,Responsibilities,Education,Requirement,FullDescriptions
4,AI Model Development Lead For Marketing (Analytics Manager 5),"Addison, TX 75001",Addison,TX,75001,None Found,"
8+ years of experience in analytics, modeling, or a combination of both
6+ years of management experience; or 6+ years of leadership experience in an advanced quantitative analytics function
A Master's degree or higher
5 + years of experience using quantitative machine learning techniques
4+ years of experience working with digital data science including analyzing cookie-level data",None Found,None Found,None Found,None Found,"Overview:
Wells Fargo technology teams drive innovation to create a more powerful and fulfilling financial experience for our customers and team members. You will join more than 24,000 team members supporting 95 billion transactions annually in 10 countries. Our career opportunities span the technology spectrum: advanced analytics, big data, information security, application development, cloud enablement, project management and more.

SUCCESS PROFILE
Check out the top traits we're looking for and see if you have the right mix. Additional related traits listed below.

Analytical
Detail-oriented
Insightful
Inventive
Problem Solver
Curious
Benefits
Wells Fargo wants to help you get more out of life and take care of things outside the office to make life a little easier. We provide:

Medical, Dental and Vision
Employer Matching 401(k)
Tuition Reimbursment
Maternity and Paternity Leave
Paid Time Off
Responsibilties
Job Description
At Wells Fargo, we want to satisfy our customers’ financial needs and help them succeed financially. We’re looking for talented people who will put our customers at the center of everything we do. Join our diverse and inclusive team where you’ll feel valued and inspired to contribute your unique skills and experience.
Help us build a better Wells Fargo. It all begins with outstanding talent. It all begins with you.
Enterprise Finance drives financial management for the company and maintains and enhances risk and financial controls. Key functions within Enterprise Finance include finance and accounting; Treasury; corporate development, mergers, and acquisitions; Data Management and Insights, the Customer Remediation Center of Excellence, Enterprise Shared Services, Business Process Management, and Corporate Strategy. Enterprise Finance informs shareholders, regulators, taxing authorities, team members, and leaders of the company’s financial performance through earnings releases, investor meetings and conferences, and meetings with regulators and credit rating agencies, following appropriate reporting guidelines. They also maintain and enhance risk and financial controls and lead many of the company’s shared services functions including corporate properties, security, and global services.
As part of the newly formed AI Model Development COE in Enterprise Analytics and Data Science (EADS), which focuses on building, implementing, and monitoring AI models for the enterprise, the AI model development team for personalization, marketing, and virtual channels is looking for an experienced AI leader to manage the development of AI models for marketing.

This leader will be responsible for building and managing a team of data scientists to design, develop, and implement AI models focused on marketing’s AI priorities. Partnering with Wells Fargo AI technology team, Wells Fargo AI business solution team, and marketing executives, you and your team will deliver and deploy AI models on the Well Fargo AI open source platform to scale these solutions and embed them in our operational processes.
KEY RESPONSIBILITIES INCLUDE:
Build and grow a team of data scientists responsible for AI model development in support of marketing
Design, develop, and deploy AI models using state of the art AI techniques available in the open stack and/or vendor solutions
Partner with marketing executives to frame the problem, manage the model development process, and business relationship
Manage a portfolio of the data science projects including the following responsibilities:
Help finalize project scope working with business partners
On-going touch-base with business partners and governance stakeholders
Define priorities in partnership with the business partners during on-going development
Work with AI technology and production teams to operationalize models
May be called upon to review vendor models and solutions and/or models developed outside of EADS
Divisional Information:
Data Management and Insights (DMI) is transforming the way that Wells Fargo uses and manages data. Our work enables Wells Fargo to empower and inform our team members, deliver exceptional experiences for our customers, and meet the elevated expectations of our regulators. The team is responsible for designing the future data environment, defining data governance and oversight, and partnering with technology to operate the data infrastructure for the company. This team also provides next generation analytic insights to drive business strategies and help meet our commitment to satisfy our customers’ financial needs.
As a Team Member Manager, you are expected to achieve success by leading yourself, your team, and the business. Specifically you will:
Lead your team with integrity and create an environment where your team members feel included, valued, and supported to do work that energizes them.
Accomplish management responsibilities which include sourcing and hiring talented team members, providing ongoing coaching and feedback, recognizing and developing team members, identifying and managing risks, and completing daily management tasks.

Required Qualifications

8+ years of experience in analytics, modeling, or a combination of both
6+ years of management experience; or 6+ years of leadership experience in an advanced quantitative analytics function
A Master's degree or higher
5 + years of experience using quantitative machine learning techniques
4+ years of experience working with digital data science including analyzing cookie-level data


Desired Qualifications

Strong analytical skills with high attention to detail and accuracy
Ability to work and influence successfully within a matrix environment and build effective business partnerships with all levels of team members
Meeting facilitation experience in leading discussions that result in consensus and commitment


Other Desired Qualifications
Data science experience in the ad tech space (DMPs, DSPs, Google and/or Adobe Cloud, digital attribution)
4+ years managing or directing data scientist/ statistician/ data engineer teams
Hands on experience with deep learning toolkits such as Tensorflow, Keras, PyTorch, Dynet
Detail oriented. Experience with model governance requirements. Able to de-mystify AI models to make them transparent and explainable
Experience with agile project management methodologies for data science

Disclaimer

All offers for employment with Wells Fargo are contingent upon the candidate having successfully completed a criminal background check. Wells Fargo will consider qualified candidates with criminal histories in a manner consistent with the requirements of applicable local, state and Federal law, including Section 19 of the Federal Deposit Insurance Act.

Relevant military experience is considered for veterans and transitioning service men and women.

Wells Fargo is an Affirmative Action and Equal Opportunity Employer, Minority/Female/Disabled/Veteran/Gender Identity/Sexual Orientation.

ENT FINANCE"
5,Ultimate Hoops Statistician,"Plano, TX 75024",Plano,TX,75024,None Found,None Found,None Found,"
Assures all players are checked in and present on official scoresheets
Tracks all relevant statistics during games
Works closely with League Coordinator to ensure member satisfaction
Assists in game preparations and/or clean up as needed
Actively promotes Ultimate Hoops and Life Time Fitness to members and non-members
Articulates extensive knowledge of Ultimate Hoops and Life Time Fitness programs, products, services, policies and procedures to prospective and current members",None Found,"
High School Diploma or GED
Experience tracking full statistical data for basketball games","Description
Position Summary
The Statistician assists in the execution of Ultimate Hoops Basketball League by tracking full statistics for League games.
Job Duties and Responsibilities
Assures all players are checked in and present on official scoresheets
Tracks all relevant statistics during games
Works closely with League Coordinator to ensure member satisfaction
Assists in game preparations and/or clean up as needed
Actively promotes Ultimate Hoops and Life Time Fitness to members and non-members
Articulates extensive knowledge of Ultimate Hoops and Life Time Fitness programs, products, services, policies and procedures to prospective and current members
Position Requirements
High School Diploma or GED
Experience tracking full statistical data for basketball games"
6,Data Scientist,"Irving, TX 75038",Irving,TX,75038,None Found,None Found,None Found,None Found,None Found,None Found,"Reporting to our Director of Marketing Analytics, the Data Scientist (aka Marketing Analytics Analyst) charter is to increase the company’s profits through advanced analytics applied to business problems in Marketing, focusing on both online and offline marketing campaigns and strategies as well as consumer journey and conversion optimization. This individual will be a key member in an exciting, fast-paced, and growing team that is making an immediate impact across the entire consumer life cycle (prospecting, acquisitions, retention and re-activation). This is a great opportunity for a talented person to broaden his/her business skill set through exposure to a wide variety of business problems and challenge him/herself with projects that can span from tactical to strategic in nature. This position is based at our Administrative Office (HQ) in Irving (Las Colinas), Texas.
KEY RESPONSIBILITIES
Design, read, and report on marketing optimization tests for channels including Direct Mail, TV, Paid Search, Online Display, Paid Social, Email, and Radio
Identify, support, and implement new projects related to the overall improvement of Marketing business processes, serving as a key stakeholder for all aspects of the Marketing Analytics project life cycle (design, development, testing, implementation, monitoring)
Work closely with the Marketing team to devise, test, and analyze Marketing programs related to loyalty, lead-buying, referral incentives, personalization of messaging
Proactively collaborate with Information Technology (Database Engineers, Application Development, Business Intelligence), Product Development, Marketing, Compliance, Decision Science, Credit Risk Management, and other internal groups to implement new strategies, campaigns and tests relating to business opportunities
Successfully manage and complete multiple concurrent projects without getting losing focus
Provide timely and quantified recommendations in response to ad hoc analysis requests by the Director of Marketing Analytics and
Head of Risk Management and Decision Science
Develop actionable reports for use by the senior leadership team
REQUIREMENTS
BS in an analytical field such as Statistics, Econometrics, Applied Mathematics or other applied science degree
1 years of work experience
Advanced user of SAS/STAT procedures
Advanced user of SAS to merge and mold data sets into a useful format
Results-oriented self-starter who is confident in defending his/her critical thinking abilities
Proven track record of developing successful predictive analytics related to marketing activities and/or consumer behaviors
Capitalistic mindset supported by a strong business acumen and work ethic
Demonstrated ability to communicate ideas and analysis results effectively both verbally and in writing to a non-technical audience
Local (Dallas/Fort Worth area) candidates only – no relocation
Must be currently authorized to work in the United States without sponsorship and not require sponsorship in the future
PREFERRED QUALIFICATIONS
Master’s degree in Statistics or Econometrics strongly preferred
Previous experience as a Data Scientist, Statistician, Risk Analyst, Quantitative Analyst, or Marketing Analytics Analyst
1 years of coding experience in open source programming languages such as Python or R
Work experience in Marketing Related Analytics (digital or non-digital)
Work experience in consumer credit
COMPENSATION
Annual salary of $74,000
BENEFITS
Medical, dental, and vision
Voluntary life/ AD&D
Short-term & long-term disability
401K with company match
Paid vacation, holidays, and sick time
Paid maternity, paternity, extended medical leave, and jury duty
Corporate discount program on personal cell phone accounts with select providers
Business casual work environment
ABOUT COTTONWOOD
Founded in 1996, Cottonwood Financial is one of the largest privately held retail consumer finance companies in the United States. We have zero debt, have been profitable every year since inception, and our growth is funded entirely through internally generated capital. Headquartered in Irving (Las Colinas), Texas, we have company-owned locations, under our Cash Store brand, across the country. Through this national brick-and-mortar footprint, we provide best-in-class customer service and offer an innovative mix of financial products and services to our customers.
We have been named multiple times to the Inc. 5000 list of America’s fastest-growing private companies, as well as to the Dallas 100 list of the fastest-growing private companies in North Texas."
7,Statistician Intern,"Richardson, TX 75081",Richardson,TX,75081,None Found,"
Currently enrolled in BS math or engineering degree program
Student must have a data science background or strong statistic data analysis skills
Self-Starter with good communication skills.
Must have a 3.0 GPA or Higher.
Must be available to work 40 hours/week during the summer
",None Found,"
Work with procurement and manufacturing groups to collect relevant data
Analyze the data to build an inventory adjustment model
Learn to use machine data collection software
Work with equipment engineers to define chamber matching actions and apply control charts to key machine parameters
Provide weekly project status updates
",None Found,"
Work with procurement and manufacturing groups to collect relevant data
Analyze the data to build an inventory adjustment model
Learn to use machine data collection software
Work with equipment engineers to define chamber matching actions and apply control charts to key machine parameters
Provide weekly project status updates
","Site: TX - Richardson
Business Title: Statistician Intern
Shift: Normal Day


At Qorvo, our vision is to do more than create innovative RF solutions for the mobile, defense and infrastructure markets. We are helping to innovate and shape the future of wireless communications. For interns or college students like you, that means having access to amazing career-building opportunities. Whether you are interested in engineering, planning, research, marketing or manufacturing, Qorvo is large enough to engage you in many learning opportunities yet small enough for you to make a direct impact. Join our culture of innovation and enjoy how Qorvo is connecting the world by shaping and launching the next generation of RF solutions. Our mission at Qorvo starts with our employees. As a unified global team, we bring a commitment to excellence and growth and a passion for creating what's next. Explore the possibilities with us.

Degree Requirements: Mathematics, Applied Statistics, Electrical Engineering, or Mechanical Engineering

Description: An intern would work in the Texas Operations group on a couple of main projects. One project is to study the wafer loadings impact on consumption of spares and consumables. Results of the study would be to create a predictive model to use during inventory ramp up and reduction.

The second project would be to evaluate Bistel’s chamber matching software to align machine performance.

Responsibilities:

Work with procurement and manufacturing groups to collect relevant data
Analyze the data to build an inventory adjustment model
Learn to use machine data collection software
Work with equipment engineers to define chamber matching actions and apply control charts to key machine parameters
Provide weekly project status updates
Qualifications:

Currently enrolled in BS math or engineering degree program
Student must have a data science background or strong statistic data analysis skills
Self-Starter with good communication skills.
Must have a 3.0 GPA or Higher.
Must be available to work 40 hours/week during the summer
NOTE: Because this is a student internship, candidate must be a currently enrolled student in a degree-seeking accredited program.

Please Note: Because this position is located at our Richardson, TX location where we have contracts with the US government, qualified candidates must have US Worker status. This usually means they are a US citizen or hold a green card. Students on visas such as F-1 or J-1 do not qualify. If you hold one of these visas, we encourage you to apply to any of our positions in other company locations."
8,AI Model Development Lead for Virtual Channels (Analytic Manager 5),"Dallas, TX",Dallas,TX,None Found,None Found,"
8+ years of experience in analytics, modeling, or a combination of both
6+ years of management experience; or 6+ years of leadership experience in an advanced quantitative analytics function
A Master's degree or higher
5 + years of experience using quantitative machine learning techniques",None Found,None Found,None Found,None Found,"Overview:
Wells Fargo technology teams drive innovation to create a more powerful and fulfilling financial experience for our customers and team members. You will join more than 24,000 team members supporting 95 billion transactions annually in 10 countries. Our career opportunities span the technology spectrum: advanced analytics, big data, information security, application development, cloud enablement, project management and more.

SUCCESS PROFILE
Check out the top traits we're looking for and see if you have the right mix. Additional related traits listed below.

Analytical
Detail-oriented
Insightful
Inventive
Problem Solver
Curious
Benefits
Wells Fargo wants to help you get more out of life and take care of things outside the office to make life a little easier. We provide:

Medical, Dental and Vision
Employer Matching 401(k)
Tuition Reimbursment
Maternity and Paternity Leave
Paid Time Off
Responsibilties
Job Description
At Wells Fargo, we want to satisfy our customers’ financial needs and help them succeed financially. We’re looking for talented people who will put our customers at the center of everything we do. Join our diverse and inclusive team where you’ll feel valued and inspired to contribute your unique skills and experience.
Help us build a better Wells Fargo. It all begins with outstanding talent. It all begins with you.
Enterprise Finance drives financial management for the company and maintains and enhances risk and financial controls. Key functions within Enterprise Finance include finance and accounting; Treasury; corporate development, mergers, and acquisitions; Data Management and Insights, the Customer Remediation Center of Excellence, Enterprise Shared Services, Business Process Management, and Corporate Strategy. Enterprise Finance informs shareholders, regulators, taxing authorities, team members, and leaders of the company’s financial performance through earnings releases, investor meetings and conferences, and meetings with regulators and credit rating agencies, following appropriate reporting guidelines. They also maintain and enhance risk and financial controls and lead many of the company’s shared services functions including corporate properties, security, and global services.
As part of the newly formed AI Model Development COE in Enterprise Analytics and Data Science (EADS), which focuses on building, implementing, and monitoring AI models for the enterprise, the AI model development team for personalization, Virtual Channels, and virtual channels is looking for an experienced AI leader to manage the development of AI models for Virtual Channels.

This leader will be responsible for building and managing a team of data scientists to design, develop, and implement AI models focused on Virtual Channels’ AI priorities. Partnering with Wells Fargo AI technology team, Wells Fargo AI business solution team, and Virtual Channels executives, you and your team will deliver and deploy AI models on the Well Fargo AI open source platform to scale these solutions and embed them in our operational processes.

KEY RESPONSIBILITIES INCLUDE:
Build and grow a team of data scientists responsible for AI model development in support of Virtual Channels
Design, develop, and deploy AI models using state of the art AI techniques available in the open stack and/or vendor solutions
Partner with Virtual Channels executives to frame the problem, manage the model development process, and business relationship
Manage a portfolio of the data science projects including the following responsibilities:
Help finalize project scope working with business partners
On-going touch-base with business partners and governance stakeholders
Define priorities in partnership with the business partners during on-going development
Work with AI technology and production teams to operationalize models
Will be called upon to review vendor models and solutions and/or models developed outside of EADS
Divisional Information:
Data Management and Insights (DMI) is transforming the way that Wells Fargo uses and manages data. Our work enables Wells Fargo to empower and inform our team members, deliver exceptional experiences for our customers, and meet the elevated expectations of our regulators. The team is responsible for designing the future data environment, defining data governance and oversight, and partnering with technology to operate the data infrastructure for the company. This team also provides next generation analytic insights to drive business strategies and help meet our commitment to satisfy our customers’ financial needs.
As a Team Member Manager, you are expected to achieve success by leading yourself, your team, and the business. Specifically you will:
Lead your team with integrity and create an environment where your team members feel included, valued, and supported to do work that energizes them.
Accomplish management responsibilities which include sourcing and hiring talented team members, providing ongoing coaching and feedback, recognizing and developing team members, identifying and managing risks, and completing daily management tasks.

Required Qualifications

8+ years of experience in analytics, modeling, or a combination of both
6+ years of management experience; or 6+ years of leadership experience in an advanced quantitative analytics function
A Master's degree or higher
5 + years of experience using quantitative machine learning techniques


Desired Qualifications

Strong analytical skills with high attention to detail and accuracy
Ability to work and influence successfully within a matrix environment and build effective business partnerships with all levels of team members
Meeting facilitation experience in leading discussions that result in consensus and commitment


Other Desired Qualifications
4+ years managing or directing data scientist/ statistician/ data engineer teams
Hands on experience with deep learning toolkits such as Tensorflow, Keras, PyTorch, Dynet
Detail oriented. Experience with model governance requirements. Able to de-mystify AI models to make them transparent and explainable
Experience with agile project management methodologies for data science
Experience with Big Data or Hadoop tools such as Spark, Hive, Kafka and Map

Street Address
NC-Charlotte: 401 S Tryon St - Charlotte, NC
MN-Minneapolis: 600 S 4th St - Minneapolis, MN
NC-Charlotte: 11625 N Community House Road - Charlotte, NC
SC-Fort Mill: 3480 State View Blvd - Fort Mill, SC
TX-Addison: 5080 Spectrum Dr - Addison, TX
TX-DAL-Downtown Dallas: 1445 Ross Ave - Dallas, TX
TX-Irving: 5000 Riverside Drive - Irving, TX
AZ-Tempe: 1150 W Washington St - Tempe, AZ
IA-Des Moines: 6200 Park Ave - Des Moines, IA
IA-Des Moines: 800 Walnut St - Des Moines, IA
GA-Atlanta: 3579 Atlanta Ave - Atlanta, GA


Disclaimer

All offers for employment with Wells Fargo are contingent upon the candidate having successfully completed a criminal background check. Wells Fargo will consider qualified candidates with criminal histories in a manner consistent with the requirements of applicable local, state and Federal law, including Section 19 of the Federal Deposit Insurance Act.

Relevant military experience is considered for veterans and transitioning service men and women.

Wells Fargo is an Affirmative Action and Equal Opportunity Employer, Minority/Female/Disabled/Veteran/Gender Identity/Sexual Orientation.

ENT FINANCE"
