,Title,Location,City,State,Zip,Country,Qualifications,Skills,Responsibilities,Education,Requirement,FullDescriptions
0,Statistician,"Dallas, TX 75251",Dallas,TX,75251,None Found,None Found,None Found,None Found,None Found,None Found,"Job Title: Statistician
Location: Dallas, TX 75251
2019 Dallas/ Fort Worth Winner for the ‘Best and Brightest Companies to Work For’

We’re currently recruiting for a Statistician that will be responsible for developing credit and behavioral scoring models, statistical models, performing statistical analysis and developing predictive models for loan acquisition and loan servicing purposes. In this role, you’ll be monitoring and validating model performance and updating models as needed; developing and maintaining various databases, technical models and reports required to support research, data gathering, and analytic responsibilities

What You’ll Do:

Develop a rapport with the various operational groups to obtain a strong understanding of the challenges the various operational groups are attempting to solve
Conduct ad hoc research projects incorporating project design, data collection and analysis; summarizing findings and presenting results
Develop recommendations for operational policies and procedures and gathering and analyzing data to determine impact to business operations.
Develop analytical tools that will be used to forecast losses, delinquency, or assist with pricing decisions

What You Bring:

6+ years’ experience of related work experience within a finance company – preferably commercial truck or auto finance
Bachelor's Degree in Statistics, Applied Mathematics, Econometrics, Operations Research or similar quantitative field REQUIRED
Master's Degree in Statistics, Applied Mathematics, Econometrics, Operations Research or similar quantitative field preferred
Working experience with SQL
Advanced process and model documentation skills
Advanced quantitative skills and ability to apply complex statistical principles

Perks of working at Freedom Truck Finance:

Three weeks PTO
10 holidays; 1 day being your birthday!
FTF gives back! All employees receive 4 paid volunteer days per year
Casual dress code
100% Employee only cost is covered for Health Care (Medical, Dental, Vision, Life Insurance/AD&D)
401(k) with company matching effective immediately to prepare for your future

About Freedom Truck Finance:
Freedom Truck Finance, based in Dallas, Texas, provides financing, warranty and emergency roadside solutions to independent owner operators. Freedom was founded in 2013, with the goal of transforming the trucking industry through technology-driven systems, data-centric processes and a highly relational model of customer service. Freedom strives to build a platform that encourages our workforce, fulfills the needs of our dealer base, and creates an opportunity for the success of our mutual customers.

Freedom Truck Finance is an equal opportunity employer. All qualified applicants will receive consideration for employment without regard to race, color, religion, sex, sexual orientation, gender identity, gender expression, national origin, age, protected veteran or disabled status, or genetic information.

Must pass background check and drug screen prior to employment"
1,Statistician,"Irving, TX",Irving,TX,None Found,None Found,None Found,None Found,None Found,None Found,None Found,"Abbott is a global healthcare leader that helps people live more fully at all stages of life. Our portfolio of life-changing technologies spans the spectrum of healthcare, with leading businesses and products in diagnostics, medical devices, nutritionals and branded generic medicines. Our 103,000 colleagues serve people in more than 160 countries.
Position Summary:
Provide appropriate statistical input into study design and analysis of data.
Ensures accuracy of programs and documents.
Participates in statistical or process related presentations to customers.
Main Responsibilities:
Developing Statistical Plan: Effectively communicates with project manager/CRA to understand to objectives of the study.
Follows the appropriate operating procedure required for developing the statistical plan.
Demonstrates the ability to research and provide appropriate statistical input to the study design.
Using templates or examples, writes accurate statistical plans that are clear and understandable to the reviewers.
Explains the rationale of the statistical methods to the project team.
Study Preparation: Meets with CRA, R&D, Instrumentation scientists, department data collection programmers, and data entry to find the best way of capturing the data.
Reviews the study protocol; understands the protocol; and ensures that the correct data is being collected to achieve the objective(s) of the protocol.
Includes data management in the planning for the study.
Makes data management aware of the schedule and any special manual data entry that will be required.
Completes the study documentation that is required.
Reviews all case report forms (CRFs) for completeness, accuracy, and appropriateness.
Gets a project numbers assigned.
Arranges with systems personnel to get the project directory set-up.
Attends and participates in the team meetings.
Data Analysis: Write SAS code and R code for common statistical analyses.
Understands and correctly uses validated SAS and R macros in the data analysis programs.
Understands program verification procedure; writes and executes program verification plans.
Conducts thorough and detailed reviews of project documentation, program algorithms and analysis outputs.
Interprets the analysis output clearly and effectively.
Identifies data analysis related issues and resolves promptly Post Analysis Activities: Participates in the creation of the verification plan and line listings.
Prepares and reviews statistical sections contained in submissions and other publications.
Prepares statistical summaries in a timely manner for team and management review.
Files documents and archives projects according to current department procedures.
biostatistics Project Management: Ensures that the appropriate personnel receive daily observation line (DOL's). Successfully troubleshoots data issues.
Prepares for data reviews throughout the study.
Creates a realistic timeline and adheres to the timeline.
Attends team meetings regularly.
Participates in the discussions.
Follows the appropriate operating procedure required within the division and department.
Effectively communicates information to supervisor and team members regarding the progress of the study.
Explains the rationale of the statistical methods to the project team.
Develops experimental design and performs statistical analyses for studies.
Participates on project teams.
Performs SAS and R programming to generate analyses of data.
Responsible for implementing and maintaining the effectiveness of the quality system.
Accountability/Scope:
Accountable for proper use of statistics and for the validity of conclusions drawn.
Performs many tasks with minimal assistance.
Qualifications/Experience:
B.S. Statistics (or related field) + 1-year experience or MS/PhD in Statistics (or related field)
SAS and R programming, statistical writing, experience in data analysis.
Knowledge of regulations and standards affecting IVDs and Biologics."
2,AI Model Development Lead For Marketing (Analytics Manager 5),"Dallas, TX",Dallas,TX,None Found,None Found,"
8+ years of experience in analytics, modeling, or a combination of both
6+ years of management experience; or 6+ years of leadership experience in an advanced quantitative analytics function
A Master's degree or higher
5 + years of experience using quantitative machine learning techniques
4+ years of experience working with digital data science including analyzing cookie-level data",None Found,None Found,None Found,None Found,"Overview:
Wells Fargo technology teams drive innovation to create a more powerful and fulfilling financial experience for our customers and team members. You will join more than 24,000 team members supporting 95 billion transactions annually in 10 countries. Our career opportunities span the technology spectrum: advanced analytics, big data, information security, application development, cloud enablement, project management and more.

SUCCESS PROFILE
Check out the top traits we're looking for and see if you have the right mix. Additional related traits listed below.

Analytical
Detail-oriented
Insightful
Inventive
Problem Solver
Curious
Benefits
Wells Fargo wants to help you get more out of life and take care of things outside the office to make life a little easier. We provide:

Medical, Dental and Vision
Employer Matching 401(k)
Tuition Reimbursment
Maternity and Paternity Leave
Paid Time Off
Responsibilties
Job Description
At Wells Fargo, we want to satisfy our customers’ financial needs and help them succeed financially. We’re looking for talented people who will put our customers at the center of everything we do. Join our diverse and inclusive team where you’ll feel valued and inspired to contribute your unique skills and experience.
Help us build a better Wells Fargo. It all begins with outstanding talent. It all begins with you.
Enterprise Finance drives financial management for the company and maintains and enhances risk and financial controls. Key functions within Enterprise Finance include finance and accounting; Treasury; corporate development, mergers, and acquisitions; Data Management and Insights, the Customer Remediation Center of Excellence, Enterprise Shared Services, Business Process Management, and Corporate Strategy. Enterprise Finance informs shareholders, regulators, taxing authorities, team members, and leaders of the company’s financial performance through earnings releases, investor meetings and conferences, and meetings with regulators and credit rating agencies, following appropriate reporting guidelines. They also maintain and enhance risk and financial controls and lead many of the company’s shared services functions including corporate properties, security, and global services.
As part of the newly formed AI Model Development COE in Enterprise Analytics and Data Science (EADS), which focuses on building, implementing, and monitoring AI models for the enterprise, the AI model development team for personalization, marketing, and virtual channels is looking for an experienced AI leader to manage the development of AI models for marketing.

This leader will be responsible for building and managing a team of data scientists to design, develop, and implement AI models focused on marketing’s AI priorities. Partnering with Wells Fargo AI technology team, Wells Fargo AI business solution team, and marketing executives, you and your team will deliver and deploy AI models on the Well Fargo AI open source platform to scale these solutions and embed them in our operational processes.
KEY RESPONSIBILITIES INCLUDE:
Build and grow a team of data scientists responsible for AI model development in support of marketing
Design, develop, and deploy AI models using state of the art AI techniques available in the open stack and/or vendor solutions
Partner with marketing executives to frame the problem, manage the model development process, and business relationship
Manage a portfolio of the data science projects including the following responsibilities:
Help finalize project scope working with business partners
On-going touch-base with business partners and governance stakeholders
Define priorities in partnership with the business partners during on-going development
Work with AI technology and production teams to operationalize models
May be called upon to review vendor models and solutions and/or models developed outside of EADS
Divisional Information:
Data Management and Insights (DMI) is transforming the way that Wells Fargo uses and manages data. Our work enables Wells Fargo to empower and inform our team members, deliver exceptional experiences for our customers, and meet the elevated expectations of our regulators. The team is responsible for designing the future data environment, defining data governance and oversight, and partnering with technology to operate the data infrastructure for the company. This team also provides next generation analytic insights to drive business strategies and help meet our commitment to satisfy our customers’ financial needs.
As a Team Member Manager, you are expected to achieve success by leading yourself, your team, and the business. Specifically you will:
Lead your team with integrity and create an environment where your team members feel included, valued, and supported to do work that energizes them.
Accomplish management responsibilities which include sourcing and hiring talented team members, providing ongoing coaching and feedback, recognizing and developing team members, identifying and managing risks, and completing daily management tasks.

Required Qualifications

8+ years of experience in analytics, modeling, or a combination of both
6+ years of management experience; or 6+ years of leadership experience in an advanced quantitative analytics function
A Master's degree or higher
5 + years of experience using quantitative machine learning techniques
4+ years of experience working with digital data science including analyzing cookie-level data


Desired Qualifications

Strong analytical skills with high attention to detail and accuracy
Ability to work and influence successfully within a matrix environment and build effective business partnerships with all levels of team members
Meeting facilitation experience in leading discussions that result in consensus and commitment


Other Desired Qualifications
Data science experience in the ad tech space (DMPs, DSPs, Google and/or Adobe Cloud, digital attribution)
4+ years managing or directing data scientist/ statistician/ data engineer teams
Hands on experience with deep learning toolkits such as Tensorflow, Keras, PyTorch, Dynet
Detail oriented. Experience with model governance requirements. Able to de-mystify AI models to make them transparent and explainable
Experience with agile project management methodologies for data science

Disclaimer

All offers for employment with Wells Fargo are contingent upon the candidate having successfully completed a criminal background check. Wells Fargo will consider qualified candidates with criminal histories in a manner consistent with the requirements of applicable local, state and Federal law, including Section 19 of the Federal Deposit Insurance Act.

Relevant military experience is considered for veterans and transitioning service men and women.

Wells Fargo is an Affirmative Action and Equal Opportunity Employer, Minority/Female/Disabled/Veteran/Gender Identity/Sexual Orientation.

ENT FINANCE"
3,Data Scientist,"Dallas, TX 75252",Dallas,TX,75252,None Found,None Found,None Found,"
Research and develop statistical models for data analysis
Identify and direct valueadd initiatives within the business involving advanced statistical techniques
Create and maintain documentation regarding advanced analytical initiatives
Work with Reporting Engineers, the Reporting Engagement team, and Self Service Analysts to understand analytical demand within the business, coordinate to meet that demand, and effectively communicate results to the business
Keep up to date with the latest relevant technology
Help the business implement statistical methodologies for real world, value add results",None Found,None Found,"Who We Are:
Informa is one of the world's leading knowledge providers. We create and deliver highly specialized information through publishing, events, training, market intelligence and expertise, providing valuable knowledge to individuals, businesses and organizations worldwide.
Informa Markets is among the world's top Exhibitions organizers, organizing events that enable buyers and sellers in specialist communities to meet face to face, build relationships and conduct business. Informa has an extensive and diverse portfolio serving several core verticals.
Global Reporting & Analytics:
The Global Reporting & Analytics team at Informa Markets delivers timely and actionable information, as well as providing advanced analytic support to all areas of the business. Using enterprise level reporting and analytics tools, the Global Reporting & Analytics team provides value add deliverables, as well as training to self-service users within the business. It is the goal of Global Reporting & Analytics to enable channels that deliver the most timely and reliable data to the decision makers within the business.
Position Description:
The Data Scientist is a specialized position responsible for ad hoc analyses and projects requiring knowledge of advanced statistical methodologies and tools. This position is an expert statistician possessing experience with various analytics tools (R, SAS JMP, Python, Alteryx, etc.). The successful candidate will work with business and technical resources to identify, coordinate, and guide advanced analytic endeavors. The Data Scientist will also have the ability to effectively communicate findings to all levels of the business.
Responsibilities:
Research and develop statistical models for data analysis
Identify and direct valueadd initiatives within the business involving advanced statistical techniques
Create and maintain documentation regarding advanced analytical initiatives
Work with Reporting Engineers, the Reporting Engagement team, and Self Service Analysts to understand analytical demand within the business, coordinate to meet that demand, and effectively communicate results to the business
Keep up to date with the latest relevant technology
Help the business implement statistical methodologies for real world, value add results
Skill Set:
Expert in statistical methods and predictive modeling
Extensive experience in data mining
Excellent SAS JMP skills
Strong communications skills and ability to coordinate project teams
Strong SQL development skills
Strong skill with R and/or Python a plus
Strong knowledge of MS Power BI preferred
We Offer:
Competitive Compensation Package
Access to LinkedIn Learning and other development/training opportunities
Health and Wellness Benefits (medical, dental, eye)
401K and Matching
Employee Stock Purchase Program
Generous PTO policy
Work-life balance
Additional discounts through various partnerships
Informa is an Equal Opportunity Employer, and all qualified applicants will receive consideration for employment without regard to race, color, religion, sex, gender identity, sexual orientation, or national origin."
