,Title,Location,City,State,Zip,Country,Qualifications,Skills,Responsibilities,Education,Requirement,FullDescriptions
48,"Software Engineer, Infrastructure","Pittsburgh, PA 15213",Pittsburgh,PA,15213,None Found,None Found,None Found,"
Build and develop our platforms, systems and infrastructure using your background in distributed systems and large-scale storage systems.
Manage individual projects priorities, deadlines and deliverables with your technical expertise.
Design, develop, test, deploy, maintain, and enhance software solutions.
",None Found,None Found,"In school or graduated within last 9 months? We encourage you to apply to openings on the Student Jobs site
Minimum qualifications:

Bachelor's degree in Computer Science or a related technical field or equivalent practical experience.
1 year of relevant work experience in software development.
Professional coding experience in C/C++, Java, Python or Go.
Experience in architecting and developing large-scale distributed systems. Experience in concurrency, multithreading and synchronization.

Preferred qualifications:

Master's degree or PhD in Computer Science.
Experience with Unix/Linux environments, and TCP/IP and network programming.
Experience with database internals, database language theories, database design, SQL and database programming.
Understanding of technologies such as virtualization and global infrastructure, load balancing, networking, massive data storage, Hadoop, MapReduce and security.
About the job
Google's software engineers develop the next-generation technologies that change how billions of users connect, explore, and interact with information and one another. Our products need to handle information at massive scale, and extend well beyond web search. We're looking for engineers who bring fresh ideas from all areas, including information retrieval, distributed computing, large-scale system design, networking and data storage, security, artificial intelligence, natural language processing, UI design and mobile; the list goes on and is growing every day. As a software engineer, you will work on a specific project critical to Google’s needs with opportunities to switch teams and projects as you and our fast-paced business grow and evolve. We need our engineers to be versatile, display leadership qualities and be enthusiastic to take on new problems across the full-stack as we continue to push technology forward.
As a Software Engineer working on Google's infrastructure, you'll have the opportunity to work on everything from the core platform that runs the world's largest distributed network to redefining the systems that allow applications and services to provide useful information to billions of users around the globe. From our Data Center software groups to Google's Cloud Platform, Gmail to YouTube, our infrastructure engineers wrestle with the vast scale of a ubiquitous system, its products, and services, and revolutionize industry leading technologies to handle the sheer magnitude at which Google operates.
Google is and always will be an engineering company. We hire people with a broad set of technical skills who are ready to take on some of technology's greatest challenges and make an impact on millions, if not billions, of users. At Google, engineers not only revolutionize search, they routinely work on massive scalability and storage solutions, large-scale applications and entirely new platforms for developers around the world. From Google Ads to Chrome, Android to YouTube, Social to Local, Google engineers are changing the world one technological achievement after another.
Responsibilities
Build and develop our platforms, systems and infrastructure using your background in distributed systems and large-scale storage systems.
Manage individual projects priorities, deadlines and deliverables with your technical expertise.
Design, develop, test, deploy, maintain, and enhance software solutions.
At Google, we don’t just accept difference—we celebrate it, we support it, and we thrive on it for the benefit of our employees, our products and our community. Google is proud to be an equal opportunity workplace and is an affirmative action employer. We are committed to equal employment opportunity regardless of race, color, ancestry, religion, sex, national origin, sexual orientation, age, citizenship, marital status, disability, gender identity or Veteran status. We also consider qualified applicants regardless of criminal histories, consistent with legal requirements. See also Google's EEO Policy and EEO is the Law. If you have a disability or special need that requires accommodation, please let us know by completing this form."
49,Sr. Software Dev Engineer,"Pittsburgh, PA",Pittsburgh,PA,None Found,None Found,None Found,None Found,None Found,None Found,None Found,"Bachelor’s and/or Master's Degree in Computer Science or related degree.5+ years of professional software development experience.Proficiency in Java or C++, and Object-oriented Design skills.Application Architecture and Design Patterns.Candidates must possess strong verbal and written communication skills and demonstrated technical leadership.Experience in development of distributed/scalable systems and high-volume transaction applications.

We are innovating on how customers globally interact with Amazon products and services, and are looking for a software engineer to help us revolutionize the localization of content for the organization. Like challenging, fast pace environments and have a passion for data, languages, and other cultures? Enjoy working with engineers in an organization that deals with some of the largest scale problems across Amazon? Do you want to be on the ground level of a new way to deliver localized content to Amazon business units worldwide? If so, the Machine Translation team wants to talk to you!
As a Software Engineer you will work with your manager to lay out and own the architectural vision for a team of highly skilled software engineers in the localization space. In this specific role, you will get to work with the latest AWS technologies in the industry to build next-generation localization and translation solutions to benefit all of Amazon. In partnership with the rest of the International Technologies group, your team will assist in assuring operation excellence across all of Amazon’s translation services. This is a unique opportunity at Amazon with great exposure as all of Amazon will be your customer!
If you like to work hard, have fun, and make a difference, this is the team for you!
Key Responsibilities:
Act as a builder and architect, design, and develop world class, scalable distributed systems.Recruit, hire, mentor and coach Software Development Engineers.Interface with our internal customers to understand requirements, set priorities and communicate direction and progress.Take on hard, ambiguous problems and articulate solutions that will be able to serve broader Amazon.Help develop long-term technical and business strategies in the machine translation space.

Graduate degree a plusExperience with distributed (multi-tiered) systems, algorithms, and relational databasesPreferred experience on a UNIX or Linux platformAbility to effectively articulate technical challenges and solutionsDeal well with ambiguous/undefined problems; ability to think abstractlyExperience working pragmatically under deadlines with operational softwareMultilingual (any language other than English)Experience with localization developmentExceptional customer support focus and skillsExperience working pragmatically under deadlines with operational softwareExperience in an engineering leadership position where you have been the owner of a technical architecture with other engineers working under your guidance.Strong business and technical vision."
50,Software Engineer,"Pittsburgh, PA 15201",Pittsburgh,PA,15201,None Found,None Found,None Found,None Found,None Found,"
2+ years of industry experience building scalable web products
A solid practical foundation in computer science, with the ability to find and fix bottlenecks in your code, as well as articulate the tradeoffs you've made
A strong background in the JavaScript language and its primitives
Experience architecting, building, and scaling web applications from scratch
Experience with AWS or similar cloud-based computing and hosting systems
Familiarity with Git or other version control systems
A desire to learn, grow, and teach skills to further your abilities along with the capabilities of the entire team","The Team:
Fitt is a new way to discover health and fitness. Our location-based platform—available on the web, iOS, and Andriod—helps users find nearby fitness studios, healthy restaurants, outdoor adventures, and upcoming events in 29 cities across the US, Canada, the UK, and Australia.
The Role:
We are looking for a software engineer to join our team to help build and maintain all aspects of the Fitt platform.
In this role, you will have the opportunity to be involved in all facets of the product lifecycle, from pitching new ideas to building and scaling them out to end-users. This allows us to iterate on ideas quickly and use any emerging technologies as we need them. You'll also be joining a team that is engineering focused and strongly promotes ideas from engineers to help define our roadmap.
You will have a key role in taking new products from design to launch while also maintaining the existing code bases.
Our main products include our website, iOS app and Android, a fully-custom CMS, and an API behind it all. We currently work in React and React Native with a Node.js and MongoDB backend.

In this role, you'll:
Work with our team to architect, build, and maintain web and mobile applications
Deliver code that is scalable, readable, and flexible enough to adapt to changing requirements
Create a cohesive testing strategy and build the integrations required to achieve it
Work closely with the team to discover pain-points and architect solutions
Scale existing products as needed
Review team members' code to ensure it follows our style guidelines and to catch any issues
Refactor existing code as needed to keep it current as requirements change
Report directly to our Head of Engineering
Requirements:
2+ years of industry experience building scalable web products
A solid practical foundation in computer science, with the ability to find and fix bottlenecks in your code, as well as articulate the tradeoffs you've made
A strong background in the JavaScript language and its primitives
Experience architecting, building, and scaling web applications from scratch
Experience with AWS or similar cloud-based computing and hosting systems
Familiarity with Git or other version control systems
A desire to learn, grow, and teach skills to further your abilities along with the capabilities of the entire team
Apply with a cover letter and resume to dev@fitt.co
jWqW7mw5zM"
51,Production Software Engineer (Site Reliability),"Pittsburgh, PA",Pittsburgh,PA,None Found,None Found,None Found,None Found,None Found,None Found,None Found,"Aurora Overview

Bringing self-driving vehicles to our roads is the most transformative opportunity of our generation. Aurora is taking a fresh start with the development of self-driving technology, combining excellence in AI, rigorous engineering, and a team with decades of experience building robots that work.

Led by a team of seasoned experts, including three of the world's leaders of self-driving technology, our mission is to deliver the benefits of self-driving technology safely, quickly, and broadly. We are designing the software and hardware to power the transportation of our future that will make our roads safer, give more people access to mobility, and reduce congestion and pollution in cities - improving the quality of life for all. The challenge in what we are endeavoring to achieve is transcendent; we are developing perhaps the world's most complex computing system and asking it to perform the task of transporting and keeping safe our most precious asset: human life.

We're looking for people who are as excited as we are to solve these complex problems and make this tremendous impact on our future, and who want to be surrounded by great people while we do it. At Aurora, software engineers in Production Engineering are focused on reliably and quickly applying the benefits of large-scale distributed systems to dramatically accelerate the development and deployment of self driving technology. We balance the hardening of trailblazing approaches to infrastructure necessary for exploration of modern applied machine learning, with the discipline of knowing ""the price of reliability is the pursuit of the utmost simplicity. ( https://en.wikipedia.org/wiki/Tony_Hoare )""

Responsibilities


Lifecycle ownership of development/deployment/improvement for Aurora's production systems.
Real-time rapid response, diagnosis, and mitigation for faults in our most critical infrastructures.
Document, educate, train, and evangelize best in class approaches to infrastructure for machine learning, batch processing, and data analysis.
Continuous introspection and improvement of system reliability, performance, and efficiency through monitoring, metrics, intentional fault injection, failure mode analysis, and incident review.

Essential


BS in Computer Science or a related field, or equivalent experience.
Experience in Python. Expertise in other languages welcome.
Experience in Linux software development and performance optimization.
Deep understanding of complex systems lifecycle in public cloud and private infrastructure.

Desirable


Background in public cloud infrastructure, with a slight preference for Google Cloud experience.
Experience with algorithms, data structures, complexity analysis and software design.
C++ programming
Exposure to TensorFlow training pipelines and infrastructure.
Understanding of object storage based data management and analysis.

Working at Aurora

Our work has real purpose. Delivering self-driving will improve lives around the world, expanding access to transportation, revitalizing cities, giving people more time back every day.

We're one team. We're inspired by the challenge of what we're solving and the impact our work will have on society. Our camaraderie is built on respect for our work and the fundamental belief our success will be a result of working together.

The Founding Team

Aurora has assembled the most experienced leadership team in the space. Chris Urmson helped lead Carnegie Mellon's efforts in Darpa's Grand Challenges, then was a founding member of Google's self-driving team. Sterling Anderson worked on the tech at MIT before leading Tesla's Autopilot system. Drew Bagnell, also a Carnegie Mellon alum, is a machine learning expert who helped build Uber's autonomy effort. At Aurora, these three continue to bring experts from all areas of the industry to the team. We are funded by some of Silicon Valley's best venture capital firms, including Greylock and Index Ventures."
52,Software Engineer - Telepresence,"Pittsburgh, PA",Pittsburgh,PA,None Found,None Found,None Found,None Found,None Found,None Found,None Found,"Come invent the future. At Facebook Reality Labs, software development is vital to turbocharging our scientific explorations and generating viable paths to the consumer products people will use for decades to come — products that will literally give people super powers. If you're a C/C++ software engineering expert with deep knowledge of real-time systems, with a love for solving novel problems from first principles, and an aptitude for optimization, you'll thrive in our collaborative environment. Join a world-class team of pioneers experimenting with breakthrough interaction technology, including virtual humans, from capture to reproduction. Partner with expert research scientists, mechanical engineers, electrical engineers and other brilliant software minds to build cutting-edge prototypes and create the technology that makes AR/VR universal. At the Pittsburgh lab, we aspire to a vision of social VR and AR, where people are able to interact with each other across distances in a way that is indistinguishable from in-person interactions. We're just getting started. You can help us make this dream a reality.
RESPONSIBILITIES
Analyze, evaluate, design, develop, integrate, debug and test real-time AR and VR software for realistic telepresence
Help design and build a next generation user interaction software platform for AR/VR
Work side by side with research scientists to enable an array of user studies that evaluate the perceptual effects of various AR/VR interactions
Collaborate in a team environment across multiple scientific and engineering disciplines, making the architectural trade-offs required to rapidly deliver software solutions
Write clean readable code, debug complex problems that span systems, prioritize ruthlessly and get things done with a high level of efficiency
Learn constantly, educate others, dive into new areas with unfamiliar technologies, and embrace the ambiguity of AR/VR problem solving
MINIMUM QUALIFICATIONS
3+ years experience with modern C++ (14 and above)
Demonstrated architecture and design experience
Experience creating or extending real-time 3D engine systems such as graphics rendering, audio, physics, networking or animation
Track record of going from prototype to production ready code
Experience working independently and in a cross-functional environment
PREFERRED QUALIFICATIONS
5+ years experience with modern C++ (14 and above)
Experience evaluating sensor input and performing sensor fusion
Experience with computer vision
Experience with machine learning
Experience with applied linear algebra and 3D geometry
Experience developing AR/VR applications
Experience with real-time physics simulations
Experience with novel input systems
Facebook is committed to providing reasonable accommodations for qualified individuals with disabilities and disabled veterans in our job application procedures. If you need assistance or an accommodation due to a disability, you may contact us at accommodations-ext@fb.com."
53,Autonomous Driving Software Engineer - Planning,"Pittsburgh, PA 15238",Pittsburgh,PA,15238,None Found,None Found,None Found,None Found,None Found,None Found,"Aptiv Autonomous Mobility
Our real-world mobility solutions are driving us toward a safer, greener and better- connected future. Aptiv is providing the “brain” and “nervous system” for vehicles that will change the face of mobility for people worldwide.Aptiv’s Autonomous Mobility team is focused on developing and commercializing autonomous vehicles and systems that enable point-to-point mobility via large fleets of autonomous vehicles in challenging urban driving environments. With talented teams working across the globe, from Boston to Singapore, Aptiv was the first company to deploy a commercial, point-to-point autonomous ride-hailing service based in Las Vegas, Nevada.In November 2017, Aptiv acquired autonomous vehicle software startup nuTonomy, an integral part of Aptiv’s Autonomous Mobility team. With continued research, development, and both current and future commercial deployments, we are looking for talented and passionate people to join our team.Work with leading engineers, research scientists, marketers and business development experts, all while enabling the future of mobility. At Aptiv, we believe that our mobility solutions have the power to change the world. For more information, please visit www.aptiv.com/our-journey and see our www.aptiv.com/careers for opportunities.

About this position
Our Software Engineers play a key role in making the vehicle of the future a reality by developing technologies that deliver a turnkey, fully autonomous driving system for our customers. Do you enjoy the challenge of working in a complex and growing system where new features are being added and evaluated rapidly? Do you enjoy working closely with roboticists and engineers to bring groundbreaking algorithms from concept to prototype and from prototype to a product deployed in the real world at scale? If the answers are yes, we’re looking for you.
How You’ll Make a Difference
Develop clean software for the motion planning and decision-making modules that sit at the core of autonomous driving systems and interface with all other key modules such localization, control, and perception.
Collaborate with motion planning experts and experienced roboticists on cutting edge algorithms from design, prototyping, testing, deployment, to production.
Contribute robust and scalable code that enables rapid exploration and evaluation of different motion planning approaches and algorithms.
Show initiative and be a valued team member in our innovative, fast-paced, entrepreneurial environment where cooperative teamwork is the norm.

What You'll Bring
Bachelor’s degree or higher in Computer Science or relevant field.
2+ years of software development experience.
C++ (i.e. C++11, C++14) development experience in a Unix/Linux environment.
Knowledge of software engineering principles including software design, source control management, build processes, code reviews, testing methods.
Strong problem-solving skills and ability to learn.
Strong communication and interpersonal skills.
Flexible and creative thinking.
Experience in working with robotic systems in a research environment is a plus.
Knowledge in motion planning, controls, and other robotics-related fields is a plus.
Experience in developing software for safety-critical applications is a plus.
Python experience is a plus.

Aptiv is an equal employment opportunity employer. All qualified applicants will receive consideration for employment without regard to race, color, religion, national origin, sex, gender identity, sexual orientation, disability status, protected veteran status or any other characteristic protected by law."
54,"Software Engineer, Build and Release","Pittsburgh, PA 15222",Pittsburgh,PA,15222,None Found,"
BS or MS in Computer Science or equivalent work experience
Experience working with build systems, environments, and continuous integration: CMake/Catkin/Bazel, Docker, Linux, Git, Jenkins pipelines
Experience working with software version control systems, packaging, and artifact management: Git/Mercurial, debians/wheels/containerization
Proficiency with Python and Bash",None Found,"
Build and maintain a simplified reproducible build environment for robotics code that allows graphics and native development
Extend tooling for generating and managing release artifacts
Support the robot CI/CD process
Work with robotics developers to enhance our build and test process",None Found,None Found,"Bossa Nova is the leading provider of real-time, on-shelf product data for the global retail industry. Our robots navigate the busy retail ecosystem, collecting a wealth of data that allows retailers to improve product availability, streamline operations, and create a better shopping experience. Our multidisciplinary team of robotics, artificial intelligence, and big data scientists has solved the challenges to deploy fully autonomous retail service robots and deliver actionable data in real-time.
Bossa Nova's robots are currently deployed in 50 stores across the United States, making it the largest deployment of this kind of technology anywhere in the world.
Position: Software Engineer, Build and Release
Location: Pittsburgh, PA
Job Description:
We need your help to support the building, testing, and deployment of robotics software that autonomously navigates hundreds of miles (and rapidly growing!) of retail environments every day.
As part of the system engineering and architecture team supporting our robotics codebase, you'll be part of the group that ensures that robot code builds, tests, and deploys correctly for the internal consumers of our services.
Your work will enable our internal teams to rapidly deploy services; quickly diagnose, escalate, and resolve issues; and help the team scale. This will enable us to meet the ever growing needs of our customers and fleet of robots.
Responsibilities:
Build and maintain a simplified reproducible build environment for robotics code that allows graphics and native development
Extend tooling for generating and managing release artifacts
Support the robot CI/CD process
Work with robotics developers to enhance our build and test process
Qualifications:
BS or MS in Computer Science or equivalent work experience
Experience working with build systems, environments, and continuous integration: CMake/Catkin/Bazel, Docker, Linux, Git, Jenkins pipelines
Experience working with software version control systems, packaging, and artifact management: Git/Mercurial, debians/wheels/containerization
Proficiency with Python and Bash
We offer a comprehensive benefits package including medical, dental, vision, PTO days, 10 company holidays, a 401(k) plan, and education assistance. And on top of all that, we also offer a variety of perks such as lunches twice a week, schedule flexibility, a stocked fridge and kitchen.
Bossa Nova Robotics provides equal employment opportunities (EEO) to all employees and applicants for employment without regard to race, color, religion, sex, national origin, age, disability or genetics. In addition to federal law requirements, Bossa Nova abides by applicable state and local laws governing nondiscrimination in employment in every location in which the company has facilities. This policy applies to all terms and conditions of employment, including recruiting, hiring, placement, promotion, termination, layoff, recall, transfer, leaves of absence, compensation and training.
QcaAEbKswH"
