,Title,Location,City,State,Zip,Country,Qualifications,Skills,Responsibilities,Education,Requirement,FullDescriptions
0,Associate Software Engineer- 2012536,"Pittsburgh, PA 15213",Pittsburgh,PA,15213,None Found,None Found,"
You have the skills to analyze customer requirements and provide novel solutions.
Willingness and ability to provide accurate estimates of development time and risk.
Capable to attend customer meetings and respond to customer requirements. Ability to multitask, solve problems and work with end users.
Ability to quickly learn new technologies (COTS/GOTS) and integrate them with existing applications and/or systems.
Knowledge of various hardware architectures and embedded systems. Embedded system design and embedded software implementation.",None Found,None Found,"
BS in computer science, software engineering, computer engineering, or a related quantitative field of study with three (3) years of applicable experience
MS in computer science, software engineering, computer engineering, or a related quantitative field of study with one (1) year of applicable experience.
Willingness to travel to various locations to support the SEI’s overall mission. This includes within the SEI and CMU community, sponsor sites, conferences, and offsite meetings on occasion. Expected 15%
You will be subject to a background check and will need to obtain and maintain a Department of Defense security clearance.","What We Do:
CERT is part of the Software Engineering Institute (SEI), a federally funded research and development center at Carnegie Mellon University in Pittsburgh, Pennsylvania. We engage in state of the art research and development, and provides robust programs focused on ensuring that software developers, internet security experts, network and system administrators, and others are able to resist, recognize, and recover from attacks on networked systems.
Position Summary:
As a member of CERT Systems Team, you will be responsible for crafting, developing, and deploying software applications and systems to improve the capabilities of CERT customers. You will participate in all phases of the software development lifecycle, and will be involved in key decisions regarding software design and technology selection, architecture and design of cyber-resilient and cyber-secure systems.
Requirements:
BS in computer science, software engineering, computer engineering, or a related quantitative field of study with three (3) years of applicable experience
MS in computer science, software engineering, computer engineering, or a related quantitative field of study with one (1) year of applicable experience.
Willingness to travel to various locations to support the SEI’s overall mission. This includes within the SEI and CMU community, sponsor sites, conferences, and offsite meetings on occasion. Expected 15%
You will be subject to a background check and will need to obtain and maintain a Department of Defense security clearance.
Knowledge, Skills and Abilities:
We are looking for someone who has the ability to function within a development team. Willingness to learn new skills, programming languages, and technologies as necessary, and a desire to solve meaningful problems through technical innovation.
You have the skills to analyze customer requirements and provide novel solutions.
Willingness and ability to provide accurate estimates of development time and risk.
Capable to attend customer meetings and respond to customer requirements. Ability to multitask, solve problems and work with end users.
Ability to quickly learn new technologies (COTS/GOTS) and integrate them with existing applications and/or systems.
Knowledge of various hardware architectures and embedded systems. Embedded system design and embedded software implementation.
Desired Experience:
Experience as a software developer working on software applications in a professional environment.
Working knowledge of multiple types of programming languages: compiled application languages (such as C, C++, Rust, Go, C#, F#, Java, Scala, or Haskell), scripting languages (such as Python, Bash, or PowerShell), and core languages for Web development (HTML, CSS, and JavaScript).
Familiarity with Web development languages, tools, and frameworks (such as Pyramid, Flask, Babel, ReactJS, Redux, PureScript, ReasonML, or Elm).
Capable of working with software development tools such as version control systems (such as Git) and bug tracking systems (such as JIRA); knowledge of agile software development practices and team design sessions.
Experience setting up, using, maintaining, and developing on UNIX/Linux systems.
Working knowledge of general networking concepts and experience with deep software analysis, debugging, or reverse engineering, with some background in cyber security.
Familiarity with containerization and orchestration technologies such as Docker and Kubernetes.
Knowledge of Hadoop or related big-data systems, LDAP directories, Web servers/reverse proxies (such as Apache httpd, Tomcat, nginx, or HAProxy), and working with development and operations (DevSecOps) technologies such as continuous integration.
Familiarity with SQL and modern SQL databases (such as MariaDB, Postgres, or SQLite), as well as non-relational database technologies (such as MongoDB, Cassandra, HBase, or Neo4j).
Job Function Breakdown:
90% Design and implementation of software requirements and integrate with other software tools or relational databases.
Secondary Functions
5% Participate in conferences and meetings; join marketing calls on clients; present technical talks as appropriate.
5% Contribute to the broader software engineering and security community.
TOTAL = 100%
More Information
Please visit “Why Carnegie Mellon” to learn more about becoming part of an institution inspiring innovations that change the world.
A listing of employee benefits is available at: www.cmu.edu/jobs/benefits-at-a-glance/.
Carnegie Mellon University is an Equal Opportunity Employer/Disability/Veteran."
1,Software Engineer - Java / Python,"Pittsburgh, PA 15213",Pittsburgh,PA,15213,None Found,None Found,"
You should possess some solid skills on either front-end or back-end but should have some experience across the board. Most of our developers are interested in being full-stack and Wombat is a great place to get that experience.
You should know Java with Spring and have Python experience. Other pluses include knowing C#, Javascript, Ember.js
Have a good handle on using and creating APIs.
You'll do well if you understand dependency injection (Spring), understand how to work with databases and other data stores, understand MVC concepts
All of our developers know their way around SQL
Comfortable with Git for version control
Can work independently and thrives with autonomy. Micromanage? Ain’t nobody got time for that!","
Perform development tasks related to delivering java apps, including design, implementation, testing and deployment
Comfortable with defining/implementing application and system architectures
Work with Product Managers and Quality Engineers to ensure the delivery of great, high-quality features
Investigate, prototype and recommend new technologies and solutions","
BS/BA in a software related field or incredible experience that makes us not care about a degree
3+ years experience of Java and or Python-5 years experience","
BS/BA in a software related field or incredible experience that makes us not care about a degree
3+ years experience of Java and or Python-5 years experience","Proofpoint Security Awareness Training, formally Wombat Security is looking for a Senior Software Engineer to join our growing development team in at our office located in the Strip District of Pittsburgh.
If you've ever wanted to work for an innovative software company, in a great environment with great people, this is your chance! We’re a security software-as-a-service company so you’ll be involved both in our day-to-day software development as well as getting exposure to our security efforts.

Q: Ok. Who are you?
A: We’re comprised of some really smart white hat security hackers, researchers from CMU, software developers and lot of hard working and friendly faces. We also really like pie.

Q: What would I be working on?
A: You know all those data breaches you hear about in the news? Most of them started when a bad guy targeted an employee with a phishing attack. You’ll be working on our cloud-based SaaS user risk management and training service. Our customers are mostly large enterprise organizations that are under attack by some pretty nasty bad guys. They use our platform to deliver security education to their employees and figure out who needs extra help. Your job will be to make our customers' experience of securing their users from attack delightful and beautiful.

Q: Can you tell me a little more about your product?
A: Sure, we have several different ways that we can deliver security training to end users as well as several different ways to assess their security knowledge. One of the really fun ways we test the user is thinking like the bad guys. We send the end users a simulated phishing message. If they fall for it (they click our link, open our attachment, etc.), we show them training right away. It's an unconventional approach to changing user behavior and it works (hint: we have data). Wombat is in a growing space to say the least. If you ever wanted to learn more about cyber security and cutting-edge attacks, this is the place to do it. You’ll get to help simulate evil, figure out how to fight evil, and give our customers data that they can use to protect their organization.

Q: Where is this position located?
A: Pittsburgh, PA where our HQ office is located in the Strip District.
Q: What will my day-to-day be like as a developer on the team?
A: You’ll be working on a key component that has high value and visibility to the organization. It’s a polyglot environment but you’ll do mostly Java, Python, or C# but you’ll also work on our web app using Javascript and Ember.js. You’ll keep in touch with the team using email, Slack, and Google Hangouts.
Q: What tools do I have at my disposal?
A: Whatever enables you to do your best work with reason (A Tesla won’t help your write code faster, sorry). Everyone on our team uses a Mac.

Q: What hours will I work?
A: We work typical office hours — but value productivity, performance, and results: happy customers and code shipped. We’re in a competitive space, so sometimes there are long hours. But we all have families so we aim for a good work-life balance. Yes, we know everyone says that but seriously, many people here have kids or super likable dogs (or the rare acceptable cat). There are occasional late nights, but we get the balance thing.

Q: What technology do you use?
A: We're built entirely within Amazon Web Services. Sample of our stack: Linux, load balancers, auto-scaling, Sidekiq, Redis, Ansible, Git, Splunk, HIDS, two-factor auth, disk encryption, and a lot of cool security stuff that you probably aren't used to seeing. Also coffee (optional but recommended).
Responsibilities
Perform development tasks related to delivering java apps, including design, implementation, testing and deployment
Comfortable with defining/implementing application and system architectures
Work with Product Managers and Quality Engineers to ensure the delivery of great, high-quality features
Investigate, prototype and recommend new technologies and solutions
Experience & Education Requirements:
BS/BA in a software related field or incredible experience that makes us not care about a degree
3+ years experience of Java and or Python-5 years experience
Skills:
You should possess some solid skills on either front-end or back-end but should have some experience across the board. Most of our developers are interested in being full-stack and Wombat is a great place to get that experience.
You should know Java with Spring and have Python experience. Other pluses include knowing C#, Javascript, Ember.js
Have a good handle on using and creating APIs.
You'll do well if you understand dependency injection (Spring), understand how to work with databases and other data stores, understand MVC concepts
All of our developers know their way around SQL
Comfortable with Git for version control
Can work independently and thrives with autonomy. Micromanage? Ain’t nobody got time for that!
The ideal candidate will be comfortable leaning in and making it happen. You will be an integral part of the team with a huge impact on the future of our products. We're passionate about what we do and you should be too.

The company offers a competitive base salary and a full benefits package including Medical, Dental and Vision, paid vacation and holidays, 401(k) plan with employer match, life insurance, disability insurance and Free parking."
2,Software Engineer,"Pittsburgh, PA 15222",Pittsburgh,PA,15222,None Found,None Found,None Found,"
Participate in weekly mobile planning session, daily standup meetings (scrum meetings)
Create test plans and test suite associated with each release and add it to the VSTS
Perform various manual enhancement and regression testing activities associated with each release of the application.
Create and perform load test on various web services associated with the mobile application.
Involve in setting up the automation testing environment for mobile UI testing and adding test scripts which replicates the test cases in the regression suite
Involve in setting up the continuous integration pipeline so that code check-ins are verified by an automated build
Involve in research of cloud based mobile application automated testing platforms such as Sauce Labs and Browser Stack
Involve in enhancements to the existing test scripts to fulfill the integration with Sauce Labs
Integration of Sauce Labs with the advantage of parallel testing so that the tests can be executed on various emulators and real devices with platformand OS specifications
Involve in adding various dependencies to the automation framework to cater the reporting and test data extraction needs
Involve in modifying the framework to accommodate parallel automation testing
Involve in building and modifying SQL queries in order to validate data in MS SQL database
","
Participate in weekly mobile planning session, daily standup meetings (scrum meetings)
Create test plans and test suite associated with each release and add it to the VSTS
Perform various manual enhancement and regression testing activities associated with each release of the application.
Create and perform load test on various web services associated with the mobile application.
Involve in setting up the automation testing environment for mobile UI testing and adding test scripts which replicates the test cases in the regression suite
Involve in setting up the continuous integration pipeline so that code check-ins are verified by an automated build
Involve in research of cloud based mobile application automated testing platforms such as Sauce Labs and Browser Stack
Involve in enhancements to the existing test scripts to fulfill the integration with Sauce Labs
Integration of Sauce Labs with the advantage of parallel testing so that the tests can be executed on various emulators and real devices with platformand OS specifications
Involve in adding various dependencies to the automation framework to cater the reporting and test data extraction needs
Involve in modifying the framework to accommodate parallel automation testing
Involve in building and modifying SQL queries in order to validate data in MS SQL database
",None Found,"Skill Set : Java,C, HTML, XML, Python, C++, JS, PHP
Education : a Bachelor's degree or its equivalent in Computer Information Systems or a closely related field
Specific Job Responsibilities :

Participate in weekly mobile planning session, daily standup meetings (scrum meetings)
Create test plans and test suite associated with each release and add it to the VSTS
Perform various manual enhancement and regression testing activities associated with each release of the application.
Create and perform load test on various web services associated with the mobile application.
Involve in setting up the automation testing environment for mobile UI testing and adding test scripts which replicates the test cases in the regression suite
Involve in setting up the continuous integration pipeline so that code check-ins are verified by an automated build
Involve in research of cloud based mobile application automated testing platforms such as Sauce Labs and Browser Stack
Involve in enhancements to the existing test scripts to fulfill the integration with Sauce Labs
Integration of Sauce Labs with the advantage of parallel testing so that the tests can be executed on various emulators and real devices with platformand OS specifications
Involve in adding various dependencies to the automation framework to cater the reporting and test data extraction needs
Involve in modifying the framework to accommodate parallel automation testing
Involve in building and modifying SQL queries in order to validate data in MS SQL database
How to Apply: Fax Resume to Friendly Consultants Inc. at 800-471-9415."
3,Software Engineer - Data Processing,"Pittsburgh, PA 15208",Pittsburgh,PA,15208,None Found,None Found,None Found,None Found,None Found,None Found,"Job At A Glance
The Data Processing team develops the software that analyzes, transforms and visualizes our robotic data so that our customers can minimize their shutdowns and get their assets repaired and back online. Software engineers on the Data Processing team are responsible for the services that make up our data processing pipeline: ingestion, preprocessing, filtering, cleaning, validation, API's, etc. Our team is currently designing for scale as Gecko continues to push the boundaries on big data.

What You Will Do

Design, implement, and verify new features in a continuous integration environment
Interact with frontend engineers and data analysts to design robust web application APIs

Lead design and code reviews

Use critical thinking skills to debug problems and develop solutions to challenging technical problems

Interact with other engineers from multiple disciplines in a team environment

Develop tests to ensure the integrity and availability of the application

Provide and review technical documentation

Reasonable accommodations may be made to enable individuals with disabilities to perform the essential functions.

What Gecko Is Looking For

2 + years experience with building backend software applications

Bachelor’s and/or Master’s degree in Computer Science, or equivalent experience

Demonstrated ability in writing performant, scalable code

Dedication to test-driven development and designing production-ready systems

Experience working with data applications and corresponding languages (Python, R, Spark, Hadoop, etc.)

Deep understanding of a backend web development framework (Django, Flask, Node.js, Spring, Ruby, or Laravel)

Familiarity with Computer Science fundamentals and ability to apply those fundamentals to code

Awareness of best practices for scaling backend architectures and databases

Who We Are

Gecko Robotics (Gecko) is focused on protecting and maintaining civilizations' most critical infrastructure, with machines and platforms.

Traditional manual maintenance is dangerous, slow and reactive. Gecko’s solutions improve safety and speed (10x) while gathering more data (1000x) to predict infrastructure failures before they happen.

Gecko services customers across the USA and internationally primarily in the Oil & Gas, Power Generation and Pulp & Paper markets."
4,NetSuite Software Engineer,"Pittsburgh, PA",Pittsburgh,PA,None Found,None Found,"
Working knowledge of software development life cycle methodology, preferably within an agile environment (Scrum, Kanban)
Working knowledge of finance and accounting principles
Expert in Oracle SQL
Expert Level in Javascript
Strong background with NetSuite s Advanced Revenue Management
Working knowledge of NetSuite s Fixed Asset Management (FAM) Module
Deep understanding of NetSuite OneWorld
Prior use of NetSuite Sales Force Automation
Extensive prior use and understanding of Custom Records
Prior knowledge of General SaaS Metrics methodology and terms (MRR/ARR, Churn, etc)
Strong oral and written communication skills
Ability to handle multiple tasks
5+ years of Software Engineering Experience
Bachelor s Degree in Computer Science or Information Systems preferred
",None Found,"
Work with team members to design, develop and test, new features or improve already existing features
Reviews and analyzes available software, and enhancements to recommend any changes to the current system and to reduce technical debt and improve applications
Continuously improve development processes, coding best practices, and code reviews
Keep abreast of new technology developments
",None Found,None Found,"ExakTime, an Arcoro company, stands out above the crowd as an ambitious innovator that places people at the front of all its products. ExakTime is a leader in time and labor management solutions. At ExakTime you will help to make an appreciated and notable difference in our customer s daily lives.

ExakTime is part of the Arcoro family of companies including BirdDogHR and InfinityHR.
In an industry revolving around people, our people are the difference. Our employees are a critical part of the organization. We pride ourselves on maintaining the highest level of integrity. We have the same high expectations for our employees.

Our team is hard working and dedicated. You would be a valued participant, in a stimulating and well managed workplace, that also has great perks and employee benefits. Work remote or local; regardless of where, you ll always feel connected, impactful and part of a family. With 13 years of offsite worker practice, we live the connected and committed workforce. ExakTime is the place to build a career, solve exciting problems, connect with customers and be part of a team without compare, ready to join?
Position Overview

We are looking for a great coder with desire to solve complex problems within a fast-paced environment. You will be a champion of quality and efficiency, employing your technical skills to invent and simplify how things work, utilize leading edge technologies, and ensure our software meets the highest standards. Working closely with team members within an Agile environment, you will be creating the features that will be improving our SaaS customers lives.
Responsibilities

Work with team members to design, develop and test, new features or improve already existing features
Reviews and analyzes available software, and enhancements to recommend any changes to the current system and to reduce technical debt and improve applications
Continuously improve development processes, coding best practices, and code reviews
Keep abreast of new technology developments
Qualifications

Working knowledge of software development life cycle methodology, preferably within an agile environment (Scrum, Kanban)
Working knowledge of finance and accounting principles
Expert in Oracle SQL
Expert Level in Javascript
Strong background with NetSuite s Advanced Revenue Management
Working knowledge of NetSuite s Fixed Asset Management (FAM) Module
Deep understanding of NetSuite OneWorld
Prior use of NetSuite Sales Force Automation
Extensive prior use and understanding of Custom Records
Prior knowledge of General SaaS Metrics methodology and terms (MRR/ARR, Churn, etc)
Strong oral and written communication skills
Ability to handle multiple tasks
5+ years of Software Engineering Experience
Bachelor s Degree in Computer Science or Information Systems preferred
Benefits/Culture:

Our team is hard working and dedicated. You would be a valued participant, in a stimulating and well managed workplace, that also has great perks and employee benefits.
Please see below for some of our benefits:
Full Medical, Dental, and Vision Insurance Plans
Life Insurance
Disability Insurance
5% company match for 401(k)
2 weeks of PTO in the first year, 3 Weeks in the 2nd year, and escalator from there
7 Paid National Holidays"
