,Title,Location,City,State,Zip,Country,Qualifications,Skills,Responsibilities,Education,Requirement,FullDescriptions
153,"Software Engineer, Productivity Apps","Pittsburgh, PA 15237",Pittsburgh,PA,15237,None Found,None Found,None Found,None Found,None Found,None Found,"Summary
Posted: Aug 13, 2019
Role Number: 200090730
Imagine what you could do here. At Apple, new ideas have a way of becoming extraordinary products, services, and customer experiences very quickly. Bring passion and dedication to your job, and there's no telling what you could accomplish.
The people here at Apple don’t just build products, they craft the kind of wonder that’s revolutionized entire industries.
It’s the diversity of those people and their ideas that support the innovation that runs through everything we do, from amazing technology to industry-leading environmental efforts. Join Apple, and help us leave the world better than we found it.
Key Qualifications
Strong object-oriented design skills, coupled with deep knowledge of data structures and algorithms.
Proficiency in one or more of the following programming languages: Objective-C, Swift, C/C++, Java Script, CSS, HTML5, Java, Python, Ruby
Experience in iOS or macOS application development is a plus
Proficiency in building scalable, maintainable, high-performance software.
Understanding of multi-platform application architectures and design patterns.
A keen eye for usability
Excellent debugging and critical thinking skills
Superior analytical and problem-solving skills
Ability to work in a fast paced, team-based environment
Creative, collaborative, and product focused
Strong verbal and written communication skills and social skills
Description
Our software engineers are on the front line of our constant charge toward innovation.
We are hiring in multiple locations:
Pittsburgh, Pennsylvania
Vancouver,
 British Columbia
Cupertino, California.
We have opportunities in the following areas:
iOS Development - You will help define and implement new features, finding innovative ways to incorporate new APIs that are coming in iOS and macOS.
Web Development - You will help build web-based tools and applications to enhance our products and do more for our customers. Our developers are responsible for shaping the direction of our products by considering the architecture, performance, testing, design, and implementation. And of course we look for engineers that use our products. Engineers here work on both UI level and lower-level implementation details. The successful candidate will be amenable to working in a dynamic, collaborative environment. You must be a hands-on, enthusiastic, self-motivated developer with strong initiative and desire to succeed in a challenging environment. You will have a real passion for extraordinary user experiences and an eye for details.
Backend Development - You are responsible for building our next generation services platform supporting millions of users and best-in-class features. Backend development opportunities are available in Cupertino.
As an engineer on the Productivity Apps team you will work closely with other groups within Apple to meet critical deadlines and consistently deliver quality software.
You should feel comfortable moving fluidly from systems programming to application development. You'll be maintaining and improving not just the productivity apps, but also their supporting frameworks. You'll also be responsible for debugging and delivering the best possible application performance and adopting the best testing and development practices to help you find and fix bugs early.
We promote innovation and new technology to further improve our creative output. Dynamic, smart people and inspiring, innovative technologies are the norm here. You will be part of building an extraordinary productivity app experience.
We're looking for a talented and passionate people to join our amazing team—if you feel this is you, we'd love to hear from you.
Education & Experience
BS/MS/PhD program in Computer Science, Computer Engineering, Electrical Engineering or related fields."
154,Robotics Software Engineer,"Pittsburgh, PA",Pittsburgh,PA,None Found,None Found,None Found,"Fluent in one or more programming languages, preferably in C, C++, or Python.
Hands on experience programming real autonomous or robotic platforms.
Understanding of common sensor errors and calibration techniques.
Prior experience with automated driving systems.",None Found,None Found,None Found,"About Your Role:
You will be directly involved in building Locomation's automated driving technology from design through manufacturing and testing. You will work closely with systems and hardware engineers to integrate Locomation technology onto existing trucks, making them safe and productive for our partners and customers.
About Your Work:
Help design and maintain the base frameworks, hardware interfaces, and diagnostic systems for automated driving.
Design and develop algorithms for one or more of perception; behavior and motion planning; positioning and localization; vehicle control; and other key subsystems.
Collaborate with the hardware team to define software/hardware interfaces.
Work closely with mechanical, electrical, and software engineering teams to develop systems from concept to production.
Establish and support test activities to verify component and system behaviors.
Perform all your work with an eye for safety.
Additional Duties:
Be willing to travel locally and interstate in support of testing activities.
About You:
Be hands-on, willing, and able to design and build things yourself when needed.
Have led or been involved in small teams building interesting software.
Be self-directed with the ability to multi-task and deal with time pressure in an unstructured environment.
Hold a Bachelors, Masters, or Ph.D. in Computer Science, Robotics, or other related field.
Specific Skills That We Are Interested In:
Fluent in one or more programming languages, preferably in C, C++, or Python.
Hands on experience programming real autonomous or robotic platforms.
Understanding of common sensor errors and calibration techniques.
Prior experience with automated driving systems.
Nice To Haves:
Have experience working with automated driving sensors, e.g., radar, LiDAR, INS, GPS, cameras, etc.
Have experience working with automotive or similar industry standards.
Have experience with safety critical software design.
Proven ability to build, test, and iterate quickly.
Ability to learn new technologies quickly.
Flexibility and adaptability to work in a growing, dynamic team.
Demonstrated ability to work on cross-functional teams.
Excellent communication and teamwork skills.
Experience at a start-up.
Experience in the auto industry.
Extra bonus if you have experience in autonomous vehicle development.
If any of your work is publicly available please include a link with your application.
Please note this job description is not designed to cover or contain a comprehensive listing of responsibilities that are required of the employee for this job.
Locomation, Inc. is an Equal Opportunity Employer that welcomes applications for employment without regard to race, color, religion, gender, sexual orientation, national origin, age, disability, marital status, or status as a covered veteran in accordance with applicable laws and Locomation, Inc. employment policies."
155,Software Engineer - Robotics Test Automation Engineer,"Pittsburgh, PA 15221",Pittsburgh,PA,15221,None Found,None Found,None Found,None Found,None Found,"
Use of Python as production grade tool rather than a scripting language
Strong understanding of automated test design
Understanding of Linux fundamentals
Container ecosystem experience such as Docker","Bossa Nova is the leading provider of real-time, on-shelf product data for the global retail industry. Our robots navigate the busy retail ecosystem, collecting a wealth of data that allows retailers to improve product availability, streamline operations, and create a better shopping experience. Our multidisciplinary team of robotics, artificial intelligence, and big data scientists has solved the challenges to deploy fully autonomous retail service robots and deliver actionable data in real-time.
Bossa Nova's robots are currently deployed in 50 stores across the United States, making it the largest deployment of this kind of technology anywhere in the world.
Job Description:
We need your help ensuring that new software for our production robot fleet works properly. As part of the robotics infrastructure team, you'll automate tests for the robot platform and application with real robots in the loop, using an array of purpose-built fixtures and carefully-specified test environments to provoke various test scenarios and confirm correct robot behavior. The work that you do will help our robotics team ship new software to field robots as quickly and confidently as possible.
What'll you will do
Automate hardware-in-the-loop tests for robot software on real robots in our state-of-the-art testing facility
Build failure analysis and debugging tools to support robotics software engineering efforts to ship software
Construct dynamic test fixtures to change the environment around robots under test during test execution
Requirements
Use of Python as production grade tool rather than a scripting language
Strong understanding of automated test design
Understanding of Linux fundamentals
Container ecosystem experience such as Docker
Bonus
Experience with CI/CD pipeline development in Jenkins
Experience with ROS
Test automation, especially with hardware in the loop
We are located in Pittsburgh's Strip District. We offer a comprehensive benefits package including medical, dental, vision, unlimited PTO days, 10 company holidays, a 401(k) plan, and education assistance. And on top of all that, we also offer a variety of perks such as lunches twice a week, schedule flexibility, a stocked fridge and kitchen.
Bossa Nova Robotics provides equal employment opportunities (EEO) to all employees and applicants for employment without regard to race, color, religion, sex, national origin, age, disability or genetics. In addition to federal law requirements, Bossa Nova abides by applicable state and local laws governing nondiscrimination in employment in every location in which the company has facilities. This policy applies to all terms and conditions of employment, including recruiting, hiring, placement, promotion, termination, layoff, recall, transfer, leaves of absence, compensation and training.
w1Q8cTPWYT"
156,Jr. Software Engineer,"Township of Moon, PA",Township of Moon,PA,None Found,None Found,None Found,"Must be authorized to work in the US. Sponsorship is not available for this position
Knowledge of Object-Oriented development (Java preferred)
Knowledge of relational databases (such as Oracle) and Structured Query Language (SQL)
","Actively participate in the development and review of User Stories
Participating in technical design and code reviews
Remediating defects by solving the reported problem and thoroughly testing to ensure the issue has been solved while leaving the surrounding code in a better state than you found it
Developing and executing unit/integration tests
Actively participating on cross-functional teams that may include Architects, Developers, Q/A, and Product Management, Project Management, and Operations personnel
Demonstrate complex topics to a diverse audience, including business leaders and customers in Sprint Reviews.
Understanding the retail pharmacy and clinical services domain, and learning how customers use McKesson products to manage their business
0-25% travel
","Bachelor's degree or above in Computer Science, Software Engineering, or related field
",None Found,"Current Need:
McKesson Pharmacy Systems (MPS) is seeking a highly motivated Software Engineer to join our EnterpriseRx Software Development team. MPS offers an array of integrated pharmacy software solutions for the health care industry. Our systems are used to manage thousands of pharmacies nationwide within the independent, chain, and hospital market segments. At McKesson, our core values are the foundation of everything that we do. We strive for excellence and challenge each other to raise the bar. We offer an invigorating blend of challenge and opportunity in a fun, fast-paced, collaborative work environment. At MPS, we actively work with you to invest in your professional development. Located in Moon Township, PA, MPS is a business unit of McKesson Corporation (NYSE: MCK), which is headquartered in San Francisco, California.
Position Description:P
If you have a passion for engineering quality software, we are interested in you. We are seeking a software engineer that will work with our team to achieve fantastic results. As a contributor within the EnterpriseRx research and development (R&D) team, you will a work in a collaborative and highly skilled Agile team. EnterpriseRx® is an enterprise class software solution that manages pharmacy workflow activities and increases revenue into pharmacies.
Key Responsibilities:
Actively participate in the development and review of User Stories
Participating in technical design and code reviews
Remediating defects by solving the reported problem and thoroughly testing to ensure the issue has been solved while leaving the surrounding code in a better state than you found it
Developing and executing unit/integration tests
Actively participating on cross-functional teams that may include Architects, Developers, Q/A, and Product Management, Project Management, and Operations personnel
Demonstrate complex topics to a diverse audience, including business leaders and customers in Sprint Reviews.
Understanding the retail pharmacy and clinical services domain, and learning how customers use McKesson products to manage their business
0-25% travel

Critical Skills:
Must be authorized to work in the US. Sponsorship is not available for this position
Knowledge of Object-Oriented development (Java preferred)
Knowledge of relational databases (such as Oracle) and Structured Query Language (SQL)
Desired Skills:
Knowledge of web development and an MVC framework such as Angular
Knowledge of web services and corresponding frameworks such as Spring Boot
Ability to learn and implement new technologies and processes
Excellent written and verbal communication skills
Education:
Bachelor's degree or above in Computer Science, Software Engineering, or related field
Int ernal Use - Career Level
P2
McKesson is an Equal Opportunity/Affirmative Action employer. All qualified applicants will receive consideration for employment without regard to race, color, religion, creed, sex, sexual orientation, gender identity, national origin, disability, or protected Veteran status.Qualified applicants will not be disqualified from consideration for employment based upon criminal history.McKesson is committed to being an Equal Employment Opportunity Employer and offers opportunities to all job seekers including job seekers with disabilities. If you need a reasonable accommodation to assist with your job search or application for employment, please contact us by sending an email to Disability_Accommodation@McKesson.com. Resumes or CVs submitted to this email box will not be accepted.Current employees must apply through internal career site.Join us at McKesson!"
157,Software Engineer Intern,"Pittsburgh, PA 15237",Pittsburgh,PA,15237,None Found,"
Working towards a degree in computer science, engineering, programming or related field
Excellent written and verbal communication skills
Strong organizational skills, attention to detail and technical judgement
Ability to work in a team environment
Experience developing with one or more languages and technologies such as:
C# .NET
ASP .Net MVC, WPF
Git a plus


",None Found,"
Write clear and concise code for Framework products
Follow the lead of the software engineers to work with design patterns and architecture
Ask questions and share your opinions as you complete your tasks
Execute agile process to provide an excellent team experience
Actively participate in planning sessions
Question estimates, ask for clarification, understand the numbers
Consistently complete tasks within estimates
Focus on delivering quality with each completed story
Continuously strive for growth and contribute to our culture
Own your growth – ask questions and learn from code reviews
Be energized by developing your skillset
Gain mastery of what you know
Explore new languages, technologies, and techniques
Engage, educate, push, and have fun with your teammates daily
Create software test exercises
Special projects and other duties as assigned
",None Found,None Found,"SoftWriters is the fastest growing provider of software to Long Term Care, Specialty, and Institutional Pharmacies. We are a Microsoft® Certified Partner with our core competency being the delivery of robust, configurable solutions that enable pharmacies to enjoy significant operational efficiencies and competitive advantages in the marketplace while providing enhanced customer care. As an industry leader, we pride ourselves in creating innovative solutions that provide our customers the ability to proactively address regulatory requirements and business opportunities alike.
SoftWriters is currently seeking talented and enthusiastic candidates for our paid software engineering internship program. Current or recent grad students in computer science, computer programming, or related programs are encouraged to apply.


Overview:

As a Software Engineer Intern at SoftWriters, you will be part of the motor that drives our Framework product line to success. You will collaborate with a team consisting of other developers, quality assurance, and product management in executing our agile process to develop clear and concise code.


Responsibilities:

Write clear and concise code for Framework products
Follow the lead of the software engineers to work with design patterns and architecture
Ask questions and share your opinions as you complete your tasks
Execute agile process to provide an excellent team experience
Actively participate in planning sessions
Question estimates, ask for clarification, understand the numbers
Consistently complete tasks within estimates
Focus on delivering quality with each completed story
Continuously strive for growth and contribute to our culture
Own your growth – ask questions and learn from code reviews
Be energized by developing your skillset
Gain mastery of what you know
Explore new languages, technologies, and techniques
Engage, educate, push, and have fun with your teammates daily
Create software test exercises
Special projects and other duties as assigned


Minimum Qualifications:

Working towards a degree in computer science, engineering, programming or related field
Excellent written and verbal communication skills
Strong organizational skills, attention to detail and technical judgement
Ability to work in a team environment
Experience developing with one or more languages and technologies such as:
C# .NET
ASP .Net MVC, WPF
Git a plus


Preferred Qualifications:

Experience and creativity in resolving software application and work-flow process problems
Ability to work both independently and collaboratively to resolve escalated incidents
A foundation in Computer Science, with some competencies in data structures, algorithms
Customer service orientation
Experience with SOLID principles, ORM, IOC / DI, and unit testing a plus


SoftWriters, Inc. is an equal opportunity employer. All qualified candidates will receive consideration for employment without regard for race, color, religion, gender, sexual orientation, national origin or citizenship status, age, disability, genetic information or veteran status.


RECRUITERS, PLEASE DO NOT CONTACT THIS POST.
Qualifications
Behaviors
Required
Innovative: Consistently introduces new ideas and demonstrates original thinking
Dedicated: Devoted to a task or purpose with loyalty or integrity
Team Player: Works well as a member of a group
Enthusiastic: Shows intense and eager enjoyment and interest
Preferred
Thought Provoking: Capable of making others think deeply on a subject
Detail Oriented: Capable of carrying out a given task with all details necessary to get the task done well
Motivations
Required
Goal Completion: Inspired to perform well by the completion of tasks
Growth Opportunities: Inspired to perform well by the chance to take on more responsibility
Ability to Make an Impact: Inspired to perform well by the ability to contribute to the success of a project or the organization
Preferred
Peer Recognition: Inspired to perform well by the praise of coworkers
Self-Starter: Inspired to perform without outside help
Education
Required
Some college or better in Computer Programming or related field.
Some college or better in Computer Science or related field."
158,Senior Software Engineer,"Pittsburgh, PA 15238",Pittsburgh,PA,15238,None Found,None Found,None Found,None Found,None Found,None Found,"Senior Software Engineer. Pittsburgh, PA. Create designs and develop efficient implementation for middle-ware and low-level software for autonomous driving systems. Collect requirements, develop new features, optimize execution and flow of data. Develop software using C/C++ in real-time environments. Requires Master of Science in Electrical and Computer Engineering and at least two years of experience designing and implementing embedded software in real-time environments, C/C++, system-level integration, system/subsystem modification, and go-live support. Mail resumes to: Aptiv Corporation, Attn: Jessica Winter-Franklin, 267 Kappa Drive, Pittsburgh, PA 15238. Ref 7947M.
Aptiv is an equal employment opportunity employer. All qualified applicants will receive consideration for employment without regard to race, color, religion, national origin, sex, gender identity, sexual orientation, disability status, protected veteran status or any other characteristic protected by law."
