,Title,Location,City,State,Zip,Country,Qualifications,Skills,Responsibilities,Education,Requirement,FullDescriptions
101,Systems Software Engineering Intern - Vertica,"Pittsburgh, PA 15222",Pittsburgh,PA,15222,None Found,None Found,None Found,None Found,None Found,None Found,"Job Description:

Vertica is seeking a Systems Software Engineer Intern in Pittsburgh, PA to expand the Data Lakes integration capabilities of its analytic database engine.
As an intern on the team, your work will focus on:
(a) Research, design, and develop features that scale to help Vertica's execution engine efficiently integrate with modern Data Lakes such as HDFS, S3, etc.
(b) Collaborate with open source communities and develop state of the art technologies for big data processing.
Vertica Databases are used across all industries to run analytic queries and machine learning algorithms on truly massive amounts of data. Vertica R&D teams work on various computer systems areas some of which include operating systems, security, networking, distributed and parallel computing. Vertica engineers are proud innovators in the Big Data space and contributors to popular open source projects. Engineers are given significant latitude and support to pursue what they are passionate about to improve the product and the company. If you are excited about building great technology, with an incredible team, you will fit in well here.
The ideal candidate has knowledge of: (bold items required)
C/C++
Multi-threading
Essential algorithms and data structures
Excellent technical communication
SQL
Database internals
Distributed computing/systems, distributed storage, esp. Fault Tolerance techniques
GDB, Valgrind, binary profiling tools such as operf
SQL.
Database and File System Internals.
You must be pursuing a degree in Computer Science, Computer Engineering, or a related field.
You can expect to learn more about all of the above, plus:
How to design changes which support real customer needs
How to debug a complex system
Working on a team
Testing your code
Practical software optimization techniques
Planning and executing on a software project.
About our team
The best ideas often come from fresh perspectives. At Vertica, our open-minded, diverse and inclusive team is always learning from each other. We approach intellectually challenging work with a ""get it done"" attitude. Vertica Engineers are given significant latitude and support to pursue what they are passionate about to make Vertica an even better place. If you are excited about building great technology with a proactive team, you will find yourself in good company at Vertica. Welcome to the family.
About our product
Vertica is a recognized leader in analytics powering some of the world’s most data driven organizations like Uber, Wayfair, Intuit, Cerner, and more. Our columnar, MPP, distributed database delivers unprecedented speed, petabyte scale, with analytics and machine learning functions built into the core.
We believe the future belongs to the fast. Join us for the ride!

Job:
Administration

Micro Focus is proud to be an Equal Opportunity Employer. Prospective employees will receive consideration without discrimination because of race, colour, religion, creed, gender, national origin, age, disability, marital or veteran status, sexual orientation, genetic information, citizenship or any other legally protected status"
102,Software Engineer - Mapping,"Pittsburgh, PA",Pittsburgh,PA,None Found,None Found,None Found,None Found,"
Define our mapping architecture and approach
Develop algorithms that create metrically correct descriptions of the world
Develop data structures that enable efficient queries about static parts of the driving environment
",None Found,None Found,"Aurora Overview

Bringing self-driving vehicles to our roads is the most transformative opportunity of our generation. Aurora is taking a fresh start with the development of self-driving technology, combining excellence in AI, rigorous engineering, and a team with decades of experience building robots that work.

Led by a team of seasoned experts, including three of the world’s leaders of self-driving technology, our mission is to deliver the benefits of self-driving technology safely, quickly, and broadly. We are designing the software and hardware to power the transportation of our future that will make our roads safer, give more people access to mobility, and reduce congestion and pollution in cities - improving the quality of life for all. The challenge in what we are endeavoring to achieve is transcendent; we are developing perhaps the world’s most complex computing system and asking it to perform the task of transporting and keeping safe our most precious asset: human life.
We’re looking for people who are as excited as we are to solve these complex problems and make this tremendous impact on our future, and who want to be surrounded by great people while we do it. We are searching for Software Engineers to architect, design, and develop our core mapping algorithms, data-structures and tools that enable autonomous operation.

Responsibilities

Define our mapping architecture and approach
Develop algorithms that create metrically correct descriptions of the world
Develop data structures that enable efficient queries about static parts of the driving environment
Essential

BS/MS or PhD in Robotics, Computer Science, or related field
Excellent C++ programming and software design skills to support high performance perception
Experience with perception sensors including LIDAR, radar, and cameras
Expertise in the design of very large adaptive data structures and familiarity with mapping and localization
Desirable

Experience with embedded Linux and real-time systems
Machine learning and labeling experience
Working at Aurora

Our work has real purpose. Delivering self-driving will improve lives around the world, expanding access to transportation, revitalizing cities, giving people more time back every day.

We’re one team. We’re inspired by the challenge of what we’re solving and the impact our work will have on society. Our camaraderie is built on respect for our work and the fundamental belief our success will be a result of working together.

The Founding Team

Aurora has assembled the most experienced leadership team in the space. Chris Urmson helped lead Carnegie Mellon’s efforts in Darpa’s Grand Challenges, then was a founding member of Google’s self-driving team. Sterling Anderson worked on the tech at MIT before leading Tesla’s Autopilot system. Drew Bagnell, also a Carnegie Mellon alum, is a machine learning expert who helped build Uber’s autonomy effort. At Aurora, these three continue to bring experts from all areas of the industry to the team. We are funded by some of Silicon Valley’s best venture capital firms, including Greylock and Index Ventures."
103,Senior Software Engineer,"Coraopolis, PA 15108",Coraopolis,PA,15108,None Found,".NET core, Java Spring Boot, Kotlin, Angular, React, etc.",None Found,None Found,None Found,None Found,"Everything we do at DICK’S Sporting Goods centers around our customers, or as we call them, our athletes. From online to in-store, we’re disrupting retail through technology.

Our Software Engineering team are key disruptors. As a Senior Software Engineer, you will help us drive our key retail disruption initiatives through technology that matters.

We empower our engineers to tear down the silos and work collaboratively with their product team to deliver solutions. We work in nimble product teams composed of engineers, designers, and product managers that aren’t bogged down by project plans and politics, but are empowered to continuously create, test and execute. One of the best parts is after the work is done, you get to see the results of your work in our stores, online and throughout our business. You get to make a difference.
Qualifications
First, let’s talk Tech.
Here is a list of our platforms. Don’t worry, you don’t have to be a master at them all. Ideally, you’ll have experience in a couple of them.
.NET core, Java Spring Boot, Kotlin, Angular, React, etc.
As a Senior Software Engineer at DICK’S you will:
Bring at least 3 years of experience to the table
Work collaboratively with designers, product managers, and engineers
Leverage cutting-edge technologies and modern practices
Identify and communication technology problems and prepare remedies
Build and ship high-quality code at a rapid pace
Work with open source tools to build new technologies
Participate in design thinking activities to improve the user experience
Work with great people at our sprawling Pittsburgh campus that includes sports leagues, a world-class health club, and a dynamic culture
We believe that there is always a better way.
So, we will expect you to:
Continuously learn modern software design and development core practices, utilizing articles, MeetUps, conferences, tech talks, etc.
Review and discuss code with engineering peers and leaders to understand best practices and optimal design patterns
Take the initiative to drive new ideas and projects
Increase your business acumen by consistently learning about other parts of the business
Support and mentor new members of the Software Engineering team
Lastly, here’s some stuff that won’t be part of your day-to-day.
At DICK’S you won’t:
Work in a silo
Be limited by project plans
Find yourself stuck in a boring cube
Pay to park or be stuck in a corporate high-rise
Be pigeonholed into proprietary and stagnant codebases
If you’re excited about joining the DSG team, we’d love to meet you. Apply today!
#LI-BT1-L"
104,2020 Summer Internship: Autonomous Mobility - Localization Engineer,"Pittsburgh, PA 15238",Pittsburgh,PA,15238,None Found,None Found,None Found,None Found,None Found,None Found,"Aptiv Autonomous Mobility
Our real-world mobility solutions are driving us toward a safer, greener and better connected future. Aptiv is providing the “brain” and “nervous system” for vehicles that will change the face of mobility for people worldwide.

Aptiv’s Autonomous Mobility team is focused on developing, and commercializing autonomous vehicles and systems that enable point-to-point mobility via large fleets of autonomous vehicles in challenging urban driving environments. With talented teams working across the globe, from Boston to Singapore, Aptiv was the first company to deploy a commercial, point-to-point autonomous ride-hailing service based in Las Vegas, Nevada.

In November 2017, Aptiv acquired autonomous vehicle software startup nuTonomy, an integral part of Aptiv’s Autonomous Mobility team. With continued research, development, and both current and future commercial deployments, we are looking for talented and passionate people to join our team.

Work with leading engineers, research scientists, marketers and business development experts, all while enabling the future of mobility. At Aptiv, we believe that our mobility solutions have the power to change the world. For more information, please visit www.aptiv.com/our-journey and see ourwww.aptiv.com/careers for opportunities.

Join our innovative team
Want to be part of this revolution? Here’s your opportunity. Join the technology company that’s transforming the future of mobility today. We are seeking a highly motivated Localization Intern to help in achieving our goals.
How you'll make a difference:
Collaborate with the larger team of Autonomous Driving engineers, gaining exposure to multiple engineering disciplines and several projects simultaneously throughout the development process
Tackle the challenge of autonomous drive through innovative software stacks that interface with all components of the automated driving vehicles
Perform prototyping, field testing, and system configuration
Show initiative and be a valued team member in our innovative, fast-paced, entrepreneurial environment where cooperative teamwork is the norm
Build new concepts and groundbreaking solutions that shape the future of mobility
What you'll bring:
Bachelor’s degree or higher in Computer Science or relevant field
Minimum 2+ years of software development experience with undergraduate degree or graduate degree plus related academic experience
C++ development experience in a Unix/Linux environment
Enabling systems on embedded platforms a plus
Strong problem solving skills
Ability to learn
Knowledge of software engineering process: software design, source control management, build processes, code reviews, etc
Strong communication and interpersonal skills
Flexible and creative thinking
Aptiv is an equal employment opportunity employer. All qualified applicants will receive consideration for employment without regard to race, color, religion, national origin, sex, gender identity, sexual orientation, disability status, protected veteran status or any other characteristic protected by law."
105,Software Engineer,"Pittsburgh, PA 15201",Pittsburgh,PA,15201,None Found,"Excellent software engineering habits.
Familiarity with development in Linux-based environments.
Experience with version control systems such as Subversion and Mercurial.
Working knowledge of software debugging and profiling tools.
Solid background in data structures and algorithms
Experience with complex robotic applications including perception and planning;
Experience with embedded systems and real-time operating systems; and
Strong math skills and familiarity with linear algebra
","Preferred Languages C,C++, Python
","Create software for robotics components and systems, including algorithms, high-level C++, lower-level C code, and user interfaces.
Test software in system integration laboratories, simulation, and on fully-realized robots.
Analyze system performance through the use of data logs and the creation of post-processing software and scripts.
Work in the design space by writing use cases, software specifications, hold and participate in design reviews and coding peer reviews.
Work with sensors and lower-level technologies like serial buses, Ethernet, and CAN.
Integrate different sensor, actuator, and computing technologies into robotic systems.
Document software using industry-standard best practices.
Conform to company policies regarding confidentiality, software licensing, and export control restrictions.
",None Found,None Found,"Job Summary
Carnegie Robotics is seeking creative, energetic and driven Software Engineers with strong hands-on development skills to work on a variety of interesting and challenging robotics perception and control projects. This position provides the opportunity to join a team of talented veterans in the robotics field and program advanced sensors and autonomous robots from the ground up. The ideal applicant for this position has brains, creativity, and strong experience developing and testing software for robotics and/or sensing applications. We seek candidates who take pride in building solid, rigorously tested systems. Experience and interest in production-level coding and testing methods is a plus for this position.
Responsibilities and Duties
Create software for robotics components and systems, including algorithms, high-level C++, lower-level C code, and user interfaces.
Test software in system integration laboratories, simulation, and on fully-realized robots.
Analyze system performance through the use of data logs and the creation of post-processing software and scripts.
Work in the design space by writing use cases, software specifications, hold and participate in design reviews and coding peer reviews.
Work with sensors and lower-level technologies like serial buses, Ethernet, and CAN.
Integrate different sensor, actuator, and computing technologies into robotic systems.
Document software using industry-standard best practices.
Conform to company policies regarding confidentiality, software licensing, and export control restrictions.
Qualifications
Excellent software engineering habits.
Familiarity with development in Linux-based environments.
Experience with version control systems such as Subversion and Mercurial.
Working knowledge of software debugging and profiling tools.
Solid background in data structures and algorithms
Experience with complex robotic applications including perception and planning;
Experience with embedded systems and real-time operating systems; and
Strong math skills and familiarity with linear algebra
Skills
Preferred Languages C,C++, Python
Salary
$90,000.00 to $150,000.00 /year
Benefits and Perks
Carnegie Robotics offers a competitive benefits package including:
High quality health/dental/vision insurance with flexible spending plan or HSA
Free catered lunch!
401(k) plan with employer match.
Fully paid days off that accrue and are yours to keep starting year one: 24 paid holidays and 15 sick and vacation days.
Comp time for company travel
Flexible schedule
Application Requirement
On your resume please include a link to a publicly available code sample!
Carnegie Robotics is an Equal Opportunity Employer that welcomes applications from all employees and applicants for employment without regard to race, color, religion, gender, sexual orientation, national origin, age, disability, marital status, or status as a covered veteran in accordance with applicable laws and Carnegie Robotics' employment policies.

lOVhKf"
106,"Software Engineer, Embedded Systems","Pittsburgh, PA 15222",Pittsburgh,PA,15222,None Found,None Found,None Found,None Found,None Found,None Found,"Argo AI was founded to tackle one of the most challenging applications in computer science, robotics and artificial intelligence with self-driving vehicles. Argo AI is developing and deploying the latest advancements in artificial intelligence, machine learning and computer vision to help build safe and efficient self-driving vehicles that enable these transformations and more. The challenges are significant, but we are a team that believes in tackling hard, meaningful problems to improve the world.

We are building a high-performance team that is excited by complex engineering challenges and is passionate about making transportation safer, more affordable and accessible for all.

The Embedded Software Engineering team at Argo AI is responsible for developing and validating a broad array of safety critical code for our sensor and computer systems. Embedded Software Engineers work with cross functional teams to develop the requirements and software architecture for our embedded systems. They write and test software for microcontrollers and system-on-chip (SoC) devices in the vehicle. And they conduct system integration validation testing with their peers.

What you'll do:

Deliver RTOS solutions for safety critical embedded software in a robotics + automotive environment.
Design software for sensor control, inter processor communications, monitoring, drivers, acceptance testing, and more.
Work with other Hardware Engineers to define requirements for hardware systems.
Work with other Software Engineers to integrate embedded systems into Argo AI's autonomy software stack.

What we're looking for:

Degree in Computer Engineering, Computer Science, Electrical Engineering, Robotics or a related field
Experience in software development for embedded devices
Experience in Low Level Communications Protocols
Experience in Bare Metal Product Environments
Strong C/C++ programming skills applied to embedded Microcontroller/Microprocessor targets
Experience in Memory Constrained Environments
Ability to understand PCB schematic and layout documents
Experience with debugging tools and methods for embedded targets
Quantitative / analytic mindset to probe, test and decompose challenging system problems into root cause issues with strong, detail oriented skills to solve them
A record of owning projects successfully and working in a fast paced environment
Ability to serve cross functional roles in a young company
Good experience writing concise, clear, and detailed engineering documentation
Strong presentation and communication skills
Experience with communication protocols used in embedded, robotics and automotive industries
Prefer candidates with experience developing highly complex hardware systems in robotics, transportation, aerospace, consumer electronics, defense, medical, energy, or similar industries
Open to occasional travel to remote offices, test facilities, engineering partners, or manufacturing partners

At Argo AI, we have a strong emphasis on creating a highly effective team environment. Thus, we seek candidates that can work effectively with others across a broad range of disciplines.

Argo AI is an equal opportunity employer that believes in diversity as a strength and is committed to creating an inclusive environment for all employees.

We know it takes competitive benefits to fuel a team that works hard and enjoys the challenge. At Argo AI, you can expect stellar perks to support your best self:


High-quality individual and family health, dental, and vision insurance
Competitive compensation packages
Employer-matched 401(k) retirement plan
Paid parental leave
Unlimited vacation
Daily catered lunches and snacks
Free onsite or adjacent parking
Commuter reimbursement
Fitness reimbursement
Professional development reimbursement

Argo AI is a LinkedIn Top 50 Startup ( https://www.linkedin.com/pulse/linkedin-top-startups-2018-50-most-sought-after-us-daniel-roth/ )"
107,Software Engineer I,"Pittsburgh, PA",Pittsburgh,PA,None Found,None Found,"
Bachelor’s Degree in Computer Science or related field or equivalent.
Approximately 0-2 years’ experience with N-tier applications using current UI frameworks, and modern web application standards.
Effective communication skills.
Working knowledge or experience in .net development including WebAPI.
Working knowledge or experience with JavaScript frameworks such as Angular (v2.0+) or AngularJS.
Working knowledge or experience with web presentation layer (HTML, SASS, CSS).
Working knowledge or experience with REST.
Working knowledge or experience working with relational databases (preferably MSSQL).
Experience working with GIT Source Control.
",None Found,"
Proven technical aptitude and exceptional proven initiative to investigate/learn new technologies.
Design, develop, test and configure web applications.
Support quality improvement of software by engaging in rigorous unit testing of all developed code. participating in peer review of own and others’ code.
Diagnose and repair technical problems within an enterprise-level web-based software application.
Software Engineers need to excel in teamwork, critical thinking, adaptability, problem analysis, initiative, and planning & organizing.
",None Found,None Found,"The Software Engineer works as an integral and collaborative part of an Agile development team to implement all phases of enterprise-level software applications.

Responsibilities

Proven technical aptitude and exceptional proven initiative to investigate/learn new technologies.
Design, develop, test and configure web applications.
Support quality improvement of software by engaging in rigorous unit testing of all developed code. participating in peer review of own and others’ code.
Diagnose and repair technical problems within an enterprise-level web-based software application.
Software Engineers need to excel in teamwork, critical thinking, adaptability, problem analysis, initiative, and planning & organizing.
Basic Qualifications

(These are the minimum qualifications you need to be considered for the job)

Bachelor’s Degree in Computer Science or related field or equivalent.
Approximately 0-2 years’ experience with N-tier applications using current UI frameworks, and modern web application standards.
Effective communication skills.
Working knowledge or experience in .net development including WebAPI.
Working knowledge or experience with JavaScript frameworks such as Angular (v2.0+) or AngularJS.
Working knowledge or experience with web presentation layer (HTML, SASS, CSS).
Working knowledge or experience with REST.
Working knowledge or experience working with relational databases (preferably MSSQL).
Experience working with GIT Source Control.
Back Share
Apply Now"
