,Title,Location,City,State,Zip,Country,Qualifications,Skills,Responsibilities,Education,Requirement,FullDescriptions
0,"Cloud Data Engineer, Google Professional Services","Atlanta, GA",Atlanta,GA,None Found,None Found,None Found,None Found,"
Act as a trusted technical advisor to customers and solve complex Big Data challenges.
Create and deliver best practices recommendations, tutorials, blog articles, sample code, and technical presentations adapting to different levels of key business and technical stakeholders.
Travel up to 30% of the time.
Communicate effectively via video conferencing for meetings, technical reviews and onsite delivery activities.",None Found,None Found,"Note: By applying to this position your application is automatically submitted to the following locations: Chicago, IL, USA; Atlanta, GA, USA
Minimum qualifications:

BA/BS degree in Computer Science, Mathematics or related technical field, or equivalent practical experience.
Experience with data processing software (such as Hadoop, Spark, Pig, Hive) and with data processing algorithms (MapReduce, Flume).
Experience in writing software in one or more languages such as Java, C++, Python, Go and/or JavaScript.
Experience managing internal or client-facing projects to completion; experience troubleshooting clients' technical issues; experience working with engineering teams, sales, services, and customers.

Preferred qualifications:
Experience working data warehouses, including data warehouse technical architectures, infrastructure components, ETL/ELT and reporting/analytic tools and environments.
Experience in technical consulting.
Experience working with big data, information retrieval, data mining or machine learning as well as experience in building multi-tier high availability applications with modern web technologies (such as NoSQL, MongoDB, SparkML, Tensorflow).
Experience architecting, developing software, or internet scale production-grade Big Data solutions in virtualized environments.
About the job
As a Cloud Data Engineer, you'll guide customers on how to ingest, store, process, analyze and explore/visualize data on the Google Cloud Platform. You will work on data migrations and transformational projects, and with customers to design large-scale data processing systems, develop data pipelines optimized for scaling, and troubleshoot potential platform challenges.
In this role you are the Google Engineer working with Google's most strategic Cloud customers. Together with the team you will support customer implementation of Google Cloud products through: architecture guidance, best practices, data migration, capacity planning, implementation, troubleshooting, monitoring and much more.
The Google Cloud Platform team helps customers transform and evolve their business through the use of Google’s global network, web-scale data centers and software infrastructure. As part of an entrepreneurial team in this rapidly growing business, you will help shape the future of businesses of all sizes use technology to connect with customers, employees and partners.
Responsibilities
Act as a trusted technical advisor to customers and solve complex Big Data challenges.
Create and deliver best practices recommendations, tutorials, blog articles, sample code, and technical presentations adapting to different levels of key business and technical stakeholders.
Travel up to 30% of the time.
Communicate effectively via video conferencing for meetings, technical reviews and onsite delivery activities.
At Google, we don’t just accept difference—we celebrate it, we support it, and we thrive on it for the benefit of our employees, our products and our community. Google is proud to be an equal opportunity workplace and is an affirmative action employer. We are committed to equal employment opportunity regardless of race, color, ancestry, religion, sex, national origin, sexual orientation, age, citizenship, marital status, disability, gender identity or Veteran status. We also consider qualified applicants regardless of criminal histories, consistent with legal requirements. See also Google's EEO Policy and EEO is the Law. If you have a disability or special need that requires accommodation, please let us know by completing this form."
1,Sr. Data Engineer,"Atlanta, GA 30328",Atlanta,GA,30328,None Found,None Found,None Found,None Found,None Found,None Found,"We are looking for a Data Engineer for the Enterprise Data Organization to build and manage data pipeline (Data ingest, data transformation, data distribution, quality rules, data storage etc.) for Azure cloud based data platform. The candidate will require to possess strong technical, analytical, programming and critical thinking skills. Ideal candidate will have familiarity with data transformation, data modeling, Master data management, and Meta data management.

KEY RESPONSIBILITIES:

Design, develop and maintain reliable automated data solutions based on the identification, collection and evaluation of business requirements. Including but not limited to data models, database objects, stored procedures and views.
Developing new and enhancing existing data processing (Data Ingest, Data Transformation, Data Store, Data Management, Data Quality ) components
Engage with IT teams such as DBAs, Security, Storage and Networking when their involvement is required to meet the project needs.
Support and troubleshoot the data environment (including periodically on call)
Document technical artifacts for developed solutions
Maintains professional and technical knowledge by attending educational workshops; reviewing professional publications; establishing personal networks; benchmarking state-of-the-art practices; participating in professional societies.
EDUCATION QUALIFICATIONS:

BS in either Information Systems, Finance/Mathematics, or Computer Science or similar field
EXPERIENCE QUALIFICATION:

10+ Years
REQUIRED KNOWLEDGE, SKILLS or ABILITIES:

Good interpersonal skills; comfort and competence in dealing with different teams within the organization. Requires an ability to interface with multiple constituent groups and build sustainable relationships.
Strong and effective communication skills (verbal and written).
Strong analytical, problem solving skills.
Experience of working in a matrix organization, self-driven. A go getter and a problem solver.
Ability to prioritize, work to deadlines, work under pressure. Results oriented, flexible, adaptable.
Work well independently, and be a team player.
Versatile, creative temperament, ability to think out-of-the box while defining sound and practical solutions. Ability to master new skills.
Proactive approach to problem solving with effective influencing skills.
TECHNICAL SKILLS:

Familiar with Agile practices and methodologies
5+ years professional data engineering experience focused on batch and real time data pipelines using Spark, PySpark, Python, SQL, Java
8+ Years of hands-on design and development experience in data space : data processing / data transformation using ETL tools, data warehouse (data modeling, programming), RDBMS
Exposure in Microsoft technologies like SSIS, SQL Server, SSRS
Experience with a DevOps model utilizing a CI/CD tool
PREFERRED KNOWLEDGE, SKILLS, OR ABILITIES:
Hands-on Talend work experience (anyone with this skill will have an advantage over other candidates)
Understanding of data science and visualization technologies (Hadoop, Spark, Databricks)
Experience working on a cloud environment, preferably, Microsoft Azure
Cloud Data Warehouse solutions (Snowflake, Azure DW)
NoSQL databases and modeling (Cassandra, HBase, MongoDB)"
2,AWS Data Engineer,"Atlanta, GA 30303",Atlanta,GA,30303,None Found,"At least 5 years of Consulting or client service delivery experience on Amazon AWS (AWS)At least 5 years of experience in developing data ingestion, data processing and analytical pipelines for big data, relational databases, NoSQL and data warehouse solutionsExtensive experience providing practical direction within the AWS Native and HadoopExperience with private and public cloud architectures, pros/cons, and migration considerations.Minimum of 5 years of hands-on experience in AWS and Big Data technologies such as Java, Node.js, C##, Python, SQL, EC2, S3, Lambda, Spark/SparkSQL, Hive/MR, Pig, Oozie and streaming technologies such as Kafka, Kinesis, NiFI etc.Extensive hands-on experience implementing data migration and data processing using AWS services: VPC/SG, EC2, S3, AutoScaling, CloudFormation, LakeFormation, DMS, Kinesis, Kafka, Nifi, CDC processing Redshift, Snowflake, RDS, Aurora, Neptune, DynamoDB, Hive, NoSQL, Cloudtrail, CloudWatch, Docker, Lambda, Spark,Glue, Sage Maker, AI/ML, API GW, etc.5+ years of hands on experience in programming languages such as Java, c#, node.js, python, pyspark, spark, SQL, Unix shell/Perl scripting etc.Minimum of 5 years of RDBMS experienceExperience in using Hadoop File Formats and compression techniquesExperience working with DevOps tools such as GitLabs, Jenkins, CodeBuild, CoePipeline CodeDeploy, etc.Bachelors or higher degree in Computer Science or a related discipline.","DevOps on an AWS platform. Multi-cloud experience a plus.Experience developing and deploying ETL solutions on AWS using tools like Talend, Informatica, MatillionStrong in Java, C##, Spark, PySpark, Unix shell/Perl scriptingIoT, event-driven, microservices, containers/Kubernetes in the cloud",None Found,None Found," Proven ability to build, manage and foster a team-oriented environment Proven ability to work creatively and analytically in a problem-solving environment Desire to work in an information systems environment Excellent communication (written and oral) and interpersonal skills Excellent leadership and management skills","Are you ready to step up to the New and take your technology expertise to the next level?

Join Accenture and help transform leading organizations and communities around the world. The sheer scale of our capabilities and client engagements, in conjunction with the way we collaborate, operate and deliver value, provides an unparalleled opportunity to grow and advance. Choose Accenture and make delivering innovative work part of your extraordinary career.

People in our Client Delivery & Operations career track drive delivery and capability excellence through the design, development and/ or delivery of a solution, service, capability or offering. They grow into delivery-focused roles, and can progress within their current role, laterally or upward. We partner with our clients to help transform their data into an ‘Appreciating Business Asset.’

As part of our Data Business Group, you will lead technology innovation for our clients through robust delivery of world-class solutions. You will build better software better! There will never be a typical day and that’s why people love it here. The opportunities to make a difference within exciting client initiatives are unlimited in the ever-changing technology landscape. You will be part of a highly collaborative and growing network of technology and data experts, who are taking on today’s biggest, most complex business challenges using the latest data and analytics technologies. We will nurture your talent in an inclusive culture that values diversity. You will have an opportunity to work in roles such as Data Scientist, Data Engineer, or Chief Data Officer covering all aspects of Data including Data Management, Data Governance, Data Intelligence, Knowledge Graphs, and IoT. Come grow your career in Technology at Accenture!

The Amazon AWS Data Engineer is responsible for delivering Data On Cloud projects for Amazon AWS based deals. The ideal candidate would be responsible for developing and delivering AWS cloud solutions to meet today’s high demand in areas such as AIML, IoT, advanced analytics, open source, enterprise collaboration, microservices, serverless, etc. The AWS Data Engineer is a highly performant engineer responsible for delivering Cloud based Big Data and Analytical Solutions at our clients. Responsibilities include building data on cloud solutions at customers, leading Business and IT stakeholders through designing a robust, secure and optimized AWS solutions and ability to be hands-on delivering the target solution. This role will work with customers and leading internal engineering teams in delivering big data soltuions on cloud. Using Amazon AWS public cloud technologies, our AWS Data Engineer professionals implement state of the art, scalable, high performance Data On Cloud solutions that meet the need of today’s corporate and emerging digital applications.

Role & Responsibilities:
Provide subject matter expertise and hands on delivery of data capture, curation and consumption pipelines on AWS and HadoopAbility to build cloud data solutions and provide domain perspective on storage, big data platform services, serverless architectures, hadoop ecosystem, RDBMS, DW/DM, NoSQL databases and security.Participate in deep architectural discussions to build confidence and ensure customer success when building new solutions and migrating existing data applications on the AWS platform.
- Build full technology stack of services required including PaaS (Platform as-a-service), IaaS (Infrastructure as-a-service), SaaS (software as-a-service), operations, management and automation.Apply Accenture methodology, Accenture reusable assets, and previous work experience to delivery consistently high-quality work.Stay educated on new and emerging technologies/patterns/methodologies and market offerings that may be of interest to our clients.Understand the strategic direction set by senior management as it relates to team goals.Use considerable judgment to define solution and seeks guidance on complex problems.Primary upward interaction is with direct supervisor. May interact with peers and/or management levels at a client and/or within Accenture. Establish methods and procedures
on new assignments with guidance.Manage small teams of delivery engineers successfully delivering work efforts (if in an independent contributor role) at a client or within Accenture.Able to travel up to 100% (M-TH)

Basic QualificationsAt least 5 years of Consulting or client service delivery experience on Amazon AWS (AWS)At least 5 years of experience in developing data ingestion, data processing and analytical pipelines for big data, relational databases, NoSQL and data warehouse solutionsExtensive experience providing practical direction within the AWS Native and HadoopExperience with private and public cloud architectures, pros/cons, and migration considerations.Minimum of 5 years of hands-on experience in AWS and Big Data technologies such as Java, Node.js, C##, Python, SQL, EC2, S3, Lambda, Spark/SparkSQL, Hive/MR, Pig, Oozie and streaming technologies such as Kafka, Kinesis, NiFI etc.Extensive hands-on experience implementing data migration and data processing using AWS services: VPC/SG, EC2, S3, AutoScaling, CloudFormation, LakeFormation, DMS, Kinesis, Kafka, Nifi, CDC processing Redshift, Snowflake, RDS, Aurora, Neptune, DynamoDB, Hive, NoSQL, Cloudtrail, CloudWatch, Docker, Lambda, Spark,Glue, Sage Maker, AI/ML, API GW, etc.5+ years of hands on experience in programming languages such as Java, c#, node.js, python, pyspark, spark, SQL, Unix shell/Perl scripting etc.Minimum of 5 years of RDBMS experienceExperience in using Hadoop File Formats and compression techniquesExperience working with DevOps tools such as GitLabs, Jenkins, CodeBuild, CoePipeline CodeDeploy, etc.Bachelors or higher degree in Computer Science or a related discipline.

Candidate Must Have Completed The Following Certifications
§ Certified AWS Developer - Associate
§ Certified AWS DevOps – Professional (Nice to have)
§ Certified AWS Big Data Specialty (Nice to have)

Nice-to-Have Skills/Qualifications:DevOps on an AWS platform. Multi-cloud experience a plus.Experience developing and deploying ETL solutions on AWS using tools like Talend, Informatica, MatillionStrong in Java, C##, Spark, PySpark, Unix shell/Perl scriptingIoT, event-driven, microservices, containers/Kubernetes in the cloud
Experience in Apache Maven a plusUnderstanding and implementation of Data Lake architecturesUnderstanding NoSQL technologies such as MongoDB, Cassandra, Hbase is a plusUnderstanding Solr, Elasticsearch is a plus

Professional Skill Requirements Proven ability to build, manage and foster a team-oriented environment Proven ability to work creatively and analytically in a problem-solving environment Desire to work in an information systems environment Excellent communication (written and oral) and interpersonal skills Excellent leadership and management skills

All of our professionals receive comprehensive training covering business acumen, technical and professional skills development. You'll also have opportunities to hone your functional skills and expertise in an area of specialization. We offer a variety of formal and informal training programs at every level to help you acquire and build specialized skills faster. Learning takes place both on the job and through formal training conducted online, in the classroom, or in collaboration with teammates. The sheer variety of work we do, and the experience it offers, provide an unbeatable platform from which to build a career.

Applicants for employment in the US must have work authorization that does not now or in the future require sponsorship of a visa for employment authorization in the United States and with Accenture (i.e., H1-B visa, F-1 visa (OPT), TN visa or any other non-immigrant status).

Candidates who are currently employed by a client of Accenture or an affiliated Accenture business may not be eligible for consideration.

Accenture is a Federal Contractor and an EEO and Affirmative Action Employer of Females/Minorities/Veterans/Individuals with Disabilities.

Equal Employment Opportunity

All employment decisions shall be made without regard to age, race, creed, color, religion, sex, national origin, ancestry, disability status, veteran status, sexual orientation, gender identity or expression, genetic information, marital status, citizenship status or any other basis as protected by federal, state, or local law.

Job candidates will not be obligated to disclose sealed or expunged records of conviction or arrest as part of the hiring process.

Accenture is committed to providing veteran employment opportunities to our service men and women."
3,Senior Big Data Engineer,"Atlanta, GA",Atlanta,GA,None Found,None Found,None Found,None Found,"
You will design and create multi-tenant systems capable of loading and transforming a large volume of structured and semi-structured fast moving data
Build robust and scalable data infrastructure (both batch processing and real-time) to support needs from internal and external users
Build Data Pipelines
Run ETL into Hadoop/Elastic Search",None Found,None Found,"Location: San Jose, CA or Atlanta, GA
For over 10 years, Zscaler has been disrupting and transforming the security industry. Our 100% purpose built cloud platform delivers the entire gateway security stack as a service through 150 global data centers to securely connect users to their applications, regardless of device, location, or network in over 185 countries protecting over 3,500 companies and 100 Million threats detected a day.
We work in a fast paced, dynamic and make it happen culture. Our people are some of the brightest and passionate in the industry that thrive on being the first to solve problems. We are always looking to hire highly passionate, collaborative and humble people that want to make a difference.
As a Big Data Engineer, you will work on building the next generation of Zscaler's security analytics platform. You will play a crucial role in building a platform to collect and ingest several billion (and growing) log events from Zscaler's globally distributed security infrastructure and provide actionable insights to customers and Zscaler's security researchers.
Responsibilities:
You will design and create multi-tenant systems capable of loading and transforming a large volume of structured and semi-structured fast moving data
Build robust and scalable data infrastructure (both batch processing and real-time) to support needs from internal and external users
Build Data Pipelines
Run ETL into Hadoop/Elastic Search
Required:
3+ years of experience in Python or Java development a must (Strong Scala would skills would be acceptable as well)
3+ years experience in application big data development (Spark, Kafka, Storm, Kinesis, & building data pipelines)
Ability to troubleshoot and find complex performance issues with queries on the Spark platform (Spark SQL)
Familiarity with implementing services following REST model
Excellent interpersonal, technical and communication skills
Ability to learn, evaluate and adopt new technologies
Bachelor's Degree in computer science or equivalent experience
Highly Desirable:
Experience working with data processing infrastructure
Experience with data serialization techniques and data stores for persisting events
What You Can Expect From Us:
An environment where you will be working on cutting edge technologies and architectures
A fun, passionate and collaborative workplace
Competitive salary and benefits, including equity
The pace and excitement of working for a Silicon Valley Unicorn
Why Zscaler?
People who excel at Zscaler are smart, motivated and share our values. Ask yourself: Do you want to team with the best talent in the industry? Do you want to work on disruptive technology? Do you thrive in a fluid work environment? Do you appreciate a company culture that enables individual and group success and celebrates achievement?

If you said yes, we’d love to talk to you about joining our award-winning team!
Learn more at zscaler.com or follow us on Twitter @zscaler. Additional information about Zscaler (NASDAQ : ZS ) is available at http://www.zscaler.com. All qualified applicants will receive consideration for employment without regard to race, sex, color, religion, sexual orientation, gender identity, national origin, protected veteran status, or on the basis of disability.
#LI-JM1"
4,Data Engineer,"Atlanta, GA",Atlanta,GA,None Found,None Found,None Found,None Found,None Found,None Found,None Found,"FraudScope - the rapidly growing company that is tackling the problem of healthcare, fraud, waste and abuse - is looking for a full-time Data Engineer to work in their office located at Midtown Atlanta.
We are seeking a talented data engineer with experience in data analytics, building large reservoirs of data, and performing efficient queries. We have built a web-based application that is supported by a large dataset of healthcare data, on which we must frequently perform large queries very efficiently and return results in real time to the user. The role of the data engineer is to bridge the data scientist with the developers and the ingestion of data. Specifically, one of the major tasks is to build and execute new data pipelines on the cloud (AWS).
Required technical skills:

Relational database (PostgreSQL)
Cloud experience (AWS S3, Aurora, EC2)
Python
Linux

Beneficial technical skills:
Apache Spark, Hadoop
AWS Glue, Athena, IAM, KMS
Proven experience processing billions of records and terabytes of data
Table partitioning with PostgreSQL
Shell scripting (e.g., bash)

Other Requirements/Preferences:
Experience with healthcare data, particularly medical claims
Bachelor degree in Computer Science, Engineering or related field - At least 2 years of experience in the software industry
Authorization to work in the USA
Position in Midtown - Atlanta, GA (no remote)"
