,Title,Location,City,State,Zip,Country,Qualifications,Skills,Responsibilities,Education,Requirement,FullDescriptions
18,Lead Data Engineer,"Atlanta, GA 30309",Atlanta,GA,30309,None Found,None Found,"Previous management experience and successfully leading a team of direct reports
Proven track record of effectively leading and managing employees, managing performance, setting goals for team/individuals and provide mentoring.
Strong Tableau, Adobe Analytics other BI solution
Expert Oracle and Vertica skillsets
Experience using JIRA and Agile Project Management software
Experience using GitHub, Bit Bucket, or other code repository solution
Strong written, verbal communication and presentation skills
Ability to explain complex technical issues in a way that non-technical people may understand
Able to work in a global, multicultural environment
Self-motivated. Capable of working with little or no supervision
Ability to react positively under pressure to meet tight deadlines
Able to work independently or as a team player
Enjoy challenging and thought provoking work and have a strong desire to learn and progress","Work with development teams and other project leaders/stakeholders to provide technical solutions that enable business capabilities
Supports the data science community by enabling data availability in environments that provide advanced analytical capabilities
Maintains a broad understanding of implementation, integration, and inter-connectivity issues with emerging technologies to define data strategies
Assist in the decision-making process related to the selection of software architecture solutions
Implement architectures to handle web-scale data and its organization
Execute strategies that inform data design and architecture partnering with enterprise standard
Build robust data pipelines on public Cloud using AWS Kinesis, Kafka, Lambda or other technologies
Assist in creating documents that ensure consistency in development across the online organization. Implements and improves core software infrastructure
Deep expertise in SQL language, Python, Hadoop ecosystem and/or Spark ecosystem. Strong experience with writing complex programs, implementing architectures, and enabling automation in these environments
Develop and maintain business reporting, ensuring reliability and performance, delivery of performance management tools (such as control charts and scorecards), readiness and adoption of data w/in the organization
Consolidate, standardize and control changes to capacity management data and metric definitions, ownership, accountability and taxonomy to ensure alignment in understanding
Serve as strong advocate to improve analytical capability across the organization
Communicate with various business areas and to gather and prioritize their business requirements
Support various reporting and BI solutions (Tableau, Power BI, Salesforce Einstein)
Manage application and data integration platforms (Informatica, Talend)
Manage the full life cycle of development/reporting/integration projects: planning, design, develop, testing and rollout
Manage solution providers, define sourcing approach and manage the providers
Create and manage data, applications and technology architecture documentation and design artifacts
Work across teams to deliver meaningful reference architectures that outline architecture principles and best practices for technology advancement
Gain adoption of architecture processes, standards and procedures","
BS in Computer Science, Applied Mathematics, Physics, Statistics or area of study related to data sciences and data mining or relevant experience",None Found,"Invesco is one of the world’s leading global investment managers, entrusted with managing $1.2 trillion* in assets on behalf of clients worldwide. We are the 6th largest US retail asset manager and the 13th largest investment manager globally, and our more than 8,000 employees worldwide are dedicated to delivering an investment experience that helps people get more out of life. We are purely focused on managing a comprehensive range of active, passive and alternative investment capabilities, which we draw on to provide customized solutions aligned to client needs, our most important benchmark. (*As of May 31,2019)

Job Purpose (Job Summary):

As a Team Lead at Invesco, you would align business outcomes to technology goals and objectives. You will be responsible for managing decision sciences and advanced analytics initiatives, data integration/engineering. Interacts with Data Scientists, Business Owners, Business Data Analysts, Data Modelers, Architects, and Application Developers, to design, build and manage large-scale batch and real-time data pipelines utilizing various data analytics processing frameworks in support of Data Science practice. The position requires building strong technical hands-on-skills and experiences as well as establishing close business relationships across the enterprise. Working closely with marketing and sales stakeholders, you will establish and drive long term advance analytics roadmap manage increasing demands for advance analytics in Sales and Marketing. You will help steer the strategic technology direction, define target state architecture, technology roadmaps and mentor others. A successful candidate must have a demonstrable background with experience in development of high performance, distributed computing tasks using Big Data technologies such as Hadoop (platform level), NoSQL, text mining and other distributed environment technologies based on the needs of the organization. Responsible for analyzing, designing, programing, debugging and modifying software enhancements and/or new products used in distributed, large scale analytics solutions. Strong visualization skills and experience with BI tools (ex. Tableau)

Key Responsibilities / Duties:
Work with development teams and other project leaders/stakeholders to provide technical solutions that enable business capabilities
Supports the data science community by enabling data availability in environments that provide advanced analytical capabilities
Maintains a broad understanding of implementation, integration, and inter-connectivity issues with emerging technologies to define data strategies
Assist in the decision-making process related to the selection of software architecture solutions
Implement architectures to handle web-scale data and its organization
Execute strategies that inform data design and architecture partnering with enterprise standard
Build robust data pipelines on public Cloud using AWS Kinesis, Kafka, Lambda or other technologies
Assist in creating documents that ensure consistency in development across the online organization. Implements and improves core software infrastructure
Deep expertise in SQL language, Python, Hadoop ecosystem and/or Spark ecosystem. Strong experience with writing complex programs, implementing architectures, and enabling automation in these environments
Develop and maintain business reporting, ensuring reliability and performance, delivery of performance management tools (such as control charts and scorecards), readiness and adoption of data w/in the organization
Consolidate, standardize and control changes to capacity management data and metric definitions, ownership, accountability and taxonomy to ensure alignment in understanding
Serve as strong advocate to improve analytical capability across the organization
Communicate with various business areas and to gather and prioritize their business requirements
Support various reporting and BI solutions (Tableau, Power BI, Salesforce Einstein)
Manage application and data integration platforms (Informatica, Talend)
Manage the full life cycle of development/reporting/integration projects: planning, design, develop, testing and rollout
Manage solution providers, define sourcing approach and manage the providers
Create and manage data, applications and technology architecture documentation and design artifacts
Work across teams to deliver meaningful reference architectures that outline architecture principles and best practices for technology advancement
Gain adoption of architecture processes, standards and procedures
Work Experience / Knowledge:
7+ years of experience in data modeling, data warehousing, and big data architectures
5+ years of experience in a data engineering role
Proficient in application/software architecture (Definition, Business Process Modeling, etc.)
Deep expertise in (at least one) SQL language, Python, Hadoop ecosystem and/or Spark ecosystem. Strong experience with writing complex programs, implementing architectures, and enabling automation in these environments
The role will be responsible for providing innovative operational solutions and best practices
Advanced knowledge in SQL/Hive, Spark, NoSQL, (Java/Python is a plus)
Strong programming skills and ability to utilize a variety of software/languages/tools; e.g., Spark, R, Python, Scala, Java, Hive, SQL, SAS, Tableau, etc.
Experience with microservice development, Docker, Kubernetes
Develop software to run on cloud native big data infrastructure built on AWS using Spark, Lambda, S3, and other cloud native services
Designs and develops complex and large-scale data structures and pipelines to organize, collect and standardize data to generate insight
3+ years of experience in data integration platforms (Informatica, Talend)
Strong analytics and reporting skills – hands on experience in BI Tools like Tableau, Power BI, Salesforce Einstein
Hands on experience in self-service data preparation tool like Alteryx
Experience using GitHub, Bit Bucket, or other code repository solution
DevOps experience is a plus
Skills / Other Personal Attributes Required:
Previous management experience and successfully leading a team of direct reports
Proven track record of effectively leading and managing employees, managing performance, setting goals for team/individuals and provide mentoring.
Strong Tableau, Adobe Analytics other BI solution
Expert Oracle and Vertica skillsets
Experience using JIRA and Agile Project Management software
Experience using GitHub, Bit Bucket, or other code repository solution
Strong written, verbal communication and presentation skills
Ability to explain complex technical issues in a way that non-technical people may understand
Able to work in a global, multicultural environment
Self-motivated. Capable of working with little or no supervision
Ability to react positively under pressure to meet tight deadlines
Able to work independently or as a team player
Enjoy challenging and thought provoking work and have a strong desire to learn and progress
Formal Education: (minimum requirement to perform job duties)
BS in Computer Science, Applied Mathematics, Physics, Statistics or area of study related to data sciences and data mining or relevant experience
FLSA (US Only): Exempt

The above information on this description has been designed to indicate the general nature and level of work performed by employees within this role. It is not designed to contain or be interpreted as a comprehensive inventory of all duties, responsibilities and qualifications required of employees assigned to this job. The job holder may be required to perform other duties as deemed appropriate by their manager from time to time.

Invesco's culture of inclusivity and its commitment to diversity in the workplace are demonstrated through our people practices. We are proud to be an equal opportunity employer. All qualified applicants will receive consideration for employment without regard to race, creed, color, religion, sex, gender, gender identity, sexual orientation, marital status, national origin, citizenship status, disability, age, or veteran status. Our equal opportunity employment efforts comply with all applicable U.S. state and federal laws governing non-discrimination in employment."
19,Senior Digital Lead Data Engineer,"Atlanta, GA 30309",Atlanta,GA,30309,None Found,None Found,"Exceptional interpersonal skills, including teamwork, facilitation, and negotiation.
Communicates IT requirements and guidelines to vendor partners.
Applies multiple technical solutions to business problems.
Quickly comprehends the functions and capabilities of new technology.
Excellent written and oral communications skills.","Design and work with Agile teams to implement highly scalable Enterprise approaches for metadata, taxonomy, tagging, folder structures providing the lightweight controls to ensure sustainable data quality and efficiencies
Defines non-functional requirements including data cleansing and validation
Mentors and coaches other members of the agile and\or Run team
Interfaces with the Product Owner and Technology partners at the Program level to define and estimate features for agile teams
Works within the SAFe Agile framework and employs ITIL best practices
Client-facing, senior strategic support
Content assessment. Providing content revision/creation recommendations that help the business and its customers achieve their goals (based on brand documentation, competitive assessments, audience segmentation, SEO data, and site metrics)
Generating and/or overseeing an inventory of relevant client content assets
Creating and/or reviewing site structure and nomenclature for the most intuitive presentation of content, usually partnering with UX
Creating taxonomy and tagging strategies
Ensuring content is structured properly for any relevant backend systems including CMS, DAM, eCommerce and/or PIM
Contributing to technical system evaluations (such as CMS, DAM, and/or PIM) from a content perspective in terms of requirements
Establishing and/or maintaining editorial standards and accuracy/quality of content
Overseeing content migration and creating or reviewing associated documentation
Contributing to definition and management of, as well as periodic updates to, content governance and workflow (including content creation, content entry, publication, and decommission) as well as localization strategies
Responsible for management of, as well as periodic updates to, personalization and content tagging strategies for the site
Assists in production support and maintenance of applications as needed","
Bachelor's degree in English, Library Science, Journalism, Technical Writing, Marketing or equivalent military experience preferred",None Found,"Invesco is one of the world's leading global investment managers, entrusted with managing $1.2 trillion* in assets on behalf of clients worldwide. We are the 6th largest US retail asset manager and the 13th largest investment manager globally, and our more than 8,000 employees worldwide are dedicated to delivering an investment experience that helps people get more out of life. We are purely focused on managing a comprehensive range of active, passive and alternative investment capabilities, which we draw on to provide customized solutions aligned to client needs, our most important benchmark. (*As of May 31,2019)

About Invesco Technology
At Invesco Technology, we are strategic problem solvers. Our mission is to create world-class technology solutions to enable global operations, lead in the innovative use of data and emerging technologies to redefine the investment experience, and help our clients “get more out of life."" This mission is fueled by our high-performing teams, which thrive on collaboration, operate on shared trust, and leverage diversity of thought to deliver valuable results every day to Invesco, clients, and partners.

We wholeheartedly believe that our success is driven by our people. That is why we invest heavily in our top talent, providing opportunities for continuous learning and professional development. Our employees are encouraged and supported in taking advantage of development opportunities tied to their goals and are recognized for employing new skills to make an impact beyond the scope of their daily roles.

To continue building our high-performing, OneTech Team, we are seeking candidates who champion innovation, operate effectively in an agile environment, challenge the status quo and are empowered to take risks.

Job Purpose (Job Summary):

Join us in realizing Invesco's Digital Transformation! We are on a journey to reimagine what is into what could be. Think of us as like a tribe of digital activists who focus disruptive innovation who believe that digital operations in Investment Management can be done better. We have MASSIVE aspirations however we are focused on four goals:
Streamline content capture across the enterprise and create a one source of truth
Fully exploit the tremendous re-use potential through seamless accessibility to content
Provide Invesco with a highly scalable and dynamic platform that enables rapid growth
To shake-up the norm by developing new digital operating models to create a ""new world order""
Our vision is simple. To create strategic advantage by being the best at digital operations. We are highly motivated, not your usual financial services stereotype, and thrive within an industry resistant to change. As a team we respect and trust each other and celebrate our successes AND failures. Welcome to the new world order!
Right now, we are transforming the way we operate and to that note, we are looking for a super-strong and super-passionate Digital Lead Data Engineer. In our digital transformation, data is key. In this role, you will build technical solutions to help improve the scalability and performance of our data stores and our overall systems. As a Lead Engineer, you will focus on efforts that will provide increased flexibility and accessibility to our data, such as our cloud-based data lake and digital pipeline initiatives.
The Digital Lead Data Engineer acts as a senior level technical and functional expert, collaborating with business and Tech stakeholders at all levels to identify architectural solution options and map value streams. This position is responsible for using data engineering practices and techniques to deliver measurable business outcomes in a large-scale, complex organization.

Key Responsibilities / Duties:
Design and work with Agile teams to implement highly scalable Enterprise approaches for metadata, taxonomy, tagging, folder structures providing the lightweight controls to ensure sustainable data quality and efficiencies
Defines non-functional requirements including data cleansing and validation
Mentors and coaches other members of the agile and\or Run team
Interfaces with the Product Owner and Technology partners at the Program level to define and estimate features for agile teams
Works within the SAFe Agile framework and employs ITIL best practices
Client-facing, senior strategic support
Content assessment. Providing content revision/creation recommendations that help the business and its customers achieve their goals (based on brand documentation, competitive assessments, audience segmentation, SEO data, and site metrics)
Generating and/or overseeing an inventory of relevant client content assets
Creating and/or reviewing site structure and nomenclature for the most intuitive presentation of content, usually partnering with UX
Creating taxonomy and tagging strategies
Ensuring content is structured properly for any relevant backend systems including CMS, DAM, eCommerce and/or PIM
Contributing to technical system evaluations (such as CMS, DAM, and/or PIM) from a content perspective in terms of requirements
Establishing and/or maintaining editorial standards and accuracy/quality of content
Overseeing content migration and creating or reviewing associated documentation
Contributing to definition and management of, as well as periodic updates to, content governance and workflow (including content creation, content entry, publication, and decommission) as well as localization strategies
Responsible for management of, as well as periodic updates to, personalization and content tagging strategies for the site
Assists in production support and maintenance of applications as needed

Work Experience / Knowledge:
Minimum 8+ years' experience in digital content strategy or similar
Agency or consulting experience a plus
Proven track record of Innovation and expertise in Data Engineering
Understanding of agile development methods including: core values, guiding principles, and key agile practices
Proven ability to get stuff done, driven to see your team succeed.

Skills / Other Personal Attributes Required:
Exceptional interpersonal skills, including teamwork, facilitation, and negotiation.
Communicates IT requirements and guidelines to vendor partners.
Applies multiple technical solutions to business problems.
Quickly comprehends the functions and capabilities of new technology.
Excellent written and oral communications skills.

Formal Education: (minimum requirement to perform job duties)
Bachelor's degree in English, Library Science, Journalism, Technical Writing, Marketing or equivalent military experience preferred

Working Conditions:
An entrepreneurial working environment. If you can make a case for a project that helps achieve our goals or fits within our vision, we would encourage and pave the way for you to deliver it
A team that supports and collaborates with you
A fun environment that is not your typical Financial Services way-of-working
Challenges that will not only positively impact our organization and clients, however will also be a first in our industry
A competitive salary
Training to further your career and development. We want you to stay progressive and relevant and therefore we will invest in you to do just that!

FLSA (US Only): Exempt

The above information on this description has been designed to indicate the general nature and level of work performed by employees within this role. It is not designed to contain or be interpreted as a comprehensive inventory of all duties, responsibilities and qualifications required of employees assigned to this job. The job holder may be required to perform other duties as deemed appropriate by their manager from time to time.

Invesco's culture of inclusivity and its commitment to diversity in the workplace are demonstrated through our people practices. We are proud to be an equal opportunity employer. All qualified applicants will receive consideration for employment without regard to race, creed, color, religion, sex, gender, gender identity, sexual orientation, marital status, national origin, citizenship status, disability, age, or veteran status. Our equal opportunity employment efforts comply with all applicable U.S. state and federal laws governing non-discrimination in employment.

#Ll-SD1"
20,Technology Spring 2020 Intern,"Atlanta, GA",Atlanta,GA,None Found,None Found,None Found,None Found,None Found,None Found,None Found,"Opportunity Overview
About Us

WarnerMedia is a leading media and entertainment company that creates and distributes premium and popular content from a diverse array of talented storytellers and journalists to global audiences through its consumer brands including: HBO, Warner Bros., TNT, TBS, CNN, DC Entertainment, New Line, Cartoon Network, Adult Swim, TCM, truTV and others.

See what it’s like to work at WarnerMedia! Discover more about the program and follow us on Instagram, Twitter and Facebook.

We are looking for a Big Data Engineer Intern interested in data engineering and analytics using large structured, semi-structured, and unstructured datasets. You will be part of a talented team of engineers that are tasked with making sense of the vast resource of data in the Warner Media infrastructure. In addition, as an intern, you will gain practical experience and gain new skills as a result of working in our world class media organization.

The Day-to-Day

Big Data engineering at Warner Media involves one or more of the following:
Designing, implementing, and improving data models, data pipelines, and metadata extractors
Analyzing AWS Cloudwatch or other logs, for example, to optimize resource utilization
Implementing statistical measurement for A/B testing
The Essentials
Students enrolled in a program for computer science, information technology, analytics, math, statistics, or a related field
Solid grasp of programming languages (particularly Python), various operating systems (Linux, Mac, Windows), and some familiarity with public cloud platforms
Demonstrated ability to conduct independent research utilizing large data sets
Strong analytical and quantitative skills, along with curiosity, creativity, and ability to communicate
Passion for seeing projects through from initial conception to eventual application
Empirical, detail-oriented mindset
Sense of ownership of her/his work, working well both independently and within a small collaborative team
What’s so great about this internship?
An opportunity to work with a great team that is passionate about the same thing you are!
Networking opportunities to meet people that you’d like to know!
A speaker series that introduces you to cool executives and what they do for the best brands!
Internship dates are January 21, 2020 – May 8, 2020. All interns are expected to work 20 hours per week and paid competitively based on location (relocation is not provided). Participation in the internship program is reserved for students who are currently enrolled or within 6 months post-graduation. Most positions are targeted to upperclassmen and graduate students. Candidates must be qualified and available to work at the time the application is submitted. Full-time employment is not guaranteed at the end of the program.

WarnerMedia and its subsidiaries are Equal Opportunity Employers and E-Verify users. Qualified applicants will receive consideration for employment without regard to race, color, religion, sex, national origin, sexual orientation, gender identity, disability, or protected veteran status."
