,Title,Location,City,State,Zip,Country,Qualifications,Skills,Responsibilities,Education,Requirement,FullDescriptions
45,"Data Engineer, Decision Sciences","Atlanta, GA 30309",Atlanta,GA,30309,None Found,None Found,"Strong Tableau, Adobe Analytics other BI solution
Expert Oracle and Vertica skillsets
Experience using JIRA and Agile Project Management software
Experience using GitHub, Bit Bucket, or other code repository solution
Strong written, verbal communication and presentation skills
Ability to explain complex technical issues in a way that non-technical people may understand
Able to work in a global, multicultural environment
Self-motivated. Capable of working with little or no supervision
Ability to react positively under pressure to meet tight deadlines
Able to work independently or as a team player
Enjoy challenging and thought provoking work and have a strong desire to learn and progress","Work with development teams and other project leaders/stakeholders to provide technical solutions that enable business capabilities
Serve as a key driver on various new technology initiatives and programs on behalf of IT organization, including big data, machine learning and AI
Supports the data science community by enabling data availability in environments that provide advanced analytical capabilities
Maintains a broad understanding of implementation, integration, and inter-connectivity issues with emerging technologies to define data strategies
Assist in the decision-making process related to the selection of software architecture solutions
Build robust data pipelines on public Cloud using AWS Kinesis, Kafka, Lambda or other technologies
Assist in creating documents that ensure consistency in development across the online organization. Implements and improves core software infrastructure
Deep expertise in SQL language, Python, Hadoop ecosystem and/or Spark ecosystem. Strong experience with writing complex programs, implementing architectures, and enabling automation in these environments
Develop and maintain business reporting, ensuring reliability and performance, delivery of performance management tools (such as control charts and scorecards), readiness and adoption of data w/in the organization
Consolidate, standardize and control changes to capacity management data and metric definitions, ownership, accountability and taxonomy to ensure alignment in understanding
Serve as strong advocate to improve analytical capability across the organization
Support various reporting and BI solutions (Tableau, Power BI, Salesforce Einstein)
Manage application and data integration platforms (Informatica, Talend)
Create and manage data, applications and technology architecture documentation and design artifacts
Work across teams to deliver meaningful reference architectures that outline architecture principles and best practices for technology advancement
Gain adoption of architecture processes, standards and procedures","
BS in Computer Science, Applied Mathematics, Physics, Statistics or area of study related to data sciences and data mining or relevant experience",None Found,"Invesco is one of the world’s leading global investment managers, entrusted with managing $1.2 trillion* in assets on behalf of clients worldwide. We are the 6th largest US retail asset manager and the 13th largest investment manager globally, and our more than 8,000 employees worldwide are dedicated to delivering an investment experience that helps people get more out of life. We are purely focused on managing a comprehensive range of active, passive and alternative investment capabilities, which we draw on to provide customized solutions aligned to client needs, our most important benchmark. (*As of May 31,2019)

Job Purpose (Job Summary):

As a Data Engineer at Invesco, you would align business outcomes to technology goals and objectives. You will be responsible for managing decision sciences and advanced analytics initiatives, data integration/engineering. Interacts with Data Scientists, Business Owners, Business Data Analysts, Data Modelers, Architects, and Application Developers, to design, build and manage large-scale batch and real-time data pipelines utilizing various data analytics processing frameworks in support of Data Science practice. The position requires building strong technical hands-on-skills and experiences as well as establishing close business relationships across the enterprise. Working closely with marketing and sales stakeholders, you will execute long term advance analytics roadmap manage increasing demands for advance analytics in Sales and Marketing. A successful candidate must have a demonstrable background with experience in development of high performance, distributed computing tasks using Big Data technologies such as Hadoop (platform level), NoSQL, text mining and other distributed environment technologies based on the needs of the organization. Responsible for analyzing, designing, programing, debugging and modifying software enhancements and/or new products used in distributed, large scale analytics solutions. Strong visualization skills and experience with BI tools (ex. Tableau)

Key Responsibilities / Duties:
Work with development teams and other project leaders/stakeholders to provide technical solutions that enable business capabilities
Serve as a key driver on various new technology initiatives and programs on behalf of IT organization, including big data, machine learning and AI
Supports the data science community by enabling data availability in environments that provide advanced analytical capabilities
Maintains a broad understanding of implementation, integration, and inter-connectivity issues with emerging technologies to define data strategies
Assist in the decision-making process related to the selection of software architecture solutions
Build robust data pipelines on public Cloud using AWS Kinesis, Kafka, Lambda or other technologies
Assist in creating documents that ensure consistency in development across the online organization. Implements and improves core software infrastructure
Deep expertise in SQL language, Python, Hadoop ecosystem and/or Spark ecosystem. Strong experience with writing complex programs, implementing architectures, and enabling automation in these environments
Develop and maintain business reporting, ensuring reliability and performance, delivery of performance management tools (such as control charts and scorecards), readiness and adoption of data w/in the organization
Consolidate, standardize and control changes to capacity management data and metric definitions, ownership, accountability and taxonomy to ensure alignment in understanding
Serve as strong advocate to improve analytical capability across the organization
Support various reporting and BI solutions (Tableau, Power BI, Salesforce Einstein)
Manage application and data integration platforms (Informatica, Talend)
Create and manage data, applications and technology architecture documentation and design artifacts
Work across teams to deliver meaningful reference architectures that outline architecture principles and best practices for technology advancement
Gain adoption of architecture processes, standards and procedures
Work Experience / Knowledge:
2+ years of experience in data modeling, data warehousing, and big data architectures
2+ years of experience in a data engineering role
Proficient in application/software architecture (Definition, Business Process Modeling, etc.)
Deep expertise in (at least one) SQL language, Python, Hadoop ecosystem and/or Spark ecosystem. Strong experience with writing complex programs, implementing architectures, and enabling automation in these environments
The role will be responsible for providing innovative operational solutions and best practices
Advanced knowledge in SQL/Hive, Spark, NoSQL, (Java/Python is a plus)
Strong programming skills and ability to utilize a variety of software/languages/tools; e.g., Spark, R, Python, Scala, Java, Hive, SQL, SAS, Tableau, etc.
Experience with microservice development, Docker, Kubernetes
Develop software to run on cloud native big data infrastructure built on AWS using Spark, Lambda, S3, and other cloud native services
Designs and develops complex and large-scale data structures and pipelines to organize, collect and standardize data to generate insight
2+ years of experience in data integration platforms (Informatica, Talend)
Strong analytics and reporting skills – hands on experience in BI Tools like Tableau, Power BI, Salesforce Einstein
Experience using JIRA and Agile Project Management software
Experience using GitHub, Bit Bucket, or other code repository solution
DevOps experience is a plus
Skills / Other Personal Attributes Required:
Strong Tableau, Adobe Analytics other BI solution
Expert Oracle and Vertica skillsets
Experience using JIRA and Agile Project Management software
Experience using GitHub, Bit Bucket, or other code repository solution
Strong written, verbal communication and presentation skills
Ability to explain complex technical issues in a way that non-technical people may understand
Able to work in a global, multicultural environment
Self-motivated. Capable of working with little or no supervision
Ability to react positively under pressure to meet tight deadlines
Able to work independently or as a team player
Enjoy challenging and thought provoking work and have a strong desire to learn and progress
Formal Education: (minimum requirement to perform job duties)
BS in Computer Science, Applied Mathematics, Physics, Statistics or area of study related to data sciences and data mining or relevant experience
FLSA (US Only): Nonexempt

The above information on this description has been designed to indicate the general nature and level of work performed by employees within this role. It is not designed to contain or be interpreted as a comprehensive inventory of all duties, responsibilities and qualifications required of employees assigned to this job. The job holder may be required to perform other duties as deemed appropriate by their manager from time to time.

Invesco's culture of inclusivity and its commitment to diversity in the workplace are demonstrated through our people practices. We are proud to be an equal opportunity employer. All qualified applicants will receive consideration for employment without regard to race, creed, color, religion, sex, gender, gender identity, sexual orientation, marital status, national origin, citizenship status, disability, age, or veteran status. Our equal opportunity employment efforts comply with all applicable U.S. state and federal laws governing non-discrimination in employment."
46,Data Engineer,"Atlanta, GA 30303",Atlanta,GA,30303,None Found,None Found,None Found,None Found,None Found,None Found,"Challengers Wanted.
See how we're embracing the challenges of tomorrow!

Are you interested in working with an excellent team of Data-focused professionals focused on opportunities to enable and enhance BI and Analytics capabilities? Here at Koch Business Solutions (KBS), we place a high value on innovation and thinking creatively in a real way. KBS serves as a technology arm to various Koch Industries companies, and the Data Services team provides real-world solutions that deliver data across systems and to end-user BI and Analytics users. If you're excited about a shift to cloud-based BI and Analytics platforms, guess what…so are we! If you have a passion for productionizing the tribal knowledge that exists in the minds of business subject matter experts, and then backing that knowledge up with real data to help business make the best decisions possible through self-service analytics and dashboards, this could be the place for you. Come grow with us!
A Day In The Life Typically Includes:
Team collaboration in development and maintenance of scalable data warehouse architecture that supports business/technical requirements
Participation in all phases of SDLC related to data delivery: Logical and physical data modeling
ETL development/management
Multidimensional Cube and Tabular model development
Platform to platform data integrations
Identifying data quality issues and supporting data governance initiatives by participating in necessary activities including data profiling, data mining, and clean up
Performing support and troubleshooting tasks for Data Services products and platforms
Tasks include: Performing work on service requests, incidents, and run and maintain activities
Providing estimates for development work needed to support break-fix, new projects, and enhancements
Providing after hours support for mission critical applications and platforms when needed
What You Will Need:

Basic Qualifications:
2+ years of experience in applied data warehousing methodology, analysis, and development
2+ years of experience developing ETL packages, including scheduling and automation
2+ years of SQL coding and tuning experience
Proven experience transforming business requirements to technical solutions
What Will Put You Ahead?

Preferred Qualifications:
Experience with both Multi-Dimensional and Tabular Analysis Services development
Bachelor's Degree in Computer Science, Information Systems, Math or other related field
Experience with AWS Cloud data platforms
Working knowledge of data platforms such as: Redshift, Glue, Matillion, Snowflake, Tableau, Alteryx and Power BI
Understanding of and experience in ETL performance tuning
Experience working in agile development environment
Solid understanding of SDLC
Experience using Source Control systems
This role is not eligible for visa sponsorship.
Learn more about us

Salary and benefits commensurate with experience.
Equal Opportunity Employer.

Except where prohibited by state law, all offers of employment are conditioned upon successfully passing a drug test.

This employer uses E-Verify. Please visit the following website for additional information: www.kochcareers.com/doc/Everify.pdf"
47,Data Architect,"Atlanta, GA",Atlanta,GA,None Found,None Found,"
Authority in everything data related. Know exactly how data is collected, analyzed, and delivered. Also familiar with both the technical and user-facing sides of databases.
5+ years work experience as a Data Architect or Data Engineer or similar role
In-depth understanding of database structure principles used for analytics such as star schemas and SCD
Expertise in database performance optimization
Expertise in building processes supporting data transformation, data structures, metadata, dependency and workload management.
A successful history of manipulating, processing and extracting value from large disconnected datasets.
Experience using the following software/tools:
Expertise in Redshift, Snowflake, or similar cloud databases
Experience with object-oriented/object function scripting languages
Experience with ETL tools: Alooma, Matillion, Fivetran, Talend, etc.
Experience with big data tools: Hadoop, Spark, Kafka, etc.
Experience with relational SQL and NoSQL databases, including Postgres and Cassandra.
Experience with data pipeline and workflow management tools: Airflow, Data Factory, etc.
Experience with stream-processing systems: Storm, Spark-Streaming, etc.
Familiarity with data visualization tools (e.g. Tableau, Looker, Power BI)
Demonstrated analytical skills
Problem-solving attitude
B.S. in Computer Science, Information Systems or another quantitative field",None Found,None Found,None Found,None Found,"Your Opportunity
We are looking for a Data Architect to run and evolve our data practice within the Go-To-Market Data & Analytics Team. We use data to (i) define and measure performance and productivity metrics across Go-To-Market Functions (ii) identify and monitor leading indicators and predictive models, and (iii) deliver insights to Go-To-Market teams to ultimately improve core business processes and outcomes. The team partners with Executives and their teams within Sales, Marketing, Pre-and-Post Technical Sales, Customer Success, and Alliances & Channels. We also partner on multi-functional projects with Product and G&A.

Who You Are:
A creative and forward-thinking data professional
An experienced data pipeline builder and data wrangler who enjoys optimizing data systems and building them from the ground up
You thrive in a fast-paced growth environment
Results and Team oriented
What You'll Do
Design, develop and build database design and architecture to power Go-To-Market analytics products
Build, optimize and maintain conceptual and logical database models
Design data pipeline architecture and ensure successful creation of the infrastructure required for optimal extraction, transformation, and loading of data from a wide variety of data sources using SQL and other technologies.
Identify, design, and implement internal process improvements: automating manual processes, optimizing data delivery, re-designing infrastructure for greater scalability, etc.
Create data monitoring models for each product and work with business and analytics teams to create models ahead of new releases
Examine and identify database structural necessities by evaluating operations, applications, and programming.
Monitor the system performance by performing regular tests, fixing performance issues, and integrating new features.
Work with business partners to assist with data-related technical issues and support their data infrastructure needs
Recommend solutions to improve new and existing database systems.
Educate staff members through training and individual support.
Your Qualifications
Authority in everything data related. Know exactly how data is collected, analyzed, and delivered. Also familiar with both the technical and user-facing sides of databases.
5+ years work experience as a Data Architect or Data Engineer or similar role
In-depth understanding of database structure principles used for analytics such as star schemas and SCD
Expertise in database performance optimization
Expertise in building processes supporting data transformation, data structures, metadata, dependency and workload management.
A successful history of manipulating, processing and extracting value from large disconnected datasets.
Experience using the following software/tools:
Expertise in Redshift, Snowflake, or similar cloud databases
Experience with object-oriented/object function scripting languages
Experience with ETL tools: Alooma, Matillion, Fivetran, Talend, etc.
Experience with big data tools: Hadoop, Spark, Kafka, etc.
Experience with relational SQL and NoSQL databases, including Postgres and Cassandra.
Experience with data pipeline and workflow management tools: Airflow, Data Factory, etc.
Experience with stream-processing systems: Storm, Spark-Streaming, etc.
Familiarity with data visualization tools (e.g. Tableau, Looker, Power BI)
Demonstrated analytical skills
Problem-solving attitude
B.S. in Computer Science, Information Systems or another quantitative field
Please note that visa sponsorship is not available for this position.
Our Office
Our office is in the tech-rich urban center of San Francisco, with easy commute access and a plethora of good eats. We provide competitive compensation, equity and big-company benefits (medical, dental, etc.)—all while maintaining the energy, agility, and fun of a start-up.
About Us
New Relic (NYSE: NEWR) is the industry’s largest and most comprehensive cloud-based instrumentation platform built to create more perfect software. The world’s best software and DevOps teams rely on New Relic to move faster, make better decisions and create best-in-class digital experiences. If you run software, you need to run New Relic. We’re proudly trusted by more than 50% of the Fortune 100.
Founded in 2008, we’re a global company focused on building a culture where all employees feel a deep sense of belonging, where every ‘Relic’ can bring their whole self to work and feel supported and empowered to thrive. We’re consistently recognized as a distinguished employer and are committed to building world-class products and an award winning culture. For more information, visit newrelic.com.
Our Hiring Process
In compliance with applicable law, all persons hired will be required to verify identity and eligibility to work and to complete employment eligibility verification. Note: Our stewardship of the data of thousands of customers’ means that a criminal background check is required to join New Relic.
We will consider qualified applicants with arrest and conviction records based on individual circumstances and in accordance with applicable law including, but not limited to, the San Francisco Fair Chance Ordinance.
Headhunters and recruitment agencies may not submit resumes/CVs through this website or directly to managers. New Relic does not accept unsolicited headhunter and agency resumes, and will not pay fees to any third-party agency or company that does not have a signed agreement with New Relic.
New Relic is an equal opportunity employer. We eagerly seek applicants of diverse background and hire without regard to race, color, gender identity, religion, national origin, ancestry, citizenship, physical abilities (or disability), age, sexual orientation, veteran status, or any other characteristic protected by law.

Interested in the details of our privacy policy? Read more here: https://newrelic.com/termsandconditions/applicant-privacy-policy

#LI-SP2"
