,Title,Location,City,State,Zip,Country,Qualifications,Skills,Responsibilities,Education,Requirement,FullDescriptions
12,Machine Learning Engineer,"Reston, VA 20190",Reston,VA,20190,None Found,"
2+ years experience coding GANs to produce desired results.
3+ years experience in selecting or developing algorithms for performing a variety of machine learning and computer vision tasks with demonstrable experience
3+ years experience in applying and adapting the latest research in machine learning and computer vision to support business objectives including prototype development and product integration.
3+ years experience performing model training / algorithm development optimizing for speed, size or accuracy and developing / refining new and existing training sets as required.
5+ years experience designing, developing, enhancing, debugging and implementing software and algorithms using programming languages such as Java, C++, Python, R, or JavaScript.
Proficiency in Machine Learning processes such as feature extraction, statistical approaches, linear and non-linear classifiers, and deep learning including one or more approaches such as CNNs, SVM, and Bayesian Networks.
Experience with deep learning frameworks such as TensorFlow, Keras, or Torch
Proficiency in in Image Processing, Image Analysis, and/or Computer Vision
Ability to work independently, in a SCRUM-like environment with strong desire to push your ideas into production, overcoming obstacles, in order to deliver impact.
",None Found,None Found,None Found,None Found,"Overview

Radical Convergence is a fast-paced start up looking to disrupt, transform, and innovate on behalf of our clients. We are inventors, technologists, artisans, problem solvers, and collaborators seeking to redefine the content management experience and changing how content is delivered to clients. We have an amazing team and we want to add a few talented revolutionaries who want to make a difference solving big problems and contributing to impactful and meaningful work. Create your story and start making an indelible impact today.

Job Description

We are seeking a Machine Learning Engineer to work collaboratively with highly talented team members to conduct applied research in generative adversarial networks (GANs) and related methods to generate content. The ideal candidate has experience applying state of the art machine learning and computer vision algorithms and deep learning frameworks with experience in GANs and related deep learning methods. Candidates must be able to conduct research, implement new models, conduct experiments and package models working with our engineering team. Candidates must have strong programming skills in Python, flexibility working across various deep learning platforms (e.g., TensorFlow and PyTorch), and previous experience coding GANs to prototype algorithms and models working with a team of engineers to productize offerings.

This position is located in our Reston, Virginia headquarters.

Qualifications

2+ years experience coding GANs to produce desired results.
3+ years experience in selecting or developing algorithms for performing a variety of machine learning and computer vision tasks with demonstrable experience
3+ years experience in applying and adapting the latest research in machine learning and computer vision to support business objectives including prototype development and product integration.
3+ years experience performing model training / algorithm development optimizing for speed, size or accuracy and developing / refining new and existing training sets as required.
5+ years experience designing, developing, enhancing, debugging and implementing software and algorithms using programming languages such as Java, C++, Python, R, or JavaScript.
Proficiency in Machine Learning processes such as feature extraction, statistical approaches, linear and non-linear classifiers, and deep learning including one or more approaches such as CNNs, SVM, and Bayesian Networks.
Experience with deep learning frameworks such as TensorFlow, Keras, or Torch
Proficiency in in Image Processing, Image Analysis, and/or Computer Vision
Ability to work independently, in a SCRUM-like environment with strong desire to push your ideas into production, overcoming obstacles, in order to deliver impact.
Preferred Qualifications

Master's or Ph.D. degree in Engineering, Computer Science, Machine Learning, Math, Statistics or related fields with specialization in machine learning and/or computer vision.
Computer vision experience in 3D computer vision tasks
Deep understanding of recent ANN/GAN concepts such as Spectral Normalization, Lipschitz Continuity, the Wasserstein Metric, Attention Mechanisms, Instance Normalization, and/or Perceptual Losses.
Experience with distributed training of deep neural networks across many GPUs/TPUs.
Experience with a diverse set of generative modeling techniques.

Benefits and Perks

Radical Convergence is as obsessed about our employees as our customers. We want to provide great benefits and perks so you can focus on making an impact. We recognize that industry is moving away from better benefits so we have decided to do our part to start reversing the trend. Join us in our quest to disrupt, transform and innovate.

Benefits
Competitive Pay
100% Company paid medical/dental/vision/life/disability plans
Health Reimbursable Account (HRA) for those pesky copays
Flexible Savings Accounts (FSA)
Training Budget
401(k) Matching
Perks
Time When You Need It – Unlimited Vacation Time
Be Gumby – Flexible work schedule and location
Late Night Munchies – We are fully stocked
zCNMCQQe1o"
13,Scientientutional Data Tesk* - Machine Learning Engineer,"Fort Meade, MD",Fort Meade,MD,None Found,None Found,None Found,None Found,None Found,None Found,None Found,"Title generated by a neural net trained on relevant job listings and then asked to perform poorly.
What you will be working on:
Come be a part of a team applying cutting edge Machine Learning to the cybersecurity domain! We will use state of the art ML techniques (Neural Nets, Gradient Boosting, etc.) to model behaviors, detect anomalies, cluster data, and ultimately create actionable information.
You will:
Build and improve ML models for a number of different problem sets
Collect and preprocess data for training and validation
Use TensorFlow, Keras, XGBoost, scikit-learn, and other ML tools
Help other engineers deploy ML models on dynamic compute platforms
Read current research and contribute to the team’s collective knowledge
Mentor junior team members
Contribute to team strategy and direction
Work at our headquarters in Annapolis Junction, MD and/or the surrounding area.
What you need:
A Bachelor’s degree in Computer Science or Mathematics
10+ years experience in Software Engineering or Machine Learning
US Government Security clearance or the ability to obtain one.
What we would like you to have:
A deep interest in data and machine learning
A Master’s degree in Computer Science or Mathematics
Experience with Python
5+ years experience with Machine Learning tools and techniques
Familiarity with the cyber security domain
A desire to solve problems whose solutions aren’t on Stack Overflow
A few of the reasons to work for us:
You can grow with us: Our flexible and collaborative environment encourages our people to challenge themselves and feed their need to learn and grow. We offer $10k towards Professional Development and Education, and Brown Bag sessions covering a wide variety of topics.
You can retire sooner rather than later: We match up to 8% of your 401k contributions which you are vested in 100% day one.
Work - life balance is real: In addition to the ability to work flexible hours, you’ll get up to 7 weeks of PTO which is based upon your total years’ experience. For every year you’re with HII-TSD (formerly G2, Inc.) you’ll enjoy an additional day of PTO.
Not quite ready to apply? TAKE THE NEXT STEP and GET CONNECTED or reach out to us at Recruiting@g2-inc.com to take a less formal approach.
We are an equal opportunity employer and all qualified applicants will receive consideration for employment without regard to race, color, religion, sex, national origin, disability status, protected veteran status, or any other characteristic protected by law.
If you are seeking reasonable accommodation as it relates to the employment process, please contact the recruiting department at (410) 290-9710 or recruiting@g2-inc.com"
14,"Associate ProServe Consultant, TechU","Washington, DC",Washington,DC,None Found,None Found,None Found,None Found,None Found,None Found,None Found,"Bachelor’s Degree in a STEM related field such as computer science, computer engineering, or equivalent experience1+ years programming experience in one of the following languages: Java, Python, Ruby, C# or C++1+ years experience with Networking fundamentals, Security, Databases (Relational and/or NoSQL), Operating Systems (Unix, Linux, and/or Windows)

At Amazon we're working to be the most customer-centric company on earth. To get there, we need exceptional talent, and bright, driven people. Amazon Web Services (AWS), a subsidiary of Amazon.com and a leader in Cloud Computing, is seeking early career talent to join our AWS Tech U Program. This is a unique opportunity for driven, self-starters to play a key role in a fast-growing business, and to deliver significant value to AWS customers of all sizes from nimble startups to global brands. You will learn from top AWS subject matter experts and get paid while you train for an exciting career in the tech industry.

These are some of the most challenging and exciting roles in the IT industry today. We work with cutting edge technologies supporting the largest and most innovative businesses, non-profits and government agencies around the world. This is a an unparalleled opportunity to leapfrog your peers and take a leadership role helping AWS to transform the way the world uses technology to solve their business challenges. The skills and experiences you gain will be highly sought after throughout the industry and give you the opportunity for the career of a lifetime.

About Tech U
If you have a deep passion for utilizing technology to empower businesses and a love for collaborating with technology and business leaders then the AWS Tech U Program is for you. AWS Tech U is an accelerated career development program for those who want to advance both their technical and business skills. The Program will provide you with training and work experience that aligns in the fields of Professional Service Consulting. This unique residency program consists of a 6-month instructor lead, project-based learning curriculum (where you must be open to both Herndon, VA, and Seattle, WA for this portion of the program), followed by a 6 month On-the-Job Training (OJT) learning assignment within Professional Services Consulting (location based on business need). To be considered for this role, you must be willing to complete the 6 months of OJT (location based on business need). AWS will provide relocation assistance for both the academic and on-the-job training assignments.

Professional Services
Amazon Web Services (AWS) is looking for motivated technologists who possess a unique balance of technical depth, business knowledge, and strong interpersonal skills. You will partner with customers and several AWS teams to craft highly scalable, flexible and resilient cloud architectures that address customer business problems. As a trusted customer advocate, you will help organizations understand best practices around cloud-based solutions, and how to migrate existing workloads to the cloud. You will have the opportunity to help shape and execute a strategy to build min- share and broad use of AWS within organizations.

At AWS, we have a credo of “Work hard. Have fun. Make history”. In this role, you will love what you do and instinctively know how to make work fun. You will be dynamic, creative, and willing to take on any challenge and make a big impact.

Here are some of the qualities we are searching for:
Be great fun to work with. At AWS, we have a credo of “Work hard. Have fun. Make history”. In this role, you will love what you do, and instinctively know how to make work fun. You will be dynamic and creative, and willing to take on any challenge and make a big impact.
An affinity for the new and unknown. We are always experimenting with innovative technologies including cloud computing, Machine Learning, and Internet of Things.
Enjoy working with customers of all shapes and sizes. You will have a passion for educating, training, designing, and building solutions for a diverse and challenging set of customers ranging from small businesses to large enterprises.
During your OJT as an Associate Cloud Developer within Professional Services, you will receive instruction and on-the-job training on a range of AWS services and solutions. By the end of your program, you will choose a specialty track suited to your strengths and preferences (subject to business availability). These tracks include:

Application Developer – AppDev resources are specialists in designing applications that run natively in the cloud. They are experts in building programs that run on any number of platforms including virtualized instances, containers, or serverless architecture.
Cloud Infrastructure Architect – An expert in cloud-based networking and system rollouts. CIAs specialize in network performance, infrastructure provisioning, and building Application Programming Interfaces (APIs).
DevOps Specialist – A leader in building advanced computing systems that harness continuous integration/continuous deployment pipelines and utilize the strengths of cloud computing to build scalable and economical systems for customers.
Data Lake & Analytics Specialist – This role will specifically focus on data processing capabilities and helping our customers and partners to remove the constraints that prevent our customers from leveraging their data to develop business insights. Engagements will include migration of existing applications and development of new applications using AWS cloud services.
Data Warehouse & Massive Parallel Processing Specialist – This role will specifically focus on large scale data warehousing and database migration capabilities. Engagements will include Redshift implementations and helping customers to migrate from their existing on-premises data warehouses using other databases to Amazon Redshift.
Data & Machine Learning Engineer – In this role, you will work with our partners and customers with a focus on our AWS Analytics and ML services offering such Amazon Kinesis, AWS Glue, Amazon Redshift, Amazon EMR, Athena, Amazon SageMaker, and more. You will help our customers and partners to remove the constraints that prevent them from leveraging their data to develop business insights.

Ability to travel to provide Professional Services is required for this role.

Meet Customer requirements to allow for authorized work in the US and possess permanent authorization to work in the U.S.Troubleshooting: Experience with QA, testing, helpdesk, IT support, or any technician or quality assurance type workCloud Awareness: Experience implementing a cloud-based technology solution in a school project or while working for a companyExperience with one or more of the following domains: systems administration (Linux/Window), network administration (DNS, IPsec, BGP, VPN, Load Balancing), or programming (Node.JS, Java, Ruby, C#, Python, or PHP)Passion for experiencing new technologies, cultures and locations in the US and around the world
Amazon is an Equal Opportunity Employer – Minority / Women / Disability / Veteran / Gender Identity / Sexual Orientation / Age.

Pursuant to the San Francisco Fair Chance Ordinance, we will consider for employment qualified applicants with arrest and conviction records.

Pursuant to the Los Angeles Fair Chance Ordinance, we will consider for employment qualified applicants with arrest and conviction records."
15,Comchhology Analytics Associate* - Machine Learning Engineer,"Fort Meade, MD",Fort Meade,MD,None Found,None Found,None Found,None Found,None Found,None Found,None Found,"Title generated by a neural net trained on relevant job listings and then asked to perform poorly.
What you will be working on:
Come be a part of a team applying cutting edge Machine Learning to the cybersecurity domain! We will use state of the art ML techniques (Neural Nets, Gradient Boosting, etc.) to model behaviors, detect anomalies, cluster data, and ultimately create actionable information.
You will: Build and improve ML models for a number of different problem sets Collect and preprocess data for training and validation Use TensorFlow, Keras, XGBoost, scikit-learn, and other ML tools Help other engineers deploy ML models on dynamic compute platforms Read current research and contribute to the team’s collective knowledge Work at our headquarters in Annapolis Junction, MD and/or the surrounding area.

What you need: A Bachelor’s degree in Computer Science or Mathematics US Government Security clearance or the ability to obtain one.

What we would like you to have: A deep interest in data and machine learning A strong background in Computer Science and Mathematics Experience with Python
 Familiarity with Machine Learning tools and techniques Familiarity with the cyber security domain A desire to solve problems whose solutions aren’t on Stack Overflow

A few reasons to work for us:
You can grow with us: Our flexible and collaborative environment encourages our people to challenge themselves and feed their need to learn and grow. We offer $10k towards Professional Development and Education, and Brown Bag sessions covering a wide variety of topics.
You can retire sooner rather than later: We match up to 8% of your 401k contributions which you are vested in 100% day one.
Work - life balance is real: In addition to the ability to work flexible hours, you’ll get up to 7 weeks of PTO which is based upon your total years’ experience. For every year you’re with HII-TSD (formerly G2, Inc.), you’ll enjoy an additional day of PTO.
Not quite ready to apply? TAKE THE NEXT STEP and GET CONNECTED or reach out to us at Recruiting@g2-inc.com to take a less formal approach.
We are an equal opportunity employer and all qualified applicants will receive consideration for employment without regard to race, color, religion, sex, national origin, disability status, protected veteran status, or any other characteristic protected by law.
If you are seeking reasonable accommodation as it relates to the employment process, please contact the recruiting department at (410) 290-9710 or recruiting@g2-inc.com"
16,Scientientutional Data Tesk* - Machine Learning Engineer,"Fort Meade, MD",Fort Meade,MD,None Found,None Found,None Found,None Found,None Found,None Found,None Found,"Title generated by a neural net trained on relevant job listings and then asked to perform poorly.
What you will be working on:
Come be a part of a team applying cutting edge Machine Learning to the cybersecurity domain! We will use state of the art ML techniques (Neural Nets, Gradient Boosting, etc.) to model behaviors, detect anomalies, cluster data, and ultimately create actionable information.
You will: Build and improve ML models for a number of different problem sets Collect and preprocess data for training and validation Use TensorFlow, Keras, XGBoost, scikit-learn, and other ML tools Help other engineers deploy ML models on dynamic compute platforms Read current research and contribute to the team’s collective knowledge Mentor junior team members Contribute to team strategy and direction Work at our headquarters in Annapolis Junction, MD and/or the surrounding area.

What you need: A Bachelor’s degree in Computer Science or Mathematics 10+ years experience in Software Engineering or Machine Learning US Government Security clearance or the ability to obtain one.

What we would like you to have: A deep interest in data and machine learning A Master’s degree in Computer Science or Mathematics Experience with Python
 5+ years experience with Machine Learning tools and techniques Familiarity with the cyber security domain A desire to solve problems whose solutions aren’t on Stack Overflow

A few of the reasons to work for us:
You can grow with us: Our flexible and collaborative environment encourages our people to challenge themselves and feed their need to learn and grow. We offer $10k towards Professional Development and Education, and Brown Bag sessions covering a wide variety of topics.
You can retire sooner rather than later: We match up to 8% of your 401k contributions which you are vested in 100% day one.
Work - life balance is real: In addition to the ability to work flexible hours, you’ll get up to 7 weeks of PTO which is based upon your total years’ experience. For every year you’re with HII-TSD (formerly G2, Inc.) you’ll enjoy an additional day of PTO.
Not quite ready to apply? TAKE THE NEXT STEP and GET CONNECTED or reach out to us at Recruiting@g2-inc.com to take a less formal approach.
We are an equal opportunity employer and all qualified applicants will receive consideration for employment without regard to race, color, religion, sex, national origin, disability status, protected veteran status, or any other characteristic protected by law.
If you are seeking reasonable accommodation as it relates to the employment process, please contact the recruiting department at (410) 290-9710 or recruiting@g2-inc.com"
