,Title,Location,City,State,Zip,Country,Qualifications,Skills,Responsibilities,Education,Requirement,FullDescriptions
8,Principal Machine Learning Engineer,"Boston, MA",Boston,MA,None Found,None Found,None Found,None Found,None Found,None Found,None Found,"As a Principle Machine Learning Engineer at Integral you will design and scale solutions to cutting edge analytical problems that arise from an extremely diverse set of biotech data - including computational chemistry, computational biology, medical records, quantitative finance, text/social, video/image analysis, mobile/digital patient engagement, and others. Successful candidates must be committed to working with a diverse set of scientists, entrepreneurs, and domain experts in ways that cut across traditional industry boundaries in a fast-paced startup environment.

Successful candidates are expected to be well-versed in good software engineering methodologies and committed to working with a diverse set of scientists, entrepreneurs, and domain experts in ways that cut across traditional industry boundaries in a fast-paced startup environment.

You'll do…


Work with data scientists, researchers, product teams, and other domain experts to build highly scalable engineering solutions to complex data-oriented problems. 
Design, develop, test, maintain, and improve an integrated codebase of advanced engineering products. 

You Bring…


BS or MS in Computer Science or related technical field 
Extensive software engineering experience across multiple languages such as Python, Java, C/C++, R, Scala 
Extensive experience with standard statistical analysis and machine learning techniques 
Experience with popular analytical tools such as Pandas, Scikit-learn, Tensorflow, PyTorch, Jupyter, ggplot2, or SparkML 
Strong analytical, problem-solving, and communication skills 

You May Also Bring…


Ph.D. in Computer Science or related technical field
Deep knowledge of computer science concepts pertaining to algorithmic complexity and distributed/parallel computing
Experience with scalable analysis tools and platforms such as Hadoop, Spark, AWS, or GCP 
Experience with non-traditional database and knowledge representation architectures such as semantic graphs, NoSQL, etc.

About Integral

Integral Health, Inc. is a privately held, computational company with a proprietary clinical development and patient engagement platform. Integral Health was founded by Flagship Pioneering, an innovation enterprise that conceives, creates, resources, and grows first-in-category life sciences companies. Flagship Pioneering has created over 40 groundbreaking companies over the past fifteen years, all of which are pioneering novel and proprietary biological, industrial, and engineering approaches to solve major needs in human health and sustainability. These companies include Seres Therapeutics (NASDAQ: MCRB), Moderna (MRNA), Syros Pharmaceuticals (SYRS), Rubius Therapeutics (RUBY), Axcella Health, Evelo Biosciences (EVLO), and Indigo Agriculture."
9,Machine Learning Engineer,"Cambridge, MA 02142",Cambridge,MA,02142,None Found,"Undergraduate degree in Computer Science, or technical field (Physics, Math, etc.)
3-5 years designing and training models on large, complex and/or biased datasets.
3-5 years experience across deep learning frameworks like Keras, TensorFlow or PyTorch and machine learning packages (sklearn, etc.)
Fluent with data modeling, indexing, and ETL and cloud-based pipelines (substantial expertise with Redshift/BigQuery, Apache Beam, Spark or equivalent)
Fluent in Python (preferred) or Java
",None Found,None Found,None Found,None Found,"The life sciences are in the midst of a data revolution. Cheap and accurate genome sequencing is here, advanced imaging is routine, and clinical data is increasingly stored in electronic formats. These innovations — and the massive data sets they produce — have brought us to the threshold of a new era in medicine, one where the data sciences hold the potential to propel our understanding and treatment of human disease.
As a result, The Broad Institute has created a machine learning initiative to drive innovation beginning with the world's leading killer, cardiovascular disease. We are building open-source software to derive insights from massive amounts of multimodal clinical and genomic (ECGs, MRIs, EHRs) data using deep learning architectures. Our aims include more than just predictive accuracy for the onset of disease - we will use our models to uncover new biology itself that can drive new therapeutics and treatment.
The role:
You will work on a small team of machine learning scientists, engineers and cardiovascular disease experts.
You will identify the highest impact opportunities by whiteboarding solutions with the top genetic and clinical researchers in the world.
You will conduct theoretical ML research with collaborators from MIT and Harvard and implement cutting edge methods for learning representations of cardiovascular health.
You will collaborate regularly with MD/PhDs from across the life sciences to explore how to embed cardiac physiology into learning agents.
You will hunt for new ways to accelerate therapeutic development with industry collaborators.
You will deploy cloud-based software to a diverse audience of researchers across the world.
You will work with real patient genomic and clinical data to train and validate impact.
Qualifications
Undergraduate degree in Computer Science, or technical field (Physics, Math, etc.)
3-5 years designing and training models on large, complex and/or biased datasets.
3-5 years experience across deep learning frameworks like Keras, TensorFlow or PyTorch and machine learning packages (sklearn, etc.)
Fluent with data modeling, indexing, and ETL and cloud-based pipelines (substantial expertise with Redshift/BigQuery, Apache Beam, Spark or equivalent)
Fluent in Python (preferred) or Java
#LI-POST
EOE / Minorities / Females / Protected Veterans / Disabilities
EOE / Minorities / Females / Protected Veterans / Disabilities"
10,Senior Machine Learning Engineer,"Chelmsford, MA 01824",Chelmsford,MA,01824,None Found,None Found,None Found,None Found,None Found,None Found,"Brooks Automation, Inc.
At Brooks, new ideas, new technologies and new ways of thinking are driving our future. Our customer focused culture encourages employees to embrace innovation and challenge the status quo with novel thinking and collaborative work relationships.


All we accomplish is grounded in our core values of Customer Focus, Achievement, Accountability, Teamwork, Employee Value and Integrity
Job Title
Senior Machine Learning Engineer
Job Description
Responsible for applying knowledge of Machine Learning into High Value Problems for Semiconductor Automation equipment. Supports identification and formulation of High Value Problems within the company across different disciplines. Interaction with Cross Functional Teams to identify existing data sinks in support of Data Mining and Analysis. Responsible for defining company’s common framework and tools to store and maintain raw and formatted data and databases for the purpose of Machine Learning applications. Expected to interact with Product Development Management to provide directions on embedding Machine Learning into the company’s products and roadmaps.
Depending on level may function as a project leader with the resident responsibilities of proposals/project plan, schedules, work assignments, prime contact, technical presentations, cross functional issue resolution, etc. Expected to interact and make technical presentations to Senior Management and Cross Functional teams. Expected to keep up to date on technical advances in Artificial Intelligence/Machine Learning and related fields. Works toward predetermined long-range goals. Recognized as the internal authority in the discipline and related fields and is sought after as such. Applies advanced concepts and contributes to advancing company products and processes to achieve organizational objectives in a creative and effective manner. Is assigned to the highest level of unique and complex problems due to the extensive knowledge of advanced principles and techniques in the area of Artificial Intelligence/Machine Learning. Has significant latitude in the choice of methods, procedures and evaluation criteria to resolve technical and business issues along with implementation of recommendations. Erroneous decisions would normally result in a failure to reach goals crucial to organizational objectives.
Required Skills:
PhD degree preferred with 5+ year's industry experience in Artificial Intelligence/Machine Learning Data Mining, Data Base Frameworks and Tools (such as AWS, Azure), Training Algorithms and Machine Learning Development Tools (Tensor Flow, Amazon Sagemaker, Scikit-Learn).
Expertise in utilization of Artificial Intelligence/Machine Learning in Industrial Automation for Adaptive Motion Control, Intelligent Fault Diagnostics and Predictive Maintenance.
Proficient in Programming languages such as Python, C, C++ and C#.
Ability to research patents and archival journals in multi-disciplinary fields and generate Intellectual Property aligned with company’s roadmaps. Proven record of archival journal publications, technical conferences and utility patents in areas associated with the job description and required skills.
Ability to effectively plan, lead and collaborate with a cross functional team including Product Engineering, Quality, Manufacturing Engineering, Reliability Engineering, Marketing and Senior Management.
Excellent communication and organization skills, team player, open minded, willing to mentor others.
If any applicant is unable to complete an application or respond to a job opening because of a disability, please email at HR.Recruiting@brooks.com for assistance.
Brooks Automation is an Equal Opportunity Employer. This company considers candidates regardless of race, color, age, religion, gender, sexual orientation, gender identity, national origin, disability or veteran status."
11,"GAMMA - Associate Director, Machine Learning Engineering","Boston, MA 02109",Boston,MA,02109,None Found, Bachelor’s degree in computer science (or in a highly related area),None Found,None Found,None Found,None Found,"Location:
Boston, Chicago, Los Angeles, New York, San Francisco, Seattle, Toronto, Washington, D.C.
Geography:
North America
Capabilities:
Big data & advanced analytics, Technology & digital
Industries:
Technology industries
About Us
Boston Consulting Group (BCG) is a global management consulting firm and the world’s leading advisor on business strategy. We partner with clients from the private, public, and not-for-profit sectors in all regions to identify their highest-value opportunities, address their most critical challenges, and transform their enterprises. Our customized approach combines deep insight into the dynamics of companies and markets with close collaboration at all levels of the client organization. This ensures that our clients achieve sustainable competitive advantage, build more capable organizations, and secure lasting results. Founded in 1963, BCG is a private company with more than 90 offices in 50 countries. For more information, please visit bcg.com
Practice Area Profile
BCG GAMMA combines innovative skills in computer science, artificial intelligence, statistics, and machine learning with deep industry expertise. The BCG GAMMA team is comprised of world-class data scientists and business consultants who specialize in the use of advanced analytics to get breakthrough business results. Our teams own the full analytics value-chain end to end: framing new business challenges, building fact-bases, designing innovative algorithms, creating scale through designing tools and apps, and training colleagues and clients in new solutions. Here at BCG GAMMA, you’ll have the chance to work with clients in every BCG region and every industry area. We are also a core member of a rapidly growing analytics enterprise at BCG - a constellation of teams focused on driving practical results for BCG clients by applying leading edge analytics approaches, data, and technology.
Role Profile
OVERVIEW OF GAMMA X:

The Gamma Engineering team is building the next generation of analytics tools. With your help, Gamma Engineering will develop a platform that fuels BCG Gamma‘s global data and analytics offerings. Data scientists depend on easy to use interfaces to easily code, increase productivity, answer questions, and envision their results. Clients need to easily interact with our analytics applications to measure the success of their new analytics enabled organization or quickly make decisions based on what and how they see analytic output. Our clients will use our analytics solutions to derive insights around business trends. We “open the doors“ to data for our clients giving them fast and trusted options to search, frame, and share data. Gamma Engineering‘s goal is to help our clients understand what their data means and provide them the tools to share its narrative with various audiences.

POSITION SUMMARY:

BCG Gamma is seeking an Associate Director Machine Learning Engineer to join our engineering team. The ideal candidate will have industry experience working on a range of different machine learning disciplines, e.g. anomaly detection, payment fraud, fraud detection, search ranking, text/sentiment classification, spam detection and others. The position will involve taking these skills and applying them to some of the most exciting and massive data and analytics problems across multiple industries. We are looking for machine learning engineers to join the ML effort building ML-based systems, tools, and services that serve as infrastructure for our internal and external clients.
As a strong software leader and an expert in building complex systems, you will be responsible for inventing how we use technology, machine learning, and data to enable the productivity of our clients. You will help envision, build, deploy and develop our next generation of data engines and tools which will help our clients fundamentally transform their business.
You will be bridging the gap between business and engineering, and functioning with deep expertise in both worlds.


BASIC JOB RESPONSIBILITIES:

We are looking for an Associate Director Machine Learning Engineer who can bring bleeding edge machine learning models into production together with a highly multi-disciplinary team of scientist, engineers, partners, product managers and subject domain experts.
Your Qualifications
 Bachelor’s degree in computer science (or in a highly related area)
 9+ years of experience in algorithms, data structures, and object-oriented programming
 Previous consulting experience and/or strong leadership positions
 Good understanding of machine learning fundamentals and deep learning
 Implementation experience in machine learning algorithms and applications
 Management/team lead experience, experience working with global and remote teams
 Experience guiding teams in addressing the technical and delivery challenges
 Excellent communication skills

TECHNOLOGIES: Strong programming skills in at least one object oriented programming language (Java, Scala, C++, Python, etc.)
 Strong skills in parallel processing technologies and languages: Hadoop, Spark, Scala etc.
 Experience with Python applied to machine learning (Pandas, Scikit-learn, Scipy, Numpy etc.)
 Strong knowledge of machine learning techniques required (KNN, random forest, Bayesian statistics etc.)
 Strong knowledge of machine learning techniques preferred (TensorFlow, Keras, PyTorch, Caffe, MxNet)
 Cloud: AWS/GCP/Azure
 DevOps: Kubernetes, Docker, CI/CD
 Building REST API
 Knowledge of relational database management: SQL, PostgreSQL, Microsoft SQL etc.
 Knowledge of NoSQL databases (MongoDB, Neo4j, Redis etc.)
 Unix-based command line & development tools


WORK ENVIRONMENT: Fast-paced, intellectually intense, service-oriented environment Optimal locations are New York, Washington DC, Boston, Chicago, Seattle, Toronto, Montreal, San Francisco Expect time spent traveling

Date Posted:
21-Sep-2018
Boston Consulting Group is an Equal Opportunity Employer. All qualified applicants will receive consideration for employment without regard to race, color, age, religion, sex, sexual orientation, gender identity / expression, national origin, disability, protected veteran status, or any other characteristic protected under national, provincial, or local law, where applicable, and those with criminal histories will be considered in a manner consistent with applicable state and local laws.

BCG is an E-Verify Employer."
12,GAMMA - Senior Machine Learning Engineer,"Boston, MA 02109",Boston,MA,02109,None Found," 5 to 8 years of experience in algorithms, data structures, and object-oriented programming Good understanding of machine learning fundamentals and deep learning Implementation experience in machine learning algorithms and applications Strong programming skills in at least one object oriented programming language (Java, Scala, C++, Python, etc.) Fluency with at least one of the modern distributed ML frameworks such as TensorFlow, PyTorch,Caffe, MxNet Eager to learn new algorithms, new application areas and new tools. Excellent communication skills",None Found,None Found,None Found,None Found,"Location:
Boston, Chicago, Los Angeles, Montreal, New York, San Francisco, Seattle, Toronto, Washington, D.C.
Geography:
North America
Capabilities:
Big data & advanced analytics, Technology & digital
Industries:
Technology industries
About Us
Boston Consulting Group (BCG) is a global management consulting firm and the world’s leading advisor on business strategy. We partner with clients from the private, public, and not-for-profit sectors in all regions to identify their highest-value opportunities, address their most critical challenges, and transform their enterprises. Our customized approach combines deep insight into the dynamics of companies and markets with close collaboration at all levels of the client organization. This ensures that our clients achieve sustainable competitive advantage, build more capable organizations, and secure lasting results. Founded in 1963, BCG is a private company with more than 90 offices in 50 countries. For more information, please visit bcg.com
Practice Area Profile
BCG GAMMA combines innovative skills in computer science, artificial intelligence, statistics, and machine learning with deep industry expertise. The BCG GAMMA team is comprised of world-class data scientists and business consultants who specialize in the use of advanced analytics to get breakthrough business results. Our teams own the full analytics value-chain end to end: framing new business challenges, building fact-bases, designing innovative algorithms, creating scale through designing tools and apps, and training colleagues and clients in new solutions. Here at BCG GAMMA, you’ll have the chance to work with clients in every BCG region and every industry area. We are also a core member of a rapidly growing analytics enterprise at BCG - a constellation of teams focused on driving practical results for BCG clients by applying leading edge analytics approaches, data, and technology.
Role Profile
OVERVIEW OF BCG GAMMA ENGINEERING:
The BCG GAMMA Engineering team is building the next generation of analytics tools. With your help, BCG GAMMA will develop a platform that fuels BCG GAMMA‘s global data and analytics offerings. Data scientists depend on easy to use interfaces to easily code, increase productivity, answer questions, and envision their results. Clients need to easily interact with our analytics applications to measure the success of their new analytics enabled organization or quickly make decisions based on what and how they see analytic output. Our clients will use our analytics solutions to derive insights around business trends. We “open the doors“ to data for our clients giving them fast and trusted options to search, frame, and share data. BCG GAMMA X‘s goal is to help our clients understand what their data means and provide them the tools to share its narrative with various audiences.

POSITION SUMMARY:
BCG GAMMA is seeking a Senior Machine Learning Engineer to join our BCG GAMMA Engineering team. The ideal candidate will have industry experience working on a range of different Machine Learning disciplines, e.g. Anomaly Detection, payment fraud, fraud detection, search ranking, text/sentiment classification, spam detection and others. The position will involve taking these skills and applying them to some of the most exciting and massive data and analytics problems across multiple industries. We are looking for machine learning engineers to join the ML effort for our teams, building ML-based systems, tools, and services that serve as infrastructure for our internal and external clients.

As a strong software leader and an expert in building complex systems, you will be responsible for inventing how we use technology, Machine Learning, and Data to enable the productivity of our clients. You will help envision, build, deploy and develop our next generation of data engines and tools which will help our clients fundamentally transform their business. You will be bridging the gap between business and engineering, and functioning with deep expertise in both worlds.

BASIC JOB RESPONSIBILITIES:
We are looking for a Machine Learning Engineer who can bring bleeding edge machine learning models into production together with a highly multi-disciplinary team of scientist, engineers, strategic partners, product managers and subject domain experts.

Your Qualifications
Degree in computer science (or in a highly related area) or equivalent experience 5 to 8 years of experience in algorithms, data structures, and object-oriented programming Good understanding of machine learning fundamentals and deep learning Implementation experience in machine learning algorithms and applications Strong programming skills in at least one object oriented programming language (Java, Scala, C++, Python, etc.) Fluency with at least one of the modern distributed ML frameworks such as TensorFlow, PyTorch,Caffe, MxNet Eager to learn new algorithms, new application areas and new tools. Excellent communication skills

STRONGLY PREFERRED MSc or PHD in Computer Science (or in a highly related area) Knowledge of or experience in building production quality and large scale deployment of applications related to natural language processing and machine learning Familiarity with AWS/GCP/Azure technology stack Experience working with global and remote teams

WORK ENVIRONMENT:Fast-paced, intellectually intense, service-oriented environmentOptimal locations are New York, Washington DC, Boston, Chicago, Seattle, Toronto, San FranciscoExpect up to 40% - 75% of time spent traveling

Date Posted:
19-Sep-2018
Boston Consulting Group is an Equal Opportunity Employer. All qualified applicants will receive consideration for employment without regard to race, color, age, religion, sex, sexual orientation, gender identity / expression, national origin, disability, protected veteran status, or any other characteristic protected under national, provincial, or local law, where applicable, and those with criminal histories will be considered in a manner consistent with applicable state and local laws.

BCG is an E-Verify Employer."
