,Title,Location,City,State,Zip,Country,Qualifications,Skills,Responsibilities,Education,Requirement,FullDescriptions
0,Machine Learning Engineer,"Vienna, VA",Vienna,VA,None Found,None Found,"
Bachelor’s Degree
At least 2 years of open source Machine Learning algorithm development experience in Python and AWS
At least 2 years of Regression analysis, Non-parametric, Bayesian Statistics, or Applied Probabilities
At least 2 years of hands on experience with Redshift tables and PostgreSQL tables
At least 2 years of experience in Continuous Integration/Continuous Development, Test Automation, Build Automation, and Test-Driven Development.
At least 2 years of deployment in AWS Cloud computing environments
",None Found,"
End-to-end/full stack software solutions development and deployment of our Machine Learning (ML) and Artificial Intelligence (AI) algorithms.
Write, design, code, test, implement, debug, and validate applications; document design decisions and develop modular software components; monitor system performance metrics, and identify potential risks/issues.
Lead multiple software development initiatives at any given time, serving as an expert for the escalation of complex application design and development issues.
Provide active mentorship/guidance to junior members of the Agile Tech team and participate in internal and external technology communities.
Work with product owners to understand desired application capabilities and testing scenarios, and define, establish, and execute against strategic technical management and business delivery roadmaps, actively managing data risks, issues, and impediments.
Present project metrics, complex ML and AI concepts to both technical and non-technical audiences.
",None Found,None Found,"Towers Crescent (12066), United States of America, Vienna, Virginia

At Capital One, we’re building a leading information-based technology company. Still founder-led by Chairman and Chief Executive Officer Richard Fairbank, Capital One is on a mission to help our customers succeed by bringing ingenuity, simplicity, and humanity to banking. We measure our efforts by the success our customers enjoy and the advocacy they exhibit. We are succeeding because they are succeeding.

Guided by our shared values, we thrive in an environment where collaboration and openness are valued. We believe that innovation is powered by perspective and that teamwork and respect for each other lead to superior results. We elevate each other and obsess about doing the right thing. Our associates serve with humility and a deep respect for their responsibility in helping our customers achieve their goals and realize their dreams. Together, we are on a quest to change banking for good.

Machine Learning Engineer

Responsibilities:

End-to-end/full stack software solutions development and deployment of our Machine Learning (ML) and Artificial Intelligence (AI) algorithms.
Write, design, code, test, implement, debug, and validate applications; document design decisions and develop modular software components; monitor system performance metrics, and identify potential risks/issues.
Lead multiple software development initiatives at any given time, serving as an expert for the escalation of complex application design and development issues.
Provide active mentorship/guidance to junior members of the Agile Tech team and participate in internal and external technology communities.
Work with product owners to understand desired application capabilities and testing scenarios, and define, establish, and execute against strategic technical management and business delivery roadmaps, actively managing data risks, issues, and impediments.
Present project metrics, complex ML and AI concepts to both technical and non-technical audiences.

Basic Qualifications:

Bachelor’s Degree
At least 2 years of open source Machine Learning algorithm development experience in Python and AWS
At least 2 years of Regression analysis, Non-parametric, Bayesian Statistics, or Applied Probabilities
At least 2 years of hands on experience with Redshift tables and PostgreSQL tables
At least 2 years of experience in Continuous Integration/Continuous Development, Test Automation, Build Automation, and Test-Driven Development.
At least 2 years of deployment in AWS Cloud computing environments

Preferred Qualifications:

Ph.D. in Computer Science, Engineering, Information Systems, Physics or Mathematics discipline
4+ years of experience in software development using Python, Scala, Java, RESTful API, Apache, Spark, Kafka and Microservices
4+ years of experience with the full AWS stack and distributed Big Data technologies such as: Hadoop, Python, Hive or Cloudera
Experience in Scala, R, Java, Perl, JavaScript, or Shell
Experience with Tensorflow

At this time, Capital One will not sponsor a new applicant for employment authorization for this position."
1,Data Scientist/Machine Learning Engineer,"Washington, DC 20005",Washington,DC,20005,None Found,"
7+ years of experience with analytics, big data, data science, machine learning, or artificial intelligence serving in technical delivery roles, including as a data scientist, developer, architect, engineer, mathematician, statistician, or machine learning specialist
5+ years of experience with leading or managing delivery teams, projects, development efforts, research efforts, or similar
3+ years of experience with programming, including in machine learning frameworks, such as TensorFlow, Keras, PyTorch, Caffe, and MXNET
3+ years of experience with business development, client or customer relationship management, proposal development, or similar, including grant application
Experience with traditional and Agile framework project management approaches and constructs
Experience with developing effective delivery or research teams, including recruiting, hiring, mentoring, coaching, and managing team members
Experience with authoring white papers, peer-reviewed articles, or other relevant technical content
Ability to effectively communicate results to both technical and non-technical audiences, including presenting to senior executives, industry conferences, technical seminars, meet-ups, or similar
BA or BS degree in Statistics, Machine Learning, Mathematics, CS, Computer Engineering, Industrial Engineering, or Operations Research
Ability to work in the US indefinitely without sponsorship
Ability to obtain a US security clearance if needed",None Found,"
7+ years of experience with analytics, big data, data science, machine learning, or artificial intelligence serving in technical delivery roles, including as a data scientist, developer, architect, engineer, mathematician, statistician, or machine learning specialist
5+ years of experience with leading or managing delivery teams, projects, development efforts, research efforts, or similar
3+ years of experience with programming, including in machine learning frameworks, such as TensorFlow, Keras, PyTorch, Caffe, and MXNET
3+ years of experience with business development, client or customer relationship management, proposal development, or similar, including grant application
Experience with traditional and Agile framework project management approaches and constructs
Experience with developing effective delivery or research teams, including recruiting, hiring, mentoring, coaching, and managing team members
Experience with authoring white papers, peer-reviewed articles, or other relevant technical content
Ability to effectively communicate results to both technical and non-technical audiences, including presenting to senior executives, industry conferences, technical seminars, meet-ups, or similar
BA or BS degree in Statistics, Machine Learning, Mathematics, CS, Computer Engineering, Industrial Engineering, or Operations Research
Ability to work in the US indefinitely without sponsorship
Ability to obtain a US security clearance if needed",None Found,None Found,"Atlas Research is looking for a Data Scientist/Machine Learning Engineer to support federal clients.
Essential Duties and Responsibilities:
Analyze large amounts of data collected from diverse sources, such as social media, images, video, and sensor feeds, extracting patterns and drawing relationships across them. Leverage your experience and skills as a data scientist, machine learning engineer, and artificial intelligence specialist to understand the complex relationships between the business needs, the data, and modeling approaches.
Develop and apply the latest innovations in machine learning, artificial intelligence, and related technologies. Lead and support research and development efforts to explore the applicability of emerging machine learning and artificial intelligence methods to address client challenges and identify and prioritize emerging methods and challenges for original research or proof of concepts. Lead and support efforts to identify, shape, capture, and deliver data science, machine learning, and artificial intelligence contracts for clients. Shape external client strategies, technology roadmaps, implementation plans, and research initiatives to integrate data science, machine learning, and artificial intelligence in support of client missions. Help identify, recruit, lead, and develop a world-class team of data scientists, data engineers, machine learning engineers, and artificial intelligence specialists.

Minimum Qualifications
7+ years of experience with analytics, big data, data science, machine learning, or artificial intelligence serving in technical delivery roles, including as a data scientist, developer, architect, engineer, mathematician, statistician, or machine learning specialist
5+ years of experience with leading or managing delivery teams, projects, development efforts, research efforts, or similar
3+ years of experience with programming, including in machine learning frameworks, such as TensorFlow, Keras, PyTorch, Caffe, and MXNET
3+ years of experience with business development, client or customer relationship management, proposal development, or similar, including grant application
Experience with traditional and Agile framework project management approaches and constructs
Experience with developing effective delivery or research teams, including recruiting, hiring, mentoring, coaching, and managing team members
Experience with authoring white papers, peer-reviewed articles, or other relevant technical content
Ability to effectively communicate results to both technical and non-technical audiences, including presenting to senior executives, industry conferences, technical seminars, meet-ups, or similar
BA or BS degree in Statistics, Machine Learning, Mathematics, CS, Computer Engineering, Industrial Engineering, or Operations Research
Ability to work in the US indefinitely without sponsorship
Ability to obtain a US security clearance if needed
Preferred Qualifications
Experience with machine learning techniques and their application, including deep learning, such as CNN, RNN, or transfer learning, NLP, gradient-boosted trees, Neural Machine Translation (NMT), and reinforcement learning
Ability to provide a public Github repository, Blog, or Kaggle account showcasing machine learning models developed
MS degree in Science, Engineering, Mathematics, or related field preferred; PhD degree a plus"
2,Machine Learning Engineer,"Alexandria, VA",Alexandria,VA,None Found,None Found,None Found,None Found,None Found,None Found,None Found,"RII develops cutting-edge software for the government and military. We use agile development practices and user-centered design to create innovative software solutions for complex real-world problems. We're breaking through the big, slow status quo with transformative technology that fundamentally changes and improves the world.

Our team is currently seeking high-quality contributors for a variety of positions in the Northern Virginia area. Our projects include developing complex, web client server applications; developing mobile device applications and prototypes; developing Big Data and machine learning solutions; architecting and prototyping complex distributed command and control network applications.

If you are a sharp, experienced engineer with demonstrated capabilities in implementing machine learning and analytical solutions on Big Data stacks we want to hear from you. Joining RII not only provides unique challenges and opportunities, it also directly and positively impacts many of our Defense and Homeland Security end users.
WHAT YOU WILL BE DOING
Identify, develop, and evaluate machine learning capabilities for deployment on our best-of-breed Big Data tech stack in support of multiple customer projects
Maintain awareness of current and emerging capabilities in machine learning and analytical technologies and how these apply to solving our customers’ challenges
Develop captivating solutions by collaborating with customers and development team
Document use cases, solutions, & recommendations to customers
WHAT YOU HAVE DONE
BS in Computer Science, or equivalent degree or work experience
Experience designing, developing, training, tuning, and deploying learning models in current ML frameworks (e.g., Tensorflow, PyTorch, Theano, Caffe, Spark MLib, etc.)
Strong software development in Python or Java
Experience performing exploratory analysis – cleaning, joining, enriching, statistical modeling, and prototyping visualizations to identify latent trends and patterns
Experience curating training and analysis datasets – cleaning, enriching, joining, annotating, and crowdsourcing data for creating and evaluating production models
Understanding in Linux operating systems, distributed systems, and databases (NoSQL and relational)
Excellent understanding of ETL and data analytics platforms
 Experience understanding and decomposing system level requirements into discrete and measurable tasks
EVEN BETTER
MS or PhD in Computer Science or equivalent degree or work experience
Experience designing, developing, and deploying analytics in streaming and cross-corpus frameworks like Spring Cloud, Kafka, Spark, MapReduce, and/or other related BigTable technologies
Experience with Agile Methodologies
Experience with natural language processing techniques and technologies
Strong knowledge of the installation, configuration, and maintenance cloud computing and Big Data infrastructure to include Hadoop, Accumulo, Kafka, Spark, Elasticsearch, Puppet, Ansible, Lucene, and related technologies
Experience with continuous integration and continuous deployment using Atlassian products
Experience with Atlassian products
Extensive experience with model transfer techniques and methodologies
Experience applying machine learning techniques to sparse data sets
Knowledge of cloud computing infrastructure such as: Amazon Web Services EC2 & Elastic
Experience creating Big Data solutions using public, private, and hybrid cloud approaches
Experience with integration methodologies and tools for Big Data applications and services
Experience with data quality and data profiling tools
Active clearance not required to apply.
US Citizenship required. Candidates must be clearable to Secret, desired TS/SCI.

Research Innovations, Inc. is an equal opportunity employer and all qualified applicants will receive consideration for employment without regard to race, color, religion, sex, national, origin, disability status, protected veteran status, or any other characteristic protected by law."
3,Machine Learning Engineer,"Fort Meade, MD",Fort Meade,MD,None Found,None Found,None Found,None Found,None Found,None Found,None Found,"The Challenge:
Are you excited at the prospect of unlocking the secrets held by a data set with algorithms you create? Are you fascinated by the possibilities presented by the IoT, machine learning, and artificial intelligence advances? In an increasingly connected world, massive amounts of structured and unstructured data open up new opportunities. As a data scientist, you can turn these complex data sets into useful information to solve global challenges. Across private and public sectors — from fraud detection, to cancer research, to national intelligence — you know the answers are in the data.
We have an opportunity for you to use your analytical skills to improve national security. You’ll work closely with your customer to understand their questions and needs, and then dig into their data-rich environment to find the pieces of their information puzzle. You’ll develop algorithms, write scripts, build predictive analytics, use automation, apply machine learning, and use the right combination of tools and frameworks to turn that set of disparate data points into objective answers to help senior leadership make informed decisions. You’ll provide your customer with a deep understanding of their data, what it all means, and how they can use it.
Join us as we use data science for national security.
Empower change with us.
Build Your Career:
At Booz Allen, we know the power of analytics and we’re dedicated to helping you grow as a data analysis professional. When you join Booz Allen, you can expect:
access to online and onsite training in data analysis and presentation methodologies, and tools like Hortonworks, Docker, Tableau, and Splunk
a chance to change the world with the Data Science Bowl—the world’s premier data science for social good competition
participation in partnerships with data science leaders, like our partnership with NVIDIA to deliver Deep Learning Institute (DLI) training to the federal government
You’ll have access to a wealth of training resources through our Analytics University, an online learning portal specifically geared towards data science and analytics skills, where you can access more than 5000 functional and technical courses, certifications, and books. Build your technical skills through hands-on training on the latest tools and state-of-the-art tech from our in-house experts. Pursuing certifications? Take advantage of our tuition assistance, on-site bootcamps, certification training, academic programs, vendor relationships, and a network of professionals who can give you helpful tips. We’ll help you develop the career you want, as you chart your own course for success
You Have:Experience as an R, Python, or Java developerExperience with designing novel analytic methods and workflowsExperience with merging disparate data sources for varying data structures of contentExperience with feature generation and feature augmentation, pulling data from unstructured formatsAbility to manage and manipulate large data sets, develop data science approaches, and manage data science tasksAbility to leverage a wide variety of data science capabilities and languagesTS/SCI clearance with a polygraphBS degree in Mathematics, Physics, or Engineering

Nice if You Have:
Experience with machine learning algorithm developmentExperience with building classification modeling schemes based upon time-based data and multivariate time series analysisExperience with statistical signal processing and sensor data fusionExperience in working with big data storage and processing techniques, including HDFS, Hive, Accumulo and Hadoop, or SparkAbility to work with activity recognition and classificationMA or MS degree
Clearance:
Applicants selected will be subject to a security investigation and may need to meet eligibility requirements for access to classified information; TS/SCI clearance with polygraph is required.
We’re an EOE that empowers our people—no matter their race, color, religion, sex, gender identity, sexual orientation, national origin, disability, veteran status, or other protected characteristic—to fearlessly drive change.
CMD"
4,Gultionar Intelligence* - Machine Learning Engineer,"Fort Meade, MD",Fort Meade,MD,None Found,None Found,None Found,None Found,None Found,None Found,None Found,"Title generated by a neural net trained on relevant job listings and then asked to perform poorly.
What you will be working on:
Come be a part of a team applying cutting edge Machine Learning to the cybersecurity domain! We will use state of the art ML techniques (Neural Nets, Gradient Boosting, etc.) to model behaviors, detect anomalies, cluster data, and ultimately create actionable information.
You will: Build and improve ML models for a number of different problem sets Collect and preprocess data for training and validation Use TensorFlow, Keras, XGBoost, scikit-learn, and other ML tools Help other engineers deploy ML models on dynamic compute platforms Read current research and contribute to the team’s collective knowledge Mentor junior team members Work at our headquarters in Annapolis Junction, MD and/or the surrounding area.
What you need: A Bachelor’s degree in Computer Science or Mathematics 5+ years experience in Software Engineering or Machine Learning US Government Security clearance or the ability to obtain one.

What we would like you to have: A deep interest in data and machine learning A Master’s degree in Computer Science or Mathematics Experience with Python
 Experience with Machine Learning tools and techniques Familiarity with the cyber security domain A desire to solve problems whose solutions aren’t on Stack Overflow

A few reasons to work for us:
You can grow with us: Our flexible and collaborative environment encourages our people to challenge themselves and feed their need to learn and grow. We offer $10k towards Professional Development and Education, and Brown Bag sessions covering a wide variety of topics.
You can retire sooner rather than later: We match up to 8% of your 401k contributions which you are vested in 100% day one.
Work - life balance is real: In addition to the ability to work flexible hours, you’ll get up to 7 weeks of PTO which is based upon your total years’ experience. For every year you’re with HII-TSD (formerly G2, Inc), you’ll enjoy an additional day of PTO.
Not quite ready to apply? TAKE THE NEXT STEP and GET CONNECTED or reach out to us at Recruiting@g2-inc.com to take a less formal approach.
We are an equal opportunity employer and all qualified applicants will receive consideration for employment without regard to race, color, religion, sex, national origin, disability status, protected veteran status, or any other characteristic protected by law.
If you are seeking reasonable accommodation as it relates to the employment process, please contact the recruiting department at (410) 290-9710 or recruiting@g2-inc.com"
