,Title,Location,City,State,Zip,Country,Qualifications,Skills,Responsibilities,Education,Requirement,FullDescriptions
25,Machine Learning Engineer,"Boston, MA 02210",Boston,MA,02210,None Found,"5+ years' experience working on data science projects
Master's degree or higher, preferably, with a concentration in a computational field such as Computer Science, Mathematics, Statistics, Physics, Engineering
Hands-on experience with mining of structured, semi-structured, and unstructured data
Intuitive understanding of machine learning algorithms, supervised and unsupervised modeling techniques
Experience with Apache Hadoop, Spark and related technologies
Working knowledge of SQL, Hive, Pig, and other query languages
Experience with machine learning tools and libraries such as Scikit-learn, R, Spark, TensorFlow
Intuition about algorithm and system performance and throughput
Experience ranking entities or attributes a plus
Architecture and system/pipeline layout experience a plus
Scala language experience a plus
Attention to detail, data accuracy, and quality of output
Strong interpersonal, written, and verbal communication skills
Ability to effectively function in a fast-paced environment with shifting priorities and simultaneous projects
","5+ years' experience working on data science projects
Master's degree or higher, preferably, with a concentration in a computational field such as Computer Science, Mathematics, Statistics, Physics, Engineering
Hands-on experience with mining of structured, semi-structured, and unstructured data
Intuitive understanding of machine learning algorithms, supervised and unsupervised modeling techniques
Experience with Apache Hadoop, Spark and related technologies
Working knowledge of SQL, Hive, Pig, and other query languages
Experience with machine learning tools and libraries such as Scikit-learn, R, Spark, TensorFlow
Intuition about algorithm and system performance and throughput
Experience ranking entities or attributes a plus
Architecture and system/pipeline layout experience a plus
Scala language experience a plus
Attention to detail, data accuracy, and quality of output
Strong interpersonal, written, and verbal communication skills
Ability to effectively function in a fast-paced environment with shifting priorities and simultaneous projects
","Build, deploy and automate large-scale machine learning algorithms (classification, regression, recommender systems) using Apache Spark and/or other big data technologies.
Automate the production of necessary reports and analyses for customers.
Develop programs and processes to access and transform large volumes of data from internal and external systems in a manner suitable for analysis.
Research new data sources, analytical tools, and methodologies; contribute to new product development, operational delivery.
Perform complex data analysis in support of ad-hoc and standing requests and demand for insights
Provide documentation for solutions by developing well documented code, uml diagrams, and well structured code.
Follow good object oriented design practices and SOLID design principles.
Continual improvement of your skills in programming languages, designs patterns, and relevant tools through personal studies as well as efficient research during work hours.
",None Found,None Found,"Company Overview
Data Plus Math is a media measurement company that helps connect advertising exposures to real-world outcomes. Powered by millions of households of cross-screen viewing data, the company's TV and Video attribution platform is used by cable operators, national programming networks, agencies and marketers to measure which components of their advertising campaigns are driving results. We work with some of the largest media and entertainment companies, agencies and brands in the world to power the next generation of analytics and measurement for all of TV and Video.
Job Summary
We are looking for a savvy Machine Learning Engineer to join our world class team of Data Scientists and Big Data Engineers. Join the team charged with aggregating, processing, filtering and conflating data from many sources and multiple modalities and delivering a unified, rich, and timely TV and Video attribution data to Data+Math's platform. We're looking for an experienced scientist/engineer who is expected to take projects from initial data mining and research through all stages of prototyping, development and final integration and into the production data accessed by our customers.
Responsibilities and Duties
Build, deploy and automate large-scale machine learning algorithms (classification, regression, recommender systems) using Apache Spark and/or other big data technologies.
Automate the production of necessary reports and analyses for customers.
Develop programs and processes to access and transform large volumes of data from internal and external systems in a manner suitable for analysis.
Research new data sources, analytical tools, and methodologies; contribute to new product development, operational delivery.
Perform complex data analysis in support of ad-hoc and standing requests and demand for insights
Provide documentation for solutions by developing well documented code, uml diagrams, and well structured code.
Follow good object oriented design practices and SOLID design principles.
Continual improvement of your skills in programming languages, designs patterns, and relevant tools through personal studies as well as efficient research during work hours.
Qualifications and Skills
5+ years' experience working on data science projects
Master's degree or higher, preferably, with a concentration in a computational field such as Computer Science, Mathematics, Statistics, Physics, Engineering
Hands-on experience with mining of structured, semi-structured, and unstructured data
Intuitive understanding of machine learning algorithms, supervised and unsupervised modeling techniques
Experience with Apache Hadoop, Spark and related technologies
Working knowledge of SQL, Hive, Pig, and other query languages
Experience with machine learning tools and libraries such as Scikit-learn, R, Spark, TensorFlow
Intuition about algorithm and system performance and throughput
Experience ranking entities or attributes a plus
Architecture and system/pipeline layout experience a plus
Scala language experience a plus
Attention to detail, data accuracy, and quality of output
Strong interpersonal, written, and verbal communication skills
Ability to effectively function in a fast-paced environment with shifting priorities and simultaneous projects
Traits
A desire to solve business problems with technology.
Great communication skills, and the ability to influence stakeholders.
Strong interpersonal skills and exceptional character
Interest, willingness and demonstrated ability to quickly pick up new technology quickly
A self-starter who brings energy, passion, and creativity to work every day
oMJR1TwHxx"
26,Machine Learning Engineer,"Boston, MA 02114",Boston,MA,02114,None Found,"M.S. computer science, physics, engineering or related field",None Found,None Found,None Found,None Found,"About Us:

As a not-for-profit organization, Partners HealthCare is committed to supporting patient care, research, teaching, and service to the community by leading innovation across our system. Founded by Brigham and Women’s Hospital and Massachusetts General Hospital, Partners HealthCare supports a complete continuum of care including community and specialty hospitals, a managed care organization, a physician network, community health centers, home care and other health-related entities. Several of our hospitals are teaching affiliates of Harvard Medical School, and our system is a national leader in biomedical research.

We’re focused on a people-first culture for our system’s patients and our professional family. That’s why we provide our employees with more ways to achieve their potential. Partners HealthCare is committed to aligning our employees’ personal aspirations with projects that match their capabilities and creating a culture that empowers our managers to become trusted mentors. We support each member of our team to own their personal development—and we recognize success at every step.

Our employees use the Partners HealthCare values to govern decisions, actions and behaviors. These values guide how we get our work done: Patients, Affordability, Accountability & Service Commitment, Decisiveness, Innovation & Thoughtful Risk; and how we treat each other: Diversity & Inclusion, Integrity & Respect, Learning, Continuous Improvement & Personal Growth, Teamwork & Collaboration.

General Summary:
The Center for Clinical Data Science (CCDS) aims to transform healthcare through cutting-edge data science, machine learning, and artificial intelligence. We combine a translational, product-focused, early-stage culture with the world-class researchers, physicians, and data/computing resources at Harvard-affiliated Massachusetts General and Brigham and Women’s Hospitals, as well as the broader Partners HealthCare System. The Center for Clinical Data Science provides the perfect environment to focus on using analytics to effect tangible advancements in medicine.

We are seeking a top-notch Machine Learning Engineer who understands how to test models for commercial release. The Engineer will be comfortable testing and debugging model performance in a healthcare setting as well as overcoming the challenges that occur in the “last mile.”

The ideal candidate will be a Machine Learning Engineer who is driven by building products that matter, with experience doing it successfully in the past, both independently as well as part of a competitive team. S/he will have demonstrated the ability to find solutions where others couldn’t, with the drive, energy and determination to pull the team forward and not quit until the impossible is possible. We’re looking for self-starters with a strong sense of urgency, comfortable working independently and sourcing input where required, and with a tolerance for operating in a fast-paced early stage environment with a high degree of ambiguity.

PRINCIPAL DUTIES AND RESPONSIBILITIES
Develop libraries to streamline the training of machine learning model developmentDesign tools and infrastructure to make model development reproducible and scalableArchitect pipelines for model testing, validation, and refinementPublish the results of their work at top-tier machine learning and clinical venuesWork with trainees (e.g. PhD students, residents, and fellows) to ensure technical quality and support of activities such as: setting up model test environments, creating ML tools, evaluating clinical utility of models, and benchmarking model performance.Use the Partners HealthCare values to govern decisions, actions and behaviors. These values guide how we get our work done: Patients, Affordability, Accountability & Service Commitment, Decisiveness, Innovation & Thoughtful Risk; and how we treat each other: Diversity & Inclusion, Integrity & Respect, Learning, Continuous Improvement & Personal Growth, Teamwork & Collaboration


Qualifications
M.S. computer science, physics, engineering or related field

SKILLS/ABILITIES/COMPETENCIES
Ability to align ML development practices with standard SW development processesStrong programming skills in PythonStrong knowledge of the DICOM standard including storage of segmented informationAbility to utilize C/C++ when performance requirements dictate it (or comfortable learning the one of the language if necessary)Ability to implement scalable, reproducible workflowsAbility to develop machine learning tools in a commercial settingStrong sense of urgency and proactivenessAbility to function effectively and independently in a fast-paced environment, organize and prioritize work independently, and meet tight deadlinesStrong analytical, planning, organization and time management skills with a high attention to detailExcellent and succinct written and oral communication skillsStrong decision making skills, with the ability to negotiate/balance decisions and priorities across functions; comfort making hard decisions with incomplete data and in a timely mannerDemonstrates strong evidence of algorithmic and structured thinking, and intuition for logic, pattern matching, what-if analysis, problem decomposition. and synthesisDemonstrates ability to organize and incorporate complex systems requirements into product features and prioritize features effectively
EEO Statement

Partners HealthCare is an Equal Opportunity Employer & by embracing diverse skills, perspectives and ideas, we choose to lead. All qualified applicants will receive consideration for employment without regard to race, color, religious creed, national origin, sex, age, gender identity, disability, sexual orientation, military service, genetic information, and/or other status protected under law.

Primary Location: MA-Boston-100 Cambridge - PHS
Work Locations: 100 Cambridge - PHS 100 Cambridge Street Boston 02114
Job: Applications/Web Development
Organization: Partners HealthCare(PHS)
Schedule: Full-time
Standard Hours: 40
Shift: Day Job
Employee Status: Regular
Recruiting Department: PHS Center for Clinical Data Science
Job Posting: Jun 18, 2019"
27,"Siri - Machine Learning Engineer (Cambridge, MA)","Cambridge, MA",Cambridge,MA,None Found,None Found,None Found,None Found,None Found,None Found,None Found,"Summary
Posted: May 15, 2019
Weekly Hours: 40
Role Number: 200060730
Want to join the team building an intelligent assistant that helps millions of people get things done? You will be part of a cross-functional team consisting of software engineers as well as machine learning scientists and will have a large impact on the Siri product. You should be creative, hard working, and ready to communicate and collaborate with multiple teams.
Key Qualifications
Experience in developing modules & libraries for workflow management systems related to Machine Learning, NLP, ASR
Familiarity with with large-scale data processing and distributed systems
Strong coding skills in Python, C/C++
Experience with CI environment (such as Jenkins, TeamCity) and artifact management solutions
Comfortable with frequent, incremental code testing and deployment
Hard working and detail oriented individual who will have a profound impact in making Siri better every single day
Description
You will be a part of a team that's responsible for a wide variety of speech-related research and development activities, including acoustic modeling, language modeling and tools development. Our speech recognition research is typically data driven and we are particularly passionate about unsupervised techniques to leverage large quantities of data. You should be passionate about building phenomenal products. Because you'll be working closely with engineers from a number of other teams at Apple, you’re a standout colleague who thrives in a dynamic environment with rapidly changing priorities.
Education & Experience
BS, MS in Computer Science, Computer Engineering, or equivalent degree with 3+ years experience"
28,GAMMA - Machine Learning Engineer,"Boston, MA 02109",Boston,MA,02109,None Found,"Engineering Degree or Computer Science Degree (Bachelors or Masters)
3 to 5 years of experience in algorithms, data structures, and object-oriented programming
Good understanding of machine learning fundamentals and deep learning
Implementation experience in machine learning algorithms and applications
Knowledge of or experience in building production quality and large scale deployment of applications related to natural language processing and machine learning
Strong programming skills in at least one object oriented programming language (Java, Scala, C++, Python, etc.)
Fluency with at least one of the modern distributed ML frameworks such as TensorFlow, PyTorch,Caffe, MxNet
Familiarity with AWS/GCP/Azure technology stack
Fluency in English required",None Found,None Found,None Found,None Found,"Location:
Boston, Chicago, Los Angeles, Montreal, New York, San Francisco, Seattle, Toronto, Washington, D.C.
Geography:
North America
Capabilities:
Big data & advanced analytics, Technology & digital
Industries:
Technology industries
About Us
Boston Consulting Group (BCG) is a global management consulting firm and the world’s leading advisor on business strategy. We partner with clients from the private, public, and not-for-profit sectors in all regions to identify their highest-value opportunities, address their most critical challenges, and transform their enterprises. Our customized approach combines deep insight into the dynamics of companies and markets with close collaboration at all levels of the client organization. This ensures that our clients achieve sustainable competitive advantage, build more capable organizations, and secure lasting results. Founded in 1963, BCG is a private company with more than 90 offices in 50 countries. For more information, please visit bcg.com
Practice Area Profile
BCG GAMMA combines innovative skills in computer science, artificial intelligence, statistics, and machine learning with deep industry expertise. The BCG GAMMA team is comprised of world-class data scientists and business consultants who specialize in the use of advanced analytics to get breakthrough business results. Our teams own the full analytics value-chain end to end: framing new business challenges, building fact-bases, designing innovative algorithms, creating scale through designing tools and apps, and training colleagues and clients in new solutions. Here at BCG GAMMA, you’ll have the chance to work with clients in every BCG region and every industry area. We are also a core member of a rapidly growing analytics enterprise at BCG - a constellation of teams focused on driving practical results for BCG clients by applying leading edge analytics approaches, data, and technology.
Role Profile
OVERVIEW OF BCG GAMMA ENGINEERING:
The BCG GAMMA Engineering team is building the next generation of analytics tools. With your help, BCG GAMMA will develop a platform that fuels BCG GAMMA‘s global data and analytics offerings. Data scientists depend on easy to use interfaces to easily code, increase productivity, answer questions, and envision their results. Clients need to easily interact with our analytics applications to measure the success of their new analytics enabled organization or quickly make decisions based on what and how they see analytic output. Our clients will use our analytics solutions to derive insights around business trends. We “open the doors“ to data for our clients giving them fast and trusted options to search, frame, and share data. BCG GAMMA X‘s goal is to help our clients understand what their data means and provide them the tools to share its narrative with various audiences.

RESPONSIBILITIES:
Build Machine Learning based systems, tools, and services that serve as infrastructure for our internal and external clients
Responsible for inventing how we use technology, Machine Learning, and Data to enable the productivity of our clients
Help envision, build, deploy and develop our next generation of data engines and tools which will help our clients fundamentally transform their business
Bridge the gap between business and engineering, and functioning with deep expertise in both worlds.
Your Qualifications
Engineering Degree or Computer Science Degree (Bachelors or Masters)
3 to 5 years of experience in algorithms, data structures, and object-oriented programming
Good understanding of machine learning fundamentals and deep learning
Implementation experience in machine learning algorithms and applications
Knowledge of or experience in building production quality and large scale deployment of applications related to natural language processing and machine learning
Strong programming skills in at least one object oriented programming language (Java, Scala, C++, Python, etc.)
Fluency with at least one of the modern distributed ML frameworks such as TensorFlow, PyTorch,Caffe, MxNet
Familiarity with AWS/GCP/Azure technology stack
Fluency in English required
Date Posted:
19-Sep-2018
Boston Consulting Group is an Equal Opportunity Employer. All qualified applicants will receive consideration for employment without regard to race, color, age, religion, sex, sexual orientation, gender identity / expression, national origin, disability, protected veteran status, or any other characteristic protected under national, provincial, or local law, where applicable, and those with criminal histories will be considered in a manner consistent with applicable state and local laws.

BCG is an E-Verify Employer."
