,Title,Location,City,State,Zip,Country,Qualifications,Skills,Responsibilities,Education,Requirement,FullDescriptions
8,"Associate Cloud Developer, A2C Relaunch","Washington, DC",Washington,DC,None Found,None Found,None Found,None Found,None Found,None Found,None Found,"BS level technical degree or equivalent experience; Computer Science or Engineering background preferred; Masters Degree desired.Experience with one of the following programming languages: Java, Python, Ruby, Node.js, C#, or C++Experience with Networking fundamentals, Security, Databases (Relational and/or NoSQL), Operating Systems (Unix, Linux, and/or Windows)Exposure to Agile development methodologies
Ability to travel to provide Professional Services is required for this role.

Returner Program Details:
Return to work and come build the future of cloud computing with Amazon Web Services.The AWS Returners Program offers individuals who have been on a career break an opportunity to return to full time employment within a breadth of different roles. The program is designed to support Returners back into a permanent position, setting them up with the skills and knowledge needed for success at AWS!

Amazon aims to be the most customer centric company on earth. Amazon Web Services (AWS) provides a highly reliable, scalable, low-cost infrastructure platform in the cloud that powers critical applications for hundreds of thousands of businesses in 190 countries around the world.

What are we looking for?
If you have been out of the workforce for longer than two years, and want to restart your career, the AWS Returners Program could be for you. As a Returner:
You will bring your voice. At AWS we value individual expression, respect different opinions, and work together to create a culture where each of us is able to contribute fully.You will accelerate your growth. The scope and scale of what we do for our customers drive us to experiment with new possibilities, take risks and learn quickly.You will chart your own path. The possibilities you explore, the opportunities you take advantage of, and the impact you have is driven by your ideas and initiative.You will embrace the challenge. At AWS building the future is inspiring and fun and we embrace the challenge that comes with inventing and delivering things that were never thought possible.
You will use our Leadership Principles every day. Whether discussing ideas for new projects or deciding on the best approach to solving a problem our Leadership Principles is just one of the things that makes Amazon peculiar. Learn more about our Leadership principles here.
What does the AWS Returners Program Offer?
In Amazon Web Services, we don't mind being called ""peculiar."" We have our own way of doing things. We're obsessed with customers, we see beauty in simplifying the complex, and we're comfortable with being misunderstood. That might sound unorthodox, but our unusual approach and our culture - focused on removing obstacles so builders can build - are part of why our employees enjoy working in AWS.

AWS is helping over a million customers in 190 countries leverage the power of cloud computing. Being a global company isn’t just about worldwide availability or working with international customers; we also see the value in building global teams. Here are some of the great benefits that you’ll get from joining us on our program.

For more information please visit.
https://www.amazon.jobs/en/landing_pages/awsreturners

Professional Services:

We are looking for motivated technologists who possess a unique balance of technical depth, business knowledge, and strong interpersonal skills who have been on a career break an opportunity to return. This program is designed to help and support you back into a full-time permanent role. Our goal is to set you up with the skills and knowledge you need for success.

During your first 6 months as a Returner, you will receive instruction and on-the-job training on a range of AWS services and solutions. By the end of the first year, you will choose a specialty track suited to your strengths and preferences (subject to business availability). These tracks include:

Application Developer – AppDev resources are specialists in designing applications that run natively in the cloud. They are experts in building programs that run on any number of platforms including virtualized instances, containers, or serverless architecture.
Cloud Infrastructure Architect – An expert in cloud-based networking and system rollouts. CIAs specialize in network performance, infrastructure provisioning, and building Application Programming Interfaces (APIs).
DevOps Specialist – A leader in building advanced computing systems that harness continuous integration/continuous deployment pipelines and utilize the strengths of cloud computing to build scalable and economical systems for customers.
Data Lake & Analytics Specialist – This role will specifically focus on data processing capabilities and helping our customers and partners to remove the constraints that prevent our customers from leveraging their data to develop business insights. Engagements will include migration of existing applications and development of new applications using AWS cloud services.
Data Warehouse & Massive Parallel Processing Specialist – This role will specifically focus on large scale data warehousing and database migration capabilities. Engagements will include Redshift implementations and helping customers to migrate from their existing on-premises data warehouses using other databases to Amazon Redshift.
Data & Machine Learning Engineer – In this role, you will work with our partners and customers with a focus on our AWS Analytics and ML services offering such Amazon Kinesis, AWS Glue, Amazon Redshift, Amazon EMR, Athena, Amazon SageMaker, and more. You will help our customers and partners to remove the constraints that prevent them from leveraging their data to develop business insights.

Our consultants deliver proof-of-concept projects, topical workshops, and lead implementation projects. These professional services engagements focus on key customer solutions such as, web applications, enterprise applications, HPC, batch processing and big data, archiving and disaster recovery, education and government.

Responsibilities include:
Expertise - Collaborate with AWS field sales, pre-sales, training and support teams to help partners and customers learn and use AWS services such as Amazon Elastic Compute Cloud (EC2), Amazon Simple Storage Service (S3), Amazon SimpleDB/RDS databases, AWS Identity and Access Management (IAM), etc.Solutions - Define and deliver on-site technical engagements with partners and customers. This includes participating in pre-sales on-site visits, understanding customer requirements, and proposing and delivering packaged offerings, and delivering custom solution engagements.Delivery - Engagements include short on-site projects proving the use of AWS services to support new distributed computing solutions that often span private cloud and public cloud services. Engagements will include migration of existing applications and development of new applications using AWS cloud services.Insights - Work with AWS engineering and support teams to convey partner and customer needs and feedback as input to technology roadmaps. Share real world implementation challenges and recommend new capabilities that would simplify adoption and drive greater value from use of AWS cloud services.
Ability to travel to provide Professional Services is required for this role.

Troubleshooting: Experience with QA, testing, helpdesk, IT support, or any technician or quality assurance type workCloud Awareness: Experience implementing a cloud-based technology solutionExperience with systems administration (Linux/Windows) or network administration (DNS, IPsec, BGP, VPN, Load Balancing)Scripting skills (e.g. Powershell, Python, Bash, Ruby, Perl, etc.)Passion for experiencing new technologies, cultures, and locations in the US and around the world
Amazon is an Equal Opportunity-Affirmative Action Employer – Minority / Female / Disability / Veteran / Gender Identity / Sexual Orientation/Age

Pursuant to the San Francisco Fair Chance Ordinance, we will consider for employment qualified applicants with arrest and conviction records.

Pursuant to the Los Angeles Fair Chance Ordinance, we will consider for employment
qualified applicants with arrest and conviction records."
9,Comchhology Analytics Associate* - Machine Learning Engineer,"Fort Meade, MD",Fort Meade,MD,None Found,None Found,None Found,None Found,None Found,None Found,None Found,"Title generated by a neural net trained on relevant job listings and then asked to perform poorly.
What you will be working on:
Come be a part of a team applying cutting edge Machine Learning to the cybersecurity domain! We will use state of the art ML techniques (Neural Nets, Gradient Boosting, etc.) to model behaviors, detect anomalies, cluster data, and ultimately create actionable information.
You will:
Build and improve ML models for a number of different problem sets
Collect and preprocess data for training and validation
Use TensorFlow, Keras, XGBoost, scikit-learn, and other ML tools
Help other engineers deploy ML models on dynamic compute platforms
Read current research and contribute to the team’s collective knowledge
Work at our headquarters in Annapolis Junction, MD and/or the surrounding area.
What you need:
A Bachelor’s degree in Computer Science or Mathematics
US Government Security clearance or the ability to obtain one.
What we would like you to have:
A deep interest in data and machine learning
A strong background in Computer Science and Mathematics
Experience with Python
Familiarity with Machine Learning tools and techniques
Familiarity with the cyber security domain
A desire to solve problems whose solutions aren’t on Stack Overflow
A few reasons to work for us:
You can grow with us: Our flexible and collaborative environment encourages our people to challenge themselves and feed their need to learn and grow. We offer $10k towards Professional Development and Education, and Brown Bag sessions covering a wide variety of topics.
You can retire sooner rather than later: We match up to 8% of your 401k contributions which you are vested in 100% day one.
Work - life balance is real: In addition to the ability to work flexible hours, you’ll get up to 7 weeks of PTO which is based upon your total years’ experience. For every year you’re with HII-TSD (formerly G2, Inc.), you’ll enjoy an additional day of PTO.
Not quite ready to apply? TAKE THE NEXT STEP and GET CONNECTED or reach out to us at Recruiting@g2-inc.com to take a less formal approach.
We are an equal opportunity employer and all qualified applicants will receive consideration for employment without regard to race, color, religion, sex, national origin, disability status, protected veteran status, or any other characteristic protected by law.
If you are seeking reasonable accommodation as it relates to the employment process, please contact the recruiting department at (410) 290-9710 or recruiting@g2-inc.com"
10,Machine Learning Engineer (Lead),"Vienna, VA",Vienna,VA,None Found,None Found,None Found,None Found,None Found,None Found,None Found,"Towers Crescent (12066), United States of America, Vienna, Virginia

At Capital One, we’re building a leading information-based technology company. Still founder-led by Chairman and Chief Executive Officer Richard Fairbank, Capital One is on a mission to help our customers succeed by bringing ingenuity, simplicity, and humanity to banking. We measure our efforts by the success our customers enjoy and the advocacy they exhibit. We are succeeding because they are succeeding.

Guided by our shared values, we thrive in an environment where collaboration and openness are valued. We believe that innovation is powered by perspective and that teamwork and respect for each other lead to superior results. We elevate each other and obsess about doing the right thing. Our associates serve with humility and a deep respect for their responsibility in helping our customers achieve their goals and realize their dreams. Together, we are on a quest to change banking for good.

Machine Learning Engineer (Lead)

Responsibilities:
End-to-end/full stack software solutions development and deployment of our Machine Learning (ML) and Artificial Intelligence (AI) algorithms.
Write, design, code, test, implement, debug, and validate applications; document design decisions and develop modular software components; monitor system performance metrics, and identify potential risks/issues.
Lead multiple software development initiatives at any given time, serving as an expert for the escalation of complex application design and development issues.
Provide active mentorship/guidance to junior members of the Agile Tech team and participate in internal and external technology communities.
Work with product owners to understand desired application capabilities and testing scenarios, and define, establish, and execute against strategic technical management and business delivery roadmaps, actively managing data risks, issues, and impediments.
Present project metrics, complex ML and AI concepts to both technical and non-technical audiences.

Basic Qualifications:
Bachelor’s Degree
At least 5 years of open source software development experience in Python
At least 2 years of software capabilities development experience in Machine Learning, Deep Learning, or Artificial Intelligence algorithms
At least 2 years of experience in Continuous Integration/Continuous Development, Test Automation, Build Automation, and Test-Driven Development to enable the rapid delivery of working code utilizing Jenkins, Maven, Nexus, Chef, Terraform, Ruby, Git, or Docker in cloud computing environments

Preferred Qualifications:
Ph.D. in Computer Science, Engineering, Information Systems, Physics or Mathematics discipline.
6+ years of experience in full stack software development using Python, Scala, Java, RESTful API, Apache, Spark, Kafka, Micro-service etc., and successful deployment of capabilities in AWS Cloud computing environments.
4+ years of experience with the full AWS stack and distributed Big Data technologies such as Hadoop, Python, Hive, Cloudera, etc.
Experience in Scala, R, Java, Perl, JavaScript, or Shell.
Experience with Tensorflow

Capital One will consider sponsoring a new qualified applicant for employment authorization for this position."
11,Machine Learning Engineer,"Reston, VA 20191",Reston,VA,20191,None Found,"You have BA/BS in a technology, engineering, computer science or related disciplineYou have at least 5 years of hands-on experience in one or more of the fields of image processing, machine learning, computer vision, and data scienceYou have hands-on experience of a broad ranges of technology systems and are able to work with:
any of the following image processing and computer vision frameworks and libraries: OpenCVany of the following AI/machine learning frameworks, statistical packages, and libraries: Tensorflow, Caffe, Amazon Machine Learning, Apache Singa, Torch, Scikit-learn, Microsoft CNTK, Apache Mahout, SQL, d3.js, map-reduce, R, Weka, Orange, as well as open source and other emerging technologies/frameworksprogramming languages and scripting methods including: Python, C, C++, Java, .NET, Bash, AWKoperating systems: Linux, Windowsprefer a Linux terminal over a GUIYou have hands-on experience:engineering solutions to optimize, monitor, and measure performance of operational biometric systemsconducting (and/or leading) research and development of biometric, identity management, and fraud prevention solutionsdeveloping alternate concepts of operation to improve biometric sample and image quality, including automated image quality assessment, image enhancement, device calibrationdeveloping software algorithms to assess and improve image qualityconducting research and assessment to develop technical contributions/guidance for national and international biometrics standards, proposed standards, laws and policiesYou desire to work in an agile and cross functional team environment, understand team goals and generate appropriate, innovative analytical insights to drive process and experience improvement
You challenge the status quo, are hungry to explore, evaluate, and understand new technologies, and wish to share insights and mentor your peersYou possess a TS security clearance",None Found,None Found,None Found,None Found,"RESPONSIBILITIES
As an engineer and technologist in image processing, machine learning, and/or computer vision with out team, you will be working with our clients to design, create, evaluate, and maintain solutions using your experience and expertise in image processing, machine learning, computer vision and data science. In your role you will work with various teams to research, develop, and deploy solutions for various national security missions spanning identity management, multimedia, and cyber end-to-end systems that are transforming the way law enforcement and intelligence communities handle and analyze information and translate it into actionable intelligence.

You would join Noblis’ identity intelligence group as we continue to grow our software and digital capabilities. Today our team consists of developers, scientists, engineers, researchers, and analysts that have served federal, state, and local government clients on high-consequence problems in analytics, biometrics, AI/machine learning, and forensic science for over 20 years. Our team is engaged across the identity intelligence community and has been instrumental in making our customers’ programs successful in analytics, automation, and digital solutions spanning identity science, AI/machine learning, computer vision, biometrics, forensics, media analytics, systems engineering, software development/integration, DevOps, and cloud technologies.
QUALIFICATIONS
Required Qualifications:You have BA/BS in a technology, engineering, computer science or related disciplineYou have at least 5 years of hands-on experience in one or more of the fields of image processing, machine learning, computer vision, and data scienceYou have hands-on experience of a broad ranges of technology systems and are able to work with:
any of the following image processing and computer vision frameworks and libraries: OpenCVany of the following AI/machine learning frameworks, statistical packages, and libraries: Tensorflow, Caffe, Amazon Machine Learning, Apache Singa, Torch, Scikit-learn, Microsoft CNTK, Apache Mahout, SQL, d3.js, map-reduce, R, Weka, Orange, as well as open source and other emerging technologies/frameworksprogramming languages and scripting methods including: Python, C, C++, Java, .NET, Bash, AWKoperating systems: Linux, Windowsprefer a Linux terminal over a GUIYou have hands-on experience:engineering solutions to optimize, monitor, and measure performance of operational biometric systemsconducting (and/or leading) research and development of biometric, identity management, and fraud prevention solutionsdeveloping alternate concepts of operation to improve biometric sample and image quality, including automated image quality assessment, image enhancement, device calibrationdeveloping software algorithms to assess and improve image qualityconducting research and assessment to develop technical contributions/guidance for national and international biometrics standards, proposed standards, laws and policiesYou desire to work in an agile and cross functional team environment, understand team goals and generate appropriate, innovative analytical insights to drive process and experience improvement
You challenge the status quo, are hungry to explore, evaluate, and understand new technologies, and wish to share insights and mentor your peersYou possess a TS security clearance

Desired Qualifications:
Beyond the requirements above, our ideal colleague:has advanced their formal education with a MS/PhD specializing in data science, computer vision, machine learning, and artificial intelligence
has strong written and verbal communication skills (e.g., technical writing)has experience working with USG clients, operational components, and stakeholdershas or are eligible for special access programshas hands-on experience with optics, sensors, color management, measuring image quality characteristicshas hands-on experience with document security features, public key infrastructure (PKI), document imaging, and optical character recognition (OCR)complements our existing team, likes solving problems, and is comfortable with ambiguity
can self manage, has strong self-organization skills, and is eager to contributestrives to be an excellent engineer, is eager to explore new technologies, and develop new skillsis comfortable working with teams across geographic bounds
OVERVIEW
Noblis and our wholly owned subsidiary, Noblis ESI, are solving difficult problems that help our government and our country. We bring the best of scientific thought, management, and engineering expertise with a reputation for independence and objectivity. We support a wide range of government and industry clients in the areas of national security, intelligence, transportation, healthcare, environmental sustainability, and enterprise engineering. Learn more at Noblis -About Us

Why work at a Noblis company?
Our employees find greater meaning in their work and balance the other things in life that matter to them. Our people are our greatest asset. They are exceptionally skilled, knowledgeable, team-oriented, and mission-driven individuals who want to do work that matters and benefits the public.

Noblis has won numerous workplace awards. Noblis maintains a drug-free workplace and is an equal opportunity employer. All qualified applicants will receive consideration for employment without regard to race.
CLIENT ENGAGEMENT
Learn about the Noblis business development life-cycle, processes, tools, and account structureContribute specialized domain or technical content to proposal sections or client white papersBuild a productive relationship with your client and understand their structure and goals."
