,Title,Location,City,State,Zip,Country,Qualifications,Skills,Responsibilities,Education,Requirement,FullDescriptions
17,Machine Learning Engineer,"Reston, VA",Reston,VA,None Found,None Found,"
Strong technical skills with an emphasis in Java
2+ years of experience with machine learning and/or deep learning methods
Ability to handle multiple projects simultaneously, meet deadlines, and effectively manage priorities and communicate progress
Experience working in a cloud based and Agile environment
Experience with big data processing (Spark/Hadoop)
Fluent in Linux based systems and code versioning tooling (Git/CI/CD)
B.S., M.S. or Ph.D. in Computer Science or equivalent degree and work experience",None Found,"
Design and implement ML feature pipelines
Serve as active member of small, dedicated machine learning team
Optimize pipelines and processes for model development, experimentation and scaled production scoring
Implement machine learning algorithms and libraries in service to modeling and production scoring pipelines
Analyze large and complex data sets to derive valuable insights, inform feature and product development
Apply machine learning and data science techniques and design distributed systems
Be in charge of the entire lifecycle (research, design, experimentation, development. deployment, monitoring, and maintenance)
Drive the evolution of Resonate’s ML/AI infrastructure through research, experimentation and implementation of best practices",None Found,"
Strong technical skills with an emphasis in Java
2+ years of experience with machine learning and/or deep learning methods
Ability to handle multiple projects simultaneously, meet deadlines, and effectively manage priorities and communicate progress
Experience working in a cloud based and Agile environment
Experience with big data processing (Spark/Hadoop)
Fluent in Linux based systems and code versioning tooling (Git/CI/CD)
B.S., M.S. or Ph.D. in Computer Science or equivalent degree and work experience","Resonate is disrupting the marketing and advertising landscape with cutting-edge technology that brings together real-time survey data and insights on over 230 million consumers and online behavioral data all in one platform. Resonate has pioneered a completely new way to identify, understand, and engage highly-targeted audiences by uncovering 13,000 individual attributes that identify their underlying values, beliefs, and motivations. We get to the heart of ‘why’ consumers do what they do and the products, companies and causes they support.
This candidate will work with a tight, highly skilled machine learning team dedicated to the development of Resonates proprietary consumer insights. This role will mine billions of streaming web events each day, leveraging the emerging ML techniques to drive the Resonate product. If you are interested in working on cutting edge ML and AI projects at internet scale and speed this is the job for you!
Key Responsibilities
Design and implement ML feature pipelines
Serve as active member of small, dedicated machine learning team
Optimize pipelines and processes for model development, experimentation and scaled production scoring
Implement machine learning algorithms and libraries in service to modeling and production scoring pipelines
Analyze large and complex data sets to derive valuable insights, inform feature and product development
Apply machine learning and data science techniques and design distributed systems
Be in charge of the entire lifecycle (research, design, experimentation, development. deployment, monitoring, and maintenance)
Drive the evolution of Resonate’s ML/AI infrastructure through research, experimentation and implementation of best practices
Qualifications & Experience Requirements
Strong technical skills with an emphasis in Java
2+ years of experience with machine learning and/or deep learning methods
Ability to handle multiple projects simultaneously, meet deadlines, and effectively manage priorities and communicate progress
Experience working in a cloud based and Agile environment
Experience with big data processing (Spark/Hadoop)
Fluent in Linux based systems and code versioning tooling (Git/CI/CD)
B.S., M.S. or Ph.D. in Computer Science or equivalent degree and work experience

About Resonate:

Resonate is a pioneer in Consumer Intelligence Marketing, delivering deep consumer understanding, dynamic insights and analysis in a simple-to-use SaaS platform. Leading consumer brands, advertising agencies and political and advocacy organizations have used Resonate to understand the Human Element, a holistic understanding of their customers and prospects, that extends beyond demographics, psychographics and behavioral data. We uncover the why that drives the what behind consumers’ decisions to buy or support certain brands, products or causes. Resonate conducts the most extensive U.S. consumer survey and the Resonate Platform contains insights on more than 13,000 attributes representing 185 million U.S. adult consumers.

Resonate offers a unique opportunity to people who want to grow and shape the future of the industry. We’ve been named a Top Workplace by both The Washington Post and VA Business Magazine multiple times. We’ve also been recognized for our consistent growth as part of the Inc. 5000 list five years in a row and by industry-leaders for our game-changing approach to understanding people.
Resonate is privately held and backed by Revolution Growth, Greycroft Partners, and iNovia Capital. Resonate is headquartered in Reston, VA with offices in New York City, and Washington, D.C. Be a part of the team that changes the industry!

More Information:

Find out more about our story at www.resonate.com.

Resonate offers a competitive compensation and benefits package."
18,"Machine Learning Engineer, Senior","Chantilly, VA 20151",Chantilly,VA,20151,None Found,None Found,None Found,None Found,None Found,None Found,"The Challenge:
Are you excited at the prospect of unlocking the secrets held by a data set? Are you fascinated by the possibilities presented by the IoT, machine learning, and artificial intelligence advances? In an increasingly connected world, massive amounts of structured and unstructured data open up new opportunities. As a data scientist, you can turn these complex data sets into useful information to solve global challenges. Across private and public sectors — from fraud detection, to cancer research, to national intelligence — you know the answers are in the data.

We have an opportunity for you to use your leadership and analytical skills to improve the military operations community. You’ll work closely with your customer to understand their questions and needs, then dig into their data-rich environment to find the pieces of their information puzzle. You’ll mentor teammates, develop algorithms, write scripts, build predictive analytics, use automation, apply machine learning, and use the right combination of tools and frameworks to turn that set of disparate data points into objective answers to help our military leaders make informed decisions. You’ll provide your customer with a deep understanding of their data, what it all means, and how they can use it. Join us as we use data science for good in support of operations.

Empower change with us.

Build Your Career:

At Booz Allen, we know the power of analytics and we’re dedicated to helping you grow as a data analysis professional. When you join Booz Allen, you can expect:
access to online and onsite training in data analysis and presentation methodologies, and tools like Hortonworks, Docker, Tableau, and Splunk
a chance to change the world with the Data Science Bowl—the world’s premier data science for social good competition
participation in partnerships with data science leaders, like our partnership with NVIDIA to deliver Deep Learning Institute (DLI) training to the federal government
You’ll have access to a wealth of training resources through our Analytics University, an online learning portal specifically geared towards data science and analytics skills, where you can access more than 5000 functional and technical courses, certifications, and books. Build your technical skills through hands-on training on the latest tools and state-of-the-art tech from our in-house experts. Pursuing certifications? Take advantage of our tuition assistance, on-site bootcamps, certification training, academic programs, vendor relationships, and a network of professionals who can give you helpful tips. We’ll help you develop the career you want, as you chart your own course for success.
You Have:5+ years of experience with application of machine learning techniquesExperience with developing machine learning systemsExperience with programming languages, including Python, R, or C++Experience with using a machine learning framework, including TensorFlow, Caffe, Keras, and SparkMLTS/SCI clearanceBA or BS degree in a Science, Technology, Engineering, or Mathematics field
Nice If You Have:2+ years of experience as a developer of Java, Python, R, or similar high-level languages2+ years of experience with designing novel data analytic methods and workflows, including full data pipelines from raw data through analysis results2+ years of experience with managing disparate data sources with varying data structures of content and preparing these for data science and machine learning applicationsExperience in working with Big Data storage, processing, and computation, including one or more of the following: Accumulo, Spark, Storm, Kafka, or MapReduceAbility to both manage and manipulate large data sets, develop data science approaches, and manage data science tasksAbility to leverage a wide variety of data science capabilities and languagesAbility to exhibit flexibility, initiative, and innovation when dealing with ambiguous and fast-paced situations
Clearance:
Applicants selected will be subject to a security investigation and may need to meet eligibility requirements for access to classified information; TS/SCI clearance is required.
We’re an EOE that empowers our people—no matter their race, color, religion, sex, gender identity, sexual orientation, national origin, disability, veteran status, or other protected characteristic—to fearlessly drive change."
19,Federal - Machine Learning Engineer,"Washington, DC 20006",Washington,DC,20006,None Found,"
1 year of experience in building and evolving complex software systems for data processing and machine learning workloads
1 year of experience with Big Data processing and ML cloud native services on one or more Cloud Platforms (GCP, Azure and/or AWS)
1 year of experience with productionizing developed machine learning solutions
1 year of knowledge and experience with databases – SQL, NOSQL
1 year of experience with Python","
1 year of experience in building and evolving complex software systems for data processing and machine learning workloads
1 year of experience with Big Data processing and ML cloud native services on one or more Cloud Platforms (GCP, Azure and/or AWS)
1 year of experience with productionizing developed machine learning solutions
1 year of knowledge and experience with databases – SQL, NOSQL
1 year of experience with Python",None Found,None Found,None Found,"Organization: Accenture Federal Services
Location: Arlington, VA - Washington, DC

Accenture Federal Services, a wholly owned subsidiary of Accenture LLP, is a U.S. company with offices in Arlington, Virginia. Accenture's federal business has served every cabinet-level department and 30 of the largest federal organizations. Accenture Federal Services transforms bold ideas into breakthrough outcomes for clients at defense, intelligence, public safety, civilian and military health organizations.
We believe that great outcomes are everything. It’s what drives us to turn bold ideas into breakthrough solutions. By combining digital technologies with what works across the world’s leading businesses, we use agile approaches to help clients solve their toughest problems fast—the first time. So, you can deliver what matters most.
Count on us to help you embrace new ways of working, building for change and put customers at the core. A wholly owned subsidiary of Accenture, we bring over 30 years of experience serving the federal government, including every cabinet-level department. Our 7,200 dedicated colleagues and change makers work with our clients at the heart of the nation’s priorities in defense, intel, public safety, health and civilian to help you make a difference for the people you employ, serve and protect.

The Machine Learning Engineer develops machine learning solutions to meet business use cases and to support experimentation and innovation to advance mission outcomes. The engineer collaborates with business SMEs, architects, data engineers, developers and data scientists to identify innovative machine learning solutions that leverage data to meet business goals. The machine learning engineer ensures infrastructure and data pipelines are structured to deploy machine learning solutions.

Key Responsibilities:

Understands and translates business and functional needs into machine learning problem statementsTranslates complex machine learning problem statements into specific deliverables and requirementsDesigns and develops scalable solutions that leverage machine learning and deep learning models to meet enterprise requirementsWorks closely with data scientists and data engineers to develop machine learning algorithmsWorks on Optimization of Neural Net and Deep Learning models for inferenceTranslates machine learning algorithms into production-level codeCollaborates with development teams to test and deploy machine learning modelsCreates metrics to continuously evaluate the performance of machine learning solutionsMaintains and improves the performance of existing machine learning solutionsEnsures adherence to performance standards and compliance to data security requirementsKeeps abreast with new tools, algorithms and techniques in machine learning and works to implement them in the organization
Skills:
Proficiency in machine learning algorithms such as multi-class classifications, decision trees, support vector machines and deep learningStrong understanding of probability and statistical models (generative and descriptive models)Ability to run experiments scientifically and analyze resultsAbility to effectively communicate technical concepts and results to technical and business audiences in a comprehensive mannerAbility to collaborate effectively across multiple teams and stakeholders, including analytics teams, development teams, product management and operations
Strong Computer Science fundamentals in algorithms, data structures, OOPS, functional programming

Basic Skills and Qualifications:
1 year of experience in building and evolving complex software systems for data processing and machine learning workloads
1 year of experience with Big Data processing and ML cloud native services on one or more Cloud Platforms (GCP, Azure and/or AWS)
1 year of experience with productionizing developed machine learning solutions
1 year of knowledge and experience with databases – SQL, NOSQL
1 year of experience with Python
Preferred Skills and Qualifications:
Strong grasp of principles and approaches used in data-driven systems, processes and algorithms
Experience with ML algorithms for time series data-sets
Experience with stream processing frameworks / complex event processing engines
Scripting skills in at least one of the following: Shell, Perl, Bash, or Ruby
Experience with performance engineering including testing, tuning and monitoring tools
Basic familiarity with continuous integration tools and frameworks
Bachelor's degree in data science, applied mathematics, computer science or otherwise research-based field

An active security clearance or the ability to obtain one may be required for this role.
Candidates who are currently employed by a client of Accenture or an affiliated Accenture business may not be eligible for consideration.
Applicants for employment in the US must have work authorization that does not now or in the future require sponsorship of a visa for employment authorization in the United States and with Accenture (i.e., H1-B visa, F-1 visa (OPT), TN visa or any other non-immigrant status).
Accenture is a Federal Contractor and an EEO and Affirmative Action Employer of Females/Minorities/Veterans/Individuals with Disabilities.
Equal Employment Opportunity
All employment decisions shall be made without regard to age, race, creed, color, religion, sex, national origin, ancestry, disability status, veteran status, sexual orientation, gender identity or expression, genetic information, marital status, citizenship status or any other basis as protected by federal, state, or local law.
Job candidates will not be obligated to disclose sealed or expunged records of conviction or arrest as part of the hiring process.
Accenture is committed to providing veteran employment opportunities to our service men and women."
20,Lead Machine Learning Engineer,"Rockville, MD 20855",Rockville,MD,20855,None Found,None Found,"Strong technical team leadership skills in communication skills with team members, task organizations, delegation, etc.
Demonstrated use and mastery of machine and deep learning concepts and key algorithms
Solid working (hands on preferred) understanding of big data technologies
Depth in at least one domain where machine learning is applied
Experience in developing, testing, debugging, and deploying complex algorithms in a variety of environments
Proficient in technical writing and strong communication skills
",None Found,"A Master’s degree (with thesis option) or Ph.D. (preferred) in Computer Science, Computer Engineering, Electrical Engineering, Robotics, Physics, Mathematics or related field
Minimum 5 years of research and development experience in general machine learning and deep learning
",None Found,"Are you a machine learning engineer? Does the idea of contributing to a variety of machine learning, deep learning, and big data projects get you excited? If so, we are looking for you!

For this role, the successful candidate will lead a team of engineers and data scientists in developing advanced algorithms for time series, text, audio, image and video processing, and big data analytics.
Related projects at IAI include multi-sensor fusion, information retrieval in big data applications, sensor simulation, text mining, image and video processing, and constrained optimization. We are looking to add expertise and talent to our multi-disciplinary team to continue our success in all of these areas.

Job Duties
Conduct research and development in the area of time series, time-frequency analysis, natural language processing, and/or image/video processing.
Develop algorithms and conduct analysis using state–of-the-art machine learning/artificial intelligence tools across a variety of domains
Interact with and support multiple research teams * Provide technical leadership, mentor junior team members, and develop high quality artifacts that can reused on different projects
Support program management and business development efforts by writing reports/papers, contributing to proposals, presenting work to customers, etc.
Required Experience & Education
A Master’s degree (with thesis option) or Ph.D. (preferred) in Computer Science, Computer Engineering, Electrical Engineering, Robotics, Physics, Mathematics or related field
Minimum 5 years of research and development experience in general machine learning and deep learning
Required Skills
Strong technical team leadership skills in communication skills with team members, task organizations, delegation, etc.
Demonstrated use and mastery of machine and deep learning concepts and key algorithms
Solid working (hands on preferred) understanding of big data technologies
Depth in at least one domain where machine learning is applied
Experience in developing, testing, debugging, and deploying complex algorithms in a variety of environments
Proficient in technical writing and strong communication skills
Desired Skills
Experience with Deep Learning Frameworks (TensorFlow, Caffe, etc.), NVIDIA Deep Learning SDK, and/or other deep learning software libraries
Strong background in math and physics
Proficient in programming and debugging in at least one language (Java, python, C/C++)
Familiar with the software development lifecycle and relevant tools
Experience with Big Data technologies (Apache Kafka, Storm, Spark, Solr).
Experience with database technologies such as HBase, Cassandra, MongoDB or similar
Experience in parallel processing such as GPU programming with CUDA or OpenCL.
About IAI

Intelligent Automation, Inc. (IAI) is a technology innovation company headquartered in Rockville, MD. For over 30 years, we have specialized in providing advanced technology solutions and R&D services to federal agencies and corporations throughout the United States and internationally. Leveraging agile R&D processes, a multi-disciplinary collaborative environment, and its substantial intellectual property portfolio, IAI excels in developing concepts into market-focused products and customer-driven solutions. IAI’s core R&D areas include: Air Traffic Management, Big Data and Social Media Analytics, Control and Signal Processing, Cyber Security, Education and Training Technologies, Health Technologies, Modeling and Simulation, Networks and Communications, Robotics, and Sensor Systems.
US Citizenship or Permanent Residency required

All qualified applicants will receive consideration for employment without regard to race,
color, religion, sex, sexual orientation, gender identity, national origin, disability, or veteran status.


Requisition ID: 19-1201"
21,ML/AI Engineer,"Reston, VA 20190",Reston,VA,20190,None Found,None Found,None Found,None Found,None Found,None Found,"MetroStar Systems is looking for a Machine Learning Engineer that is passionate about cutting edge research and using the latest technologies. If you want to join a company that values solving real client problems while advancing the field of machine learning and are open to commuting to Reston, VA we want you to work for MetroStar!
You're a great fit if:
5+ years functional experience in a data engineering or business intelligence role
You have experience with AWS or Google ML/AI services
You thrive in a collaborative and open environment solving problems
You'll love our position if:
(This is the stuff you MUST have to be a fit)
5+ years of professional software engineering experience, including testing and deploying iterative releases of software systems
3+ years of experience applying, implementing, and/or developing machine learning or statistical algorithms
Proficiency in Python and/or C++ and SQL
3+ years in data modeling and systems design skills
We'll REALLY love you if:
(This is the bonus stuff that makes you stand out)
You have a bachelor’s degree in Computer Science or Software Engineering, or Master’s Degree or PhD in Computer Science or Software Engineering
You have an established portfolio of publications, projects and/or speaking engagements
3+ years working with cloud software design using distributed caching
Advanced knowledge of big data and machine learning technologies, especially in AWS and/or Google
Experience with Apache Atlas, Airflow, and Spark
The Admin Stuff: Applicants selected may be subject to a government security investigation and must meet eligibility requirements for potential access to classified information. Accordingly, US Citizenship is required
The Legal Stuff:MetroStar Systems is committed to creating a diverse environment and is proud to be an equal opportunity employer. All qualified applicants will receive consideration for employment without regard to race, color, religion, gender, gender identity or expression, sexual orientation, national origin, genetics, disability, age, or veteran status. The statements herein are intended to describe the general nature and level of work being performed by employees, and are not to be construed as an exhaustive list of responsibilities, duties, and skills required of personnel so classified. Furthermore, they do not establish a contract for employment and are subject to change at the discretion of MetroStar Systems."
