,Title,Location,City,State,Zip,Country,Qualifications,Skills,Responsibilities,Education,Requirement,FullDescriptions
13,Senior Machine Learning Engineer - QuantumBlack,"Boston, MA",Boston,MA,None Found,None Found,"MSc or degree in Computer Science or a relevant subject
Strong coding skills in Python, experience with pandas, scikit-learn, matplotlib a huge plus
Practical experience with machine learning methods, such as Linear Regression, Decision Trees, Random Forest, Deep Learning, etc.
Experience in object-orientated programming such as C, C++, Java OR Scala
Deep understanding of good software engineering principles
Knowledge of technologies, such as Spark, Hadoop/MapReduce is desirable but not essential
Good knowledge of testing frameworks and libraries
Experience with a range of database management languages e.g. SQL, PostgreSQL
",None Found,"
Work closely with Data Scientists and Data Engineers to productionise and deploy machine learning models
Work with the guild leadership to set the standards for software engineering practices within the machine learning engineering team and support across other disciplines
Play an active role in leading team meetings and workshops with clients
Choose and use the right analytical libraries, programming languages, and frameworks for each task
Produce high-quality code that allows us to put solutions into production
Refactor code into reusable libraries, APIs, and tools
Help us to shape the next generation of our products
Rotate between client project work and internal product development in alignment with your personal development plan",None Found,None Found,"Qualifications
MSc or degree in Computer Science or a relevant subject
Strong coding skills in Python, experience with pandas, scikit-learn, matplotlib a huge plus
Practical experience with machine learning methods, such as Linear Regression, Decision Trees, Random Forest, Deep Learning, etc.
Experience in object-orientated programming such as C, C++, Java OR Scala
Deep understanding of good software engineering principles
Knowledge of technologies, such as Spark, Hadoop/MapReduce is desirable but not essential
Good knowledge of testing frameworks and libraries
Experience with a range of database management languages e.g. SQL, PostgreSQL
Who You'll Work With
You'll join us in Boston and will have the opportunity to work on complex problems with our clients across a number of domains. You will work part of a highly collaborative and cross-functional team of Data Scientists, Data Architects, Engineers and Designers.
Who you are
A core value at QuantumBlack is fusion and at the heart of our multi-disciplinary teams is the belief that the sum of individual parts will always be less than the impact of the entire team. You are a highly collaborative individual who is capable of laying aside your own agenda, listening to and learning from colleagues, challenging thoughtfully and prioritising impact. You search for ways to improve things and work collaboratively with colleagues. You believe in iterative change, experimenting with new approaches, learning and improving to move forward quickly. Trust between colleagues is paramount here – you are an individual who can always be trusted to work in the best interests of all colleagues and to achieve the best outcome for QuantumBlack and our clients. You are naturally enthusiastic and enjoy sharing your passion with others.
What You'll Do
As a Senior Machine Learning Engineer at QuantumBlack in Boston...
You are a keen problem solver who uses technology to solve complex analytical problems. You have a deep interest in Big Data technologies, Analytics and Data Science. You know how to engineer beautiful code in Python and/or Scala (and Spark) but also can read R and take pride in what you produce.
Responsibilities
Work closely with Data Scientists and Data Engineers to productionise and deploy machine learning models
Work with the guild leadership to set the standards for software engineering practices within the machine learning engineering team and support across other disciplines
Play an active role in leading team meetings and workshops with clients
Choose and use the right analytical libraries, programming languages, and frameworks for each task
Produce high-quality code that allows us to put solutions into production
Refactor code into reusable libraries, APIs, and tools
Help us to shape the next generation of our products
Rotate between client project work and internal product development in alignment with your personal development plan
Who we are
QuantumBlack teams work in multi-disciplinary environments harnessing data to provide real-world impact. We bring together the brightest data scientists, engineers and designers to take on the biggest problems facing the world’s most influential organisations. Our projects range from helping pharmaceutical companies bring lifesaving drugs to market quicker to optimising a Formula1 car’s performance. At QuantumBlack you have the best of both worlds; all the benefits of being part of one of the leading management consultancies globally and the autonomy to thrive in a fast growth tech culture.
No project is ever the same - we work across multiple sectors, providing unique learning and development opportunities internationally.
Fusing Tech & Leadership – We work with the latest technologies and methodologies and offer first class learning programmes at all levels
Multidisciplinary Teamwork - Our teams include data scientists, engineers, project managers, UX and visual designers who work collaboratively to enhance performance.
Innovative Work Culture - Creativity, insight and passion come from being balanced. We cultivate a modern work environment through an emphasis on wellness, insightful talks and training sessions.
Striving for Diversity – With colleagues from over 40 nationalities, we recognise the benefits of working with people from all walks of life.
What we do
We guide global companies through data science solutions to transform their businesses and enhance performance across industries including healthcare, automotive, energy and elite sport.
Healthcare Efficiency - We helped a healthcare provider improve their clinical trial practices by identifying congestion in diagnostic testing as a key indicator of admissions breaches.
Environmental Impact – We designed and built the first data-driven application for a state of the art centre of excellence in urban innovation by collecting real-time data from environmental sensors across London and deploying proprietary analytics to find unexpected patterns in air pollution.
Product Development - We worked with the CEO of an elite automotive organisation to reduce the 18-month car development timeframe by improving processes, designs and team structures.
Visit our Careers site to watch our video and read about our interview processes and benefits."
14,Machine Learning Engineer,"Somerville, MA",Somerville,MA,None Found,None Found,None Found,None Found,None Found,None Found,None Found,"We’re looking for a bright Machine Learning Engineer to join our team of machine learning experts. Our team is growing, and so is our appetite for cutting edge work. You will have many chances to bring work from theory to practice, enrich Tulip’s intellectual property, and share it before key people in the company and outside.

We are looking at hard, data-rich problems, with immense scale and unique opportunity for impact on large organizations. Your first goal will be to research the data analysis needs of our clients, and implement those on our platform. Next you will deploy your work and monitor its performance with live installations worldwide.

About us

At Tulip [https://tulip.co/], we’re using technology to empower the people who build our world. We’re at the technological forefront of disrupting the manufacturing industry. We build tools to augment the people from the factory floor up to the highest ranks in the organization. We sense the people in the workstations, the processes, the work pieces, the machines, the tools and even the environment. All this creates incredible amounts of data, ripe for insight extraction. Join us if you want to help create the next industrial revolution.

The job


Develop data analysis pipelines from ingest to postprocessing
Train machine learning models that solve hard, large-scale problems
Continuously improve the model deployment pipeline
Track and monitor the performance of your model outcomes
Contribute to the IP of the company
Collaborate in driving sales with your technological expertise
Bring up new data-driven features from ideation to production

You


Curious about data-driven software and machine learning solutions
Have experience in turning data into insights, and insights into actions
Understand the latest work in deep learning, and want to stay in touch
Demonstrate your own work in front of peers
Are committed to stepping up and making your path as a data-driven innovator

Key requirements


A degree or several in computational sciences (CS, Math, Applied Physics, Engineering, Statistics, Computational Cognition, etc.) or equivalent industrial experience in an engineering role.
Demonstrated capacity for realizing non-trivial machine learning projects, e.g. on GitHub, Kaggle
Demonstrable mathematical reasoning about data and numerical problems in multiple aspects: linear algebra, calculus, probability, algorithmics and optimization.
Advanced experience in relevant major languages: Python, C++
Experience with deep & machine learning libraries: Tensorflow / Keras / PyTorch / MXNet / Gluon, Scikit-learn, Pandas.

Bonus skills


Experience with MR, data pipelines and ETL in the various clouds (AWS, GCP, Azure), e.g. DataProc, EMR, Spark, Hadoop.
Experience with cloud-based deployment of ML models, e.g. SageMaker, GCP AI Platform, Azure ML service
Experience with edge-based ML inference
Experience with ML parallelism, MPI, e.g. Horovod, Tensorflow parallelized training
Working in containerized environments, e.g. Docker, Kubernetes
Experience with relevant visualization libraries, e.g. matplotlib, Seaborn, Bokeh, Plotly
Experience in computer vision or language processing algorithm development.

Working at Tulip

We are building a strong, diverse team that values hard work, families, and personal wellbeing. Benefits of working with us include:


Direct impact on product and culture
Company equity
Competitive benefits package including Health, Dental, Vision, HRA, Commuter, and 401k
Flexible work schedule and unlimited vacation policy
Fully stocked office kitchen with weekly meals and beer on tap
Company outings and happy hours
Fitness subsidies
Dog-friendly office

We are an equal opportunity employer and value diversity at our company. We do not discriminate on the basis of race, religion, color, national origin, gender, sexual orientation, age, marital status, veteran status, or disability status. Even if you don't check every box, but see yourself contributing, please apply. Help us build an inclusive community that will transform manufacturing."
15,Machine Learning Engineer,"Cambridge, MA 02138",Cambridge,MA,02138,None Found,None Found,None Found,None Found,None Found,None Found,"Meet CarGurus—the #1 visited online car shopping website in the US. At CarGurus, we're building the world's most trusted and transparent automotive marketplace where it's easy to find great deals from top-rated dealers.

Founded in 2006 by Langley Steinert (co-founder of TripAdvisor), CarGurus is a technology company with a passion for data and its power to simplify every aspect of the car shopping experience. Using proprietary technology, search algorithms and innovative data analytics, we provide unbiased validation on pricing, dealer reputation and vehicle history.

We're looking for a thoughtful, technical and deeply collaborative Machine Learning Engineer to work with our growing Analytics Engineering team! This position will provide foundational framework for the Data Science team. This includes building the infrastructure to allow the team to ""publish"" models into production, developing Python libraries to facilitate feature generation, and providing the data science team with product-based datasets to train their models.

What you'll do:

Collaborate with Data Scientists, Emerging Product Engineers, and Analysts
Be the interface between the data warehouse and the data science team, using transformation frameworks to automate dataset generation
Help Data Scientists optimize, monitor, and deploy their models
Build, maintain, and upgrade a platform for running machine learning models
Develop APIs to serve model predictions in real time and at scale
Learn the business inside and out, interfacing with domain knowledge experts
Participate in creating the team's roadmap, providing feedback on priority and business value.

Who You Are:

3+ years experience as a data engineer, machine learning engineer, or a software engineer with a passion for data.
Team player who thrives in a collaborative environment.
Self-starter, willing to jump in and learn something new to execute on a task.
Experienced in SQL, with ability to optimize database and query performance.
A natural detective, with a keen interest in solving business problems with data driven methods.
Deeply focused on delivering value to stakeholders, with a data-as-a-product mindset.
Passionate about creating production grade systems and data quality, supporting what you build.
Familiarity with cloud computing and architectures.
Exposure and experience with machine learning is a plus.

Technologies we use:
Airflow, AWS, Docker, Snowflake, Python, Spark, Kafka, Prometheus, Snowplow

CarGurus Culture:
At the core of our company culture is a spirit of innovation, curiosity and collaboration. True to our start-up roots, we're nimble, flexible and hardworking. We have a great respect for testing and learning and a healthy aversion to scheduling meetings to discuss meetings. Lunch is catered daily. Gym membership is free. Foosball and ping pong are played often. Now a publicly-traded company, we're as committed as ever to cultivating the culture that got us here.

In addition to the US, CarGurus operates sites in Canada, the UK and Germany with other markets on the horizon. Our offices are located in Cambridge, MA, Detroit, MI and Dublin, Ireland. If you'd like to learn more, please visit our careers page ( https://careers.cargurus.com/ )."
16,Machine Learning Engineer,"Newton, MA",Newton,MA,None Found,None Found,None Found,None Found,None Found,None Found,None Found,"About the Machine Learning Engineer position
You are a strong software engineer with either past experience with machine learning and broader artificial intelligence techniques, or a deep desire to expand into Analytics and Data Science. You thoughtfully develop beautiful code and are looking to work with other exceptional engineers, data scientists, and a tech-focused management team in a fast-paced startup environment. You can't help shake the idea that artificial intelligence, machine learning, deep learning, and similar concepts are poised to change the world - and you want to be part of the action.
Machine Learning Engineer Responsiblities
Work closely with Data Engineers and Data Scientists to create analytical variables, metrics, and models
Organize full lifecycle software development to solve difficult engineering and machine learning problems
Write well designed, testable, efficient code
Choose and use the right analytical libraries, programming languages, and frameworks for each task
Organize documentation and maintenance of software functionality
Integrate software components into a fully functional software system
Machine Learning Engineer Requirements
2+ years experience of working on a Computer Software Engineer or Software Developer position
Proven knowledge of object-oriented programming
Knowledge of at least one scripting language e.g. Python, Perl, R, etc
Knowledge of statistics, machine learning, NLP and data analytics techniques
Knowledge of Big Data solutions (e.g. Spark, Hadoop, MapReduce) is desirable, but not essential
Commercial/Enterprise application of data science work is desirable, but not essential
BS degree in Computer Science or Engineering"
17,"Senior Machine Learning Engineer, Core Modeling","Boston, MA",Boston,MA,None Found,None Found,None Found,None Found,None Found,None Found,None Found,"-----------
Job Summary
-----------

As a Machine Learning Engineer on our Core Modeling team, you will work on DataRobot's machine learning platform and actively contribute to the development of our state-of-the-art preprocessing and modeling capabilities.

Core Modeling owns the entire data science backend for DataRobot, and is responsible for making sure our models and modeling automation are the best in the world.

We are looking for talented people with excellent engineering skills and deep knowledge of machine learning who can analyze problems, design unprecedented solutions, and implement them for real-world use on top of our platform.

DataRobot is based around delivering best-in-class AI solutions, and this position provides the opportunity to build the key machine learning components of our system.

----------------
Responsibilities
----------------


Automate machine learning processes
Design and build machine learning models for accuracy and scalability
Integrate machine learning algorithms with other applications and services

-----------------
Main Requirements
-----------------


Recommended background: 5+ years of combined Python engineering and machine learning experience
Experience writing maintainable, testable, production-grade Python code
Understanding of different machine learning algorithm families and their tradeoffs (linear, tree-based, kernel-based, neural networks, unsupervised algorithms, etc.)
Good command of scientific Python toolkit (numpy, scipy, pandas, scikit-learn)
Understanding of time, RAM, and I/O scalability aspects of data science applications (e.g. CPU and GPU acceleration, operations on sparse arrays, model serialization and caching)
Software design and peer code review skills
Experience with automated testing and test-driven development in Python
Experience with Git + GitHub
Comfortable with Linux-based operating systems

--------------
Desired Skills
--------------


Experience with large-scale machine learning (100GB+ datasets)
Experience with deep learning libraries and frameworks (TensorFlow, Keras, PyTorch etc.)
Competitive machine learning experience (e.g. Kaggle)
Previous experience of deploying and maintaining machine learning models in production

"
18,Machine Learning Engineer,"Boston, MA",Boston,MA,None Found,None Found,None Found,None Found,None Found,None Found,None Found,"Are you a software engineer interested in pursuing a career in machine learning? Do you enjoy collaborating with other bright, talented individuals to solve complex problems? If so, read on! At TrueMotion, we're passionate about making the world a safer place, by helping to eliminate distracted driving. We do this by using the smartphone as a sensor and machine learning to turn phone data into driving data. This is a unique opportunity to create a massive impact in our business and technology, while helping people become safer drivers. We're looking for a bright & talented software engineer with a keen interest in Machine Learning to join our Data Science team. As our first machine learning engineer, you'll be collaborating with senior members of our Data Science, Platform, and Mobile teams to solve complex, challenging problems using your intellect, skills and the latest and greatest technologies!

You will:

Advise the Data Science team on optimizing our use of Databricks, Spark, and AWS services for building machine learning models at scale
Collaborate with our platform and mobile teams to deploy machine learning models on both iOS and Android devices
Improve data ETL pipelines, design and manage databases that support research and development, support testing of machine learning models for product releases, and own the software frameworks we use to deploy our models in production
Own the software frameworks we use to deploy production models, design and manage databases supporting research & development and support testing of learning models for production releases
Improve data ETL pipelines by scaling, building and maintaining secure backend code using unit testing, automation and continuous delivery
Design and create tooling to improve the efficiency of feature engineering, model training and validation
Build scalable machine learning infrastructure that allows your Data Science teammates to deliver new models faster
Build infrastructure to monitor the performance of machine learning models at scale, including models deployed on mobile devices
Stay up to date on the latest Machine Learning and mobile application trends and provide recommendations on solutions addressing scaling, cost and performance challenges
Help lay out the architecture for mobile, backend and research domains

You have:

2+ years in backend engineering and an interest in Machine Learning
Knowledge of Big Data infrastructure and networking software, e.g. Databricks, Spark, S3
Knowledge of software development process, and ability to code in scripting languages for data manipulation e.g. Python, Pandas, NumPy, scikit-learn and SQL
Design and document systems, including writing and reviewing code, to automate away problems within your squad's domain
Good coding skills in at least one programming language, and a desire to pick up more. We work primarily in Python, with smatterings of shell scripting
Understanding of AWS services
Experience with Linux
Database (RDBMS & NoSql) schema design

Pluses:

Experience with Machine Learning
Experience using EC2, Lambda, Dynamo, RDS (PostgreS), S3, Kinesis
Experience with Docker, NGiИX, PostgreSQL, Consul and/or Cassandra.
Experience building scalable data processing systems for production environment.
Experience with deep learning frameworks e.g. TensorFlow, Keras, Torch, Caffe, for data networking, visualization and performance
Ability to navigate code, request data from data sources and code for bug fixes.
Actively seeks feedback and resolve discrepancies with senior team members.

Compensation:

Competitive salary based on experience
Stock options
Comprehensive benefits (Medical, Dental, Vision, 401k)
Flexible Paid Time Off

Additional Perks:

Feel great working to solve a serious problem (distracted driving)
Touch your toes thanks to our daily post stand-up meeting team stretch
Burn some calories during our optional weekly fun-run around the Boston waterfront
Get to really know your coworkers over a drink and snacks every Thursday afternoon
Have fun at our frequent team outings, where we go to Red Sox games, volunteer to clean-up the Esplanade, etc.

Why TrueMotion?

At TrueMotion we build solutions that make driving safer, lower cost, and more fun. We use the smartphone as a sensor and machine learning to turn phone data into driving data. We believe distracted driving is a solvable problem and partner with insurance companies and other relevant organizations to drive change (pun intended). We are a band of entrepreneurs dedicated to our mission and having fun at our office on Fort Point Channel!

TrueMotion is backed by General Catalyst, Bain Capital Ventures and Lakestar. We are an equal opportunity employer and value diversity. We do not discriminate on the basis of race, religion, color, national origin, gender, sexual orientation, age, marital status, veteran status, or disability status.

Note: local candidates are highly preferred for this role."
