,Title,Location,City,State,Zip,Country,Qualifications,Skills,Responsibilities,Education,Requirement,FullDescriptions
66,IT System Administrator I,"Auburn, WA 98002",Auburn,WA,98002,None Found,None Found,None Found,None Found,None Found,None Found,"JOB TITLE: IT System Administrator I
GAMING LICENSE REQUIRED: Class III A
GRADE: 16
STATUS: Hourly, Non-Exempt
SYSTEM TITLE: IT System Administrator I
POSITION REPORTS TO: IT System Administrator IV

JOB SUMMARY: The IT System Administrator I is responsible for performing highly complex technical and analytical work in the design, installation, documentation, support and maintenance of casino-wide applications and networks. Also provides guidance to applications personnel in the use of systems software, linkage to application programs, servers, and networks. Work is performed independently and reviewed through observation, conferences and results achieved.

ESSENTIAL DUTIES AND RESPONSIBILITIES: The statements describe the general nature and level of work only. They are not an exhaustive list of all required responsibilities, duties, and skills. Other duties may be added, or this description may be amended, at any time.
1. Practice, support and promote the Mission, Vision and Values of Muckleshoot Casino.
2. Provide overall technical responsibility for network applications, with in-depth knowledge of a wide variety of communications hardware and software.
3. Design, install, maintain, and document infrastructure of servers.
4. Administer the testing and analysis of all components of networked facilities to ensure the operation status of the servers systems.
5. Responsible for and supports a variety of Casino applications. Provides site design and client support. May include messaging system and Microsoft operating and other related systems.
6. Analyze systems or applications testing and production problems; take corrective action to reduce system failure; implement system or application software and modifications efficiently.
7. Test new or modified software; analyzes test results.
8. Maintain applications software and computer equipment; apply knowledge, as applicable, in making recommendations to management and/or users of new systems or modifications to existing systems. Provide or assures that technical guidance and resources are available to team members when necessary.
9. Research, evaluate, and recommend changes in hardware, software, data communications, and techniques that contribute to more effective automated system capabilities.
10. Develop and administer disaster recovery systems and procedures.
11. Interact and coordinate with users and vendors to foster a satisfying guest service relationship; proactively identifies technical issues/problems that could negatively impact business operations; develops and proposes a variety of solutions and options; assists users in selecting the most effective course of action.
12. Obtain training on ongoing technical updates in industry as related to current and determined future technologies and systems.
13. Create, maintain and facilitate a positive work environment
14. Smile and engage Guests and Team Members with a positive professional demeanor
15. Performs other duties as assigned.

LICENSES OR CERTIFICATIONS (required / preferred):
Microsoft Technology Associate Windows Server Administration Fundamental required.Microsoft Technology Associate Networking Fundamentals required.Microsoft Technology Associate Database Fundamentals required.Microsoft Technology Associate Security Fundamentals required.Microsoft Certified Solutions Associate - MCSA preferred.

EDUCATION, EXPERIENCE AND TRAINING FOR POSITION (required / preferred):
High school diploma or GED equivalent required.Two (2) years IT experience required.Associate Degree in Computer Science or related field preferred.Experience with corporate level applications such as SharePoint, Microsoft Operation Manager, Systems Management Server, Windows Server Update Services, ISA, IIS and SQL servers preferred.

SPECIFIC SKILLS/KNOWLEDGE/ABILITIES REQUIRED FOR POSITION:
Exhibit excellent troubleshooting and problem-solving skills.Exhibit expert Active Directory skills, specifically working with OUs, GPOs, server scripts and security.Demonstrate ability to diagnose and resolve complex server operating system problems using various tools and techniques.Demonstrate knowledge of backup and disaster recovery strategies.Demonstrate ability to manage multiple tasks independently with minimal supervision.Exhibit strong end user support and training skills.Exhibit strong written skills for documenting technical system and procedures.Exhibit effective interpersonal skills when interacting with various levels of personnel. Read, write and speak English fluently.Demonstrate ability to verbally explain highly technical concepts to technical and non-technical audiences.Demonstrate ability to work any shift.Utilize portable radio or cell phone to stay in contact during shift for the Department.

JOB DEMANDS
PHYSICAL
The physical demands described here are representative of those that must be met by a team member to successfully perform essential functions of this job. Shift work, holidays, weekends, or nights may be assigned.

Ability to maneuver in all areas of casino, ascent/descent from stairs, frequent standing, walking, sitting, reaching, stooping, kneeling or crouching, and/or prolonged periods of time focusing on tasks. Ability to lift 50 lbs. May regularly need to lift/ move, push or pull up material or boxes necessary to the job function, with or without assistance.

Specific vision ability includes close vision, distance vision, color vision, peripheral vision, and depth perception. Visual acuity to discern and examine text, graphics, color and symmetry. Speech to communicate clearly, express ideas and convey information in an understandable manner. Ability to hear for listening comprehension and to understand ideas presented through spoken words and sentences. Manual dexterity to operate office or required equipment and examine or update documents, records, data, instructions, logs, and files.
MENTAL Social perceptiveness to assess and understand other's reactions and behavior. Critical thinking to use logic and reasoning, reach conclusions/solutions. Comprehension in assessing, analyzing, and processing alpha, numeric, and visual data and completing required tasks or documents accurately. Ability to tolerate stress and conduct tasks under critical deadlines. Ability to concentrate on task over a period of time without being distracted.
WORK ENVIRONMENT The work environment characteristics described here are representative of those a team member encounters while performing functions of his/her job and in areas monitored by security or surveillance cameras. Work in casino operations and/or internal or external environments occasionally. Exposure to second hand smoke, moderate to high noise level, bright lights, fluctuating temperatures/weather conditions.
This list of minimum essential functions is illustrative of the minimums ONLY, and is not a comprehensive listing of all functions and tasks performed by positions in this class. It does not imply that all positions within the class perform all of the duties listed as the maximum expectation, nor does it necessarily list all possible duties that may be assigned.Success in this position will require ongoing knowledge and application of Company driven performance indicators that include but are not limited to interpersonal and communication skills, change leadership and teamwork, customer service and satisfaction, attendance and punctuality, integrity and dependability.All duties shall be performed in accordance with Muckleshoot Casino's policies & procedures, internal control standards, and organizational objectives.Reasonable accommodations may be made to enable individuals with disabilities to perform the essential functions."
67,Administrator (Contract Specialist) – 3rd Party Systems and Services,"Seattle, WA 98104",Seattle,WA,98104,None Found,"Candidates must demonstrate leadership qualities and have the ability to work with multiple functions and management levels.
Experienced in software licensing and professional services contracts, standardized procurement processes and negotiations, changes to statements of work, including the review of Supplier service levels and costs to ensure alignment with contract terms.
Some experience with improving and streamlining procurement processes.",None Found,None Found,None Found,None Found,"Company Description
“We’re not in the shipping business; we’re in the information business” -Peter Rose, Expeditors Founder
Global supply chain management is what we do, but at the heart of Expeditors you will find professionalism, leadership, and a friendly environment, all of which foster an innovative, customer service-based approach to logistics.
17,000 trained professionals
300+ locations worldwide
Fortune 500
Globally unified systems
Job Description
Negotiating the best terms for IT products and services is a key enabler towards the success of Expeditors strategy. Come be a part of our IS Sourcing and Provider Management Team, round out your leadership experience, and broaden your knowledge about all aspects of Expeditors’ IS team.
As a key enabler of Expeditors global logistics solutions, 3rd Party Systems and Services (3PSS) supports our IS teams’ needs by strategically sourcing third party products and services. 3PSS partners with IS teams to plan procurement strategy, organize and manage the procurement process, and execute on a successful implementation to achieve the objectives of the Company.
Be a part of the team that is driving a more strategic and systematic approach to achieving and sustaining world-class sourcing and provider management.
A willingness to learn, ability to successfully communicate with technical and business representatives as well as external suppliers and a positive and flexible customer service-oriented attitude are essential traits for being successful in this position.
Responsibilities include:
For selected projects: leads teams of individuals representing departments through the stages of the source selection process, culminating in a team recommendation to Executive Mgmt.
Build a productive business network by establishing relationships within and outside the department.
Lead, participate and support the goals established by the 3PSS team and IS organization.
Influence attainment of goals by providing counsel to other groups involved in acquiring goods & services.
Assist in the development of and maintenance of a supplier database which contain supplier account profiles, including business history with Expeditors, key competencies, contract terms and list of key contacts.
Lead / Support the development of procurement related management reporting.
Act as a liaison with business partners (Business Owners, Tax, Legal and Executives) on Agreements and special projects impacting information needs, data, systems, contracts, policies, and procedures.
Support the communication of department guidelines, initiatives, and achievements through presentations and status reporting.
Participate in defining the organizational infrastructure to deliver in accordance with service expectations.
Qualifications
Minimum Qualifications:
Candidates must demonstrate leadership qualities and have the ability to work with multiple functions and management levels.
Experienced in software licensing and professional services contracts, standardized procurement processes and negotiations, changes to statements of work, including the review of Supplier service levels and costs to ensure alignment with contract terms.
Some experience with improving and streamlining procurement processes.
Desired Qualifications:
Have experience with defining and improving acquisition strategies and overall procurement processes – i.e. Develop a category, or provider specific procurement strategy aimed at lowering overall costs and improving customer service levels through provider consolidation, B2B implementation, new pricing models and/or recommended tools / procurement process improvements.
Experienced in participating to define procurement related business plans, process methodology and service offerings.
Experienced with Supplier scorecards and defining key performance indicators, including Supplier cost, quality, delivery, customer service and innovation and strategy.
Additional Information
Expeditors offers excellent benefits
Paid Vacation, Holiday, Sick Time
Health Plan: Medical, Prescription Drug, Dental and Vision
Life and Long Term Disability Insurance
401(k) Retirement Savings Plan (US only)
Employee Stock Purchase Plan
Training and Personnel Development Program
All your information will be kept confidential according to EEO guidelines.
Successful candidates must pass a background check."
68,"Senior Systems Engineer, Gitlab","Seattle, WA 98107",Seattle,WA,98107,None Found,None Found,None Found,None Found,None Found,None Found,"What you'll be doing...
The Senior Systems Engineer’s responsibilities will be to support and maintain Tableau’s on-premise Gitlab application and infrastructure. In this role, you will support High-Availability infrastructure, Infrastructure running on VMWare with Pure Storage backend with 1500-2000 Gitlab users.
Some of the things you'll be doing include...
Provide architecture guidance for a performant GitLab infrastructure
Troubleshooting performance issues with the Gitlab infrastructure and application
Troubleshoot and support postgreSQL database
Support Tableau users via email, tickets and slack channel
Scripting/Automation against the Gitlab infrastructure
Support Linux operating system
Work on tickets reported by internal customers
Work hand in hand with Tableau teams to design and provide infrastructure to meet their objectives
Participate in on call rotation
Who you are…
Educated. BS in Computer Science, similarly technical degree or equivalent directly applicable experience.
Experienced. 7+ years’ of experience working as a system administrator, systems engineer, or server side support position. Experience with enterprise systems, supporting development teams and driving continuous improvements to their support and testing systems.
Tech Strong. Experience with technologies supporting an enterprise scale infrastructure:
Experience with High-Availability infrastructure, infrastructure running on VMWare with PureStorage backend
Strong knowledge of Gitlab permissions model and topics model
Ability to script in different languages and the ability to automate systems management task
Configuration Management (Puppet)
Expertise in system installation, configuration, deployment, and patch managemnet
Familiarity with Linux system installation and base management (Red Hat, CentOS, Ubuntu)
Deep knowledge of networking concepts and common configurations
Ability to outline processes and best practices for new systems
Ability to troubleshoot challenging issues
Strong Communicator. Possess and understanding that central documentation is important to team success. Ability to write for a company-wide audience of all skill levels.
Flexible. Ability to work with a diverse set of technologies and issues.
Skilled problem solver . You love tackling the most difficult of challenges and know how to get to the best solution.
You are a Recruiter! Tableau hires company builders and, in this role, you will be asked to be on the constant lookout for the best talent to bring onboard to help us continue to build one of the best companies in the world!
#LI-KD2
Tableau Software is an Equal Opportunity Employer.
Tableau Software is a company on a mission. We help people see and understand their data. After a highly successful IPO in 2013, Tableau has become a market-defining company in the business intelligence industry. Our culture is casual and high-energy. We are passionate about our product and our mission and we are loyal to each other and our company. We value work/life balance, efficiency, simplicity, freakishly friendly customer service, and making a difference in the world!"
69,Senior Database Partner Program Lead,"Seattle, WA",Seattle,WA,None Found,None Found,None Found,None Found,None Found,None Found,None Found,"5+ years experience in a technology-centric company, holding a role related program management, marketing programs, product marketing, or partner developmentExperience developing go-to-market (GTM) strategies and initiativesStrong written and verbal English skillsWilling to travel up to 15% to support partners and internal teams – exact travel dates are typically negotiable and flexible

Would you like to develop and manage core programs that help AWS partners grow their business on AWS database services? Are you passionate about developing partner channel relationships and seeing tangible success as a result of your work? Are you organized, thorough, and energized by the thought of bringing your creativity and business savvy to a collaborative team that’s helping shape the migration strategy for AWS’s most important partners and customers?

The Senior Database Partner Program Lead is responsible for the overall development, rollout, and ongoing improvement of core programs for AWS database partners. AWS database partners build solutions on and help customers implement services like Amazon Aurora, Amazon DynamoDB, and Amazon Redshift. Not a technical role, this position leads the overall messaging and lifecycle management for database partner recruiting, enablement, and go-to-market (GTM) programs.

This role is part of a team (50%/50% women/men) with members in Seattle, Bay Area, Northeast US, and growing. In this role, you will develop and launch scalable programs that enable AWS partners to grow their business on AWS database services; you will collaborate across AWS with business, technical, and product teams to scale, evangelize, and gather feedback on program messaging, effectiveness, and usability. Your creative skills and EQ will be critical to developing straightforward yet meaningful programs that really make a difference to our partners’ and customers’ businesses. You will be surrounded by dedicated business development, technical and marketing resources, so you will be well-supported from every critical aspect.

This role is a unique opportunity grow your career with AWS, the undisputed leader in cloud computing. You will learn from and influence marketing, business development, partner, and product teams. You will have the opportunity to shape the migration strategy for our most important customers by bringing your creativity, marketing savvy, program management skills, and innovation to the table. Importantly, you will also have the opportunity to take a hand in actively nurturing and growing key, strategic relationships with our partner community as they build new and exciting services and offerings for AWS’s millions of global customers.

Amazon provides an array of benefits including paid vacation, PTO, and family leave for both mothers and fathers. While this role is not remote and regular face-to-face time with colleagues, stakeholders, and customers is essential, you will have the flexibility of working from home to support your family and personal goals. This role requires some travel, primarily domestic, to meet with and support partners as well as internal stakeholders, up to 15% (e.g. average 2-3 days per month for meetings, 3-4 days to attend AWS re:Invent, etc). Committed to a healthy work/life balance, most travel dates and times are negotiable and flexible. Our team is committed to equal opportunity employment, actively seeking a broad and diverse pool of applicants and team members. We are also committed to the long-term development of our team members, including training opportunities, mentorship, and career growth both within AWS and across Amazon.com in general.

RESPONSIBILITIES
Use AWS partner and AWS internal feedback to define, launch, and scale programs that help AWS consulting and technology partner grow their business on AWS database servicesWork closely with AWS business and technical teams to develop assets and best practices for partners, e.g. repeatable sales plays and funding packagesBe the focal point within our team for existing and new Amazon Partner Network (APN) programs such as APN Competency Program and APN Service Delivery ProgramDevelop reusable assets, operational guidelines, and rollout/evangelism plans to scale our programs externally and internally (e.g. messaging content, PPT decks, web pages, wiki, videos, playbooks)Establish best practices for reporting program results and effectiveness and report weekly to management

Amazon.com is an Equal opportunity Employer – Minority / Women / Disability / Veteran / Gender Identity / Sexual Orientation.

Pursuant to the San Francisco Fair Chance Ordinance, we will consider for employment qualified applicants with arrest and conviction records.

aws-partners-na
LI-JM5"
