,Title,Location,City,State,Zip,Country,Qualifications,Skills,Responsibilities,Education,Requirement,FullDescriptions
44,Sr Database Engineer,"Tukwila, WA",Tukwila,WA,None Found,None Found,None Found,None Found,None Found,None Found,None Found,"SUMMARY
The Database Administration team members at BECU install, monitor, maintain and performance tune production and non-production databases while ensuring high levels of data availability. We develop, implement and continually review database policies and procedures to ensure the security, integrity and availability of databases and their accompanying applications.
The Senior Database Engineer will evaluate, recommend and implement the latest ideas for security, performance and HA/DR, serve as an escalation point for complex database performance issues and provide support for database related tools like SSRS, SSIS and ASM along with third party tools. This role will also install and configure database software, consult with development teams on SQL and application design for large complex projects and work with the Systems team on major database infrastructure tasks.
RESPONSIBILITIES
Perform all responsibilities in accordance with BECU Competencies and Information Protection requirements.
Build, administer, maintain and support multiple instances of MS SQL Server 2008 thru 2016 and Oracle 12c. Ensure databases are functioning at the highest level to ensure BECU applications availability.
Establish BECU database backup, data replication and HA/DR procedures using the latest approved technology and keep them updated. Ensure production databases are adequately built and tested to meet RTO and RPO requirements in the event of a disaster. Lead database activities with DR/BC events or tests.
Troubleshoot and resolve escalated high complexity database monitoring and tuning issues. Lead a cross-team database performance management and tuning group for BECU's Production databases.
Lead escalated Tier 3 (high) database issues/needs through to resolution completion. Ensure quality RCAs as needed, and that RCA remediation tasks are completed.
Creates written procedures for advanced topics and contributes to other areas development of written procedures. Ensure all database team core documentation is maintained.
Independently work on large enterprise or infrastructure projects, or highly complex projects, that support key applications.
Develop scripts for complex database monitoring and to automate routine tasks using scripting languages like PowerShell.
Perform additional duties as may be assigned.
QUALIFICATIONS
Bachelor’s degree in Computer Science or related discipline required, or equivalent work or educational experience. Master’s degree preferred.
Minimum 7 years of related experience required.
Knowledge of Database Operating Systems – Windows (required) and Linux (preferred).
Experience with SQL Server 2008 – 2016 both on premise and hosted in Azure or other cloud provider required.
Experience with Oracle12c preferred.
Proficient with SQL DML & DDL, T-SQL PL/SQL.
Ability to troubleshoot database issues from code to hardware.
Experience with related tools such as SSAS, SSIS, SSRS, OEM, ASM and others preferred.
Experience with hardware, storage, RAID, and disk subsystems technologies as they pertain to DBMS systems preferred.
Knowledge of scripting languages including Powershell, Perl and Bash shell scripting.
Experience with Microsoft Enterprise technologies including Visual Studio, TFS, Systems Center preferred.
General knowledge in the following areas preferred: IT concepts, strategies, and methodologies, architectures and technical standards, database administration tools and utilities, application architectures and design principles, infrastructure architectures, backup and recovery, storage subsystems, and replication concepts.
Occasional travel required.
Be available on an on-call basis to respond to pending issues or problems arising during non-business hours and provide support and response.
Proficient verbal and written skills to effectively communicate in the English language.
EEO Statement:

BECU is an equal opportunity employer. All qualified applicants will receive consideration for employment without regard to race, color, religion, sex, national origin, veteran status, disability, sexual orientation, gender identity, or any other protected status."
45,Database Administrator 2-IT,"Seattle, WA",Seattle,WA,None Found,None Found,"Provide all activities related to the administration of a massively scaled Oracle database fleet
Project long-range requirements for database administration and design in conjunction with other service owners in the Oracle Cloud ecosystem
Conduct quality control and auditing of databases to ensure accurate and appropriate use of data
Designs, implements and maintains complex databases, access methods, access time, devise allocation, validation checks, organization, protection and security

Qualifications include:

Possess knowledge of performing detailed performance analysis, tuning and diagnostics for Oracle 12c Databases
Possess leadership experience to assure appropriate changes, upgrades, and enhancements are made based on the technical analysis
Bachelor's degree in Computer Science or related field work
Eight or more years of experience in Oracle Database Administration
Deep understanding and expertise in database management features
Excellent problem solving, critical thinking, and communication skills
Ability to work in an extremely fast paced and challenging environment
Excellent command of written and spoken English
",None Found,None Found,None Found,None Found,"Database Administrator 2-IT-190015HX


Preferred Qualifications

The Oracle Cloud Infrastructure (OCI) team can provide you the opportunity to build and operate a suite of massive scale, integrated cloud services in a broadly distributed, multi-tenant cloud environment. OCI is committed to providing the best in cloud products that meet the needs of our customers who are tackling some of the world’s biggest challenges.
We offer unique opportunities for smart, hands-on engineers with the expertise and passion to solve difficult problems in distributed highly available services and virtualized infrastructure. At every level, our engineers have a significant technical and business impact designing and building innovative new systems to power our customer’s business critical applications.

Become an integral part of Oracle’s Cloud Infrastructure - IaaS growth and adoption. We are aggressively building high scale public cloud technologies from the ground up ( Compute, Storage, Networking, Governance, Database, and Load Balancing Services ). If you’re a database engineer with expertise and passion in solving difficult problems for highly available services at massive scale, we are currently seeking Oracle Database Administration Specialists. Help us build the bedrock for the Enterprise Class Cloud of the future!

Responsibilities include, but are not limited to:

Provide all activities related to the administration of a massively scaled Oracle database fleet
Project long-range requirements for database administration and design in conjunction with other service owners in the Oracle Cloud ecosystem
Conduct quality control and auditing of databases to ensure accurate and appropriate use of data
Designs, implements and maintains complex databases, access methods, access time, devise allocation, validation checks, organization, protection and security

Qualifications include:

Possess knowledge of performing detailed performance analysis, tuning and diagnostics for Oracle 12c Databases
Possess leadership experience to assure appropriate changes, upgrades, and enhancements are made based on the technical analysis
Bachelor's degree in Computer Science or related field work
Eight or more years of experience in Oracle Database Administration
Deep understanding and expertise in database management features
Excellent problem solving, critical thinking, and communication skills
Ability to work in an extremely fast paced and challenging environment
Excellent command of written and spoken English

More information about our organization, Oracle Cloud can be found here: https://cloud.oracle.com/

Detailed Description and Job Requirements

Work with a world class team to provide enterprise-wide, Oracle Database Administration support for production systems and provide DBA services to application development teams, including database design, database generation, coding, and database production support. Provide DBA support with a high degree of customer service, technical expertise, and timeliness. Provide accurate and creative solutions to user problems of moderate nature to ensure user productivity.

Provide Development and Production support for databases. This includes creating primary database storage structures; designing and creating primary objects; modifying database structure as necessary for enhancements or performance; monitoring and optimizing performance of the database; planning for backup and recovery of the database; allocating system storage and planning future storage needs; and creating database-related scripts and programs to support development and production environments.

Duties and tasks are standard with some variation. Completes own role largely independently within defined policies and procedures. 3 years of experience supporting relational databases as a DBA, with multiple distributed relational DBSM*s or a depth and focus in Oracle and related tools. Exposure and practice at using the DBMS to optimize performance of large databases for enterprise use is preferred. Experience with an organization with a key 24 X 7 reliance on its database is desirable. BS or equivalent desired.

Oracle is an Affirmative Action-Equal Employment Opportunity Employer. All qualified applicants will receive consideration for employment without regard to race, color, religion, sex, national origin, sexual orientation, gender identity, disability, protected veterans status, age, or any other characteristic protected by law."
46,Telecom Application Engineer,"Seattle, WA",Seattle,WA,None Found,None Found,None Found,None Found,None Found,None Found,None Found,"Job Description

We are seeking an Applications Engineer with experience with AS400 (COBOL/RPG) for a contract-to-hire opportunity in Seattle, WA. In this role you will be a prime administrator and operator of all the specific applications that are used in IT for Billing, Finance, and ERP. The engineer is expected to be on a 24/7 on call rotation along with the other members of the team as to ensure 5-9’s (99.999%) uptime for any and all applications. The engineer needs to be extremely knowledgeable about the inner workings of all the applications they are prime, as well as communicating that knowledge to the other team members of the applications team. The candidate is expected to communicate closely with the development teams as well as the server admins to ensure that applications are functional, usable, and reliable for use by the entire company.
Job Duties
Maintain and operate applications that are classified as Billing, Financial and ERP applications
Communicate issues to vendors for out of the box applications and form a functional plan on implementing fixes and troubleshooting the application
Document and inventory the status quo of integrated applications including external system calls of applications
Become a subject matter expert (SME) on Billing, Financial and ERP applications
Write “how to” documentation for operating and administering applications
Ensure that security requirements on all Unix / Linux servers are being adhered to
Communicate changes and recommendations to improve efficiency in applications and systems
Create MOPs and execute changes within the production environments
Identify dependencies between applications and OS level packages as well as troubleshoot problems with those interconnections
Work with cross functional groups and organizations to develop tools and solutions from use cases and requirement documents
Performs other duties as required to support the business and evolving organization
Mentor and train lower tier engineers to increase their technical ability and experience

Qualifications

At least 3+ years of engineering and application experience working with development teams and system admin teams
At least 3+ years working in a large, geographically distributed server architecture
At least 3+ years of experience working with development teams for functional requirements on distributed server systems running internally developed applications
At least 3+ years of experience working for large telecommunications companies
At least 3+ years of networking experience with focus on server interconnections
Bachelor’s degree in computer science or similar field
Ability to travel up to 50% at times
Ability to be on call in a 24/7 server environment
Experience in doing large scale software upgrades and versioning changes across multiple servers
Experience running applications for one or more of the following applications:
Infinium, Netsuite, HRS systems, CABS (Carrier Access Billing Systems), Globys,
middleware solutions like Tibco, and Mulesoft
Database technologies Mongo DB, Cassandra DB, Oracle databases, and SQL.
Data warehouse knowledge, along with Enterprise Reporting systems like Tableau, Spotfire, etc.
Other technologies, Syslog, Apache, Tomcat, Perl, HTML 5 including development languages for AS400 applications (COBOL, RPG, Java), or experience with DPI.
Additional Information

This contract-to-hire role can sit in Seattle, WA or Allen, TX. There may be some travel between the two areas."
47,Database Admin III,"Seattle, WA",Seattle,WA,None Found,None Found,None Found,None Found,None Found,None Found,None Found,"Bachelor’s Degree in Computer Science or a related field, and/or relevant work experience5+ years of Database Administration and Design experience with administering and supporting multiple Microsoft SQL databases for performance critical, highly available systems (purging logs, recreating indexes, data consistency, etc.).Experience in MySQL , architecture, configuration, and administration.Experience with data modeling and conducting performance tuning, backup/recovery, and scalability/capacity planning.Excellent troubleshooting and problem-solving abilitiesExcellent SQL and DB performance tuning skillsExperience with MYSQL security, authentication, tuning, DB direct access, T-SQL development, and T-SQL supportExperience developing, managing, and monitoring stored procedures.Experience with data extraction, transformation, and loading (ETL)Experience with bespoke/ad hoc MYSQL data manipulation and scriptingExperience with API calls (JSON & REST)Experience with data driven vendor/third party applications

Amazon Web Services (AWS) is a dynamic and rapidly growing business within Amazon.com. AWS identity team has been strategic to amazon from the early years. We are pioneers in areas such as identity, security and providing fundamental platform capabilities to all of AWS services. AWS identity team enables our customers to control and secure the most sensitive data on the internet.

We are looking for a talented Database engineers who are passionate about taking hard problems head on and creating simple, scalable, maintainable DB solutions. As a tier zero service we will be raising the bar on resilience and scalability. We’re looking for top DBE to design, evangelize and implement state of the art DB solutions for never before solved problems. The DBE will perform administration and engineering for multiple production databases, and will be responsible for fast-paced, complex distributed database environments globally. You will be responsible for designing and building redundant enterprise level solutions as well as maintaining existing systems. This position will be able to rapidly troubleshoot complex technical problems under pressure while implementing solutions that are massively scalable.

Masters in Computer Science or related degree (Computer Engineering, Electrical Engineering, etc.)Advanced knowledge of other database products such as MYSQL, DynamoDB, and Postgres.Demonstrated skill and passion for operational excellence.Excellent communication skills, the ability to work well in a team, strong customer focus, and ownershipAble to create and collaborate with others on the creation and maintenance of technical documentation.Experience in creating automation tools for managing relational databases.Detailed understanding & experience of Microsoft operating systems."
48,Database Administrator,"Bellevue, WA 98005",Bellevue,WA,98005,None Found,None Found,None Found,None Found,None Found,None Found,"Database Administrator
Healthcare Management Administrators - Bellevue, WA
We are looking for a talented Database Administrator that is ready to make a difference and help us continue Proving What's Possible in Healthcare®!
For over 30 years, HMA has been helping Pacific Northwest-based employers administer their own health plans. We believe that good healthcare should improve health, so we support companies in taking better care of their people by taking better care of them. Now is an excellent time to join HMA as our employees are combining purpose, passion, and experience in new and innovative ways to stay ahead of the healthcare curve. We offer competitive pay, comprehensive benefits, professional development opportunities and an entrepreneurial, collaborative, and fun team environment.
How YOU will make a Difference:
The Database Administrator’s role is to design, install, monitor, maintain, and performance-tune production databases while ensuring high levels of data availability. This individual is also responsible for developing, implementing, and overseeing database policies and procedures to ensure the integrity and availability of databases and their accompanying software.
What YOU will do:
Work with application development and Infrastructure staff to develop database architectures, storage, coding standards and quality assurance policies and procedures
Assist with design and implementation of redundant database and storage systems, policies, and procedures for disaster recovery and data archiving to ensure effective protection and integrity of data assets
Conduct research and make recommendations on database products, services, protocols, and standards in support of procurement and development efforts
Create models for new database development and/or changes to existing ones
Respond to and resolve database access and performance issues
Monitor database system details within the database, including stored procedures and execution time, and implement efficiency improvements
Plan and coordinate data migrations between systems
Develop, implement, and maintain change control and testing processes for modifications to databases
Create, or support creation of, required reports in response to business user needs
Perform database transaction and security audits
Establish appropriate end-user database access control levels
Develop routines for end users to facilitate best practices database use
Manage and/or provide guidance to junior members of the team
Develop automated routines to replace manual processes
Knowledge, Experience, and Key Attributes needed for Success:
College diploma or university degree in the field of computer science and/or 5 years’ equivalent work experience
Strong understanding of database structures, theories, principles, and practices
Working technical experience with designing, building, installing, configuring and supporting database servers, especially MS SQL Server. Experience with No-SQL databases like MongoDB, highly preferred
Hands-on database tuning and troubleshooting experience
Experience with data processing flowcharting techniques
Knowledge of applicable data privacy practices and laws
Good written and oral communication skills
Strong technical documentation skills
Good interpersonal skills
Ability to conduct research into database issues, standards, and products as required
Ability to present ideas in user-friendly language
Highly self-motivated and directed
Keen attention to detail
Proven analytical and problem-solving abilities
Experience in automating manual processes
Ability to effectively prioritize and execute tasks in a high-pressure environment
Strong customer service orientation
Experience working in a team-oriented, collaborative environment
How we Support your Work, Life, and Wellness Goals
We offer a comprehensive total rewards package including: competitive pay; annual incentive; medical, dental, and vision insurance; 401K retirement plan with match; generous PTO and holidays; an onsite gym facility; a gym subsidy; Life, AD&D, Short-Term and Long-Term Disability Insurances; an Employee Assistance Plan; free parking and easy freeway access to I-405 and I-520; a well-stocked kitchen on-site with subsidized snacks and refreshments; year-round wellness activities; the ability to earn a $500 wellness incentive; monthly events; paid volunteer hours and more!
HMA requires a background screen prior to employment.
Protected Health Information (PHI) Access
Healthcare Management Administrators (HMA) employees may encounter protected health information (PHI) in the regular course of their work. All PHI shall be used and disclosed on a need-to-know-basis and according to HMA’s standard policies and procedures.
HMA is an Equal Opportunity Employer"
