,Title,Location,City,State,Zip,Country,Qualifications,Skills,Responsibilities,Education,Requirement,FullDescriptions
20,Assistant Director for International Education and Study Abroad,"Bremerton, WA 98337",Bremerton,WA,98337,None Found,"
Bachelor's degree from an accredited College or University.
2 years' work experience in international student recruitment, international admissions or a closely related field.
Experience with international students admissions and F, M, and J visas.
Intermediate computer competency, including Microsoft Office applications.",None Found,None Found,None Found,None Found,"Description
The College uses an e-Reference feature which means the references you list on your application will receive an email with a secure link to provide an online reference for you.

Priority consideration date: September 13, 2019, This position will remain opened until filled.

Olympic College seeks an experienced administrator to manage and support International Education. Are you interested in joining a team that is dedicated to student-centered learning, closing achievement gaps, support diversity, and social justice learning opportunities we would love to hear from you?

This position is responsible for program development, international recruitment including building sustainable relationships & partnerships while increasing International Student participation & representation on campus.

The Assistant Director is responsible for the administration of the program including providing information, interpreting rules and regulations, advising students, preparing & issuing I-20's and admission letters, etc. The Assistant Director is also responsible to assist the Associate Dean with departmental planning of goals, objectives and related staffing.

Assist the Associate Dean with department planning of goals and objectives; plan, schedule, train, and work activities of staff as assigned. Represent the Associate Dean in her absence.
Essential Functions
Travel internationally, build relationships and partnerships abroad, recruit students and provide information sessions. Consult with the Associate Dean and execute agreements.
Meet annual international student enrollment targets through recruitment and retention of students.
Participate in a variety of activities including recruitment fairs and visits to individuals, school counselors, secondary schools, embassies, overseas educational advisors, Education USA and the like, locally and internationally.
Develop and produce outreach materials (application materials, web materials, admissions brochures, posters, outreach displays, general program brochures for admission purposes, banners and other pertinent prospective student materials) for international programs.
Liaise with assisting agencies such as the US Department of Commerce, the American Association of Community Colleges (AACC), NAFSA: Association of International Educators, Association of Washington International Student Affairs (AWISA), etc..
Serve as SEVIS Designated School Official (DSO) and issue appropriate documents such as 1-20's.
Monitor students' attendance and credit hour enrollment and grades each quarter to meet the Student and Exchange Visitor Information System (SEVIS) enrollment requirement and the OC academic progress requirements.
Process international student online and paper applications, issue 1-20's and prepare monthly inquiry reports of potential students; conduct follow-up for all electronic and paper-based inquiries and applications.
Monitor the effectiveness of international recruitment and the development of a short- and long-range plan.
Establish strategic agreements and partnerships with international high school and university officials, government agencies, educational organizations and professionals who serve international students.
Lead efforts to leverage the diversity, knowledge, and relationships of the college's existing international student, faculty, staff and alumni population in the development of a broader network to support international recruitment.
Oversee the communication with the accounting department and outside vendors to maintain international student insurance enrollment, make sure payments are up-to-date each quarter, and issue insurance cards for enrolled students.
Provide advising to international students for the Intensive English Program and college-level courses.
Act as an advocate for international student concerns.
Analyze data to achieve international student enrollment goals.
Plan and coordinate the New International Student Orientation each quarter and the yearly International Student Reception; assist with social and cultural events including campus tours for international visitors and quarterly activities.
Assist the International Student Club Advisor with on- and off-campus activities, arranging for necessary safety and first aid, transportation, and permission forms.
Perform related duties as required and/or assigned.
Qualifications
Minimum Qualifications
Bachelor's degree from an accredited College or University.
2 years' work experience in international student recruitment, international admissions or a closely related field.
Experience with international students admissions and F, M, and J visas.
Intermediate computer competency, including Microsoft Office applications.
Preferred Qualifications
Bilingual
Experience with Student and Exchange Visitor Information System (SEVIS) reporting requirements, student tracking, and database management for research and data analysis.
Successful Applicants will be able to:
Demonstrate success in recruiting for international college admissions.
Demonstrate an understanding of the unique needs of international students
Interact successfully with individuals and groups representing a wide range of diverse cultural, geographic, and socioeconomic backgrounds.
Make public presentations related to international student programs.
Demonstrate excellent interpersonal skills to collaborate and build rapport with colleagues, staff, and students as part of an educational team.
Effectively direct the work of others to achieve department goals.
Demonstrate excellent skills with technology such as student management systems, SEVIS database, and office applications.
Prepare written records and reports.
Understand complex oral and written instructions.
Display strong organizational and analytical skills.
Independently prioritize and organize assigned work.
Establish and maintain effective working relationships.
Demonstrate excellent oral and written communication skills.
Possess excellent customer service skills; including building and maintaining internal/external customer satisfaction.
Demonstrate an appreciation of diversity and the benefits of a commitment to cultural awareness and sensitivity in the workplace.
Demonstrate an understanding of and commitment to the Olympic College mission, vision, and values.
Demonstrate ethics, integrity and sound professional judgment
Additional Information
Terms of Employment:
This is a full-time, 12-month exempt professional position contracted on an annual basis. The salary is $62,069.00 annually which will be prorated to reflect the remaining contract days during the fiscal year. The fiscal year runs from July 1 through June 30 annually.

Olympic College provides an excellent benefits package which includes vacation, holiday & sick leave, medical/dental/vision/life insurance.

Flexibility in scheduling is required to meet the needs of the department. Evening and weekend work and travel to satellite campuses and off-campus locations are required for scheduled and unscheduled sessions and events.

Participation in international travel is necessary as requested, up to 12 weeks each year.

Conditions of Employment:
Successful Completion of a criminal history background check. Information from the background check will not necessarily preclude employment but will be considered in determining the applicant's suitability to perform in the position.
Travel
Requires domestic and international travel typically up to 25% of the time. Additional travel may be required as requested.

Application Procedures
 To be considered for this position a candidate must apply online through the Olympic College website and submit the following required materials:
Olympic College Online Application
Resume
Cover Letter- In your cover letter describe your experience with international relations, international student services or your related qualifications and how these set you apart for this position.
Unofficial college transcripts. Official transcripts and copies of mandated certifications will be required of the successful candidate.

All application materials become the property of the College and will not be returned.
For technical support, contact NEOGOV Customer Service at 855-524-5627 between 6 am and 6 pm Pacific Time, Monday-Friday.
Corrected or extended notices for this recruitment will be posted on the Olympic College web site.
Olympic College is an Equal Opportunity Employer and Educator"
21,TECHNOLOGIST AND DIGITAL PRODUCER,"Seattle, WA",Seattle,WA,None Found,None Found,None Found,None Found,None Found,None Found,None Found,"Notes: As a UW employee, you will enjoy generous benefits and work/life programs. For detailed information on Benefits for this position, click here.


Please note that this position has been re-posted. If you have already submitted your application, you need not submit it again, as it has already been received.


As a UW employee, you have a unique opportunity to change lives on our campuses, in our state and around the world. UW employees offer their boundless energy, creative problem solving skills and dedication to build stronger minds and a healthier world.


UW faculty and staff also enjoy outstanding benefits, professional growth opportunities and unique resources in an environment noted for diversity, intellectual excitement, artistic pursuits and natural beauty. All of which has allowed the UW to be nationally recognized as a “Great College to Work For” for four consecutive years.


The University of Washington Tacoma is a growing, urban-serving university that is deeply invested in its local communities. As one of three campuses of a world-class university, UW Tacoma is dedicated to interdisciplinary and innovative teaching and scholarship and to engaging the community in mutually beneficial partnerships. UW Tacoma’s commitment to access and diversity is central to an environment where students, staff, faculty and South Sound residents find abundant opportunities for intellectual, personal and professional growth. More information about UW Tacoma and its strategic plan can be found here.


The Milgard School of Business (MSB) is seeking a Technologist and Digital Producer with a passion for learning, a love for solving exciting information technology & system challenges, a desire to create innovative and effective digital content, and the collaborative nature to support a variety of stakeholders. The Technologist and Digital Producer provides research-based, learner-centered program, project and course support, knowledge object development (e.g. setup software, create tutorials, processes, policies, procedures) and information systems/technology support to the Center for Business Analytics (CBA) programs (Virtual Big Data Analytics Lab using MS Azure, Amazon AWS, Google or IBM Cloud). The role also includes supporting community engagement data analytics projects, applied project showcases, analytics foundation bootcamp, digital badging, CRM solution design, Docusign, and digital (e.g. web, social media, mobile, handout, poster, newsletter, picture & video capture & editing) content design and development support]. The person in this position will report directly to the Director of the CBA, the person in this position will regularly communicate with the Director and the Administrator of the MSB.


Responsibilities include:


VIRTUAL BIG DATA ANALYTICS/SMART DIGITAL TRANSFORMATION LAB DESIGN, DEVELOPMENT & MANAGEMENT


Design, setup and manage CBA's Virtual Big Data Analytics and Smart Digital Transformation Lab in a Cloud Computing Environment (e.g. Microsoft Azure, Amazon AWS, Google Cloud, IBM Cloud);

Develop and support the creation of training materials, promotional materials, technical support, and computer tutorials and guides to support student, faculty and staff learning;

Create design documents that describe business needs, audience needs, high level tasks, delivery content, supporting materials, copyright and evaluations/assessments;

Monitor and maintain computer systems and networks, and necessary licensing agreements;

Provide technical support to the MSBA, undergraduate and professional education students, faculty and business community and respond to their queries in a timely fashion;

Provide technical support to MSBA students;

Set up and/or assist new accounts for student users;

Set up accounts for new staff/faculty users;

Test new information technologies/systems;

Offer regular online training support for students, faculty and staff;

Communicate effectively with students that have various levels of technological skill and assist in their learning of new technologies;

Work with students dealing with complex technology challenges, understanding policy and procedures, complete necessary administrative tasks as necessary.


DIGITAL CONTENT DESIGN AND MANAGEMENT


Work closely with CBA staff, Milgard Information Specialist, UWT Marketing team, and program staff and faculty to develop multiple web content strategies that align with program, MSB and UWT goals;

Collaborate with CBA staff and Milgard Information Specialist to assess digital content and web development needs;

Work alongside the CBA staff and MSB information specialist to create content for various programs on different social media channels;

Plan and execute a content strategy that drives high engagement;

Create content marketing calendar to ensure regular content is posted to website throughout the year;

Write entertaining and informative web search engine optimized content;

Serve as leader for all content to ensure quality, clarity and consistency;

Target keywords set by program leads and bring articles around them;

Collect, monitor and analyze social and website metrics, and make improvements accordingly;

Stay updated on industry trends and adjust the content strategy as needed;

Manage the distribution of content across all channels;

Repurpose content for different mediums including social media and video;

Keep up to date with industry best practice and monitor content activities of competitors;

Update all sections of the website including homepage and all other categories;

Capture, edit and create picture, video and sound content.


MANAGE DAILY OPERATIONS AND ADMINISTRATION


Assist with quality assurance and develop evaluations for CBA Programs;

Administers the CBA's Virtual Big Data Analytics & Smart Digital Transformation Lab;

Work closely with CBA FOUNDATIONS faculty to create LMS platform, and supporting students as needed;

Interface with students, faculty, staff and community concerning Center resources, activities and collaboration possibilities;

Author high-level, engaging course design within the Canvas LMS, and provide high level LMS support to faculty and students;

Manage students cloud usage, and create and maintain protocols for running analytics tools;

Manage part-time resources such as student workers as needed;

Develop status/progress report/project time log and present metrics data on a regular basis (e.g. weekly, monthly, quarterly, annually, etc.);

Manage student group information;

Maintain current knowledge of distance education trends, innovations, research and best practices;

Coordinate online learning related events and training workshops, including event planning, scheduling, promotion, delivery, tweeting/blogging, recording, media archiving, etc.


RESEARCH


Maintain current knowledge of data analytics trends, innovations, software solutions and best practices;

Conduct pilot experiments with faculty and implement new data analytics and digital media solutions;

Present the latest findings related to data analytics practice.


OUTREACH


Represent the Milgard School of Business as a focus for data analytics and smart technology both internally and externally;

Work closely with UW Tacoma and UW Information Technology, eLearning, library and other departments to promote data analytics;

Interface with students, faculty, staff and community concerning Center resources, activities and collaboration possibilities;

Interact with instructional designers from other schools and UW campuses and contribute to the Instructional Design and Faculty Support (IDFS) group among the University of Washington campuses.


Perform other duties and responsibilities as assigned.


Requirements:

Bachelor's degree in Information Systems, Computer Science/Engineering, Design or Related Field

Minimum 3 years of experience in information technology, computer science, computing, engineering, design or closely related field, preferably in a higher education institution.

Demonstrated knowledge of learning and support computer systems, software and emerging data analytics and digital media technologies

Experience with web site design and content editing (e.g. Drupal, Wordpress)

Knowledge of database and data model development, and data collection, storage and analysis, SQL language, decision support systems, business intelligence design & engineering (such a Tableau, Power BI or Cognos).

Experience with cloud computing solutions (e.g. Microsoft Azure, Amazon AWS, Google Cloud, IBM Cloud)

Experience with the use of up-to-date technologies such as web conferencing, video development, lecture capture, web page editors, graphic software, mobile learning and copyright

Excellent written and verbal communication skills, strong project management, needs assessment, time management, organization, ability to multi-task, work independently, detail oriented, networking, adaptable to change, and strong interpersonal skills

Demonstrated ability to work independently and work a flexible schedule with some evening and/or weekend work

Ability to work collaboratively in a dynamic, evolving environment

Experience using computer programs such as MS Office Word, Access, Excel, Power Point, Cloud suite, SQL Database

Must be comfortable with data and have an intermediate level proficiency with computer technology

Must have a technical, logical thought process and excellent problem solving abilities

An ability to prioritize multiple projects and delegate when necessary

Must be precise, thorough and detail-oriented

Ability and eager to learn new technology solutions (especially data analytics solutions)

Ability to facilitate collaboration, support, and buy-in from a variety of stakeholders


Equivalent education/experience will substitute for all minimum qualifications except when there are legal requirements, such as a license/certification/registration.


Desired Qualifications

Master's degree in information technology, computer science or engineering or related field desired

Creative mind with an ability to conceive interesting ideas for new content

Experience with content marketing tactics and leading content marketing campaigns

Proven understanding of tools for teaching, including emerging technologies

Ability to stay abreast of the changing educational technology landscape

Teaching experience is a plus

Familiar with online education solutions

Familiar with professional AV, web and multimedia development production.

Familiar with the usability and accessibility guidelines

Knowledgeable and experienced with appropriate hardware and software used in the creation of digital media including but not limited to MS Office Suite plus Project and Camtasia, Adobe Creative Suite, Visio, Adobe Captivate, Photoshop, web page authoring and social media platforms.


Application Process

Part of the application process for this position includes completing an online cover letter assessment, as well as the Work Authorization Assessment to obtain additional information that will be used in the evaluation process. The assessment(s) will appear on your screen for you to complete as soon as you select ""Apply to this Position"" on this job announcement. Once you begin the assessment, it must be completed at that time. If you select to take it later, it will appear on your ""My Jobs"" page to take when you are ready. Please note that your application will not be reviewed and you will not be considered for this position until the assessment is complete.

Committed to attracting and retaining a diverse staff, the University of Washington will honor your experiences, perspectives and unique identity. Together, our community strives to create and maintain working and learning environments that are inclusive, equitable and welcoming.
The University of Washington is a leader in environmental stewardship & sustainability, and committed to becoming climate neutral.
The University of Washington is an equal opportunity, affirmative action employer. To request disability accommodation in the application process, contact the Disability Services Office at 206-543-6450 / 206-543-6452 (tty) or dso@uw.edu."
22,Oracle Database Administrator,"Seattle, WA",Seattle,WA,None Found,None Found,None Found,None Found,None Found,None Found,None Found,"LIVE THE ISLAND LIFE
Tommy Bahama is more than just an island inspired brand, it’s a lifestyle! Live the Island Life as an ambassador of our brand, representing the season’s stylish trends. We look for those who are passionate about growth as we offer a variety of rewarding positions, from sales to management. You will play an important role in our store leadership, inspiring your team to work together to achieve our goals, create an environment of aloha fun, while exceeding guest expectations - taking them someplace great. Come join us, share knowledge on latest designs and provide guest with world class service!
SET THE COURSE
The Oracle Database Administrator is responsible for the Implementation, Operation, Administration and Maintenance of company’s Oracle databases in the areas of performance, availability, reliability and data integrity.
BE THE ISLAND GUIDE
Implement and maintain company database systems.
Monitor Oracle databases to insure maximum uptime and performance.
Troubleshoot and resolve database issues in a timely manner.
Ensure database licensing and versions are current.
Design, implement, and maintain database backup and recovery routines through RMan.
Develop and Implement custom database queries and reports as needed.
Create new instances of databases and copying databases between environments.
Set database access and security.
Work with systems vendors to resolve database-related issues.
Document database configurations and administrative procedures.
Provide data-related application and network support.
Provide 7X24 emergency support, as needed.
Other duties as required and that may occasionally be necessary to support facilities.
ESSENTIALS FOR LIFE IN PARADISE
Bachelor's degree in Information Technology or related field.
3-5 years experience in design, deployment and administration of Oracle Database environments in Linux server environments, specifically experience with Oracle Database Appliances.
Oracle Certification desired.
Relevant experience with the following Database Systems: Oracle 11gR2, Oracle 12C, RAC, Data Guard
Knowledge of the following Operating Systems: Linux Redhat, Windows, Oracle Database Appliance Operating System
Familiarity with the following: Oracle Database Appliances, RMan, OEM,PLSQL Commands, LDAP, TCP/IP, DHCP, DNS, Cohesity
Solid understanding of enterprise data backup and fail-over technologies.
Ability to work under pressure and complete tasks on time.
Ability to communicate and document technical knowledge in an easy to understand manner.
Mahalo (thank you) for your interest in Tommy Bahama!"
