,Title,Location,City,State,Zip,Country,Qualifications,Skills,Responsibilities,Education,Requirement,FullDescriptions
0,Basis HANA Admin #1998~,"Issaquah, WA 98027",Issaquah,WA,98027,None Found,None Found,None Found,None Found,None Found,None Found,"Description of position

Costco Wholesale is currently seeking an SAP HANA Basis Administrator experienced in establishing and carrying out implementations of SAP and related policies and procedures in support of large SAP implementations. The SAP HANA Basis Administrator is responsible for the installation, configuration and maintenance of the Basis component of SAP systems and will assist in the planning, designing, and architecting of SAP systems across a variety of platforms and database. Individuals should be capable of working independently or in teams and have the ability to effectively gain insight and develop solutions to meet their business needs. The SAP Administrator installs support packs, conducts upgrades, backups/recovery, system refresh and troubleshooting as well as administers databases, conducts failover of production systems, and monitors and ensures performance of SAP systems. The candidate is responsible for administration of SAP HANA system integration within an SAP Landscape. Role covers HANA Security, HANA SLT Configuration, Suite on HANA and BW on HANA Migrations, HANA System Monitoring, HANA Install & Config, Health Check, and Monitoring.


Tasks and responsibilities
Performs the administration and operation of the SAP HANA systems and associated components and 3rd party tools
Collaborates with Technical SAP Project leads and team members on design and build of the SAP eco-system and infrastructure
Serves as technical support for medium to complex problem resolution. Provide technical expertise for resolving escalated system issues. Participate in crisis meetings as necessary
Ensures adherence to regulatory and compliance requirements within SAP System design and implementation
Automates administrative and operational functions. Provide training and direction to operational teams
Maintains technical knowledge of SAP system components and architecture
Resolves incidents affecting the operation/availability of global systems, through troubleshooting and implementing known fixes
Provides technical upgrades as well as functional and technical enhancements. Troubleshooting and resolution of application and system errors
Evaluates, installs, configures, and deploys SAP applications, systems software, products, and/or enhancements to existing applications throughout the enterprise
Collaborates with analysts, architects, and system owners in the testing of SAP software programs and applications
Installs and configures patches and Support pack upgrades to SAP systems as required
Assists in other areas of the department and company as necessary


Required skills, abilities, and certifications

7+ Years SAP Basis Administration with two or more of the following SAP products

CRM, ECC, TREX, CAR, BW4HANA, Portals, HANA Side Car


Knowledge and experience in Suite on HANA
Knowledge and experience with evaluating, install, configure and deploy SAP applications
Knowledge and experience with SAP upgrades including Support Packs and Enhancement Packs
Knowledge and experience with Red Hat Linux and SUSE Operating System
Knowledge and experience with SAP Performance tuning
Technically fluent in SQL
Ability to write Bash Shell
Must have excellent analytical and problem solving skills
Ability to adjust priorities in rapidly changing environments; work well under pressure
Excellent verbal and written communication skills, ability to present complex ideas and designs to a variety of technical or non-technical stakeholders
Attention to detail, multi-tasking and prioritization skills are required
Work and collaborate with other technology groups to support the SAP landscape
Exemplary troubleshooting and ability to drive root cause analysis on incidents and problems
Ability to provide effective onsite and remote support and troubleshooting 24X7
Strong written and verbal communication skills


Recommended skills, abilities, and certifications

SAP HANA Certification
Knowledge of SAP Solution Manager 7.2
Deep technical knowledge of the relevant part(s) of the SAP infrastructure and Linux operating environment
Successful internal candidates will have spent one year or more on their current team"
1,"Mgr, Software Quality & Proj Mgmt","Seattle, WA 98102",Seattle,WA,98102,None Found,None Found,None Found,None Found,None Found,None Found,"What you'll be doing...
-----------------------

Do you have a passion for making a visible difference in your work? Is it your mission to fully understand the impact you and your expertise provide to your clients? Are you excited by challenges that present new opportunities? Do you long for quality, value-driven work, an amazing team environment, while maintaining true work-life balance? We are looking for a manager for our Quality Control Group (QCG) that sees these questions and is positive that it describes their interests and strengths.

Our Quality Control Group Manager is responsible for the delivery of all NWA software development projects, database queries, and system support, as well as the management of the Software Testing, Application Support, Business Analysis and Project Management teams.


Serve as the expert in managing small and large scale IT projects
Implement and train best practices in the software development process
Assess project and departmental needs and communicate them to all stakeholders
Proactively gather requirements and ensure timely delivery throughout the project lifecycle
Manage the quality testing to ensure product/enhancement completion and readiness
Partner with the director of software development to optimize the development process
Manage the results and actions of the team (training, payroll, performance management, etc.)

Who you are...
--------------


Educated. BA degree in computer science (preferred)
Experienced. Min 7 years' experience in system design, application development, tech selection
Leadership. Demonstrated experience leading, developing, and motivating teams
Communication. Excellent interpersonal and communication skills, verbal and written
Organized. Strong skills and attention to detail in a fast-paced environment

Who we are...
-------------

Northwest Administrators, Inc. is an industry leader in third-party administration of employee benefits. We administer one of the largest multi-employer pension plans in the country, along with numerous large health and welfare plans. As part of our team, you will benefit from many training and development opportunities and can expect a better-than-market benefits package.

If hired, you can expect...
---------------------------


Collaborative team environment
Medical, dental and vision, and Rx
401(k) with company contribution and match
Paid sick, vacation, and holiday
Work-life balance
Great location on east Lake Union

Equal Employment Opportunity
----------------------------

It is the policy of NWA to ensure equal employment opportunity without discrimination or harassment on the basis of race, color, religion, sex, sexual orientation, gender identity or expression, age, disability, marital status, citizenship, genetic information or any other characteristic protected by law. NWA prohibits any such discrimination or harassment."
2,Business Administrator (Part-Time),"Seattle, WA 98101",Seattle,WA,98101,None Found,None Found,None Found,"
You will handle the monthly billing process for our team and manage hourly employee time sheet approvals
Gather and report on monthly critical metric data in addition to general reporting support
You will be regularly working in Salesforce.com and Intacct helping with data entry and integrity
We'll rely on you for support with Statement of Work (SOW) drafting and tracking and client extension management in Salesforce.com
You'll be a key partner in fiscal year close/open financial processes
You will maintain process documentation and training on tools and processes
To help the team you'll recommend process improvements where applicable
",None Found,"
5 years of experience as a bookkeeper, business administrator, human resource coordinator, operations assistant or similar role OR a Bachelors degree in Business Administration; Human Resources, Marketing; Accounting; or Finance
Attention to detail is one of your professional superpowers
Intermediate to Advanced skills in Microsoft Office (Outlook, Word, Excel, PowerPoint) or equivalent classes before starting
Ability to work in a fast-paced and sometimes ambiguous environment with diplomacy and enthusiasm
Technically-minded with a track record of learning and using new systems and tools quickly
Whimsical sense of humor and interest in creating a genuine and inclusive work environment
Passion for diversity, equity, and inclusion and willingness to network and learn in this space
","Description:
Projectline, a leader in modern resourcing and consulting, is hiring for a part-time business administrator. In this dynamic roll, you will spend about 50% of your time on HR related activities and 50% on financial and business process activities. Are you a stickler for details and love making sure things are just right? Do you want to contribute to business process improvements? If so, this is your ideal job! Youll get to work with a very tight-knit management team and you will work out of our Seattle headquarters in the Smith Tower.

Key Responsibilities:
Financial Coordination (about 10 hours/week)


You will handle the monthly billing process for our team and manage hourly employee time sheet approvals
Gather and report on monthly critical metric data in addition to general reporting support
You will be regularly working in Salesforce.com and Intacct helping with data entry and integrity
We'll rely on you for support with Statement of Work (SOW) drafting and tracking and client extension management in Salesforce.com
You'll be a key partner in fiscal year close/open financial processes
You will maintain process documentation and training on tools and processes
To help the team you'll recommend process improvements where applicable

Human Resource Coordination (about 10 hours/week)


You will own our consultant roster database management and data integrity
You will oversee the monthly employee community call logistics (agenda, scheduling, invites, slides) and drive our Employee reward program
Coordinate new hire hand off from recruiting coordinator and manage onboarding scheduling process for new hires
Coordinate monthly training webinar logistical coordination
You'll enjoy planning (and participating in) remote and in person morale events

Requirements:

5 years of experience as a bookkeeper, business administrator, human resource coordinator, operations assistant or similar role OR a Bachelors degree in Business Administration; Human Resources, Marketing; Accounting; or Finance
Attention to detail is one of your professional superpowers
Intermediate to Advanced skills in Microsoft Office (Outlook, Word, Excel, PowerPoint) or equivalent classes before starting
Ability to work in a fast-paced and sometimes ambiguous environment with diplomacy and enthusiasm
Technically-minded with a track record of learning and using new systems and tools quickly
Whimsical sense of humor and interest in creating a genuine and inclusive work environment
Passion for diversity, equity, and inclusion and willingness to network and learn in this space

Nice to have


Experience with Salesforce.com, Intacct, Applicant Tracking Systems (ATSs), DocuSign, Microsoft Teams, Microsoft SharePoint, a huge plus
Interest in networking, writing, speaking, and being a visible part of the business community
Background in internal communications

Equal Employment Opportunity Policy

Projectline provides equal employment opportunities (EEO) to all employees and applicants for employment without regard to race, color, religion, sex, national origin, age, disability or genetics.

About Projectline Services:
Projectline Services, a division of Yesler Inc., delivers on-demand consulting and resourcing services around the world from our offices in Seattle, Philadelphia, Toronto, Portland, and beyond. Our consultants offer deep expertise in marketing, program management, sales support, and operations.

Projectline has been recognized as an outstanding place to work. The awards keep coming in: We were named one of the 100 Best Companies to Work For by Seattle Business Magazine, included in the Inc 5000 list for five years in a row, and have won a place on the Seattle Met magazine list of Best Places to Work twice. If you are looking for a place where you can grow your consulting career with a list of blue-chip clients, contact us.

Our mission is to positively impact the people we work with, the people we work for, and the communities we live in. We support our mission by providing an inclusive environment where all are empowered to share their diverse perspectives and experiences so we can ultimately be better together. Our policies, practices, programs, activities and decisions regarding employment, hiring, assignment, promotion, compensation, volunteerism, internships are not based on a persons race, color, sex, age, religion, national origin, mental or physical disability, ancestry, military discharge status, sexual orientation, gender identity or expression, marital status, source of income, parental status, housing status, or other protected status. We strongly urge women, people of color, veterans, individuals with disabilities, and members of the LGBTQ community to apply.

Follow us on Twitter: https://twitter.com/projectline and Instagram: http://www.instagram.com/projectline"
