,Title,Location,City,State,Zip,Country,Qualifications,Skills,Responsibilities,Education,Requirement,FullDescriptions
37,Machine Learning Engineer,"Redmond, WA",Redmond,WA,None Found,None Found,None Found,None Found,None Found,None Found,None Found,"Are you passionate about machine learning and its impact on business and technology? Are you a prolific software engineer wanting to expand your skills and experience in data science? Do you want to apply your skills to real world challenges? Are you excited about learning new technologies, tools, and languages? We are looking for leading engineers capable of leveraging machine learning and other techniques to architect and implement state-of-the-art solutions for innovative problems.
We are looking for top engineers who want to apply what they have learned in their Masters or PhD programs and their hands-on engineering, to tackle challenging problems and, who have the passion and capacity to quickly learn new skills.
Our challenges span cloud, embedded, application development, and IoT. If you want to dive deeper into Machine Learning, are a strong communicator and collaborator, have solid engineering fundamentals, and are an innovator, we should talk.
Basic Qualifications:
BS in computer science (with Machine Learning focus)
3+ years experience in software development
Strong algorithm development experience
Skills with Java, Python, R or similar programming language
Predictive maintenance experience
Preferred Qualifications
Numeric and Visual Anomaly detection experience
Experience training a deep neural network
Masters or PhD in computer science (with Machine Learning focus)
+5 years of relevant experience in industry and/or academia
hands-on experience in predictive modeling and analysis
Please send your resume and information to jobs@redcleypartners.net."
38,Sr. Machine Learning Engineer,"Seattle, WA 98101",Seattle,WA,98101,None Found,None Found,None Found,None Found,None Found,None Found,"Does working collaboratively with a product and engineering team to create and productionalize machine learning models that, when implemented into our industry-leading software platform, deliver new and incredible value to our customers seem exciting? Do you know how to optimize ML algorithms and work with a data analyst to create data sets and reports that can help customers make informed, successful business decisions? Are you ready to bring a consultative, data focused approach to an emerging, sought-after technology product and help influence the success of the product, business and a new market?
If taking ownership of new machine learning initiatives across the lntegris product offering sounds like the challenge you'd like to tackle next, please send us your resume.
What you can expect to do:
Solve challenging problems for a new market, at scale
Work closely with the product team to create clear requirements that allow you to develop machine learning applications that get implemented into the product line
Run machine learning tests and experiments in production
Take responsibility for ensuring that machine learning code, models and pipelines are deployed successfully into production, and troubleshooting issues that arise
Design solution architectures for our application that would use machine learning models
Automate model training and testing via machine learning continuous delivery pipelines
Work with a data analyst to design and implement metrics to verify model and algorithm effectiveness
What you bring to the table:
The ability to write clean code using Java, Python, and SQL
Strong understanding of data structures, data modeling and software architecture
Deep knowledge of algorithms is a must; knowledge of math, probability and statistics is a bonus
Prior experience working with large data sets – we're talking petabytes per customer
Experience working in a startup environment where things change quickly
Ability to work with structured and un-structured data
Knowledge of mining complex data, identifying patterns and feature engineering
Stellar communication skills: whether speaking or writing, you've got communication nailed
Strong attention to detail: we're moving fast, and details matter for our customers
A great attitude: we collaborate like crazy, and you will build relationships at all levels of the organization
An appreciation for our values so you can model the way:
Humility: We check our egos at the door and celebrate our diversity, individuality, right to privacy and the contributions of all
Excellence: We strive to do our best in intent and action, and commit this excellence to each other
Accountability: We dream, crave feedback, take ownership, and are accountable in an effort to continuously improve as a collective
Resourcefulness: We are resourceful, we persevere through any challenge, are tenacious, and results driven
Transparency: We are transparent in our interactions and communication with each other
A degree in Computer Science, Mathematics or Statistics: it's highly preferred, but relevant work and industry experience is most important
What we put on the table:
The opportunity to take on timely, interesting and challenging problems that matter to everyone;
A solid funding story that includes backing from Madrona Venture Group, Aspect Ventures, Workday Ventures, and Amplify Partners;
A successful and collaborative leadership team committed to leading by example with integrity;
An innovative, dynamic culture that enables our people to do trail blazing work, and have a bunch of fun while doing it
The opportunity to learn, grow and develop your professional skill set;
Competitive compensation packages that include equity ownership, 401K, healthcare, a transportation stipend and a variety of other benefits
Who we are:
Integris Software, headquartered in downtown Seattle and founded in 2016, is a Data Privacy Automation vendor. Data has become the single most important asset for many organizations, and enterprises need a defendable and scalable data privacy solution that can adapt to a constantly evolving data landscape. The Integris industry-leading solution suite continuously monitors sensitive data that enables a defensible compliance strategy for enterprises and allows businesses to have confidence that their customers are protected.
We celebrate our inclusive culture, and welcome diversity in age, race, gender, gender identity, religion, and ethnicity to help keep our innovation and learning spirit alive.
aD17D7ougS"
39,Machine Learning Engineer(s),"Seattle, WA 98115",Seattle,WA,98115,None Found,"
Master's degree/PhD in computer science or related field",None Found,"Work with data scientists to take proof-of-concept models and implement them in production systems
Design systems that work at scale and successfully handle customer load
Develop software to help extract data and create features around it
Contribute to the team with software best practices—this is especially important given the fast pace nature of the work",None Found,None Found,"Machine Learning Engineer

About the Role…
Logic20/20 is seeking a Machine Learning Engineers who will be part of a team that leads the way in bringing artificial intelligence and machine learning into the very processes and systems that impact how customers are served. This is an exciting opportunity to make an impact with a Fortune 500 telecommunications company by leveraging AI and ML techniques to create production level systems through application of machine learning models.

The team you will be a part of is the first AI team within the company, leading the way in both researching new methods and deploying production-grade products.
Core Responsibilities
Work with data scientists to take proof-of-concept models and implement them in production systems
Design systems that work at scale and successfully handle customer load
Develop software to help extract data and create features around it
Contribute to the team with software best practices—this is especially important given the fast pace nature of the work
About You:
You’re passionate about finding solutions to deep technical problems
You have knowledge of professional enterprise software development and practices including software lifecycle, best coding practices, version control, architecture, testing and deployment
You have experience in prototyping machine learning models on data from multiple data sources with many distinct attributes
You have experience in taking proof-of-concept machine learning models and figuring out how to deploy them into production
You have familiarity with popular machine learning libraries and frameworks (tensorflow, keras, etc.)
You are proficient at either R or Python, and comfortable with object-oriented and programming languages (particularly Java)
Should have worked in data modeling, applying machine learning algorithms based on the business problem
Qualifications:
Master's degree/PhD in computer science or related field
About Us…
Logic20/20 is one of Seattle’s fastest growing full-service consulting firms. Our core competency is creating simplicity and efficiency in complex solutions. Although we make it look like magic, we succeed by combining methodical and structured approaches with our substantial experience to design elegant solutions for even the most intricate challenges. Our rapid growth is in response to our ability to deliver consistently for our clients, which is directly related to the quality of the people we hire.
The past four years, we’ve been in the top 10 “Best Companies to Work For”. Our team members are highly self-motivated, comfortable conceiving strategies on the fly, and enjoy working both individually and as part of a team. Our environment is very high-energy and demanding, and individuals with remarkable enthusiasm and a can-do attitude are joining our team. We have lots of fun, focus on our employees and our clients, and work to bring our best to every opportunity.
Compensation & Benefits
We offer competitive compensation, medical, dental, vision and basic life insurance. One of the most important benefits is the opportunity to work in an incredibly exciting and rapidly growing firm. The best part is that we are a group of highly dedicated and competent professionals that deliver results and have fun along the way."
40,Machine Learning Engineer,"Seattle, WA",Seattle,WA,None Found,None Found,None Found,None Found,None Found,None Found,None Found,"At ActZero, our mission is simple: Stop cyber threats, protect the world.
We are developing the most effective, hyper-scale managed security service powered by AI, while building a rewarding and values-driven environment for our team.
As a Machine Learning Engineer for ActZero on our Data Platform team, your job is to build a scalable platform to integrate, sanitize, store and productize our massive store of customer security data. Your platform will handle well over tens-of-billions of events per day. You will partner with our Data Scientists and Data Engineers to use this data to intelligently identify, detect and respond to known and future security threats events. The output of your ML algorithms will keep our customers more secure than ever before, while minimizing the cost of doing so.
We're a team of talented engineers and security professionals. Our team has led cybersecurity at the White House, led NVIDIA's cloud platform, built Akamai's security practice, and launched ML at WatchGuard.
While we're a small and rapidly growing team, we have the stability and funding of a series B company. We believe in doing challenging and rewarding work while also enjoying work-life balance, great benefits, a stable work environment, and building a culture led by our values (https://www.keyvalues.com/actzero).
You will …
Build robust and scalable data and ML services, and deploy and manage them in the cloud
Develop data set processes for data modeling, mining and production
Create automation to rapidly and reliably release our models to production
Improve model reliability, efficiency and quality
We'd like to speak with you if you have ...
A proven track record of success building cloud-based, highly-automated, near real time data processing platforms
An innovative and passionate spirit, an ability to overcome technical issues in a cooperative environment, a commitment to ship quickly, and familiarity with agile software development practices
Solid knowledge of Computer Science fundamentals (object-oriented design, data structures and algorithm design, problem solving, and complexity analysis)
The ability to deal with ambiguity, to communicate well with partner teams, and to turn empathy for the customer into a delightful user experience.
Expertise programming with Python
Experience with both SQL and NoSQL databases
Familiarity with ML algorithms and techniques
About ActZero
ActZero is building the most effective, hyperscale AI-powered MSSP that will give users better protection, faster, and with more precision, at a fraction of the cost of traditional approaches. We foster a culture centered upon our customers and rooted in mutual trust and committed to execution, where we continuously learn and improve, like the AI systems we develop. Founded in 2019, ActZero is backed by Point72 Ventures, a global venture capital firm led by a diverse set of domain experts with the capital to lead rounds through all stages of company growth.
ActZero celebrates diversity and is committed to creating an inclusive workplace. We are an Equal Opportunity Employer and consider, develop and retain candidates without regards to race, color, national origin, sex, age, religion, sexual orientation, gender identity, veteran status, marital status, physical or mental disability, or other protected classes under all local, state, and federal laws and ordinances."
41,Sr. Machine Learning Engineer - Home Timeline,"Seattle, WA",Seattle,WA,None Found,None Found,None Found,None Found,None Found,None Found,"
B.S., M.S. or Ph.D. in Computer Science or equivalent degree and 5+ years of work experience.","Twitter's Consumer Product Teams are responsible for core features of twitter.com, which includes Timelines, Tweets, Search, Trends, Recommendations, Notifications, Tweet details/permalink, and more! Our code operates at massive scale and speed, serving billions of requests per day, connecting hundreds of millions of active Twitter users to real-time information about their lives and the world we live in.

Who We Are:

At Twitter, our mission is to instantly connect users to the information most meaningful to them. Realizing this involves work in areas such as machine learning, applied data science, recommendation systems, information retrieval systems, natural language processing, large graph analysis, spam, etc.

The team’s mission is to show users the content they care about. We build relevance and machine learning models and systems to power the core of the Twitter product. Every time users see new tweets we evaluate candidates from the nearly half a billion daily tweets to select, organize and deliver the best timeline. The recent products and technologies built by our team have shown consistent results in driving retention and are some of largest contributors of engagements on the platform.

What You'll Do:

Although you will work on cutting-edge problems, this position is not a research position. You will participate in the engineering life-cycle at Twitter, including designing distributed systems, writing production code, conducting code reviews and working alongside our infrastructure and reliability teams. You’ll apply data science, machine learning and/or graph analysis techniques to a variety of modeling and relevance problems involving users, their relationships, their tweets and their interests.

Who You Are:

You’re a relevance engineer, applied data scientist or machine-learning engineer who wants to work on exciting algorithmic and deep infrastructure issues. You’re experienced solving large scale relevance problems and comfortable doing incremental quality work while building brand new systems to enable future quality improvements.

Knowledgeable in one or more of the following: machine learning, information retrieval, recommendation systems, social network analysis
Designed and evaluated approaches for handling high-volume real-time data streams.
A strong technical advocate with a background in Java, C++, or Scala, and Python.
Comfortable conducting design and code reviews.
Experienced in operating Linux-based systems.
Knowledgeable of core CS concepts such as: common data structures and algorithms, profiling/optimization.
Passionate about working with large unstructured and structured data sets ( for example multi-terabyte+, 100MM+ daily transaction volumes).
Experienced in collaborating across multiple teams including analytics, product management, and operations.
Requirements:

B.S., M.S. or Ph.D. in Computer Science or equivalent degree and 5+ years of work experience.
We are committed to an inclusive and diverse Twitter. Twitter is an equal opportunity employer. We do not discriminate based on race, color, ethnicity, ancestry, national origin, religion, sex, gender, gender identity, gender expression, sexual orientation, age, disability, veteran status, genetic information, marital status or any legally protected status."
42,Machine Learning Engineer,"Renton, WA 98057",Renton,WA,98057,None Found,None Found,None Found,None Found,None Found,None Found,"Company Information
PACCAR is a Fortune 500 company established in 1905. PACCAR Inc is recognized as a global leader in the commercial vehicle, financial, and customer service fields with internationally recognized brands such as Kenworth, Peterbilt, and DAF trucks. PACCAR is a global technology leader in the design, manufacture and customer support of premium light-, medium- and heavy-duty trucks under the Kenworth, Peterbilt and DAF nameplates and also provides customized financial services, information technology and truck parts related to its principal business.
Whether you want to design the transportation technology of tomorrow, support the staff functions of a dynamic, international leader, or build our excellent products and services, you can develop the career you desire with PACCAR. Get started!
Division Information
PACCAR’s Information Technology Division (ITD), located in Renton, WA utilizes cutting-edge technology to provide systems development, consulting, voice and data communications services to the entire Corporation, which has high visibility in the technology sector.
Requisition Summary
Build the future of Data Science as part of the Advanced Analytics Center of Excellence (CoE). The CoE is a unique team within PACCAR, focusing on solving PACCAR’s most important challenges using Data and Advanced Analytics. As part of a diversified global Fortune 200 company, the CoE works on a huge variety of projects; from predictive analytics models to support our financial services divisions, to prescriptive analytics to support PACCAR’s sales efforts, and data mining projects to identify the drivers of warranty claims. As part of PACCAR’s leading Analytics team, you will work on high-impact and high-visibility projects, helping to shape not only PACCAR’s current business, but it’s long term strategy.
This role will work with a team of Data Scientists to develop and productionize analytics solutions. This requires the use of sophisticated distributed systems, the development of high-availability APIs, and the application of statistical techniques. As part of your job, you will handle large amounts of training data, rapidly prototype new cloud architectures, perform testing and push solutions into production. Must have strong problem-solving abilities, be able to work both at high and low levels of detail, have excellent communication skills.
Job Functions / Responsibilities
Develop scalable, efficient, automated processes for large scale data analyses, model development, validation and, implementation
Introduce improvements to increase the speed, accuracy and efficiency of Advanced Analytics across the organization
Work closely with data scientists and engineering teams to create and deploy new features
Advocate for quality coding. Write secure, stable, testable, maintainable code with minimal defects
Maintain code and scripting version control repositories and serve as a technical resource for merge requests, assisting others in writing scripts, and answering questions about use of the infrastructure
Work with System Engineers, Developers, Architects, and other DevOps engineers to integrate Analytics solutions to existing and new applications
Work with other technical teams to create system and workflow information visible through monitoring systems and web-based dashboards
Maintain and improve configuration management platform keeping up with the current technologies in the space
Implement processes and work with systems to deploy Analytics solutions to AWS development and production environments
Provide accurate time estimates for your scope of work, turn it into code, and deliver on schedule
Identify, troubleshoot, and resolve problems with the build, deployment, and continuous integration process
Document build, continuous integration and deployment processes
Leverage scripting languages to build automated solutions and integrations on an ad-hoc basis. Languages often include PowerShell, BASH, Perl, Ruby and Python across both Windows and Linux systems
Respond to System Performance and Security Events
Defend the System against Unsustainable or Unreliable Components
Compose Root Cause Analysis Reports
Ensures security is integrated into all architecture solutions to meet compliance standards
Contribute to and maintain system standards
Qualifications
Required Qualifications:
3+ years of AWS DevOps experience
Strong Python knowledge
Experience with Containerization (e.g. Docker, k8s, EKS), Big Data (e.g. EMR, Data Bricks) and other AWS Technologies (S3, EC2, lambda function, etc.)
A strong understanding of networking and security basics are mandatory.
Experience in building CI/CD pipelines using tools like Jenkins, Maven/Gradle
Experience with cloud resource provisioning tools like CloudFormtion, Terraform
Experience with machine learning techniques and technologies (Spark, Kafka, highly distributed and multi-sourced data pipelines, etc.) is preferred
Self-motivated, able to work independently as well as within a team, and work well to meet deadlines within short time constraints
Experience with automated testing, including unit, functional, and integration testing
Strong Written and Verbal Communication Skills, with a demonstrated ability to concisely and clearly communicate complex technical topics
Bachelor’s or master’s degree in CS or equivalent

Preferred Qualifications:
4+ years of software development experience
AWS DevOps Solution Architecture Associate certified is preferred
Demonstrable in-depth understanding of data structures and ETL processes (including SSIS)
Experience with structured and unstructured data, including relational databases (SQL Server), graph databases (Neo4J), NoSQL databases (MongoDB) and unstructured data
Experience with working with big data (Scala, Spark, Pig)
Experience with the operationalization and maintenance of analytics APIs using Plumber, Flask, Swagger and similar
Education
Bachelor’s degree Computer Science or related field required
Master's degree in Computer Science or related field preferred
Additional Job Board Information

PACCAR is an Equal Opportunity Employer/Protected Veteran/Disability."
