,Title,Location,City,State,Zip,Country,Qualifications,Skills,Responsibilities,Education,Requirement,FullDescriptions
12,Senior Engineer - Machine Learning,"Seattle, WA",Seattle,WA,None Found,None Found,None Found,None Found,None Found,None Found,None Found,"As a Senior Machine Learning Engineer you will be part of a key team of Nordstrom Technology professionals that applies scientific, mathematical and social principles to design, build, and maintain technology products, devices, systems and solutions. These technology products and solutions provide amazing customer experiences while meeting the needs of the business.
More Specifically you will will be part of the team building an Enterprise Grade Machine Learning Platform which enables Self Service Data Science by creating a collection of easy to use SDK’s, CLI’s, API’s and UI’s. Building on top of modern open source tech stacks and contributing the teams work back to open source for the benefit of others.
A day in the life…
Abstracting the Engineering from data science users by writing easy to use SDK’s, CLI’s, API’s and UI’s to enabke Data Science to perform tall the key capabilities in the Machine learning workflow, i.e. Machine Learning Feature Engineering, Model Training and Model Serving.
Building a Framework for data scientists to create ML Features, without having them to understand/learn the backend physical stores implementing the ML Feature Stores. This requires experience working with streaming applications, popular batch and online stores. Also enabling Feature store discoverability using easy to use UI’s.
Working on building/updating Authentication and Autherization Frameworks for ML Platform.
Working on Building/Enhancing a meta data engine to show end to end lineage for all ML Operations part of the framework.
Building/Enhancing SDK’s, CLI’s in Python and R.
Building/Enhancing ML frameworks for automated self service service Model Training capabilities while providing an enterprise grade model repository.
Building/Enhancing ML frameworks for automated self service serving of batch and online serving of ML Models.
Building/Enhancing ML frameworks to Ingest data from heterogeneous data sources.
Productionzing ML Pipelines for Data science and supporting them in Production.
Building Scalable Data Pipelines for generating training datasets for machine learning deliverables.
Mentor Junior engineers and drive end to end design, implementation and delivery of engineering components.
Collaborate with cross-functional teams – business stakeholders, engineers, program management, project management, etc. - to produce the best solutions possible.
Anticipate system/application challenges and proposes solutions for the same.
Contribute to story sizing and work estimates for implementation, validation, delivery and documentation
Review user stories to ensure a quality user experience, well-defined acceptance criteria and thorough test coverage.
Participate in design and code review to ensure quality and testability of feature code.
Implement test automation to validate new and existing code.
Adjust positively to quickly-changing priorities and shifting goals.
Willingness to work in a DevOps environment.
You own this if you have…
5-7 years of professional experience in practice area.
Proven high level of expertise in either of the programming languages Python, Java, Scala and related technology stacks.
Cloud Computing Experience (e.g AWS) is a plus.
Good Working knowledge of Apache Kafka is a plus.
Experience working with container management technologies such as Docker, Kubernetes is a plus.
Working knowledge of big data technologies such as Spark, Presto, DynamoDB and other relational data stores is a plus.
Prior Experience building/working with ML Platforms/Frameworks is a plus.
Proven proficiency in API development (REST) is a plus.
Agile software development experience.
Experience working in a metrics driven environment is a plus.
Strive for continuous improvement of code quality and development practices
Willingness to adapt to and self learn new technologies and deliver on them.
Building and maintaining solutions on highly available environments.
Working knowledge of CI/CD is a plus.
Working knowledge of telemetry solutions is a plus.
Technical expertise to build code that is performant as well as secure.
Technical depth and vision to perform POC’s and evaluate different technologies.
Translate business issues to technical terms.
Understand, leverage and applies best practices effectively. Also leads by example and comes up with coding standards and best practices for technology.
#LI-JH2
We’ve got you covered…
Our employees are our most important asset and that’s reflected in our benefits. Nordstrom is proud to offer a variety of benefits to support employees and their families, including:
Health
Retirement
Time Off
Merchandise Discount
Lifework / EAP resources
A few more important points...
The job posting highlights the most critical responsibilities and requirements of the job. It’s not all-inclusive. There may be additional duties, responsibilities and qualifications for this job.
Nordstrom will consider qualified applicants with criminal histories in a manner consistent with all legal requirements.
Applicants with disabilities who require assistance or accommodation should contact the nearest Nordstrom location, which can be identified at www.nordstrom.com .
By applying, you agree to our Nordstrom Careers Privacy Policy
© 2019 Nordstrom, Inc.
Current Nordstrom employees: To apply, log into Workday, click the Careers button and then click Find Jobs."
13,Amazon AI ML Engineer,"Seattle, WA",Seattle,WA,None Found,None Found,None Found,None Found,None Found,None Found,None Found,"Master’s Computer Science (or another quantitative field)3+ years of practical experienceAlgorithm and model development experience for large-scale applicationsExcellent programming skills (C/C++, python, Unix)Practical experience in AI, Machine Learning/Deep Learning

AWS Comprehend Medical is looking for a Machine Learning Engineer to join our
science team in the area of Speech and Natural Language Processing.
Our organization develops the science that drives the cloud-based AI
services of AWS Comprehend Medical. Our mission is to put the power of AI into the hands
of every developer. We seek to advance the state of the art in machine
learning to create services that delight our customers and meet
real-world business needs.

As a Machine Learning Engineer you will partner with talented
scientists and engineers to design, train, test, and deploy machine
learning models. You will contribute to innovative features, improve
our services based on customer requirements and help maintain a highly
scalable data and model management infrastructure that supports
cutting-edge research. You will be responsible for translating
business and engineering requirements into deliverables and software
products.

We are looking for candidates who thrive in an exciting,
fast-paced environment and who have a strong personal interest in
learning, researching, and creating new technologies with high
customer impact.

Prior domain knowledge in speech, natural language processing, or
computer vision is strongly preferred; solid knowledge of fundamentals
of statistics, machine learning, and deep learning is
required. Candidates should possess strong software engineering
skills and several years of industry experience.

BASIC QUALIFICATIONS
Master’s Computer Science (or another quantitative field)3+ years of practical experienceAlgorithm and model development experience for large-scale applicationsExcellent programming skills (C/C++, python, Unix)Practical experience in AI, Machine Learning/Deep Learning
PREFERRED QUALIFICATIONS
Prior experience in speech, natural language processing, computer vision or related areaFamiliarity with AWS infrastructureExperience with large-scale distributed systems or high-performance computing

Prior experience in speech, natural language processing, computer vision or related areaFamiliarity with AWS infrastructureExperience with large-scale distributed systems or high-performance computing
Amazon is an Equal Opportunity-Affirmative Action Employer – Minority / Female / Disability / Veteran / Gender Identity / Sexual Orientation"
14,"Senior Machine Learning Engineer, Rekognition","Seattle, WA",Seattle,WA,None Found,None Found,None Found,None Found,None Found,None Found,None Found,"4+ years of professional software development experience3+ years of programming experience with at least one modern language such as Java, C++, or C# including object-oriented design2+ years of experience contributing to the architecture and design (architecture, design patterns, reliability and scaling) of new and current systems

Have you ever wanted to work on state of the art computer vision and applied machine learning that will make a lasting impact on society?

We are looking for brilliant Machine Learning Senior Software Development Engineers who have the passion to tackle tough problems by bringing cutting edge deep learning technologies to customer facing computer vision products at Amazon Web Services (AWS)!

As a Machine Learning Senior Software Development Engineer on the Amazon Rekognition Team (https://aws.amazon.com/rekognition/) you will design and develop fast, efficient and highly scalable deep learning algorithms that are applied to challenging deep learning-based image and video recognition problems.

In 'Rekognition' we offer a service that makes it easy to add image and video analysis to applications. Rekognition APIs enables you to quickly add sophisticated visual search, image classification, face recognition and much more to your applications.

You'll work with senior scientists and engineers within Amazon AI and develop high quality software that is robust and reliable.

Software Engineers at Amazon do so much more than just software development.
We'll be looking at you to help:
Decide what features to build and performance improvements.Drive software engineering best practice.Design distributed and scalable systems.Provide technical leadership and contribute to the definition, development, integration, test, documentation, and support of Java and Python software.Instill best practices for software development and documentation, making sure designs meet requirements, and delivering high quality software on tight schedules.

Master’s degree in Computer Science or related field with 4+ years of relevant experience.Experience providing technical leadership for a team.Experience with machine learning, deep learning, data mining, and/or statistical analysis tools.Experience taking projects from scoping requirements through V1 launch and V2 iterations.Knowledge of professional software engineering practices and best practices for the full software development life cycle, including coding standards, code reviews, source control management, build processes, testing, and operations.Experience with highly distributed systems.Experience designing high performance software and algorithms for resource constrained environments.Proficiency training large scale models in, at least, one modern deep learning engine such as MXNet, Tensorflow, Caffe/Caffe2, Keras, PyTorch/Torch and Theano.Experience in GPU, FPGA, DSP acceleration and performance tuning.Experience in production-scale software development with ML/DL/AI and computer vision
Amazon is an Equal Opportunity-Affirmative Action Employer – Minority / Female / Disability / Veteran / Gender Identity / Sexual Orientation"
15,Pricipal Machine Learning Engineer,"Seattle, WA",Seattle,WA,None Found,None Found,None Found,None Found,None Found,None Found,None Found,"About The Team

Data is at the core of Outreach's strategy. It drives our customers and ourselves to the highest levels of success. We use it for everything from customer health scores and revenue dashboards, to operational metrics of our AWS infrastructure, to helping increase product engagement and user productivity through automated natural language understanding, to predictive analytics and causal inference via experimentation. As our customer base continues to grow, we are looking towards new ways of leveraging our data to save our customers time and improve their sales efficiency.

Key goal of the Data Science team is to transform how sales reps operate by enabling personalized guided selling. This requires a scalable cost-efficient data and ML infrastructure. As a member of the team, you will be on the ground floor, working directly with the VP of Data Science to define and implement our strategy for delivering on this vision. You will be responsible for improving and scaling our data, ML, and experimentation infrastructure, delivering models and data-driven functionality, automating ML pipelines. You will serve as tech lead owning the outcomes of projects and initiatives, working with junior team members, collaborating with other engineering teams, and providing technical guidance.
Our Vision of You
You have 10+ years of experience working with distributed data processing frameworks such as Spark. Experiences with Spark’s Mlib, AWS, Databricks, MLFlow are a plus.
You understand the entire lifecycle of machine learning product development, from inception to production
You have substantial experience with deploying and running ML models in real products.
You have substantial coding experience. Experience with Python and its ML packages such as scikit-learn is a plus
You are hands on, able to quickly pick up new tools and languages, and excited about building things and experimenting
You are experienced at mentoring junior team members and go above and beyond to help your team.
You are honest, admit mistakes, and own fixing them
You are a motivated and talented craftsperson: always looking to sharpen and adapt your skills
You have a MS or PhD degree in Computer Science or a related field, or equivalent industry experience

Why You’ll Love It Here
100% medical, dental, and vision coverage for full-time employeesUnlimited PTO (and people actually use it!)401k to help you save for the futureCompany-organized and personal paid volunteer days to support the community that supports usFun company and team outings because we play just as hard as we workDiversity and inclusion programs that promote employee resource groups like OWN (Outreach Women's Network)A parental leave program that includes not just extended time off but options for a paid night nurse, food delivery, gradual return to work, and the Gottman Institute's Bringing Home Baby course for new parentsEmployee referral bonuses to encourage the addition of great new people to the teamPlus, unlimited snacks and beverages in our kitchen"
16,"Machine Learning Engineer, Consumer Analytics AI","Seattle, WA 98101",Seattle,WA,98101,None Found,None Found,None Found,None Found,None Found,None Found,"About the team
The Consumer Analytics AI Team is at the center of Zillow’s effort to craft the future of real estate. We build capabilities that use Machine Learning, AI Advertising/Marketing techniques, and advanced data science to attract new customers to our marketplace, nurture our customers through the home buying and selling experience, engage customers with the home recommendations, updates, and product features and share related offerings from Zillow Group brands that are most likely to help.

We are always looking to explore or invent the best approach to solve every challenge, whether it is a best-practices implementation of a well-known approach to inventing novel solutions from scratch and advancing the state-of-the-art.
About the role
We are looking for a Machine Learning Engineer to build massive scale production services. If you have an interest in contextual / multi-armed bandits and reinforcement learning, and want to want to build a V1 product within a rapidly growing team we want to talk to you!
You will:
Employ contextual bandits and other online experimentation capabilities to dynamically improve customer experience and engagement at massive scale
Develop bidding and budget pacing algorithms to optimize our access to the best customer prospects
Implement time series and other prediction methods to segment and predict consumer behavior, providing insight into our customers and helping them find their ways home
Deliver advanced measurement of successful consumer impact using marketing science methodologies
Work closely with applied scientists and other machine learning and software engineers to productionalize models at 100M+ users scale
Collaborate using iterative agile processes with a focus on delivering production-ready, testable, and value producing code in small iterations
You will participate in the full development lifecycle, from concept to testing to release and monitoring
Who you are
You have 2+ years software development experience with highly scalable systems involving machine learning and analytics
You have experience researching and implementing state of the art machine learning methods
You are passionate about working across organizational boundaries including with teams of engineers, MLEs, applied/data scientists, marketing and analytics
You are interested in building a V1 product within a rapidly growing team
You have proven expertise with data analysis languages such as Python, Scala, or R
You want to learn more about Spark and Hadoop
You've built applications with Amazon AWS services (specifically S3, EMR, RDS and EC2)
You're comfortable working with modern source control tools (Git, Hg, SVN)
You are interested in contextual / multi-armed bandits and reinforcement learning
You have a degree (BS+) in a Computer Science or related discipline
Get to know us
Zillow Group houses the largest portfolio of real estate brands on mobile and the web. We are on a mission to rewire the real estate transaction and are building transformational tools and services that make it easier for everyone to find and get into a home they love. We are working to create an on-demand real estate transaction experience for every stage of the home lifecycle - for buyers, sellers, renters and borrowers - and we're well on our way. No matter what job you're in, you will play a critical role in making this vision a reality for millions of people.
At Zillow Group, we're powered by our inclusive work culture, where everyone has the support and resources to do the best work of their careers. Our efforts to streamline the real estate transaction is supported by our passion to empower people and enrich lives around everything home, a deep-rooted culture of innovation, a fundamental commitment to Equity and Belonging, and world-class benefits. But, don't just take our word for it. Read our reviews on Glassdoor and recent recognition from multiple organizations, including: Fortune 100 Best Companies to Work For (#69), Fortune Best Workplaces for Diversity (#38), Fortune Best Workplaces for Parents (#31), Fortune Best Workplaces for Women (#20), Fatherly's Best Workplaces for New Dads (#37), JUST Capital 100 Company (#69), Bloomberg Gender Equality Index constituent.
Zillow Group is an equal opportunity employer committed to fostering an inclusive, innovative environment with the best employees. Therefore, we provide employment opportunities without regard to age, race, color, ancestry, national origin, religion, disability, sex, gender identity or expression, sexual orientation, or any other protected status in accordance with applicable law. If there are preparations we can make to help ensure you have a comfortable and positive interview experience, please let us know."
17,Machine Learning Engineer,"Seattle, WA",Seattle,WA,None Found,None Found,"
Demonstrated ability to connect business purpose to data-driven analysis.
Experience working with Python (dataframes, scikit-learn), SQL, Spark.
Experience working with Machine Learning Algorithms (Linear, Logistic, Decision Trees, Random Forests, Support Vector Machines, Neural Networks, KNN, etc)
Proficient in handling unstructured/structured data, including analyzing and troubleshooting complex data for quality and integrity.
Experience with building and maintaining large scale data processing pipelines using technologies like Kafka, Hadoop, or Spark.
Bachelor’s degree in Computer Science, Maths or related field, or equivalent practical experience.","
Demonstrated ability to connect business purpose to data-driven analysis.
Experience working with Python (dataframes, scikit-learn), SQL, Spark.
Experience working with Machine Learning Algorithms (Linear, Logistic, Decision Trees, Random Forests, Support Vector Machines, Neural Networks, KNN, etc)
Proficient in handling unstructured/structured data, including analyzing and troubleshooting complex data for quality and integrity.
Experience with building and maintaining large scale data processing pipelines using technologies like Kafka, Hadoop, or Spark.
Bachelor’s degree in Computer Science, Maths or related field, or equivalent practical experience.",None Found,None Found,None Found,"Company Introduction

Wicket Labs is focused on delivering actionable insights to media companies that are facing a shifting audience, in an arena where the consumer has to be the focus and data is the differentiator. We’re talking about the evolution of the television market towards new devices, services and consumption models. Our goal is to help traditional and new media business leaders succeed in this environment with better data, and more predictive insights.

We are a venture-backed software company located in the heart of Pioneer Square in Seattle. We are part of a great, vibrant technology and art community in an area with a rich cultural heritage.

We strongly believe in the value of diversity, equity, and inclusion and aim to reflect that belief in the team that we build. We hope you will consider joining us.

Job Description

Join a small team building a big impact product. We’re looking for a Data Engineer to help us design and implement software that turns large volumes of raw data into attractive and actionable business insights. You’ll have the opportunity to build the first versions of our data processing architecture.

Technologies We’re Using

We are building analytical platforms using open source big data tools and technologies. Our data pipeline leverages technologies like Presto, Spark, Python, SQL and S3 using AWS cloud services.

What You’ll Do

Interface with business customers, gathering requirements and developing new datasets.
Extracting and combining data from various heterogeneous data sources
Modelling data and metadata to support ad-hoc and pre-built reporting
Designing, implementing and supporting a platform that can provide ad-hoc access to large datasets as well as a 'hands-off' automated pipeline
Work on a highly collaborative agile team with skilled teammates
Champion test standards and best practices for data pipelines
Collaborate across business teams
Listen and communicate ideas effectively with respectful and responsive interactions
Adopt a team player approach by doing what needs done and cheering each other on
Skills and Qualifications

Demonstrated ability to connect business purpose to data-driven analysis.
Experience working with Python (dataframes, scikit-learn), SQL, Spark.
Experience working with Machine Learning Algorithms (Linear, Logistic, Decision Trees, Random Forests, Support Vector Machines, Neural Networks, KNN, etc)
Proficient in handling unstructured/structured data, including analyzing and troubleshooting complex data for quality and integrity.
Experience with building and maintaining large scale data processing pipelines using technologies like Kafka, Hadoop, or Spark.
Bachelor’s degree in Computer Science, Maths or related field, or equivalent practical experience."
