,Title,Location,City,State,Zip,Country,Qualifications,Skills,Responsibilities,Education,Requirement,FullDescriptions
25,"Machine Learning Engineer, Rekognition","Seattle, WA",Seattle,WA,None Found,None Found,None Found,None Found,None Found,None Found,None Found,"3+ years of non-internship professional software development experienceProgramming experience with at least one modern language such as Java, C++, or C# including object-oriented design1+ years of experience contributing to the architecture and design (architecture, design patterns, reliability and scaling) of new and current systems.

Have you ever wanted to work on state of the art computer vision and applied machine learning that will make a lasting impact on society?

We are looking for brilliant Machine Learning Software Dev Engineers who have the passion to tackle tough problems by bringing cutting edge deep learning technologies to customer facing computer vision products at Amazon Web Services (AWS)!

As a Machine Learning Software Dev Engineer on the Amazon Rekognition Team (https://aws.amazon.com/rekognition/) you will design and develop fast, efficient and highly scalable deep learning algorithms that are applied to challenging deep learning-based image and video recognition problems.

In 'Rekognition' we offer a service that makes it easy to add image and video analysis to applications. Rekognition APIs enables you to quickly add sophisticated visual search, image classification, face recognition and much more to your applications.

You'll work with senior scientists and engineers within Amazon AI and develop high quality software that is robust and reliable.

Software Engineers at Amazon do so much more than just software development.
We'll be looking at you to help:
Decide what features to build and performance improvements.Drive software engineering best practice.Design distributed and scalable systems.Provide technical leadership and contribute to the definition, development, integration, test, documentation, and support of Java and Python software.Instill best practices for software development and documentation, making sure designs meet requirements, and delivering high quality software on tight schedules.

Master’s degree in Computer Science or related field with 2+ years of relevant experience.

Experience with machine learning, deep learning, data mining, and/or statistical analysis tools.

Experience taking projects from scoping requirements through V1 launch and V2 iterations.

Knowledge of professional software engineering practices and best practices for the full software development life cycle, including coding standards, code reviews, source control management, build processes, testing, and operations.

Experience with highly distributed systems.

Experience designing high performance software and algorithms for resource constrained IoT and mobile environments.

Proficiency training large scale models in, at least, one modern deep learning engine such as MXNet, Tensorflow, Caffe/Caffe2, Keras, PyTorch/Torch and Theano.

Experience in GPU, FPGA, DSP acceleration and performance tuning.

Experience in production-scale software development with MLDL//AI and computer vision.

Amazon is an Equal Opportunity-Affirmative Action Employer – Minority / Female / Disability / Veteran / Gender Identity / Sexual Orientation"
26,"Senior Machine Learning Engineer, AI Personalization","Seattle, WA 98101",Seattle,WA,98101,None Found,None Found,None Found,None Found,None Found,None Found,"About the team
The mission of the Zillow AI division is to create unique content and features powered by sophisticated analytics and machine learning technologies atop our unparalleled living database of all homes and hundreds of millions of customers.

We're a fast-moving, developer-driven organization full of brilliant and ambitious people. Zillow product development is highly decentralized in order to create the small team speed and autonomy of a start-up environment while backed by big company resources.

We are responsible for building distributed, big data, machine-learning applications in the cloud. These consumer-facing products power Zillow’s industry-leading online marketplace and puts the team and this role at the core of Zillow’s mission to empower the consumer.

Learn more about what we are doing at https://www.zillow.com/data-science.
About the role
The Zillow AI Personalization team is hiring a Senior Machine Learning Engineer to build intelligent systems that help our customers find a home, driven by machine learning, recommendation, and other forms of automated personalization. Personalization is a critical part of making Zillow the largest, most-trusted, and vibrant home-related market in the world. You will:
Design and code highly scalable, machine learning for real time prediction, streaming and batch processing.
Provide technical leadership to a strong team of applied scientists, machine learning engineers and software engineers.
Follow agile processes with a focus on delivering production-ready testable code in small iterations.
Familiar with coding and optimizing machine learning and deep learning algorithms.
Establish best practices in the team to be adopted by applied scientists and engineers
Who you are
4+ years professional software development experience with solid engineering and coding skills.
Familiarity with key machine learning concepts, models, and evaluation methodologies.
Experience with distributed computing frameworks, such as Hadoop or Spark.
Experience with a Cloud Computing Platform, such as AWS, Azure, or Google Cloud.
Experience in designing and productionizing large-scale systems built around machine learned models and big data.
Ability to produce scalable and robust production-quality code incorporating testing, evaluation, and monitoring.
An advanced degree (MS) in a Computer Science or related discipline or the equivalent technical depth.
Get to know us
Zillow Group houses the largest portfolio of real estate brands on mobile and the web. We are on a mission to rewire the real estate transaction and are building transformational tools and services that make it easier for everyone to find and get into a home they love. We are working to create an on-demand real estate transaction experience for every stage of the home lifecycle - for buyers, sellers, renters and borrowers - and we're well on our way. No matter what job you're in, you will play a critical role in making this vision a reality for millions of people.
At Zillow Group, we're powered by our inclusive work culture, where everyone has the support and resources to do the best work of their careers. Our efforts to streamline the real estate transaction is supported by our passion to empower people and enrich lives around everything home, a deep-rooted culture of innovation, a fundamental commitment to Equity and Belonging, and world-class benefits. But, don't just take our word for it. Read our reviews on Glassdoor and recent recognition from multiple organizations, including: Fortune 100 Best Companies to Work For (#69), Fortune Best Workplaces for Diversity (#38), Fortune Best Workplaces for Parents (#31), Fortune Best Workplaces for Women (#20), Fatherly's Best Workplaces for New Dads (#37), JUST Capital 100 Company (#69), Bloomberg Gender Equality Index constituent.
Zillow Group is an equal opportunity employer committed to fostering an inclusive, innovative environment with the best employees. Therefore, we provide employment opportunities without regard to age, race, color, ancestry, national origin, religion, disability, sex, gender identity or expression, sexual orientation, or any other protected status in accordance with applicable law. If there are preparations we can make to help ensure you have a comfortable and positive interview experience, please let us know."
27,Machine Learning Engineer,"Seattle, WA 98101",Seattle,WA,98101,None Found,"
3+ years of experience in designing, developing, deploying and monitoring deep learning solutions, specifically in the context of computer vision and natural language understanding.
Experienced Python programmer, especially in the context of established deep learning frameworks.
Bachelor's degree in computer science, data science, applied mathematics, or an equally computational field
",None Found,"
Building and deploying predictive solutions with established tools and packages
Feature extraction and data preparation
Algorithm development and evaluation
",None Found,None Found,"Engineering & Tech Ops | Seattle, Washington

Our agreement with employees
DocuSign is committed to building trust and making the world more agree-able for our employees, customers and the communities in which we live and work. You can count on us to listen, be honest, and try our best to do what's right, every day. At DocuSign, everything is equal. We each have a responsibility to ensure every team member has an equal opportunity to succeed, to be heard, to exchange ideas openly, to build lasting relationships, and to do the work of their life. Best of all, you will be able to feel deep pride in the work you do, because your contribution helps us make the world better than we found it. And for that, you'll be loved by us, our customers, and the world in which we live.

The team
Our Agreement Intelligence team builds and operates a use-case agnostic Deep Learning platform that extends throughout the DocuSign Agreement Cloud. Our AI solutions will impact millions of people and businesses every day. We also maintain the highest possible standards around customer data security and service availability. As such, we hire people who are excited about working on a groundbreaking and technically challenging AI vision that will be one of DocuSign's key investments over the next 5 years.

This position
DocuSign is looking for a passionate, talented, and inventive machine learning engineer to help build industry-leading state of the art machine learning solutions. You will be leveraging data mining, deep learning, content understanding, image processing and more. You will integrate and deploy machine learning models that deliver more personalized and automated customer experiences.

This position is an Individual Contributor role and reports to an Engineering Lead.

Responsibilities:

Building and deploying predictive solutions with established tools and packages
Feature extraction and data preparation
Algorithm development and evaluation

Basic Qualifications:

3+ years of experience in designing, developing, deploying and monitoring deep learning solutions, specifically in the context of computer vision and natural language understanding.
Experienced Python programmer, especially in the context of established deep learning frameworks.
Bachelor's degree in computer science, data science, applied mathematics, or an equally computational field

Preferred Qualifications:

Experience with containerization and orchestration of machine learning models in production.
Masters or PhD in computer science, data science, machine learning, applied mathematics, or an equally computational field.
Familiarity with programming in TensorFlow or Keras.
Demonstrated experience with text-based deep learning (NLP, NLU).
Demonstrated experience in extracting, cleansing, and manipulating large, diverse unstructured datasets.
Strong desire to stay ahead of industry trends & technologies with a commitment to continuous research and learning.

About us
DocuSign® helps organizations connect and automate how they prepare, sign, act on, and manage agreements. As part of the DocuSign Agreement Cloud, DocuSign offers eSignature: the world's #1 way to sign electronically on practically any device, from almost anywhere, at any time. Today, hundreds of thousands of customers and hundreds of millions of users in over 180 countries use DocuSign to accelerate the process of doing business and simplify people's lives. Plus, we save more trees together! And that's a good thing.

DocuSign is an Equal Opportunity Employer. DocuSign is committed to building a diverse team of talented individuals who bring different perspectives to the discussion and who feel a sense of inclusion and belonging when they join our team. Individuals seeking employment at DocuSign are considered without regards to race, ethnicity, color, age, sex, religion, national origin, ancestry, pregnancy, sexual orientation, gender identity, gender expression, genetic information, physical or mental disability, registered domestic partner status, caregiver status, marital status, veteran or military status, citizenship status, or any other legally protected category.

#LI-DS1"
28,Machine Learning Engineer,"Bellevue, WA",Bellevue,WA,None Found,None Found,"
PhD or MS in computer science, engineering, mathematics/statistics or related field and 2-3 years or work experience as an ML engineer/data scientist
Excellent understanding of computer science fundamentals, data structures, and algorithms. Strong programming skills (one or more of Python, Java, Scala, etc.).
Expertise in specialized areas such as Optimization, NLP, Reinforcement Learning, Probabilistic Inference, Machine Learning, Information Retrieval, Recommendation Systems.
Proven experience with large data sets and related technologies, e.g., Hadoop and Spark. Knowledge of SQL and NoSQL is required.
Expert level experience in at least one of the ML learning software (tensor flow, sklearn, etc.) is required.
Good communication skills, ability to work with large cross-functional teams of technical and non-technical members.",None Found,"
PhD or MS in computer science, engineering, mathematics/statistics or related field and 2-3 years or work experience as an ML engineer/data scientist
Excellent understanding of computer science fundamentals, data structures, and algorithms. Strong programming skills (one or more of Python, Java, Scala, etc.).
Expertise in specialized areas such as Optimization, NLP, Reinforcement Learning, Probabilistic Inference, Machine Learning, Information Retrieval, Recommendation Systems.
Proven experience with large data sets and related technologies, e.g., Hadoop and Spark. Knowledge of SQL and NoSQL is required.
Expert level experience in at least one of the ML learning software (tensor flow, sklearn, etc.) is required.
Good communication skills, ability to work with large cross-functional teams of technical and non-technical members.",None Found,None Found,"Do you want to have a huge impact on the largest eCommerce website? Are you interested in solving cutting edge research problems while impacting all eBay advertising channels? Does working with Big Data, cloud computing, large-scale optimization, probabilistic inference, and machine learning excite you? If you answered yes, the Marketing Science team at eBay is the right place for you. We are looking for rockstar Data Scientists to join our team.
You will be directly responsible for improving eBay's algorithms that drive customer traffic via external marketing channels. You will work on cutting-edge ML/optimization algorithms against one of the biggest datasets in the world. You’ll work with world-class data scientists and engineers. You’ll solve problems that have a direct impact on a multi-billion dollar business. Bring your ideas, energy, and dedication to reach and engage the next 100M eBay users.
We are developing state-of-the-art bidding and optimization strategies that have a direct impact on eBay's users as well as the company's bottom line. You will be expected to research state-of-the-art machine learning, optimization, natural language processing, text mining, and other techniques, and apply them to eBay's marketing platforms. You will roll your solutions to production, analyze results offline and online, and measure site impact.
Responsibilities
Aggregate huge amount of data and information from large numbers of sources to discover patterns and features necessary to build machine learning models that match eBay’s inventory with customers’ demand via Marketing channels. Design and implement end-to-end solutions using Machine Learning, Optimization, and other advanced computer science technologies, and own live deployments to drive customer traffic to eBay.
Qualifications
PhD or MS in computer science, engineering, mathematics/statistics or related field and 2-3 years or work experience as an ML engineer/data scientist
Excellent understanding of computer science fundamentals, data structures, and algorithms. Strong programming skills (one or more of Python, Java, Scala, etc.).
Expertise in specialized areas such as Optimization, NLP, Reinforcement Learning, Probabilistic Inference, Machine Learning, Information Retrieval, Recommendation Systems.
Proven experience with large data sets and related technologies, e.g., Hadoop and Spark. Knowledge of SQL and NoSQL is required.
Expert level experience in at least one of the ML learning software (tensor flow, sklearn, etc.) is required.
Good communication skills, ability to work with large cross-functional teams of technical and non-technical members.
This website uses cookies to enhance your experience. By continuing to browse the site, you agree to our use of cookies
View our privacy policy
View our accessibility info
eBay Inc. is an equal opportunity employer. All qualified applicants will receive consideration for employment without regard to race, color, religion, national origin, sex, sexual orientation, gender identity, veteran status, and disability, or other legally protected status. If you are unable to submit an application because of incompatible assistive technology or a disability, please contact us at talent@ebay.com. We will make every effort to respond to your request for disability assistance as soon as possible.
For more information see:
EEO is the Law Poster
EEO is the Law Poster Supplement"
29,Machine Learning Engineer,"Seattle, WA",Seattle,WA,None Found,None Found,None Found,None Found,None Found,None Found,None Found,"About The Team

Data is at the core of Outreach's strategy. It drives our customers and ourselves to the highest levels of success. We use it for everything from customer health scores and revenue dashboards, to operational metrics of our AWS infrastructure, to helping increase product engagement and user productivity through automated natural language understanding, to predictive analytics and causal inference via experimentation. As our customer base continues to grow, we are looking towards new ways of leveraging our data to save our customers time and improve their sales efficiency.

Key goal of the Data Science team is to transform how sales reps operate by enabling personalized guided selling. This requires a scalable cost-efficient data and ML infrastructure. As a member of the team, you will be on the ground floor, working directly with the VP of Data Science to define and implement our strategy for delivering on this vision. You will be responsible for improving and scaling our data, ML, and experimentation infrastructure, delivering models and data-driven functionality, automating ML pipelines.
Our Vision of You
You have significant experience working with distributed data processing frameworks such as Spark. Experiences with Spark’s Mlib, AWS, Databricks, MLFlow are a plus.
You understand the entire lifecycle of machine learning product development, from inception to production
You have experience with deploying and running ML models in real products.
You have substantial coding experience. Experience with Python and its ML packages such as scikit-learn is a plus
You are hands on, able to quickly pick up new tools and languages, and excited about building things and experimenting
You go above and beyond to help your team
You are honest, admit mistakes, and own fixing them
You are a motivated and talented craftsperson: always looking to sharpen and adapt your skills
You have a MS or PhD degree in Computer Science or a related field, or equivalent industry experience

Why You’ll Love It Here
100% medical, dental, and vision coverage for full-time employeesUnlimited PTO (and people actually use it!)401k to help you save for the futureCompany-organized and personal paid volunteer days to support the community that supports usFun company and team outings because we play just as hard as we workDiversity and inclusion programs that promote employee resource groups like OWN (Outreach Women's Network)A parental leave program that includes not just extended time off but options for a paid night nurse, food delivery, gradual return to work, and the Gottman Institute's Bringing Home Baby course for new parentsEmployee referral bonuses to encourage the addition of great new people to the teamPlus, unlimited snacks and beverages in our kitchen"
30,Principal Machine Learning Engineer - Conversational AI,"Seattle, WA 98101",Seattle,WA,98101,None Found,None Found,None Found,None Found,None Found,None Found,"About the team
The Conversational Assistants AI team, part of the overall Artificial Intelligence team, is responsible for the science and platforms that power automated conversational intelligent agents across Zillow Group websites and mobile apps. The intelligent bots converse with 200 million unique users per month supporting apartment tours, questions and answers for landlords, rental leases, and other natural language conversations for real-estate specific scenarios.
About the role
The Principal Machine Learning Engineer will design and build the next-generation intelligent agents that will power automated natural language conversations in real-estate. You will:
Participate in the technical direction for conversation assistants at Zillow Group
Build machine learning models and systems in natural language processing (NLP), natural language understanding (NLU), semantic understanding, and intent classification
Build real-time low-latency machine learning platforms
Be hands-on in technical feature development, design and code-reviews, prototyping
Enable applied scientists to iterate quickly and deploy NLP and NLU machine learning models into production
Who you are
Proven track record of successfully architecting and building highly available, low latency systems for high traffic applications
7+ years of experience as a software engineer
2+ years of experience building conversational intelligent agents
Strong knowledge of machine learning, NLP, and NLU
Familiarity with conversational bot integrations with Google Assistant, Alexa, and Siri
Bachelor's/Master's degree preferred
Get to know us
At Zillow Group, we're powered by our inclusive work culture, where everyone has the support and resources to do the best work of their careers. Our efforts to streamline the real estate transaction is supported by our passion to empower people and enrich lives around everything home, a deep-rooted culture of innovation, a fundamental commitment to Equity and Belonging, and world-class benefits. But, don't just take our word for it. Read our reviews on Glassdoor and recent recognition from multiple organizations, including: Fortune 100 Best Companies to Work For (#69), Fortune Best Workplaces for Diversity (#38), Fortune Best Workplaces for Parents (#31), Fortune Best Workplaces for Women (#20), Fatherly's Best Workplaces for New Dads (#37), JUST Capital 100 Company (#69), Bloomberg Gender Equality Index constituent.
Zillow Group is an equal opportunity employer committed to fostering an inclusive, innovative environment with the best employees. Therefore, we provide employment opportunities without regard to age, race, color, ancestry, national origin, religion, disability, sex, gender identity or expression, sexual orientation, or any other protected status in accordance with applicable law. If there are preparations we can make to help ensure you have a comfortable and positive interview experience, please let us know."
